1307,1442066936222,0,1,1,0,off-topic,0,129,1472,That Surf Dog special they did on sportscenter just pulled on your heart strings...
1308,1442066936223,0,1,1,0,off-topic,1,145,1473,@oddfab @GuernseyPark Hugh speaks the truth! He's awesome and just wowed the crowd at @IgniteOKC !!
1309,1442066936223,0,1,1,0,off-topic,0,161,1474,@Beckah_Great don't even ask me how that happened tho. I can't tell you. I legit thought I had happy, not Jason lol
1310,1442066936224,0,0,1,0,off-topic,1,155,1475,Everyone is having fun tonight enjoying Memorial Day tomorrow! And I'm like....bed time. Work in the morning.
1311,1442066936401,0,0,1,0,off-topic,177,162,1476,I don't dress like us. @ashlynnk34: Niggas in Oklahoma style is so wack lol I'm glad my man doesn't dress like y'all
1312,1442066936401,0,0,1,0,off-topic,0,72,1477,My stomach is gettin tight
1313,1442066936402,0,0,1,0,off-topic,1,154,1478,Don't worry guys I still know all the words to all the songs from High School Musical 1-3.#WhatTeam#WILDCATS
1314,1442066936402,0,0,1,0,off-topic,0,163,1479,@Real_Scorpios: A good relationship can make #Scorpio stronger. A bad relationship can make them wiser for next time.
1315,1442066936402,0,0,1,0,off-topic,0,94,1480,@Grind3Times_ alright she's taking you up here ?
1316,1442066936402,0,0,1,0,off-topic,0,97,1481,Remix is Melvin the Dude Cross Eyed Kisses is heat!
1317,1442066936402,0,1,1,0,off-topic,0,121,1482,Omg:  the attitudes &lt;&lt;&lt;&lt;&lt; I just wanna make him happppy -__-
1318,1442066936403,0,0,1,0,off-topic,1,115,1483,Omg. he's totally making me blush haha and he's a cutie.. it's a plus
1319,1442066936403,0,1,1,0,off-topic,0,109,1484,@cassafrass11 haha I just kept hitting refresh starting at 9:58
1320,1442066936403,0,0,1,0,off-topic,0,103,1485,@LiyahhBiaa11 lol I'm not eating sandwich that you making
1321,1442066936404,0,0,1,0,off-topic,1,100,1486,Wanna talk about my dick but that shit is a long story
1322,1442066936404,0,0,1,0,off-topic,0,147,1487,Welcome to the family!!!!! @IWashington: I love the colors green and yellow... http://t.co/L3QL5jZE5z
1323,1442066936588,0,0,1,0,off-topic,184,91,1488,@SwavorSwav Why ??? I Can't RT Nth You Say !!
1324,1442066936588,0,0,1,0,off-topic,0,110,1489,@finkenstein_: @ChelseaNcates ew. Cows are delightful like you .
1325,1442066936588,0,0,1,0,off-topic,0,69,1490,I'm loving this seat yo
1326,1442066936589,0,0,1,0,off-topic,1,96,1491,LMAOOO THE BEST DRAKE PIC!! http://t.co/GeJnzbXUFV
1327,1442066936589,0,0,1,0,off-topic,0,120,1492,Theirs nothing worse than a Texas fan who was born and raised in Oklahoma.
1328,1442066936589,0,0,1,0,off-topic,0,146,1371,Whenever someone says, It's getting hot in here I automatically think, So take off all your clothes.
1329,1442066936589,0,0,1,0,off-topic,0,99,1372,@D_McCoy_Era @victoriademar you know what I meant!!!!
1330,1442066936590,0,0,1,0,off-topic,1,146,1373,On I -35 trying to get home.  Standstill.  Truck loaded with plastic sheeting, bags, gloves, buckets
1331,1442066936590,0,1,1,0,off-topic,0,85,1375,@plmueller14 you already know I am boo!
1332,1442066936590,0,1,1,0,off-topic,0,104,1376,@Brittanie_Renae: The school bell just rang.they always do
1333,1442066936590,0,0,1,0,off-topic,0,131,1378,Welllllll, good thing I have a best friend who will let me stay with him for awhile..
1334,1442066936591,0,0,1,0,off-topic,1,93,1379,Wish My Bestfriend Wouldn't Have Canceled On Me
1335,1442066936591,0,0,1,0,off-topic,0,82,1380,Neva realized how funny boss'n up is
1336,1442066936780,0,1,1,0,off-topic,189,78,1381,17 more minutes left till summer
1337,1442066936781,0,0,1,0,off-topic,1,86,1382,I got you Ry his ears are legit no doubt
1338,1442066936781,0,0,1,0,off-topic,0,144,1383,RT @koconews: Facebook page for the McClain County Animal Response Team:   http://t.co/nrZ5QZtuUe.
1339,1442066936781,0,1,1,0,off-topic,0,140,1384,I don't feel like being right here now I just want to go away from myselfBut I don't know how.
1340,1442066936781,0,0,1,0,off-topic,0,111,1385,@DustinKnight24: Shout out to @_meaganunruh_ for the follow!  Mhm
1341,1442066936781,0,0,1,0,off-topic,0,120,1386,I'm having friend withdraws. I feel like I haven't seen anyone in so long.
1342,1442066936782,0,1,1,0,off-topic,1,170,1387,And on my way back so we could go home.. we got stuck.. im just glad it was my car and not my best friends life @GarnandKyla
1343,1442066936782,0,0,1,0,off-topic,0,74,1388,Way too hot to run. Dying :(
1344,1442066936782,0,1,1,0,off-topic,0,97,1389,If you don't shut up your gonna get an ass whoopin!
1345,1442066936782,0,0,1,0,off-topic,0,73,1390,I keep shaking. I'm so cold
1346,1442066936783,0,0,1,0,off-topic,1,90,1391,@GordonRamsay  make that up sate NY then lol
1347,1442066936783,0,1,1,0,off-topic,0,176,1392,Jared makes me so mad sometimes.. but other times when I'm by myself and I start to think, I remember why I fell in love with him.
1348,1442066936783,0,0,1,0,off-topic,0,109,1393,@Maria_Frye_TGL I thought they were leggings. So I was like ew.
1349,1442066936963,0,1,1,0,off-topic,180,128,1394,Omg I am going to throw up... And that is going to hurt my tummy worse. #ihatethis
1350,1442066936964,0,0,1,0,off-topic,1,137,1345,Im still sick, im getting Vietnamese soup, pho. (@ Lee's Sandwiches) http://t.co/13F8p1Lr8B
1351,1442066936964,0,1,1,0,off-topic,0,68,1346,i just want too sleep.
1352,1442066936964,0,0,1,0,off-topic,0,128,1347,Vacation weeks go fast af&lt;&lt;&lt;&lt;   Work weeks slow af&lt;&lt;&lt;&lt;&lt;
1353,1442066936964,0,0,1,0,off-topic,0,70,1348,Collin needs to wake up.
1354,1442066936965,0,0,1,0,off-topic,1,79,1350,i can NEVER sleep in #thestruggle
1355,1442066936965,0,0,1,0,off-topic,0,73,1351,Its a zebrahead kinda night
1356,1442066936965,0,0,1,0,off-topic,0,99,1327,@ShortyS_10 yes you cant go wrong with that selection
1357,1442066936966,1,1,1,1,on-topic,1,181,1569,@jeffbrown763 @tritonbassman70 I'm in Midwest city just missed my work we good here except hail. Prayers goin out for the kids in Moore
1358,1442066936966,1,1,1,1,on-topic,0,84,1572,WATCH OUT CALE BIG TORNADO INCOMING!!!
1359,1442066936966,0,1,1,0,off-topic,0,172,1531,SB1127 [Update] Appropriations; State Department of Education budget limits. Effective date. Emergency. http://t.co/ho77CUAVPv
1360,1442066936966,1,1,1,1,on-topic,0,115,1536,when there's a tornado coming I text my mom :( http://t.co/60e8DSjtVB
1361,1442066936966,1,0,1,0,on-topic,0,177,1624,Our first truck is being unloaded this morning. Relief to the people of #Moore is here! #COHResponse #hopeis http://t.co/gWkIW0y2O6
1362,1442066937151,0,0,1,0,off-topic,185,190,1654,Two brothers &amp; 5 cousins....Mally, Jon, Kaden, Mary Caroline and McKinley had a blast tonight fishing, jumping equestrian, Xbox and burgers.
1363,1442066937151,1,0,1,0,on-topic,0,122,1655,Again?? Praying for protection for those in its path. http://t.co/a4GxwObUtc
1364,1442066937151,1,0,1,0,on-topic,0,180,1610,Thoughts and prayers to all the families involved. Thank you @koconews @kfor @NEWS9 and @NWSNorman. Would be a lot higher without you.
1365,1442066937151,0,0,1,0,off-topic,0,116,1618,Back safe and sound.  Praying for those affected by the Moore tornado!
1366,1442066937152,0,0,1,0,off-topic,1,101,1552,@AlyssaAllen13 no it's the fact twitter is dead tonight
1367,1442066937152,1,0,1,0,on-topic,0,186,1496,@stevelackmeyer unfortunately, Oklahoma City doesn't share that with Moore, although a number if OKC residents are in the Moore Schools dist
1368,1442066937152,1,0,1,0,on-topic,0,91,1498,Ready for tornado clean up tommorow #oklahoma
1369,1442066937152,1,0,1,0,on-topic,0,150,1523,@Simpsongirl1994 Hey it's okay! We have so many volunteers helping out!!! It's insane how awesome it is!
1370,1442066937153,0,0,1,0,off-topic,1,167,1622,I've got some issues that nobody can see &amp; all of these emotions pouring out for me I bring them to the light for you
1371,1442066937154,0,0,1,0,off-topic,1,153,1623,My phone is in 8%. I'll be back on at about 3:30 when this baseball game is over. Enjoy your break from me.
1372,1442066946005,0,0,1,0,off-topic,8851,96,1625,Everytime I drive somewhere I end up getting angry
1373,1442066946005,0,0,1,0,off-topic,0,117,1626,@KDTrey5 is a selfless person. That is such an amazing act of kindness.
1374,1442066946005,0,0,1,0,off-topic,0,99,1627,Can't wait to go back to school imma handle that shit
1375,1442066946006,0,0,1,0,off-topic,1,76,1628,Some Italian food for the soul
1376,1442066946006,1,1,1,1,on-topic,0,106,1629,This is all so heartbreaking. #prayformoore #prayforoklahoma
1377,1442066946007,0,0,1,0,off-topic,1,84,1630,And I hate asking my parents for money
1378,1442066946007,0,0,1,0,off-topic,0,121,1631,@LindsayVail27 love you!!! Saturday all you can drink mimosas, joinnnn me!!
1379,1442066946008,0,0,1,0,off-topic,1,89,1632,@Will_Carel No one ever said I was nice. :)
1380,1442066946008,0,0,1,0,off-topic,0,104,1633,Working out and gettin some shots up.. Good morning y'all.
1381,1442066946009,0,0,1,0,off-topic,1,68,1634,when my back won't pop
1382,1442066946009,0,1,1,0,off-topic,0,186,1635,Not gonna lie out of all the teaches I've had ill miss mr. Green the most. Hands down my favorite cosmetology teacher tough me alot of stuff
1383,1442066946009,0,0,1,0,off-topic,0,108,1636,@abbyabraham20 tell him to come by my house, in hungry to! lol
1384,1442066946010,0,1,1,0,off-topic,1,73,1637,On the south side now! #FWM
1385,1442066946010,0,0,1,0,off-topic,0,151,1638,Wish I had a relationship half as good as @cherokee_gibson &amp; @SavageNation012.Or even a relationship.
1386,1442066946010,0,0,1,0,off-topic,0,117,1639,@EsmeraldaJaquez @_1boxer lol yeah it's cause he's a little girl! -.-tt
1387,1442066946011,0,0,1,0,off-topic,1,124,1640,@DaeAndNight: I hateeeee being late to anything well be on time #problemsolved
1388,1442066946011,0,0,1,0,off-topic,0,165,1641,$PHOTOGRAPHERS NEEDED$ - #Norman , OK (http://t.co/siyuif5hVJ) Get Photography Jobs #Photography #jobs #job #GetAllJobs
1389,1442066946011,0,0,1,0,off-topic,0,121,1642,Ain't tweeted bout the heat game cause I'm too busy watching it #HeatNation
1390,1442066946011,0,0,1,0,off-topic,0,75,1643,no one go to school tomorrow.
1391,1442066946012,1,1,1,1,on-topic,1,98,1644,@Meezy1994: 16 minutes to save your life. That's it.
1392,1442066946012,0,0,1,0,off-topic,0,120,1645,Lets put the past beyond us, &amp; go far away were nobody could find us .
1393,1442066946013,0,0,1,0,off-topic,1,71,1646,If I Tell Her This ......
1394,1442066946013,0,0,1,0,off-topic,0,150,1647,Mine too. @_DougieFresh: Gotta get some ice packs for a home made ice tube. These hamstring are on fire!
1395,1442066946013,0,0,1,0,off-topic,0,139,1648,I will literally have zero motivation to anything school related for the next three months...
1396,1442066946013,0,1,0,0,off-topic,0,185,1649,HB1477 [Update] State government; powers and duties of the Director of the Office of Management and Enterprise Se... http://t.co/AJudJ11Zhh
1397,1442066946193,0,0,1,0,off-topic,180,129,1650,Every new day is another chance to be a better person than you were the day before.
1398,1442066946193,0,0,1,0,off-topic,0,97,1651,@pvs_imbackpv Yeah I know lol I don't even have 200
1399,1442066946193,0,0,1,0,off-topic,0,162,1652,Who me!? Why!? //@JoshKosh_B_Gosh @iTweetAndTwatch is the most aint shit nigga I know! He need to go back to Mexico!
1400,1442066946194,0,0,1,0,off-topic,1,76,1653,Chillin at work.... no power..
1401,1442066946194,0,0,1,0,off-topic,0,82,1656,I'm used to walking this road alone.
1402,1442066946195,0,0,1,0,off-topic,1,153,1657,@gabrielledoug: Scripture of the day: Don't worry about anything; instead, pray about everything.  Phil 4:6
1403,1442066946195,0,0,1,0,off-topic,0,99,1658,@jrafaelmartinez why didn't I think of that? Perfect!
1404,1442066946195,0,0,1,0,off-topic,0,135,1659,@Kortez_96 @OhDamnImRylee I think y'all both got it wrong she my girl she like white meat
1405,1442066946195,0,0,1,0,off-topic,0,126,1660,Zoey is super excited about wedding weekend! #DBWedding13 http://t.co/KIsGTTNMbT
1406,1442066946196,0,0,1,0,off-topic,1,97,1661,@soy_bonitax3 I do so my muscles shine in the light
1407,1442066946196,1,1,1,1,on-topic,0,185,1698,Peoples, quit delaying traffic to stare @ #oktornado damage. Lots of time to rudely gawk at the misfortune of others-gonna be there a while
1408,1442066946196,0,0,1,0,off-topic,0,181,1679,Barry is 18. Came from Alberta b/c of a teacher he saw i'viewed on @ac360. The one who sang to kids #tornadowalk http://t.co/BJHAnA3p14
1409,1442066946196,1,0,1,0,on-topic,0,177,1695,Awesome...@TheFoodDood: About 900 served at #OKChefsRelief today. No numbers yet on donations, but it will be substantial. #bemoore
1410,1442066946197,1,0,1,0,on-topic,1,176,1710,Walking through this field to get to a damaged neighborhood. You can see rubble on the horizon #tornadowalk http://t.co/y8IPA4XEOx
1411,1442066946197,0,1,1,0,off-topic,0,156,1667,@MariahAustin_: Wonder if @kushmarie_ knows I'm in here house?.....  Lolol I didn't even see this til now lmao
1412,1442066946197,0,0,0,0,off-topic,0,187,1668,BBLW Trucking Harrah, OK 25.00 discount off of multiple load orders (offercod http://t.co/f12HqODJuq Harrah Sand &amp; Gravel Dealers #coupon
1413,1442066946197,0,0,1,0,off-topic,0,87,1669,Seriously no one is answering their phone
1414,1442066946197,0,0,1,0,off-topic,0,81,1670,@TinLovesKD God Bless you too buddy
1415,1442066946198,0,0,1,0,off-topic,1,102,1671,@jessemontez_93 you down for the ranch tomorrow morning?
1416,1442066946198,0,0,1,0,off-topic,0,94,1672,Don't get caught in the sauce fuckin with a boss
1417,1442066946199,0,0,1,0,off-topic,1,137,1673,Has me wondering ARE YOU TRYIN TO BE FUNNY?! Lol, cause trust me, I'm laughing at yo ass!!!
1418,1442066946199,0,1,1,0,off-topic,0,144,1674,@Aye_shortstuff: @ChapmanCanida: Choclate milk sounds really good right nowWith cookies? Fuck yes.
1419,1442066946381,0,1,1,0,off-topic,182,153,1675,Ever since the day you went away and left me lonely &amp; cold my life just hasn't been the same oh baby no
1420,1442066946381,0,0,1,0,off-topic,0,102,1676,You stole 10 months away from me. You said you loved me.
1421,1442066946381,0,0,1,0,off-topic,0,92,1677,@McMillionairee that's what Rick James said :)
1422,1442066946381,0,1,1,0,off-topic,0,94,1678,I still can't believe what happened Friday night
1423,1442066946382,0,0,1,0,off-topic,1,117,1680,Yeah maybe @kylemparker shouldn't hash tag more than twice in one tweet
1424,1442066946382,0,0,1,0,off-topic,0,186,1681,@mtvexit. This gentleman has asked a pointed question of how to get in on world policy discussions @hariesbd 2 stop human trafficking. Help?
1425,1442066946382,0,0,1,0,off-topic,0,100,1682,Why do certain people act like I care what they think?
1426,1442066946383,0,0,1,0,off-topic,1,89,1683,@Maryh_Est_91 any word on your spot or nah?
1427,1442066946383,0,0,1,0,off-topic,0,96,1684,My relationship is none of your business. #fuckoff
1428,1442066946383,0,1,1,0,off-topic,0,131,1685,Me, @BryseJustin_ , @_shyannemeyer ,And @jackieramos_  Finished Our Test!!  We Cold!!
1429,1442066946383,0,0,1,0,off-topic,0,141,1686,Wind 1 mph NE. Barometer 29.79 in, Steady. Temperature 64.8 F. Rain today 0.00 in. Humidity 89%
1430,1442066946384,0,0,1,0,off-topic,1,87,1687,you noe you love it when this beat is on.
1431,1442066946384,0,0,1,0,off-topic,0,117,1688,@Here3Luv88 That they are. Me not so happy. Run me in the ground...lol.
1432,1442066946384,0,1,1,0,off-topic,0,75,1689,Going to be an uncle #excited
1433,1442066946385,0,0,1,0,off-topic,1,149,1690,@Dymu_Loyalty: @Oops_Sowy I wish I wad Kool enough to be your friend lol why you gotta be good enough ?
1434,1442066946385,0,0,1,0,off-topic,0,97,1691,@logan_lambert I can't today! When are you leaving?
1435,1442066946386,0,1,1,0,off-topic,1,129,1692,@okcgood - thanks for responding! go anytime or sometime specific? or go right now?
1436,1442066946386,0,1,1,0,off-topic,0,121,1693,@minsooey thanks babygirl. Once I start I'm sure I'll find the right words.
1437,1442066946386,0,0,1,0,off-topic,0,96,1694,When we stare into each other eyes&gt;&gt;&gt;&gt;
1438,1442066946387,0,0,1,0,off-topic,1,175,1696,Black men protested with a sign around their necks saying I am a man. I guess MJ needed such a sign during his meetings with AEG.
1439,1442066946387,0,1,1,0,off-topic,0,90,1697,But i have a feeling its never gonna happen.
1440,1442066946387,0,1,1,0,off-topic,0,117,1699,I'm just gonna keep a smile on my face n move on http://t.co/m8QrbNL2dx
1441,1442066946388,0,0,1,0,off-topic,1,176,1700,I wore this in high school. It's double knit. No, I wasn't fashionable. Can't wear it today, it's a memento http://t.co/LeB8tLHtTk
1442,1442066946388,0,0,1,0,off-topic,0,82,1701,Had a nice talk with my boyfriend (:
1443,1442066946388,0,0,1,0,off-topic,0,151,1702,@FunnyJokeBook: People who post the Don't delete my Instagram picture should get their Instagram deleted.
1444,1442066946566,0,0,1,0,off-topic,178,184,1703,My wife thing she is special because she has bewbs and 1300+ followers. Honey you have 1300+ followers cause you have bewbs! @zanne1111973
1445,1442066946566,0,1,1,0,off-topic,0,185,1704,SB820 [Update] Courts and judges of the district courts; modifying certain electoral districts. Effective dates. ... http://t.co/NvVgca66J2
1446,1442066946566,0,0,1,0,off-topic,0,112,1705,This could also be another example as to why no one likes elmore..
1447,1442066946567,0,1,1,0,off-topic,1,89,1706,I just hope paradise is treating you right!
1448,1442066946567,0,1,1,0,off-topic,0,184,1707,I like all colors, just not messican color@SkatePhantom: Do yall start to like white boys after niggas broke ya hearts or liked em growing
1449,1442066946567,0,0,1,0,off-topic,0,111,1708,Good luck to my favorite boys, @TLCroslin and @NateTCross today!!
1450,1442066946568,0,0,1,0,off-topic,1,97,1709,it's summer, and i don't even want to stay up late.
1451,1442066946568,0,1,1,0,off-topic,0,93,1711,@FrenchieBSM all over my TL right now!!! #Loved
1452,1442066946569,0,0,1,0,off-topic,1,88,1712,Linda's little do fav know I will not come
1453,1442066946569,0,0,1,0,off-topic,0,107,1713,It's ok for humans to eat acorns, right? What? I was curious!
1454,1442066946570,0,0,1,0,off-topic,1,100,1714,Dear Stupid Allergies, I Hate You!! Feel Like Crap! :(
1455,1442066946570,0,0,1,0,off-topic,0,135,1715,Happy 21st Birthday Emmalie!! I love you girl! Can't wait for tonight:) #notwitterEmmalie
1456,1442066946570,0,0,1,0,off-topic,0,68,1716,She is my best buddy .
1457,1442066946575,0,1,1,0,off-topic,5,185,1749,SB629 [Update] Public health and safety; relating to the Nursing Facilities Quality of Care Fee; Oklahoma Departm... http://t.co/JCBfCFNnVT
1458,1442066946576,1,0,1,0,on-topic,1,149,1723,@Duracell #PowerForward relief team is amazing! Thank you so much for the batteries!!! #moore #oklahoma
1459,1442066946576,1,0,1,0,on-topic,0,186,1751,If u still want 2 help clean up n moore w/ @ServeMooreOK Is not turning away ne volunteers @ all Website is http://t.co/R5hsRzvLh0 4 address
1460,1442066946576,0,0,1,0,off-topic,0,110,1719,Put ya number twos in the air if you did it on emmm #shittedonem
1461,1442066946576,0,0,1,0,off-topic,0,127,1720,07:56PM UTC Tor&lt;-Spotr 1 miles S of MOORE, OK-Stovepipe 6-8 W of my location..
1462,1442066946577,0,0,1,0,off-topic,1,130,1721,@maddisenm is thig of all thugs for thowing another party .... Noooo ignorant people
1463,1442066946577,0,0,1,0,off-topic,0,109,1722,@SMichaelReeves Yes, we had a glitch in the system on that day.
1464,1442066946577,0,0,1,0,off-topic,0,98,1724,How was i caking on the phone? Idek how you do that!
1465,1442066946578,0,0,1,0,off-topic,1,65,1725,Oomf is mad I think
1466,1442066946578,0,0,1,0,off-topic,0,155,1726,Planning on my 10k tweet tomorrow night. If you want in it favorite this and tell me why you should be in it.
1467,1442066946579,0,0,1,0,off-topic,1,135,1727,Yea. It's been exhausting. @ Darwin Motorcycles World Headquarters http://t.co/zJhyahObaD
1468,1442066946579,1,0,1,0,on-topic,0,140,1728,Definite eye opener after volunteering in Moore. Very grateful for everything I've been given!
1469,1442066946579,0,0,1,0,off-topic,0,145,1729,@_FiletMignon_: Won't waste negative emotions on people who aren't even worth recognition. This tho
1470,1442066946579,0,0,1,0,off-topic,0,76,1730,Girl you know that you got me.
1471,1442066946580,0,0,1,0,off-topic,1,103,1731,Salute me or Shoot Me, Make ya next Move ya Best Move!!!!
1472,1442066946580,0,0,1,0,off-topic,0,82,1732,Harrah at 4:14? Awesome.. please no.
1473,1442066946581,0,0,1,0,off-topic,1,126,1733,@CallieAmos @Yobbo123 he has other colors too. Expect to see the blue one today.
1474,1442066946581,0,0,1,0,off-topic,0,106,1734,@J_Cole_Jackson @austinduncan35 I think no such thing coley!
1475,1442066946581,0,1,1,0,off-topic,0,185,1735,HB1717 [Update] State government; providing for determinations of salary amounts for certain chief executive offi... http://t.co/ZrAdryUkJ8
1476,1442066946582,0,0,1,0,off-topic,1,79,1736,I will wait, I will wait for you.
1477,1442066946582,0,0,1,0,off-topic,0,120,1737,Getting to old for these kinda shows. Scene kids and fan girls everywhere.
1478,1442066946582,0,0,1,0,off-topic,0,120,1738,@BrookeAPotter half of it! Lol. But I'm okay, and that's all that matters!
1479,1442066946583,0,1,1,0,off-topic,1,129,1739,Maaannn Paul George has been scrubbin' all game and is gonna hit that though??? Smh
1480,1442066946583,0,0,1,0,off-topic,0,94,1740,Eww my dad is taking the guts out these rabits!!
1481,1442066946583,0,0,1,0,off-topic,0,86,1741,There is no more middle class. #detropia
1482,1442066946584,0,1,1,0,off-topic,1,132,1742,I already have it picked out.. I just got a little more budget then i expected! haaaay
1483,1442066946584,0,1,1,0,off-topic,0,173,1743,@_fitness_freak: I'm just ready for school to be over and focus on my fitness  I've been loving all the free time for fitness!!
1484,1442066946584,0,1,1,0,off-topic,0,133,1744,The moment I get my new car I'm going to stay at my grandparents for a week. #screwthis
1485,1442066946584,0,0,1,0,off-topic,0,137,1745,@Pshrimp_Psauce The States are treating me well. Around 23-24 degrees. But I do miss Delhi.
1486,1442066946585,0,0,1,0,off-topic,1,183,1746,@Corrolaurita @Dianiss_Mtz @JenniferrMarti @pRiiss16 miss you too baby!!!! You need to take us all on a date night when you get back!! ;)
1487,1442066946585,0,0,1,0,off-topic,0,89,1747,The feeling of homesickness comes so strong
1488,1442066946585,0,1,1,0,off-topic,0,83,1748,Fuck everyone going to the lake today
1489,1442066946586,0,0,1,0,off-topic,1,87,1750,So If your from Africa why are you white?
1490,1442066946586,0,0,1,0,off-topic,0,133,1752,And then I have to pay insurance on a car I haven't even been driving,  there goes $90.
1491,1442066947143,0,0,1,0,off-topic,557,111,1753,thank you. RT@SuckMyTweets_x5: @STFUimMacking Thanks  So Is Yours
1492,1442066947143,0,0,1,0,off-topic,0,100,1754,@KingJames done messed around and got a triple double.
1493,1442066947144,0,0,1,0,off-topic,1,157,1755,My sister is mean she never wants to talk to me and she use to tell me I was adopted when I was little @_tnytot
1494,1442066947144,0,0,1,0,off-topic,0,93,1756,I gotta go watch FAST 6 ... but I have no date.
1495,1442066947144,0,0,1,0,off-topic,0,129,1757,Almost all of the bridal party! The picture cut off Kristen! http://t.co/85ebu6ajJf
1496,1442066947145,0,1,1,0,off-topic,1,136,1758,@KimKardashian I agree I like working out in the A M but don't have the time now!!!! Enjoy
1497,1442066947145,0,1,1,0,off-topic,0,93,1759,Gonna turn my phone off for the rest of the day
1498,1442066947145,0,0,1,0,off-topic,0,134,1760,@Mallorie_White lol shhh lets go noodling all my buddy's are scared the water is to cold
1499,1442066947145,0,0,1,0,off-topic,0,93,1761,I wish I could take everything back that I did.
1500,1442066947146,0,1,1,0,off-topic,1,179,1762,I hate when people leave me out of plans until the last minute and then say babe you have an hour to get ready... like what the eff..
1501,1442066947146,0,0,1,0,off-topic,0,80,1763,@TheLauraCook what is it Laura? :)
1502,1442066947146,0,0,1,0,off-topic,0,106,1764,@BashBurnett18 haha. I bet it's worth it! Love and miss you!
1503,1442066947147,0,1,1,0,off-topic,1,141,1765,The car hop at sonic just told me my eyes were beautiful.. made my entire day and its only 1030
1504,1442066947147,0,0,1,0,off-topic,0,82,1766,I pop a purp.. Turn on my own switch
1505,1442066947147,0,0,1,0,off-topic,0,127,1767,Why these people got there top down? It's 63 degrees you ain't cool you're a tool
1506,1442066947148,0,0,1,0,off-topic,1,178,1717,Okies apparently believe 'The President's Authority' overrule my Constitutional Rights and those granted him under The Constitution?
1507,1442066947148,1,0,1,0,on-topic,0,162,1781,I'm actually very nervous about the storms expected today. That's rare for me. Guess my nerves need time to recover!
1508,1442066947148,0,0,1,0,off-topic,0,103,1768,@nycolej105 when i see you next! We locking on sight cuz!
1509,1442066947148,0,0,1,0,off-topic,0,83,1769,@MoralesChristan ya it blows! server?
1510,1442066947149,1,0,1,0,on-topic,1,84,1770,Cars were thrown around like HOTWHEELS
1511,1442066947149,0,0,1,0,off-topic,0,101,1771,Cryer will be having heart problems again. ..# RollTide
1512,1442066947150,0,0,1,0,off-topic,1,103,1772,I think a couple #omf and myself need to go get some grub
1513,1442066947150,0,0,1,0,off-topic,0,78,1773,@BIGYAK77 bro beans. He is whack
1514,1442066947152,0,0,1,0,off-topic,2,127,1774,@B_Dick29 Lol Darius a fool! And yeah I think they did because I know it was CNN!
1515,1442066947153,0,0,1,0,off-topic,1,84,1775,@Garcia_V17 I doubt it's that bad -__/
1516,1442066947154,0,1,1,0,off-topic,1,160,1776,@deirdrevisser My wife says I'm a big baby when sick. I say not one bit. I just need regular changing and feeding.
1517,1442066947154,0,0,1,0,off-topic,0,78,1777,took a brave, brave girl to try.
