2588,1442066963063,0,0,1,0,off-topic,1,141,3375,It's so funny watching you like nothing but pretty much naked girls pictures on instagram lolol
2589,1442066963064,0,0,1,0,off-topic,1,191,3376,@NayomiArroyo @josematamoros63 , a lion &amp; a cheetah had a race. the cheetah won. they LION said you CHEETAH, &amp; the CHEETAH said YOU LION!
2590,1442066963064,0,1,1,0,off-topic,0,96,3377,Don't believe me just watch! Niggga niggga niggga!
2591,1442066963065,0,1,1,0,off-topic,1,77,3378,You're long gone, and moved on.
2592,1442066963067,0,0,1,0,off-topic,2,90,3380,All I hear are sirens. Hope everybody is ok.
2593,1442066963068,0,1,1,0,off-topic,1,110,3381,Hmm should I stay up and go to work at 1 or just fall asleep now
2594,1442066963069,0,0,1,0,off-topic,1,110,3382,@Chris44Kirk on crips I'm getting it from yo mama an sista blood
2595,1442066963070,0,0,1,0,off-topic,1,109,3383,Well the lake def got the best of me. #Eufaula #MemorialWeekend
2596,1442066963071,0,0,1,0,off-topic,1,78,3385,Jennifers ass is so damn random!
2597,1442066963073,0,1,1,0,off-topic,2,86,3386,got about 3 hours of sleep.. That's cool
2598,1442066963074,0,1,1,0,off-topic,1,119,3387,This is going to be beautiful. RT @jtLOL: I am James Rosen. #UpYoursObama
2599,1442066963075,0,0,1,0,off-topic,1,74,3388,Now I know what it means lol
2600,1442066963076,0,0,1,0,off-topic,1,156,3389,@JennyyOu16 andale pues siguele eh!! lol trust me its getting done monday night and tuesday before class!! Lol
2601,1442066963076,0,1,1,0,off-topic,0,112,3390,@Lester_Asamoah @KateSleem step off Lester. I know where you live.
2602,1442066963077,0,1,1,0,off-topic,1,79,3391,@Lo4sho1 send me a pic right now!
2603,1442066963078,0,1,1,0,off-topic,1,141,3392,@bleednornge72 I just wanted my dog! And I got her! Lol that's all I cared about at the moment!
2604,1442066963079,0,0,1,0,off-topic,1,91,3393,@BIGYAK77 @kenzgup13 bro beans he is the best
2605,1442066963080,0,1,1,0,off-topic,1,80,3394,I'm laughing so hard right now xDD
2606,1442066963082,0,0,1,0,off-topic,2,167,3396,#realtalk #faith #change #life #lifechange #learn #learning #failures #nevergiveup @ Clear Picture http://t.co/jsSRUCVpoY
2607,1442066963082,1,1,1,1,on-topic,0,185,3425,@CassieScerbo before you start praying for us make sure you take the extra 2 seconds to spell fucking Oklahoma right http://t.co/L5uLTSVJb5
2608,1442066963083,0,1,1,0,off-topic,1,183,3436,OKC Quick-Cast: Memorial Day starts off in the low 70s, heating to the upper 80s. Storms possible across western OK, a few may be severe.
2609,1442066963083,1,1,1,1,on-topic,0,182,3462,Praying for this family right now. Sydney Angle was in the 3rd grade at #plazatowers #elementary #prayforoklahoma http://t.co/ceauqcJmnD
2610,1442066963083,1,0,1,0,on-topic,0,184,3433,Moore, OK Ground Zero.  This was the home of a cousin's best friend.  The storm shelter saved a father and his son. http://t.co/ekzdeq4Y0a
2611,1442066963084,1,0,1,0,on-topic,1,179,3437,To friends who lost or had there house damaged today. My thoughts and prayers are with you. Let me know if there's anyway I can help.
2612,1442066963084,1,0,1,0,on-topic,0,155,3473,@DanGordon Those wanting to donate to relief efforts can also give to @CathCharitiesOK http://t.co/Wx5spvRmVT
2613,1442066963085,1,0,1,0,on-topic,1,132,3474,@steph_porras: Pray for Calissa Knight, she lost a loved one in this tragedy. Praying!
2614,1442066963085,0,0,1,0,off-topic,0,70,3423,Guys, I made a snapchat.
2615,1442066963087,0,0,1,0,off-topic,2,120,3424,l@_MrHoopMixtape: @max_keyla I didn't even think you was no hoe or nothing
2616,1442066963088,0,1,1,0,off-topic,1,174,3426,Happy birthday @HollaAtchaHero...live it up. But Dont get crazy. I will come all the way to TX and whoop yu! Yu not grown yet :)
2617,1442066963092,0,1,1,0,off-topic,4,83,3427,Can I take a 3 minute nap real quick?
2618,1442066963093,0,0,1,0,off-topic,1,100,3428,I'd like to go to a couple running trails this summer.
2619,1442066963094,1,1,1,1,on-topic,1,113,3429,If my mom still worked in Moore I would be flipping shit right now.
2620,1442066963095,0,0,1,0,off-topic,1,85,3430,Broader bambino the hardest in of idgaf
2621,1442066963097,0,0,1,0,off-topic,2,88,3431,@Bwoodriing ok! The application is online.
2622,1442066963098,0,0,1,0,off-topic,1,127,3432,@1willydakid: Must be trying to get serge ibaka'd? ayyyy don't talk about my baby
2623,1442066963099,0,0,1,0,off-topic,1,107,3434,Everyone go to El Chapala if you haven't been, it's delicious
2624,1442066963100,0,1,1,0,off-topic,1,97,3435,@anamariecox @EvanMcSan now that would be a scandal
2625,1442066963101,1,0,1,0,on-topic,1,182,3438,Took the rest of the Zyrtec this morning. After #volunteerMoore, doing yard work, and walking the park this weekend... Head is a balloon
2626,1442066963102,0,0,1,0,off-topic,1,93,3439,How in the hail am I supposed to go to school?!
2627,1442066963103,0,0,1,0,off-topic,1,142,3440,Hands down without a doubt the absolute weirdest introductions on the Bachelorette!!! Bi.zarr.O!
2628,1442066963104,0,0,1,0,off-topic,1,183,3441,Day #1 of #FatlessPayGoal.Cleansing... All water today. Maybe some fresh fruit juice later tonight.No strenuous activity other than work.
2629,1442066963104,0,0,1,0,off-topic,0,64,3442,A house is on fire
2630,1442066963105,0,0,1,0,off-topic,1,111,3443,I feel at home with this weather...#pisces http://t.co/yHsq8li7Ol
2631,1442066963106,0,0,1,0,off-topic,1,76,3444,God I love Honey Nut Cheerios.
2632,1442066963108,0,0,1,0,off-topic,2,116,3445,that's on you . but I can't promise you nothing .. it's harsh I know .
2633,1442066963109,0,1,1,0,off-topic,1,76,3446,YAWN I'm already tired as fuck
2634,1442066963112,0,0,1,0,off-topic,3,101,3447,@TMast1331 not much to miss! Lol but I'm glad it's good
2635,1442066963113,0,0,1,0,off-topic,1,130,3448,@l_see_you @nickr_7 @GabrielNeri5 so their religion is to not care if children past?
2636,1442066963114,0,0,1,0,off-topic,1,107,3449,Quitting my job at liquor store!! :) new chapter in my life!!
2637,1442066963115,0,1,1,0,off-topic,1,103,3450,So I guess todays just gonna be a laid back boring day?..
2638,1442066963117,0,0,1,0,off-topic,2,106,3451,My fellow tomato lover is here!!! @frankieramirez #soexcited
2639,1442066963119,0,0,1,0,off-topic,2,87,3452,Party this weekend . I'm gunna be there !
2640,1442066963121,0,0,1,0,off-topic,2,95,3453,Went to bed at 830 last night and was still tired
2641,1442066963124,0,0,1,0,off-topic,3,76,3454,Why am I sleeping in my jeans?
2642,1442066963129,0,1,1,0,off-topic,5,91,3455,@kev1d Thanks man! We are thankful right now!
2643,1442066963134,0,1,1,0,off-topic,5,152,3456,So my second smallest toe is broken and OMG it's painful. I didn't think it would be this painful/annoying
2644,1442066963136,0,0,1,0,off-topic,2,132,3457,@KappaSigmaOCU Hey I'm here trying to drop off stuff but no one's here to let me in...
2645,1442066963136,0,0,1,0,off-topic,0,185,3458,http://t.co/BtxHA2bUAw I grew up virtually next door to  main office- and my family also has orphanage/disenfranchised  service connections
2646,1442066963137,0,1,1,0,off-topic,1,87,3459,Gonna be at the movies til 1:00 am...yay.
2647,1442066963138,0,0,1,0,off-topic,1,101,3460,@kelseydduncan all the fun is in the road trip though!!
2648,1442066963138,0,0,1,0,off-topic,0,116,3461,I want a boo. don't want to be single this summer. but I will find on.
2649,1442066963139,0,0,1,0,off-topic,1,153,3463,@Jah_Lloyd @_StinaaBabyy lol I was sleep bro..headed to work but dm me ur number and ill send em to u today
2650,1442066963140,0,0,1,0,off-topic,1,117,3464,Can't really fucc with my fam like that most of them bitches are stupid
2651,1442066963140,0,0,1,0,off-topic,0,87,3465,Hey skinny briches.. That there's my man!
2652,1442066963141,0,0,1,0,off-topic,1,68,3466,I can't do this today.
2653,1442066963142,0,0,1,0,off-topic,1,181,3467,http://t.co/k3MccqerUl see even the internet search agrees with me......... #OKC #remington #art #cowboys #kids #family Think Ponderosa
2654,1442066963143,0,0,1,0,off-topic,1,109,3468,that's why most of yall are lost and don't know what to believe
2655,1442066963143,0,0,1,0,off-topic,0,99,3469,Has anyone actually confirmed Westboro is even there?
2656,1442066963146,0,0,1,0,off-topic,3,78,3470,Sensual seduction by snoop  lmao
2657,1442066963147,1,1,1,1,on-topic,1,139,3515,Tornado Warning for Henry and Patrick Counties in VA until 6:00 PM EDT http://t.co/Mpts7VSD5B
2658,1442066963148,1,1,1,1,on-topic,1,133,3518,Tornado Warning for Custer County in NE until 9:15 PM CDT. #newx http://t.co/if3HiKzhwt
2659,1442066963148,1,1,1,1,on-topic,0,183,3536,Severe Thunderstorm Warning for  Carter, Garvin, Johnston, Marshall, Murray, Pontotoc [OK] till 1:45 PM CDT. #okwx http://t.co/ZKXI73zi3Z
2660,1442066963149,0,0,1,0,off-topic,1,184,3495,@LouisMGreen @dannybowien @OKChefsRelief they did it all day yesterday. text me when you're heading down and ill check on what's available
2661,1442066963149,1,0,1,0,on-topic,0,180,3523,People are out here DYING with life threatening injuries due to the traumatic tornado we experienced, and you're here for a tick bite.
2662,1442066963150,0,0,1,0,off-topic,1,112,3489,What is goin on tnite my peeps!!!!? Im off work and tryna step out
2663,1442066963150,0,0,1,0,off-topic,0,75,3490,Where are his eyebrows, lord?
2664,1442066963152,0,0,1,0,off-topic,2,97,3491,@Jens_Randall .....so am I all three or can I pick?
2665,1442066963153,0,0,1,0,off-topic,1,85,3492,Sometimes. I. Want. To. Choke. You. Btw
2666,1442066963154,0,1,1,0,off-topic,1,76,3493,No. I am not going to ARKANSAS
2667,1442066963159,0,0,1,0,off-topic,5,109,3494,Sitting at Anthony's house while he's at work, is so lonely....
2668,1442066963167,0,0,1,0,off-topic,8,84,3496,She got a sheet as a dress in her Avi?
2669,1442066963170,0,0,1,0,off-topic,3,171,3497,@masonspillman @dariusrucker Proving to the twitter universe how ignorant you are. @th3j35t3r should HACK you for being rude!
2670,1442066963171,0,0,1,0,off-topic,1,68,3498,I wanna hold ya tight!
2671,1442066963175,0,0,1,0,off-topic,4,107,3499,@madiiwatsonn: Kobe pissed me off on a daily basis. #bye  rft
2672,1442066963177,0,0,1,0,off-topic,2,152,3500,Sitting in the car listening to @Cetera_Desunt and @Kade_Kwitowski  sing along to @AARONCARTER #IWantCandy
2673,1442066963177,0,0,1,0,off-topic,0,99,3501,S/o to @CadeThronebury for always makin me laugh haha
2674,1442066963178,0,1,1,0,off-topic,1,166,3502,I'm so depressed I'm not gonna be at cheer camp next week. But you bet I'll be up there the last day to watch my girlies
2675,1442066963178,0,0,1,0,off-topic,0,131,3503,@Odia_ know a woman dt got a divorce after 40yrs of marriage. Dt I cn neva understand
2676,1442066963179,0,0,1,0,off-topic,1,119,3504,@_tnytot you should of told the bitch mind her buisness &amp; im grown tf
2677,1442066963180,0,0,1,0,off-topic,1,99,3505,If I dot got a cup then I'm probably getting blowed..
2678,1442066963181,0,0,1,0,off-topic,1,99,3506,Rediscovering the music I grew up on. LOVE LOVE LOVE.
2679,1442066963181,0,0,1,0,off-topic,0,128,3507,@PYRO83 I'm in Oklahoma ill be here for a couple months then I'm headed to Cali :(
2680,1442066963182,0,1,1,0,off-topic,1,91,3508,@DillonKang you're gonna be puking everywhere
2681,1442066963183,0,0,1,0,off-topic,1,173,3509,Slow down grab the wall, wiggle like you trynna make yo ass fall off, &amp; to think i wanna smash em all, speed up, gas pedal.
2682,1442066963183,0,0,1,0,off-topic,0,73,3510,This is the way. I feel it.
2683,1442066963184,0,1,1,0,off-topic,1,172,3511,SB965 [Update] Oklahoma Water Resources Board; modifying appointments based on regional representation. http://t.co/Rxno4fQURa
2684,1442066963184,0,1,1,0,off-topic,0,144,3512,SB321 [Update] Revenue and taxation; gross receipts tax on mixed beverages. http://t.co/CzOJ7t78zq
2685,1442066963185,0,1,1,0,off-topic,1,185,3513,SB1121 [Update] State Department of rehabilitations Services; budgeting in certain categories; lapse dates. Effec... http://t.co/ApSp2hU4J7
2686,1442066963185,0,0,1,0,off-topic,0,148,3514,@cynthiaesqu  you read that Eric!!! You're buying groceries and helping cook!!!  @EMartinez41 @_Ameya_
2687,1442066963186,0,0,1,0,off-topic,1,84,3516,@kellNworldpeace is it quite slippery?
2688,1442066963187,0,0,1,0,off-topic,1,98,3517,Did everything with my bro and a female messed it up
2689,1442066963188,0,0,1,0,off-topic,1,79,3519,Honestly , it felt kinda good lol
2690,1442066963189,0,1,1,0,off-topic,1,135,3520,Everybody asleep, except for me on the  highway lol. This non caffeine soda got me going.
2691,1442066963189,1,0,1,0,on-topic,0,106,3521,It's so hard trying to decide what city to help clean up in.
2692,1442066963190,0,0,1,0,off-topic,1,108,3522,Crazy to say my favorite song is called my favorite song. #Wiz
2693,1442066963191,0,1,1,0,off-topic,1,149,3524,you're gonna be okay. Sleep good. @blueoceania: @official_keli always knows how to make me feel better.
2694,1442066963192,0,1,1,0,off-topic,1,155,3525,Ripped my pants in the back by my butt like above my pockets, well these Aeropostale Pants are work pants now
2695,1442066963192,1,1,1,1,on-topic,0,128,3526,@TrePorter5: Saved her daughter by holding on to hair... Amazing story scary story
2696,1442066963193,0,1,1,0,off-topic,1,93,3527,Don't forget that U.S has short attention span.
2697,1442066963194,0,0,1,0,off-topic,1,93,3528,When you have no one to say goodmorning to &lt;
2698,1442066963196,0,0,1,0,off-topic,2,84,3529,Aaron has all these women brainwashed.
2699,1442066963197,0,0,1,0,off-topic,1,93,3530,@ChapmanCanida at least you thought it was good
2700,1442066963198,0,0,1,0,off-topic,1,107,3531,They see me bowling, they hatin! Drake http://t.co/2gv99npI6K
2701,1442066963199,0,0,1,0,off-topic,1,84,3532,@alexisannemack can I know who it is ?
2702,1442066963200,0,1,1,0,off-topic,1,105,3533,@DeidzzAddington @wade_x3 because you just way too smart !!
2703,1442066963201,0,1,1,0,off-topic,1,121,3534,If jake &amp; I don't go camping this weekend I'm gonna be extremely upset.
2704,1442066963202,0,0,1,0,off-topic,1,147,3535,S/O 2 @LickMah_Beauty &gt;&gt;&gt; your avi is cute af. lol, y'all go follow her after she follow me.
2705,1442066963202,0,0,1,0,off-topic,0,90,3537,Why can't I past this level on candy crush?!
2706,1442066963206,0,0,1,0,off-topic,4,83,3538,It's 1 in the mornin and I'm starvin.
2707,1442066963210,1,1,1,1,on-topic,4,165,3560,@kfor @lancewest other outlets are reporting survivors being rescued from the school...I hope you're wrong on this one.
2708,1442066963211,1,1,1,1,on-topic,1,176,3581,Haven't allowed myself to watch the news at all today after my brother told me about the travesty that happened in moore! #Prayers
2709,1442066963212,0,0,1,0,off-topic,1,141,3561,@RickMitchellWX @NWSNorman Timing, as well. Imagine the toll if it struck at 5pm instead of 2pm
2710,1442066963214,1,0,1,0,on-topic,2,143,3562,And the storms continue #hail and #flashflooding #prayforoklahoma rescuers http://t.co/lzVxoOTqis
2711,1442066963215,1,0,1,0,on-topic,1,181,3580,RT @CBCWeather: Classic hook echo as the devastating tornado touched down west of Moore, OK yesterday afternoon: http://t.co/F0A3ahbirz
2712,1442066963216,1,0,1,0,on-topic,1,168,3598,The area in orange is under a tornado watch til 10 PM CDT. Grapefruit size hail, tornadoes likely.  http://t.co/IMbsI5G1GP
2713,1442066963217,0,0,1,0,off-topic,1,133,3559,Waiting for the next life to build up on candy crush is real close to cruel punishment.
2714,1442066963218,0,0,1,0,off-topic,1,141,3563,@tayylor_greeson: Really need to figure out what kinda schedule I wanna work this summer. Soml.
2715,1442066963221,0,0,1,0,off-topic,3,174,3564,@anissalinaka lol it's because he said he was bringing the Dada outfit back so they are doing the most which is cracking me up!!
2716,1442066963223,0,0,1,0,off-topic,2,166,3565,@TyKnight__: @Knight3blaine @T_Hamilton13 @eddie_pv25 @BraydenLindsey okay. Lets settle this. Nathan is a fruit. I agree
2717,1442066963224,0,0,1,0,off-topic,1,88,3566,Get back to edmond and my ac is out....fml
2718,1442066963226,0,0,1,0,off-topic,2,80,3567,Please leave so I can come out lol
2719,1442066963227,0,0,1,0,off-topic,1,126,3568,you know your in Texas when everything is brown, dry and ugly. Welcome Home Tav.
2720,1442066963228,0,0,1,0,off-topic,1,96,3569,If we get married I wonder how that would work out
2721,1442066963229,0,0,1,0,off-topic,1,182,3570,The money is GIVEN to you. I don't know how you feel, but I don't feel right accepting money given to me when there's others who need it
2722,1442066963229,0,0,1,0,off-topic,0,106,3571,@Okc_ThunDerMan lol sorry :) but I'm not being a smart ass .
2723,1442066963230,0,1,1,0,off-topic,1,182,3572,@Jwognakou4 let me know if you get to go! That's my #1 choice, then OU then UCO. I'm just confused about if OSU is the best place for me
2724,1442066963230,0,0,1,0,off-topic,0,78,3573,@jazmiiine_ want me to make you?
2725,1442066963231,0,0,1,0,off-topic,1,102,3574,@sosakeller24 That's bull you should still be able to go
2726,1442066963232,0,0,1,0,off-topic,1,79,3575,I miss @CaltotheEE a whole bunch.
2727,1442066963233,0,0,1,0,off-topic,1,112,3576,@Tyler__Campbell yea hopefully! All we know is what Casey told us!
2728,1442066963234,0,0,1,0,off-topic,1,80,3577,Ppl who underestimate are funny...
2729,1442066963235,0,1,1,0,off-topic,1,166,3578,@BarbaraBJSweat @ChrisYoungMusic Yes They Told Me I Was Going To Hell Cause Im a Fan Of Chris. Because I'm a Christian!!
2730,1442066963236,0,0,1,0,off-topic,1,80,3579,I fuckin hate you.. but I love you
2731,1442066963237,0,0,1,0,off-topic,1,69,3582,You can shut your trap.
2732,1442066963241,0,1,1,0,off-topic,4,141,3583,@shelbyjayne_7: I hate when vines don't upload and then I gotta upload them hours later  preach
2733,1442066963241,0,0,1,0,off-topic,0,109,3584,@marcelluswriter @KellyinOKC country music... Worse than dying.
2734,1442066963242,0,0,1,0,off-topic,1,117,3585,@RDisalvatore oh yeah hilarious! You almost fell head first into a wall
2735,1442066963242,0,0,1,0,off-topic,0,99,3586,The McDonald's on Harrison makes the worst McChickens
2736,1442066963243,0,1,1,0,off-topic,1,171,3587,@Cmdr_Hadfield but! They never showed gravity adjustment on Star Trek, no matter how big or small of a planet they landed on.
2737,1442066963244,0,0,1,0,off-topic,1,84,3588,@06bigtown Awe, dang! I'll be in Utah!
2738,1442066963245,0,1,1,0,off-topic,1,176,3589,@LeagueBound87 in OKC right now, should get back late tonight. I'll holla tomorrow and maybe we can meet at North for a few hours.
2739,1442066963246,0,0,1,0,off-topic,1,70,3590,My ankles are so swollen
2740,1442066963248,0,0,1,0,off-topic,2,162,3591,This boy's vocabulary is better than some adults! #cutiepie #childrensministry #spanishchurch http://t.co/KIwptWdYOP
2741,1442066963248,0,0,1,0,off-topic,0,66,3592,Ot or win it #Pacers
2742,1442066963250,0,0,1,0,off-topic,2,122,3593,@_Ben_Official @danielbrumley or I called Ben! Either way I was on the phone
2743,1442066963251,0,1,1,0,off-topic,1,114,3594,@Sessahhh oh we are ok. Just surprised to see you tweet about us. :)
2744,1442066963251,0,1,1,0,off-topic,0,190,3595,Research suggests that laziness is just a natural part of being a teenager &amp; doesnt reflect bad behavior @_JuliaMartinez_  guess your normal
2745,1442066963252,0,1,1,0,off-topic,1,103,3596,Just finished studying now time to watch @GameOfThrones .
2746,1442066963253,0,0,1,0,off-topic,1,74,3597,Today has been a Good day :)
2747,1442066963255,0,0,1,0,off-topic,2,70,3599,I hope my family is okay
2748,1442066963257,0,0,1,0,off-topic,2,105,3600,And all my folks are panicking, MAKIN MY DAMN NERVES BAD!!!
2749,1442066963257,0,0,1,0,off-topic,0,87,3601,Oh, don't forget, rocking back and forth.
2750,1442066963258,1,0,1,0,on-topic,1,182,3602,What you can't see on the television is the heat...the smell...gas lines broken everywhere. Insulation stinging your eyes as you search.
2751,1442066963259,0,0,1,0,off-topic,1,91,3603,And nobody thought to invite Sekret Agent!!!!
2752,1442066963260,0,0,1,0,off-topic,1,171,3604,Checking out my first show at @reduxiontheatre ! Very cool stage and setup, and the owners are awesome http://t.co/eYTzIFv6GK
2753,1442066963260,0,0,1,0,off-topic,0,97,3605,My waiter tonight&gt;&gt;&gt;&gt;&gt;&gt; #gorgeous
2754,1442066963261,0,0,1,0,off-topic,1,91,3606,@shypullum15 it made me SO sad seeing them :(
2755,1442066963263,0,0,1,0,off-topic,2,158,3607,What about babtist? @ashleyywadee: ok no he actually is right.. I typed westboro and it changed it to Westbrook.
2756,1442066963264,0,0,1,0,off-topic,1,102,3608,Selfish player. Then again, closed mouths don't get fed!
2757,1442066963264,0,1,1,0,off-topic,0,186,3656,I know my lifes not right with God at the moment but some of yall better be praying and not just saying all of that just bc everyone else is
2758,1442066963265,1,0,1,0,on-topic,1,186,3622,@gardencatlady may be part of why house in a direct tornado alley. And some areas more at risk than others as a rule. All OKCPS Title I. FYI
2759,1442066963265,1,0,1,0,on-topic,0,99,3626,#prayformoore night guys. keep Moore in your prayers.
2760,1442066963266,1,0,1,0,on-topic,1,153,3654,Kevin Durant has donated $1 million to the Red Cross for Tornado relief. This is Durant being Durant. #okwx
2761,1442066963267,1,0,1,0,on-topic,1,168,3657,Volunteers are the bomb dot com! #nojoke #heroes #Moore #Oklahoma #HelpMoore #volunteers @ Covenant http://t.co/UaFHXvyr6v
2762,1442066963267,0,0,1,0,off-topic,0,118,3610,I need to find me a job so I can slave and get my small saving back #at0
2763,1442066963268,0,1,1,0,off-topic,1,109,3611,Traffic going into Moore is moving at like zero miles per hour.
2764,1442066963269,0,0,1,0,off-topic,1,81,3612,@jennabuuug she's getting 2 of them
2765,1442066963270,0,1,1,0,off-topic,1,160,3613,We need hands to unload semi and load u-hauls NOW! Mid-Del-Moore Realtors 1212 Air Depot, Midwest City. Please RT!
2766,1442066963271,0,1,1,0,off-topic,1,140,3614,I still can't believe my baby girl is going to kindergarten next year.  http://t.co/NJOWphsMMJ
2767,1442066963271,0,0,1,0,off-topic,0,71,3615,Wish oomf would text me..
2768,1442066963273,0,0,1,0,off-topic,2,140,3616,Haiku for @ThatKevinSmithYou brought me laughterWhen I needed it the mostA thousand thank yous
2769,1442066963273,0,1,1,0,off-topic,0,186,3617,@kevinmd @briandavidearp signing into acute care for mental health and secondary eval to affirm admission helps when no MD readily available
2770,1442066963276,0,0,1,0,off-topic,3,101,3618,Why am I crying? I'm suppose to be happy about leaving.
2771,1442066963280,0,0,1,0,off-topic,4,132,3619,RT @NEWS9: Cleveland County Offers Free Tetanus Shots Wednesday http://t.co/pwWR66WV0t
2772,1442066963280,0,0,1,0,off-topic,0,139,3620,@UltraWarrior so when do you think they'll finally pair up Axel and Sandow? A perfect team...
2773,1442066963280,0,1,1,0,off-topic,0,98,3621,@brandynfoster only if you insist I was just kidding
2774,1442066963281,0,0,1,0,off-topic,1,179,3623,C# Web Developer - Level... - #OklahomaCity , OK (http://t.co/GJuEy3m19r) Get Web Developer Jobs #WebDeveloper #jobs #job #GetAllJobs
2775,1442066963281,0,0,1,0,off-topic,0,148,3624,Wind 6 mph S. Barometer 29.99 in, Falling slowly. Temperature 81.5 F. Rain today 0.00 in. Humidity 73%
2776,1442066963282,0,1,1,0,off-topic,1,91,3625,@CptnLessing are you going to come back ever?
2777,1442066963282,0,0,1,0,off-topic,0,92,3627,My outfit for today tho http://t.co/8U5pC9afjS
2778,1442066963283,0,0,1,0,off-topic,1,83,3628,@raianna_brown you ain't mad so tf up
2779,1442066963284,0,0,1,0,off-topic,1,100,3629,@scottkfoley oh you deal with that too? #toddlertweets
2780,1442066963285,0,0,1,0,off-topic,1,184,3630,@hariesbd @avoicewithin @RAINN01 Look for other post 2. If you message groups and ask for help- or focus they mostly answer. Pull together
2781,1442066963286,0,0,1,0,off-topic,1,111,3631,@kenzgup13: Don't follow nicole Honestly. I regret following her.
2782,1442066963287,0,0,1,0,off-topic,1,78,3632,Your not worth it!! #donewithyou
2783,1442066963289,0,1,1,0,off-topic,2,75,3633,I'm trippin' balls right now.
2784,1442066963290,0,0,1,0,off-topic,1,86,3634,Big ass crib but I only use the kitchen.
2785,1442066963291,1,0,1,0,on-topic,1,167,3635,Moore, Oklahoma is my home, I know some people don't understand how we can keep living in a place like this. #moorestrong
2786,1442066963291,0,0,1,0,off-topic,0,147,3636,Wind 7 mph S. Barometer 29.83 in, Rising slowly. Temperature 79.2 F. Rain today 0.00 in. Humidity 68%
2787,1442066963292,0,1,1,0,off-topic,1,104,3637,I need to cherish these last 15 minutes in @CaHays15 class
2788,1442066963292,0,0,1,0,off-topic,0,101,3638,@JacobForgue32 @ForrestB93 hes not an asshole like you.
2789,1442066963293,0,0,1,0,off-topic,1,83,3639,@JordieMack17 no way you could resist
2790,1442066963294,0,0,1,0,off-topic,1,76,3640,I'm hungry but idk what to eat
2791,1442066963296,0,1,1,0,off-topic,2,168,3641,Reporter... Nothing good has happened, for three days. Except today I got to meet Anderson Cooper.#OverheardInTheSatTruck.
2792,1442066963296,1,1,1,1,on-topic,0,104,3642,I can't imagine how my Moore friends are feeling right now
2793,1442066963297,0,1,1,0,off-topic,1,118,3643,I swear I'm gonna be the only person walking around school tomorrow #wah
2794,1442066963298,1,0,1,0,on-topic,1,111,3644,Yea so this weekend if I'm in town Ill be helping out in Moore...
2795,1442066963298,0,0,1,0,off-topic,0,85,3645,Chasing my dream until it is a reality.
2796,1442066963300,0,1,1,0,off-topic,2,132,3646,@musiccSPEAKS: &amp; WHO SAID THE HEAT WAS GONE LOSE? bulls fans and other heat haters
2797,1442066963301,0,0,1,0,off-topic,1,66,3647,I'm not tired at all
2798,1442066963303,0,1,1,0,off-topic,2,103,3648,Just because she done you wrong doesn't mean be a player.
2799,1442066963304,0,0,1,0,off-topic,1,129,3649,I'm at Courtyard Oklahoma City Northwest (Oklahoma City, OK) http://t.co/MMRfu3JguS
2800,1442066963305,0,0,1,0,off-topic,1,96,3650,Pictures and memories will have to get me through.
