1676,1441806213464,0,0,1,0,off-topic,0,102,1741,Chillin at The Sports Club/LA for the day, not even mad.
1677,1441806213465,0,0,1,0,off-topic,1,126,1742,@SaadSJ1 @ahmedhrt believe me Saad! It is one of his DARKEST moments in his LIFE
1678,1441806213465,0,0,1,0,off-topic,0,111,1743,@Cloud99_ Lmfaoo I knew you would say something nigga . Lmaooo :D
1679,1441806213465,0,0,1,0,off-topic,0,92,1607,The fact that I'm always in Back Bay scares me
1680,1441806213466,1,1,1,1,on-topic,1,104,1608,Quick updates on manhunt in Boston  http://t.co/8eIL4gBP2L
1681,1441806213466,0,0,1,0,off-topic,0,106,1609,I'm at Uncle Charlie's (Weymouth, MA) http://t.co/S7frSLB7d7
1682,1441806213467,0,0,1,0,off-topic,1,107,1610,Im really not in the mood to be dealing with PEOPLE LIKE THIS
1683,1441806213467,1,1,1,1,on-topic,0,129,1601,Keep hearing helicopters go over my house..just want this all to end #prayforboston
1684,1441806213467,0,0,1,0,off-topic,0,186,1602,Hey Westboro Baptist Church- I dare you to come to Boston. Apparently you have no idea what this city is all about. You're fixin to find out
1685,1441806213467,0,0,1,0,off-topic,0,127,1603,My athletic aspirations for the next two years are skyrocketing tonight #inspired
1686,1441806213468,0,0,1,0,off-topic,1,136,1605,National Guard in Commons. Two more buses of guardsmen arrived now. http://t.co/1o8Zjd5OvY
1687,1441806213468,0,0,1,0,off-topic,0,111,1606,@KristinClaire29 I love you. Thank you for always thinking of me.
1688,1441806213468,0,0,1,0,off-topic,0,148,1597,Go prep the new bottom they said. It'll be fun they said... #Boats @ Marina Bay http://t.co/AWUc3233Yk
1689,1441806213469,0,0,1,0,off-topic,1,85,1598,@meimeifoodtruck You guys are the best.
1690,1441806213469,1,0,1,0,on-topic,0,149,1760,http://t.co/A4N3RWgvLW lots of information here on the #bostonmarathon #explosion with constant updates
1691,1441806213470,1,1,1,1,on-topic,1,132,1744,It's really 70's weather outside right now . Thanks to this mofo no one can enjoy it .
1692,1441806213470,0,0,1,0,off-topic,0,94,1745,@YourBoyBarney: All these bitch nigga get me mad
1693,1441806213470,0,0,1,0,off-topic,0,166,1746,Panera Bread #Hospitality #Job: Shift Supervisor ( #Franklin , MA) http://t.co/Z8UE1agEJS #VeteranJob #Jobs #TweetMyJobs
1694,1441806213471,1,0,1,0,on-topic,1,167,1747,@Top_29 've seen fuck Muslims and Russians all over my newsfeed, idk if it has to do with their country but still #FuckEm
1695,1441806213471,0,0,1,0,off-topic,0,85,1748,Did everyone get there nails done today
1696,1441806213644,1,0,1,0,on-topic,173,147,1749,So surreal. Crazy packed with cops. Stay safe everyone #Boston @ Boston Common http://t.co/QUPeu0d4Hi
1697,1441806213644,0,0,1,0,off-topic,0,93,1750,what a coincidence that were both here together
1698,1441806213644,0,0,1,0,off-topic,0,153,1751,@BecauseIHadToo yea. You coulda found that eventually. If u said like h.o 280. Some ppl would of given 300$
1699,1441806213644,0,0,1,0,off-topic,0,182,1752,I wish it were acceptable for me to walk around shoving my headphones in people's ears so they could hear the awesome music that I find.
1700,1441806213645,0,0,1,0,off-topic,1,165,1753,If battle scars comes on the radio I turn my radio all the way up and sing at the top of my lungs  I love this song tho
1701,1441806213645,0,0,1,0,off-topic,0,101,1754,@lilmamaxoxo111 your just mean! Dont talk to me no more
1702,1441806213645,0,0,1,0,off-topic,0,112,1755,I like to be a little scary with them. Like 'Boo, here's my dick!'
1703,1441806213646,0,0,1,0,off-topic,1,174,1756,#Marketing #Job in #Dedham , MA: Communications Manager - Dedham, MA at Citizens Financial Group http://t.co/uaUw7qhRhT #cfgjobs
1704,1441806213646,0,0,1,0,off-topic,0,77,1757,It's not too early for dreamin'
1705,1441806213646,0,0,1,0,off-topic,0,105,1758,I'm at @SantarpiosPizza (Boston, MA) http://t.co/b3j7RXbM3t
1706,1441806213647,0,0,1,0,off-topic,1,177,1759,This check-in is dedicated to @atrain13 (@ Barcelona Restaurant and Wine Bar - @barcelonawineba w/ 4 others) http://t.co/DUNaq1Ajw5
1707,1441806213647,0,0,1,0,off-topic,0,133,1761,Dessert first. Now it's time for lunch, Syrian bread, lentils and tabouli! Mmm. Cheers.
1708,1441806213647,0,0,1,0,off-topic,0,73,1599,Stupid people on my TL shit
1709,1441806213648,0,0,1,0,off-topic,1,80,1600,@terrenceKC thanks I will fix that
1710,1441806213648,0,0,1,0,off-topic,0,141,1595,@TrueSoccerProbz: This is on every soccer player's bucket list  http://t.co/EUCRcEfHpX yessssss
1711,1441806213648,0,0,1,0,off-topic,0,185,1596,Boston fans mourn, then cheer as sports return: Emerging from a moment of silence with a deafening cheer, fans at... http://t.co/8wRJTZemTT
1712,1441806213648,0,0,1,0,off-topic,0,133,1592,@HeyRatty same here but everyone keeps telling me I'm overreacting for feeling that way
1713,1441806213649,0,0,1,0,off-topic,1,123,1593,Aw @MattSchenk54 does care about me..lovvvve ya! #sibs http://t.co/ca2tSXjXn0
1714,1441806213649,0,0,1,0,off-topic,0,146,1594,I hope i become Known For a huge acomplishment (famous) thank My REAL niggas That where there For me
1715,1441806213649,0,0,1,0,off-topic,0,67,1590,My back hurts so much
1716,1441806213650,0,0,1,0,off-topic,1,80,1588,Can't believe this guy is only 19!
1717,1441806213650,0,0,1,0,off-topic,0,73,1589,@AbiZagnoli do it you won't
1718,1441806213650,0,0,1,0,off-topic,0,109,1585,Starbucks really should deliver though. I'm waiting for the day
1719,1441806213651,0,0,1,0,off-topic,1,155,1586,@JohnRaphael @thebravobitch that she is!  She may not have fired from Fox 5, but I bet she wasn't asked back.
1720,1441806213830,0,0,1,0,off-topic,179,137,1587,I may not have eardrums or a voice tomorrow... But it's all worth it. @Timeflies @HOBBoston
1721,1441806213830,1,0,1,0,on-topic,0,165,1583,@chad_courtright not really sure yet, I was at the halfway point, so 13 miles out of the finish line.  2 bombs for sure
1722,1441806213831,0,0,1,0,off-topic,1,105,1584,@UrLadyPimp2109 what did I tell you about the age your done
1723,1441806213831,0,0,1,0,off-topic,0,79,1578,My only class today for cancelled
1724,1441806213831,0,0,1,0,off-topic,0,160,1579,Today people fight. ..but for what? !? Power, money all leading up to greed.  Fight for something more worthwhile.
1725,1441806213832,1,0,1,0,on-topic,1,99,1580,When was the last time there was a manhunt in the US?
1726,1441806213832,0,0,1,0,off-topic,0,83,1575,Why I'm I hearing fiveO in Hyde Park?
1727,1441806213832,0,0,1,0,off-topic,0,82,1576,empty streets. Its a ghost town here
1728,1441806213833,0,0,1,0,off-topic,1,154,1577,Mullen: Layout Artist ( #Boston , MA) http://t.co/dhVBWeQpAW #Marketing #advertising #Job #Jobs #TweetMyJobs
1729,1441806213833,0,0,1,0,off-topic,0,74,1574,Never good enough for ANYONE
1730,1441806213834,0,0,1,0,off-topic,1,125,1572,My phone police scanner hasn't stopped going for 5 hours http://t.co/ymr6rStXo2
1731,1441806213834,1,0,1,0,on-topic,0,101,1573,Everyone is walking out of the city. Quietly.... #weird
1732,1441806213834,0,0,1,0,off-topic,0,150,1565,FUCK THIS STUPID ASS WORLD... I'm so thankful my cousin made it safe back home but what about my aunt :(
1733,1441806213834,1,0,1,0,on-topic,0,185,1566,Tight security at Bruins' arena: Security has been tightened at the TD Garden, where the Bruins play on Wednesday... http://t.co/iKzr1YagTN
1734,1441806213835,0,0,1,0,off-topic,1,111,1567,My home. #Boston @ Marriott's Custom House http://t.co/BBO37dNqFC
1735,1441806213835,0,0,1,0,off-topic,0,70,1568,I love the smell of weed
1736,1441806213835,0,0,1,0,off-topic,0,155,1569,Love, at the end of the day is stronger than some mistake somebody made, something they did that they regret.
1737,1441806213836,0,0,1,0,off-topic,1,129,1564,Boston Berklee College of Music @ Berklee Performance Center http://t.co/fCvfov6CHp
1738,1441806213836,0,0,1,0,off-topic,0,142,1560,I'm at @BostonLogan International Airport (BOS) (Boston, MA) w/ 32 others http://t.co/vvUZfAyPSp
1739,1441806213836,0,0,1,0,off-topic,0,160,1561,Last night I opened this note in the mail from my beautiful, sweet niece. Much needed #love http://t.co/za7oC3WWs9
1740,1441806213836,1,0,1,0,on-topic,0,167,1793,Praying for the officers and all people who continue to risk their lives to ensure the safety of others. #america #boston
1741,1441806213837,1,1,1,1,on-topic,1,183,1782,@TheFollowingFOX what will happen for people in Boston waiting to watch The Following? Breaking news is still on. Will there be a replay?
1742,1441806213837,1,1,1,1,on-topic,0,137,1781,At the airport, flights delayed but not canceled. #Boston #BostonMarathon #BostonExplosions
1743,1441806213837,0,0,1,0,off-topic,0,95,1769,Avoid Callahan tunnel. Dead stop. Also I need gas
1744,1441806213838,1,0,1,0,on-topic,1,101,1773,No arrests. Nothing. Leaving Boston a little unsettled.
1745,1441806213838,1,0,1,0,on-topic,0,174,1775,Rep. Keating: Explosions A Coordinated Attack: BOSTON (AP)  U.S. Rep. William Keating, a member of the... http://t.co/Y4uywNCgpx
1746,1441806213838,0,0,1,0,off-topic,0,132,1794,Closed Streetlight report at 80-82 Bayswater St http://t.co/yVR59cxhwn. Case resolved.
1747,1441806213839,0,0,1,0,off-topic,1,88,1795,I'm at MGH Core Lab http://t.co/JysdBVqhkw
1748,1441806213839,0,0,1,0,off-topic,0,186,1796,My sophomore year was probably the best I was on my shit doing my thang not much was going on plus I had shorty by my side always #RealNigga
1749,1441806213839,1,1,1,1,on-topic,0,176,1797,4/17 packed TD Garden before the National Anthem. Truly moving moment, amazing anthem #bruins #bostonstrong http://t.co/f69fqPeInE
1750,1441806213840,0,0,1,0,off-topic,1,134,1798,Someone bring me a dub to Rosi &amp; a Rollie. &amp; you must accept debit or credit lol
1751,1441806213840,0,0,1,0,off-topic,0,80,1799,To franklin field later to ball up
1752,1441806213840,0,0,1,0,off-topic,0,121,1800,Don't know why I'm so tired but u couldnt pay me to get outta bed right now
1753,1441806213841,0,0,1,0,off-topic,1,95,1801,I dont even know if I can braid like I use to lol
1754,1441806213841,0,0,1,0,off-topic,0,79,1802,I hope Steph curry takes the ship
1755,1441806213842,0,0,1,0,off-topic,1,83,1789,AND I WAS RIGHT YOU CHOSE HER OVER ME
1756,1441806213842,1,0,1,0,on-topic,0,118,1790,RT @Boston_Police: Taxi service in the City of Boston has been restored.
1757,1441806213842,0,0,1,0,off-topic,0,103,1791,@jillc543 I was just gonna tweet that about my stats test
1758,1441806213843,0,0,1,0,off-topic,1,152,1792,@ImALittleDizzy nah hahah I mean I could probably figure it out but like I wouldn't say I actually know...
1759,1441806213843,0,0,1,0,off-topic,0,97,1779,i got $20 ima buy me another pair of elite socks :)
1760,1441806213843,0,0,1,0,off-topic,0,102,1780,@SReddivari95 u cud learn a few things from sober people
1761,1441806213844,0,0,1,0,off-topic,1,99,1783,It's a beautiful day where anything can happen #smile
1762,1441806213844,1,0,1,0,on-topic,0,121,1784,Globe flag at half-staff. #Boston @ The Boston Globe http://t.co/bxAIYRlziN
1763,1441806213844,1,0,1,0,on-topic,0,99,1785,In Watertown tho this is fuckin crazy #bostonweareone
1764,1441806213845,0,0,1,0,off-topic,1,128,1786,And honestly I have been begging for answers That you and only you can give to me.
1765,1441806213845,0,0,1,0,off-topic,0,104,1787,Really just kind of hit me how fucked up today really was.
1766,1441806213845,1,0,1,0,on-topic,0,182,1788,@sevlarochelle: Thankful my baby @OlDirtiiSlim was running late and didn't make it to the finish line.  I love you for checkin on me boo
1767,1441806213845,0,0,1,0,off-topic,0,116,1776,Now my side chick, my main chick, my main guhh ain't feelin me no more
1768,1441806213846,0,0,1,0,off-topic,1,110,1777,Channel 7 has live feed of a suspect down on the ground!!!!!!!!!
1769,1441806213846,0,0,1,0,off-topic,0,91,1778,@FranBre3zy your screams echoed tru the 'hood
1770,1441806213846,0,0,1,0,off-topic,0,185,1762,Clay Buchholz keeps Rays at Bay: As the outs piled up, as the innings flew by, and as Clay Buchholz inched closer... http://t.co/tu46RWPoow
1771,1441806213846,0,0,1,0,off-topic,0,180,1763,This just proves that guns don't kill people, people kill people. We have hearts after tragedies but where are our hearts before them?
1772,1441806213847,0,0,1,0,off-topic,1,89,1764,@megabelbarros oh ok. Ill have to do that..
1773,1441806213847,1,1,1,1,on-topic,0,161,1765,Truly just traumatized by this week. Just being in this city during this horrible time has forever changed my life.
1774,1441806213847,0,0,1,0,off-topic,0,173,1766,Man at Back Bay newspaper stand says he has about doubled normal sales so far. Most buying @BostonGlobe. http://t.co/fmUMD3iZuC
1775,1441806213847,0,0,1,0,off-topic,0,99,1767,@_Edaawg that ain't shit I slept in a closet lmfaoooo
1776,1441806213848,0,0,1,0,off-topic,1,94,1768,@susan_lam2 yeah i will &lt;3 thanks susan &lt;3
1777,1441806213848,0,0,1,0,off-topic,0,168,1770,Selfies during study with @sixteeen_ and @ayjayyy_ #selfie #gay #lonely #as #hell @ Foxborough High http://t.co/Z6y8C5V7AG
1778,1441806213848,0,0,1,0,off-topic,0,76,1771,Each month get worse each time
1779,1441806213848,0,0,1,0,off-topic,0,93,1772,I want to meet some of my followers. y'all cool
1780,1441806213849,1,0,1,0,on-topic,1,186,1774,I want this nightmare to be over. I want them to find him. And I do not feel safe returning to normal life with this psychotic on the loose.
1781,1441806213849,0,0,1,0,off-topic,0,83,1562,Dorris burke is even unbearable in 2k
1782,1441806213849,0,0,1,0,off-topic,0,93,1563,@FiveAtHeart me too, 1 wanted to go. I said no.
1783,1441806213850,0,0,1,0,off-topic,1,111,1546,Crazy. My gf lives like 2 mins away from where the bomb went off.
1784,1441806213850,0,0,1,0,off-topic,0,164,1547,@Realitytea: NeNe Leakes Sister Speaks Out! http://t.co/H6nxQRqahe you never can win when you play dirty hunni! #karma
1785,1441806213850,1,0,1,0,on-topic,0,104,1548,Boston Police meeting in the street http://t.co/n7Trw7WK30
1786,1441806213850,0,0,1,0,off-topic,0,112,1549,But mean while I'm enjoying this nice drank http://t.co/L5rYTknO3i
1787,1441806213851,0,0,1,0,off-topic,1,113,1550,@UglyPeopIe: if ur hot please dont flirt with cute boys that i like
1788,1441806213851,0,0,1,0,off-topic,0,118,1551,Your dads white you live in a trailer my dads a spic i live in a mansion
1789,1441806213851,0,0,1,0,off-topic,0,96,1552,@merepar they're saying it was. Was right by there
1790,1441806214588,0,0,1,0,off-topic,737,177,1848,@Jaxcash26 I have a little brother, that's terrible I can't imagine what that family is going through no reason to put me on blast.
1791,1441806214588,0,0,1,0,off-topic,0,74,1858,Evil dead was a good movie !
1792,1441806214588,0,0,1,0,off-topic,0,96,1842,@simonepress federal courthouse being evacuated...
1793,1441806214589,1,0,1,0,on-topic,1,93,1828,Walking around Watertown... Sike #bostonbombing
1794,1441806214589,1,0,1,0,on-topic,0,107,1820,My uncle is a Brookline Police Officer. #bostonstrong #boston
1795,1441806214590,0,0,1,0,off-topic,1,120,1804,@Seamheads I feel for all of the first responders. May God keep them safe.
1796,1441806214590,0,0,1,0,off-topic,0,71,1805,So is evil dead any good?
1797,1441806214591,0,0,1,0,off-topic,1,189,1887,A lady in my office came by w/ hershey kisses saying we've all had a hard week &amp; could use a little cheering up #littlethings #bostonstrong
1798,1441806214592,0,0,1,0,off-topic,1,175,1888,Candreva played 20 matches for Juve in 2010/11 season. While leaving  helped his career, I would have liked to see him with Conte
1799,1441806214592,0,0,1,0,off-topic,0,119,1889,@Brendybum @cardoye  runway more like the projects of the track community
1800,1441806214592,0,0,1,0,off-topic,0,83,1890,@JohnDMcCormack both :( it's a code 9
1801,1441806214593,1,0,1,0,on-topic,1,170,1891,We cheered the runners on during the marathon and we'll cheer Boston on now. My heart goes out to all http://t.co/JJJp96GQcA
1802,1441806214593,0,0,1,0,off-topic,0,115,1881,It's times like these when your true friends really shine #loveyouall
1803,1441806214594,0,0,1,0,off-topic,1,91,1882,@DonteStallworth  ty for all the info. Dam...
1804,1441806214595,0,0,1,0,off-topic,1,95,1883,@Raangz_2 @nwankalicious taxi service is down too
1805,1441806214596,0,0,1,0,off-topic,1,151,1884,Opened Graffiti report via Android at 347-353 Blue Hill Ave Boston http://t.co/oRYDbMgnev. 324 blue hill.
1806,1441806214597,0,0,1,0,off-topic,1,144,1885,@Soulmate_x33 @Supremee_xo I was screaming your name lastnight too tell you to get off of my tits!
1807,1441806214598,0,0,1,0,off-topic,1,142,1886,@RunninThemERINs @alexas143 @sakira_sakira thanks guys...I'm very tired right now leave me alone
1808,1441806214598,0,0,1,0,off-topic,0,104,1876,im done with humanity just gonna enjoy life till its over.
1809,1441806214599,0,0,1,0,off-topic,1,129,1877,Closed report at 73 Windsor St http://t.co/rNVLgOX13f. Case resolved. street swept.
1810,1441806214603,0,0,1,0,off-topic,4,127,1878,I need to find a girl thats ride or die and someone that i can treat like a queen
1811,1441806214604,0,0,1,0,off-topic,1,175,1879,#Marketing #Job in #Boston , MA: Internal Communications, Associate Consult... at Liberty Mutual Insurance http://t.co/01D5gGdHPP
1812,1441806214604,0,0,1,0,off-topic,0,143,1880,Sometimes you can see the ending before the tenure begins.   Smh!  Good luck with that one.  #wbb
1813,1441806214604,0,0,1,0,off-topic,0,117,1866,Maximize your time (@ Milton Hill Sport and Spa) http://t.co/qu0z4Oo6dH
1814,1441806214604,0,0,1,0,off-topic,0,141,1867,It's so pretty and nice out right now. Boston should be full of happy people, not a ghost town.
1815,1441806214605,0,0,1,0,off-topic,1,182,1868,Heavy security at South Station this morning, police and troopers with assault rifles, riot gear, and dogs. Marathon jackets everywhere.
1816,1441806214605,0,0,1,0,off-topic,0,116,1869,@kristen_ayers27 lmao I want too! But I might throw up if I see it lol
1817,1441806214605,0,0,1,0,off-topic,0,125,1870,@livv_montgomery @paigehollyx0 @CassidyG22 OMFG that just made me laugh so hard
1818,1441806214605,1,1,1,1,on-topic,0,112,1871,Boston's on locked but ask me if the hood ppl r still in the house
1819,1441806214606,0,0,1,0,off-topic,1,188,1872,it's a sign!!! @Fashionista_com: Dye-ing to switch up your style? Here's our ultimate guide to going &amp; staying red: http://t.co/V5DnbWp3uN
1820,1441806214606,0,0,1,0,off-topic,0,94,1873,@Yelle0896 I really think we need a day off no??
1821,1441806214606,0,0,1,0,off-topic,0,120,1874,Ubaldo Jimenez just hasn't lived up to expectations since leaving Colorado
1822,1441806214607,0,0,1,0,off-topic,1,130,1875,@AZEALIABANKS yessss finally no more ignorant bullshit clogging up my feed you HOBAG
1823,1441806214607,1,0,1,0,on-topic,0,169,1859,Some of Boston's Finest brought up on stage at the @HOBBoston by @Timeflies!! Fuckkn amazing. #bostonmarathon #bostonstrong
1824,1441806214607,0,0,1,0,off-topic,0,174,1860,Stop by Doyle's in JP for a #samsmithsalute event! Keep your glass tonight! @merchantduvin @ Doyle's Cafe http://t.co/BiaXrCih7J
1825,1441806214607,1,1,1,1,on-topic,0,121,1861,It's Marathon Monday in Boston. What am I doing? Still laying in bed. #lazy
1826,1441806214608,0,0,1,0,off-topic,1,112,1862,@JDubsBro no but I meant Muslims.. you know what I meant. shut up.
1827,1441806214608,0,0,1,0,off-topic,0,116,1863,@GreggyBennett pretty much seems like a movie around here unbelievable
1828,1441806214608,0,0,1,0,off-topic,0,184,1864,I will be with @GomezForMA at Henderson's Cafe at 8AM tomorrow. Proud to endorse him in #hwsen race. @JPhelps_SN @HamWenPatch @HWChronicle
1829,1441806214609,0,0,1,0,off-topic,1,107,1865,@NoRapist: Statistically, 9 out of 10 people enjoy gang rape.
1830,1441806214609,0,0,1,0,off-topic,0,119,1855,Carol the mime, honey bun, zippers/ sweater vest, tan jan, Darcy, Charles
1831,1441806214609,0,0,1,0,off-topic,0,107,1856,@elisaa_rose Pearl follows me wth!? Wat kinda shit is that!!!
1832,1441806214610,0,0,1,0,off-topic,1,145,1857,@MrMakeHerSmile: People hate when you show them how it feels to be treated the way they treat you..
1833,1441806214610,0,0,1,0,off-topic,0,167,1851,Finally sitting down after a looooong day to crochet. Can't go to bed without knitting or crocheting a little each night!
1834,1441806215151,0,0,1,0,off-topic,541,103,1852,This school work is a nightmare and I just want it to end
1835,1441806215152,1,1,1,1,on-topic,1,186,1853,Being stuck I'm Boston right now with swat teams and police all over us.... Going to need an escort to get Out of here #bostonstrong #scared
1836,1441806215152,0,0,1,0,off-topic,0,81,1854,I wanna go to another Redsox game !
1837,1441806215152,1,0,1,0,on-topic,0,141,1849,So proud and thankful for @Boston_Police and @MassStatePolice  #Boston #bostonstrong #watertown
1838,1441806215153,0,0,1,0,off-topic,1,146,1850,Uncle Aaron came to play! vincethefrenchie &amp; @hivesmasher @ LoPresti Park http://t.co/S5Vv415FZI
1839,1441806215153,0,0,1,0,off-topic,0,114,1843,I'm at Wellesley Dental Group (Wellesley, MA) http://t.co/Go3KghOtMC
1840,1441806215153,1,1,1,1,on-topic,0,151,1902,2 explosions in Marathon Sports store near finish line. 2 dead and 23 injured so far. Stay safe everyone!
1841,1441806215154,0,0,1,0,off-topic,1,184,1892,The eagle has landed... But I got patients to tend to. (@ Massachusetts General Hospital - @massgeneralnews) [pic]: http://t.co/kG5IDQk96k
1842,1441806215154,0,0,1,0,off-topic,0,124,1893,@SimpleAsAmyBC boooooo... #chinatown intervention soon tho. Maybe after finals
1843,1441806215154,0,0,1,0,off-topic,0,176,1894,@autumn_maarie is just mad that she has to take an elevator to the top floor just to be as tall as us #midget #smallfry #shortpoop
1844,1441806215154,0,0,1,0,off-topic,0,173,1895,Adventure to Boston part 2: made it onto the train alive. Fairly confident I'm actually on the inbound, headed toward the city.
1845,1441806215155,0,0,1,0,off-topic,1,175,1896,#internship #Job alert: 3rd Annual Sustainable ... | Annual Sustainable Economy Confe... | #Brookline , MA http://t.co/rM2XLTIToE
1846,1441806215155,0,0,1,0,off-topic,0,85,1897,These days it's hard to meet good women
1847,1441806215155,1,1,1,1,on-topic,0,109,1898,@RockDaPanda thanks! So glad I'm safe! I'm still shaking though
1848,1441806215156,0,0,1,0,off-topic,1,83,1899,Now I have to blow dry my cousin hair
1849,1441806215157,0,0,1,0,off-topic,1,98,1900,@Sophisticate_x3 thank you baby girl . Love you tons
1850,1441806215157,0,0,1,0,off-topic,0,148,1901,@IssaHindi I know I have really splurged recently, it was my birthday last week http://t.co/N4OvK7NS7M
1851,1441806215157,0,0,1,0,off-topic,0,81,1903,Who's Rebel Wilson? I'm always late
1852,1441806215158,0,0,1,0,off-topic,1,87,1904,@MonopolyGuy365 I really hate this shit !
1853,1441806215158,1,1,1,1,on-topic,0,100,1905,@tomferry caution.  Boston is nearly under martial law
1854,1441806215159,0,0,1,0,off-topic,1,116,1844,Happy birthday, Timmy, I'll always love you. Thank you for everything.
1855,1441806215159,0,0,1,0,off-topic,0,149,1845,You are much better off getting your Juve news and quotes from @ADP1113 than @footballitalia these days
1856,1441806215160,1,0,1,0,on-topic,1,132,1846,Just because you lived here for 11 years DOES NOT make you an American. #prayforboston
1857,1441806215721,1,0,1,0,on-topic,561,171,1847,Holy cow just watched the national anthem before the b's game at the garden. Talk about America chills!!! #usa  #bostonstrong
1858,1441806215722,1,0,1,0,on-topic,1,129,1839,Violence in any form is senseless. Thinking of #boston #BostonStrong #prayforboston
1859,1441806215722,0,0,1,0,off-topic,0,139,1840,@Phuonglazie i think everything is normalised right now, so the situation should be fine now.
1860,1441806215722,1,0,1,0,on-topic,0,107,1841,This whole situation starting to remind me of the movie Salt.
1861,1441806215723,0,0,1,0,off-topic,1,144,1837,The Baseball team gets no love; fuck all you techboston Nd Dorchester kids. Dumb hood broke niggas
1862,1441806215723,0,0,1,0,off-topic,0,72,1838,@DaBashers half a mile max
1863,1441806215723,0,0,1,0,off-topic,0,101,1833,@M_Ro_Co @dhiggz247 no no that cant b right #SillyWomen
1864,1441806215724,0,0,1,0,off-topic,1,168,1834,@SAMH08_ nah ked im all set with u and ur lies at out friendship level u dnt need an invite if u cared enough ud just come
1865,1441806215724,0,0,1,0,off-topic,0,105,1835,Brad Marchand with the game winning goal in shoot out watch
1866,1441806215724,0,0,1,0,off-topic,0,121,1836,@therachel having issues getting call out. Try me. I will DM you my number.
1867,1441806215725,1,0,1,0,on-topic,1,111,1829,Waking up to CNN saying you are a city under siege #prayforboston
1868,1441806215725,0,0,1,0,off-topic,0,122,1830,Started from the bottom now my whole fuckin team is hammered #marathonmonday
1869,1441806215725,0,0,1,0,off-topic,0,78,1831,Goodbye Boston, I'll miss you :(
1870,1441806215726,0,0,1,0,off-topic,1,128,1832,@kasafc ah hah. Needed to take car. Otherwise I'd have walked or public transport.
1871,1441806215726,1,0,1,0,on-topic,0,157,1823,Talk about a rough week in Boston... Have to keep reminding ourselves the good outnumber the bad! #BostonStrong
1872,1441806215727,0,0,1,0,off-topic,1,171,1824,#Boston , MA #Marketing #Job: Sr. External Communications Consultant at Liberty Mutual Insurance http://t.co/GZBmogXTx7 #Jobs
1873,1441806215727,0,0,1,0,off-topic,0,82,1825,Yoo swat just popped up at the scene
1874,1441806215727,0,0,1,0,off-topic,0,68,1826,Your all I ever wanted
1875,1441806215728,0,0,1,0,off-topic,1,76,1827,I want a s2k for a project car
1876,1441806215728,0,0,1,0,off-topic,0,107,1821,@doingitwells bruise on your bosom :'( http://t.co/H3V0Zu16m2
1877,1441806215728,0,0,1,0,off-topic,0,165,1822,The blood of thousands is on your hands. You can't buy our government and override the will of the people forever. @NRA
1878,1441806215729,0,0,1,0,off-topic,1,177,1818,2013 Women to Sara Spalding: As senior director of Microsofts New England Research and Development Center... http://t.co/C3uIsTTE5z
