3109,1441805395502,0,0,1,0,off-topic,0,183,3109,#security checkpoint outside Cathedral of the Holy Cross much like at the airport. Metal detectors and inspectors. http://t.co/RdXBdv6Www
3110,1441805395502,0,0,1,0,off-topic,0,138,3110,@bran_alvarez it doesn't concern you I didn't know it was Jordan and Brandon hop off my dude
3111,1441805395503,1,0,1,0,on-topic,1,114,3111,I've never felt so safe yet so scared all in one time. #BostonStrong
3112,1441805395503,0,0,1,0,off-topic,0,93,3112,@jadd_dem it's a legit house daddy has pictures
3113,1441805395504,0,0,1,0,off-topic,1,84,3113,Jamie Foxx's speech was a force though
3114,1441805395505,0,0,1,0,off-topic,1,122,3114,@unexplainablexo: Broke my phone even more .. Smfhomfg -.- Let me kill you !
3115,1441805395505,0,0,1,0,off-topic,0,73,3115,Your new bitch my old bitch
3116,1441805395506,0,0,1,0,off-topic,1,120,3116,I hope #oomf don't think my last tweet was about her cause it wasn't lmfao
3117,1441805395506,0,0,1,0,off-topic,0,119,3117,@taylor_dunagan: I want to meet myself from someone else's point of view.
3118,1441805395507,0,0,1,0,off-topic,1,86,3118,WAIT SOMEONE TELL ME WHAT HAPPENED !!!!!
3119,1441805395508,0,0,1,0,off-topic,1,77,3119,Chipotle would be sex right now
3120,1441805395508,0,0,1,0,off-topic,0,106,3120,the first thing she asks for is cookie dough ice cream haha.
3121,1441805395509,0,0,1,0,off-topic,1,172,3121,Aww le boo  @flygerian2funny: @JenniesSweetz you can't respect me anymore Shey? Shut up and callin me names? Lemme jam you tho
3122,1441805395509,1,0,1,0,on-topic,0,180,3122,Marathon Bombing Victim, 8, Recalled As Spirited: BOSTON  Neighbors and friends remembered 8-year-old Boston... http://t.co/pvmPms70yy
3123,1441805395510,0,0,1,0,off-topic,1,116,3123,@Thiskidmook that's ok your the one who's gunna have to look at it lol
3124,1441805395510,0,0,1,0,off-topic,0,161,3124,@reidjjackson didn't see you as a quitter, Reid.... my eyes are burning and my brain is mush. What the fucking fuck
3125,1441805395511,0,0,1,0,off-topic,1,108,3125,Need plans about to ran away for the day super bored right now
3126,1441805395511,0,0,1,0,off-topic,0,71,3126,I freaking hate this girl
3127,1441805395512,0,0,1,0,off-topic,1,116,3127,@berksie21147 @cmnazo I wouldn't believe either. Must be a video game?
3128,1441805395513,0,0,1,0,off-topic,1,79,3128,Can i replay last night? #amazing
3129,1441805395513,0,0,1,0,off-topic,0,146,3129,What others names do u have apart from whore, ho which ur dumbass sef calls hoe, u no like cutlass .
3130,1441805395514,0,0,1,0,off-topic,1,148,3130,Good. This is a cluster fuck RT @kellymacfarland: @LPizzle @danicaps on lockdown but hanging in there.
3131,1441805395514,0,0,1,0,off-topic,0,100,3131,Calling Michael, Marquisse Jordan  he hates that shit.
3132,1441805395515,0,0,1,0,off-topic,1,106,3132,@ataiznunna_ figure what out lmao and http://t.co/VFUV2XjUQk
3133,1441805395515,0,0,1,0,off-topic,0,95,3133,@kinky: We all have that one ex that changed us..
3134,1441805395516,0,0,1,0,off-topic,1,76,3134,Why must he be sooo selfish ?!
3135,1441805395517,0,0,1,0,off-topic,1,112,3135,Tie up your scarf real tight. These boys are out for blood tonight
3136,1441805395517,1,0,1,0,on-topic,0,131,3136,The Bruins game better not get cancelled. We all need something to get away from this
3137,1441805395518,0,0,1,0,off-topic,1,127,3137,@Bill_Nye_Tho__ this made me laugh for the first time since yesterday. thank you.
3138,1441805395518,0,0,1,0,off-topic,0,148,3138,To the girl at the mall wearing a backpack that says grenade on it in huge letters- you're a dumb fuck
3139,1441805395519,0,0,1,0,off-topic,1,77,3139,It's still written in the stars
3140,1441805395519,0,0,1,0,off-topic,0,93,3140,America has a big target on their back it seems
3141,1441805395520,0,0,1,0,off-topic,1,112,3141,@universalhub list of open #WiFi in #boston http://t.co/lM40PPwRCz
3142,1441805395521,0,0,1,0,off-topic,1,152,3142,@susantorres35 I literally just said to @jackweiland I don't know how people are watching this wo Twitter.
3143,1441805395521,1,0,1,0,on-topic,0,70,3143,Sad for my city  #Boston
3144,1441805395522,0,0,1,0,off-topic,1,174,3144,Getting to bottom of this, we had it for lunch. MT @Mcconvillematic That's a lie I was there. I looked for a solid 30-40 minutes
3145,1441805395522,0,0,1,0,off-topic,0,98,3145,@Rico_WDE16 @AnaleeS6 yeah we're fine thanks mane!!!
3146,1441805395522,0,0,1,0,off-topic,0,137,3146,@JonnyArakelian @mikefreeman26 @christian_lilly @sammybarron4 ok your all annoying #goodbye
3147,1441805395523,0,0,1,0,off-topic,1,120,3147,Oh my goodness I didn't acknowledge my 500th tweet!! #Special #TwitterGame
3148,1441805395523,0,0,1,0,off-topic,0,180,3148,What are your goals?  Do you write them down?  It may sound silly to you, but THE most successful people write their goals, and why...
3149,1441805395524,0,0,1,0,off-topic,1,110,3149,@GetABiggerBoat he's in Arlington and will be home in two weeks!
3150,1441805395524,0,0,1,0,off-topic,0,131,3150,okay well here goes a very very long day of hell taking care of evil little children.
3151,1441805395525,0,0,1,0,off-topic,1,83,3151,I can never sleep past 10 anymore -.-
3152,1441805395525,1,1,1,1,on-topic,0,180,3152,The world's media assembled for first #bostonmarathon #explosions update. #Boston #BostonBombings LIVE on @NECN http://t.co/zEm0uww92s
3153,1441805395525,0,0,1,0,off-topic,0,90,3153,You ain't the only one tryna be the only one
3154,1441805395526,0,0,1,0,off-topic,1,118,3154,@TheFunnyTeens: I say i don't know to everything when I'm in a bad mood.
3155,1441805395527,0,0,1,0,off-topic,1,128,3155,@ashhayers @mickyadams3 hangout with me on Thursday bitches! Lets do something fun
3156,1441805395527,0,0,1,0,off-topic,0,111,3156,Seeing evil dead... A little nervous. @beccabishop27 @dantesmall_
3157,1441805395528,0,0,1,0,off-topic,1,100,3157,Obama you didn't say it any better  Not here in Boston
3158,1441805395529,0,0,1,0,off-topic,1,176,3158,Alkermes touts positive Phase 2 results of depression drug: Alkermes plc (Nasdaq:ALKS) released positive... http://t.co/EQarvpRmOa
3159,1441805395530,0,0,1,0,off-topic,1,76,3159,Up for 26 1/2 hours, you guys.
3160,1441805395531,0,0,1,0,off-topic,1,96,3160,I make every nigga irrelevant. I'm sex intelligent
3161,1441805395531,1,1,1,1,on-topic,0,184,3161,@BrooklynDecker they did it so that the public will stop using social media to relay what is happening on the scanners. For officer safety
3162,1441805395532,0,0,1,0,off-topic,1,106,3162,@TheGreatGlavino it could just be from this whole situation.
3163,1441805395532,1,0,1,0,on-topic,0,174,3163,Whoever would bomb this kind of happy, community day filled w love and support for strangers is a demon. #Boston #BostonMarathon
3164,1441805395532,1,1,1,1,on-topic,0,112,3164,Reallly wish my mom wasnt blocks away from watertown right now wtf
3165,1441805395533,0,0,1,0,off-topic,1,126,3165,@DFDeuce1 your fucking lucky Im in Boston right now cause I will break yor shit!
3166,1441805395533,0,0,1,0,off-topic,0,105,3166,Letss goo mcgary and robinson back for another year #GoBlue
3167,1441805395534,1,0,1,0,on-topic,1,159,3167,Feet away from the Kennedy's, world diplomats, and the Prez...nbd #bostonstrong #cathedral http://t.co/G6M2AhvgT9
3168,1441805395534,0,0,1,0,off-topic,0,91,3168,Now Becca sees my indirects i c u Becca i c u
3169,1441805395535,0,0,1,0,off-topic,1,100,3169,I hope nothing like this happen for the walk of hunger
3170,1441805395536,1,0,1,0,on-topic,1,177,3170,I thank God for saving me, close to my work today there were 2 explosions and I was still at work. God decided that wasn't my time.
3171,1441805395536,0,0,1,0,off-topic,0,101,3171,@RicanInBoston I was crying at my desk. This is fucked.
3172,1441805395536,0,0,1,0,off-topic,0,185,3172,@MyProtegee LOL you would choose Katherine over Elena #shitsreal Caroline is my favorite Vampire! Elena will be dismissed if she does that!
3173,1441805395537,0,0,1,0,off-topic,1,166,3173,Look Auntie Muslim fuck, your nephew's killed Americans. Lower your voice and suck start a shotgun. Or leave my country.
3174,1441805395537,1,0,1,0,on-topic,0,177,3174,This week started out filled with so much anticipation &amp; joy in the air. Stay safe #boston #BostonStrong http://t.co/HTm2X9Mz1K
3175,1441805395537,0,0,1,0,off-topic,0,149,3175,It's good, Jimmy. Thanks for checking in. @jimmyhuiquincy: @swtrgrl how's everything going at HQ today?
3176,1441805395537,1,1,1,1,on-topic,0,160,3176,Currently receiving text updates regarding Joey McIntyre's position in the Boston Marathon. http://t.co/0rO42IPs1l
3177,1441805395538,0,0,1,0,off-topic,1,100,3177,Just put my phone on the charger so I'm going to bed !
3178,1441805395538,0,0,1,0,off-topic,0,140,3178,They're advising people to stay indoors and my mom is dragging me to the mall...#dontwanttodie
3179,1441805395539,0,0,1,0,off-topic,1,133,3179,Getting anxious! Boarding my flight in ten, then it's #fiftyshadesofgrey the whole way!
3180,1441805395539,0,0,1,0,off-topic,0,108,3180,whoever did this should be tied up downtown and stoned #Maggot
3181,1441805395540,0,0,1,0,off-topic,1,137,3181,Headed back to LA LA land. (@ Terminal C - @bostonlogan w/ 5 others) http://t.co/ByKs8zgGI2
3182,1441805395540,0,0,1,0,off-topic,0,143,3182,@JahHills Abducted, drugged, brain refurbished. Who leaves home without their phone &amp; wallet?
3183,1441805395541,0,0,1,0,off-topic,1,120,3183,Highlight of the day: watching Michelle Obama being driven down Huntington
3184,1441805395541,0,0,1,0,off-topic,0,78,3184,@Dope_Giqqlesx u do the same hun
3185,1441805395542,0,0,1,0,off-topic,1,183,3185,@SavedByTheKelll: The fact that @Maaaggz just hunted me down and hugged me made my day so happy you're near me, see you tomorrow sunshine
3186,1441805395542,0,0,1,0,off-topic,0,109,3186,The awk moment when I forget where I put my stuff in the lib...
3187,1441805395542,0,0,1,0,off-topic,0,76,3187,Goin out to eat with my family
3188,1441805395543,0,0,1,0,off-topic,1,181,3188,Boston, folks. RT: @billy_baker: For no explicable reason, there is now a man outside the courthouse playing Amazing Grace on bagpipes.
3189,1441805395543,0,0,1,0,off-topic,0,139,3189,:(  @NotifyBoston: [CANCELLATIONS] #RedSox, #Bruins games + Big Apple Circus for Friday 4/19.
3190,1441805395544,0,0,1,0,off-topic,1,162,3190,@bjp no. we were just commenting on it, however. will check it out this week. loving this weather &amp; lunch walks.
3191,1441805395544,0,0,1,0,off-topic,0,92,3191,Whole top diamond bottom row gold @dantesmall_
3192,1441805395545,0,0,1,0,off-topic,1,134,3192,@iHateCourtneyB: Stupid ass Sister Charlotte ... Should've broken her other leg. really?
3193,1441805395545,0,0,1,0,off-topic,0,88,3193,Have you ever popped champagne on a plane?
3194,1441805395546,0,0,1,0,off-topic,1,72,3194,FUCK THIS AIRPORT MY NIGGA
3195,1441805395547,0,0,1,0,off-topic,1,157,3195,Holy fuck, just saw a video from last night shooting on 7 News... looks like a fucking war zone.. #BostonStrong
3196,1441805395547,0,0,1,0,off-topic,0,125,3196,@noellandry_: Everything you said to me was just a lie until you left basically
3197,1441805395548,0,0,1,0,off-topic,1,158,3197,@walternebedum Least productive day ever. I'm working up to hour 14 of continuous news coverage. I need a drink.
3198,1441805395548,0,0,1,0,off-topic,0,160,3198,@ChampagneRod119: http://t.co/iHSEzYqgC3  @JoeyBenjamins I appreciate the help bro we all we got (in my Ben voice)
3199,1441805395548,0,0,1,0,off-topic,0,170,3199,Revound and I'm so sick of everyone's bullshit. It's all about me from now on, so suck my fucking dick if you don't like it.
3200,1441805395548,1,0,1,0,on-topic,0,83,3200,Boston is way too quiet for my liking
3201,1441805395549,0,0,1,0,off-topic,1,103,3201,@TheOnlyLincoln7 come talk to me when u way less than 250
3202,1441805395550,0,0,1,0,off-topic,1,137,3202,@universalhub Still weird...or maybe I watch &amp; read too many CSI, Criminal Minds etc ;)
3203,1441805395550,0,0,1,0,off-topic,0,109,3203,@kenzieflanigan hahaha oh boy. Tell her it will surely be okay!
3204,1441805395551,0,0,1,0,off-topic,1,182,3204,I can't believe that after Marotta got Lichtsteiner,Vidal,Barzagli,Bonucci, Pirlo,Pogba for less than Melo/Amauri he is still questioned
3205,1441805395551,0,0,1,0,off-topic,0,142,3205,Why is random people following me? Shit let it be one of my friend when i was in k1 or some shit
3206,1441805395551,0,0,1,0,off-topic,0,119,3206,#Boston @ Boston Logan International Airport (BOS) http://t.co/U3eyQElhFv
3207,1441805395552,0,0,1,0,off-topic,1,143,3207,@Rhea_EdgeZimmer YOUR NAME IS RHEA OMG SO IS MINE. CAN WE BE BESTFRIEND FOREVER IT WAS MENT TO BE
3208,1441805395552,0,0,1,0,off-topic,0,118,3208,I'm freezing in the lecture hall and my professor is putting me to sleep
3209,1441805395553,0,0,1,0,off-topic,1,77,3209,Well I've been drunk since noon
3210,1441805395554,0,0,1,0,off-topic,1,145,3210,@TheFireTracker2 The lone wolf thoery is HIGHLY unlikely considering the locations and coordination
3211,1441805395554,1,0,1,0,on-topic,0,112,3211,Confounded but not consumed - Rev Liz Walker #bostonstrong #Boston
3212,1441805395555,0,0,1,0,off-topic,1,105,3212,Sounds like its the Brown asshole on the run. CATCH HIM!!!!
3213,1441805395555,0,0,1,0,off-topic,0,124,3213,Can't Hold Us music video is best music video since And We Danced. #motherMary
3214,1441805395556,0,0,1,0,off-topic,1,138,3214,I love #UBurger #Boston #bacon #bbq #cheeseburger #heavenly @ UBurger http://t.co/lSCZvziMu7
3215,1441805395556,0,0,1,0,off-topic,0,83,3215,@michelledeidre he better be alive!!!
3216,1441805395557,0,0,1,0,off-topic,1,77,3216,Someone needs to cook for me ..
3217,1441805395558,0,0,1,0,off-topic,1,85,3217,After last night, I think I need rehab.
3218,1441805395559,0,0,1,0,off-topic,1,150,3218,Yoga capris, hair up, and a tee.  Did I just roll out of bed or am I going to the gym? You never know...
3219,1441805395559,1,0,1,0,on-topic,0,176,3219,Witnessing terrorism like this puts my life in perspective. Never take advantage for what you have. Always take pride in your city
3220,1441805395559,0,0,1,0,off-topic,0,129,3220,@hollaAtCHEAgirl @mattellis15 @a_kais  So incredibly grateful! Literally lifesavers
3221,1441805395560,0,0,1,0,off-topic,1,174,3221,Most people think about people they like/want/have or stresses in their life...I think about MGK. And meeting him. And the show.
3222,1441805395560,0,0,1,0,off-topic,0,113,3222,@_Dorothy34: Hope my cousin @adwoaaaaa is okay  I'm good thanks bbg
3223,1441805395561,0,0,1,0,off-topic,1,107,3223,she know even if I'm fucking with her I don't really need her
3224,1441805395561,1,0,1,0,on-topic,0,85,3224,Tight security in the hospital district
3225,1441805395562,0,0,1,0,off-topic,1,177,3225,Spring has finally sprung.  Dropping boys at Lax. (@ Gillette Stadium) http://t.co/rzZGbYvpSS Jealous they are going on Pats field.
3226,1441805395562,0,0,1,0,off-topic,0,140,3226,@uh_leeshh_uh @lisamarie885 @keshasuxx ...can we just come up w another excuse to wear tutus??
3227,1441805395563,1,0,1,0,on-topic,1,85,3227,Crazy I was 200 feet away from the bomb
3228,1441805395563,0,0,1,0,off-topic,0,186,3228,Trying to be happy by accumulating possessions is like trying to satisfy hunger by taping sandwiches all over your body #quote #georgecarlin
3229,1441805395563,1,0,1,0,on-topic,0,108,3229,Not sure what it was. Sounded like a Loud pop. #BostonMarathon
3230,1441805395564,0,0,1,0,off-topic,1,123,3230,abandinnd at home all alone where da strippers and bananas at?????? #ThuRsdAy
3231,1441805395565,0,0,1,0,off-topic,1,184,3231,This piece of shit has already affected so many people's lives. Prolonging it and affecting an entire city's workday..turn yoself in bitch
3232,1441805395565,0,0,1,0,off-topic,0,125,3232,Thank you everyone for checking up on me. I have the best friends in the world.
3233,1441805395566,0,0,1,0,off-topic,1,123,3233,I can't believe I'm literally watching this happen right now with my own eyes
3234,1441805395567,0,0,1,0,off-topic,1,82,3234,I just want all of this to be over..
3235,1441805395567,1,0,1,0,on-topic,0,141,3235,My prayers go to the victims of the #bostonmarathon explosion. #PrayForBoston #PrayersForBoston
3236,1441805395568,0,0,1,0,off-topic,1,74,3236,Hair up in a bun type of day
3237,1441805395569,0,0,1,0,off-topic,1,84,3237,@MBarry197 ik I didn't say he was dead
3238,1441805395569,0,0,1,0,off-topic,0,158,3238,I have an abusive boyfriend :-(  he twisted my wrist now watch when he wakes up imma stab him with his own knife
3239,1441805395570,1,1,1,1,on-topic,1,113,3239,Remember when Watertown is right next to where I live? Just praying
3240,1441805395570,0,0,1,0,off-topic,0,82,3240,Im in that polo t guccie sweat pants
3241,1441805395571,0,0,1,0,off-topic,1,163,3241,@lukeyb1987 @lutherwray26 that was going to be my tweet but thought wasnt in gd taste. Its only 3 miles from my house
3242,1441805395572,0,0,1,0,off-topic,1,154,3242,If this kid is still alive, he is probably so terrified. As a 19 year old, how can you even understand this.
3243,1441805395572,0,0,1,0,off-topic,0,92,3243,@ash_Eballs69 happy birthday!! Have a good one
3244,1441805395573,1,0,1,0,on-topic,1,162,3244,Cops are on every corner in #boston sirens keep going off. I sure as f hope a serious lead comes on these 2 suspects
3245,1441805395573,0,0,1,0,off-topic,0,125,3245,Drawing 2 final #finished #yes @ Northeastern University http://t.co/kMsY7bYGgw
3246,1441805395573,1,0,1,0,on-topic,0,121,3246,That is so messed up people putting bombs in trash cans during the marathon
3247,1441805395574,0,0,1,0,off-topic,1,135,3247,6 celcius outside! Nice fire place to warm myself. @ Hotel Marlowe http://t.co/akNBsL0YKm
3248,1441805395574,0,0,1,0,off-topic,0,137,3248,@anjulifatima yeah we're ok. Are your fam/friends ok? @CarolinaBerryB lives in Houston now!
3249,1441805395575,1,0,1,0,on-topic,1,172,3249,One of the many reasons I love Amy Poehler: @HPGoodNews: WATCH: Amy Poehler's message of love to Boston http://t.co/7K3zDZGFR8
3250,1441805395575,0,0,1,0,off-topic,0,142,3250,Correction, officer says what went over the wire was that one device in mailbox, one in trashcan
3251,1441805395575,1,0,1,0,on-topic,0,150,3251,@BrandonSmithCEO thanks for the Retweet can I please get a #followback from you thank you #prayforboston
3252,1441805395576,0,0,1,0,off-topic,1,183,3252,Thermo Fisher to buy Life Technologies for $13.6B: Thermo Fisher Scientific Inc. has offered to pay about $13.6... http://t.co/e6ndzdQAvn
3253,1441805395585,0,0,1,0,off-topic,9,98,3253,@alisahalis I'm in Brighton- this is nuts! Are u ok?
3254,1441805395586,0,0,1,0,off-topic,1,74,3254,My last final is on May 21st
3255,1441805395587,0,0,1,0,off-topic,1,80,3255,@meganappleseed You got that right
3256,1441805395588,0,0,1,0,off-topic,1,93,3256,Wait I'm so happy my Twitter says 10k now #swqp
3257,1441805395589,0,0,1,0,off-topic,1,183,3257,Any number of reasons to appreciate Robinson: On April 15, 1947, Jackie Robinson not only made history but also... http://t.co/fHcQ7nHHNw
3258,1441805395589,0,0,1,0,off-topic,0,126,3258,I've came to the conclusion that i only have a handful of friends ... Barely lol
3259,1441805395590,0,0,1,0,off-topic,1,145,3259,Does anyone want to work starting next week for free tanning through the end of may ? @WickedTans67
3260,1441805395590,0,0,1,0,off-topic,0,95,3260,@SoSoSophanavy funny guy eh? You across the city!
3261,1441805395591,0,0,1,0,off-topic,1,158,3261,I'm at Fenway Park - @mlb for Tampa Bay Rays vs Boston Red Sox (Boston, MA) w/ 132 others http://t.co/vx6vwJJpYQ
3262,1441805395591,0,0,1,0,off-topic,0,104,3262,@JessIndeed_ its not nice at all lol and who you got mimes
3263,1441805395592,0,0,1,0,off-topic,1,115,3263,@omgthatspunny: If you were a triangle you'd be acute one. @zessburke
3264,1441805395592,1,0,1,0,on-topic,0,177,3264,University service of healing #bostonmarathon #prayforboston (@ Boston University Marsh Chapel - @bu_tweets) http://t.co/nYgiTWa4Wy
3265,1441805395771,0,0,1,0,off-topic,179,70,3265,Miami Pon La Webcam &gt;
3266,1441805395773,0,0,1,0,off-topic,2,88,3266,I don't know about you but I'm feeling 22.
3267,1441805395774,0,0,1,0,off-topic,1,179,3267,Realistically though you haven't been dating your boyfriend as long as you make it seem , so maybe he turned a hoe into a housewife..
3268,1441805395774,0,0,1,0,off-topic,0,165,3268,@InstaAntGram: #titanic #frenchgirls #idiot #funny #humor #vineportraits #comedy #loop https://t.co/8HwWwW2sR7 oh la la
3269,1441805395775,0,0,1,0,off-topic,1,99,3269,News conference in Boston Commons. Stay tuned. @WCSH6
3270,1441805395776,0,0,1,0,off-topic,1,78,3270,My contacts kill my eyes #owwwie
3271,1441805395777,0,0,1,0,off-topic,1,174,3271,#RiseandShine novemberproject best way to start your Wednesday with lots of hugs &amp; a great #workout @ http://t.co/1mo9sCklKt
3272,1441805395777,0,0,1,0,off-topic,0,125,3272,Hamburger on the run #onlymarathonmonday @ Dunkin Donuts http://t.co/KZlbNJ8x5i
3273,1441805395778,0,0,1,0,off-topic,1,118,3273,@Dat_Kid_Joey54: Anyone want to be my friend ?? Meeeeeee ! *raises hand*
3274,1441805395778,0,0,1,0,off-topic,0,134,3274,Remembering watching @MBascom2 pass out at the FHS blood drive two years ago... #Classic
3275,1441805395779,0,0,1,0,off-topic,1,110,3275,@EricHolden5 was cock blocked bc of @CBork21 #ForcingIt @Mdele07
3276,1441805395961,0,0,1,0,off-topic,182,102,3276,What is your issue right now? Stay out of this. #likewut
3277,1441805395962,0,0,1,0,off-topic,1,184,3277,@Dst_pLatanero: shit like this only happen when we dont have school -.-you tryna say you want it to happen anywaysjust when were in school
3278,1441805395963,0,0,1,0,off-topic,1,73,3278,Can I get some grenades to?
3279,1441805395966,0,0,1,0,off-topic,3,97,3279,Fucking aggrivated !!!!!!!!!!! . Im about to be out
3280,1441805395968,0,0,1,0,off-topic,2,107,3280,About to go take a shower !      .. But idk what to wear.  ?!
3281,1441805395969,0,0,1,0,off-topic,1,93,3281,Going to the last shot in sweats to drink a keg
3282,1441805395970,0,0,1,0,off-topic,1,99,3282,@stopdreeming yessss black. claim it, be proud like I
3283,1441805395972,0,0,1,0,off-topic,2,190,3283,Love is unconditional. It's about forgiveness, understanding, comfort, trust, loyalty, strength, &amp; finding perfection through anothers flaws
3284,1441805395972,0,0,1,0,off-topic,0,96,3284,Wish I still had a reason to stay up until 3 am...
3285,1441805395973,0,0,1,0,off-topic,1,154,3285,I'm fine ,thanks to all of u for ur private messages me and my family we are okey  I appreciate you all  :-)
3286,1441805395973,0,0,1,0,off-topic,0,117,3286,@BeautySupreme if she cheats on him I'm going to possibly throw things.
3287,1441805395974,1,1,1,1,on-topic,1,184,3287,@billy_baker: Boston Globe photographers are delivering incredible images right now. http://t.co/keZEvIVqZf the 2nd pic is our frontyard..
3288,1441805396147,1,0,1,0,on-topic,173,171,3288,@Boston_Police: #CommunityAlert: Gov Patrick says the stay indoor request has been lifted and MBTA service has been restored.
3289,1441805396147,0,0,1,0,off-topic,0,124,3289,#boston #cruise #fun #college #party @ Spirit of Boston http://t.co/NNXmMAYXtr
3290,1441805396148,0,0,1,0,off-topic,1,149,3290,I get sad when my mom goes to bed, I feel like I have nobody to talk to :/ .. Yes I love my mother lol.
3291,1441805396149,0,0,1,0,off-topic,1,123,3291,Call me by my government name &amp; ill never talk to you again. #Ihatemyname
3292,1441805396149,0,0,1,0,off-topic,0,144,3292,@carlymetz dude that's so scary... I'm glad it's not you. She's been in there for like 15 minutes.
3293,1441805396150,0,0,1,0,off-topic,1,98,3293,I just tell the truth so I'm cool in every hood spot
3294,1441805396151,0,0,1,0,off-topic,1,111,3294,@donovanEMC at the warehouse in sobo, i'll forward you the invite
3295,1441805396152,0,0,1,0,off-topic,1,119,3295,@emmanedell13 Ik Ik, but ppl are getting ma at Russia, Russia is our ally
3296,1441805396153,1,0,1,0,on-topic,1,102,3296,So many friends could have been in the area. Very scary.
3297,1441805396155,0,0,1,0,off-topic,2,80,3297,The sun goes down and so does she.
3298,1441805396156,1,0,1,0,on-topic,1,117,3298,@KacieFOX29 I have never seen the city so empty. http://t.co/VrI9mSstSO
3299,1441805396158,0,0,1,0,off-topic,2,175,3299,@stillinthewater IKR ): I'm trying I think of one good thing and the only thing is my dog but I don't think cami helps Texas much
3300,1441805396335,0,0,1,0,off-topic,177,139,3300,@FoOzTV no worries was just making sure this was indeed the case and i just hadn't missed it.
3301,1441805396336,0,0,1,0,off-topic,1,163,3301,On our phones on twitter instead of talking to real people #AlphaThetaInsecurities @evagach @lcbrown91 @emilylaughren
3302,1441805396336,0,0,1,0,off-topic,0,117,3302,Ugh daylight is playing upton, ma tonight and I really want to goooooo.
3303,1441805396336,0,0,1,0,off-topic,0,142,3303,So there isnt gonna be a pair of scoring title kd 5 this year :( thats if there was going to be.
3304,1441805396337,0,0,1,0,off-topic,1,76,3304,haven't tweeted in bad long ..
3305,1441805396338,0,0,1,0,off-topic,1,71,3305,tomorrow's gonna be 69 :D
3306,1441805396339,1,0,1,0,on-topic,1,155,3306,Classy move by the city of Chicago. Thank you Chi-town! #prayforboston #bostonmarathon http://t.co/rEiSpRxrtn
3307,1441805396339,0,0,1,0,off-topic,0,78,3307,Days are only getting worst man.
3308,1441805396340,1,0,1,0,on-topic,1,77,3308,I'm happy they got that asshole
3309,1441805396340,0,0,1,0,off-topic,0,181,3309,Love you more than anything sweety and I'm soo glad to have you in my life @Alaagaladari: @FatimaGaladari only because you asked me to.
3310,1441805396341,1,0,1,0,on-topic,1,125,3310,Who the FUCK bombs a marathon? Honestly? My thoughts go out to anyone effected.
3311,1441805396522,0,0,1,0,off-topic,181,160,3311,@NBCNews: Today was a 'shameful day for Washington,' Obama says after background check bill fails Tell em Barack!!
3312,1441805396523,0,0,1,0,off-topic,1,88,3312,I always wake up singing a different song.
