1679,1441805376271,1,0,1,0,on-topic,1,182,1679,RT @YAppelbaum: Trying to explain to my kids why we're staying inside, as police escort a busload of SWAT officers...Tough conversation.
1680,1441805376271,0,0,1,0,off-topic,0,115,1680,Drinks for the birthday betch @case418 @ Alibi http://t.co/gIZdxFJz8g
1681,1441805376635,0,0,1,0,off-topic,364,135,1681,@marypiskule nice! Now I know I can do that when I have future embarrassing questions lol
1682,1441805376635,0,0,1,0,off-topic,0,83,1682,How illiterate you are is disturbing.
1683,1441805376636,0,0,1,0,off-topic,1,99,1683,@Hello_KieaxD lmao damn I'm rise ooh well that's life
1684,1441805376636,0,0,1,0,off-topic,0,155,1684,Summer is almost here. And I want to me in my shorts and bikini  Taydolashes@gmail.com http://t.co/lFJY8RuaBs
1685,1441805376636,0,0,1,0,off-topic,0,142,1685,I'm at @BostonLogan International Airport (BOS) (Boston, MA) w/ 58 others http://t.co/md5MLY5vPK
1686,1441805376636,0,0,1,0,off-topic,0,99,1686,Gym time baby   @ Roxbury YMCA http://t.co/m9UWRWw5vn
1687,1441805376637,1,0,1,0,on-topic,1,119,1687,Dear Terrorist Scum, get out of my city. Sincerely, aggregated Bostonian.
1688,1441805376637,0,0,1,0,off-topic,0,109,1688,Oh hey cgfiore @ Christian Science Plaza http://t.co/xIVMFvCIdE
1689,1441805376637,0,0,1,0,off-topic,0,86,1689,Are you going to the game today @sachem9
1690,1441805376638,0,0,1,0,off-topic,1,106,1690,@MON_ster8614 I've taught you well. You're making mama proud
1691,1441805376638,0,0,1,0,off-topic,0,155,1691,No kidding @DouthatNYT: This @sullydish reader email is a very rich cultural artifact: http://t.co/msFQXuwK52
1692,1441805376638,0,0,1,0,off-topic,0,100,1692,RT @XSTROLOGY: #Leo's are proud, honest, and generous.
1693,1441805376638,0,0,1,0,off-topic,0,177,1693,pops taught me to look a man in his eye, all u gut is ur balls an pride ,have faith sum ones watchen in the sky ,an be ready to die
1694,1441805376639,0,0,1,0,off-topic,1,111,1694,@yrameisor what you should do is bring  me back a great souvenir.
1695,1441805376639,0,0,1,0,off-topic,0,76,1695,Wish i was good enough for you
1696,1441805376639,1,0,1,0,on-topic,0,141,1696,Waiting to see El Presidente #bostonstrong @ Cathedral Of The Holy Cross http://t.co/M5WJDfrqv1
1697,1441805376639,0,0,1,0,off-topic,0,133,1697,Honestly...i just wanna fuck...but apparently thats too much to ask for as a female....
1698,1441805376640,0,0,1,0,off-topic,1,91,1698,what do you think provoked this being loosers
1699,1441805376640,0,0,1,0,off-topic,0,89,1699,Tatted on my stomach, rich forever Makaveli
1700,1441805376640,1,1,1,1,on-topic,0,155,1700,Seems like they're searching for more people... You already shot 1 suspect, caught 1 suspect... THERE'S MORE?
1701,1441805376640,0,0,1,0,off-topic,0,84,1701,I'm very tired to day to much work !!!
1702,1441805376641,0,0,1,0,off-topic,1,111,1702,Clearest image yet of possible 2nd suspect http://t.co/0cHPfifcgj
1703,1441805376641,0,0,1,0,off-topic,0,132,1703,I'm at The Fairmont Copley Plaza - @fairmonthotels (Boston, MA) http://t.co/LNu6loIzBQ
1704,1441805376641,0,0,1,0,off-topic,0,83,1704,All of you on nice weather fuck y'all
1705,1441805376642,0,0,1,0,off-topic,1,168,1705,CNN posted my images of this sad tragedy in their website and headline. -Thank you, @ Copley Square http://t.co/MsuUQOx5k8
1706,1441805376642,0,0,1,0,off-topic,0,118,1706,I am screwed!!! Two exams coming next week! I only have 3 days left!! :/
1707,1441805376642,0,0,1,0,off-topic,0,66,1707,I'm ready to be home
1708,1441805376642,0,0,1,0,off-topic,0,98,1708,@CommonWhiteGirI: my favorite study method is crying
1709,1441805376643,0,0,1,0,off-topic,1,94,1709,No Smoking In This Area. Unless it's good shit..
1710,1441805376643,1,1,1,1,on-topic,0,151,1710,Just headed out for a quick yog (soft j). 26.2 miles on the greatest course in the world. #BostonMarathon
1711,1441805376643,0,0,1,0,off-topic,0,81,1711,Or rather tac on me as in tactical.
1712,1441805376644,0,0,1,0,off-topic,1,71,1712,He needs to get down here
1713,1441805376644,0,0,1,0,off-topic,0,133,1713,@SarahhhK25 @jennhasss lmao this dick, I'm not workinnn I gots shit to do people to see
1714,1441805376644,0,0,1,0,off-topic,0,118,1714,When ya Nigga Go too court, now his phones not workingggg ughhhhhhhh !!!
1715,1441805376644,0,0,1,0,off-topic,0,76,1715,someone text me or something!!
1716,1441805376645,0,0,1,0,off-topic,1,174,1716,@nrlore @drivi86 and I were evacuated from towne and walked back to the south end.  Always felt safe ... Glad I was with my bro.
1717,1441805376645,0,0,1,0,off-topic,0,123,1717,@FarrahsBayou actual fuck tho? It's the pot calling the kettle obsidian black
1718,1441805376645,0,0,1,0,off-topic,0,186,1718,Retail store credit cards are worse than scabies. Take it from me, I'm forced to sell them. Sell your soul to Satan instead of getting them.
1719,1441805376645,0,0,1,0,off-topic,0,171,1719,Peak hours in Boston's Trending Topics for Wednesday 17 were at 11 am and 3 pm: http://t.co/HeV34D0dF2 http://t.co/vI9eRNyJmb
1720,1441805376645,1,0,1,0,on-topic,0,105,1720,Explosion in Boston marathon stopped http://t.co/ttNcvosRT8
1721,1441805376646,0,0,1,0,off-topic,1,160,1721,I'm in my sweatpants at an Asian seafood buffet in Quincy. I think I'm done w all the going out. I'm fuckin tired.
1722,1441805376646,0,0,1,0,off-topic,0,137,1722,@Brandeness @qqueenb that's subjective lol. Usually I'd argue the most morally sound people
1723,1441805376646,0,0,1,0,off-topic,0,100,1723,Don't mess with Jagr cuz you'll have to go throw Soupy
1724,1441805376646,0,0,1,0,off-topic,0,129,1724,RT if you would want to be my #anasister and text a bunch and help eachother! (USA)
1725,1441805376647,0,0,1,0,off-topic,1,65,1725,Just me and a goose
1726,1441805376647,0,0,1,0,off-topic,0,93,1726,@Drkylehughes yessir I am. But I'm safe though.
1727,1441805376647,0,0,1,0,off-topic,0,68,1727,Bangor bound in the am
1728,1441805376648,0,0,1,0,off-topic,1,161,1728,@roliepoly I have an extra ticket to Timeflies thursday at HOB.. You have tix? Or know someone who needs/wants one?
1729,1441805376648,1,0,1,0,on-topic,0,168,1729,Spread the love indeed, Boston. I love this city and this community. From the memorials people have http://t.co/3UopgHxaJZ
1730,1441805376648,0,0,1,0,off-topic,0,144,1730,I'm sorry to inform you but you do not have an ass.... So stop acting like you do #dismissyourself
1731,1441805376648,0,0,1,0,off-topic,0,149,1731,@fashionkilllla_: Girls love beyonce x Drake &gt;&gt;&gt;&gt;yes! And listen to ace hood fuck the world
1732,1441805376649,0,0,1,0,off-topic,1,113,1732,@_nickga yes let us heckle people trying to update others.  you ass
1733,1441805376649,1,0,1,0,on-topic,0,122,1733,Careful, no lifeguard on duty! @ 2013 Boston Marathon http://t.co/i4InOlfaqb
1734,1441805376649,0,0,1,0,off-topic,0,111,1734,I'm at The Milton Barber Shop (Milton, MA) http://t.co/Nhb4YiVM9a
1735,1441805376649,0,0,1,0,off-topic,0,75,1735,I'm being followed by deer...
1736,1441805376650,0,0,1,0,off-topic,1,82,1736,there's a monster in my room!!!!!!!!
1737,1441805376650,0,0,1,0,off-topic,0,138,1737,I really wish I could remember some of the ridiculous conversations I had last night #sloppy
1738,1441805376651,0,0,1,0,off-topic,1,98,1738,fuck it I'm not going to practice again #wasteoftime
1739,1441805376651,0,0,1,0,off-topic,0,148,1739,@AlexJAM4 okay! Ill figure things out tomorrow night. Cause idk what time I come back to Massachusetts
1740,1441805376651,1,0,1,0,on-topic,0,182,1740,HOLY Shalane. Literally every female spectator around me is bursting with pride. Strong finish at #BostonMarathon http://t.co/ayyqFqAhTY
1741,1441805376651,0,0,1,0,off-topic,0,102,1741,Chillin at The Sports Club/LA for the day, not even mad.
1742,1441805376652,0,0,1,0,off-topic,1,126,1742,@SaadSJ1 @ahmedhrt believe me Saad! It is one of his DARKEST moments in his LIFE
1743,1441805376652,0,0,1,0,off-topic,0,111,1743,@Cloud99_ Lmfaoo I knew you would say something nigga . Lmaooo :D
1744,1441805376652,1,1,1,1,on-topic,0,132,1744,It's really 70's weather outside right now . Thanks to this mofo no one can enjoy it .
1745,1441805376653,0,0,1,0,off-topic,1,94,1745,@YourBoyBarney: All these bitch nigga get me mad
1746,1441805376653,0,0,1,0,off-topic,0,166,1746,Panera Bread #Hospitality #Job: Shift Supervisor ( #Franklin , MA) http://t.co/Z8UE1agEJS #VeteranJob #Jobs #TweetMyJobs
1747,1441805376653,1,0,1,0,on-topic,0,167,1747,@Top_29 've seen fuck Muslims and Russians all over my newsfeed, idk if it has to do with their country but still #FuckEm
1748,1441805376653,0,0,1,0,off-topic,0,85,1748,Did everyone get there nails done today
1749,1441805376654,1,0,1,0,on-topic,1,147,1749,So surreal. Crazy packed with cops. Stay safe everyone #Boston @ Boston Common http://t.co/QUPeu0d4Hi
1750,1441805376654,0,0,1,0,off-topic,0,93,1750,what a coincidence that were both here together
1751,1441805376655,0,0,1,0,off-topic,1,153,1751,@BecauseIHadToo yea. You coulda found that eventually. If u said like h.o 280. Some ppl would of given 300$
1752,1441805376655,0,0,1,0,off-topic,0,182,1752,I wish it were acceptable for me to walk around shoving my headphones in people's ears so they could hear the awesome music that I find.
1753,1441805377025,0,0,1,0,off-topic,370,165,1753,If battle scars comes on the radio I turn my radio all the way up and sing at the top of my lungs  I love this song tho
1754,1441805377026,0,0,1,0,off-topic,1,101,1754,@lilmamaxoxo111 your just mean! Dont talk to me no more
1755,1441805377026,0,0,1,0,off-topic,0,112,1755,I like to be a little scary with them. Like 'Boo, here's my dick!'
1756,1441805377026,0,0,1,0,off-topic,0,174,1756,#Marketing #Job in #Dedham , MA: Communications Manager - Dedham, MA at Citizens Financial Group http://t.co/uaUw7qhRhT #cfgjobs
1757,1441805377026,0,0,1,0,off-topic,0,77,1757,It's not too early for dreamin'
1758,1441805377027,0,0,1,0,off-topic,1,105,1758,I'm at @SantarpiosPizza (Boston, MA) http://t.co/b3j7RXbM3t
1759,1441805377027,0,0,1,0,off-topic,0,177,1759,This check-in is dedicated to @atrain13 (@ Barcelona Restaurant and Wine Bar - @barcelonawineba w/ 4 others) http://t.co/DUNaq1Ajw5
1760,1441805377027,1,0,1,0,on-topic,0,149,1760,http://t.co/A4N3RWgvLW lots of information here on the #bostonmarathon #explosion with constant updates
1761,1441805377027,0,0,1,0,off-topic,0,133,1761,Dessert first. Now it's time for lunch, Syrian bread, lentils and tabouli! Mmm. Cheers.
1762,1441805377028,0,0,1,0,off-topic,1,185,1762,Clay Buchholz keeps Rays at Bay: As the outs piled up, as the innings flew by, and as Clay Buchholz inched closer... http://t.co/tu46RWPoow
1763,1441805377028,0,0,1,0,off-topic,0,180,1763,This just proves that guns don't kill people, people kill people. We have hearts after tragedies but where are our hearts before them?
1764,1441805377028,0,0,1,0,off-topic,0,89,1764,@megabelbarros oh ok. Ill have to do that..
1765,1441805377028,1,1,1,1,on-topic,0,161,1765,Truly just traumatized by this week. Just being in this city during this horrible time has forever changed my life.
1766,1441805377029,0,0,1,0,off-topic,1,173,1766,Man at Back Bay newspaper stand says he has about doubled normal sales so far. Most buying @BostonGlobe. http://t.co/fmUMD3iZuC
1767,1441805377029,0,0,1,0,off-topic,0,99,1767,@_Edaawg that ain't shit I slept in a closet lmfaoooo
1768,1441805377029,0,0,1,0,off-topic,0,94,1768,@susan_lam2 yeah i will &lt;3 thanks susan &lt;3
1769,1441805377030,0,0,1,0,off-topic,1,95,1769,Avoid Callahan tunnel. Dead stop. Also I need gas
1770,1441805377030,0,0,1,0,off-topic,0,168,1770,Selfies during study with @sixteeen_ and @ayjayyy_ #selfie #gay #lonely #as #hell @ Foxborough High http://t.co/Z6y8C5V7AG
1771,1441805377030,0,0,1,0,off-topic,0,76,1771,Each month get worse each time
1772,1441805377031,0,0,1,0,off-topic,1,93,1772,I want to meet some of my followers. y'all cool
1773,1441805377031,1,0,1,0,on-topic,0,101,1773,No arrests. Nothing. Leaving Boston a little unsettled.
1774,1441805377031,1,0,1,0,on-topic,0,186,1774,I want this nightmare to be over. I want them to find him. And I do not feel safe returning to normal life with this psychotic on the loose.
1775,1441805377032,1,0,1,0,on-topic,1,174,1775,Rep. Keating: Explosions A Coordinated Attack: BOSTON (AP)  U.S. Rep. William Keating, a member of the... http://t.co/Y4uywNCgpx
1776,1441805377032,0,0,1,0,off-topic,0,116,1776,Now my side chick, my main chick, my main guhh ain't feelin me no more
1777,1441805377032,0,0,1,0,off-topic,0,110,1777,Channel 7 has live feed of a suspect down on the ground!!!!!!!!!
1778,1441805377032,0,0,1,0,off-topic,0,91,1778,@FranBre3zy your screams echoed tru the 'hood
1779,1441805377033,0,0,1,0,off-topic,1,97,1779,i got $20 ima buy me another pair of elite socks :)
1780,1441805377034,0,0,1,0,off-topic,1,102,1780,@SReddivari95 u cud learn a few things from sober people
1781,1441805377034,1,1,1,1,on-topic,0,137,1781,At the airport, flights delayed but not canceled. #Boston #BostonMarathon #BostonExplosions
1782,1441805377035,1,1,1,1,on-topic,1,183,1782,@TheFollowingFOX what will happen for people in Boston waiting to watch The Following? Breaking news is still on. Will there be a replay?
1783,1441805377036,0,0,1,0,off-topic,1,99,1783,It's a beautiful day where anything can happen #smile
1784,1441805377038,1,0,1,0,on-topic,2,121,1784,Globe flag at half-staff. #Boston @ The Boston Globe http://t.co/bxAIYRlziN
1785,1441805377039,1,0,1,0,on-topic,1,99,1785,In Watertown tho this is fuckin crazy #bostonweareone
1786,1441805377040,0,0,1,0,off-topic,1,128,1786,And honestly I have been begging for answers That you and only you can give to me.
1787,1441805377041,0,0,1,0,off-topic,1,104,1787,Really just kind of hit me how fucked up today really was.
1788,1441805377042,1,0,1,0,on-topic,1,182,1788,@sevlarochelle: Thankful my baby @OlDirtiiSlim was running late and didn't make it to the finish line.  I love you for checkin on me boo
1789,1441805377042,0,0,1,0,off-topic,0,83,1789,AND I WAS RIGHT YOU CHOSE HER OVER ME
1790,1441805377043,1,0,1,0,on-topic,1,118,1790,RT @Boston_Police: Taxi service in the City of Boston has been restored.
1791,1441805377043,0,0,1,0,off-topic,0,103,1791,@jillc543 I was just gonna tweet that about my stats test
1792,1441805377044,0,0,1,0,off-topic,1,152,1792,@ImALittleDizzy nah hahah I mean I could probably figure it out but like I wouldn't say I actually know...
1793,1441805377044,1,0,1,0,on-topic,0,167,1793,Praying for the officers and all people who continue to risk their lives to ensure the safety of others. #america #boston
1794,1441805377044,0,0,1,0,off-topic,0,132,1794,Closed Streetlight report at 80-82 Bayswater St http://t.co/yVR59cxhwn. Case resolved.
1795,1441805377044,0,0,1,0,off-topic,0,88,1795,I'm at MGH Core Lab http://t.co/JysdBVqhkw
1796,1441805377045,0,0,1,0,off-topic,1,186,1796,My sophomore year was probably the best I was on my shit doing my thang not much was going on plus I had shorty by my side always #RealNigga
1797,1441805377045,1,1,1,1,on-topic,0,176,1797,4/17 packed TD Garden before the National Anthem. Truly moving moment, amazing anthem #bruins #bostonstrong http://t.co/f69fqPeInE
1798,1441805377045,0,0,1,0,off-topic,0,134,1798,Someone bring me a dub to Rosi &amp; a Rollie. &amp; you must accept debit or credit lol
1799,1441805377045,0,0,1,0,off-topic,0,80,1799,To franklin field later to ball up
1800,1441805377045,0,0,1,0,off-topic,0,121,1800,Don't know why I'm so tired but u couldnt pay me to get outta bed right now
1801,1441805377046,0,0,1,0,off-topic,1,95,1801,I dont even know if I can braid like I use to lol
1802,1441805377046,0,0,1,0,off-topic,0,79,1802,I hope Steph curry takes the ship
1803,1441805377046,0,0,1,0,off-topic,0,136,1803,Same side sitters! #watertaxi #boatphone @ Boston Harbor Water Taxi http://t.co/wvMFdPLi2G
1804,1441805377047,0,0,1,0,off-topic,1,120,1804,@Seamheads I feel for all of the first responders. May God keep them safe.
1805,1441805377047,0,0,1,0,off-topic,0,71,1805,So is evil dead any good?
1806,1441805377048,0,0,1,0,off-topic,1,88,1806,Lol lyss is redder than a bell pepper dawg
1807,1441805377048,1,1,1,1,on-topic,0,185,1807,@Lifeis_baseball: He was running to support the kids from Sandy Hook, and now he will never run again #PrayForBoston http://t.co/42u0iyri0N
1808,1441805377048,0,0,1,0,off-topic,0,109,1808,@RepMichlewitz Glad you are okay. Thanks for everything you do.
1809,1441805377049,0,0,1,0,off-topic,1,129,1809,@Trevor_Truely I'm hip I told her that the apple don't fall far from the tree lmaoo
1810,1441805377603,0,0,1,0,off-topic,554,131,1810,@NicoleCallahan8 wtf I swear it was you you must havw a twin that drives the same car
1811,1441805377603,0,0,1,0,off-topic,0,139,1811,@irishnessa @nikioni we are ok. We happened to be downtown at the time. Like a block away. :/
1812,1441805377603,0,0,1,0,off-topic,0,74,1812,Underestimate me if you want
1813,1441805377604,0,0,1,0,off-topic,1,116,1813,Wanna get a milkshake from JP Licks but also want real food. #whattodo
1814,1441805377604,1,0,1,0,on-topic,0,86,1814,this is such a sick world #prayforboston
1815,1441805377604,1,1,1,1,on-topic,0,99,1815,@alyssa_millet safe inside right noww, thank you&lt;3
1816,1441805377605,0,0,1,0,off-topic,1,142,1816,Making a list of things to bake / videos to make before I move:) #kitchen #baking #onecutefoodie
1817,1441805377605,0,0,1,0,off-topic,0,102,1817,Get out of then kitchen so I can finish making my dinner
1818,1441805377605,0,0,1,0,off-topic,0,177,1818,2013 Women to Sara Spalding: As senior director of Microsofts New England Research and Development Center... http://t.co/C3uIsTTE5z
1819,1441805377605,0,0,1,0,off-topic,0,128,1819,@TheDogLB @c_lipz when you guys going? And are you scooping me? Lol but I might go
1820,1441805377606,1,0,1,0,on-topic,1,107,1820,My uncle is a Brookline Police Officer. #bostonstrong #boston
1821,1441805377606,0,0,1,0,off-topic,0,107,1821,@doingitwells bruise on your bosom :'( http://t.co/H3V0Zu16m2
1822,1441805377606,0,0,1,0,off-topic,0,165,1822,The blood of thousands is on your hands. You can't buy our government and override the will of the people forever. @NRA
1823,1441805377607,1,0,1,0,on-topic,1,157,1823,Talk about a rough week in Boston... Have to keep reminding ourselves the good outnumber the bad! #BostonStrong
1824,1441805377607,0,0,1,0,off-topic,0,171,1824,#Boston , MA #Marketing #Job: Sr. External Communications Consultant at Liberty Mutual Insurance http://t.co/GZBmogXTx7 #Jobs
1825,1441805377607,0,0,1,0,off-topic,0,82,1825,Yoo swat just popped up at the scene
1826,1441805377607,0,0,1,0,off-topic,0,68,1826,Your all I ever wanted
1827,1441805377608,0,0,1,0,off-topic,1,76,1827,I want a s2k for a project car
1828,1441805377608,1,0,1,0,on-topic,0,93,1828,Walking around Watertown... Sike #bostonbombing
1829,1441805377608,1,0,1,0,on-topic,0,111,1829,Waking up to CNN saying you are a city under siege #prayforboston
1830,1441805377609,0,0,1,0,off-topic,1,122,1830,Started from the bottom now my whole fuckin team is hammered #marathonmonday
1831,1441805377609,0,0,1,0,off-topic,0,78,1831,Goodbye Boston, I'll miss you :(
1832,1441805377609,0,0,1,0,off-topic,0,128,1832,@kasafc ah hah. Needed to take car. Otherwise I'd have walked or public transport.
1833,1441805377610,0,0,1,0,off-topic,1,101,1833,@M_Ro_Co @dhiggz247 no no that cant b right #SillyWomen
1834,1441805377610,0,0,1,0,off-topic,0,168,1834,@SAMH08_ nah ked im all set with u and ur lies at out friendship level u dnt need an invite if u cared enough ud just come
1835,1441805377610,0,0,1,0,off-topic,0,105,1835,Brad Marchand with the game winning goal in shoot out watch
1836,1441805377610,0,0,1,0,off-topic,0,121,1836,@therachel having issues getting call out. Try me. I will DM you my number.
1837,1441805377611,0,0,1,0,off-topic,1,144,1837,The Baseball team gets no love; fuck all you techboston Nd Dorchester kids. Dumb hood broke niggas
1838,1441805377611,0,0,1,0,off-topic,0,72,1838,@DaBashers half a mile max
1839,1441805377611,1,0,1,0,on-topic,0,129,1839,Violence in any form is senseless. Thinking of #boston #BostonStrong #prayforboston
1840,1441805377612,0,0,1,0,off-topic,1,139,1840,@Phuonglazie i think everything is normalised right now, so the situation should be fine now.
1841,1441805377612,1,0,1,0,on-topic,0,107,1841,This whole situation starting to remind me of the movie Salt.
1842,1441805377612,0,0,1,0,off-topic,0,96,1842,@simonepress federal courthouse being evacuated...
1843,1441805377613,0,0,1,0,off-topic,1,114,1843,I'm at Wellesley Dental Group (Wellesley, MA) http://t.co/Go3KghOtMC
1844,1441805377613,0,0,1,0,off-topic,0,116,1844,Happy birthday, Timmy, I'll always love you. Thank you for everything.
1845,1441805377613,0,0,1,0,off-topic,0,149,1845,You are much better off getting your Juve news and quotes from @ADP1113 than @footballitalia these days
1846,1441805377614,1,0,1,0,on-topic,1,132,1846,Just because you lived here for 11 years DOES NOT make you an American. #prayforboston
1847,1441805377789,1,0,1,0,on-topic,175,171,1847,Holy cow just watched the national anthem before the b's game at the garden. Talk about America chills!!! #usa  #bostonstrong
1848,1441805377790,0,0,1,0,off-topic,1,177,1848,@Jaxcash26 I have a little brother, that's terrible I can't imagine what that family is going through no reason to put me on blast.
1849,1441805377790,1,0,1,0,on-topic,0,141,1849,So proud and thankful for @Boston_Police and @MassStatePolice  #Boston #bostonstrong #watertown
1850,1441805377790,0,0,1,0,off-topic,0,146,1850,Uncle Aaron came to play! vincethefrenchie &amp; @hivesmasher @ LoPresti Park http://t.co/S5Vv415FZI
1851,1441805377790,0,0,1,0,off-topic,0,167,1851,Finally sitting down after a looooong day to crochet. Can't go to bed without knitting or crocheting a little each night!
1852,1441805377790,0,0,1,0,off-topic,0,103,1852,This school work is a nightmare and I just want it to end
1853,1441805377791,1,1,1,1,on-topic,1,186,1853,Being stuck I'm Boston right now with swat teams and police all over us.... Going to need an escort to get Out of here #bostonstrong #scared
1854,1441805377791,0,0,1,0,off-topic,0,81,1854,I wanna go to another Redsox game !
1855,1441805377791,0,0,1,0,off-topic,0,119,1855,Carol the mime, honey bun, zippers/ sweater vest, tan jan, Darcy, Charles
1856,1441805377791,0,0,1,0,off-topic,0,107,1856,@elisaa_rose Pearl follows me wth!? Wat kinda shit is that!!!
1857,1441805377792,0,0,1,0,off-topic,1,145,1857,@MrMakeHerSmile: People hate when you show them how it feels to be treated the way they treat you..
1858,1441805377792,0,0,1,0,off-topic,0,74,1858,Evil dead was a good movie !
1859,1441805377792,1,0,1,0,on-topic,0,169,1859,Some of Boston's Finest brought up on stage at the @HOBBoston by @Timeflies!! Fuckkn amazing. #bostonmarathon #bostonstrong
1860,1441805377793,0,0,1,0,off-topic,1,174,1860,Stop by Doyle's in JP for a #samsmithsalute event! Keep your glass tonight! @merchantduvin @ Doyle's Cafe http://t.co/BiaXrCih7J
1861,1441805377793,1,1,1,1,on-topic,0,121,1861,It's Marathon Monday in Boston. What am I doing? Still laying in bed. #lazy
1862,1441805377793,0,0,1,0,off-topic,0,112,1862,@JDubsBro no but I meant Muslims.. you know what I meant. shut up.
1863,1441805377793,0,0,1,0,off-topic,0,116,1863,@GreggyBennett pretty much seems like a movie around here unbelievable
1864,1441805377794,0,0,1,0,off-topic,1,184,1864,I will be with @GomezForMA at Henderson's Cafe at 8AM tomorrow. Proud to endorse him in #hwsen race. @JPhelps_SN @HamWenPatch @HWChronicle
1865,1441805377794,0,0,1,0,off-topic,0,107,1865,@NoRapist: Statistically, 9 out of 10 people enjoy gang rape.
1866,1441805377794,0,0,1,0,off-topic,0,117,1866,Maximize your time (@ Milton Hill Sport and Spa) http://t.co/qu0z4Oo6dH
1867,1441805377794,0,0,1,0,off-topic,0,141,1867,It's so pretty and nice out right now. Boston should be full of happy people, not a ghost town.
1868,1441805377795,0,0,1,0,off-topic,1,182,1868,Heavy security at South Station this morning, police and troopers with assault rifles, riot gear, and dogs. Marathon jackets everywhere.
1869,1441805378172,0,0,1,0,off-topic,377,116,1869,@kristen_ayers27 lmao I want too! But I might throw up if I see it lol
1870,1441805378172,0,0,1,0,off-topic,0,125,1870,@livv_montgomery @paigehollyx0 @CassidyG22 OMFG that just made me laugh so hard
1871,1441805378173,1,1,1,1,on-topic,1,112,1871,Boston's on locked but ask me if the hood ppl r still in the house
1872,1441805378173,0,0,1,0,off-topic,0,188,1872,it's a sign!!! @Fashionista_com: Dye-ing to switch up your style? Here's our ultimate guide to going &amp; staying red: http://t.co/V5DnbWp3uN
1873,1441805378173,0,0,1,0,off-topic,0,94,1873,@Yelle0896 I really think we need a day off no??
1874,1441805378174,0,0,1,0,off-topic,1,120,1874,Ubaldo Jimenez just hasn't lived up to expectations since leaving Colorado
1875,1441805378174,0,0,1,0,off-topic,0,130,1875,@AZEALIABANKS yessss finally no more ignorant bullshit clogging up my feed you HOBAG
1876,1441805378174,0,0,1,0,off-topic,0,104,1876,im done with humanity just gonna enjoy life till its over.
1877,1441805378174,0,0,1,0,off-topic,0,129,1877,Closed report at 73 Windsor St http://t.co/rNVLgOX13f. Case resolved. street swept.
1878,1441805378175,0,0,1,0,off-topic,1,127,1878,I need to find a girl thats ride or die and someone that i can treat like a queen
1879,1441805378175,0,0,1,0,off-topic,0,175,1879,#Marketing #Job in #Boston , MA: Internal Communications, Associate Consult... at Liberty Mutual Insurance http://t.co/01D5gGdHPP
1880,1441805378175,0,0,1,0,off-topic,0,143,1880,Sometimes you can see the ending before the tenure begins.   Smh!  Good luck with that one.  #wbb
1881,1441805378175,0,0,1,0,off-topic,0,115,1881,It's times like these when your true friends really shine #loveyouall
1882,1441805378176,0,0,1,0,off-topic,1,91,1882,@DonteStallworth  ty for all the info. Dam...
1883,1441805378176,0,0,1,0,off-topic,0,95,1883,@Raangz_2 @nwankalicious taxi service is down too
