1055,1441803347987,0,0,1,0,off-topic,0,168,1055,there's a difference between wanting to know for curiosity&amp; wanting to know &amp;doing something about it. #Difference
1056,1441803347987,0,0,1,0,off-topic,0,123,1056,The gunman still on the loose is my age. I wonder why he's doing all of this.
1057,1441803347987,0,0,1,0,off-topic,0,169,1057,@leonoradee either I'm having convos with who I'm dating in my head or I'm dating someone COMPLETELY in my head #MrZacEfron
1058,1441803347987,0,0,1,0,off-topic,0,152,1058,I will literally beat a westboro baptist church member with a bat  #AreYouSerious #Disrespectful #Scumbags
1059,1441803347988,0,0,1,0,off-topic,1,71,1059,Thank you for the follow!
1060,1441803347988,1,0,1,0,on-topic,0,183,1060,World shows its heart: In the aftermath of twin bombings at the Boston Marathon, people from all over the world... http://t.co/AYP8wqEC1Y
1061,1441803348174,1,0,1,0,on-topic,186,136,1061,No matter what these people went to doesn't give them the right to hurt innocent people :\
1062,1441803348174,1,0,1,0,on-topic,0,156,1062,I'm sure a lot of people want to see the President, myself included, but never under circumstances like these.
1063,1441803348174,0,0,1,0,off-topic,0,189,1063,@yannidenise @undefinedtatix3 @yazelly_mariee Mira just shut up already &amp; Dm each other shit. The fuck everybody need to know your business
1064,1441803348174,0,0,1,0,off-topic,0,93,1064,3 papers due tomorrow... Lot of work #letsgetit
1065,1441803348174,0,0,1,0,off-topic,0,105,1065,I'm at Monica's Mercato (Boston, MA) http://t.co/aZkHOmINBQ
1066,1441803348175,0,0,1,0,off-topic,1,137,1066,I'm at Old Colony Hospice &amp; Palliative Care, Inc. (Randolph, MA) http://t.co/5UrMJwJOuf
1067,1441803348175,0,0,1,0,off-topic,0,71,1067,@MuffyCx yes, I am why? :
1068,1441803348175,1,0,1,0,on-topic,0,163,1068,first something exploded and then they made everyone clear the way so an ambulance could go through... #whathappened?
1069,1441803348175,0,0,1,0,off-topic,0,157,1069,@damicobrian @flatheadjake Corner of Harrison &amp; MSGR Reynolds, across from Engine 3. http://t.co/SZrRk60GK4
1070,1441803348175,0,0,1,0,off-topic,0,98,1070,@kaymuff yeah I was on boylston street all day today
1071,1441803348176,0,0,1,0,off-topic,1,83,1071,I've need been so happy to be outside
1072,1441803348176,0,0,1,0,off-topic,0,141,1072,@JohnDennisWEEI So this scumbag went to the same school as best buds Ben Affleck and Matt Damon
1073,1441803348361,0,0,1,0,off-topic,185,97,1073,I'm just sitting next to a little kid I don't know.
1074,1441803348361,0,0,1,0,off-topic,0,140,1074,@Uhneedaaa lmfao okay we can go to another ice cream place but we can also check there first !
1075,1441803348361,0,0,1,0,off-topic,0,157,1075,Burger deal for under $5 with @phanto_ghost! (@ Boston Burger Company - @bostonburgerco) http://t.co/sYYiM5Jxud
1076,1441803348362,0,0,1,0,off-topic,1,132,1076,Got into a issue wit babe he forgave me @RUGARELLFWP srry, I kno I got a slick mouth!!
1077,1441803348362,0,0,1,0,off-topic,0,152,1077,@illicitDemeanor @nightlifeg lmao don't be sayin that bout my nigga doe.  She's not here to defend herself
1078,1441803348362,0,0,1,0,off-topic,0,73,1078,Girl I know ya want da Dick
1079,1441803348362,0,0,1,0,off-topic,0,168,1079,Tonight's Fun! Salty Mac , Chocolate covered caramel walnuts, the Strawberry tha was big as my palm http://t.co/kAl9CeqHsW
1080,1441803348362,0,0,1,0,off-topic,0,135,1080,When you get to college, you get a 35, and you're like, 'Hell yeah! I'm fucking awesome!'
1081,1441803348362,0,0,1,0,off-topic,0,186,1081,@gelicarae was walking down the street and heard two loud explosions. The news is saying there were 2 bombs in trash cans at the finish line
1082,1441803348363,0,0,1,0,off-topic,1,120,1082,A Magic pre-paid card by Magic Johnson??? Smh. Daytime TV commercials wow!
1083,1441803348548,0,0,1,0,off-topic,185,184,1083,CEO Fontaines pay skyrockets as Wellesley Bank grows deposits, commercial lending: Thomas J. Fontaine, president... http://t.co/88SGpojQ97
1084,1441803348548,1,0,1,0,on-topic,0,166,1084,Marathon medals for sale on eBay; local company that makes them is disgusted http://t.co/Cb0lXjXQSg @eBay @SecretService
1085,1441803348548,0,0,1,0,off-topic,0,88,1085,@TRILLA_LONDON that's me on my good days .
1086,1441803348549,0,0,1,0,off-topic,1,121,1086,How much you think the people in great chef get paid? They must make money!
1087,1441803348549,0,0,1,0,off-topic,0,97,1087,This episode is too dramatic and weird like I can't
1088,1441803348549,0,0,1,0,off-topic,0,169,1088,no kiss me signs for us, we're classy.  #wellesley #screamtunnel  #bostonmarathon @ Wellesley Scream http://t.co/CydF80Skip
1089,1441803348549,0,0,1,0,off-topic,0,180,1089,Obama to city: We finish the race: President Obamas rallying cry yesterday for unity and resolve in the face... http://t.co/o3rB2EZfj8
1090,1441803348549,0,0,1,0,off-topic,0,165,1090,A numbers of restaurants on Brighton Avenue are open. People in Allston start to show up on the streets. @BUNewsService
1091,1441803348549,0,0,1,0,off-topic,0,116,1091,@danielhuynhh: 9 I don't know you well but you seem pretty chill  stop
1092,1441803348550,0,0,1,0,off-topic,1,85,1092,@_smooth36 I dont have TV here hahahaha
1093,1441803348550,0,0,1,0,off-topic,0,136,1093,We all have a moral obligation to leave this world a better place than the way we found it
1094,1441803348737,1,0,1,0,on-topic,187,68,1094,ban lifted we are free
1095,1441803348737,0,0,1,0,off-topic,0,86,1095,I can't ask my mom if my niece is crying
1096,1441803348737,0,0,1,0,off-topic,0,98,1096,we don't have to go to Alaska anymore. i understand.
1097,1441803348737,0,0,1,0,off-topic,0,134,1097,@caycayredsox @jblock20 yeah uhh why were you on my twitter there not psycho girlfriend?
1098,1441803348737,0,0,1,0,off-topic,0,126,1098,What's the first thing you do when you wake up? Me I go on my phone to be honest
1099,1441803348738,0,0,1,0,off-topic,1,176,1099,#Dedham , MA #Marketing #Job: Onlne Mbl Banking Manager I - Dedham, MA at Citizens Financial Group http://t.co/CbRRVCdhBQ #cfgjobs
1100,1441803348738,0,0,1,0,off-topic,0,80,1100,All I'm doing today is watching tv
1101,1441803348738,1,0,1,0,on-topic,0,122,1101,The car was found in Cambridge. http://t.co/X2r5zw5u0m (via @BostonMagazine)
1102,1441803348738,0,0,1,0,off-topic,0,87,1102,I'm not getting involved. #issues #ConLaw
1103,1441803348738,0,0,1,0,off-topic,0,86,1103,@emily_mullaney rough day for the kids #
1104,1441803348739,0,0,1,0,off-topic,1,76,1104,wrentham outlets with my momma
1105,1441803348739,0,0,1,0,off-topic,0,148,1105,Many prayers right now. Push comes to shove, university POs are signing up to step in front of bullets
1106,1441803348739,0,0,1,0,off-topic,0,96,1106,I'm at Quincy Career Center http://t.co/V2Ti8j0kpH
1107,1441803348924,0,0,1,0,off-topic,185,170,1107,When Raff calls her family and starts jabbering loudly in tongues right as the mayor comes on for a news briefing. Smh raff.
1108,1441803348924,0,0,1,0,off-topic,0,123,1108,Lol dad shut the fuck up, I'm almost 18 years old, grounding me is pointless.
1109,1441803348924,0,0,1,0,off-topic,0,88,1109,I hope everyone from @Nov_Project is safe.
1110,1441803348925,0,0,1,0,off-topic,1,120,1110,@Deej_Jacavone lol thanks I keep seeing it on twitter I'm gonna pass on it
1111,1441803348925,1,0,1,0,on-topic,0,107,1111,@basharatSAYS ya re :( everything is shit down in Boston. :-|
1112,1441803348925,0,0,1,0,off-topic,0,88,1112,@matt_morse1: Yeah ur a bitch fuck u sorry
1113,1441803348926,0,0,1,0,off-topic,1,168,1113,Happy Monday ya'll! Out to enjoy this marathon Monday with my momma @BlancaIris31 my sis @Afeliz11 and my niece, Jaelyn...
1114,1441803348926,1,1,1,1,on-topic,0,106,1114,Eerily calm on Newbury Street at the moment. #marathonmonday
1115,1441803348926,0,0,1,0,off-topic,0,180,1115,My thoughts and prayers go out 2 the people of West, Tx. May God Bless u all and give u the strength 2 surpass this horrific incident.
1116,1441803348926,0,0,1,0,off-topic,0,181,1116,Mass. Medical Society urges limits on medical marijuana: The states new medical marijuana law doesnt just let... http://t.co/oOIimUS5N6
1117,1441803348926,0,0,1,0,off-topic,0,166,1117,At that point where I can't talk while nursing bc twins will de latch look up &amp; smile #sofunny #bfing #breastfeeding
1118,1441803349117,0,0,1,0,off-topic,191,112,1118,@TheBigKiddo Thinking bout you will help me groove better &gt;&gt;
1119,1441803349117,0,0,1,0,off-topic,0,88,1119,I struggle to find any truth in your lies.
1120,1441803349117,1,0,1,0,on-topic,0,174,1120,My mom thinks I'm not dropping her off because its dangerous in boston and that ill allow her to take that stupid shuttle thing.
1121,1441803349117,0,0,1,0,off-topic,0,83,1121,Can't wait to go to New York tomorrow
1122,1441803349118,0,0,1,0,off-topic,1,129,1122,@ryenarussillo yea but arent more players disappointments..thats just more probable
1123,1441803349118,0,0,1,0,off-topic,0,138,1123,This customer just called me a sexy little leprechaun...not sure if freaked out or flattered
1124,1441803349118,0,0,1,0,off-topic,0,118,1124,A guy can only say so much nd not expect a girl to feel some type of way
1125,1441803349118,1,0,1,0,on-topic,0,122,1125,@WSJ: #BostonMarathon suspect. Photos of empty areas: http://t.co/ZCI51d3TbQ
1126,1441803349119,0,0,1,0,off-topic,1,87,1126,@RyanMerry @riggssm love you guys so much
1127,1441803349119,0,0,1,0,off-topic,0,117,1127,@karamat CNN is going to help reunite them. She's still in the hospital
1128,1441803349119,0,0,1,0,off-topic,0,114,1128,@Jkrazykid @jcasseus7 @forever_mariee_ @catt419 what do you mean was
1129,1441803349119,1,0,1,0,on-topic,0,128,1129,I think we should have a fundraiser for all the victims in boston RT if you agree!
1130,1441803349299,0,0,1,0,off-topic,180,183,1130,Just found out the 8 year old boy who was killed I knew by association. I met him thru my best friend a few years ago at a 4th party #RIP
1131,1441803349299,0,0,1,0,off-topic,0,164,1131,I don't normally condone violence but the members of the WBC who come here to protest deserve to get their shit tossed
1132,1441803349300,0,0,1,0,off-topic,1,110,1132,I'm at Maples Nursing Home (Wrentham, MA) http://t.co/5yn1PuW4iv
1133,1441803349300,0,0,1,0,off-topic,0,107,1133,@dijohnson004 @CoachRoweOHS sorry I let y'all down mile 23-26
1134,1441803349301,1,0,1,0,on-topic,1,185,1134,Boston cambridge watertown waltham woburn dartmouth,this Ruski must run a 4.34, the pats should throw a number at him for next year #wheels
1135,1441803349301,1,1,1,1,on-topic,0,173,1135,Boston may not be my hometown but I live here it's so sad what happened earlier 2day in the marathon ur in my prayers bean town
1136,1441803349301,0,0,1,0,off-topic,0,181,1136,I have a hard time trusting people more than ever. I just don't wanna get hurt ever again, I'm so happy right now. #bitchdontkillmyvibe
1137,1441803349301,0,0,1,0,off-topic,0,81,1137,@jeremycloud it's intense right now
1138,1441803349302,0,0,1,0,off-topic,1,81,1138,#Honesthour I can get very Stubborn
1139,1441803349303,1,0,1,0,on-topic,1,113,1139,Women's leader at 23 mi mark #BostonMarathon http://t.co/Q4TgjNJQRk
1140,1441803349303,0,0,1,0,off-topic,0,71,1140,I just want to be home...
1141,1441803349487,1,0,1,0,on-topic,184,185,1141,friend of mine is supposed to be bringing her cat over 4 me to catsit  while she goes away. Delayed : no fly zone over whole marathon route
1142,1441803349487,0,0,1,0,off-topic,0,79,1142,Been in my bed legit all day &lt;
1143,1441803349487,0,0,1,0,off-topic,0,94,1143,I need a friend that's a bomb ass tattoo artist.
1144,1441803349487,0,0,1,0,off-topic,0,93,1144,and that's exactly why I have trust issues.....
1145,1441803349488,0,0,1,0,off-topic,1,81,1145,@kledoux Audubon Circle, hands down
1146,1441803349488,0,0,1,0,off-topic,0,88,1146,@kmor07 and why would u want less freedom?
1147,1441803349488,0,0,1,0,off-topic,0,137,1147,@miilkkk: Mom: Did you get home okay? Me: No, actually I was murdered. Twice. Dying hahahah
1148,1441803349489,1,0,1,0,on-topic,1,127,1148,Giving blood #prayforboston @julie_m0ran @ Education First http://t.co/QiQT4MldY5
1149,1441803349489,0,0,1,0,off-topic,0,130,1149,@PoopsInSoups @erinncooperr this kid keeps calling Othello a baller, I have to leave
1150,1441803349489,0,0,1,0,off-topic,0,85,1150,You had my heart, but then you blew it.
1151,1441803349489,0,0,1,0,off-topic,0,93,1151,Twitter is earning its keep tonight. #watertown
1152,1441803349490,0,0,1,0,off-topic,1,104,1152,The bruins are getting too good at blowin leads in the 3rd
1153,1441803349490,0,0,1,0,off-topic,0,103,1153,New day #Boston @ Arnold Worldwide http://t.co/AW9aM5S3Ct
1154,1441803349490,0,0,1,0,off-topic,0,157,1154,Wow it's hard to believe that three finals separate me from the end of my freshman year #timeflies #amazingyear
1155,1441803349673,0,0,1,0,off-topic,183,113,1155,@MichelleL646 thank you Michelle! Hope everything's ok around curry
1156,1441803349673,0,0,1,0,off-topic,0,74,1156,Popped a Molly im flexing ;3
1157,1441803349674,0,0,1,0,off-topic,1,83,1157,@PrincessAudg_xo I live right near it
1158,1441803349674,0,0,1,0,off-topic,0,84,1158,@perseid88 that made me laugh! Thanks!
1159,1441803349674,0,0,1,0,off-topic,0,87,1159,My boyfriend is so annoying #ventingtweet
1160,1441803349675,0,0,1,0,off-topic,1,142,1160,@WolfHaleyBitch @jasminee_oceann AND IM THE MAN OF THE HOUSE SO ETF DO YOU THINK THAT MAKES YOU?
1161,1441803349675,0,0,1,0,off-topic,0,107,1161,@eazyduzPITT where is Baseball Tavern when you need it?!!!!!!
1162,1441803349675,0,0,1,0,off-topic,0,173,1162,@aliiipayne I had to get it for Kiss concert to show my LD support get yours so we can be twins! #teamLD http://t.co/AlJg7iZ5kF
1163,1441803349675,0,0,1,0,off-topic,0,183,1163,@benjamin8213 I don't even know who you're referring to specifically, but if he uploaded a monetized video about what happened in my city
1164,1441803349675,0,0,1,0,off-topic,0,88,1164,@BillySawyer1 y u got no faith in me ? Lol
1165,1441803349675,1,1,1,1,on-topic,0,181,1165,Recently Married Couple Seriously Hurt In Boston Marathon Bombings: BOSTON (AP)  A recently married couple is... http://t.co/0XwDQNA7qU
1166,1441803349861,1,1,1,1,on-topic,186,115,1166,@MrWalrusQ there's been a lot of nutty reporting in the last few days
1167,1441803349861,1,1,1,1,on-topic,0,169,1167,CNN is reporting suspect is a tall, dark skinned brother with dimples, wearing a black Kangol, sweatsuit and sneakers. #Bad
1168,1441803349862,0,0,1,0,off-topic,1,101,1168,@Scorpiolo_Ouww lol my hairs out but my face looks ugly
1169,1441803349862,0,0,1,0,off-topic,0,118,1169,Ain't getting to much love lately, it's cool, I was born alone so I'll .
1170,1441803349862,0,0,1,0,off-topic,0,154,1170,View from roof of cops leaving children's.. can still see some crowded on the corner. http://t.co/b4Xl9qhj3P
1171,1441803349862,0,0,1,0,off-topic,0,104,1171,@iTupacShakur: Some people just have backwards priorities.
1172,1441803349862,1,1,1,1,on-topic,0,183,1172,We r staying in Cambridge across the river from Boston where there have been gunshots at MIT (Cambridge) side. Interesting stay in Boston
1173,1441803349862,0,0,1,0,off-topic,0,132,1173,Feeling Artsy! (@ Institute of Contemporary Art - @icainboston) http://t.co/OfNagrL13y
1174,1441803349863,0,0,1,0,off-topic,1,88,1174,@m_haley81 mikes are always mother fuckers
1175,1441803349863,0,0,1,0,off-topic,0,181,1175,Got here just in time for the PHAT Tuesday ride, but so did the wind. Bailing #PMC2013 @pmc_phat (@ panmassbike) http://t.co/XkEAXKOxeN
1176,1441803349863,1,0,1,0,on-topic,0,101,1176,@SeanWrenn4 Oh my god. This is so scary!  #loveyouseano
1177,1441803350049,0,0,1,0,off-topic,186,97,1177,Up to 63% Off Painting Class http://t.co/fZsD0870yq
1178,1441803350050,0,0,1,0,off-topic,1,113,1178,About to just head off to bed because everyone fell asleep on me ..
1179,1441803350051,0,0,1,0,off-topic,1,91,1179,I want him home! #dogs http://t.co/Qm9qwc6lCC
1180,1441803350051,0,0,1,0,off-topic,0,87,1180,I wanna actually do something fun tonight
1181,1441803350051,1,0,1,0,on-topic,0,126,1181,So much fun! (@ Boston Marathon Finish Line w/ 45 others) http://t.co/ccFpZPPUJR
1182,1441803350051,0,0,1,0,off-topic,0,99,1182,I learned a lot about being a friend when I was alone
1183,1441803350052,1,1,1,1,on-topic,1,114,1183,Friends I am safe. Two casualties and 22 injuries as of now. #boston
1184,1441803350052,0,0,1,0,off-topic,0,81,1184,She needs to call back im bored mow
1185,1441803350052,0,0,1,0,off-topic,0,103,1185,@heyheyhayleyk we are the strongest city!!!!  Love u #bff
1186,1441803350053,1,0,1,0,on-topic,1,147,1186,Thinking of you Boston. @BrianAHarris11 and I are safe. Thank you all for your calls and text #boston
1187,1441803350053,0,0,1,0,off-topic,0,66,1187,How do I say this...
1188,1441803350053,0,0,1,0,off-topic,0,119,1188,Really chuck Norris follows me best day of my life http://t.co/L7ziKIK6nK
1189,1441803350053,0,0,1,0,off-topic,0,82,1189,IM SO FUCKING MAD SO FUCKING FURIOUS
1190,1441803350054,0,0,1,0,off-topic,1,129,1190,@BenMulroney1976 thanks Ben! Getting a little stir crazy here. Hope this ends soon!
1191,1441803350236,0,0,1,0,off-topic,182,87,1191,When you get butterflies &gt;&gt;&gt;&gt;
1192,1441803350237,1,0,1,0,on-topic,1,123,1192,@iFreaksYaTweets bombing at the finish line of the marathon and on the trains
1193,1441803350237,1,0,1,0,on-topic,0,168,1193,FWIW, I'm near the JFK library and it doesn't feel like this was related to the marathon. The intersections aren't closed.
1194,1441803350237,0,0,1,0,off-topic,0,102,1194,@Only1Jade_3: @BangaKnowsBest what time u off don't know
1195,1441803350237,0,0,1,0,off-topic,0,132,1195,I wish #dexter was a real person. He would have this kid wrapped in plastic in no time
1196,1441803350238,0,0,1,0,off-topic,1,136,1196,@_MadiC ya thx for looking out for me, how will u tell her that ur too smart for her class
1197,1441803350238,0,0,1,0,off-topic,0,97,1197,I don't feel like doing the walk for hunger anymore
1198,1441803350238,0,0,1,0,off-topic,0,177,1198,@kayleemac16: If you love something, set it free. If it comes back, it's yours. If it does not come back, it was never meant to be.
1199,1441803350238,0,0,1,0,off-topic,0,85,1199,@Jaddoooo I wont even be awake at 8 lol
1200,1441803350239,0,0,1,0,off-topic,1,102,1200,Whoa, really low-flying helicopter just flew over in JP.
1201,1441803350239,0,0,1,0,off-topic,0,142,1201,@carlyco_xo @morehouse11 enjoying this hotel!! It sure is a suite room ;) http://t.co/yom9gBqSnA
1202,1441803350239,0,0,1,0,off-topic,0,128,1202,When feel good inc comes on the radio and I start jammin alone&gt;&gt;&gt;&gt;&gt;
1203,1441803350423,0,0,1,0,off-topic,184,104,1203,#YouAintFromBoston if you don't live in Boston,simple. ._.
1204,1441803350424,0,0,1,0,off-topic,1,91,1204,@Jack_The_Mc Glad to hear u are ok.  Be safe.
1205,1441803350424,0,0,1,0,off-topic,0,116,1205,@MattBors @AdamSerwer Irish off the hook here in beantown. #justahunch
1206,1441803350424,0,0,1,0,off-topic,0,158,1206,Closed report at 500 E Broadway http://t.co/p4ajnq86FW. Case noted. ticket was issued on 4-16-13 by officer dao.
1207,1441803350424,0,0,1,0,off-topic,0,75,1207,@Rdipz You fell asleep on me.
1208,1441803350425,0,0,1,0,off-topic,1,112,1208,That mick Foley DVD looks awesome. Think I might pick that one up.
1209,1441803350425,1,0,1,0,on-topic,0,118,1209,Boston is on official army lockdown. Stay inside and stay safe everyone.
1210,1441803350425,0,0,1,0,off-topic,0,85,1210,@AyyyKT KT  ! Thank you for the concern
1211,1441803350426,0,0,1,0,off-topic,1,70,1211,Yo ass big so throw that
1212,1441803350426,0,0,1,0,off-topic,0,154,1212,@Mykelti_young @jettalena yeah, we're the biggest sluts especially at BAA. we'll take your man so watch out.
1213,1441803350426,0,0,1,0,off-topic,0,127,1213,So happy to be seeing @Timeflies tonight. (at @HOBBoston)  http://t.co/oUNax7qcUr
1214,1441803350426,0,0,1,0,off-topic,0,170,1214,@RachelZG @FozzyTheGamer @SharpShotApollo well, as long as the people don't talk about postmodernism, the people are better.
1215,1441803350426,0,0,1,0,off-topic,0,181,1215,I've only had good encounters with the #MIT police. On slow nights, they'd catch me walking home and offer me a ride. RIP Sean Collier.
1216,1441803350612,0,0,1,0,off-topic,186,184,1216,Somber Red Sox Regroup, Beat Indians 7-2: Mike Napoli hit a three-run double in Boston's seven-run second inning... http://t.co/1TcakQXW60
1217,1441803350612,1,0,1,0,on-topic,0,184,1217,Pres Obama to the Cathedral today along with D Patrick.. Security everywhere has been tight wonderland station looks like  a military base
1218,1441803350613,0,0,1,0,off-topic,1,168,1218,Peak hours in Boston's Trending Topics for Sunday 13 were at 12 am and 1 am: http://t.co/5glVj4yxEx http://t.co/wWxKuqWYkE
1219,1441803350613,0,0,1,0,off-topic,0,76,1219,I get the whole day off today!
1220,1441803350613,0,0,0,0,off-topic,0,182,1220,running as soon as they let me: currently, I'm on a strict 'no-running' order from my PT due to knee issues...... http://t.co/dMEcgVZgsn
1221,1441803350614,0,0,1,0,off-topic,1,82,1221,okay I'm done with the paranoia lml.
1222,1441803350615,0,0,1,0,off-topic,1,102,1222,Thunderstruck with rubinoff... Not our smartest decision
1223,1441803350615,0,0,1,0,off-topic,0,120,1223,Thats why they Call it close friends they come close and they move First .
1224,1441803350616,0,0,1,0,off-topic,1,146,1224,Obviously I'm not allowed to leave my house, but I did google map walking directions to the airport.
1225,1441803350616,0,0,1,0,off-topic,0,85,1225,@aharonson28 um, I'm not really sure...
1226,1441803350801,0,0,1,0,off-topic,185,106,1226,I'm at Twist &amp; Shake (Revere, MA) http://t.co/32UxlR6u8E
1227,1441803350802,1,0,1,0,on-topic,1,152,1227,Boston drinking game: drink every time you hear a siren, drink every time a news reporter gives false info
1228,1441803350802,0,0,1,0,off-topic,0,93,1228,lets see what the Varsity lookin like tonight .
1229,1441803350803,1,0,1,0,on-topic,1,185,1229,CNN says suspect may be in gray CRV, 316 ES9. May have traveled to CONNECTICUT. Good thing I'm not supposed to go there. #ohwait #goddamnit
1230,1441803350803,0,0,1,0,off-topic,0,147,1230,Check in with the girls and @hannaheliz15! (@ Stetson West Eatery - @nudining) http://t.co/8i7mWgIYPy
1231,1441803350803,0,0,1,0,off-topic,0,185,1231,@NMC1390 @j_clarks24 when did I ever have blonde hair? And I would've crushed that girl in hurdles! Remember me hurdling the couch in 1616?
1232,1441803350803,0,0,1,0,off-topic,0,107,1232,@stephyska I wish it weren't insensitive for me to RT that...
1233,1441803350804,1,1,1,1,on-topic,1,81,1233,Boston isn't just the same anymore.
1234,1441803350805,0,0,1,0,off-topic,1,97,1234,ya i don't think i can start my 10 page paper today
1235,1441803350805,0,0,1,0,off-topic,0,69,1235,@KellyLux nm. I got it.
1236,1441803350805,1,0,1,0,on-topic,0,136,1236,These asshats are quite possibly the worst criminals ever...a notch below the wet bandits.
1237,1441803350805,0,0,1,0,off-topic,0,85,1237,@vanillaice. Lemme get a followback fam
1238,1441803350987,0,0,1,0,off-topic,182,164,1238,@heymochaaa lols, right &amp; i mean look into it, it might not be the college that you wanted or expected so why no
1239,1441803350987,0,0,1,0,off-topic,0,116,1239,@pam_eltoe cooking burritos over a fire isn't a cookout #sorrynotsorry
1240,1441803350987,0,0,1,0,off-topic,0,72,1240,I suppose gay and lesbians
1241,1441803350987,0,0,1,0,off-topic,0,93,1241,@AH_BrownMan this needs to be a versus somehow.
1242,1441803350988,1,0,1,0,on-topic,1,93,1242,Shit is crazy all I can say is long live boston
1243,1441803350988,0,0,1,0,off-topic,0,131,1243,To All Y'all People in relationships Follow your hearts &amp; Do what you gotta do ..
1244,1441803350988,0,0,1,0,off-topic,0,82,1244,I can't and I don't want to give up.
1245,1441803350988,0,0,1,0,off-topic,0,114,1245,Yes tweeps, not one millisecond of sleep last night for me. Not one.
1246,1441803350989,0,0,1,0,off-topic,1,104,1246,My Finance professor sent his students a wonderful e-mail.
1247,1441803350989,0,0,1,0,off-topic,0,98,1247,When they catch this fool, someone please wake me up
1248,1441803350989,0,0,1,0,off-topic,0,158,1248,American Flag flown at half mass today at the office #boston @ Regan Communications Group http://t.co/hDXd8XwhQr
1249,1441803350989,0,0,1,0,off-topic,0,128,1249,I'm sure the plane is fine, most of those scratches will buff right out #Goldeneye
1250,1441803350989,0,0,1,0,off-topic,0,147,1250,@KookooKristina this is all conditional considering I haven't watched the show since the first season
1251,1441803351174,1,0,1,0,on-topic,185,155,1251,B of A Pavilion showing American pride... #prayforboson @ Park Lane Seaport Apartments http://t.co/GVWWNN9Y5k
1252,1441803351174,0,0,1,0,off-topic,0,91,1252,You broke up with him because you're a pussy.
1253,1441803351174,0,0,1,0,off-topic,0,81,1253,Ok I want to know what happen in NB
1254,1441803351174,0,0,1,0,off-topic,0,177,1254,The police dont like me i called them and they put me to voicemail -_- with that elavater music playing telling me to wait and shit
1255,1441803351174,0,0,1,0,off-topic,0,171,1255,@RadioChloe FWIW, I bought this cable modem at Best Buy. It should support faster speeds from Xfinity: http://t.co/t7jw8l7p6X
1256,1441803351174,0,0,1,0,off-topic,0,95,1256,@TanyaStanley20 Tanks Boo and I'm going ova after
1257,1441803351175,0,0,1,0,off-topic,1,90,1257,NOTHING ANNOYS ME MORE THAN A CORNY ASS DUDE
1258,1441803351175,0,0,1,0,off-topic,0,151,1258,completing the boston marathon is such an amazing accomplishment for so many people. who would ruin that?
1259,1441803351175,0,0,1,0,off-topic,0,88,1259,I better get my ice cream  @MarcLovesBecky
1260,1441803351175,0,0,1,0,off-topic,0,159,1260,Downtown Boston is quiet, yes, but several restaurants are open and there's plenty of foot traffic on the street.
1261,1441803351175,0,0,1,0,off-topic,0,87,1261,When i get home i take a nice warm shower
