2905,1441805138881,1,0,1,0,on-topic,0,111,2905,@juanjohnsilvers: #YouAintFromBoston if you don't know of BriAbba
2906,1441805138881,0,0,1,0,off-topic,0,104,2906,Woke up to get food at 3, too much energy to sleep... #fml
2907,1441805138882,0,0,1,0,off-topic,1,79,2907,I hate not being able to sleep in
2908,1441805138883,0,0,1,0,off-topic,1,92,2908,Im trynna go to brazil some time in the future
2909,1441805138883,0,0,1,0,off-topic,0,129,2909,I'm at Quincy Market - @faneuilhall (Boston, MA) w/ 3 others http://t.co/FvpXKG4M0M
2910,1441805138884,0,0,1,0,off-topic,1,93,2910,I have ocd when it comes to my closet and draws
2911,1441805138885,1,1,1,1,on-topic,1,145,2911,@ashleyxcat I'm okay, I was right where it exploded about 2 minutes before. Thanking my lucky stars
2912,1441805138885,0,0,1,0,off-topic,0,84,2912,@HeluEllu please be careful! Dear god.
2913,1441805138886,1,0,1,0,on-topic,1,154,2913,An eerily quiet Boston. #iamlegend #boston #bostonlockdown @ Boston University Bridge http://t.co/ilFerCFxfA
2914,1441805138886,1,0,1,0,on-topic,0,136,2914,@KevinHart4real we need it its crazy out here a lot of innocent ppl got hurt so far 2 dead
2915,1441805138886,0,0,1,0,off-topic,0,136,2915,Squeezing in a dinner date!  Thank you Gma and Gdad! (at @BarLouie) http://t.co/wzotANMJJS
2916,1441805138887,0,0,1,0,off-topic,1,111,2916,SOMEONE'S FUCKING CAR ALARM HAS BEEN GOING OFF FOR 20 MINUTES NOW
2917,1441805138887,0,0,1,0,off-topic,0,169,2917,you know your party is dope when neighbors come by like if you guys aren't gonna invite us then at least keep it down #208W
2918,1441805138887,0,0,1,0,off-topic,0,186,2918,Caceres &amp; Asamoah are not set starters on Juve and fit huge needs for Milan, El Shaarawy is a perfect ST for Conte system #previoustweet
2919,1441805138888,0,0,1,0,off-topic,1,177,2919,#Country in #CoordinatorAlley - Track 2: Springsteen - now I'm chugging the kool-aid @chris_d_cameron @rachellyons61 #Woah-oh-oh-oh
2920,1441805138888,0,0,1,0,off-topic,0,100,2920,This is all gonna come out my ass @autumn_maarie #LMAO
2921,1441805138888,0,0,1,0,off-topic,0,182,2921,@ElizabethAnne97 some little ass kid tryed fucking with tinkam soo he went after him and started punching him in the face shit was crazy
2922,1441805138889,0,0,1,0,off-topic,1,105,2922,#petpeeves I don't like sitting too close to the dashboard.
2923,1441805138889,0,0,1,0,off-topic,0,93,2923,@TonyRBranco Gulp, I'm going to be, in 2 weeks.
2924,1441805138890,0,0,1,0,off-topic,1,186,2924,@Stephanie_Link how do you feel about $CHRW? Cheap gas good for truck margin and air and sea shipping as well. Looks cheap here/ solid yield
2925,1441805138890,0,0,1,0,off-topic,0,125,2925,@aaronwhite Some great memories here as I'm sure you have. Not easy to replace.
2926,1441805138891,0,0,1,0,off-topic,1,101,2926,Four hour study session today #breakTime#tacos#backToIt
2927,1441805138891,0,0,1,0,off-topic,0,66,2927,I don't give a fuck.
2928,1441805138892,0,0,1,0,off-topic,1,154,2928,I'm about 1/4 mile from the command post. This is too freaky that I live right in the middle of all of this!
2929,1441805138892,0,0,1,0,off-topic,0,94,2929,Is it really 7:53??? I haven't slept a wink, yo.
2930,1441805138893,0,0,1,0,off-topic,1,96,2930,@Podolski10 u r awesome! One of my fave at Arsenal
2931,1441805138894,1,0,1,0,on-topic,1,126,2931,Love my adopted city. We'll get through this @ Boston, MA http://t.co/XSDYmzoX7B
2932,1441805138894,1,0,1,0,on-topic,0,182,2932,The craziest part about today was that I wasn't even in Boston yet and our train was stopped and checked for bombs by a full bomb squad.
2933,1441805138894,0,0,1,0,off-topic,0,108,2933,The #swan s are tired. @ The Swan Boats http://t.co/nEf8lA11wN
2934,1441805138895,0,0,1,0,off-topic,1,96,2934,We are spiritual beings living a human experience!
2935,1441805138896,0,0,1,0,off-topic,1,86,2935,@xoraachox apparently their searching ut
2936,1441805138896,0,0,1,0,off-topic,0,131,2936,@brayanthen yes Im watching the news right now, but they said to keep your eyes open.
2937,1441805138897,0,0,1,0,off-topic,1,88,2937,Being at work in this condition is so bad.
2938,1441805138898,0,0,1,0,off-topic,1,102,2938,I'm done looking for perfect I just want something real!
2939,1441805138898,0,0,1,0,off-topic,0,129,2939,Closed report at N42.29 E71.09 http://t.co/akf84FLQpl. Case noted. not enough info.
2940,1441805138899,0,0,1,0,off-topic,1,99,2940,she got her food before me &amp; I was here first ...
2941,1441805138900,0,0,1,0,off-topic,1,126,2941,Get me back to Vermont. Where there are no sirens. No helicopters. None of this.
2942,1441805138900,0,0,1,0,off-topic,0,149,2942,@MegaPlayDoe: When bitches be like you cumming in the condom not on me &lt;&lt;&lt;&lt;&lt;&lt;&lt;&lt;
2943,1441805138900,0,0,1,0,off-topic,0,127,2943,im only countin on your cancellation when I should be countin on you at my doorrr
2944,1441805138901,0,0,1,0,off-topic,1,114,2944,That awkward moment when someone's butt looks better than your face.
2945,1441805138901,0,0,1,0,off-topic,0,79,2945,I wish this girl had a phone !!!!
2946,1441805138902,0,0,1,0,off-topic,1,121,2946,@_MarieHarrison @shanna_burke party at my place I got the Doritos my niggas
2947,1441805138902,1,0,1,0,on-topic,0,142,2947,I can't believe what I'm waking up to. I feel like I've been living in a horror movie this week.
2948,1441805138903,0,0,1,0,off-topic,1,126,2948,I'm at Late Night Kitchen - @budiningservice (Boston, MA) http://t.co/JSYWQh49xI
2949,1441805138903,0,0,1,0,off-topic,0,121,2949,hope i get to see @ashleybbal11 today and that she has a great day! #cheers
2950,1441805138904,0,0,1,0,off-topic,1,111,2950,I'm at Consolidated Concepts (Allston, MA) http://t.co/NQVxSiUyPh
2951,1441805138905,0,0,1,0,off-topic,1,104,2951,I'm at Fox &amp; Hound (Quincy, MA) http://t.co/T1VCi7Ejyq
2952,1441805138905,0,0,1,0,off-topic,0,92,2952,@botdfmusic thank u...ur soo sweet and caring.
2953,1441805138906,0,0,1,0,off-topic,1,160,2953,Love when I tell my bf that I wish I was on a bike and he brags about being one all day... Cool now #shutyourmouth
2954,1441805138906,0,0,1,0,off-topic,0,165,2954,Tranq this asshole and let him wake up strapped to a chair via a strong right hook to mouth. DON'T KILL HIM! #SetToStun
2955,1441805138906,0,0,1,0,off-topic,0,114,2955,People would really make a fake twitter account for this fucker SMFH
2956,1441805138907,1,1,1,1,on-topic,1,177,2956,Okay I get it that W Bush was an asshole but all these tweets about US using what is happening in Boston to start a war is RETARDED
2957,1441805138907,1,0,1,0,on-topic,0,184,2957,Manhunt forces families to stay indoors: Burt Granofskys plan for today was brunch and outside play time for his... http://t.co/TSTQHNE90A
2958,1441805138907,0,0,1,0,off-topic,0,107,2958,I'm at Fenway Park - @mlb (Boston, MA) http://t.co/R2kZWWm1vk
2959,1441805138908,0,0,1,0,off-topic,1,126,2959,S/O to my new follower @DopeAssShae . Appreciate the follow. Now following back!
2960,1441805138908,0,0,1,0,off-topic,0,135,2960,@Trojan_o: I'm already going to Bed #exhausted have a good night's sleep liv, I love you!
2961,1441805138908,0,0,1,0,off-topic,0,83,2961,Good morning @Jahnee_ have a good day
2962,1441805138909,0,0,1,0,off-topic,1,89,2962,@Kyra_brito: I can give two fucks about you
2963,1441805138910,0,0,1,0,off-topic,1,120,2963,@AshwagW sure will dear, thank you for your concerns and being here for us
2964,1441805138910,1,0,1,0,on-topic,0,137,2964,Anti-gun people trying to crusade in the name of the Boston Marathon bombing make me cringe
2965,1441805138911,1,0,1,0,on-topic,1,173,2965,thoughts and prayers go out to those at the finish line of the #bostonmarathon #prayforboston really sick that someone did this
2966,1441805138911,0,0,1,0,off-topic,0,162,2966,@NessaHarmony: If you're really gonna twatch someone you gotta at least check their favorites too. fucking Stalker !
2967,1441805138911,1,0,1,0,on-topic,0,139,2967,So if the guy captured in Watertown was a bomber, why would he rob a 7-11? #Watertown #boston
2968,1441805138911,0,0,1,0,off-topic,0,163,2968,Drinking a Henry Weinhard's Woodland Pass IPA by Blitz-Weinhard Brewing Co. at @bellinhandtav  http://t.co/SdGqCiNPMB
2969,1441805138912,0,0,1,0,off-topic,1,122,2969,New post on the blog today!  @ http://t.co/QbtLHU5Kq0 http://t.co/KUCPobmMob
2970,1441805138912,0,0,1,0,off-topic,0,90,2970,What's the semicolon project? #PleaseExplain
2971,1441805138913,0,0,1,0,off-topic,1,92,2971,@ultraV10L3Trayz when are you back in my life?
2972,1441805138913,0,0,1,0,off-topic,0,168,2972,That type of night when your really tired , and cant sleep and u just want to cuddle !!!!! #TeamLonerrrrr #Cold #Sleepy :/
2973,1441805138914,1,0,1,0,on-topic,1,125,2973,Thoughts and prayers for #boston @ Boston Public Library http://t.co/aBhsoIGQ2f
2974,1441805138914,1,1,1,1,on-topic,0,124,2974,Wait a minute. If #boston streets are so empty, what happened to the homeless?
2975,1441805138915,0,0,1,0,off-topic,1,86,2975,@Brittgantenbein Monday like I'm fucked.
2976,1441805138915,0,0,1,0,off-topic,0,96,2976,Found a pizza shop that's open in Allston... Word!
2977,1441805138916,0,0,1,0,off-topic,1,90,2977,Good morning, early risers. Welcome to hell.
2978,1441805138916,1,1,1,1,on-topic,0,178,2978,@edwinocon1 U should shut the fuck up&amp; show some care on what's happening. so what if they never cared until the bombing happen?
2979,1441805138917,0,0,1,0,off-topic,1,82,2979,Whose moving to Trinidad with me ?..
2980,1441805138917,0,0,1,0,off-topic,0,98,2980,Nics bronco shakes too much for me to type correctly
2981,1441805138918,0,0,1,0,off-topic,1,90,2981,@MeowitsAna can't pay the bill cause my card
2982,1441805138919,0,0,1,0,off-topic,1,194,2982,@Naked_Virginxo I know &amp;it happened like right after we stopped fuckin around too. Me &amp; lj is meant to be in the fam! Yal gon' take us back!
2983,1441805138919,0,0,1,0,off-topic,0,122,2983,@ScarletVirgin: Denzel Washington can have it anytime, any day, any where!!!
2984,1441805138919,0,0,1,0,off-topic,0,86,2984,I just lost my police scanner feed #fuck
2985,1441805138920,1,0,1,0,on-topic,1,163,2985,Chalk outside of Niketown. You don't know strength until its your only option. #bostonstrong @ http://t.co/L8h4YPFt2B
2986,1441805138920,0,0,1,0,off-topic,0,124,2986,Army guy at mile 25 in full uniform and carrying a whole backpack #usa #crying
2987,1441805138921,0,0,1,0,off-topic,1,62,2987,I want to go out
2988,1441805138921,0,0,1,0,off-topic,0,91,2988,one direction in red mango brb killing myself
2989,1441805138922,0,0,1,0,off-topic,1,184,2989,@_ChicagoKidd   RETWEET THIS! FOLLOW ME &amp; EVERYONE ELSE THAT RETWEETS THIS! FOR 50+ FOLLOWERS FAST #TeamFollowBack  #Follow2BeFollowed
2990,1441805138922,0,0,1,0,off-topic,0,71,2990,Waking up to the bullshit
2991,1441805138923,0,0,1,0,off-topic,1,127,2991,@DeliaCabe f that. I also blocked some bloodthirsty eejits. No hate in my stream.
2992,1441805138923,0,0,1,0,off-topic,0,180,2992,Irish dancers step up to support one of their own: The Irish dance community is stepping up support for Jane... http://t.co/h9xnTKapvW
2993,1441805138923,0,0,1,0,off-topic,0,70,2993,Don't give up on me baby
2994,1441805138924,0,0,1,0,off-topic,1,90,2994,S/o to @mk_slattery have fun at UNH tomorrow
2995,1441805138925,0,0,1,0,off-topic,1,98,2995,I'll take your hand and make you take a walk with me
2996,1441805138925,0,0,1,0,off-topic,0,125,2996,@justinbieber @jaxonbieber @jazmynbieber aw your so cute I love you so much omg
2997,1441805138926,1,0,1,0,on-topic,1,183,2997,I don't get why they haven't found Dzhokhar Tsarnaev yet. especially with all this man power. he could have possibly committed suicide...
2998,1441805138926,0,0,1,0,off-topic,0,93,2998,@ColeyMick they released a picture of the body?
2999,1441805138927,0,0,1,0,off-topic,1,69,2999,Things is like this now
3000,1441805138927,0,0,1,0,off-topic,0,87,3000,@morphosis7 Thanks. That might work well.
3001,1441805138928,1,0,1,0,on-topic,1,179,3001,Incredible the amount of god-hating and anti-religious people who are praying and thanking god when bad things happen #BostonMarathon
3002,1441805138928,0,0,1,0,off-topic,0,75,3002,Never be sorry for being real
3003,1441805138929,1,1,1,1,on-topic,1,176,3003,Seeing a ton of people walking around town today sporting their Marathon Jackets! Makes me real proud to live here! #prayforboston
3004,1441805138929,0,0,1,0,off-topic,0,111,3004,At least three ambulances at Copley Plaza. http://t.co/kNpeZA37A1
3005,1441805138930,0,0,1,0,off-topic,1,85,3005,Heard you a freak, I put my name on it.
3006,1441805138930,0,0,1,0,off-topic,0,179,3006,#BU Crisis Counselors are available 24/7 if you need someone to talk to. Our thoughts go out to everyone affected by today's tragedy.
3007,1441805138930,0,0,1,0,off-topic,0,119,3007,I mean out of the 16 Best Armed Forces in the World Pakistan won Number 1
3008,1441805138931,0,0,1,0,off-topic,1,119,3008,@GavinDeGraw Pretty much! No one messes w/ my city, family &amp; friends.
3009,1441805138931,0,0,1,0,off-topic,0,170,3009,Never have felt this motivated in my life, going to work as hard as I can to make my dream job a reality! #hardwork #excited
3010,1441805138932,0,0,1,0,off-topic,1,89,3010,@naughty_touch get a pic of that ass for me
3011,1441805138932,0,0,1,0,off-topic,0,180,3011,Associate Marketing Commu... - #Canton , MA (http://t.co/IDLuUkI8Yd) Get Public Relations Jobs #PublicRelations #jobs #job #GetAllJobs
3012,1441805138932,0,0,1,0,off-topic,0,99,3012,Good luck playing army in the woods all weekend Will!
3013,1441805138933,0,0,1,0,off-topic,1,146,3013,Getting my tat on chest what chu think ---- A mans worth is no greater then his ambition plz comment
3014,1441805138933,0,0,1,0,off-topic,0,83,3014,Can we live in peace?!????!!!! PLEASE
3015,1441805138934,0,0,1,0,off-topic,1,131,3015,Not even finals studying can keep me from watching the hour of Parks and Rec tonight.
3016,1441805138934,0,0,1,0,off-topic,0,118,3016,@_MarieHarrison do you really love the lamp or are you just saying that?
3017,1441805138935,0,0,1,0,off-topic,1,97,3017,@EmansBlessed @rihanna shut up -_- you can keep her
3018,1441805138935,0,0,1,0,off-topic,0,97,3018,@La_Maravillaa jajaja u and ur weird tweets baby :)
3019,1441805138936,0,0,1,0,off-topic,1,88,3019,@katieeee16 I was jamming to this earlier!
3020,1441805138937,0,0,1,0,off-topic,1,82,3020,If you knew better you'll  do better
3021,1441805138937,0,0,1,0,off-topic,0,139,3021,Late Night Conversation Anyone ? Strangers Available Lmao #FemalesOnly just making That clear
3022,1441805138938,0,0,1,0,off-topic,1,83,3022,I'm scared to love for the first time
3023,1441805138938,0,0,1,0,off-topic,0,163,3023,@Mykelti_young lml. you cut me? that was almost cute. &amp; idunno probably like. 8 but different outfits and scenery
3024,1441805138939,0,0,1,0,off-topic,1,179,3024,Q: Have any units sold at 820 South St. in Roslindale MA during the past 12 months? - 820 SOUTH STREET 02131 - http://t.co/VZMNmbIQXn
3025,1441805138939,0,0,1,0,off-topic,0,77,3025,I am not going to sleep tonight
3026,1441805138939,0,0,1,0,off-topic,0,83,3026,@CBork21 yeah r u is the question lol
3027,1441805138940,0,0,1,0,off-topic,1,183,3027,Photos: 117th Boston Marathon: The Boston Marathon starts in Hopkinton, Mass. and ends in downtown Boston, with... http://t.co/Y37KE3wHXF
3028,1441805138940,0,0,1,0,off-topic,0,99,3028,@Msallabtmyson her phone going to voicemail call me!!
3029,1441805138941,0,0,1,0,off-topic,1,166,3029,#wbz federal judge mark wolf just came out of fed ct hs...had animated conversation with marshals...marched back inside.
3030,1441805138941,0,0,1,0,off-topic,0,112,3030,California dreaming @ Harry's Bar and Grill http://t.co/vQX4j5yM3i
3031,1441805138942,0,0,1,0,off-topic,1,100,3031,@ddefaz111 Hahahaha wow look at you you twitter maniac
3032,1441805138942,0,0,1,0,off-topic,0,79,3032,Omg they have him at gun point!!!
3033,1441805138943,1,0,1,0,on-topic,1,101,3033,@alyshaknowsbest agreed i bet he went south or hes dead
3034,1441805138944,0,0,1,0,off-topic,1,112,3034,Drunken sex usually turns into Rough sex! Which is fine in my book
3035,1441805138944,1,0,1,0,on-topic,0,104,3035,Arrest made in #bostonmarathon case http://t.co/PANvydhDgO
3036,1441805138945,0,0,1,0,off-topic,1,172,3036,Cant stop thinking about this fuckin kid like where is he. Is he dead?? Is he watching himself on TV? Is he even in MA still??
3037,1441805138945,0,0,1,0,off-topic,0,69,3037,Proud to be a Bostonian
3038,1441805138946,0,0,1,0,off-topic,1,64,3038,Bye CT see u later
3039,1441805138946,0,0,1,0,off-topic,0,70,3039,Life is full of changes.
3040,1441805138947,1,0,1,0,on-topic,1,175,3040,Boston feels so deserted. It is deserted even on weekdays *compared to NYC* and today feels like there are hardly any ppl here...
3041,1441805138947,0,0,1,0,off-topic,0,69,3041,I wonder who did it..:(
3042,1441805138948,0,0,1,0,off-topic,1,81,3042,Why can't things just be simple doe
3043,1441805138949,0,0,1,0,off-topic,1,93,3043,@allihart I am :-/ can't wait for it all to end
3044,1441805138950,0,0,1,0,off-topic,1,87,3044,@JahvaeH the carnivals only open from 2-6
3045,1441805138950,0,0,1,0,off-topic,0,142,3045,@PryaaSwagDaddy: Im always being so nice to people , and they just take advantage of it .. !!!!!
3046,1441805138951,1,0,1,0,on-topic,1,160,3046,@yessurrfm more than that. There's police chases, stolen vehicles, shoot outs, and grenades getting thrown at cops
3047,1441805138951,0,0,1,0,off-topic,0,121,3047,We're here to give you 2 1/2 hours of kick ass music, Boston - Stevie Nicks
3048,1441805138951,0,0,1,0,off-topic,0,170,3048,Citizens Financial Group #Marketing #Job: Project Manager - Dedham, MA ( #Dedham , MA) http://t.co/oz4SEfN1YT #cfgjobs #Jobs
3049,1441805138952,0,0,1,0,off-topic,1,179,3049,@misterladygaga Ok, fat maybe.  what proof do you have about LSD?  You are about as unchristian as they come.  Retarded? Embarrassing
3050,1441805138952,0,0,1,0,off-topic,0,109,3050,Lunch with the family! (at @PaneraBread) http://t.co/Hu4g6Rtq9r
3051,1441805138952,0,0,1,0,off-topic,0,80,3051,@sydddox love you too!! I'm trying
3052,1441805138953,0,0,1,0,off-topic,1,186,3052,It's not that they were denied it's that everyone is expected to pay $  for the title of press member. Is this the future of press coverage?
3053,1441805138953,0,0,1,0,off-topic,0,182,3053,@totallyCAKEDup cus dats ya parents last name,u dnt even look or can speak it bitchh !!! U came out pretty sum y'all be mad funny lookin
3054,1441805138953,0,0,1,0,off-topic,0,126,3054,Bet you can't guess which took longer: applying to jobs or cleaning out my purse
3055,1441805138954,0,0,1,0,off-topic,1,155,3055,@SakiBombx how could you forget how awesome it is!? I still sneak it in to most of my playlists. #beastindeed
3056,1441805138954,0,0,1,0,off-topic,0,148,3056,That's ok email, you just keep freezing up. It's not like I have a million and one things to do anyway
3057,1441805138954,1,0,1,0,on-topic,0,107,3057,Police scanner says the suspects have grenades and explosives
3058,1441805138955,1,1,1,1,on-topic,1,184,3058,I'm gonna run today for those who no longer can what kind of self-centered, faux caring bullshit is that? Your 15 minute jog helps no one.
3059,1441805138955,0,0,1,0,off-topic,0,114,3059,Oh hello Gillette :). Drinks with @Cal1772 #collegeroomies #patriots
3060,1441805138956,0,0,1,0,off-topic,1,106,3060,I like when I see a straight guy with a gay guy beat friend.
3061,1441805138956,0,0,1,0,off-topic,0,152,3061,@Brandeness @qqueenb I mean like when they do things that can be easily misconstrued, do you just test it?
3062,1441805138957,0,0,1,0,off-topic,1,173,3062,@JacobyEllsbury, have you heard of @HarvardNAP? I know lots of #native students who would love to meet you and hear your story!
3063,1441805138957,1,0,1,0,on-topic,0,183,3063,Candle burning at #newbalance building heading into #boston. cannot believe all I saw yesterday, but so proud #Bos http://t.co/oVFjVRtRkt
3064,1441805138957,1,0,1,0,on-topic,0,114,3064,I really can't believe this guy went to umass Dartmouth , so scary .
3065,1441805138958,0,0,1,0,off-topic,1,101,3065,@MustLoveChucks lol sounds good don't work out too hard
3066,1441805138958,0,0,1,0,off-topic,0,127,3066,@t_bocc they took pics of my car speeding and sent a ticket to my house #bullshit
3067,1441805138959,1,1,1,1,on-topic,1,161,3067,Omg I just saw the suspect's Facebook page!!! It says that he was going to take his life? Did anyone else see that?
3068,1441805138959,0,0,1,0,off-topic,0,181,3068,@iamdanielharris @aviwisnia @goldenbloom @acexperience Dang! that's a good playlist, although it seems like we might need more tunes...
3069,1441805138959,0,0,1,0,off-topic,0,174,3069,Closed Streetlight report at 54 W Broadway http://t.co/39EWEogiyT. Case resolved. replaced new style acorn globe and 150sv lamp.
3070,1441805138959,0,0,1,0,off-topic,0,146,3070,@Rozzay007: If this was GTA this kid would've had 6 wanted stars.. Bastard. Hes on extra cheat codes
3071,1441805138960,0,0,1,0,off-topic,1,97,3071,Stilllllllll have no prom date.. I ain't shit Lmfao
3072,1441805138960,0,0,1,0,off-topic,0,132,3072,@RedSox are making #Boston proud right now with this game! #RedSoxNation #BostonStrong
3073,1441805138961,0,0,1,0,off-topic,1,123,3073,It hurts just to watch #marathonmonday @ Wellesley, MA http://t.co/KyXAb6goUE
3074,1441805138961,0,0,1,0,off-topic,0,184,3074,@HuffPostStyle no!! Not really LOL their idea of a muffin top is a lil ridiculous hehe but I guess it would b where the camera adds 10 lbs
3075,1441805138961,1,0,1,0,on-topic,0,100,3075,Heading downtown to explosion. chaps in Boston. @WCSH6
3076,1441805138962,0,0,1,0,off-topic,1,85,3076,@ohshitcindy lol tell her i said hey ;)
3077,1441805138963,0,0,1,0,off-topic,1,144,3077,I don't wana go there, we should never go there, why you gotta go there? I guess I gotta go there.
3078,1441805138963,1,0,1,0,on-topic,0,118,3078,It's so crazy to think we are 5 miles away from this I hope everyones ok
3079,1441805138964,0,0,1,0,off-topic,1,99,3079,Any High Schoolers now a Derek and Conner from Quincy
3080,1441805138964,1,0,1,0,on-topic,0,152,3080,Got a call from the office. We are not starting our day until the situation resolves. Locked down at home.
3081,1441805138965,0,0,1,0,off-topic,1,168,3081,Celebrating warm-ish weather with food trucks. (@ Clover Food Truck (Dewey Sq) - @cloverdwy) [pic]: http://t.co/nrlLq16gml
3082,1441805138965,0,0,1,0,off-topic,0,132,3082,There is no foreseeable limit to the amount of blts I could eat from jims deli. #bacon
3083,1441805138965,0,0,1,0,off-topic,0,119,3083,There's no one way to be perfect, but there's a thousand ways to be great
3084,1441805138966,0,0,1,0,off-topic,1,122,3084,I miss my uncle , Both of my cousins &amp; My Great Grandfather :( , #RIP ..
3085,1441805138966,1,0,1,0,on-topic,0,160,3085,My heart goes out to #Boston. If you know of anyone who needs a hand, have them contact me! http://t.co/6KEHowOY3f
3086,1441805138967,0,0,1,0,off-topic,1,144,3086,Taking off your pants and wondering why you ever have to wear them #teamnopants #nopantsnoproblems
3087,1441805138967,0,0,1,0,off-topic,0,173,3087,@RachRudin81: Hate not being able to speak fluent Spanish cause I don't understand anything anyone says to me lmao fml My.Life.
3088,1441805138967,0,0,1,0,off-topic,0,114,3088,Watching @samm_gil walk backwards for tours &gt;&gt;&gt; #allgrownup
3089,1441805138968,0,0,1,0,off-topic,1,76,3089,My tongue has no feeling #what
3090,1441805138968,1,0,1,0,on-topic,0,165,3090,This has been one of the most surreal weeks... #bostonstrong #boston #prayforboston @ Boston, MA http://t.co/h33jx6tbBR
3091,1441805138969,0,0,1,0,off-topic,1,112,3091,@Pawel__Brozek no I'm not there yet, I could be down Friday-Sunday
3092,1441805138969,0,0,1,0,off-topic,0,115,3092,Having a diff time sleeping cant get images and sirens out my head...
3093,1441805138970,0,0,1,0,off-topic,1,104,3093,Laundry time (@ Sweet Pio's Palace) http://t.co/MhnQvE89Wt
3094,1441805138970,0,0,1,0,off-topic,0,180,3094,RT @GregMitch: Parody of typical Tom Friedman column from abroad--see if you can tell it from the real thing!   http://t.co/sWBnOrKYj9
3095,1441805138971,1,0,1,0,on-topic,1,186,3095,@_lovehanna @Imthatkid19 Local Boston stations. But if u put it on Fox news, they are also using are local Fox station. They say he's in Boa
3096,1441805138971,0,0,1,0,off-topic,0,77,3096,I hate how I have back problems
3097,1441805138972,0,0,1,0,off-topic,1,175,3097,#April23 &amp; #April25 #LifeisSoExcitingTour  at the Wilbur Theatre. Good music invades Boston next week. http://t.co/wHgmZMhJ9A
3098,1441805138972,0,0,1,0,off-topic,0,109,3098,Ive allways been doing me. Im My own follower and My own leader
3099,1441805138972,0,0,1,0,off-topic,0,121,3099,I'm at Bass Pro Shops - @bassoutlet (Foxborough, MA) http://t.co/74nKErelGL
3100,1441805138973,0,0,1,0,off-topic,1,131,3100,I'm at Stadium Sports Bar &amp; Grill (Boston, MA) w/ 3 others http://t.co/YiGMxblaN2
3101,1441805138973,0,0,1,0,off-topic,0,74,3101,I wanna see Obama today!!!!!
3102,1441805138974,0,0,1,0,off-topic,1,155,3102,Amazing collage of Hill Holliday's building from my former intern, Sam @ Hill Holliday http://t.co/8cVoN5VCMz
3103,1441805138975,0,0,1,0,off-topic,1,134,3103,@kaylee_beers: @CristinnxO just admitted she had a crush on me #Awkk #SorryImMarriedGirl
3104,1441805138975,0,0,1,0,off-topic,0,93,3104,I don't care...I'll eat the rats. #bostonstrong
3105,1441805138976,0,0,1,0,off-topic,1,116,3105,@annifer ALL of em. ooh. and prince, let's go crazy. another good one.
3106,1441805138976,0,0,1,0,off-topic,0,120,3106,Public works crews out cleaning sidewalks and streets just now in Kenmore.
3107,1441805138977,0,0,1,0,off-topic,1,97,3107,People be so surprised when I tell them I'm African
3108,1441805138977,1,0,1,0,on-topic,0,162,3108,At Logan. Extra security, long lines, but as kind as I've seen the place. Tons of marathon runners here flying home.
