2084,1441803369758,0,0,1,0,off-topic,1,88,2836,Marathon commute not too bad so far. #mbta
2085,1441803369758,0,0,1,0,off-topic,0,120,2837,Ugh I wish I wasn't in Boston right now ! #bringmehome #scaryworldwelivein
2086,1441803369759,0,0,1,0,off-topic,1,117,2838,The only good thing about being wounded in the buttox is the ice cream.
2087,1441803369759,0,0,1,0,off-topic,0,92,2839,@kevpaterno @MrMnmeng good. Go big or go home.
2088,1441803369760,0,0,1,0,off-topic,1,107,2840,@GiulianaRancic can you send me on a date with a band member?
2089,1441803369760,1,0,1,0,on-topic,0,117,2841,Two bombs can effect so much , hurt so many nd confuse alot of feelings
2090,1441803369761,0,0,1,0,off-topic,1,82,2842,alllll I gotta say is get it glittle
2091,1441803369761,0,0,1,0,off-topic,0,140,2843,God Bless the 3 cops that decided to shake MY hand in Dunkin Donuts because of my white chucks
2092,1441803369762,0,0,1,0,off-topic,1,176,2844,@iAMPhilliy  RT @TheJustinDuncan: If your girlfriend is 5'9 or taller, y'all aren't boyfriend and girlfriend. Y'all are teammates.
2093,1441803369762,0,0,1,0,off-topic,0,152,2845,Last day of classes ever if summer classes and grad school somehow don't count #teacherproblems #seniortho
2094,1441803369762,0,0,1,0,off-topic,0,178,2846,@SlimeRoscoe boston is a mix of grand theft auto and #callofduty fair to say niggas gotta be stuck in the house on a hot ass day fml
2095,1441803369762,0,0,1,0,off-topic,0,103,2847,Fill us in RT @ChristFinnegan: Question answered. Thanks.
2096,1441803369763,0,0,1,0,off-topic,1,130,2848,I just swallowed my contact. I was trying to clean it like a cat #marathonmonday2013
2097,1441803369763,0,0,1,0,off-topic,0,175,2849,Good questions from @alisonkingnecn @necn to a high school classmate of suspects. New insight to what kind if kids they are/were.
2098,1441803369764,0,0,1,0,off-topic,1,156,2850,@1DLittleSecret: I try to be cool, but I'm not very good at it -Liam's quote at Madame Tussauds! aw oh ma gawd
2099,1441803369764,0,0,1,0,off-topic,0,137,2851,Two $8 32oz beers as 2 slices #bruins (@ Halftime Pizza w/ 3 others) http://t.co/WzR0yMUmTD
2100,1441803369764,0,0,1,0,off-topic,0,101,2852,Jonathan texted me back guys! He's alive ! Hallelujah !
2101,1441803369765,0,0,1,0,off-topic,1,138,2853,Four hours later and I'm finally done with my history paper... #thestruggle#is#still#notover
2102,1441803369765,0,0,1,0,off-topic,0,172,2854,Seriously. Such a loss. @Jimmy_Toscano: I'm really going to miss the Masters website for another year. Congrats to Adam Scott.
2103,1441803369765,0,0,1,0,off-topic,0,113,2855,@crab_fight_me @marsh_melody LIL I THOUGHT WE HAD SOMETHING SPECIAL
2104,1441803369766,0,0,1,0,off-topic,1,130,2856,Can't believe I'm drinking mimosas and chugging beer at 9am #flipcup #MARATHONMONDAY
2105,1441803369766,0,0,1,0,off-topic,0,71,2857,Honestly happy to be home
2106,1441803369767,0,0,1,0,off-topic,1,186,2858,A usual work-week is pretty exhausting. Spending it glued to social media, terrible events, getting chewed out and little sleep worsens that
2107,1441803369767,0,0,1,0,off-topic,0,91,2859,I cant wait til all of our plans come through
2108,1441803369768,0,0,1,0,off-topic,1,80,2860,@CraigJHines are you replacing me?
2109,1441803369768,1,1,1,1,on-topic,0,159,2861,Shocked by the news from Boston Marathon, waiting for news on what exactly happened, knew some people running it.
2110,1441803369769,0,0,1,0,off-topic,1,163,2862,RT @muskrat_john Thanks all for asking and caring.  YES! Many thanks to everyone for their kind thoughts and concern!
2111,1441803369769,0,0,1,0,off-topic,0,114,2863,I'm staying up way too late I'm going to hate myself in a few hours.
2112,1441803369769,1,0,1,0,on-topic,0,117,2864,Pray for all.. #prayforboston @ One Boston Place http://t.co/KTx5wSEGFO
2113,1441803369770,0,0,1,0,off-topic,1,122,2865,Times like this bringing out the good cops. Normally we hear about renicops.
2114,1441803369770,0,0,1,0,off-topic,0,103,2866,I guess I shouldn't cook anymore, I think I'm gonna vomit
2115,1441803369771,0,0,1,0,off-topic,1,104,2867,I'm at The Skinny Beet (Boston, MA) http://t.co/ZPQQz74mxq
2116,1441803369945,0,0,1,0,off-topic,174,99,2868,@lopez_118 speaks some real shit #respect #followback
2117,1441803369946,1,0,1,0,on-topic,1,186,2869,I've heard enough from the media and from these bastards' family...this was a terrorist attack on the United States and we are still at war.
2118,1441803369946,0,0,1,0,off-topic,0,186,2870,Dear ignorant people,       Shut up about Obama, he is not superman and can not put out bombs. He's as human as you are and did not do this.
2119,1441803369946,1,1,1,1,on-topic,0,149,2871,If I get one more email about Marathon Monday safety rules I am going to purposely violate all of them.
2120,1441803369947,0,0,1,0,off-topic,1,97,2872,She's crazy.. I don't even want her to go wtf #tmlt
2121,1441803369947,0,0,1,0,off-topic,0,80,2873,I'm hearing a helicopter right now
2122,1441803369948,0,0,1,0,off-topic,1,99,2874,My iPhone cover just broke, Someone get me a new one.
2123,1441803369949,0,0,1,0,off-topic,1,105,2875,@cardenbow @torianne14 ugh sorry gurls I'm only on season 3
2124,1441803369949,0,0,1,0,off-topic,0,134,2876,@Damn_Saudia @thiskidmook no he be acting like.... You know what lol let me not go there
2125,1441803369949,0,0,1,0,off-topic,0,124,2877,@epaloma_hermosa Yayyyy ! Ill be 21! Lol . Havent seen you in legit years Haha
2126,1441803369950,0,0,1,0,off-topic,1,157,2878,I'm at Fenway Park - @mlb for Tampa Bay Rays vs Boston Red Sox (Boston, MA) w/ 68 others http://t.co/uhdONya7Fv
2127,1441803369950,0,0,1,0,off-topic,0,178,2879,The idea that the head coach is solely responsible for coaching offense and defense needs to stop. Most have a defensive coordinator
2128,1441803369950,0,0,1,0,off-topic,0,134,2880,@LilyanaRomero: Can everyone stop talking about partying for one second? Jesus Christ nA
2129,1441803369951,1,0,1,0,on-topic,1,108,2881,@MeghanLibby 2 explosions at the finish line.. Alleged bombing
2130,1441803369951,0,0,1,0,off-topic,0,99,2882,Fighting w. Yur Man a lot can make Him Goo away too !
2131,1441803369952,0,0,1,0,off-topic,1,143,2883,Looking at a lot of dirty cars that need a cleaning... (@ 88 Black Falcon) http://t.co/aennOdjoe8
2132,1441803369952,0,0,1,0,off-topic,0,130,2884,@CoreyKeyz this dude corey is funny as shit..unfollow if u think otherwise #RT #lolz
2133,1441803369952,0,0,1,0,off-topic,0,107,2885,@CodnBitches aint gonna happen des, you got too many groupies
2134,1441803369953,0,0,1,0,off-topic,1,107,2886,@alaynaself add some draino to any drink to spice up ur night
2135,1441803369954,0,0,1,0,off-topic,1,119,2887,Thank god I'm finally on the train going home from Boston. #prayforboston
2136,1441803369954,1,0,1,0,on-topic,0,172,2888,Feeling sad but safe and more then anything proud on this beautiful day in #Boston @ Financial District http://t.co/RwVWRyJLfI
2137,1441803369954,1,0,1,0,on-topic,0,119,2889,after what the police scanners are saying, these bastards better go down.
2138,1441803369955,0,0,1,0,off-topic,1,109,2890,I'm at Lone Star Taco Bar w/ @laurade777 http://t.co/9vRYU8w6jp
2139,1441803369956,1,0,1,0,on-topic,1,182,2891,RT @CyrusVJ: BPD: We have multiple scenes, not all of them cleared...incident in #Watertown did involve explosive devices against police
2140,1441803369956,0,0,1,0,off-topic,0,183,2892,@WhenBoys_: F is for friends who dont talk to you.  U is for Ur alone.  N is for never having any plans at all, all you do is sit at home
2141,1441803369956,1,1,1,1,on-topic,0,97,2893,I wanna go out with being worried of getting bombed
2142,1441803369957,0,0,1,0,off-topic,1,183,2894,http://t.co/ubLIHTa9tt Just... oh my goodness. I love it. And I want it. And I love it. BLOOD DRAGON is like an action figure commercial.
2143,1441803369957,0,0,1,0,off-topic,0,97,2895,@JohnAvolio ha. You have that video? I never saw it
2144,1441803369957,1,0,1,0,on-topic,0,141,2896,I'm at Boston Marathon Finish Line TV Compound (Boston, MA) w/ 27 others http://t.co/0VVKVVNTYk
2145,1441803369958,0,0,1,0,off-topic,1,137,2897,@Goodlife_inc Killer resume: Save lives, manage rock stars, sling rocket fuel. Pretty good.
2146,1441803369958,0,0,1,0,off-topic,0,78,2898,This is just super weird. Sorry.
2147,1441803369959,0,0,1,0,off-topic,1,121,2899,Air Force One at Logan, with Coast Guard protection. http://t.co/WN8eenhxk2
2148,1441803369959,0,0,1,0,off-topic,0,111,2900,@catt419 @jkrazykid @forever_mariee_ lol I need a bow for my hair
2149,1441803369960,0,0,1,0,off-topic,1,113,2901,@Iamlomonz thanks love. Just keep everyone affected in your prayers
2150,1441803370133,0,0,1,0,off-topic,173,109,2902,Sorry @NikkiGlaser but @JENNIWOWW would fuck yer shit up hahaha
2151,1441803370134,0,0,1,0,off-topic,1,98,2903,@RJ_88Keys: #HonestHour I can't roll lmfaoooo#turnup
2152,1441803370134,0,0,1,0,off-topic,0,173,2904,@follow_tamera girl it's the same thing as going out to come to my house ..I live like right up the street but w.e I ain't shit
2153,1441803370135,1,0,1,0,on-topic,1,111,2905,@juanjohnsilvers: #YouAintFromBoston if you don't know of BriAbba
2154,1441803370135,0,0,1,0,off-topic,0,104,2906,Woke up to get food at 3, too much energy to sleep... #fml
2155,1441803370136,0,0,1,0,off-topic,1,79,2907,I hate not being able to sleep in
2156,1441803370137,0,0,1,0,off-topic,1,92,2908,Im trynna go to brazil some time in the future
2157,1441803370137,0,0,1,0,off-topic,0,129,2909,I'm at Quincy Market - @faneuilhall (Boston, MA) w/ 3 others http://t.co/FvpXKG4M0M
2158,1441803370138,0,0,1,0,off-topic,1,93,2910,I have ocd when it comes to my closet and draws
2159,1441803370138,1,1,1,1,on-topic,0,145,2911,@ashleyxcat I'm okay, I was right where it exploded about 2 minutes before. Thanking my lucky stars
2160,1441803370139,0,0,1,0,off-topic,1,84,2912,@HeluEllu please be careful! Dear god.
2161,1441803370139,1,0,1,0,on-topic,0,154,2913,An eerily quiet Boston. #iamlegend #boston #bostonlockdown @ Boston University Bridge http://t.co/ilFerCFxfA
2162,1441803370140,1,0,1,0,on-topic,1,136,2914,@KevinHart4real we need it its crazy out here a lot of innocent ppl got hurt so far 2 dead
2163,1441803370140,0,0,1,0,off-topic,0,136,2915,Squeezing in a dinner date!  Thank you Gma and Gdad! (at @BarLouie) http://t.co/wzotANMJJS
2164,1441803370140,0,0,1,0,off-topic,0,111,2916,SOMEONE'S FUCKING CAR ALARM HAS BEEN GOING OFF FOR 20 MINUTES NOW
2165,1441803370141,0,0,1,0,off-topic,1,169,2917,you know your party is dope when neighbors come by like if you guys aren't gonna invite us then at least keep it down #208W
2166,1441803370141,0,0,1,0,off-topic,0,186,2918,Caceres &amp; Asamoah are not set starters on Juve and fit huge needs for Milan, El Shaarawy is a perfect ST for Conte system #previoustweet
2167,1441803370141,0,0,1,0,off-topic,0,177,2919,#Country in #CoordinatorAlley - Track 2: Springsteen - now I'm chugging the kool-aid @chris_d_cameron @rachellyons61 #Woah-oh-oh-oh
2168,1441803370142,0,0,1,0,off-topic,1,100,2920,This is all gonna come out my ass @autumn_maarie #LMAO
2169,1441803370143,0,0,1,0,off-topic,1,182,2921,@ElizabethAnne97 some little ass kid tryed fucking with tinkam soo he went after him and started punching him in the face shit was crazy
2170,1441803370143,0,0,1,0,off-topic,0,105,2922,#petpeeves I don't like sitting too close to the dashboard.
2171,1441803370143,0,0,1,0,off-topic,0,93,2923,@TonyRBranco Gulp, I'm going to be, in 2 weeks.
2172,1441803370144,0,0,1,0,off-topic,1,186,2924,@Stephanie_Link how do you feel about $CHRW? Cheap gas good for truck margin and air and sea shipping as well. Looks cheap here/ solid yield
2173,1441803370144,0,0,1,0,off-topic,0,125,2925,@aaronwhite Some great memories here as I'm sure you have. Not easy to replace.
2174,1441803370145,0,0,1,0,off-topic,1,101,2926,Four hour study session today #breakTime#tacos#backToIt
2175,1441803370145,0,0,1,0,off-topic,0,66,2927,I don't give a fuck.
2176,1441803370146,0,0,1,0,off-topic,1,154,2928,I'm about 1/4 mile from the command post. This is too freaky that I live right in the middle of all of this!
2177,1441803370146,0,0,1,0,off-topic,0,94,2929,Is it really 7:53??? I haven't slept a wink, yo.
2178,1441803370147,0,0,1,0,off-topic,1,96,2930,@Podolski10 u r awesome! One of my fave at Arsenal
2179,1441803370148,1,0,1,0,on-topic,1,126,2931,Love my adopted city. We'll get through this @ Boston, MA http://t.co/XSDYmzoX7B
2180,1441803370148,1,0,1,0,on-topic,0,182,2932,The craziest part about today was that I wasn't even in Boston yet and our train was stopped and checked for bombs by a full bomb squad.
2181,1441803370148,0,0,1,0,off-topic,0,108,2933,The #swan s are tired. @ The Swan Boats http://t.co/nEf8lA11wN
2182,1441803370149,0,0,1,0,off-topic,1,96,2934,We are spiritual beings living a human experience!
2183,1441803370149,0,0,1,0,off-topic,0,86,2935,@xoraachox apparently their searching ut
2184,1441803370150,0,0,1,0,off-topic,1,131,2936,@brayanthen yes Im watching the news right now, but they said to keep your eyes open.
2185,1441803370150,0,0,1,0,off-topic,0,88,2937,Being at work in this condition is so bad.
2186,1441803370151,0,0,1,0,off-topic,1,102,2938,I'm done looking for perfect I just want something real!
2187,1441803370151,0,0,1,0,off-topic,0,129,2939,Closed report at N42.29 E71.09 http://t.co/akf84FLQpl. Case noted. not enough info.
2188,1441803370152,0,0,1,0,off-topic,1,99,2940,she got her food before me &amp; I was here first ...
2189,1441803370153,0,0,1,0,off-topic,1,126,2941,Get me back to Vermont. Where there are no sirens. No helicopters. None of this.
2190,1441803370153,0,0,1,0,off-topic,0,149,2942,@MegaPlayDoe: When bitches be like you cumming in the condom not on me &lt;&lt;&lt;&lt;&lt;&lt;&lt;&lt;
2191,1441803370153,0,0,1,0,off-topic,0,127,2943,im only countin on your cancellation when I should be countin on you at my doorrr
2192,1441803370154,0,0,1,0,off-topic,1,114,2944,That awkward moment when someone's butt looks better than your face.
2193,1441803370154,0,0,1,0,off-topic,0,79,2945,I wish this girl had a phone !!!!
2194,1441803370155,0,0,1,0,off-topic,1,121,2946,@_MarieHarrison @shanna_burke party at my place I got the Doritos my niggas
2195,1441803370155,1,0,1,0,on-topic,0,142,2947,I can't believe what I'm waking up to. I feel like I've been living in a horror movie this week.
2196,1441803370156,0,0,1,0,off-topic,1,126,2948,I'm at Late Night Kitchen - @budiningservice (Boston, MA) http://t.co/JSYWQh49xI
2197,1441803370326,0,0,1,0,off-topic,170,121,2949,hope i get to see @ashleybbal11 today and that she has a great day! #cheers
2198,1441803370326,0,0,1,0,off-topic,0,111,2950,I'm at Consolidated Concepts (Allston, MA) http://t.co/NQVxSiUyPh
2199,1441803370327,0,0,1,0,off-topic,1,104,2951,I'm at Fox &amp; Hound (Quincy, MA) http://t.co/T1VCi7Ejyq
2200,1441803370328,0,0,1,0,off-topic,1,146,3129,What others names do u have apart from whore, ho which ur dumbass sef calls hoe, u no like cutlass .
2201,1441803370328,0,0,1,0,off-topic,0,148,3130,Good. This is a cluster fuck RT @kellymacfarland: @LPizzle @danicaps on lockdown but hanging in there.
2202,1441803370329,0,0,1,0,off-topic,1,100,3131,Calling Michael, Marquisse Jordan  he hates that shit.
2203,1441803370330,0,0,1,0,off-topic,1,106,3132,@ataiznunna_ figure what out lmao and http://t.co/VFUV2XjUQk
2204,1441803370330,0,0,1,0,off-topic,0,95,3133,@kinky: We all have that one ex that changed us..
2205,1441803370331,0,0,1,0,off-topic,1,76,3134,Why must he be sooo selfish ?!
2206,1441803370332,0,0,1,0,off-topic,1,112,3135,Tie up your scarf real tight. These boys are out for blood tonight
2207,1441803370333,1,0,1,0,on-topic,1,131,3136,The Bruins game better not get cancelled. We all need something to get away from this
2208,1441803370334,0,0,1,0,off-topic,1,127,3137,@Bill_Nye_Tho__ this made me laugh for the first time since yesterday. thank you.
2209,1441803370334,0,0,1,0,off-topic,0,148,3138,To the girl at the mall wearing a backpack that says grenade on it in huge letters- you're a dumb fuck
2210,1441803370335,0,0,1,0,off-topic,1,77,3139,It's still written in the stars
2211,1441803370336,0,0,1,0,off-topic,1,93,3140,America has a big target on their back it seems
2212,1441803370337,0,0,1,0,off-topic,1,112,3141,@universalhub list of open #WiFi in #boston http://t.co/lM40PPwRCz
2213,1441803370338,0,0,1,0,off-topic,1,152,3142,@susantorres35 I literally just said to @jackweiland I don't know how people are watching this wo Twitter.
2214,1441803370338,1,0,1,0,on-topic,0,70,3143,Sad for my city  #Boston
2215,1441803370339,0,0,1,0,off-topic,1,174,3144,Getting to bottom of this, we had it for lunch. MT @Mcconvillematic That's a lie I was there. I looked for a solid 30-40 minutes
2216,1441803370340,0,0,1,0,off-topic,1,98,3145,@Rico_WDE16 @AnaleeS6 yeah we're fine thanks mane!!!
2217,1441803370340,0,0,1,0,off-topic,0,137,3146,@JonnyArakelian @mikefreeman26 @christian_lilly @sammybarron4 ok your all annoying #goodbye
2218,1441803370341,0,0,1,0,off-topic,1,120,3147,Oh my goodness I didn't acknowledge my 500th tweet!! #Special #TwitterGame
2219,1441803370342,0,0,1,0,off-topic,1,180,3148,What are your goals?  Do you write them down?  It may sound silly to you, but THE most successful people write their goals, and why...
2220,1441803370343,0,0,1,0,off-topic,1,110,3149,@GetABiggerBoat he's in Arlington and will be home in two weeks!
2221,1441803370344,0,0,1,0,off-topic,1,131,3150,okay well here goes a very very long day of hell taking care of evil little children.
2222,1441803370515,0,0,1,0,off-topic,171,83,3151,I can never sleep past 10 anymore -.-
2223,1441803370518,1,1,1,1,on-topic,3,180,3152,The world's media assembled for first #bostonmarathon #explosions update. #Boston #BostonBombings LIVE on @NECN http://t.co/zEm0uww92s
2224,1441803370519,0,0,1,0,off-topic,1,90,3153,You ain't the only one tryna be the only one
2225,1441803370519,0,0,1,0,off-topic,0,118,3154,@TheFunnyTeens: I say i don't know to everything when I'm in a bad mood.
2226,1441803370520,0,0,1,0,off-topic,1,128,3155,@ashhayers @mickyadams3 hangout with me on Thursday bitches! Lets do something fun
2227,1441803370520,0,0,1,0,off-topic,0,111,3156,Seeing evil dead... A little nervous. @beccabishop27 @dantesmall_
2228,1441803370521,0,0,1,0,off-topic,1,100,3157,Obama you didn't say it any better  Not here in Boston
2229,1441803370522,0,0,1,0,off-topic,1,176,3158,Alkermes touts positive Phase 2 results of depression drug: Alkermes plc (Nasdaq:ALKS) released positive... http://t.co/EQarvpRmOa
2230,1441803370522,0,0,1,0,off-topic,0,76,3159,Up for 26 1/2 hours, you guys.
2231,1441803370523,0,0,1,0,off-topic,1,96,3160,I make every nigga irrelevant. I'm sex intelligent
2232,1441803370523,1,1,1,1,on-topic,0,184,3161,@BrooklynDecker they did it so that the public will stop using social media to relay what is happening on the scanners. For officer safety
2233,1441803370524,0,0,1,0,off-topic,1,106,3162,@TheGreatGlavino it could just be from this whole situation.
2234,1441803370525,1,0,1,0,on-topic,1,174,3163,Whoever would bomb this kind of happy, community day filled w love and support for strangers is a demon. #Boston #BostonMarathon
2235,1441803370525,1,1,1,1,on-topic,0,112,3164,Reallly wish my mom wasnt blocks away from watertown right now wtf
2236,1441803370526,0,0,1,0,off-topic,1,126,3165,@DFDeuce1 your fucking lucky Im in Boston right now cause I will break yor shit!
2237,1441803370527,0,0,1,0,off-topic,1,105,3166,Letss goo mcgary and robinson back for another year #GoBlue
2238,1441803370527,1,0,1,0,on-topic,0,159,3167,Feet away from the Kennedy's, world diplomats, and the Prez...nbd #bostonstrong #cathedral http://t.co/G6M2AhvgT9
2239,1441803370528,0,0,1,0,off-topic,1,91,3168,Now Becca sees my indirects i c u Becca i c u
2240,1441803370528,0,0,1,0,off-topic,0,100,3169,I hope nothing like this happen for the walk of hunger
2241,1441803370529,1,0,1,0,on-topic,1,177,3170,I thank God for saving me, close to my work today there were 2 explosions and I was still at work. God decided that wasn't my time.
2242,1441803370529,0,0,1,0,off-topic,0,101,3171,@RicanInBoston I was crying at my desk. This is fucked.
2243,1441803370530,0,0,1,0,off-topic,1,185,3172,@MyProtegee LOL you would choose Katherine over Elena #shitsreal Caroline is my favorite Vampire! Elena will be dismissed if she does that!
2244,1441803370530,0,0,1,0,off-topic,0,166,3173,Look Auntie Muslim fuck, your nephew's killed Americans. Lower your voice and suck start a shotgun. Or leave my country.
2245,1441803370530,1,0,1,0,on-topic,0,177,3174,This week started out filled with so much anticipation &amp; joy in the air. Stay safe #boston #BostonStrong http://t.co/HTm2X9Mz1K
2246,1441803370530,0,0,1,0,off-topic,0,149,3175,It's good, Jimmy. Thanks for checking in. @jimmyhuiquincy: @swtrgrl how's everything going at HQ today?
2247,1441803370531,1,1,1,1,on-topic,1,160,3176,Currently receiving text updates regarding Joey McIntyre's position in the Boston Marathon. http://t.co/0rO42IPs1l
2248,1441803370531,0,0,1,0,off-topic,0,100,3177,Just put my phone on the charger so I'm going to bed !
2249,1441803370532,0,0,1,0,off-topic,1,140,3178,They're advising people to stay indoors and my mom is dragging me to the mall...#dontwanttodie
2250,1441803370532,0,0,1,0,off-topic,0,133,3179,Getting anxious! Boarding my flight in ten, then it's #fiftyshadesofgrey the whole way!
2251,1441803370532,0,0,1,0,off-topic,0,108,3180,whoever did this should be tied up downtown and stoned #Maggot
2252,1441803370533,0,0,1,0,off-topic,1,137,3181,Headed back to LA LA land. (@ Terminal C - @bostonlogan w/ 5 others) http://t.co/ByKs8zgGI2
2253,1441803370533,0,0,1,0,off-topic,0,143,3182,@JahHills Abducted, drugged, brain refurbished. Who leaves home without their phone &amp; wallet?
2254,1441803370534,0,0,1,0,off-topic,1,120,3183,Highlight of the day: watching Michelle Obama being driven down Huntington
2255,1441803370534,0,0,1,0,off-topic,0,78,3184,@Dope_Giqqlesx u do the same hun
2256,1441803370535,0,0,1,0,off-topic,1,183,3185,@SavedByTheKelll: The fact that @Maaaggz just hunted me down and hugged me made my day so happy you're near me, see you tomorrow sunshine
2257,1441803370535,0,0,1,0,off-topic,0,109,3186,The awk moment when I forget where I put my stuff in the lib...
2258,1441803370536,0,0,1,0,off-topic,1,76,3187,Goin out to eat with my family
2259,1441803370536,0,0,1,0,off-topic,0,181,3188,Boston, folks. RT: @billy_baker: For no explicable reason, there is now a man outside the courthouse playing Amazing Grace on bagpipes.
2260,1441803370537,0,0,1,0,off-topic,1,139,3189,:(  @NotifyBoston: [CANCELLATIONS] #RedSox, #Bruins games + Big Apple Circus for Friday 4/19.
2261,1441803370537,0,0,1,0,off-topic,0,162,3190,@bjp no. we were just commenting on it, however. will check it out this week. loving this weather &amp; lunch walks.
2262,1441803370537,0,0,1,0,off-topic,0,92,3191,Whole top diamond bottom row gold @dantesmall_
2263,1441803370538,0,0,1,0,off-topic,1,134,3192,@iHateCourtneyB: Stupid ass Sister Charlotte ... Should've broken her other leg. really?
2264,1441803370538,0,0,1,0,off-topic,0,88,3193,Have you ever popped champagne on a plane?
2265,1441803370539,0,0,1,0,off-topic,1,72,3194,FUCK THIS AIRPORT MY NIGGA
2266,1441803370540,0,0,1,0,off-topic,1,157,3195,Holy fuck, just saw a video from last night shooting on 7 News... looks like a fucking war zone.. #BostonStrong
2267,1441803370701,0,0,1,0,off-topic,161,125,3196,@noellandry_: Everything you said to me was just a lie until you left basically
2268,1441803370701,0,0,1,0,off-topic,0,158,3197,@walternebedum Least productive day ever. I'm working up to hour 14 of continuous news coverage. I need a drink.
2269,1441803370701,0,0,1,0,off-topic,0,160,3198,@ChampagneRod119: http://t.co/iHSEzYqgC3  @JoeyBenjamins I appreciate the help bro we all we got (in my Ben voice)
2270,1441803370702,0,0,1,0,off-topic,1,170,3199,Revound and I'm so sick of everyone's bullshit. It's all about me from now on, so suck my fucking dick if you don't like it.
2271,1441803370702,1,0,1,0,on-topic,0,83,3200,Boston is way too quiet for my liking
2272,1441803370703,0,0,1,0,off-topic,1,103,3201,@TheOnlyLincoln7 come talk to me when u way less than 250
2273,1441803370703,0,0,1,0,off-topic,0,137,3202,@universalhub Still weird...or maybe I watch &amp; read too many CSI, Criminal Minds etc ;)
2274,1441803370707,0,0,1,0,off-topic,4,109,3203,@kenzieflanigan hahaha oh boy. Tell her it will surely be okay!
2275,1441803370708,0,0,1,0,off-topic,1,182,3204,I can't believe that after Marotta got Lichtsteiner,Vidal,Barzagli,Bonucci, Pirlo,Pogba for less than Melo/Amauri he is still questioned
2276,1441803370708,0,0,1,0,off-topic,0,142,3205,Why is random people following me? Shit let it be one of my friend when i was in k1 or some shit
2277,1441803370709,0,0,1,0,off-topic,1,119,3206,#Boston @ Boston Logan International Airport (BOS) http://t.co/U3eyQElhFv
2278,1441803370709,0,0,1,0,off-topic,0,143,3207,@Rhea_EdgeZimmer YOUR NAME IS RHEA OMG SO IS MINE. CAN WE BE BESTFRIEND FOREVER IT WAS MENT TO BE
2279,1441803370710,0,0,1,0,off-topic,1,118,3208,I'm freezing in the lecture hall and my professor is putting me to sleep
2280,1441803370710,0,0,1,0,off-topic,0,77,3209,Well I've been drunk since noon
2281,1441803370711,0,0,1,0,off-topic,1,145,3210,@TheFireTracker2 The lone wolf thoery is HIGHLY unlikely considering the locations and coordination
2282,1441803370711,1,0,1,0,on-topic,0,112,3211,Confounded but not consumed - Rev Liz Walker #bostonstrong #Boston
2283,1441803370712,0,0,1,0,off-topic,1,105,3212,Sounds like its the Brown asshole on the run. CATCH HIM!!!!
2284,1441803370712,0,0,1,0,off-topic,0,124,3213,Can't Hold Us music video is best music video since And We Danced. #motherMary
2285,1441803370713,0,0,1,0,off-topic,1,138,3214,I love #UBurger #Boston #bacon #bbq #cheeseburger #heavenly @ UBurger http://t.co/lSCZvziMu7
2286,1441803370713,0,0,1,0,off-topic,0,83,3215,@michelledeidre he better be alive!!!
