1470,1441805116929,0,0,1,0,off-topic,0,162,1470,No oh.. Na one castrated bastard come my mention to call me a HOE.. Nigga can't even spell HO ..Mscheeew @miss_beckz
1471,1441805116929,1,0,1,0,on-topic,0,86,1471,Safe but shaken....scary day in Back Bay
1472,1441805117493,0,0,1,0,off-topic,564,130,1472,They're making a sequel to Link to the Past for 3DS?! Fuck! Now I have to buy a 3DS.
1473,1441805117493,0,0,1,0,off-topic,0,142,1473,@DDUBsBOSTONjenn frida, @JKandDDUB_Amor 's brother was running and I think they stopped him too.
1474,1441805117494,0,0,1,0,off-topic,1,110,1474,My mother stay talking shit  &amp; wonders where I get it from !
1475,1441805117494,0,0,1,0,off-topic,0,94,1475,Just posted a photo @ KFC http://t.co/t9i3YVQMPt
1476,1441805117494,0,0,1,0,off-topic,0,64,1476,And I want my mom!
1477,1441805117495,0,0,1,0,off-topic,1,121,1477,Sean Lehomo just showed me his mangina... I repeat he showed me his mangina
1478,1441805117495,0,0,1,0,off-topic,0,155,1478,Hot 97 Boston: Promotions Intern ( #HydePark , MA) http://t.co/iUjwitQb3o #internship #Job #Jobs #TweetMyJobs
1479,1441805117495,0,0,1,0,off-topic,0,113,1479,Staying a mile away from explosions... It's not looking good at all
1480,1441805117496,0,0,1,0,off-topic,1,147,1480,I'm gonna be so lonely for the next couple of days, everyone's leaving to new York tomorrow except me
1481,1441805117496,0,0,1,0,off-topic,0,154,1481,@rawrachaelrawr @bridgetx26 a tv show one day where all me @Chris11Coleman and @Brandonsully20 do is #TurnUp
1482,1441805117496,0,0,1,0,off-topic,0,183,1482,My radio show IN THE GROOVE on @WECB won the Going Solo award tonight. Tune in Tuesdays at http://t.co/3p5sAgpK9m! http://t.co/5nJzstnW2I
1483,1441805117496,0,0,1,0,off-topic,0,103,1483,Blood Drive at Dean tomorrow from 12:00 to 5:00. #BeThere
1484,1441805117496,0,0,1,0,off-topic,0,178,1484,@BOOBIIESx: @UrObsessionKeyz: Wait! Do we even have a blender? Lol. *scratches heas* I do Yeah but when you go bye bye? No more lol.
1485,1441805117496,1,1,1,1,on-topic,0,189,1485,#PTL for protecting me &amp; everyone I know here in Boston from the explosions. Thanks everyone for the concerned texts! Keep praying for Bos.
1486,1441805117496,0,0,1,0,off-topic,0,126,1486,@OMGFactsCelebs: The senator of Nebraska tried to sue God. @TheTanz93 HAHAHAHAHA
1487,1441805117497,0,0,1,0,off-topic,1,145,1487,@wsmusicsc and youre singing BG right now. Just fell in love. And you havent even performed it yet.
1488,1441805117497,0,0,1,0,off-topic,0,111,1488,I'm at JP Seafood Cafe (Jamaica Plain, MA) http://t.co/nFyXpZE7WH
1489,1441805117497,0,0,1,0,off-topic,0,184,1489,What does it mean when most of who twitter thinks is similar to you has blocked you? Uh..totally hypothetical #Asking4aFriend #NotMe #okme
1490,1441805117497,0,0,1,0,off-topic,0,123,1490,Waiting for it to get better and it keeps getting worse how is this happening
1491,1441805117497,0,0,1,0,off-topic,0,155,1491,@VanessaTSmiles Stay there and when order is lifted, you should go home. No point in trying to get back here.
1492,1441805117497,0,0,1,0,off-topic,0,96,1492,@Donyk95: If we must fight. Lets fight for peace ?
1493,1441805117498,0,0,1,0,off-topic,1,114,1493,Ed Davis: 3 dead, 17 in critical condition, 176 casualties in total.
1494,1441805117498,0,0,1,0,off-topic,0,71,1494,Just saw my nigga Denzel.
1495,1441805117498,0,0,1,0,off-topic,0,149,1495,@Murraymints2012 is 30 mins an hour ok? We're gnna bring out the cake for fletch the dad I live with...
1496,1441805117498,0,0,1,0,off-topic,0,88,1496,If I see suspect 2 I'm calling 911 and 119
1497,1441805117499,1,1,1,1,on-topic,1,96,1497,Looks like I might be stuck in boston for the day.
1498,1441805117499,1,1,1,1,on-topic,0,106,1498,@RedSox Great slogan for such a sad time here. We are strong
1499,1441805117499,1,0,1,0,on-topic,0,98,1499,Sad day in #Boston, sad day for the United States...
1500,1441805117500,0,0,1,0,off-topic,1,68,1500,My ass is already numb
1501,1441805117500,0,0,1,0,off-topic,0,86,1501,It looks like I got punched in both eyes
1502,1441805117500,0,0,1,0,off-topic,0,142,1502,I'm at @BostonLogan International Airport (BOS) (Boston, MA) w/ 58 others http://t.co/NNwc0uPFoY
1503,1441805117500,0,0,1,0,off-topic,0,117,1503,late nights with no one to talk to &lt;&lt;&lt;&lt;&lt;&lt;&lt;&lt;&lt;
1504,1441805117501,1,0,1,0,on-topic,1,184,1504,Mile 26 of the #BostonMararthon was dedicated to the Newtown families, some were sitting in the VIP section across from the 1st explosion.
1505,1441805117501,0,0,1,0,off-topic,0,115,1505,Large tent structure at Boylston and Dartmouth http://t.co/DzsNW0WbWZ
1506,1441805117501,0,0,1,0,off-topic,0,92,1506,@tyler_bell111 what time is practice tomorrow?
1507,1441805117501,0,0,1,0,off-topic,0,129,1507,Tomorrow, the Sox will receive their first legitimately loving ovation in two years
1508,1441805117501,1,1,1,1,on-topic,0,123,1508,I'm nervous for marathon Monday and I'm not even racing tomorrow. #Boston2013
1509,1441805117502,0,0,1,0,off-topic,1,92,1509,THEN try to go at your girls neck nigga please
1510,1441805117502,0,0,1,0,off-topic,0,109,1510,Could really use a stress ball right now. In that kind of mood.
1511,1441805117502,0,0,1,0,off-topic,0,86,1511,To make matters worse my phone is on 13%
1512,1441805117503,0,0,1,0,off-topic,1,94,1512,Meeghan just backed up her car up into me lol ow
1513,1441805117503,0,0,1,0,off-topic,0,80,1513,@BkFinest9 we was on another level
1514,1441805117503,0,0,1,0,off-topic,0,99,1514,Fox 25 be switching shit up. #7News is where its at !
1515,1441805117504,0,0,1,0,off-topic,1,124,1515,Trying to tell my dad to come into Cambridge for work today...get a grip buddy
1516,1441805117504,0,0,1,0,off-topic,0,105,1516,Definitely getting a maid once I get my own house #insallah
1517,1441805117504,0,0,1,0,off-topic,0,75,1517,I don't Want my breds no more
1518,1441805117504,0,0,1,0,off-topic,0,98,1518,Things fall apart so better things can fall together
1519,1441805117505,0,0,1,0,off-topic,1,108,1519,Won't passed the weed but I'll passed the bitch - school boy q
1520,1441805117505,0,0,1,0,off-topic,0,81,1520,@BarackObama hang out with me today
1521,1441805117506,0,0,1,0,off-topic,1,93,1521,@d0ntpaanic I'd prefer not to... please go away
1522,1441805117506,0,0,1,0,off-topic,0,110,1522,@TheGreatGlavino they just said someone is near the arsenal mall
1523,1441805117507,0,0,1,0,off-topic,1,99,1523,@ad_Franc @max_dgaf lmao Astrid is always here for me
1524,1441805117507,0,0,0,0,off-topic,0,182,1524,running as soon as they let me: currently, I'm on a strict 'no-running' order from my PT due to knee issues...... http://t.co/dMEcgVZgsn
1525,1441805117507,0,0,1,0,off-topic,0,86,1525,I'm ten minutes away from quitting ufood
1526,1441805117507,0,0,1,0,off-topic,0,75,1526,@AverageVirus i didnt do that
1527,1441805117508,0,0,1,0,off-topic,1,87,1527,Dead phone for 3 hrs = 17 snaps #snapchat
1528,1441805117508,0,0,1,0,off-topic,0,127,1528,@8_Semesters: Still haven't made the transition from spring break to school mode.
1529,1441805117508,0,0,1,0,off-topic,0,157,1529,People who use celebrities as their twit pics need to stop that. Now. It's not you and you don't look like them
1530,1441805117508,0,0,1,0,off-topic,0,170,1530,#TweetMyJobs #internship #Job alert: Youth Programs Internship | Zoo New England | #Boston , MA http://t.co/qMnrBUeLV5 #Jobs
1531,1441805117509,0,0,1,0,off-topic,1,161,1531,Deff a cover up first reports that there was a suspect arrested now there has been no arrest made #Something'sFishy
1532,1441805117509,0,0,1,0,off-topic,0,76,1532,I'm stuck in the ghetto. Help.
1533,1441805118056,0,0,1,0,off-topic,547,130,1533,I legit just left my dads aggy &amp; he thought he was getting his $200 dollars back
1534,1441805118056,1,0,1,0,on-topic,0,111,1534,I can't take all this in this shouldn't happen to anybody #RipNed
1535,1441805118056,0,0,1,0,off-topic,0,158,1535,@MargieJPhelps we were just wondering when were coming to Boston? Post the arrival times #margiephelpsfilthycunt
1536,1441805118056,0,0,1,0,off-topic,0,80,1536,@Beanz_NLMB you know I got the fam
1537,1441805118057,1,1,1,1,on-topic,1,124,1537,@la_vag_knee I'm in Boston now, yes. I'm about 3 miles from where it happened.
1538,1441805118057,0,0,1,0,off-topic,0,80,1538,@iBritJordan I'm okay, thank you !
1539,1441805118058,0,0,1,0,off-topic,1,112,1539,@moki52390 @bellehaitian she's always late with everything...smh!!
1540,1441805118058,0,0,1,0,off-topic,0,133,1540,@Ddrink73 thanks man, I appreciate it. Haha nah I'll stick with my jack Daniels instead
1541,1441805118058,0,0,1,0,off-topic,0,152,1541,Bad girls ain't no good, good girls ain't no fun, hood girls want a smart nigga, college girls want a thug
1542,1441805118058,0,0,1,0,off-topic,0,94,1542,@amarie05 I knew u would appreciate that comment
1543,1441805118058,0,0,1,0,off-topic,0,119,1543,Great just woke up to all the bullshit in the city and a huge pimple... Y
1544,1441805118059,0,0,1,0,off-topic,1,97,1544,@Sexi_Naffy lol not mine the one at the apple store
1545,1441805118059,0,0,1,0,off-topic,0,171,1545,The stress behind how many packages I have coming in the mail and not knowing which one is coming first ;x #Anxious #Annoying
1546,1441805118059,0,0,1,0,off-topic,0,111,1546,Crazy. My gf lives like 2 mins away from where the bomb went off.
1547,1441805118059,0,0,1,0,off-topic,0,164,1547,@Realitytea: NeNe Leakes Sister Speaks Out! http://t.co/H6nxQRqahe you never can win when you play dirty hunni! #karma
1548,1441805118060,1,0,1,0,on-topic,1,104,1548,Boston Police meeting in the street http://t.co/n7Trw7WK30
1549,1441805118060,0,0,1,0,off-topic,0,112,1549,But mean while I'm enjoying this nice drank http://t.co/L5rYTknO3i
1550,1441805118060,0,0,1,0,off-topic,0,113,1550,@UglyPeopIe: if ur hot please dont flirt with cute boys that i like
1551,1441805118061,0,0,1,0,off-topic,1,118,1551,Your dads white you live in a trailer my dads a spic i live in a mansion
1552,1441805118061,0,0,1,0,off-topic,0,96,1552,@merepar they're saying it was. Was right by there
1553,1441805118061,0,0,1,0,off-topic,0,82,1553,@Uhneedaaa its creepy da faq is that
1554,1441805118062,0,0,1,0,off-topic,1,111,1554,Late mornings and long nights (@ Bullhorn) http://t.co/6Jmfkdrkhn
1555,1441805118062,0,0,1,0,off-topic,0,97,1555,that's cool how will smiths in a movie with his son
1556,1441805118063,0,0,1,0,off-topic,1,144,1556,You hit up everyone's boyfriends actually, you aren't riding for him. You're riding multiple dicks
1557,1441805118063,0,0,1,0,off-topic,0,161,1557,My 2nd Home The Gym! #MiWe60DayWorkout Day 12 #notquitting #dedicated #GettingItIn  delaskar http://t.co/kTXbt1ByAu
1558,1441805118063,0,0,1,0,off-topic,0,111,1558,Last 9/11... That flag. @ Right Field Roof http://t.co/yx75XRwD02
1559,1441805118063,0,0,1,0,off-topic,0,82,1559,Enjoying the sun with @MissAbbyGlime
1560,1441805118064,0,0,1,0,off-topic,1,142,1560,I'm at @BostonLogan International Airport (BOS) (Boston, MA) w/ 32 others http://t.co/vvUZfAyPSp
1561,1441805118065,0,0,1,0,off-topic,1,160,1561,Last night I opened this note in the mail from my beautiful, sweet niece. Much needed #love http://t.co/za7oC3WWs9
1562,1441805118065,0,0,1,0,off-topic,0,83,1562,Dorris burke is even unbearable in 2k
1563,1441805118065,0,0,1,0,off-topic,0,93,1563,@FiveAtHeart me too, 1 wanted to go. I said no.
1564,1441805118066,0,0,1,0,off-topic,1,129,1564,Boston Berklee College of Music @ Berklee Performance Center http://t.co/fCvfov6CHp
1565,1441805118067,0,0,1,0,off-topic,1,150,1565,FUCK THIS STUPID ASS WORLD... I'm so thankful my cousin made it safe back home but what about my aunt :(
1566,1441805118067,1,0,1,0,on-topic,0,185,1566,Tight security at Bruins' arena: Security has been tightened at the TD Garden, where the Bruins play on Wednesday... http://t.co/iKzr1YagTN
1567,1441805118067,0,0,1,0,off-topic,0,111,1567,My home. #Boston @ Marriott's Custom House http://t.co/BBO37dNqFC
1568,1441805118067,0,0,1,0,off-topic,0,70,1568,I love the smell of weed
1569,1441805118068,0,0,1,0,off-topic,1,155,1569,Love, at the end of the day is stronger than some mistake somebody made, something they did that they regret.
1570,1441805118241,1,0,1,0,on-topic,173,152,1570,@JuttaBoliver they said there was a fire but it wasn't related to the explosion so at least thats a relief
1571,1441805118242,1,0,1,0,on-topic,1,98,1571,Explosion in Copley by Boston Marathon finish line?!
1572,1441805118242,0,0,1,0,off-topic,0,125,1572,My phone police scanner hasn't stopped going for 5 hours http://t.co/ymr6rStXo2
1573,1441805118242,1,0,1,0,on-topic,0,101,1573,Everyone is walking out of the city. Quietly.... #weird
1574,1441805118243,0,0,1,0,off-topic,1,74,1574,Never good enough for ANYONE
1575,1441805118243,0,0,1,0,off-topic,0,83,1575,Why I'm I hearing fiveO in Hyde Park?
1576,1441805118243,0,0,1,0,off-topic,0,82,1576,empty streets. Its a ghost town here
1577,1441805118244,0,0,1,0,off-topic,1,154,1577,Mullen: Layout Artist ( #Boston , MA) http://t.co/dhVBWeQpAW #Marketing #advertising #Job #Jobs #TweetMyJobs
1578,1441805118244,0,0,1,0,off-topic,0,79,1578,My only class today for cancelled
1579,1441805118244,0,0,1,0,off-topic,0,160,1579,Today people fight. ..but for what? !? Power, money all leading up to greed.  Fight for something more worthwhile.
1580,1441805118244,1,0,1,0,on-topic,0,99,1580,When was the last time there was a manhunt in the US?
1581,1441805118245,1,1,1,1,on-topic,1,122,1581,The twitter love for Boston right now is amazing! #staystrongboston #prayers
1582,1441805118245,0,0,1,0,off-topic,0,102,1582,@TayDonatella lol I would be to if I was watching that !
1583,1441805118245,1,0,1,0,on-topic,0,165,1583,@chad_courtright not really sure yet, I was at the halfway point, so 13 miles out of the finish line.  2 bombs for sure
1584,1441805118245,0,0,1,0,off-topic,0,105,1584,@UrLadyPimp2109 what did I tell you about the age your done
1585,1441805118246,0,0,1,0,off-topic,1,109,1585,Starbucks really should deliver though. I'm waiting for the day
1586,1441805118246,0,0,1,0,off-topic,0,155,1586,@JohnRaphael @thebravobitch that she is!  She may not have fired from Fox 5, but I bet she wasn't asked back.
1587,1441805118246,0,0,1,0,off-topic,0,137,1587,I may not have eardrums or a voice tomorrow... But it's all worth it. @Timeflies @HOBBoston
1588,1441805118246,0,0,1,0,off-topic,0,80,1588,Can't believe this guy is only 19!
1589,1441805118247,0,0,1,0,off-topic,1,73,1589,@AbiZagnoli do it you won't
1590,1441805118247,0,0,1,0,off-topic,0,67,1590,My back hurts so much
1591,1441805118247,0,0,1,0,off-topic,0,129,1591,@GailSimone Correction, one not dead...he's in custody but other is still at large.
1592,1441805118247,0,0,1,0,off-topic,0,133,1592,@HeyRatty same here but everyone keeps telling me I'm overreacting for feeling that way
1593,1441805118248,0,0,1,0,off-topic,1,123,1593,Aw @MattSchenk54 does care about me..lovvvve ya! #sibs http://t.co/ca2tSXjXn0
1594,1441805118248,0,0,1,0,off-topic,0,146,1594,I hope i become Known For a huge acomplishment (famous) thank My REAL niggas That where there For me
1595,1441805118429,0,0,1,0,off-topic,181,141,1595,@TrueSoccerProbz: This is on every soccer player's bucket list  http://t.co/EUCRcEfHpX yessssss
1596,1441805118430,0,0,1,0,off-topic,1,185,1596,Boston fans mourn, then cheer as sports return: Emerging from a moment of silence with a deafening cheer, fans at... http://t.co/8wRJTZemTT
1597,1441805118430,0,0,1,0,off-topic,0,148,1597,Go prep the new bottom they said. It'll be fun they said... #Boats @ Marina Bay http://t.co/AWUc3233Yk
1598,1441805118430,0,0,1,0,off-topic,0,85,1598,@meimeifoodtruck You guys are the best.
1599,1441805118431,0,0,1,0,off-topic,1,73,1599,Stupid people on my TL shit
1600,1441805118431,0,0,1,0,off-topic,0,80,1600,@terrenceKC thanks I will fix that
1601,1441805118431,1,1,1,1,on-topic,0,129,1601,Keep hearing helicopters go over my house..just want this all to end #prayforboston
1602,1441805118432,0,0,1,0,off-topic,1,186,1602,Hey Westboro Baptist Church- I dare you to come to Boston. Apparently you have no idea what this city is all about. You're fixin to find out
1603,1441805118432,0,0,1,0,off-topic,0,127,1603,My athletic aspirations for the next two years are skyrocketing tonight #inspired
1604,1441805118432,1,1,1,1,on-topic,0,167,1604,@BostonGlobe: UPDATE: Another suspicious package was reported near the Harvard #MBTA station @bernielim please stay safe.
1605,1441805118432,0,0,1,0,off-topic,0,136,1605,National Guard in Commons. Two more buses of guardsmen arrived now. http://t.co/1o8Zjd5OvY
1606,1441805118617,0,0,1,0,off-topic,185,111,1606,@KristinClaire29 I love you. Thank you for always thinking of me.
1607,1441805118617,0,0,1,0,off-topic,0,92,1607,The fact that I'm always in Back Bay scares me
1608,1441805118617,1,1,1,1,on-topic,0,104,1608,Quick updates on manhunt in Boston  http://t.co/8eIL4gBP2L
1609,1441805118618,0,0,1,0,off-topic,1,106,1609,I'm at Uncle Charlie's (Weymouth, MA) http://t.co/S7frSLB7d7
1610,1441805118618,0,0,1,0,off-topic,0,107,1610,Im really not in the mood to be dealing with PEOPLE LIKE THIS
1611,1441805118618,0,0,1,0,off-topic,0,151,1611,#wbz us marshalls and homeland security ordering huge crowd and hundreds of away from federal courthouse.
1612,1441805118618,0,0,1,0,off-topic,0,163,1612,@Rambeanstalk Same here. Have you watched the season finale yet? They said Andrea died. I hope the governor too. hehe
1613,1441805118618,0,0,1,0,off-topic,0,134,1613,I'm at John and Kathryn Silber Administrative Center (Boston, MA) http://t.co/wfV7EwCbaT
1614,1441805118619,0,0,1,0,off-topic,1,108,1614,@sedin151 Nah, all that's done is distracted me from studying.
1615,1441805118619,0,0,1,0,off-topic,0,103,1615,@CDuRKs8 @anut37 @BrianLombardo21 been doing that all day
1616,1441805118619,1,0,1,0,on-topic,0,103,1616,We are Boston, we are united, we are strong #bostonstrong
1617,1441805118620,0,0,1,0,off-topic,1,98,1617,I'm at Starbucks (Boston, MA) http://t.co/qOupQe9XHi
1618,1441805118620,1,0,1,0,on-topic,0,110,1618,State Police source says that shots were fired and suspect down.
1619,1441805118620,1,0,1,0,on-topic,0,109,1619,Officially in the audience for Barack Obama's address to Boston
1620,1441805118621,0,0,1,0,off-topic,1,151,1620,I have assessed all of my needs, and I have come to the conclusion that I need Ben and Jerry's ice cream.
1621,1441805118621,0,0,1,0,off-topic,0,134,1621,@onlyadayaway I am nice to everyone just not her, the girl saying that about my hometown
1622,1441805118621,0,0,1,0,off-topic,0,167,1622,Mullen: Senior Experience Designer ( #Boston , MA) http://t.co/2YviEPdcG9 #Marketing #advertising #Job #Jobs #TweetMyJobs
1623,1441805118621,0,0,1,0,off-topic,0,146,1623,@Lovelyy_Milli: @SafinahBumar: I love you guys where are you!?! What the fuck. Where are you ???????
1624,1441805118622,1,0,1,0,on-topic,1,169,1624,@nickkeyko and I are okay! Currently safe in our apartment. Completely shocked and devastated by the events here in #Boston
1625,1441805118622,0,0,1,0,off-topic,0,131,1625,@Swishdreams101: i want a serious ass, long ass relationship &gt;&gt;&gt;&gt;&gt;&gt;
1626,1441805118622,0,0,1,0,off-topic,0,171,1626,Our new flockette, stephhhlarsen, looking positively gorgeous in our new  Rain Dancer Dress by ladakh! http://t.co/65CO4zlEA0
1627,1441805118622,1,0,1,0,on-topic,0,83,1627,This is it lets get him #BostonStrong
1628,1441805118623,0,0,1,0,off-topic,1,163,1628,Photo Lab Technician - #Boston , MA (http://t.co/QBj4GUb0mW) Get Photography Jobs #Photography #jobs #job #GetAllJobs
1629,1441805118623,0,0,1,0,off-topic,0,169,1629,Saving this as a constant reminder of the most important and real life lesson one could learn Never, http://t.co/JQqvZxsNgH
1630,1441805118623,0,0,1,0,off-topic,0,102,1630,I can't change the past i can only influence the future.
1631,1441805118623,0,0,1,0,off-topic,0,105,1631,@LisaMarie885 pissed off. Is more like  it I hate Hyde park
1632,1441805118624,0,0,1,0,off-topic,1,123,1632,@Philly101580 hahahhaha woww I can't believe you just said that you redneck !
1633,1441805118624,0,0,1,0,off-topic,0,73,1633,Baby B isn't a baby anymore
1634,1441805118624,0,0,1,0,off-topic,0,84,1634,like tryna know somebody you never met
1635,1441805118625,1,1,1,1,on-topic,1,168,1635,Not yet recognized CNN correspondent @rzapp815 is tweeting live updates about current Watertown, MIT situations #followhim
1636,1441805118625,1,1,1,1,on-topic,0,145,1636,BOSTON BOMBERS: Search for green Honda Civic now called off. BOLO recalled by state police in Conn.
1637,1441805118625,1,0,1,0,on-topic,0,141,1637,That was scary, can't believe a place I call home was so close to the explosion! #PrayForBoston
1638,1441805118626,0,0,1,0,off-topic,1,85,1638,Omega x Tu No ta pa mi &gt;&gt;&gt;&gt;
1639,1441805118626,0,0,1,0,off-topic,0,108,1639,I FORGOT ME AND PAILLE HAD THE SAME BIRTHDAY! Happy 29th Pies!
1640,1441805118627,0,0,1,0,off-topic,1,112,1640,Just posted a photo @ Kennedy Fried Chicken http://t.co/euLJT0JoF8
1641,1441805118804,1,0,1,0,on-topic,177,149,1641,My roommate and I were close to the incident in Boston. We're okay, but everyone, please #prayforboston
1642,1441805118804,1,1,1,1,on-topic,0,174,1642,I love Boston. Regardless of the time I have lived here, this city has shown me love and respect. We. Are. Boston. #bostonstrong
1643,1441805118804,0,0,1,0,off-topic,0,163,1643,dhy poster session :) @ Massachusetts College of Pharmacy and Health Sciences (MCPHS) - Boston http://t.co/3cDOABnhwf
1644,1441805118805,0,0,1,0,off-topic,1,140,1644,Still can't get over how OK is a sideways person  OK  WHERE DID YOU COME FROM, WHO CREATED YOU
1645,1441805118805,0,0,1,0,off-topic,0,123,1645,I'm at MBTA Charles/MGH Station - @mbtagm (Boston, MA) http://t.co/wLZTP1t84z
1646,1441805118805,0,0,1,0,off-topic,0,100,1646,This zocalo joint better be good or I'm throwing a fit
1647,1441805118805,0,0,1,0,off-topic,0,112,1647,@lifewithmissk Nope. And I didn't bring my laptop home last night.
1648,1441805118806,0,0,1,0,off-topic,1,81,1648,My pep talk turned into a pep rally
1649,1441805118806,0,0,1,0,off-topic,0,95,1649,the biggest douchebag award goes to you #congrats
1650,1441805118807,0,0,1,0,off-topic,1,186,1650,You can't scare Catwoman into staying inside. I can't wait to prowl Boston Comic Con on Saturday and celebrate a wonderful part of our city!
1651,1441805118807,0,0,1,0,off-topic,0,145,1651,And I'll be in your corner like Mick, baby, 'til the end or when you hear a song from that big lady
1652,1441805118808,0,0,1,0,off-topic,1,129,1652,'Chechnya' shows up at this time as Trending Topic in Boston http://t.co/jghqhPZGyC
1653,1441805118808,0,0,1,0,off-topic,0,79,1653,@INDIEcud why were your pants off
1654,1441805118808,0,0,1,0,off-topic,0,128,1654,Anyone have another feed besides Broadcastify? I got booted and can't get it back.
1655,1441805118808,1,0,1,0,on-topic,0,92,1655,Some people lost their legs?!?! #prayforboston
1656,1441805118809,0,0,1,0,off-topic,1,98,1656,Never been so disgusted by someone in my entire life
1657,1441805118809,1,1,1,1,on-topic,0,184,1657,Holy Smack! We were feet from the explosion 15 minutes before it happened. #insane #bostonmarathon #explosion we're ok. praying for others
1658,1441805118809,0,0,1,0,off-topic,0,101,1658,@DreamSully I think we look nice together... #justsayin
1659,1441805118809,0,0,1,0,off-topic,0,138,1659,@annakkern my mom didn't want me to, but I have class and a doctors appointment so I have to
1660,1441805118810,0,0,1,0,off-topic,1,79,1660,yara has the biggest boobs in baa
1661,1441805118810,0,0,1,0,off-topic,0,134,1661,@cameronreeve @jjake1969 @whitney_schrock he's my Bestfriend, leave him alone you bully.
1662,1441805118810,0,0,1,0,off-topic,0,112,1662,@will_ellis15: Shut up already #noonecares everyone listen to will
1663,1441805118811,0,0,1,0,off-topic,1,70,1663,I think im a philosopher
1664,1441805118811,0,0,1,0,off-topic,0,134,1664,@stoolpresidente google Sunil. It certainly looks like him. Been missing since mid March
1665,1441805118811,0,0,1,0,off-topic,0,88,1665,These songs got me feelin some type of way
1666,1441805118811,1,1,1,1,on-topic,0,151,1666,Listening and watching all of the people trying to fight and protect for Boston right now.. Unbelievable.
1667,1441805118812,0,0,1,0,off-topic,1,123,1667,I'm at Bijou for John Digweed (Boston, MA) w/ 9 others http://t.co/LS8YTu9z6G
1668,1441805118812,0,0,1,0,off-topic,0,144,1668,@Will_Padgman thank you Will! I'm two blocks away from the explosion and my school is on lockdown.
1669,1441805118812,1,1,1,1,on-topic,0,184,1669,BPD: Do Not Compromise Officer Safety/Tactics by Broadcasting Live Video of Officers While Approaching Search Locations every news station
1670,1441805118812,0,0,1,0,off-topic,0,162,1670,I seriously love the friends I've made through twitter and tumblr. They are some of the best people I have ever met.
1671,1441805118812,0,0,1,0,off-topic,0,138,1671,ahhhh (at @TDGarden for Buffalo Sabres vs Boston Bruins w/ 95 others) http://t.co/XEE7WLK6Rn
1672,1441805118812,1,0,1,0,on-topic,0,124,1672,I'm at Prudential Center Tower (Boston, MA) w/ 2 others http://t.co/XdWDwuECTH
1673,1441805118813,1,1,1,1,on-topic,1,183,1673,This might sounds harsh, but why are people just becoming proud that they're from Boston..you should be proud regardless of what happens.
1674,1441805118813,0,0,1,0,off-topic,0,184,1674,#welcometomyschoolwhere people who are smart act so stupid, rich white kids complain about how hard life is, and are snapbacks everywhere.
1675,1441805118996,0,0,1,0,off-topic,183,84,1675,@szliu Yup! Wish I can watch Homeland.
1676,1441805118996,0,0,1,0,off-topic,0,137,1676,Lmao fuck you @Max_DGAF: @Anastasiyaiya can't be trusting Russians anymore. This is goodbye
1677,1441805118997,0,0,1,0,off-topic,1,90,1677,@JamesTaylor_23 it's been like that all week
1678,1441805118997,0,0,1,0,off-topic,0,94,1678,@beholdsquashua you already won it two years ago
