1,1441806181261,1,1,1,1,on-topic,1441806181261,184,30,You always hear abt explosions in Mumbai, Delhi, NYC but when it happens right in front of your house, it's totally numbing and frightening!
2,1441806181453,0,0,1,0,off-topic,192,154,31,Shots fired in South End, explosions in Texas. Why is the world crashing down now? I want to graduate college.
3,1441806181453,1,0,1,0,on-topic,0,178,6,Back Bay Businesses Large And Small Affected By Marathon Blasts: BOSTON  Three days after the Boston Marathon... http://t.co/rWbTJR7Fns
4,1441806181454,0,0,1,0,off-topic,1,121,36,I just fixed my erection in public and this chick saw me and started laughing
5,1441806181454,0,0,1,0,off-topic,0,143,37,You can it stop us @lizandbells @BenHMichaels (@ Sunset Cantina w/ 3 others) http://t.co/H8jxK8kOOT
6,1441806181459,0,0,1,0,off-topic,5,81,38,Getting on the plane , goodbye Boston
7,1441806181460,0,0,1,0,off-topic,1,154,33,Where's everyone who called me crazy when I said the sox where gonna be nasty???? #sorry #urwrong #alwaysright
8,1441806181461,0,0,1,0,off-topic,1,179,34,@HomunculusLoikm @MarxBogpaper @luchadora41 @southgadiva I think who the fuck is Jan and how the flying fuck do u think I fucking feel.
9,1441806181462,0,0,1,0,off-topic,1,86,28,@GerryCallahan Um, he's the mayor dumbass.
10,1441806181462,0,0,1,0,off-topic,0,173,29,!! @tyw_yzy: Bandz mk her Dnce@Samwizee: ! @_OfficialNAGz: Juicy J@Samwizee: She put that ass up in my hands, I remote control it
11,1441806181636,1,1,1,1,on-topic,174,156,32,#7News #Boston commercial with clips from yesterday's service just gave me the chills. #loveBoston #BostonStrong
12,1441806181636,0,0,1,0,off-topic,0,90,25,@Treezy_Dollasss you want me to call you now ?
13,1441806181636,0,0,1,0,off-topic,0,118,26,@BookerTda4th I'm trying book, I'm trying. I'll be safe though, I promise.
14,1441806181637,0,0,1,0,off-topic,1,172,27,Taste of the Nation @sharestrength #tonboston (@ Black Falcon Cruise Terminal w/ @thebostonfoodie) [pic]: http://t.co/an4kBggXsw
15,1441806181637,0,0,1,0,off-topic,0,72,35,How did I just wake up now..
16,1441806181637,0,0,1,0,off-topic,0,83,22,She said she left and never coming back
17,1441806181640,1,0,1,0,on-topic,3,102,20,Thank you to everyone who is keeping our city safe #heroes
18,1441806181640,0,0,1,0,off-topic,0,172,21,Fleetwood Mac is putting on such a badass show! #boston #fleetwoodmac #StevieNicks always a good time with @FastFreddyMurph ! :)
19,1441806181641,0,0,1,0,off-topic,1,121,13,Wtf is going on!!! So many incidents happening tonight! #scared #wanttogohome
20,1441806181641,0,0,1,0,off-topic,0,82,14,watch me crank dat watch me rooollllll
21,1441806181641,0,0,1,0,off-topic,0,111,15,I hate females That be acting up In front of people For nothing -.-
22,1441806181641,0,0,1,0,off-topic,0,98,16,@uh_leeshh_uh I mean they need to leave a lesson soooo
23,1441806181641,0,0,1,0,off-topic,0,121,39,@Gabbylicious6: Imagine this as a movie in the future Manhunt Boston Manhunt*
24,1441806181681,0,0,1,0,off-topic,40,88,17,#5WordsiHateToHear sorry we are not hireinng
25,1441806181682,1,1,1,1,on-topic,1,162,18,Tough to grasp what's happening right now in @bostonmarathon. Hopefully friends at @Marathon_Sports are safe and well.
26,1441806181682,0,0,1,0,off-topic,0,86,19,@kelllli_c that feeling when you just know
27,1441806181869,1,1,1,1,on-topic,187,116,10,9000 agents/officers working for 14 hours, so much respect #BostonStrong
28,1441806181869,0,0,1,0,off-topic,0,90,11,I mean obviously he'll win if he had a bomb XD
29,1441806181870,0,0,1,0,off-topic,1,83,12,@yannidenise : why don't you just @ me?
30,1441806181870,0,0,1,0,off-topic,0,101,9,This is what I deal with @poooodles http://t.co/r0VBmpLmsH
31,1441806181870,0,0,1,0,off-topic,0,120,7,I want the second suspect alive because I want to know the big question: why?
32,1441806181870,0,0,1,0,off-topic,0,77,8,I'm a brand bitch nicki the Queen.
33,1441806181870,0,0,1,0,off-topic,0,91,5,Let me love you @GavinQuin you know who else too
34,1441806181870,0,0,1,0,off-topic,0,110,4,@J_Adams91 oops, someone doesn't like to be told he's a lying punk.
35,1441806181871,0,0,1,0,off-topic,1,66,2,I just wanna go outside
36,1441806181871,1,1,1,1,on-topic,0,99,3,This is fucking crazy. Suspect # 2 has like 2 hours max.
37,1441806181871,0,0,1,0,off-topic,0,182,23,I must be the only person who doesn't want this guy killed. I want to know who sent him, if there are more out there, etc. I want justice!
38,1441806181871,0,0,1,0,off-topic,0,134,24,If u can't recognize a fact when u see one. Then GET LOST! Ain't gat time B.S @i_am_arndru
39,1441806181871,0,0,1,0,off-topic,0,163,1,Funny how I got twenty minutes of sleep last night. Funny how I've got six energy drinks with me. Bring it on exhaustion
40,1441806182245,1,0,1,0,on-topic,374,162,64,#Boston PD tweet: @Boston_Police: Despite reports to the contrary there has not been an arrest in the Marathon attack.
41,1441806182246,1,0,1,0,on-topic,1,155,58,Reports that multiple bombs are being detonated by police around Boston, seems the attack did not go as planned
42,1441806182246,1,0,1,0,on-topic,0,84,94,I'm praying everyone in Boston is okay..
43,1441806182246,0,0,1,0,off-topic,0,141,83,@imtonyfernandez the gay dating website of the same name is based out of Cambridge if that counts
44,1441806182247,0,0,1,0,off-topic,1,78,84,@ricoOG: I hope he's in that house
45,1441806182247,0,0,1,0,off-topic,0,85,85,#Honesthour I hate cocky stuck up bitches
46,1441806182247,0,0,1,0,off-topic,0,149,86,@ADP1113 @matthew_ward_92 I don't think he wants to sell Vidal, same way Moggi didn't want to sell Zidane
47,1441806182247,0,0,1,0,off-topic,0,144,87,@Factsionary: Canadians eat more donuts per capita than any other country. What a bunch of fatties!!
48,1441806182248,0,0,1,0,off-topic,1,75,88,Back at it. Find these fuckers!
49,1441806182248,0,0,1,0,off-topic,0,100,89,@Adoreealisha  I'm about to go holy holy those cops girl
50,1441806182248,1,0,1,0,on-topic,0,120,90,Having an incredibly hard time concentrating at work #justice #prayforboston
51,1441806182248,1,1,1,1,on-topic,0,124,91,@NHLBruins tribute was nothing short of amazing tonight... Chills #prayforboston
52,1441806182431,0,0,1,0,off-topic,183,74,92,@TisGQ best thing in the world
53,1441806182431,0,0,1,0,off-topic,0,122,93,@TheKyleHardy haha this woman is messing with my head. Thanks for the support!
54,1441806182431,0,0,1,0,off-topic,0,126,95,@yo_scoot you're welcome. That's the only way I know how to respond to a thank you
55,1441806182432,0,0,1,0,off-topic,1,112,76,I'm at Super Stop &amp; Shop (Dorchester, MA) http://t.co/PifmNoGJAH
56,1441806182432,0,0,1,0,off-topic,0,184,77,This ricin guy is a fucking idiot. Like did he really think Obama would go to the mailbox of 1600 Penn and retrieve the mail himself? #Logic
57,1441806182432,0,0,1,0,off-topic,0,67,78,@MsLittleSunset l m a o
58,1441806182433,0,0,1,0,off-topic,1,113,79,Their uncle dosent know anything about either one of them as people !
59,1441806182433,0,0,1,0,off-topic,0,128,80,#HonestHour most of my headaches that I'm always complaining about come from stress.
60,1441806182433,1,0,1,0,on-topic,0,158,81,@MLB: #Phillies OF @BenRevere9 taped a special message to his glove tonight: http://t.co/VrvFdYl71W #prayforboston
61,1441806182433,0,0,1,0,off-topic,0,87,82,These colors don't run.   #american #Boston
62,1441806182433,1,0,1,0,on-topic,0,100,62,#BostonStrong! This national anthem is too good! #chills
63,1441806182434,0,0,1,0,off-topic,1,175,63,@Reveur_KTM: @DezzyYBR: @Reveur_KTM: I hate when people leave me voicemails... then Im forced to check them can I leave you one? NO
64,1441806182619,0,0,1,0,off-topic,185,163,65,'Mass General' appeared on Monday 15 at the 14th place in the Top20 of Boston's Trending Topics: http://t.co/HjcxrjKLQd
65,1441806182619,0,0,1,0,off-topic,0,143,66,Hangin out indoors til my freedom ride gets here. #Boston (at @DunkinDonuts) http://t.co/OOSdqPDr7t
66,1441806182619,0,0,1,0,off-topic,0,187,67,#Boston is probably the only major city that if u fuck w/ them they will shut down the whole city..stop everything..&amp; find u@_Happy_Gilmore
67,1441806182620,0,0,1,0,off-topic,1,156,68,@TrendsGlasgow: Eric Twardzik, @eric_twardzik is now trending in #Glasgow http://t.co/Dl4JWVW3fa This is surreal
68,1441806182620,0,0,1,0,off-topic,0,178,69,I be talking to dudes I don't know who played in the league and wishing me the best on things cuz they know ima do big things #blessed
69,1441806182620,0,0,1,0,off-topic,0,143,70,I have no class this morning. Which is always nice however I wish it was for a different reason. :/
70,1441806182620,1,1,1,1,on-topic,0,118,71,This shit is getting even scarier. What the fuck is wrong with this world?
71,1441806182620,0,0,1,0,off-topic,0,112,72,Don't hmu if  1. your not gunna reply  2. if Your going to be ma dry
72,1441806182621,0,0,1,0,off-topic,1,180,73,In the morning will speak with chef and let you know. MT @tgordonn  would you be able to let me know if the chicken is soy free at loose
73,1441806182621,0,0,1,0,off-topic,0,176,74,first sox game :D w/ @thecarintwenty (@ Fenway Park - @mlb for Tampa Bay Rays vs Boston Red Sox w/ 57 others) http://t.co/BxRp4vyjN5
74,1441806182807,0,0,1,0,off-topic,186,77,75,I fucks with my local artists bro
75,1441806182807,0,0,1,0,off-topic,0,135,55,Why did you have to play games like that, of you didn't mean it you shouldn't have said it.
76,1441806182807,0,0,1,0,off-topic,0,101,56,Planning and Adaptability. The Ying and Yang of Business.
77,1441806182807,0,0,1,0,off-topic,0,139,57,@Dzhokhar_A. Dude your either going to get shot in the face or fucked in the ass in jail hahaha
78,1441806182807,0,0,1,0,off-topic,0,135,59,I'm at Old Colony Hospice &amp; Palliative Care, Inc. (Randolph, MA) http://t.co/DRr5XHBIsR
79,1441806182808,0,0,1,0,off-topic,1,121,60,I'm at 448 Park Drive - The Fontainebleau (Boston, MA) http://t.co/rtiCL37VtN
80,1441806182808,0,0,1,0,off-topic,0,84,61,Just gonna be one of those days I guess.
81,1441806182808,0,0,1,0,off-topic,0,95,52,Justin and rashid are losing hard as hell right now
82,1441806182808,0,0,1,0,off-topic,0,114,53,@The_Juventino In last few days I have become more optimistic he stays
83,1441806182808,0,0,1,0,off-topic,0,176,54,..This ain't no time for actin' and this ain't no time for games and this ain't no time for uncertainty.. Say my name say my name...
84,1441806182808,0,0,1,0,off-topic,0,172,51,Another major bonus to the weekend! One more day for a 3 day weekend woo! afbaumann8 @ Boston Beer Garden http://t.co/vfkgvb6LGc
85,1441806182893,0,0,1,0,off-topic,85,110,40,@Skibum39 mmmm well good luck tomorrow!! Tell me how the test goes
86,1441806182894,0,0,1,0,off-topic,1,154,41,@JohnKingCNN you are also not a journalist, or someone who understands sensitive situations. you are a puppet.
87,1441806182895,0,0,1,0,off-topic,1,88,42,@spaceboydenzy I'm hip we was cooking niggas
88,1441806182896,0,0,1,0,off-topic,1,84,43,@co_KAYainee lol i dont know, should i ?
89,1441806182896,0,0,1,0,off-topic,0,115,44,@mobilegurlz @buzzfeednews I should really be writing this with a quill
90,1441806182896,1,1,1,1,on-topic,0,181,119,One Boston Marathon suspect dead, Boston on lockdown; Update:...: One Boston Marathon suspect dead, Boston on ... http://t.co/SBgsE032Df
91,1441806183076,1,0,1,0,on-topic,180,141,97,Yup. RT @cjjoyce: Terribly strange to watch the President speak about the tragedy your home city.
92,1441806183077,0,0,1,0,off-topic,1,95,139,Mad excited to take my motorcycle license tomorrow
93,1441806183077,0,0,1,0,off-topic,0,123,140,@sexiiness_ Technically yes but Miley and Hannah Montana do different things.!
94,1441806183077,0,0,1,0,off-topic,0,97,136,Starting to hate second shift, wastes my whole day..
95,1441806183077,0,0,1,0,off-topic,0,184,137,Im on da road again im on another run im on lazy leather seat freestyln to da beat listening to bossie got me screamin free my nigga boosie
96,1441806183078,0,0,1,0,off-topic,1,122,138,Passion Pit-Middle East Club Boston /Chris Becker 2008 http://t.co/znSljGs26W
97,1441806183078,0,0,1,0,off-topic,0,110,129,I've been thinking about stuff I shouldn't even be thinking about
98,1441806183078,0,0,1,0,off-topic,0,87,130,My jam today. @wwe https://t.co/1mr23TFnZJ
99,1441806183078,0,0,1,0,off-topic,0,108,131,I'm at All About You salon (Foxboro, MA) http://t.co/bUkaDD9ezb
100,1441806183079,0,0,1,0,off-topic,1,114,132,RT @the_ashhole: THIS I WHY I LOVE THIS SCHOOL http://t.co/jdzQeEoERF
101,1441806183079,0,0,1,0,off-topic,0,96,133,@Nesx33 if you found a new love, better put a on it
102,1441806183264,0,0,1,0,off-topic,185,121,134,@SpirituallyBass @catt419 @jkrazykid @forever_mariee_ is there one in legacy
103,1441806183264,0,0,1,0,off-topic,0,83,135,cool sammi now I'm deleting that tweet
104,1441806183265,0,0,1,0,off-topic,1,164,121,#TweetMyJobs #Marketing #Job alert: Marketing &amp; PR Intern | PreApps com | #Boston , MA http://t.co/OrZlkYKFHM #Jobs
105,1441806183265,0,0,1,0,off-topic,0,123,122,Look for me on NBC maybe right next to the guy with the flag and Tuukka poster
106,1441806183265,0,0,1,0,off-topic,0,72,123,I hate twitter honestly lol
107,1441806183265,0,0,1,0,off-topic,0,70,124,Lose yourself in a moment
108,1441806183266,0,0,1,0,off-topic,1,95,125,I don't need to look, I already came across you :)
109,1441806183266,0,0,1,0,off-topic,0,123,126,@Boobeardrea yes ikr! Me too! Been craving for these two food omgomgomg!!! T.T
110,1441806183266,0,0,1,0,off-topic,0,87,127,Finally in my bed..sleeping until tomorrow
111,1441806183266,0,0,1,0,off-topic,0,177,128,You could call me any mean name you can think of and I wont care. Except fat,  thats the one word that hurts. #mean #uncallfor #ouch
112,1441806183267,0,0,1,0,off-topic,1,82,118,Movement in the boat! He just sat up!
113,1441806183267,0,0,1,0,off-topic,0,106,120,I wish my life was like an 80's movie #ikitscorny #butitstrue
114,1441806183267,0,0,1,0,off-topic,0,129,116,People who are out drinking PLEASE GO HOME NOW be indoors.. too many cops everywhere
115,1441806183267,0,0,1,0,off-topic,0,115,117,I'm at Joshua Tree - @jtreeboston (Allston, MA) http://t.co/Z6wxaQHR3W
116,1441806183451,0,0,1,0,off-topic,184,169,114,Working in an office I have come to realize that Office Space might be the most realistic, tonally accurate, film ever made.
117,1441806183451,0,0,1,0,off-topic,0,111,115,Welcome home from Ireland Strings Attached! http://t.co/zKUqxR7sbO
118,1441806183452,0,0,1,0,off-topic,1,111,110,@taylahussey1 hahahahah she should!!! Seeing as their best friends
119,1441806183452,0,0,1,0,off-topic,0,76,111,He made me hide in a closet wtf
120,1441806183452,0,0,1,0,off-topic,0,97,112,It's a fact that you're very beautiful   Thanks bruh
121,1441806183452,0,0,1,0,off-topic,0,181,113,Walking off with Napoli: Walkoff hits like the one Mike Napoli produced yesterday are exactly what the Red Sox... http://t.co/IACOnexrc2
122,1441806183452,0,0,1,0,off-topic,0,125,107,#lunchdate turns into Liz designated driving these clowns http://t.co/dF8CAOpPUQ
123,1441806183453,0,0,1,0,off-topic,1,94,108,I love when it's warmer outside then it is inside
124,1441806183453,0,0,1,0,off-topic,0,85,109,Am I the only drunk mf at this reunion ?
125,1441806183453,0,0,1,0,off-topic,0,92,96,@j_harrington11: Just wanna be cute with someone
126,1441806183453,0,0,1,0,off-topic,0,144,98,RFT @KGTrashTalk: One day we're all gonna agree that Stephen Curry was the best shooter of all time.
127,1441806183454,0,0,1,0,off-topic,1,119,99,The fact that @myrtlemanorshel favorited my tweet last night(: #myrtlemanor
128,1441806183646,0,0,1,0,off-topic,192,93,100,Just used my entire debit card hahaha #$1000gone
129,1441806183646,0,0,1,0,off-topic,0,88,101,How Selina didn't text me back &lt;&lt;&lt;
130,1441806183646,0,0,1,0,off-topic,0,82,102,I will never get sick of thrift shop.
131,1441806183647,0,0,1,0,off-topic,1,118,103,@CourageousGod he stole this suv before they put watertown on lock down..
132,1441806183647,0,0,1,0,off-topic,0,106,104,@stephyska Oh that's embarrassing for me then #doitallthetime
133,1441806183647,1,1,1,1,on-topic,0,140,105,I JUST WANT THEM TO TAKE #WATERTOWN #BostonMarathon SUSPECT INTO CUSTODY SO I CAN SLEEP TONIGHT
134,1441806183647,0,0,1,0,off-topic,0,91,106,well this has gotta be the longest crush ever.
135,1441806183647,0,0,1,0,off-topic,0,89,45,@MilesLacy have to start somewhere. Good luck
136,1441806183648,0,0,1,0,off-topic,1,135,46,The fact Sean Thorton just said they don't call us massholes for nothing  #truestatementtho
137,1441806183648,0,0,1,0,off-topic,0,85,47,Khyla should've left with us like I said.
138,1441806183648,0,0,1,0,off-topic,0,99,48,Something things are just fucked up in this crazy world
139,1441806183649,0,0,1,0,off-topic,1,118,49,Going from a bike to an automatic sucks, at least there's a sport mode lol
140,1441806183649,0,0,1,0,off-topic,0,164,188,Needed this right now. RT @EmergencyPuppy: Piglet wearing a sweater and little booties, napping. http://t.co/lFdTJyaTkq
141,1441806183833,1,0,1,0,on-topic,184,181,160,I have lived in Boston for 17 years, this is 1st time terrorists strikes me so close to home. I think of those who deal with it everyday
142,1441806183834,1,1,1,1,on-topic,1,166,159,#April 19 #fmsphotoaday: button. Watching breaking news in my BUSM tee in honor of #WearBostonDay. http://t.co/vPnPHmBJKE
143,1441806183834,1,0,1,0,on-topic,0,145,177,Copley 4.17 feels like a post apocalypse/walking dead scene... #prayforboston http://t.co/CuEKji0wnt
144,1441806183835,1,0,1,0,on-topic,1,181,171,france24: USA: Three killed, scores injured in Boston Marathon explosions: At least three people we... http://t.co/WOaq8W5PEi #albarjeel
145,1441806183835,1,0,1,0,on-topic,0,179,172,Such a sad sad day. Patriots Day will never be the same. The Boston Marathon will never be the same. Boston will overcome this tragedy
146,1441806183835,0,0,1,0,off-topic,0,181,144,to everyone who said our ideas of the entire 7/11 MIT shooting being related to the the assholes who caused the bombing... #givemeabadge
147,1441806183836,0,0,1,0,off-topic,1,154,182,It's so early (@ Fenway Park - @mlb for Tampa Bay Rays vs Boston Red Sox w/ 13 others) http://t.co/Q4JXuMACGF
148,1441806183836,0,0,1,0,off-topic,0,118,183,Abate and Boateng will be available for Juve match according to Sky Sport
149,1441806183837,0,0,1,0,off-topic,1,90,184,@rokkamharish77 thanks for the follow back :)
150,1441806183838,0,0,1,0,off-topic,1,82,185,@jackieinreverse Show em your biceps!
151,1441806184020,0,0,1,0,off-topic,182,97,186,@hannahefay my friend did&amp;the same thing happend
152,1441806184021,0,0,1,0,off-topic,1,116,187,Men and women's races side by side in media room http://t.co/htNYBUxMOa
153,1441806184021,0,0,1,0,off-topic,0,146,189,@TheRealestPablo I think it is more like she could write a song called though this would last forever
154,1441806184021,0,0,1,0,off-topic,0,76,190,Stay inside friends and be safe
155,1441806184022,0,0,1,0,off-topic,1,112,191,@dannnika: I want to text you but you'll more likely just ignore me
156,1441806184022,0,0,1,0,off-topic,0,136,181,happy birthday to my baby @nikki_burnes6 !!!!!! i hope you have a good day &amp; I LOVE YOU
157,1441806184022,0,0,1,0,off-topic,0,117,176,I slept for 10 hours straight. Why the hell am i so sleepy and tired wtf
158,1441806184022,1,0,1,0,on-topic,0,146,178,People leaving the area seem relatively calm. Many glued to their phones. #BostonMarathon @globalpost
159,1441806184023,0,0,1,0,off-topic,1,145,179,I dare the fucking Westboro baptist church to come to Boston, We're not afraid to best your ass here
160,1441806184023,0,0,1,0,off-topic,0,122,180,@amber_aponte: I just want babe to come over and cuddle with me all night omw
161,1441806184023,0,0,1,0,off-topic,0,112,175,Not too shabby bigbossroo617 @ Louis Vuitton http://t.co/MnGrJKo8s7
162,1441806184023,0,0,1,0,off-topic,0,120,173,Root beer float beef chuck @BCAE     @meyerlemonzest http://t.co/nqQUTdbFO5
163,1441806184207,0,0,1,0,off-topic,184,89,174,I think ill go to the east Boston pf tonight
164,1441806184208,0,0,1,0,off-topic,1,76,170,Wow they still did not find him
165,1441806184208,0,0,1,0,off-topic,0,111,169,That feeling of heavy eyes you get when you're buzzed &lt;&lt;&lt;
166,1441806184208,0,0,1,0,off-topic,0,84,168,@latenitereading Come hang in Boston :)
167,1441806184208,0,0,1,0,off-topic,0,139,166,The fact that my mom is not letting me go out... not even to the corner store. Like really Ma'
168,1441806184209,0,0,1,0,off-topic,1,146,167,@hwinkler4real That shanty must be Mosquito City when it gets crazy Humid #WeatherChannel #ExtraTowel
169,1441806184209,0,0,1,0,off-topic,0,113,164,Realizing that some of my friends aren't healthy for me. #stressfree
170,1441806184209,0,0,1,0,off-topic,0,175,165,@sarkrico, watching your boys on our home field (@ Fenway Park - @mlb for Tampa Bay Rays vs Boston Red Sox) http://t.co/qRlrSHioJF
171,1441806184210,1,0,1,0,on-topic,1,143,162,Congrats to all the runners :) (@ Boston Marathon Finish Line w/ 52 others) http://t.co/pnBPcJkt9V
172,1441806184210,0,0,1,0,off-topic,0,109,163,you're a lonely soul cause you won't let go of anything you hold
173,1441806184211,1,0,1,0,on-topic,1,180,161,Colleagues reporting that Federal officials, including ATF and FBI on scene at Watertown shooting. We don't know why. (via @JanetWuOn7)
174,1441806184211,0,0,1,0,off-topic,0,107,158,Oh sorry im sure ur really good outside the kitchen @EHernie17
175,1441806184395,0,0,1,0,off-topic,184,83,157,I need to redeem myself for last night
176,1441806184396,0,0,1,0,off-topic,1,106,155,Just decided that I give up on school altogether. Not for me.
177,1441806184396,0,0,1,0,off-topic,0,123,156,Salvadoran thug at work gave me three cookies today woooooo with a threat lmao
178,1441806184396,0,0,1,0,off-topic,0,136,154,but I don't need more friends they just need better shifts / the same shifts as me #sullies
179,1441806184397,0,0,1,0,off-topic,1,73,152,How did suspect #1 die ? Wtf
180,1441806184397,0,0,1,0,off-topic,0,79,153,I have 6bills! Whats the word? Lol
181,1441806184397,0,0,1,0,off-topic,0,105,151,@heathhealy3 @lordford00 hangout with my friends and you die
182,1441806184397,0,0,1,0,off-topic,0,118,141,@kplange39 If you need food, I'll gladly distract myself and cook for you
183,1441806184398,0,0,1,0,off-topic,1,171,142,Crazy lady at garden: can you give me a couple of dollars? Me: Sorry, got nothing. Her: Fuck you. Me: Okay. *Keeps on walking*
184,1441806184398,0,0,1,0,off-topic,0,111,143,@totallyodelee  ahhh lmao you just got to love this Boston Airport
185,1441806184398,0,0,1,0,off-topic,0,137,145,Wish people understood how severe yesterday was  the news will never do those people justice
186,1441806184398,0,0,1,0,off-topic,0,85,146,@Jleclair17 that loud pack for Saturday!
187,1441806184398,0,0,1,0,off-topic,0,90,147,Did he just call me big head? Cut it ouuut :$
188,1441806184584,0,0,1,0,off-topic,186,113,148,@krejcismoxie do my best. Hoping to grab one if someone leave behind
189,1441806184585,0,0,1,0,off-topic,1,151,149,@ThisGuySMH: Fun day planned tomorrow, time to hang with the #crazywhitegirls lmao I take offense to that!
190,1441806184585,0,0,1,0,off-topic,0,111,238,My body is sweating alcohol #rehearsaldiaries #ilikethesoundofthat
191,1441806184586,0,0,1,0,off-topic,1,134,239,@BCChorus thank you so much and thank you all for allowing me to be a part of this chorus
192,1441806184586,1,0,1,0,on-topic,0,122,240,Maret Tsarnaev, #Boston suspects' Toronto based Aunt, also seems pretty cool.
193,1441806184586,0,0,1,0,off-topic,0,112,241,@___Ximena i was so jelous that you went it looked so beautiful lol
194,1441806184587,0,0,1,0,off-topic,1,136,242,Extra appreciation for my early morning leg PT and for the #MBTA running vigilantly #boston
195,1441806184587,0,0,1,0,off-topic,0,82,235,Eating a burrito on the transit sorry
196,1441806184587,0,0,1,0,off-topic,0,100,236,@1bostonsports take them down, wipe them away, move on.
197,1441806184587,0,0,1,0,off-topic,0,91,237,Did I ever mention how much I hate shoot outs?
198,1441806184588,0,0,1,0,off-topic,1,153,233,Go onto fb and type in red boston . This guy recorded a video and you can hear all the shots fired!! Crazy!!
199,1441806184588,0,0,1,0,off-topic,0,65,234,Today was a good day
200,1441806184588,1,0,1,0,on-topic,0,112,228,Ahhh gotta love the best day of the year in Boston, Marathon Monday
201,1441806184772,0,0,1,0,off-topic,184,175,229,@MagPie625 #thanks god &amp; I would never get back with her &amp; he will soon enough findout how much of a pre madonna u are lol
202,1441806184772,0,0,1,0,off-topic,0,147,230,My job involves spending way to much time wasted waiting for other people to do their own job on time.
203,1441806184772,0,0,1,0,off-topic,0,165,231,@Leslieeemarie: @JVx3_ hey baby thought of you instantly hope you're okay over there &amp;lt;3 be safe please! Thank you
204,1441806184772,0,0,1,0,off-topic,0,91,232,#np dancing in my head - Eric turner vs avicii
205,1441806184772,0,0,1,0,off-topic,0,106,225,All right this isn't funny anymore. Where's my Matty Mckibben
206,1441806184773,0,0,1,0,off-topic,1,182,226,If you rip out my headphones while I'm listening to music because you think it's funny I will personally escort you to the gates of hell.
207,1441806184773,0,0,1,0,off-topic,0,100,227,@5DaniDee lol emotional Patrick! That's how I'm feeling
208,1441806184773,1,0,1,0,on-topic,0,124,217,#Boston will bounce back #bostonmarathon @ Copley Square http://t.co/bTBmG9tD8U
209,1441806184773,0,0,1,0,off-topic,0,83,218,So blessed to be safe. This is insane.
210,1441806184773,0,0,1,0,off-topic,0,153,219,@hryan57 people will take my last tweet  the wrong way but if waiting for you is wrong I dont wanna be right
211,1441806184774,0,0,1,0,off-topic,1,106,220,dude, if your calling yourself pretty I think our fucking sus
