3104,1441806235090,0,0,1,0,off-topic,3,144,3292,@carlymetz dude that's so scary... I'm glad it's not you. She's been in there for like 15 minutes.
3105,1441806235091,0,0,1,0,off-topic,1,98,3293,I just tell the truth so I'm cool in every hood spot
3106,1441806235092,0,0,1,0,off-topic,1,111,3294,@donovanEMC at the warehouse in sobo, i'll forward you the invite
3107,1441806235094,0,0,1,0,off-topic,2,119,3295,@emmanedell13 Ik Ik, but ppl are getting ma at Russia, Russia is our ally
3108,1441806235095,1,0,1,0,on-topic,1,102,3296,So many friends could have been in the area. Very scary.
3109,1441806235096,0,0,1,0,off-topic,1,80,3297,The sun goes down and so does she.
3110,1441806235097,1,0,1,0,on-topic,1,117,3298,@KacieFOX29 I have never seen the city so empty. http://t.co/VrI9mSstSO
3111,1441806235098,0,0,1,0,off-topic,1,175,3299,@stillinthewater IKR ): I'm trying I think of one good thing and the only thing is my dog but I don't think cami helps Texas much
3112,1441806235105,0,0,1,0,off-topic,7,139,3300,@FoOzTV no worries was just making sure this was indeed the case and i just hadn't missed it.
3113,1441806235110,0,0,1,0,off-topic,5,163,3301,On our phones on twitter instead of talking to real people #AlphaThetaInsecurities @evagach @lcbrown91 @emilylaughren
3114,1441806235110,0,0,1,0,off-topic,0,117,3302,Ugh daylight is playing upton, ma tonight and I really want to goooooo.
3115,1441806235113,0,0,1,0,off-topic,3,142,3303,So there isnt gonna be a pair of scoring title kd 5 this year :( thats if there was going to be.
3116,1441806235114,0,0,1,0,off-topic,1,76,3304,haven't tweeted in bad long ..
3117,1441806235116,0,0,1,0,off-topic,2,71,3305,tomorrow's gonna be 69 :D
3118,1441806235117,1,0,1,0,on-topic,1,155,3306,Classy move by the city of Chicago. Thank you Chi-town! #prayforboston #bostonmarathon http://t.co/rEiSpRxrtn
3119,1441806235118,0,0,1,0,off-topic,1,78,3307,Days are only getting worst man.
3120,1441806235120,1,0,1,0,on-topic,2,77,3308,I'm happy they got that asshole
3121,1441806235121,0,0,1,0,off-topic,1,181,3309,Love you more than anything sweety and I'm soo glad to have you in my life @Alaagaladari: @FatimaGaladari only because you asked me to.
3122,1441806235122,1,0,1,0,on-topic,1,125,3310,Who the FUCK bombs a marathon? Honestly? My thoughts go out to anyone effected.
3123,1441806235122,0,0,1,0,off-topic,0,160,3311,@NBCNews: Today was a 'shameful day for Washington,' Obama says after background check bill fails Tell em Barack!!
3124,1441806235123,0,0,1,0,off-topic,1,88,3312,I always wake up singing a different song.
3125,1441806235124,0,0,1,0,off-topic,1,102,3313,@MAD_youaintme @_apatten I don't think I even wanna know
3126,1441806235128,0,0,1,0,off-topic,4,148,3315,@AshleyPurdy Your website  My wallet ______          Wait I dont have a wallet. You know what I meannn
3127,1441806235131,0,0,1,0,off-topic,3,69,3316,I need a big ice coffee
3128,1441806235134,0,0,1,0,off-topic,3,108,3317,I'm at 9 Adams St, #3 (Charlestown, MA) http://t.co/Xgk8r7EukP
3129,1441806235137,1,0,1,0,on-topic,3,163,2985,Chalk outside of Niketown. You don't know strength until its your only option. #bostonstrong @ http://t.co/L8h4YPFt2B
3130,1441806235139,0,0,1,0,off-topic,2,124,2986,Army guy at mile 25 in full uniform and carrying a whole backpack #usa #crying
3131,1441806235141,0,0,1,0,off-topic,2,62,2987,I want to go out
3132,1441806235146,0,0,1,0,off-topic,5,91,2988,one direction in red mango brb killing myself
3133,1441806235147,0,0,1,0,off-topic,1,184,2989,@_ChicagoKidd   RETWEET THIS! FOLLOW ME &amp; EVERYONE ELSE THAT RETWEETS THIS! FOR 50+ FOLLOWERS FAST #TeamFollowBack  #Follow2BeFollowed
3134,1441806235148,0,0,1,0,off-topic,1,71,2990,Waking up to the bullshit
3135,1441806235149,0,0,1,0,off-topic,1,180,2992,Irish dancers step up to support one of their own: The Irish dance community is stepping up support for Jane... http://t.co/h9xnTKapvW
3136,1441806235149,0,0,1,0,off-topic,0,70,2993,Don't give up on me baby
3137,1441806235151,0,0,1,0,off-topic,2,90,2994,S/o to @mk_slattery have fun at UNH tomorrow
3138,1441806235152,0,0,1,0,off-topic,1,121,2946,@_MarieHarrison @shanna_burke party at my place I got the Doritos my niggas
3139,1441806235152,1,0,1,0,on-topic,0,142,2947,I can't believe what I'm waking up to. I feel like I've been living in a horror movie this week.
3140,1441806235153,1,1,1,1,on-topic,1,133,3340,Loving my city right now.... And it won't be long before they catch this asshole bomber
3141,1441806235153,1,0,1,0,on-topic,0,183,3352,@BuzzFeed: The Epic, Crazy, Horrifying, Ongoing Story Of The Boston Marathon Bombers http://t.co/j7ydJRvbge just wow. @sourcefed @PhillyD
3142,1441806235154,1,0,1,0,on-topic,1,96,3336,Thoughts and prayers for our colleagues in Boston.
3143,1441806235155,1,0,1,0,on-topic,1,169,3343,Thanks all for your concerns...I'm OK. I didn't see or hear the explosion at the Boston Marathon. Worried about my friends.
3144,1441806235157,0,0,1,0,off-topic,2,153,3351,@YourAnonNews if anyone gets arrested protesting the #wbc I will represent you pro bono no questions asked.
3145,1441806235158,1,0,1,0,on-topic,1,134,3365,Screw you terrorist, we aren't hiding at home (@ Boylston Street) http://t.co/bmzzgkSV7V
3146,1441806235159,0,0,1,0,off-topic,1,100,3318,Just posted a photo @ dreamland http://t.co/xQMnw94BxI
3147,1441806235161,0,0,1,0,off-topic,2,129,3319,Thank you old man at the gym for trying to hook me up with an engaged man. #useless
3148,1441806235162,0,0,1,0,off-topic,1,74,3320,@LadyNesi I'm fine, my love.
3149,1441806235163,0,0,1,0,off-topic,1,174,3321,when somebodies cheats and the mistress gets blamed I find it stupid as fuck. the mistress ain't the one that HAS to be faithful
3150,1441806235164,0,0,1,0,off-topic,1,113,3322,@RIPcompetition hummm hold up who said I was Doing your  hair.lmaoo
3151,1441806235165,0,0,1,0,off-topic,1,98,3323,I am loving the suspects uncle on the news right now
3152,1441806235166,0,0,1,0,off-topic,1,79,3324,Right where I was fucking sitting
3153,1441806235167,0,0,1,0,off-topic,1,122,3325,At ground zero, Andersen Cooper is about 10ft from me http://t.co/eHz3sP3u1z
3154,1441806235170,0,0,1,0,off-topic,3,180,3326,@DaRealMonieLove watertown suburb, egleston is a neighborhood within the city of Boston, thats why the L &amp; cornerstore r open lol!
3155,1441806235171,0,0,1,0,off-topic,1,102,3327,Shoutout to @Smoked_OutLugar  Everyone go and follow him
3156,1441806235175,1,0,1,0,on-topic,4,177,3328,Boston ff union prez Ed Kelly says my heart is broken but as a Bostonian my resolve for justice and liberty has never been stronger
3157,1441806235176,0,0,1,0,off-topic,1,138,3329,@GlovesOffHockey I was and I will be buddy. What section you in? Stop by I'll buy you a beer
3158,1441806235176,0,0,1,0,off-topic,0,84,3330,Someone with a car ZHASHTAG PICK US UP
3159,1441806235177,0,0,1,0,off-topic,1,70,3331,I kinda wanna just dance
3160,1441806235178,0,0,1,0,off-topic,1,156,3332,Nothing is impossible if you are willing to do whatever it takes for as long as it takes.   #AlwaysBeEpic #abe
3161,1441806235178,0,0,1,0,off-topic,0,122,3333,I honestly feel like giving up. Why even bother. #Emotional  #FuckIt #ImDone
3162,1441806235179,0,0,1,0,off-topic,1,94,3334,It's crazy when you don't have anyone to turn to
3163,1441806235180,0,0,1,0,off-topic,1,78,3335,Wow I can't even deal with today
3164,1441806235181,0,0,1,0,off-topic,1,111,3337,I'm at Yawkey Way (Boston, MA) w/ 4 others http://t.co/3PFdGAdEIg
3165,1441806235182,0,0,1,0,off-topic,1,87,3338,Who knows where Molly is ?! #coolasschick
3166,1441806235183,0,0,1,0,off-topic,1,147,3339,Senior .Net Engineer - #Boston , MA (http://t.co/feevIvjkt5) Get NET Jobs #NET #jobs #job #GetAllJobs
3167,1441806235185,0,0,1,0,off-topic,2,118,3341,#Martin #UncleJerome Jerome's in the house!! Lol  http://t.co/D2cSM31zeK
3168,1441806235188,0,0,1,0,off-topic,3,101,3342,Alix &amp; I always fight over who's gonna pay the bill
3169,1441806235191,0,0,1,0,off-topic,3,113,3344,@HomunculusLoikm @MarxBogpaper @luchadora41 Yah I'm sure #Jan does.
3170,1441806235192,0,0,1,0,off-topic,1,135,3345,@ASAPRockyTRILL: I don't give a fuck what people think of me. If I did, I wouldn't be me.
3171,1441806235193,0,0,1,0,off-topic,1,182,3346,@tonyrobbins I'd like to volunteer in Boston tomorrow I'm going to close my business for the day. Does your team need another volunteer?
3172,1441806235194,1,0,1,0,on-topic,1,138,3347,Bombs can kill and injure, but they will not crush the American spirit #boston #bostonstrong
3173,1441806235194,0,0,1,0,off-topic,0,84,3348,I would just fall down the stairs #FML
3174,1441806235195,0,0,1,0,off-topic,1,86,3349,14 days ...21 crazyyy didnt even realize
3175,1441806235196,0,0,1,0,off-topic,1,78,3350,@Jhay2217 are we going to play?!
3176,1441806235197,0,0,1,0,off-topic,1,123,3353,@Jsheeze97  @bsulllyyy like honestly u fruit loop u cant even spell wendesday
3177,1441806235198,1,0,1,0,on-topic,1,84,3354,@MuffyCx yea a bomb, im fine though :)
3178,1441806235199,0,0,1,0,off-topic,1,142,3355,I'm at @BostonLogan International Airport (BOS) (Boston, MA) w/ 58 others http://t.co/6UIdCs0ijm
3179,1441806235199,0,0,1,0,off-topic,0,87,3356,He's gonna light something up. Holy shit.
3180,1441806235201,1,1,1,1,on-topic,2,145,3357,.@blakehounshell: Um, wow. A picture of the 8-year-old boy killed in Boston. http://t.co/ERgrQusRHI
3181,1441806235201,1,0,1,0,on-topic,0,153,3358,@TheRealKerrin no the same one from the marathon shit. They killed his brother now they're looking for him.
3182,1441806235203,1,0,1,0,on-topic,2,157,3359,Boston is a tough and resilient town, so are it's people. -President Obama #BostonStrong http://t.co/WFOEJpvi3e
3183,1441806235205,0,0,1,0,off-topic,2,69,3360,i hate the fucking news
3184,1441806235207,0,0,1,0,off-topic,2,86,3361,@Mike_FTW or the birth of mob reporting.
3185,1441806235208,0,0,1,0,off-topic,1,116,3362,@CokeBoy1021 my computer is mad slow :/ fuck it ill wait till it drops
3186,1441806235208,0,0,1,0,off-topic,0,148,3363,Dear @ThoughtCatalog this is the worst time to be posting these depressingly accurate archive articles
3187,1441806235209,0,0,1,0,off-topic,1,129,3364,Drinking a HopBack Amber Ale by @TroegsBeer @ Canary Square  http://t.co/y4cBJQYqf9
3188,1441806235209,0,0,1,0,off-topic,0,104,3366,Driving by Watertown and seeing all this shit is craaaaazy
3189,1441806235210,0,0,1,0,off-topic,1,67,3367,So cold that I'm warm
3190,1441806235212,0,0,1,0,off-topic,2,168,3373,Cupcake baking time with @hannaheliz15 and @rebecca_mich! (@ West Village E 420 w/ 2 others) [pic]: http://t.co/TleJPHv4nj
3191,1441806235212,0,0,1,0,off-topic,0,139,3374,@jennyfriend thanks JJ. Will look into those resources.  Look for my #hashtag updates soon ;)
3192,1441806235214,1,1,1,1,on-topic,2,105,3375,Its hard to think that im only 25 minutes from the bombs...
3193,1441806235214,0,0,1,0,off-topic,0,77,3376,I wanna see ur tat @MaggieLeary
3194,1441806235216,0,0,1,0,off-topic,2,80,3377,Sooooo many weeks behind at school
3195,1441806235217,0,0,1,0,off-topic,1,75,3378,@ohsnappitsv where u play at?
3196,1441806235218,0,0,1,0,off-topic,1,74,3379,SHE CALLED ME STUPID...OH NO
3197,1441806235223,0,0,1,0,off-topic,5,180,3380,@NotifyBoston: All MBTA service suspended until further notice. Details: http://t.co/s4MmiM0ci4 @Jkrazykid @jcasseus7 @Forever_Mariee_
3198,1441806235224,0,0,1,0,off-topic,1,183,3381,@ThaBlackgl0ve I'm not giving up on pubs! It's just a nice change of pace from the constant BS and kids who don't make any effort to win.
3199,1441806235225,0,0,1,0,off-topic,1,93,3382,@YoungStud_Devii it won't let me dm you back :/
3200,1441806235226,1,0,1,0,on-topic,1,157,3383,I can hear so many sirens from my house. I thought it was the tv until I turned it off and could still hear it.
3201,1441806235227,1,0,1,0,on-topic,1,110,3384,AT LARGE suspect Dzhokhar Tsarnaev, 19, was living in Cambridge.
3202,1441806235229,0,0,1,0,off-topic,2,89,3385,@iEatPrettyGirlz that's how ya put u. Work.
3203,1441806235230,1,1,1,1,on-topic,1,161,3386,We are out of the city and safe. Thanks to everyone for checking in. Call your loved ones. This is so unsettling...
3204,1441806235231,0,0,1,0,off-topic,1,186,3387,@Sheep_Shooter Youre amazingly sweet Red I'm so lucky to have you as my bestest friend! I don't know what I would do without you. I love you
3205,1441806235231,1,1,1,1,on-topic,0,95,3388,It's getting dark here. Lets just pray #watertown
3206,1441806235232,0,0,1,0,off-topic,1,149,3389,Feels good to be a customer and not a server for once. Yum yum yum (@ Ferrara's) http://t.co/5VpkwlwLTo
3207,1441806235233,0,0,1,0,off-topic,1,99,3390,how can a person have so much power over my emotions?
3208,1441806235234,0,0,1,0,off-topic,1,156,3391,Dress rehearsal for BDE Faculty/Staff dance! (@ Sorenson Center for the Arts - @babson) http://t.co/AmnYFeD3sN
3209,1441806235235,0,0,1,0,off-topic,1,104,3392,@BrentBeshore @mattwilsontv Tell me more? Is there a link?
3210,1441806235237,0,0,1,0,off-topic,2,105,3393,I can't tell if I would be better or worse off without you.
3211,1441806235240,0,0,1,0,off-topic,3,76,3394,Starbucks is much needed today
3212,1441806235242,0,0,1,0,off-topic,2,105,3395,@bosoxbill: Wish you guys told me about this before I left.
3213,1441806235244,0,0,1,0,off-topic,2,99,3396,I took some great photos of myself weeping last night
3214,1441806235246,0,0,1,0,off-topic,2,163,3397,the sun keeps waking me up at like 6:30 every morning and then i can't fall back asleep!! #annoying #needdarkershades
3215,1441806235246,0,0,1,0,off-topic,0,105,3398,I miss my long hair so bad  just wish it would grow back ..
3216,1441806235247,0,0,1,0,off-topic,1,134,3399,@amarie05 idk for sure. She had a cyst rupture on her cervix that caused her to pass out
3217,1441806235248,1,1,1,1,on-topic,1,167,3400,A new car there looking for. Help the cops. Repost &amp; send around &amp; lets catch this fucker! http://t.co/qje0whrtbT
3218,1441806235249,0,0,1,0,off-topic,1,95,3401,That awkward moment when it's a skunk or raccoon.
3219,1441806235251,0,0,1,0,off-topic,2,145,3402,CHEF MANAGER Job - #Quincy , MA (http://t.co/9w0sVXcYa8) Get Chef Jobs #Chef #jobs #job #GetAllJobs
3220,1441806235251,1,0,1,0,on-topic,0,182,3368,Suspect described as dark-skinned male says @JohnKingCNN, adding was given further description but won't inflame intentions by repeating
3221,1441806235252,0,0,1,0,off-topic,1,100,3369,I'm at Supercuts (Brighton, MA) http://t.co/Z5E2PVfwJy
3222,1441806235254,0,0,1,0,off-topic,2,83,3370,@SkinlessJSn most def. not far at all
3223,1441806235257,0,0,1,0,off-topic,3,97,3371,pain a funny thing when u cant figure out the sorce
3224,1441806235258,0,0,1,0,off-topic,1,107,3372,Stop crying girls he's not worth it you got years to live for
3225,1441806235260,0,0,1,0,off-topic,2,126,2948,I'm at Late Night Kitchen - @budiningservice (Boston, MA) http://t.co/JSYWQh49xI
3226,1441806235261,0,0,1,0,off-topic,1,121,2949,hope i get to see @ashleybbal11 today and that she has a great day! #cheers
3227,1441806235261,0,0,1,0,off-topic,0,111,2950,I'm at Consolidated Concepts (Allston, MA) http://t.co/NQVxSiUyPh
3228,1441806235262,0,0,1,0,off-topic,1,104,2951,I'm at Fox &amp; Hound (Quincy, MA) http://t.co/T1VCi7Ejyq
3229,1441806235263,0,0,1,0,off-topic,1,92,2952,@botdfmusic thank u...ur soo sweet and caring.
3230,1441806235264,0,0,1,0,off-topic,1,160,2953,Love when I tell my bf that I wish I was on a bike and he brags about being one all day... Cool now #shutyourmouth
3231,1441806235264,0,0,1,0,off-topic,0,165,2954,Tranq this asshole and let him wake up strapped to a chair via a strong right hook to mouth. DON'T KILL HIM! #SetToStun
3232,1441806235264,0,0,1,0,off-topic,0,114,2955,People would really make a fake twitter account for this fucker SMFH
3233,1441806235265,1,1,1,1,on-topic,1,177,2956,Okay I get it that W Bush was an asshole but all these tweets about US using what is happening in Boston to start a war is RETARDED
3234,1441806235265,1,0,1,0,on-topic,0,184,2957,Manhunt forces families to stay indoors: Burt Granofskys plan for today was brunch and outside play time for his... http://t.co/TSTQHNE90A
3235,1441806235265,0,0,1,0,off-topic,0,107,2958,I'm at Fenway Park - @mlb (Boston, MA) http://t.co/R2kZWWm1vk
3236,1441806235266,0,0,1,0,off-topic,1,126,2959,S/O to my new follower @DopeAssShae . Appreciate the follow. Now following back!
3237,1441806235267,0,0,1,0,off-topic,1,135,2960,@Trojan_o: I'm already going to Bed #exhausted have a good night's sleep liv, I love you!
3238,1441806235267,0,0,1,0,off-topic,0,83,2961,Good morning @Jahnee_ have a good day
3239,1441806235269,0,0,1,0,off-topic,2,89,2962,@Kyra_brito: I can give two fucks about you
3240,1441806235271,1,0,1,0,on-topic,2,182,5076,#LiveWireRecords Boston Marathon Bombing -- Father Speaks ... My Kids Were FRAMED: The brot... http://t.co/QoSMq6c7tg #LiveWireAthletics
3241,1441806235273,1,1,0,0,on-topic,2,185,5078,RT @911BUFF: BOSTON: CODE BLACK AT AUBURN HOSPITAL. 'POSSIBLE BOMB DISCOVERED'. EMERGENCY PERSONNEL RUSHING. EVACUATIONS UNDERWAY. #911BUFF
3242,1441806235276,1,1,1,1,on-topic,3,186,5079,RT @Deanofcomedy: CNN Wolf Blitzer just confirms that Boston Police did not arrest anyone in connection with bombing. NY Post simply lie ...
3243,1441806235279,1,1,0,0,on-topic,3,173,5080,RT @BostonGlobe: BREAKING NEWS: Shots fired in Watertown; source says Boston Marathon terror bomb suspect has been pinned down.
3244,1441806235282,0,0,1,0,off-topic,3,188,5082,RT @SyedUsmanShahG: Mean while in Iraq 27 died in a blast.. Where the coverage for them? #Boston #Chechnya #Irony \\We live in such a ridic
3245,1441806235287,1,1,1,1,on-topic,5,166,5084,They are showing pictures of the Boston bombing suspects on the news right now! Look, Rainee! See if you know them. -Mom
3246,1441806235293,1,0,1,0,on-topic,6,172,5090,POLICE CHASE, EXPLOSIONS REPORTED NEAR MIT SHOOTING: As of 2:45 AM Eastern, the Boston Globe is clai http://t.co/wLO3lUyKWc
3247,1441806235298,1,1,1,1,on-topic,5,144,5093,RT @nbcnightlynews: Update: Boston bombing suspects came to U.S. with their family in 2002 or 2003
3248,1441806235301,1,1,1,1,on-topic,3,186,5096,RT @AidanMc_LUFC: 55 people died in car bombings in Iraq today. Take this time not just for the bombing attacks in Boston,but from all t ...
3249,1441806235303,1,1,1,1,on-topic,2,180,5097,CBS NEWS SPECIAL REPORT: Pres. Obama addresses interfaith prayer service for Boston bombing victims WATCH LIVE: http://t.co/FfVMpcB4BH
3250,1441806235306,1,1,1,1,on-topic,3,166,5103,RT @thinkprogress: Here is the latest: one Boston bombing suspect dead, other still on the loose. http://t.co/2O1vhzGVcZ
3251,1441806235308,1,0,0,0,on-topic,2,186,5104,RT @JBONAMASSA: Watching the news anchors speculate on if they made an arrest in the Boston Bombing case is like watching old women goss ...
3252,1441806235309,1,0,1,0,on-topic,1,141,5107,RT @cnnbrk: FBI releases photos of 2 suspects in #Boston terror attack.  http://t.co/T2iPlgMkiA
3253,1441806235310,1,1,0,0,on-topic,1,186,5110,RT @YesYoureRacist: ATTENTION, RACISTS: The Boston bombing suspects are from the actual Caucasus region, meaning they *literally could n ...
3254,1441806235311,1,1,0,0,on-topic,1,151,5123,RT @YourAnonNews: BREAKING: AP says surviving Boston bomb suspect is Dzhokhar A. Tsarnaev, 19. #Watertown
3255,1441806235312,1,0,1,0,on-topic,1,130,5125,FBI releases images of 2 suspects in Boston Marathon bombings http://t.co/LMu4j3SPZU
3256,1441806235313,1,0,1,0,on-topic,1,186,5042,RT @jihadwatchRS: Steve Emerson: Saudi national questioned in Boston Marathon bombings to be deported on national security groun... http ...
3257,1441806235314,1,0,1,0,on-topic,1,179,5045,RT @WAFB: REPORT: Mayor of Boston says officials have a suspect surrounded http://t.co/iwAWVrY4MG     #bostonbombings #bostonmarathon
3258,1441806235315,1,0,1,0,on-topic,1,185,5046,RT @Startingastory: So awful. How a young, injured Saudi man was treated in the wake of the Boston marathon tragedy: http://t.co/IkgovBHmlk
3259,1441806235315,1,0,0,0,on-topic,0,174,5055,RT @AP: Man who finished Boston Marathon seconds before bombing witnesses Texas explosion days later: http://t.co/THvRFFrMjI -CC
3260,1441806235316,1,0,1,0,on-topic,1,140,5067,Ngl I think sandy hook and the boston bombing is just some bullshit made up by the government.
3261,1441806235317,1,0,1,0,on-topic,1,126,5019,Watching the presidential address on the Boston Bombing. Prayers to all affected
3262,1441806235319,1,1,0,0,on-topic,2,178,5028,RT @CBSNews: BREAKING NEWS: FBI releases video of possible suspects wanted in Boston Marathon bombing. PHOTO: http://t.co/WLZ3ZwNRFR
3263,1441806235321,1,0,0,0,on-topic,2,184,5030,RT @DannyAmendola: I will DONATE $100 for EVERY pass I catch next season to whatever Boston Marathon Relief Fund there is. And $200 fo ...
3264,1441806235322,1,1,1,1,on-topic,1,178,5031,RT @SassyGirlsProbs: What happened in Boston is a tragedy. Don't make it worse by making things up/spreading things that are untrue.
3265,1441806235323,1,1,1,1,on-topic,1,182,4973,BREAKING NEWS: FBI says bombing suspect may be driving a 4-door, green 1999 Honda Civic with Massachusetts plates 116GC7. Please retweet
3266,1441806235324,1,0,1,0,on-topic,1,181,4918,Boston Marathon Runners React To Bombing: BOSTON  Many people who live and work in Boston are still absorbing... http://t.co/tRVaznkUlB
3267,1441806235325,1,1,1,1,on-topic,1,152,4922,Sending out my prayers to the runners and the fans. Cherish all the special people in your life right now.
3268,1441806235326,0,0,1,0,off-topic,1,183,4866,why would anyone say try want him dead, we NEED answers. Take him alive and let him get his little ass handed to him in prison #BitchMade
3269,1441806235326,0,0,1,0,off-topic,0,139,4879,Both of these chaotic ass events happened next to both of my jobs. The fuck it good right now
3270,1441806235327,1,1,1,1,on-topic,1,182,4795,So sad what happened in Boston today.  I was supposed to be downtown shopping. Glad we changed our plans. #BOS. Praying for the victims.
3271,1441806235328,0,0,1,0,off-topic,1,116,4798,Starting the recovery the only way I know: #jackdaniels and hair metal
3272,1441806235330,0,0,1,0,off-topic,2,116,4693,WCVB reports explosions were also heard on Franklin St. @BUNewsService
3273,1441806235331,1,0,1,0,on-topic,1,132,4667,Flowers and letters at the finish line: Boston Bombing http://t.co/7XUpC0U2jw #iReport
3274,1441806235332,1,1,1,1,on-topic,1,128,4670,Mass general Hospital is reporting  2 casualties from the bomb at #bostonmarathon.
3275,1441806235334,1,1,1,1,on-topic,2,182,4631,Shock gives way to angst in wake of Boston bombings: Within minutes, the gatherings began. In bars across the ... http://t.co/vL6qX2R7Jf
3276,1441806235335,0,0,1,0,off-topic,1,170,4637,@DavidVenner18 they r turning away ppl now blood banks full but nice idea sat @ soccer they r having a bake sale for victims
3277,1441806235336,0,0,1,0,off-topic,1,155,4647,News interviewing a poly sci professor who immediately says these guys are al Qaeda home grown terrorists -_-
3278,1441806235339,1,1,1,1,on-topic,3,177,4619,BPD: Fire At JFK Library Not Related To Downtown Explosions: BOSTON (CBS)  Boston Police are now saying a... http://t.co/DUndFLI8FU
3279,1441806235340,1,1,1,1,on-topic,1,161,4490,Obama is coming to visit the victims of the bombing at MGH &amp; the secret service got this bitch on LOCK DOWN lol
3280,1441806235341,1,1,1,1,on-topic,1,152,4511,@MarathonMom5 Good luck on the race.  My prayers are with you.  May what happened here never happen again.
3281,1441806235342,1,1,1,1,on-topic,1,85,4440,Just heard an explosion #BostonMarathon
3282,1441806235344,0,0,1,0,off-topic,2,96,4410,@Imthatkid19 he might be on a boat. Dead or Alive?
3283,1441806235347,0,0,1,0,off-topic,3,168,4356,@mattgentili not at all. Praying and showing support is great, but taking immediate, tangible action to help is different.
3284,1441806235348,1,0,1,0,on-topic,1,146,4315,@Boston_Police: Despite reports to the contrary there has not been an arrest in the Marathon attack.
3285,1441806235348,1,0,1,0,on-topic,0,151,4330,@jthibodeau13 yeah, we are all okay. he finished shortly before the explosions, so he was safe, thank god
3286,1441806235348,1,0,1,0,on-topic,0,177,4276,Bombing Suspects Uncle: They Do Not Deserve To Live On This Earth: BOSTON (CBS)  The uncle of the two men... http://t.co/xcfVJcvhSG
3287,1441806235349,1,1,1,1,on-topic,1,119,4210,All of Boston on lockdown now. #marathonbombing #terrorism #prayforboston
3288,1441806235350,1,1,1,1,on-topic,1,96,4170,@johnguilfoil yet news stations are live-streaming
3289,1441806235352,1,1,1,1,on-topic,2,185,4186,@BostonGlobe: BREAKING NEWS: Residents describe pandemonium on Franklin Street in Watertown; source says suspect pinned down.PLEASE BE TRUE
3290,1441806235355,1,1,0,0,on-topic,3,161,5131,RT @AP: BREAKING: AP: Surviving Boston bomb suspect identified as Dzhokhar A. Tsarnaev, 19, of Cambridge, Mass. -SS
3291,1441806235356,1,1,1,1,on-topic,1,165,5141,RT @AntDeRosa: Live video of police manhunt for Boston Marathon explosions suspect in #Watertown http://t.co/wBZ2Ah9MJe
3292,1441806235357,1,0,1,0,on-topic,1,182,5142,One suspect in Boston bombing dead, manhunt under way for second man: WATERTOWN, Massachusetts (R... http://t.co/Y9E5A1gcOG @crossoceans
3293,1441806235358,1,0,1,0,on-topic,1,186,5150,RT @BelieberSwagguh: I close my eyes and pray for all lives and familes affected during the Boston Marathon. #prayforboston http://t.co/ ...
3294,1441806235358,1,1,0,0,on-topic,0,143,5154,RT @SportsCenter: BREAKING: An arrest has been made in the Boston Marathon bombings, CNN reports.
3295,1441806235360,1,0,0,0,on-topic,2,141,5157,RT @cnnbrk: FBI releases photos of 2 suspects in #Boston terror attack.  http://t.co/pcuskSgjaF
3296,1441806235361,1,0,0,0,on-topic,1,161,5161,RT @Deadspin: The photos released by the FBI of two suspects in the Boston Marathon bombing: http://t.co/QvwdpVx17n
