2229,1442076412689,0,0,1,0,off-topic,0,130,4120,I'm annoyed frustrated and mad !!! For something that shouldn't even matter to me ..
2230,1442076412690,0,0,1,0,off-topic,1,77,4121,so grateful for all the support
2231,1442076412691,0,0,1,0,off-topic,1,98,4122,Girl you look good oh who is you playin with when ya
2232,1442076412693,0,0,1,0,off-topic,2,81,4123,Me &amp; My Homie Had A Good Time .
2233,1442076412694,0,0,1,0,off-topic,1,69,4124,Get with it or get lost
2234,1442076412697,0,1,1,0,off-topic,3,77,4125,@BlackBerry should just give up
2235,1442076412699,0,0,1,0,off-topic,2,80,4126,She Say That Was Outta Her Range !
2236,1442076412700,0,0,1,0,off-topic,1,102,4127,@krups930 ill deal with it since its not football season
2237,1442076412701,0,0,1,0,off-topic,1,107,4128,When I'm mad, I'll respond with one word a lot towards you ..
2238,1442076412702,0,0,1,0,off-topic,1,80,4129,Don't say something you don't mean
2239,1442076412704,0,0,1,0,off-topic,2,68,4130,Oh, how he loves us!!!
2240,1442076412705,0,0,1,0,off-topic,1,69,4131,I Woke In A New BUGATTI
2241,1442076412706,0,1,1,0,off-topic,1,103,4132,@LoKat2014 lets party tonight? I may be coming up tonight
2242,1442076412708,0,1,1,0,off-topic,2,177,4133,@anchors_n_stix: @summerdawson23 you deserve a break. your not kidding...I have thrown up 11 times now and can't keep anything down
2243,1442076412708,0,0,1,0,off-topic,0,143,4134,If you love me then you'll buy me an ungodly amount of trace &amp; vellum. #endoftheyear #IDprobs
2244,1442076412709,0,0,1,0,off-topic,1,93,4135,I promised my grandma ill help her this weekend
2245,1442076412710,0,0,1,0,off-topic,1,70,4136,I Was Sleeping Too Good!
2246,1442076412711,0,0,1,0,off-topic,1,74,4137,You love when I get up in it
2247,1442076412712,0,1,1,0,off-topic,1,96,4138,I wish this shit would hurry up and be done with!!
2248,1442076412713,0,0,1,0,off-topic,1,118,4139,@emmalee_26 one is one still someone. But to @BrookeClan14 point I agree
2249,1442076412714,0,0,1,0,off-topic,1,136,4140,@WestSide_Do well how about keep it jus shape it up and you can have a in the middle look!
2250,1442076412715,0,0,1,0,off-topic,1,88,4141,@QuansterGO I was jus playing its yo phone
2251,1442076412716,0,0,1,0,off-topic,1,93,4142,@OORAH_Bitch read my tweets girl.. It's awful a
2252,1442076412717,0,0,1,0,off-topic,1,100,4143,@tweetitbishhh: About to lay it down yeah you need too
2253,1442076412718,0,0,1,0,off-topic,1,123,4144,Chilling on top of Hashtag Swaggie with @sam_smallwood http://t.co/fMkH3cidL7
2254,1442076412718,0,0,1,0,off-topic,0,173,4145,countless make up work, keep getting sick, and trying to graduate in may...my stress level doesn't even have a level anymore...
2255,1442076412719,0,0,1,0,off-topic,1,101,4146,I'm at Cracker Barrel (Waco, TX) http://t.co/3fYh39DCCW
2256,1442076412720,0,0,1,0,off-topic,1,112,4147,Baby you summertime fine, I let you get on top, I be the underline
2257,1442076412721,0,0,1,0,off-topic,1,69,4148,Baby am I doing to much
2258,1442076412722,0,0,1,0,off-topic,1,94,4149,I am not the one too sit around &amp; be played.
2259,1442076412723,0,0,1,0,off-topic,1,92,4150,@Simply_DLisha #Dallas Ummmm It Dont Matter...
2260,1442076412725,0,0,1,0,off-topic,2,123,4151,@EricMontes12 yeeee. I don't like those thin tires. Get the big ones estupid.
2261,1442076412725,0,0,1,0,off-topic,0,72,4152,My Apperance Speak For Me!
2262,1442076412728,0,0,1,0,off-topic,3,123,4153,Roomie's bf knows the entire plotline of Doctor Who. Didn't you know? #shutup
2263,1442076412729,0,0,1,0,off-topic,1,76,4154,God I love Texas #texanforever
2264,1442076412731,0,0,1,0,off-topic,2,141,4155,Get Steve nd Jodie on the wing. Pau on that 15 footer and Dwight on the block that'll be deadly
2265,1442076412732,0,0,1,0,off-topic,1,127,4156,@iAmSandra23Yes but it's being brought to me cause I don't have $14 straight. Lol
2266,1442076412732,0,0,1,0,off-topic,0,121,4157,@KeatonFoxNBC5 iPhone panorama doesn't take into account the smell, either.
2267,1442076412733,1,0,1,0,on-topic,1,182,4158,@J_Lee30 fertilizer plant caught fire and exploded. Dozens and dozens injured and being taken to area hospitals. NO confirmed deaths yet
2268,1442076412734,0,0,1,0,off-topic,1,71,4159,@FvckLia I told you first
2269,1442076412736,0,1,1,0,off-topic,2,129,4160,Maybe it's just my room that depresses me, because once I leave I feel almost great
2270,1442076412737,1,0,1,0,on-topic,1,126,4161,Dang what is up with all these explosions dude? Praying for those people in West
2271,1442076412738,0,0,1,0,off-topic,1,135,4162,Me &amp; zhane used to be bestfriends oss when she was fuckin with my nigga lloyd smh lol
2272,1442076412739,0,1,1,0,off-topic,1,94,4163,I hate banks. They ruin lives. Or at least mine.
2273,1442076412740,0,0,1,0,off-topic,1,185,4164,Lemme set the example for #reasonsimsingle -laughed so hard at smthng I was thinking abt that snot blew out of my nose Cc: @antoniaterrazas
2274,1442076412741,1,0,1,0,on-topic,1,127,4165,@MarkJWeather all I saw we're news crews sat trucks in waco Texas and fire trucks
2275,1442076412742,0,0,1,0,off-topic,1,78,4166,Why did the dick go to the 7-11?
2276,1442076412743,0,0,1,0,off-topic,1,124,4167,@denerian3 when you want to, I still can't get nothing those bumps still there
2277,1442076412744,0,0,1,0,off-topic,1,100,4168,I have no energy to be writing this unnecessary paper.
2278,1442076412745,0,0,1,0,off-topic,1,172,4169,I think I have the right to be fat if I want to. Fuck what society and who ever else thinks. My body bitch! Next step #beergut
2279,1442076412747,0,0,1,0,off-topic,2,125,4170,@kaaaaci yeah! I have to skip one of my classes to make it, but I'm excited! :)
2280,1442076412748,0,1,1,0,off-topic,1,140,4171,He bought me coffee and we're going to the lake... #buymecoffee #takemetowater #youhavemyheart
2281,1442076412750,0,0,1,0,off-topic,2,110,4172,@IronAndWine Damn fine record!! Incredible sounds you've created
2282,1442076412753,0,0,1,0,off-topic,3,86,4173,2 miles on level 14 in 7-8mins ain't bad
2283,1442076412755,0,1,1,0,off-topic,2,112,4174,My classes finished early today. Had an early lunch. Now nap time.
2284,1442076412757,0,1,1,0,off-topic,2,105,4175,Just posted a photo @ Ferrell Center http://t.co/yskiEWXCXa
2285,1442076412758,0,0,1,0,off-topic,1,92,4176,Oomf steady talking shit but he can't whoop me
2286,1442076412760,0,1,1,0,off-topic,2,94,4177,I Just Want What's Best For My Fam , That's It .
2287,1442076412764,1,1,1,1,on-topic,4,185,4178,@Slatersnews Im drivin home 2 SA on 35. Just passed thru west. Cant tell the devastation from 35. But had to be 80-100 news vans on side rd
2288,1442076412765,0,0,1,0,off-topic,1,94,4179,I wont smoke nobody weed if I didnt put in on it
2289,1442076412767,0,1,1,0,off-topic,2,79,4180,Now they just cheating for Denver
2290,1442076412769,0,0,1,0,off-topic,2,117,4181,I'm at Cameron Park Zoo - @camparkzoo (Waco, TX) http://t.co/Y1ksgsWH86
2291,1442076412770,0,0,1,0,off-topic,1,89,4182,Got my nigga vero jammin no new friends  !!
2292,1442076412777,0,0,1,0,off-topic,7,84,4183,@Blue_Xanax holy fuckballs I would DIE
2293,1442076412780,0,0,1,0,off-topic,3,149,4184,@B2Will1 Hahaha, exactly. So it won't be as fun next year because its legally okay. Do it Big Baby boy.
2294,1442076412781,0,0,1,0,off-topic,1,98,4185,@Eemma___ the soccer coach from like 2 years ago bro
2295,1442076412782,0,0,1,0,off-topic,1,104,4186,S/O to @95Brendan for making my week!! #bestdayever #truth
2296,1442076412784,0,0,1,0,off-topic,2,112,4187,We having our car wash next to a car wash like really uncle Calvin
2297,1442076412785,0,0,1,0,off-topic,1,182,4188,Well he hasn't thrown up since I got home last night that's good I hope. :/ I locked him in the back room Bj himself with food and water
2298,1442076412786,0,1,1,0,off-topic,1,92,4189,@Sukkieee you not going to sleep but night lol
2299,1442076412790,0,0,1,0,off-topic,4,151,4190,I woke up and asked myself wtf was on my face! I touched it and it was gum with ALL my hair stuck to hit!
2300,1442076412791,0,0,1,0,off-topic,1,99,4191,If I got $10.00 &amp; my girl broke, then I got $5.00
2301,1442076412793,0,0,1,0,off-topic,2,106,4192,head down. as I watch my feet take turns hitting the ground.
2302,1442076412794,0,1,1,0,off-topic,1,124,4193,Just good luck guy's man we need to do this shit once a trojan always a TROJAN
2303,1442076412795,0,0,1,0,off-topic,1,104,4194,He was a candle maker. So, Satan burns off the guy's dick.
2304,1442076412796,0,0,1,0,off-topic,1,110,4195,@QuinteroAbby had no idea you were cool enough for twitter ! Lol
2305,1442076412797,0,1,1,0,off-topic,1,94,4196,i wanna wake up &amp; this all just be a dream..
2306,1442076412798,0,0,1,0,off-topic,1,67,4197,I'm a trill ass nigga
2307,1442076412804,0,0,1,0,off-topic,6,90,4198,When Chris Call Me by my first name &gt;&gt;
2308,1442076412805,1,0,1,0,on-topic,1,194,4199,I will def go out there &amp; help tomorrow if anyone wants to go with me It is my day off &amp; I want to help out a town that has ppl I care about
2309,1442076412805,0,0,1,0,off-topic,0,68,4200,You fuckin with a boss
2310,1442076412807,0,0,1,0,off-topic,2,117,4201,I should go 15 mph in front of Moody. Said no one ever. @Baylorproblems
2311,1442076412811,1,0,1,0,on-topic,4,130,4202,I don't even like Obama &amp; I think it's nice of him to come speak on this tragedy
2312,1442076412812,0,0,1,0,off-topic,1,119,4203,@SteveMLynch the official said to jump in wherever you think you can help
2313,1442076412814,0,0,1,0,off-topic,2,105,4204,@AllGoldAlex: It's 4/20 and I haven't smoked shit same here
2314,1442076412815,0,0,1,0,off-topic,1,174,4205,You hate her yet she still texts you &amp; calls you bro? Come on man, like tell her something instead of being like that nigga!
2315,1442076412816,0,1,1,0,off-topic,1,109,4206,Oh that's cool. Those are just my feelings you're messing with.
2316,1442076412817,0,0,1,0,off-topic,1,177,4207,@annaisbananas_: I might sound like a faggot for this but I seriously wonder what it feels like to be in love it's a terrible place
2317,1442076412818,0,0,1,0,off-topic,1,114,4208,@Dis_PriceIsRght: I swear parents dick ride certain kids !! Shutuppp
2318,1442076412819,0,0,1,0,off-topic,1,81,4209,I can watch #ridiculousness all day
2319,1442076412821,0,0,1,0,off-topic,2,121,4210,@jazzzmyn55 lmaoo. Ok ! Well charge it ! And do my laundry while your at it
2320,1442076412822,0,1,1,0,off-topic,1,90,4211,Love is just a word until its proven to you!
2321,1442076412824,0,0,1,0,off-topic,2,93,4212,@CaramelBOMBBB some cheetah prints on my sleeve
2322,1442076412826,0,0,1,0,off-topic,2,101,4213,#DrBradleySays push it like a cushion  @BaylorMensChoir
2323,1442076412828,0,0,1,0,off-topic,2,77,4214,Don't Know What I'm Doing Yet !
2324,1442076412830,0,0,1,0,off-topic,2,72,4496,Get Money &amp; Smoke Loud
2325,1442076412832,0,0,1,0,off-topic,2,64,4497,I want my man back
2326,1442076412834,0,0,1,0,off-topic,2,146,4498,One major downfall of having headaches all the time: it literally hurts to roll my eyes. #itsareflex
2327,1442076412835,0,0,1,0,off-topic,1,92,4499,Terrance Williams is a Cowboy ! Congrats Twill
2328,1442076412837,0,0,1,0,off-topic,2,79,4500,My 2 feet will stay on the ground
2329,1442076412839,0,0,1,0,off-topic,2,186,4501,@krissybrown73 still girl, something so serious you really shouldn't joke. I'm not hoppin down your ass or anything but it's not an ok thing
2330,1442076412839,0,1,1,0,off-topic,0,166,4502,@OhItsJehtay omg THANK YOU! I would rather starve  ugh I just have to get the ladyballs to make the damn appointment lol
2331,1442076412840,0,0,1,0,off-topic,1,81,4503,ya she need to quit with all that..
2332,1442076412842,0,0,1,0,off-topic,2,127,4504,Ready for summer and skeeter baseball games with @DDish2 @KelsWingert @lexmelhorn
2333,1442076412843,0,1,1,0,off-topic,1,109,4505,@Felipe91695 I just got out of the shower so it could be awhile
2334,1442076412844,0,0,1,0,off-topic,1,91,4506,@ImPrincessDee ima be up by myself &amp; shit
2335,1442076412849,0,0,1,0,off-topic,5,86,4507,This Hoe Caking and I'm On this Webbiee!
2336,1442076412851,0,0,1,0,off-topic,2,78,4508,Its money over them dumb bitches
2337,1442076412853,0,0,1,0,off-topic,2,112,4509,@TressaNicolee_ lol you always say you sick but be lying like a mf
2338,1442076412854,0,0,1,0,off-topic,1,80,4510,#TurnOn listen to my music with me
2339,1442076412856,0,0,1,0,off-topic,2,114,4511,@apple3swagg so you can at least be back in the M Mexia niggas voice
2340,1442076412857,0,0,1,0,off-topic,1,93,4512,Haha dayummm it's a party here at morales house
2341,1442076412859,0,0,1,0,off-topic,2,94,4513,@ImMarcAnthony I have to have a cool rapper name
2342,1442076412861,0,1,1,0,off-topic,2,141,4514,First I seen my nigga Dealton and Kitty here at wingstop and now I seen Adrian Michael and Tavo
2343,1442076412863,0,0,1,0,off-topic,2,183,4515,@OurDailyBears:President Obama will join Truman, Eisenhower, Johnson, Ford, and Bush as sitting Presidents to visit @Baylor.@Grant_Senter
2344,1442076412865,0,0,1,0,off-topic,2,183,4516,@_CallieOsborne: I held the door open for two guys, one after another, yesterday and they both didn't say thank you. #Uh #ExcuseYou rude!
2345,1442076412868,0,1,1,0,off-topic,3,156,4517,@MilSOlovely telescopic by loreal!! It's been the only one I use since I started wearing makeup it's the best!
2346,1442076412871,0,0,1,0,off-topic,3,104,4518,I'm getting all of your Instagram notifications -____- lol
2347,1442076412878,0,0,1,0,off-topic,7,161,4519,@BrookeeKnightt: 20 is such a weird age to turn lol it's like the first birthday you really feel old I'm scared lol
2348,1442076412882,0,0,1,0,off-topic,4,121,4520,@GaryDJMoore uh I love you but HAIL NO. Haha, I didn't get a birthday gift.
2349,1442076412885,0,1,1,0,off-topic,3,106,4521,I'm seriously  close to walking out &amp; just saying I quit
2350,1442076412887,1,1,1,1,on-topic,2,120,4522,About to pass West Texas praying for everyone effective with the explosion
2351,1442076412888,1,0,1,0,on-topic,1,141,4523,So relieved my family &amp; friends are safe their houses are ruined but at least they are safe
2352,1442076412889,0,0,1,0,off-topic,1,101,4524,I'm at Castle Bastian (Waco, TX) http://t.co/SBtiKbHcOo
2353,1442076412891,0,0,1,0,off-topic,2,63,4525,I wanna go home!!
2354,1442076412893,0,0,1,0,off-topic,2,81,4526,Im have hatred towards these niggas
2355,1442076412895,1,0,1,0,on-topic,2,136,4527,donating clothes &amp; money tomorrow! im determined to make a difference in this tragedy!
2356,1442076412896,0,0,1,0,off-topic,1,70,4528,Gotta respect the hustle
2357,1442076412897,0,0,1,0,off-topic,1,102,4529,Everybody itches for beauty, only scratchin' the surface
2358,1442076412899,0,1,1,0,off-topic,2,130,4530,@arianathepoet just favorited one of my tweets... And like that. My day was made!!!!
2359,1442076412900,0,0,1,0,off-topic,1,175,4531,I'm really liking the Browns moves drafting a LB, CB, and S... And also signing WR Davon Bess to a 3 year deal! #Browns #Football
2360,1442076412900,0,0,1,0,off-topic,0,126,4532,@Xman813: I always find a way to mess up anything good that walks into my life..
2361,1442076412901,0,0,1,0,off-topic,1,90,4533,@Pretty_Dest95 it's hard not to spend money.
2362,1442076412902,0,0,1,0,off-topic,1,75,4534,These Niggas a cuff  anything
2363,1442076412904,0,1,1,0,off-topic,2,127,4535,im just ready to make up our lost time..the house is coming along tho!(: #lovehim
2364,1442076412905,0,0,1,0,off-topic,1,72,4536,My hair looks bigger today
2365,1442076412907,0,0,1,0,off-topic,2,76,4537,Y'all come to my game tomorrow
2366,1442076412909,0,0,1,0,off-topic,2,134,4538,Boston shooting again near MIT, explosions have been heard. One officer has been killed.
2367,1442076412910,0,0,1,0,off-topic,1,119,4539,The only thing that stays the same, is everything changes. #timemarcheson
2368,1442076412911,0,0,1,0,off-topic,1,75,4540,I wanna go do something today
2369,1442076412913,0,0,1,0,off-topic,2,142,4541,@MessyKyah hell yeah! They jumped my ass lisy time I was down. A nigga was really sore too lmao.
2370,1442076412913,0,1,1,0,off-topic,0,149,4542,Boom found both books I wanted and found out my book has a fourth final book that's out already. #dying
2371,1442076412914,0,0,1,0,off-topic,1,103,4543,@_SaaayChris your brother likes big girls with short hair
2372,1442076412916,0,1,1,0,off-topic,2,88,4544,@NicoMoran you should try coming to Baylor
2373,1442076412917,0,0,1,0,off-topic,1,137,4545,When i realized everyone was ok, i ran out and checkdd o. The other ppl along with my dad..
2374,1442076412918,0,0,1,0,off-topic,1,160,4546,Arrived to serve meals to the many who need them with @missionu2rr (@ West, TX w/ 3 others) http://t.co/x3L3qbVPlh
2375,1442076412919,0,1,1,0,off-topic,1,154,4547,Diet Dr. Pepper: checkSubway: checkBrownies to eat while studying:check Heart attack: check back for updates
2376,1442076412919,0,1,1,0,off-topic,0,126,4548,Today is just one of those days that EVERYTHING PISSES ME OFF. I'm so emotional.
2377,1442076412920,0,0,1,0,off-topic,1,116,4549,Butter crunch ice cream &amp; pandora &gt; I feel like a depressed hoe
2378,1442076412921,0,1,1,0,off-topic,1,112,4550,@k3ndallblair: Already tired of this class and the bell just rang.
2379,1442076412923,0,1,1,0,off-topic,2,111,4551,Ooo shit! I just missed my great grandma &amp; papa phone call!!!
2380,1442076412924,0,0,1,0,off-topic,1,94,4552,Thank God For Another Day That Was Not Promised.
2381,1442076412926,0,1,1,0,off-topic,2,110,4553,My lil dude just made me move my bed around for no reason -____-
2382,1442076412927,0,1,1,0,off-topic,1,129,4554,@ImKindaABigDill I did about a year ago! Now I live about 3 hours away from there..
2383,1442076412928,0,0,1,0,off-topic,1,184,4555,I love when roomie @jennaakay texts me sweet things, especially when she's laying next to me, in my bed.  #truelove http://t.co/E8XjLd8bA9
2384,1442076412929,0,0,1,0,off-topic,1,133,4556,Wow! The semester is winding down! I have 1 class b4 finals. I'm so ready to celebrate!
2385,1442076412930,0,0,1,0,off-topic,1,95,4557,@reagannewman15 oh my gawwdd haha! I was so naive
2386,1442076412931,0,0,1,0,off-topic,1,96,4558,I really need to get my shit together!!! #Stressed
2387,1442076412933,0,0,1,0,off-topic,2,97,4559,WCW and MCM Make a Bitch Not wanna get on instagram
2388,1442076412935,0,0,1,0,off-topic,2,85,4560,Oomf never texted me back -.- it's cool
2389,1442076412937,0,0,1,0,off-topic,2,116,4561,Not to mention the way some of y'all talk to y'all daddy...? Chill out
2390,1442076412938,0,0,1,0,off-topic,1,81,4562,I'll be in DC this time next month!
2391,1442076412940,0,0,1,0,off-topic,2,113,4563,What do you get when you put 50 lawyers in a room with 50 lesbians?
2392,1442076412942,1,0,1,0,on-topic,2,171,4564,Makes me smile to see firefighters on the processional taking pics and video of the crowd. They're touched too. #westmemorial
2393,1442076412943,0,0,1,0,off-topic,1,116,4565,I'm tryna catch a break . But every time I do some always goes wrong .
2394,1442076412944,0,1,1,0,off-topic,1,186,4566,@CALMATE_Carina as long as it's healthy lol. I'm not going to eat anything I'm going to take some drink it's a meal replacement it's healthy
2395,1442076412945,0,1,1,0,off-topic,1,112,4567,Satan asks the third guy, What was your daddy when you were alive?
2396,1442076412946,0,1,1,0,off-topic,1,80,4568,I really just wanna get fucked up.
2397,1442076412948,0,1,1,0,off-topic,2,92,4569,Ying Yang twins are going to be here on DIA ?!
2398,1442076412951,0,1,1,0,off-topic,3,87,4570,@WhatTheDickens_ why are you going home??
2399,1442076412953,0,0,1,0,off-topic,2,85,4571,@MissJenn121211 WELL work go get one!!!
2400,1442076412956,0,0,1,0,off-topic,3,105,4572,@JMag90 @ngunyi_michelle OMG!!!!  He knew wat he was dong!!
2401,1442076412958,0,1,1,0,off-topic,2,100,4573,Got this yungsta in the crib right now killing shit...
2402,1442076412960,0,1,1,0,off-topic,2,124,4574,Wish I had a girl to kick it with , shii gone be back right soon hopefully ...
2403,1442076412961,0,0,1,0,off-topic,1,153,4575,@AdamAjSalinas ok it didn't work ok i tried and it didn't work....i refuse to slow down my life ok im sorry
2404,1442076412962,0,1,1,0,off-topic,1,108,4576,I never wanted to be your whole life-- just your favorite part
2405,1442076412963,0,0,1,0,off-topic,1,173,4577,Everyone pay there money to go to school in PJ's tomorrow? Smh or go to school for free and not look ratchet #DUMB  #FUNDRAISER
2406,1442076412964,1,1,1,1,on-topic,1,178,4578,I feel like the people that are interested in just seeing Obama just shouldn't go. Don't forget the purpose of the memorial service.
2407,1442076412965,0,0,1,0,off-topic,1,167,4579,#tbt to the best spring break ever with my best friend! #HPL #Hogwarts #normal  @ Hogsmead Village http://t.co/EYGfCNLKdX
2408,1442076412966,0,0,1,0,off-topic,1,101,4580,Well looks like I ain't making my Mama that cheese cake
2409,1442076412967,0,0,1,0,off-topic,1,105,4581,@BegginForMOE nearest liquor bottle JK hope you feel better
2410,1442076412969,0,0,1,0,off-topic,2,105,4582,@johnnyjeff05 you comin down for the summer semesters right
2411,1442076412971,0,0,1,0,off-topic,2,116,4583,@ashleyybrooke6: Feels so good to not work on a Saturday for once AMEN
2412,1442076412972,0,1,1,0,off-topic,1,125,4584,@teeburt9493: I don't see how some people just stay on twitter forever.. Guilty
2413,1442076412973,0,1,1,0,off-topic,1,167,4585,Here at Baylor the girls don't have to study for finals. We just have to pray that our future husbands are. #ringbyspring
2414,1442076412974,0,0,1,0,off-topic,1,111,4586,@YoungBoyBurton: Gotta watch who you love, love will let you down
2415,1442076412975,0,0,1,0,off-topic,1,87,4587,Goodluck to all the juniors testing today
2416,1442076412977,0,0,1,0,off-topic,2,126,4588,#WeCantDateIf &lt;------ girls y'all need to stop using this lol y'all look dumb
2417,1442076412978,0,0,1,0,off-topic,1,88,4589,@TheReal_BAIN wish I was.... Stuck in waco
2418,1442076412981,0,0,1,0,off-topic,3,93,4590,@Pretty_Eyez_94 how I tweeted it before you guy
2419,1442076412985,0,0,1,0,off-topic,4,90,4591,Never been with a playa x big binky &gt;&gt;
2420,1442076413393,0,0,1,0,off-topic,408,97,4592,Fuck my feelings .... That's usually how it goes ..
2421,1442076413395,0,0,1,0,off-topic,2,142,4593,The area code that the Westboro Baptist Church is located in is 66604. Coincidence? I think not.
2422,1442076413396,0,1,1,0,off-topic,1,189,4594,just got into my fluffy pajama pants, walk out in the front yard to my car &amp; the damn sprinklers come on... DARN YOUR AUTOMATIC SPRINKLERS!
2423,1442076413396,0,0,1,0,off-topic,0,171,4595,Watching David Letterman for the 1st time ever &amp; his quick sarcasm reminds me of Prof. Harris! @lisamonthie #gottalovehim
2424,1442076413397,0,0,1,0,off-topic,1,171,4596,I mean, I shared a build-a-bear monkey with my ex and look how that turned out. #IGotStuckWithTheMonkey #NoMonkeySupportMoney
2425,1442076413397,0,0,1,0,off-topic,0,76,4597,I seriously need a haircut foo
2426,1442076413399,0,0,1,0,off-topic,2,159,4598,@RalphLondon_: Finna jump in my tlady bed and mess w/ her till she wake upNuh uh stay your grown ass in YOUR bed.
2427,1442076413399,0,1,1,0,off-topic,0,81,4599,Waco. 3 more hours then San Antonio
2428,1442076413401,0,0,1,0,off-topic,2,135,4600,@BarryHartweg why would you tweet about that and announce it to the world... #embarrassed
2429,1442076413401,0,0,1,0,off-topic,0,120,4601,Bump to the beat in the streets! !!! Turn it up on the 4 o clock four play
2430,1442076413403,1,0,1,0,on-topic,2,178,4602,So glad I went to the memorial today. The best thing wasn't seeing the president speak, but the videos of the legacy those men left.
2431,1442076413403,0,1,1,0,off-topic,0,112,4603,They Will Fuck over You ina minute and swear nothing wrong with It
2432,1442076413404,0,0,1,0,off-topic,1,129,4604,Learn To Appreciate What You Have , Before Time Makes You Appreciate What You Had .
2433,1442076413405,0,1,1,0,off-topic,1,115,4605,@OhItsJehtay @krissybrown73 but what comment started the whole thing?
2434,1442076413406,0,0,1,0,off-topic,1,70,4606,Ready to talk to my baby
2435,1442076413408,0,0,1,0,off-topic,2,108,4607,And so we meet again: the question of pancakes versus physics.
2436,1442076413409,0,0,1,0,off-topic,1,101,4608,Light skins and dark skins then it became a competition
2437,1442076413410,0,1,1,0,off-topic,1,172,4609,@itsMeekMill: Be careful who you open up to. Only a few people actually care, the rest are just curious. Ain't that the truth!
2438,1442076413411,0,0,1,0,off-topic,1,73,4610,Zro Be Speaking That Real .
2439,1442076413412,0,0,1,0,off-topic,1,77,4611,still a lil mad.. back to sleep
2440,1442076413415,0,0,1,0,off-topic,3,179,4612,@Bionic_Worm: Pepe: We will FIGHT for the comeback he is foreal tho! hahahahahahahahhahahahahahahahahahahahhahahahahahahahahahahahaha
2441,1442076413416,0,1,1,0,off-topic,1,107,4613,The woman replies, No. I think I'll just wait for the police.
2442,1442076413417,0,0,1,0,off-topic,1,111,4614,@c3mills Well Dante wrote his entire epic in 3 sections! #whatnow
2443,1442076413418,0,1,1,0,off-topic,1,114,4615,@allex_austin lol I was just trynna see who else wanted to. Ima wait
2444,1442076413419,0,1,1,0,off-topic,1,180,4616,You know you're a Baylor girl if you understand this: I spent 15 minutes with Lori and it was only my second time going over. #SOproud
2445,1442076413420,0,0,1,0,off-topic,1,98,4617,Our God is one of love. Not hate. Never forget that.
2446,1442076413421,0,0,1,0,off-topic,1,156,4618,@Kdoll1234: @Ur_Majestyyy Alexis, stay strong girl. They will be okay, I love you!! thank you! i love you too!
2447,1442076413422,0,0,1,0,off-topic,1,91,4619,Ok this next ones really funny, sorry bout it
2448,1442076413423,0,0,1,0,off-topic,1,111,4620,lol Papa gon get on my ass, he might be old but he got them hoes.
2449,1442076413425,1,1,1,1,on-topic,2,198,4621,I live right off the highway in Lacy-Lakeview/Waco &amp; all I hear are police &amp; EMS Sirens. My thoughts &amp; prayers are w/you responders as well.
