1132,1442076387121,1,1,1,1,on-topic,0,171,1332,@chancehorner truth, even working 24 straight hours covering the West explosion is so much better than just watching it on TV
1133,1442076387122,0,0,1,0,off-topic,1,82,1333,@SmoothOcean did you get my message?
1134,1442076387122,0,1,1,0,off-topic,0,73,1334,I feel soo fat right now =/
1135,1442076387122,0,0,1,0,off-topic,0,75,1335,Trippy Niggas with a few hoes
1136,1442076387123,1,0,1,0,on-topic,1,160,1336,It's crazy to be in West, TX after last week. Police and news vans everywhere. #Pray4WestTX http://t.co/BSmxc4VReN
1137,1442076387123,0,0,1,0,off-topic,0,137,1337,If you let somebody talk down on yo nigga in yo presence and you ok with it , you fake RS !
1138,1442076387123,0,1,1,0,off-topic,0,151,1338,@KiBreeze lol... I feel yea. I'm kinda missing the straightness of my hair. I'll just get it braided tho.
1139,1442076387308,0,1,1,0,off-topic,185,120,1339,Starting to MAYBE think that tattoos are attractive.. On a few select men.
1140,1442076387309,0,0,1,0,off-topic,1,157,1340,You know, when I have money I spend it. Also, when I don't have money I still spend it. #CommonGrounds #DIA2k13
1141,1442076387309,0,0,1,0,off-topic,0,158,1341,I'm that awkward girl that's wearing riding boots while other people are wearing shorts because I don't do cold.
1142,1442076387310,0,0,1,0,off-topic,1,74,1342,TGIF Up Early Headed To Work
1143,1442076387311,0,0,1,0,off-topic,1,76,1343,So many emotions all at once..
1144,1442076387312,0,1,1,0,off-topic,1,98,1344,All of a sudden everyone trying to be so religious..
1145,1442076387314,0,1,1,0,off-topic,2,98,1345,I just wanna wake up &amp; this all just be a dream.
1146,1442076387315,0,1,1,0,off-topic,1,168,1346,Woke up at 3:30.... Pretty sure that's a sign that school is currently stuffing me into lockers and taking my lunch money.
1147,1442076387315,0,0,1,0,off-topic,0,135,1347,Im not saying my life is messed up but I honestly feel I could be doing so much better ..
1148,1442076387315,0,1,1,0,off-topic,0,103,1348,@_itsJUSTkass I would've throw yo lil ahh in the wall lol
1149,1442076387315,0,0,1,0,off-topic,0,111,1349,Comparisons are easily done once you've had a taste of perfection
1150,1442076387316,0,1,1,0,off-topic,1,89,1350,@Nickk_Allen lol I'm in a Bugatti right now
1151,1442076387495,0,1,1,0,off-topic,179,152,1351,@nurya phew! Also, just as an FYI, Jodi &amp; Christian Baron are two of my favesies. Don't you know them?
1152,1442076387495,0,1,1,0,off-topic,0,91,1352,I don't wanna lose you, I just got to have ya
1153,1442076387495,0,0,1,0,off-topic,0,169,1353,My Nikes are soaked and my socks...thank goodness I left my crocs in C1!  It's defiantly a new look. http://t.co/WyO4aYQYEh
1154,1442076387495,0,0,1,0,off-topic,0,90,1354,I'm Finna fall asleep. I been up all day smh
1155,1442076387496,0,1,1,0,off-topic,1,81,1355,That strawberry I just ate &gt;&gt;
1156,1442076387496,0,0,1,0,off-topic,0,103,1356,I'm at @SamsOnTheSquare (Waco, TX) http://t.co/iRN47sn6lr
1157,1442076387496,0,0,1,0,off-topic,0,89,1357,@SebstianIngross why did you in follow me:(
1158,1442076387497,0,0,1,0,off-topic,1,152,1358,Sorting text panels for the #stormwatch exhibit! @drpeppermuseum @ Dr Pepper Museum http://t.co/6VUCmY1o8b
1159,1442076387497,0,0,1,0,off-topic,0,164,1359,Charlie and Raider had such a fun sleepover last night! @kelsieshea91 #sweetdogs @ Kappa Korner http://t.co/8MAWItsX4C
1160,1442076387497,0,1,1,0,off-topic,0,104,1360,@JakeLaneTX not fun. I'm dying, I just want my sleep! Haha
1161,1442076387498,0,1,1,0,off-topic,1,90,1361,I hate being alone, im just not used to it..
1162,1442076387498,0,0,1,0,off-topic,0,98,1362,@Letmeslideindat lol quit changing people tweets hoe
1163,1442076387683,0,0,1,0,off-topic,185,103,1363,WHY am I in my jeans still? *takes them off aggressively*
1164,1442076387683,0,1,1,0,off-topic,0,81,1364,Im never gonna knock a nigga hustle
1165,1442076387684,0,0,1,0,off-topic,1,90,1365,@Describe_name: You know Starr . Naaa I dont
1166,1442076387684,0,0,1,0,off-topic,0,83,1366,@ahhleesonn ok, I'll do that then pal
1167,1442076387684,0,0,1,0,off-topic,0,165,1367,Beautiful but cold here on day one of the #TAQHA State Championship Show! #weather #instaweather http://t.co/VSphwSpaXY
1168,1442076387685,0,0,1,0,off-topic,1,79,1368,A real bitch over here lost nshit
1169,1442076387685,0,0,1,0,off-topic,0,95,1369,@alex_sowell12 straight took the A tho! COPY CAT!
1170,1442076387685,0,0,1,0,off-topic,0,178,1370,Cannot wait to be done with these stinking cabinet doors, they have been a HUGE pain! @michael_sch #housereno http://t.co/vlfNQ5Rudz
1171,1442076387685,0,0,1,0,off-topic,0,92,1371,That will never be enough but You are! #beglad
1172,1442076387686,0,0,1,0,off-topic,1,94,1372,What do you call a lesbian with ten girlfriends?
1173,1442076387686,0,1,1,0,off-topic,0,94,1373,@raveandrollhard Yes. I live a block from Baylor
1174,1442076387686,0,1,1,0,off-topic,0,134,1374,What a crazy day at work today... It's about that time to start looking for a new job...
1175,1442076387687,0,0,1,0,off-topic,1,114,1375,@rigby_eleanor :( Tigger moment? (referring to move this summer?) :D
1176,1442076387687,0,0,1,0,off-topic,0,154,1376,@princesscathh true true  lol I forget not everyone has a mom that used to be a hairdresser for 30 years lol
1177,1442076387870,0,0,1,0,off-topic,183,172,1377,#texas #jobs Park Tech I / West District Parks (Part-time, Temp, Seasonal) - Travis County -  West, TX  http://t.co/3LodjMfqfZ
1178,1442076387870,0,0,1,0,off-topic,0,119,1378,Wife and kids at park to relax, I'm at #goldsgym to relax #workout #golds
1179,1442076387870,0,0,1,0,off-topic,0,80,1379,Yo I'm bout to turn twitter up!!!!
1180,1442076387871,0,0,1,0,off-topic,1,101,1380,@brittgilmartin: @marckiewalter what a cutie! Thank you
1181,1442076387871,0,0,1,0,off-topic,0,88,1381,This wedding today better have open bar...
1182,1442076387871,0,1,1,0,off-topic,0,120,1382,@XXKINGCANOXX I'm saying how you coming over here if the freeway I closed?
1183,1442076387872,0,0,1,0,off-topic,1,155,1383,@trey2flythoo @bryan_highflyin delt feathers tho &gt; #ShreddedGirlsOverEverything with big booties of course
1184,1442076387872,0,0,1,0,off-topic,0,95,1384,Nigga was determined too hoop on Hurricane Season
1185,1442076387872,0,0,1,0,off-topic,0,96,1385,Damn Darius uglass Needed my charger and im on 15%
1186,1442076387873,0,0,1,0,off-topic,1,143,1386,@JennaJohnson015 you don't have to say that twice... Over here about to have a nervous breakdown.
1187,1442076387873,1,1,1,1,on-topic,0,165,1387,Anhydrous tank is safe now, says state fire Marshall. No tanks are problems. No fires burning on the scene. No dangers.
1188,1442076387873,0,0,1,0,off-topic,0,181,1388,@LizVaughan09 I talked to a girl and she said she uses it toCount her miles in the pool so I was like.. That's good enough for me!! Lol
1189,1442076388057,0,1,1,0,off-topic,184,95,1389,@GorgeoussTHUGG I'm bout to follow you now, dm it
1190,1442076388057,1,0,1,0,on-topic,0,184,1390,One more pic of procession outside West memorial. Hundreds of fire trucks, ambulances and first responders. @nbcdfw http://t.co/7eqaUHBm32
1191,1442076388058,1,0,1,0,on-topic,1,180,1391,MT @bynickdean: How does one find such selflessness to put the safety of everyone else before your own? - @JohnCornyn at #westmemorial
1192,1442076388058,1,1,1,1,on-topic,0,172,1392,@J_Lee30 plus we took all the WestTx donations yesterday. And I loaded and unloaded our truck. Just a lot of strain on my back
1193,1442076388058,0,0,1,0,off-topic,0,110,1393,walking like a penguin today because of my leg workout yesterday
1194,1442076388058,0,1,1,0,off-topic,0,174,1394,I absolutely hate it when it's the last minute of class and the professor is talking and people stand up and get ready to leave.
1195,1442076388058,0,0,1,0,off-topic,0,98,1395,How she dont suck dick but she begging me to eat her
1196,1442076388059,0,0,1,0,off-topic,1,79,1396,Uggh this English class is BORING
1197,1442076388059,0,0,1,0,off-topic,0,142,1397,watching behind the scenes on how they made Spider-Man 2.. NONE of the stunts are real.. #SadDay
1198,1442076388059,0,0,1,0,off-topic,0,71,1398,Guess who hops on my back
1199,1442076388245,1,1,1,1,on-topic,186,166,1399,Awaiting possible briefing at 10 a.m. Follow @startelegram and @fwhanna for updates as the day progresses #westexplosion
1200,1442076388245,1,0,1,0,on-topic,0,143,1400,GRO boys playing a benefit for #WestTexas in Waco tonight @ Ferrell Center http://t.co/KojaRZqUlC
1201,1442076388245,0,0,1,0,off-topic,0,188,1401,@JeremyC_Bradley it's the closest Volvo dealership &amp; I need some repairs :( so basically my trip is the exact opposite of your trip bc I'm
1202,1442076388245,0,0,1,0,off-topic,0,124,1402,For All the marbles. Sic em bears! @ Hurd Tennis Courts http://t.co/wLxqoa74k6
1203,1442076388245,1,0,1,0,on-topic,0,101,1403,@CharoKnightJr he's comin for the West memorial service
1204,1442076388246,0,0,1,0,off-topic,1,79,1404,I Wanna Go To Sleep But I Don't !
1205,1442076388246,0,0,1,0,off-topic,0,179,1405,I don't understand why people hang dream catchers from their car's rearview mirror. You plan on sleeping in there? #DefeatsThePurpose
1206,1442076388246,0,0,1,0,off-topic,0,99,1406,These niggas out here frontin. They aint drillin shit
1207,1442076388247,0,0,1,0,off-topic,1,80,1407,Dude love jay-z !! Ash K went hard
1208,1442076388247,1,0,1,0,on-topic,0,133,1408,Can't sleep. So shaken and sad for our neighbors. Praying so hard tonight. #prayforwest
1209,1442076388247,0,0,1,0,off-topic,0,76,1409,Dude.. How selfish can you be?
1210,1442076388247,0,0,1,0,off-topic,0,107,1410,Salman gets peach raspberry cherry cream slushes at Sonic ...
1211,1442076388433,0,0,1,0,off-topic,186,67,1411,I was knocked out boy
1212,1442076388434,0,1,1,0,off-topic,1,97,1412,I'm going to be 6'7 by basketball season  next year
1213,1442076388434,0,1,1,0,off-topic,0,135,1413,@ayy_mcGangstaa what happened?? o: and really I need a cig so I don't explode mentally :I
1214,1442076388434,0,0,1,0,off-topic,0,89,1414,@ThatIsTRAGIC ion wanna catch on fire cuh !
1215,1442076388435,0,0,1,0,off-topic,1,120,1415,Dia del Saturday. Thank goodness for our amazing @BaylorPiKapps #happiness
1216,1442076388435,0,1,1,0,off-topic,0,130,1416,@NiyMonroee sound good, don't talk all that shit now and cop a deuce when I get back
1217,1442076388435,0,0,1,0,off-topic,0,125,1417,@yellafella_TP: @Eric_F_Baby23: But if anybody ask, we are taking it day by day
1218,1442076388435,1,1,1,1,on-topic,0,111,1418,i seriously can't stop crying right now.. my family is out there!
1219,1442076388436,0,0,1,0,off-topic,1,82,1419,I got subtweeted in real life today.
1220,1442076388436,0,0,1,0,off-topic,0,82,1420,Well this has been a great day. #NOT
1221,1442076388436,1,0,1,0,on-topic,0,166,1421,Being in West, Texas for the funeral of a fallen Dallas Fireman is a really sobering experience. #hero #prayforwest #dfd
1222,1442076388437,1,0,1,0,on-topic,1,97,1422,@eric_schumann it's crazy sad man. It's 15 min away
1223,1442076388437,0,1,1,0,off-topic,0,161,1423,I just screamed in the library because I thought @gracehelbig liked my post. #IMPOSTER #rude http://t.co/CI7m02iWOI
1224,1442076388620,0,0,1,0,off-topic,183,68,1424,Guess ill stay up late
1225,1442076388620,0,0,1,0,off-topic,0,105,1425,@Meliamei22 HATER. she makes wine and tweets me. I love her
1226,1442076388620,0,1,1,0,off-topic,0,120,1426,@KidKid_YBLU @ChrisMacTheRula y'all are acting like brothers right now lol
1227,1442076388621,0,0,1,0,off-topic,1,164,1427,I need a dude that keep trill and he remain the same and he don't get behind my back and try and and flip and change .
1228,1442076388621,0,1,1,0,off-topic,0,74,1428,Justice wanna be like me lol
1229,1442076388621,0,0,1,0,off-topic,0,145,1429,@BroHumour: If Taylor Swift ever dated Chris Brown and broke up. Her next song would be a hit. Lmao
1230,1442076388621,0,0,1,0,off-topic,0,83,1430,Omg DO NOT MESS WITH MY SHOE BOXES!!!
1231,1442076388622,0,0,1,0,off-topic,1,75,1431,Stevie J Had Meme Fucked Up ?
1232,1442076388622,0,1,1,0,off-topic,0,137,1432,It's Sad When Girls Lie About Their Age &amp; Shit Just To Be With A Grown Nigga. #DoBetter
1233,1442076388622,0,0,1,0,off-topic,0,106,1433,I can't tell if I'm awake or not. #roughmorning #wheresmybed
1234,1442076388622,0,0,1,0,off-topic,0,147,1434,@Thee_Leaderr @payton_odom13 @shelby_nb a machine that makes any type of food I want instantly appear
1235,1442076388623,0,1,1,0,off-topic,1,169,1435,Papa Johns 50% off tomorrow cuz the rangers scored more than 7 runs again  haha they going to make them run out of business
1236,1442076388807,0,0,1,0,off-topic,184,121,1436,Fool me once? Shame on me. Fool me twice? I'm done with you. #indirecttweet
1237,1442076388808,0,0,1,0,off-topic,1,86,1437,@TweetEm_B We Do!!  This Weekend wassup?
1238,1442076388808,0,0,1,0,off-topic,0,66,1438,I know I had it too!
1239,1442076388808,1,1,1,1,on-topic,0,174,1439,The greatest need right now is blood ~news anchor urging people to help for the explosion victims. If you wanna help, donate #fb
1240,1442076388809,0,0,1,0,off-topic,1,172,1440,#texas #jobs Park Tech I / West District Parks (Part-time, Temp, Seasonal) - Travis County -  West, TX  http://t.co/rUJhiX5Dtr
1241,1442076388809,0,0,1,0,off-topic,0,67,1441,We Up In This Bitch !
1242,1442076388809,0,0,1,0,off-topic,0,161,1442,@JaimiesHusband hahaha I'm glad you know the limit, I don't think we could handle a Colin conceitedness filled life
1243,1442076388809,0,0,1,0,off-topic,0,99,1443,He into them ugly ass females with them bad attitudes
1244,1442076388809,0,0,1,0,off-topic,0,86,1444,We still here playing fifa and pool haha
1245,1442076388810,0,0,1,0,off-topic,1,127,1445,Show me a sign LordIt's all that I've been waiting forI can't go on without you..
1246,1442076388810,0,0,1,0,off-topic,0,116,1446,Drinking some Ultras with these jams. Faaaaaak. http://t.co/mLXmkBYICD
1247,1442076388810,1,0,1,0,on-topic,0,124,1447,@celia_pd thank you.  It's pretty awful.  Appreciate prayers for all affected.
1248,1442076388811,0,1,1,0,off-topic,1,175,1448,That awkward moment when I'm hanging out with @kelbelle13 at shortys but I'm really just alone at the bar while she works........
1249,1442076388995,0,0,1,0,off-topic,184,73,1449,Middle finger to the police
1250,1442076388995,0,0,1,0,off-topic,0,127,1450,Ok FINE. I'm sorry about the munch munch #struggle #youreamazing @NicholasLopez11
1251,1442076388995,0,1,1,0,off-topic,0,99,1451,@SimplyErica__ showing her this tomorrow just because
1252,1442076388995,0,0,1,0,off-topic,0,135,1452,At Baylor, even the graffiti is scripture @ Moody Memorial Library http://t.co/tKYXcVfpoJ
1253,1442076388996,1,0,1,0,on-topic,1,142,1453,My thoughts and prayers are with our brother and sisters of #West. #PrayForWest #FirstResponders
1254,1442076388996,0,1,1,0,off-topic,0,147,1454,To my last RT, if a body has been In the river for months, why would it just now be noticed floating?
1255,1442076388996,0,0,1,0,off-topic,0,112,1455,Ill rub tf out of Dwight Howard big as shoulders with his fine ass
1256,1442076388996,0,0,1,0,off-topic,0,155,1456,@airmanlover13 this is my foot tat. I love tattoos too girl! I'm fixin to get another  http://t.co/rpb2zI6zdO
1257,1442076388996,0,0,1,0,off-topic,0,95,1457,Always Count Your Blessings , Not Your Problems !
1258,1442076388996,0,0,1,0,off-topic,0,75,1458,Y'all ain't real. None of you
1259,1442076388997,0,0,1,0,off-topic,1,134,1459,When you use the handicap button so you don't have to physically open a door. #lazyprobs
1260,1442076388997,0,1,1,0,off-topic,0,129,1460,@jennyc104 I'll just go study accounting at a&amp;m! It'll be a party all the time!
1261,1442076389183,0,0,1,0,off-topic,186,104,1461,@Mark_Cummings_ I got 2nd and got a Rudy's gift card. Haha
1262,1442076389184,0,0,1,0,off-topic,1,112,1462,@bugirl14 shouldn't you be working on something...? Procrastinator
1263,1442076389185,0,1,1,0,off-topic,1,144,1463,where are the real people at just in general. thats why im the way I am bc nobody is real anymore.
1264,1442076389185,0,1,1,0,off-topic,0,104,1464,I kinda wanna do that lucid dream!! Just not be by myself!
1265,1442076389185,0,0,1,0,off-topic,0,129,1465,@jazzzmyn55 you cooked.... And graced me with the opportunity to eat from the pot !
1266,1442076389186,0,0,1,0,off-topic,1,162,1466,@GorgeoussTHUGG: @DreWill_Kcg What Middle School DID You Go To ? I went to baines in fortbend &amp; johnston in HISD
1267,1442076389186,0,0,1,0,off-topic,0,104,1467,Tryna Lose At Least 10 Pounds So I Can Be Summer Time Fine
1268,1442076389186,0,0,1,0,off-topic,0,125,1468,@OsamaBinAndre @BEATKINGKONG either way u say it ...that IS some #homo ass shit
1269,1442076389186,0,0,1,0,off-topic,0,94,1469,Lol I aint know my lil nigga jared from compton.
1270,1442076389186,0,0,1,0,off-topic,0,201,1470,@TheeLastOreo no we didn't, we looked &amp; looked &amp; I found this one &amp; fell in love, he actually showed me it  i love unique stuff &amp; it's perf
1271,1442076389186,0,0,1,0,off-topic,0,135,1471,@bmiana you like them &amp;&amp;&amp;&amp;  I like them! So that all that matters anyways
1272,1442076389369,0,0,1,0,off-topic,183,80,1472,Detention&lt;&lt;&lt; but last day
1273,1442076389369,1,0,1,0,on-topic,0,184,1473,Sen. Cornyn n Cruz taking questions from media Tells @keyetv at least another day before folks allowed home #WestTX http://t.co/Y65NpMLUem
1274,1442076389369,0,0,1,0,off-topic,0,85,1474,And I'm laughing at them puuhh nihhhhas
1275,1442076389370,0,0,1,0,off-topic,1,78,1475,Lol i stays doing oomf like that
1276,1442076389376,0,0,1,0,off-topic,6,156,1476,idgaf who you are or where I am I will ALWAYS jam every word to every song on Britney's blackout album. #endof
1277,1442076389376,1,0,1,0,on-topic,0,107,1477,RT @JohnCornyn: Blast site West, Texas http://t.co/7d2pymjg1h
1278,1442076389376,0,0,1,0,off-topic,0,80,1478,Im putting all the young niggas on
1279,1442076389377,0,1,1,0,off-topic,1,150,1479,just two rags waving in the wind @therealjwills #JonnyFlag #vivaItalia @ flagpole http://t.co/uCXoGb0zQc
1280,1442076389377,0,1,1,0,off-topic,0,182,1480,Who woulda thought little ole Watertown, Mass., where I spent a good chunk of my early childhood, would be the hub for media right now?!
1281,1442076389377,0,0,1,0,off-topic,0,135,1481,There's a bird stuck in our living room ceiling vent. HE. NEEDS. TO. LEAVE. #byebyebirdie
1282,1442076389377,0,1,1,0,off-topic,0,108,1482,Tonight it's just me, myself and basketball #playoffs #memphis
1283,1442076389377,0,0,1,0,off-topic,0,103,1483,I can't help you if you ain't willing to help yourself !!
1284,1442076389558,0,0,1,0,off-topic,181,111,1484,Oh snaps Patrick Peterson and TM7 on the same team again ... Nice
1285,1442076389558,1,0,1,0,on-topic,0,121,1485,some serious military choppers out here in the Waco area... #BlessWestTexas
1286,1442076389559,0,0,1,0,off-topic,1,106,1486,@CocoaWessst: Damn it's cold outside. Ill be there next time
1287,1442076389559,0,0,1,0,off-topic,0,123,1487,@x_CussImJazz: @BraziliaanGOTTI: Real Bitches Listen When im Speaking No.why?
1288,1442076389559,0,0,1,0,off-topic,0,83,1488,Time has changed so fuck it get a new
1289,1442076389560,0,0,1,0,off-topic,1,74,1489,Still at this hospital tho .
1290,1442076389560,0,0,1,0,off-topic,0,124,1490,@foreverkaelaa: My ass looks enormous with grey leggings .  #liestoldontwitter
1291,1442076389560,0,1,1,0,off-topic,0,163,1491,@krissybrown73 @tx_navyfiance just like you didn't think everyone would take it this seriously, so might she, ya know
1292,1442076389560,0,0,1,0,off-topic,0,78,1492,I refuse to be sick! #notdoingit
1293,1442076389561,0,0,1,0,off-topic,1,74,1493,Beer farts are the stinkiest
1294,1442076389561,0,0,1,0,off-topic,0,91,1494,Ex txted me &lt;&lt;&lt; its been how long .?
1295,1442076389561,0,0,1,0,off-topic,0,73,1495,I can't roast for shit !!!!
1296,1442076389562,0,0,1,0,off-topic,1,84,1496,Take ugly selfies so I know it's real.
1297,1442076389562,0,0,1,0,off-topic,0,84,1497,Sorry but true you can catch me on T.V
1298,1442076389747,0,0,1,0,off-topic,185,81,1498,Now mami show me how that neck feel
1299,1442076389749,0,0,1,0,off-topic,2,152,1499,Not that it isn't a good song. But how is a song about a crack whore so popular? Class a team.. Strange...
1300,1442076389749,0,0,1,0,off-topic,0,103,1500,Thinking Real Hard If I Should Fade Dallas Next Weekend .
1301,1442076389750,0,0,1,0,off-topic,1,77,1501,I fuck with females 19 &amp; up
1302,1442076389750,1,0,1,0,on-topic,0,133,1502,I'm only 15 min away.. &amp; I am so helpless... I haven't felt like this since 9/11...
1303,1442076389750,0,0,1,0,off-topic,0,78,1503,I should be writing my 5 essays.
1304,1442076389751,0,0,1,0,off-topic,1,114,1504,I'm at Waco, TX - @cityofwaco w/ @b_vasquez28 http://t.co/n4BjobvGH8
1305,1442076389751,0,0,1,0,off-topic,0,77,1505,I could f*ck you all the time..
1306,1442076389752,0,0,1,0,off-topic,1,174,1506,@Mike_Millz187 That nigga Alex lying hard !!! -.- he ain't ever call me ... But it's all good ! -.- fuck all y'all niggas . Lmao
1307,1442076389752,0,0,1,0,off-topic,0,90,1507,@Jamzbro Wow, and I totally went to class...
1308,1442076389752,0,1,1,0,off-topic,0,175,1508,@ToyaAmanda: @__MacAttack: The world's been fucked up. Pay attention in history class. Ain't nothing changed but the date. AMEN !
1309,1442076389752,0,0,1,0,off-topic,0,116,1509,im congested but my nose is running. what kind of devil magic is that.
1310,1442076389753,0,0,1,0,off-topic,1,71,1510,#HonestDM ? R e t w e e t
1311,1442076389941,0,0,1,0,off-topic,188,91,1511,If yo avi look ugly, you not getting a follow
1312,1442076389941,0,0,1,0,off-topic,0,116,1512,So many people left after Obama's speech..... That's so disrespectful.
1313,1442076389942,1,1,1,1,on-topic,1,120,1513,Live streaming of West First Responders Memorial at http://t.co/Ub8gJimfKk
1314,1442076389942,0,0,1,0,off-topic,0,169,1514,Relaxing and watching a sunset after finishing a LONG, emotional day. Nice to unwind and decompress. http://t.co/5aBSXmBesS
1315,1442076389942,0,0,1,0,off-topic,0,142,1515,S/O to my bros @_John_Doee and @OGClarkKent for holdin it down! KO football is the best football
1316,1442076389942,0,0,1,0,off-topic,0,95,1516,Fuck him, he looks like the scream - Ester hahaha
1317,1442076389943,0,0,1,0,off-topic,1,84,1517,@kby80 @jordynnlea where is her car...
1318,1442076389943,0,0,1,0,off-topic,0,121,1518,@ThelIluminati: Don't make a permanent decision for your temporary emotion.
1319,1442076389943,1,0,1,0,on-topic,0,122,1519,Half of proceeds at Scruffs go to West #everyreasontodrinkmore #baylor #waco
1320,1442076389944,0,0,1,0,off-topic,1,88,1520,Damn I forgot I wanted to change My number
1321,1442076389944,0,0,1,0,off-topic,0,97,1521,@JoeneishaC it's almost there, food comes first lol
1322,1442076389944,0,0,1,0,off-topic,0,106,1522,Yesterday I told Chris He Look like he work at walmart nshit
1323,1442076389945,0,0,1,0,off-topic,1,129,1523,He cheats, he dives, he'll bite your hands and thighs. Luis Suarez, Suareeeeezzzzz!
1324,1442076390128,1,0,1,0,on-topic,183,115,1524,Massive donation sorting center #westexplosion http://t.co/8WZQh0JkoN
1325,1442076390128,0,0,1,0,off-topic,0,180,1525,@akenjari I'm writing a paper on if India was more authoritarian would it have more economic growth than China and at a faster rate...
1326,1442076390128,0,0,1,0,off-topic,0,73,1526,I'm about to fire myself up
1327,1442076390128,0,0,1,0,off-topic,0,96,1527,Them blunts and that Cup had a bitch feeling right
1328,1442076390129,0,1,1,0,off-topic,1,117,1528,I See Wat Niggas Be Talking Bouyt I Be Thinking They Just Be Talking...
1329,1442076390129,0,0,1,0,off-topic,0,126,1529,Somebody Tell Me What Happiness Is Cuz I'm Sick Of Living So Low... In My Life..
1330,1442076390129,0,0,1,0,off-topic,0,85,1530,@Dinero_Quaa: All freaks go both ways!!
1331,1442076390129,0,0,1,0,off-topic,0,77,1531,I need to get my life together.
1332,1442076390130,0,0,1,0,off-topic,1,100,1532,@Lickk_Downn_LOW: The FACT That He Aint Shit But A Hoe
1333,1442076390130,0,1,1,0,off-topic,0,173,1533,I might sound very hypocritical in my tweets cause I smoke and now I'm tryna go back to church ... But people could change ....
1334,1442076390130,0,0,1,0,off-topic,0,173,1534,@iiGBreezy: PICTURE Of Chris Brown's New DOPE Painting! #Teambreezy #BreezyART @chrisbrown RT http://t.co/gldSbbKgxK that ant a
1335,1442076390130,0,0,1,0,off-topic,0,87,1535,I bet they arrested that dude on the roof
1336,1442076390316,0,0,1,0,off-topic,186,118,1536,@TirayeKream_: damn this nigga really mad the price done went up 3 raccs
1337,1442076390316,0,0,1,0,off-topic,0,108,1537,Nothing brings two people together faster than a common enemy.
1338,1442076390316,0,0,1,0,off-topic,0,70,1538,Damn I Hate Being Sober!
1339,1442076390317,0,0,1,0,off-topic,1,75,1539,I'm in my zone!!I'm feelin it
1340,1442076390317,0,0,1,0,off-topic,0,142,1540,I remember those dark days of high school when we couldn't wear Nike shorts. How did we survive?
1341,1442076390317,0,0,1,0,off-topic,0,85,1541,@Jordynberryy did you figure it out? :(
1342,1442076390317,0,1,1,0,off-topic,0,167,1542,Being reminded of the smell of an old love that you just can't get over when someone who wears the same cologne walks by.
1343,1442076390318,1,1,1,1,on-topic,1,142,1543,Just bringing water to the people of West with @livriordann! #prayforWest http://t.co/1ARqD74W1V
1344,1442076390318,0,0,1,0,off-topic,0,69,1544,if I get these shoes...
1345,1442076390318,0,0,1,0,off-topic,0,78,1545,At Home Staying Out Of The Air .
1346,1442076390319,0,0,1,0,off-topic,1,181,1546,@krissybrown73 @tx_navyfiance girl people don't joke about that kinda stuff, it's hurtful. How would you feel if that girl actually did
1347,1442076390319,0,1,1,0,off-topic,0,153,1547,I think it's funny when people are scared to sit by someone on the bus they don't know so they just stand..
1348,1442076390319,0,0,1,0,off-topic,0,98,1548,@roach_april @bwadwilliams dont act like you havent!
