1070,1434448329721,0,0,1,0,off-topic,1,124,1352,@Jmodio oh my god.....are you living in Little Utah section of NYC?  Come over
1071,1434448329721,0,0,1,0,off-topic,0,111,1353,why does @TheReal_AGallo go to sleep so early like hello im bored
1072,1434448329721,0,1,1,0,off-topic,0,77,1354,Its our world, its just us two.
1073,1434448329721,1,0,1,0,on-topic,0,182,1355,@Jamrock_Prize: Mi peeps in the US without light.... At least a farrin unnu deh. By tmrw unnu get dat back. *hugs* a lie yah tel my girl
1074,1434448329721,0,1,1,0,off-topic,0,172,1356,@KingJames: Best of luck to my lil bro/homie @JHarden13 in H-Town! He bout to go HAM in his role now.. THATS CRAZY.....OKC WTF
1075,1434448329722,0,0,1,0,off-topic,1,91,1357,I need more interesting people to #follow ...
1076,1434448329722,0,0,1,0,off-topic,0,98,1358,Sitting in the car with my sisters charging my phone
1077,1434448329722,0,0,1,0,off-topic,0,128,1359,I'm at Tam Mobile Falafel &amp; Smoothie Truck (New York, NY) http://t.co/Wab78Dqt
1078,1434448329722,0,1,1,0,off-topic,0,107,1360,We would be outside right now playing handball @jhadirectz (:
1079,1434448329907,0,0,1,0,off-topic,185,89,1361,Not my video though. Don't get too excited.
1080,1434448329907,0,1,1,0,off-topic,0,103,1362,Hookah with my fam , shit is crazyb getting fuckhed up xP
1081,1434448329907,0,0,1,0,off-topic,0,173,1363,@viaBANGarang lol all the girls in the city got like short ass skirts and you can see their ass mad funny. Some hot bitches too
1082,1434448329908,0,0,1,0,off-topic,1,96,1364,@sarahjoybrown I hope we are still here too!!  LOL
1083,1434448329908,0,0,1,0,off-topic,0,135,1365,The gym is packed. #cmonson #businessasusual (@ Club Fitness) [pic]: http://t.co/LWDsxrxm
1084,1434448329908,0,0,1,0,off-topic,0,81,1366,Pablo doesn't know what he's saying
1085,1434448329908,0,0,1,0,off-topic,0,140,1367,#Top10FavouriteSongs yzl OMG #StudyingForTheSAT .. thank God I found this http://t.co/kdLmgABd
1086,1434448329909,0,1,1,0,off-topic,1,134,1368,@justin_oakley: Going to the inlet with poppa oaks @DanielleOakleyx this is a joke right
1087,1434448329909,1,0,1,0,on-topic,0,187,1369,@FreddyFigs: Praying that all my family, friends &amp; people are safe on the East Coast. Everyone, please stay safe out there.Thanks babe!xo
1088,1434448329909,1,0,1,0,on-topic,0,92,1370,Sandy, you are seriously a B #Sandy #abcliving
1089,1434448329909,0,0,1,0,off-topic,0,109,1371,@bree_cass @JaclynLoftus bitch ill give you all the tude i want
1090,1434448329909,1,0,1,0,on-topic,0,93,1372,Mother Nature is about to have a Period. #Sandy
1091,1434448329910,0,0,1,0,off-topic,1,103,1373,I'm at Lower Twp Police (Villas, NJ) http://t.co/411iO35Y
1092,1434448330094,0,0,1,0,off-topic,184,136,1374,Ugh a #7eleven opened on my block. What is that smell they all have? Bring back my bodega.
1093,1434448330094,0,0,1,0,off-topic,0,103,1375,@skelseymarie hahahaha. We do too! So far. And beer . . .
1094,1434448330094,1,0,1,0,on-topic,0,111,1376,Streets are flooded and not one rain drop came down so far #Sandy
1095,1434448330095,0,0,1,0,off-topic,1,106,1377,@NickBl00m @scarlettkromer_ yeah I know I'm still scared lol
1096,1434448330095,1,0,1,0,on-topic,0,132,1378,Overhead view of Union Square #sandy  @ W New York - Union Square http://t.co/uBM2tW3S
1097,1434448330095,0,1,1,0,off-topic,0,113,1379,Second brunch! (with Mary at William Hallett)  http://t.co/hz4zoS6q
1098,1434448330095,0,0,1,0,off-topic,0,111,1380,&amp; in one of those texts, no work tomorrow?! YES #Recuperating
1099,1434448330095,1,0,1,0,on-topic,0,71,1381,Did all of bg lose power?
1100,1434448330096,0,0,1,0,off-topic,1,132,1382,Researching Companies for #TMCF25 (@ Hilton New York w/ 6 others) http://t.co/Ne1UBvKP
1101,1434448330096,0,0,1,0,off-topic,0,106,1383,Okayy finally these dudes got ready lol I'm in a better mood
1102,1434448330096,0,1,1,0,off-topic,0,119,1384,daddy is so good he gets paid $500 an hour to fight with people #clueless
1103,1434448330096,0,0,1,0,off-topic,0,103,1385,@Codyleedrnt working one day a week,isn't making me rich!
1104,1434448330097,0,0,1,0,off-topic,1,96,1386,@NeoScandal Hopefully MORE #Scandal PROMOS ON #ABC
1105,1434448330282,1,0,1,0,on-topic,185,146,1387,Looking bad across the river in Jersey City #Sandy  @ Robert F. Wagner Jr. Park http://t.co/BG8G8ORf
1106,1434448330282,0,0,1,0,off-topic,0,129,1388,I love the random conversations my grandma &amp;&amp; I have at one in the morning!
1107,1434448330282,1,0,1,0,on-topic,0,114,1389,MTA is suspended &amp; Pathmark is about to close. Day off! Woohoo !
1108,1434448330282,0,1,1,0,off-topic,0,104,1390,Tomorrow... No school, no work, no street, just bed!!! \o/
1109,1434448330283,0,0,1,0,off-topic,1,94,1391,@PdaMadridista97 shitzu , and in july u late son
1110,1434448330283,0,0,1,0,off-topic,0,100,1392,@SuaveMarci. Niggas mvccn with they old boo's and shit
1111,1434448330283,0,0,1,0,off-topic,0,142,1393,Lmaoo RT @_M__W_: @aliyahster: Why would Beyonce stay in New York? u know fav aint the brightest
1112,1434448330284,0,0,1,0,off-topic,1,91,1394,@chollis not until you answer my phone calls.
1113,1434448330284,0,1,1,0,off-topic,0,111,1395,Why tf did everybody RT that tweet that i made like.an hour ago .
1114,1434448330284,0,1,1,0,off-topic,0,98,1396,@xxcaselinaxx: I want chinese food so bad right now.
1115,1434448330285,0,0,1,0,off-topic,1,91,1397,@yeaimBlunt lol that doesn't help my appetite
1116,1434448330285,1,0,1,0,on-topic,0,141,1398,@AHurricaneSandy dis bitch fucking dropped a giant ass branch onto my car  http://t.co/txPOYzjt
1117,1434448330285,0,0,1,0,off-topic,0,137,1399,@MsPixiee hey that's an offensive word missy, take that back !! I'll P.I.M.P slap you silly
1118,1434448330469,0,0,1,0,off-topic,184,143,1400,@rachaelking70 Yes, I was dismayed by  the sudden sexism of an otherwise enjoyable correspondent.
1119,1434448330469,0,0,1,0,off-topic,0,121,1401,When I say fuck yes I don't mean fuck the band called Yes, cos I love them.
1120,1434448330470,0,0,1,0,off-topic,1,182,1402,Carnival des Corbeaux... Let's see how this goes. No idea what to expect. (@ Manderley Bar at the McKittrick Hotel) http://t.co/Ww68DhpZ
1121,1434448330470,0,0,1,0,off-topic,0,96,1403,#10ReasonsWhyILoveYou - youre so cute and handsome
1122,1434448330470,1,0,1,0,on-topic,0,174,1404,Wind finally died down enough to crack a window in here. Enjoying the fresh air. Still locked on to @WNYC radio coverage. #Sandy
1123,1434448330470,0,0,1,0,off-topic,0,117,1405,Called out of work. That's right, called, because the OG doesn't close.
1124,1434448330471,0,0,1,0,off-topic,1,165,1406,Okay so ur mad at me cause ur a sad excuse of a slut yea well I think ur aiming ur anger at the wrong person #stupidhoe
1125,1434448330471,0,0,1,0,off-topic,0,118,1407,Girl I ain't a hipster but I can make you're hips stiiiiir - Mac millerr
1126,1434448330471,0,0,1,0,off-topic,0,87,1408,@KieraGalvin awe love u too.. Uhhh whoops
1127,1434448330471,1,0,1,0,on-topic,0,110,1409,Before and after #sandy  @ Breezy Point, NY http://t.co/n7yqbt83
1128,1434448330471,1,1,1,1,on-topic,0,121,1410,Bloomberg: By midnight we expect surge to recede. #Sandy And now...espanol!
1129,1434448330657,0,0,1,0,off-topic,186,77,1411,We could live like this forever
1130,1434448330658,0,0,1,0,off-topic,1,118,1412,@ItsMuslia wear a bathing suit to school Tuesday we'll swim to home room
1131,1434448330658,0,0,1,0,off-topic,0,96,1413,@Redbone_Jawn Thankyou baby  the feeling is mutual
1132,1434448330659,0,0,1,0,off-topic,1,96,1414,@JLBarrow whoa . Glad to hear you're safe though !
1133,1434448330659,0,1,1,0,off-topic,0,165,1415,@OrinPhillips: People buying water when its gonna be raining. &lt;&lt;&lt;Tell Me Abt It..Supermarkets Did Pack Today..
1134,1434448330659,1,0,1,0,on-topic,0,80,1416,Just did odee work for this storm!
1135,1434448330659,0,0,1,0,off-topic,0,120,1417,Playing 2 Chainz at a house party is a recipe for ratchetry and debauchary
1136,1434448330660,0,0,1,0,off-topic,1,116,1418,Damn did I really drink half a bottle by myself?! Wtf? #chocolatevodka
1137,1434448330660,0,0,1,0,off-topic,0,90,1419,@A_Steelman omg! Be careful out there! Geez!
1138,1434448330660,0,0,1,0,off-topic,0,144,1420,A time like this calls for a RE-read of Mr. Grey. #50shades Sadly, I only have the first book. -.-
1139,1434448330660,0,0,1,0,off-topic,0,127,1421,@ndevito27 @Ndais10 @RalphieSpamps the hurrican in wrestling was that dude though
1140,1434448330660,0,0,1,0,off-topic,0,171,1422,@1DTartheela @xkayykayyx @itzmejefferly i m eating chocolate! My uncle brought mad chocolate for me!!!!!! Jealous bitches?!?!
1141,1434448330843,0,0,1,0,off-topic,183,122,1423,Return to Sender with Lee and Romy! @ Broadway Dive Bar http://t.co/YGYK88uo
1142,1434448330844,0,1,1,0,off-topic,1,143,1424,@Marky_Kelarky: @itsz_jeremy lmao don't worry about it bro, soon enough! We got FIND coming up to
1143,1434448330844,0,0,1,0,off-topic,0,111,1425,I'll never understand why coolin hates me so much  #imaniceperson
1144,1434448330844,0,1,1,0,off-topic,0,154,1426,I just ousted @harlemboy22 as the mayor of New York City Center Stage I on @foursquare! http://t.co/CAn36o99
1145,1434448330844,0,0,1,0,off-topic,0,125,1427,@jcsturgeon Grampie would be proud...didn't miss the mail yesterday or today :)
1146,1434448330844,0,0,1,0,off-topic,0,121,1428,Lower your expectations of people, and you will lower your disappointments.
1147,1434448330844,0,0,1,0,off-topic,0,134,1429,@gemma_annn LOL not you...but you deff can fit under that category today that's for sure
1148,1434448330845,1,0,1,0,on-topic,1,181,1430,@rcnconnects 1199 Park Ave. - NY has been without internet or telephone service all night. Lots of elderly. What is ETA of your people?
1149,1434448330845,0,0,1,0,off-topic,0,129,1431,Ppl want me to kall dem nd shit like my battery built lik dat iphones die fast love
1150,1434448330845,0,1,1,0,off-topic,0,84,1432,I really just need someone to talk to.
1151,1434448330845,0,0,1,0,off-topic,0,78,1433,Keep calm and go smoke some weed
1152,1434448331032,0,1,1,0,off-topic,187,155,1434,@itsyoliebitch @YummyLena i just hope the power doesn't go out. Halloween movie marathon to pass the time in.
1153,1434448331032,0,0,1,0,off-topic,0,131,1435,Sometimes girls don't get when I'm kidding and it's annoying #imeanwell #relax #Sandy
1154,1434448331032,0,1,1,0,off-topic,0,170,1436,@jerzyjax yea good. Im sure u seen the pics of ww. The island is under H2o byt we in pville just windy but AC is dun for too
1155,1434448331033,0,0,1,0,off-topic,1,100,1437,@MzBellee I know man .. But i wanna know if hes ok lol
1156,1434448331033,1,0,1,0,on-topic,0,145,1438,I'm at Frankenstorm Apocalypse - Hurricane Sandy (New York, NY) w/ 2852 others http://t.co/76GHum7n
1157,1434448331033,1,0,1,0,on-topic,0,114,1439,Tree fell in neighbors car &amp; house   @ home http://t.co/cleevXwZ
1158,1434448331033,0,0,1,0,off-topic,0,78,1440,i guess she wants that angry sex
1159,1434448331034,0,0,1,0,off-topic,1,121,1441,New York is such a strong state... throw anything at us and we will beat it
1160,1434448331034,0,0,1,0,off-topic,0,87,1442,@SmiloTweets nah, still waiting to go on!
1161,1434448331035,0,0,1,0,off-topic,1,140,1443,Happy Haloween from the United Federation of Planets @ the Waffle Brothel http://t.co/cjKZvZEH
1162,1434448331035,0,0,1,0,off-topic,0,101,1444,I'm at Furry Fiends (New York, NY) http://t.co/an7DnmRd
1163,1434448331035,0,0,1,0,off-topic,0,70,1445,My fun came to an end :(
1164,1434448331036,1,0,1,0,on-topic,1,130,1446,My post #HurricaneSandy #Breakfast...  @ Woodlands Condominiums http://t.co/63J2yEsE
1165,1434448331219,0,0,1,0,off-topic,183,91,1447,Is there really no dance on Monday Or Tuesday
1166,1434448331220,0,0,1,0,off-topic,1,131,1448,@Smackdoom_02: #ToMyFutureWife well first you better be able to cook or learn how too
1167,1434448331220,0,0,1,0,off-topic,0,121,1449,I like can't stand anyone anymore! No one know the definition of being real
1168,1434448331221,0,1,1,0,off-topic,1,169,1450,Come by in 21 minutes and see my low tide, I'll be 30 inches under my usual level. My mudflats will bask in fragrant decay.
1169,1434448331221,1,0,1,0,on-topic,0,91,1451,@ChrisRonca22 yeah trees and powerlines down.
1170,1434448331221,0,0,1,0,off-topic,0,97,1452,Today would be a good day to cook a Sunday dinner .
1171,1434448331222,1,0,1,0,on-topic,1,106,1453,Bout 2 fight sandy 2 get 2 work...if u  gotta b out...b safe
1172,1434448331222,0,0,1,0,off-topic,0,123,1454,@fob_talk loll no it's not. It's better than saying I don't wanna talk to you
1173,1434448331222,1,0,1,0,on-topic,0,101,1455,No power... What. Am. I. Supposed. To. Do.... #craycray
1174,1434448331222,0,0,1,0,off-topic,0,75,1456,I missing all the good movies
1175,1434448331223,0,0,1,0,off-topic,1,103,1457,Bouta go buy a mask and call it a night .. I'm cashin out
1176,1434448331223,1,1,1,1,on-topic,0,184,1458,Eric Holthaus: NHC update at 5am: #Sandy now moving due north, will turn toward the northwest -- and toward land -- in the next few hours.
1177,1434448331407,1,0,1,0,on-topic,184,170,1459,GOOD call. On it! Cc @hillarygrove @Punkaboo RT @LuckyMagazine: Buying a new raincoat. Thanks for the justification, #Sandy.
1178,1434448331408,0,0,1,0,off-topic,1,129,1460,@GuapHeavy: I am extraordinarily patient, provided I get my way in the end. indeed!
1179,1434448331409,0,0,1,0,off-topic,1,108,1461,Ok geniuses, start taping.  @ Apple Store http://t.co/VE03OOVD
1180,1434448331410,0,0,1,0,off-topic,1,74,1462,I really hate this kid lmfao
1181,1434448331412,0,0,1,0,off-topic,2,111,1463,Rotten lemon on the window sill  @ Mercer St http://t.co/vZtVAriJ
1182,1434448331413,1,0,1,0,on-topic,1,116,1464,Coastal Flood Warning issued for Ellis Island, NJ http://t.co/VPHcwCnb
1183,1434448331415,0,1,1,0,off-topic,2,142,1465,Im gonna always spark in remeberance and celebration of the day i walked away from the bullshit!
1184,1434448331415,0,1,1,0,off-topic,0,116,1466,My thies are KILLIN me, ive been walkin for 7 hours straight NON STOP!
1185,1434448331416,0,0,1,0,off-topic,1,127,1467,Storms over surveying the area (@ Prospect Park w/ 5 others) http://t.co/vFPRuw3T
1186,1434448331416,0,0,1,0,off-topic,0,181,1468,@gageboettinger: #ToMyFurtureChildren if you look anything like @Chhhloex you will be killed you wish you're kids looked like me niggaa
1187,1434448331416,1,0,1,0,on-topic,0,145,1469,I'm at Frankenstorm Apocalypse - Hurricane Sandy (New York, NY) w/ 4049 others http://t.co/Q0WmKC7Z
1188,1434448331594,0,0,1,0,off-topic,178,110,1470,@laurenaud ohh I was quite confused but yes I know I can't wait!
1189,1434448331594,0,1,1,0,off-topic,0,90,1471,I believe people like getting on my nerves .
1190,1434448331595,0,0,1,0,off-topic,1,79,1472,@Tamaraaax3 your so corny its sad
1191,1434448331595,0,0,1,0,off-topic,0,119,1473,@Argonon thanks for the follow team Argonon! @JarlsNewYork @HumanityPride
1192,1434448331596,0,0,1,0,off-topic,1,102,1474,I'm at Seth Low Park (Brooklyn, NY) http://t.co/zfDfiuMu
1193,1434448331601,0,0,1,0,off-topic,5,146,1475,@69fbird @aaguero9 so what if I get sleepy!!! This is driving me nuts-I could use a few drinks! Lol!
1194,1434448331602,1,1,1,1,on-topic,1,185,1476,Right now we r watching #hurricanesandy with Pirpir and uncle Sam. #brooklyn #bayridge #newyork #sandy checking tweets http://t.co/d0bJFBPx
1195,1434448331602,1,0,1,0,on-topic,0,134,1477,I'm at Frankenstorm Apocalypse - Hurricane Sandy w/ @selfwilledsoul http://t.co/HpZ5xvwF
1196,1434448331602,0,0,1,0,off-topic,0,91,1478,Round 3 wif ma bestest friends #schoolteacher
1197,1434448331602,0,1,1,0,off-topic,0,154,1479,Mom just said I can watch one more movie with her before I start my homework...shouldn't she be encouraging?
1198,1434448331603,0,0,1,0,off-topic,1,121,1480,@LBINow: Via Jay Zimmerman http://t.co/4FiaOTC0. Do you know where this is?
1199,1434448331603,0,0,1,0,off-topic,0,111,1481,Kickin' it with the #Empire  @ Herald Square http://t.co/P0iZz6YD
1200,1434448331781,0,0,1,0,off-topic,178,105,1482,Empty Times Sq is Empty @ Times Square http://t.co/iPKTcWY5
1201,1434448331782,1,1,1,1,on-topic,1,90,1483,Largest storm on record coming to New York..
1202,1434448331782,0,1,1,0,off-topic,0,182,1484,Follow my new twitter @smackboi_ent1 for everything smackboi up coming shows videos features and new pics of Kim Luc #smackboi #smackboi
1203,1434448331782,1,0,1,0,on-topic,0,185,1485,As we brace for a massive east coast storm #RomneyRyan are staying quiet If elected they will cut funding for both FEMA and disaster relief
1204,1434448331782,0,0,1,0,off-topic,0,133,1486,Harden kcp OH God: #HaveToAceMySATexam : thanks Jesus I found that http://t.co/ETu0aks8
1205,1434448331782,0,0,1,0,off-topic,0,136,1487,Post tail feather shaking drink.  @ Blue Ribbon Sushi Bar &amp; Grill http://t.co/VQ7bll3L
1206,1434448331782,0,0,1,0,off-topic,0,166,1488,@DeaconJohnHunt: @Micheee1020: hang in there. Angels will watch over you. Thanks Deacon John....pls pray for us in NJ xo
1207,1434448331783,1,1,1,1,on-topic,1,149,1489,I'm finally back in power and cell service on the UES tonight, the last 24 hours have been awful #sandy
1208,1434448331783,0,1,1,0,off-topic,0,95,1490,Okay so I'm officially off 2mor who's coming over
1209,1434448331783,1,0,1,0,on-topic,0,116,1491,Awning ripped off of Claire's #sandy  @ Bay Ridge http://t.co/quYBI3ub
1210,1434448331783,0,0,1,0,off-topic,0,72,1492,Pawn stars all day I guess
1211,1434448331784,0,0,1,0,off-topic,1,152,1493,!!!!!! @oMelly_6: I don't really care no more , it's done &amp; over with good luck on ya life . . I tried
1212,1434448331969,1,0,1,0,on-topic,185,92,1494,Shit storm hitting right into my friggin houze
1213,1434448331970,0,0,1,0,off-topic,1,165,1495,#TranquilaMaricaPonteABailarGangnamStyle yes SAT EXAM #StudyingForTheSAT // thank God I found this http://t.co/SoQ4yATK
1214,1434448331970,0,1,1,0,off-topic,0,81,1496,Gonna go and buy a kite #WhenInRome
1215,1434448331970,0,0,1,0,off-topic,0,81,1497,@HDOFblog it's the only thing open!
1216,1434448331971,0,0,1,0,off-topic,1,103,1498,Could not be more stoked for this extra day off. Or 2...?
1217,1434448331971,0,0,1,0,off-topic,0,143,1499,I have highly considered raping and pillaging given the great opportunity by these power outages.
1218,1434448331971,1,0,1,0,on-topic,0,183,1500,@Veronica_Cakir just make your way to my school before this storm gets here and i got you! I'll pay for gas and toll both ways. (= Lmaooo
1219,1434448331971,0,0,1,0,off-topic,0,128,1501,I sometimes listen to music and get deep in thought, thinking about life problems.
1220,1434448331972,0,0,1,0,off-topic,1,112,1502,@ElliottAlmond Of course. Anything to earn your pie-worthy praise!
1221,1434448331972,0,0,1,0,off-topic,0,107,1503,@jimmykimmel So we're really bored in the lobby. Come see us!
1222,1434448331972,0,0,1,0,off-topic,0,113,1504,Why doesnt Christie have an ASL interpreter next to him though? :-/
1223,1434448331973,0,0,1,0,off-topic,1,148,1505,#ToMyFurtureChildren I'll make sure I marry someone with gorgeous eyes so you can be blessed with them
1224,1434448332157,0,0,1,0,off-topic,184,117,1506,I've lived on this avenue for 18 years and never seen it empty god damn
1225,1434448332158,0,0,1,0,off-topic,1,107,1507,FYI three blind mice is a really tasteless Halloween costume.
1226,1434448332158,0,1,1,0,off-topic,0,179,1508,This chick just said once upon a time when I was blinded in the ummah #SoFeelingHer lol Islam is great but these Muslims be tripping.
1227,1434448332158,0,0,1,0,off-topic,0,81,1509,Off to the beach to take pictures!!
1228,1434448332159,0,0,1,0,off-topic,1,180,1510,@Mjulissaxo: Deadass this kid needs to stop calling me on private, you swear I don't know it's you. annoying same person as last time?
1229,1434448332159,0,0,1,0,off-topic,0,143,1511,Does Jerry Jones dress up for Halloween ? I mean come on the man looks like a skelaton year round
1230,1434448332159,0,0,1,0,off-topic,0,180,1512,@LeslieMarshall your argument is a more one, other than paid off union workers most Americans think we got screwed by the auto bailout
1231,1434448332159,0,0,1,0,off-topic,0,109,1513,Ballroom dancing with my brother.. in the kitchen.. in the dark
1232,1434448332159,1,0,1,0,on-topic,0,131,1514,Drinking sandy away with my girl Julia. Bottoms up! (@ Walter's) http://t.co/4Djq9v2D
1233,1434448332159,0,1,1,0,off-topic,0,111,1515,Shouldn't the sun be out (@ 24 Hour Fitness) http://t.co/viqRnlwY
1234,1434448332345,0,0,1,0,off-topic,186,91,1516,Taking mami out to eat ~ http://t.co/pEFRCFE0
1235,1434448332347,0,1,1,0,off-topic,2,143,1517,@Gsquare86 thanks Gigi :-) just a bit of wind at this point send good vibes to your sis for me...
1236,1434448332347,0,1,1,0,off-topic,0,113,1518,@ray_Burt I just want some major swerve, Brock vs Ryback might sell
1237,1434448332347,0,0,1,0,off-topic,0,163,1519,@meliithebest26 WEA WEA! She said that IM Doing Great and that i choosed a Good grupo of friends :D sea YOU LMFAOO :D
1238,1434448332348,0,0,1,0,off-topic,1,137,1520,All there is to do is go on twitter, eat, and watch tv until the power goes out if it does.
1239,1434448332348,0,1,1,0,off-topic,0,128,1521,@David_Boreanaz here's a photo by my house about 4 hours ago. http://t.co/a6K2WqQ1
1240,1434448332348,0,0,1,0,off-topic,0,114,1522,Really hard to believe I saw 25 range rovers today. #bestcaroutthere
1241,1434448332348,0,0,1,0,off-topic,0,133,1523,Hi Cav vmt WOW.. #HaveToAceMySATexam : ..better get it while u can http://t.co/KiPUmQsZ
1242,1434448332349,0,0,1,0,off-topic,1,104,1524,We ready 2 Helloween  @ 48th St. Home http://t.co/8TAm1iw2
1243,1434448332349,1,0,1,0,on-topic,0,126,1525,@RomneyStormTips: On day one I will end Hurricanes #Sandy #RomneyStormTips lolol
1244,1434448332349,0,0,1,0,off-topic,0,115,1526,@KACB417 At home? I still have power and I live around the corner lol
1245,1434448332350,1,0,1,0,on-topic,1,185,1527,Neighborhood assessment: fallen trees, electric poles slanted, but Dunkin Donuts, Rite Aid, local market, pizza and nail salon open. #sandy
1246,1434448332532,0,0,1,0,off-topic,182,90,1528,RIP Emanuel Steward. Still tough to stomach.
1247,1434448332532,0,0,1,0,off-topic,0,151,1529,@GreatNonprofits Michael Bloomberg also takes 1.00 a year salary, donated computers,takes subways etc etc
1248,1434448332533,1,0,1,0,on-topic,1,179,1530,#champagne by #candlelight #sandy #fuckit #bubbly #hurricaneparty just me and @cdharrison @ C&amp;Cs House of Hu http://t.co/gSJXiabN
1249,1434448332533,0,0,1,0,off-topic,0,185,1531,Dr. Azmi Hakim, President of the Orthodox Council of 1948 Palestinians, receives death threats for opposing IDF draft. http://t.co/lFKeOskS
1250,1434448332533,0,0,1,0,off-topic,0,98,1532,I wish I had a nice relationship with my brothers :/
1251,1434448332533,0,0,1,0,off-topic,0,159,1533,lmfaooooo @KattWillliams: All these girls claimin' to be barbies look like they came from the Build-A-Ho Workshop
1252,1434448332534,0,1,1,0,off-topic,1,179,1534,#SATstudyTime : O.M.G. We really wish my brother managed to get this previously http://t.co/ETHAhWvO you better get it now Harden vlb
1253,1434448332534,0,0,1,0,off-topic,0,83,1535,The world is casually ending outside.
1254,1434448332534,1,0,1,0,on-topic,0,137,1536,@tkylemac at least you have taller buildings. Hope you don't live on the bottom floors haha
1255,1434448332534,0,1,1,0,off-topic,0,92,1537,I swear Jay-Z's dad just got in this elevator.
1256,1434448332720,0,0,1,0,off-topic,186,103,1538,Christie is also not a fan of exercise or quiet breathing
1257,1434448332720,1,0,1,0,on-topic,0,74,1539,Hurricane better not kill me
1258,1434448332721,0,0,1,0,off-topic,1,100,1540,Great weekend capped off with some #homeland #showtime
1259,1434448332721,1,0,1,0,on-topic,0,172,1541,Power was good while it lasted @PSEGcares @PSEGNews @PSEGdelivers we are without power in Verona, NJ (near West Orange border)
1260,1434448332721,0,0,1,0,off-topic,0,104,1542,Beth's family &gt;&gt;&gt;&gt;      i absolutely love them
1261,1434448332722,0,0,1,0,off-topic,1,185,1543,@abcnews. What is the city doing for people in the financial district with cars parked underground? How do you plan to get those cars out??
1262,1434448332722,0,1,1,0,off-topic,0,166,1544,@risssrosss15 I was just there 30 minutes ago and was the only one in there. Shit got awkward with Rose working.. Hahaha
1263,1434448332722,1,0,1,0,on-topic,0,189,1545,@christinelem_: Oh &amp; good luck to everyone spending the storm with a Cuddle Buddy Don't let a hot date turn into a due date, guys. &gt; LOL
1264,1434448332722,1,0,1,0,on-topic,0,173,1546,@hurricannesandy: WAKE UP IN DA MORNIN FEELIN LIKE DESTROYIN CITIES GRAB MAH GLASSES I'M OUT DA DOOR IMA FUCK UP NEW YORK CITY.
1265,1434448332723,0,0,1,0,off-topic,1,133,1547,@WeatherABC7 this is right on the corner of our block, Jamaica, NY http://t.co/JgeKgloL
1266,1434448332723,0,0,1,0,off-topic,0,92,1548,@Smoove_Wave32 yeah u want me to invite people
1267,1434448332908,0,0,1,0,off-topic,185,97,1549,No power lots of wind and tress etc down everywhere
1268,1434448332909,0,0,1,0,off-topic,1,86,1550,@twinn97 @halerssss JK IM IN MY ROOM RN!
1269,1434448332909,0,0,1,0,off-topic,0,101,1551,@ShawNovel I know I was so happy with that text. Hahaha
1270,1434448332910,0,1,1,0,off-topic,1,143,1552,@SINCERE_ADONIS lol Now the song is on repeat in my head !! I love that song though. #KevinLittle
1271,1434448332910,1,0,1,0,on-topic,0,109,1553,@AMarie2410 there is no thunder. They are generators blowing up
1272,1434448332910,0,1,1,0,off-topic,0,171,1554,AMEN!!!  RT @MSJean0319: I swear I may stay off fb till the election is done. Ppl are ignorant stupid mofos. Just my opinion.
1273,1434448332910,0,1,1,0,off-topic,0,105,1555,I need an IV and anger management counseling like right now
1274,1434448332911,0,1,1,0,off-topic,1,170,1556,So @_HelloKeem ask me if I'm mad that he ate somebody ass and swallowed the dude throw up now you tell me do I give a phuck?
1275,1434448332911,0,0,1,0,off-topic,0,99,1557,Twitter me this #SEAISLECITY, NJ http://t.co/r4IKkq02
