1,1434450568718,0,0,1,0,off-topic,1434450568718,93,1,I've got enough candles to supply a Mexican family
2,1434450568909,1,0,1,0,on-topic,191,120,2,Sandy be soooo mad that she be shattering our doors and shiet #HurricaneSandy
3,1434450568909,0,0,1,0,off-topic,0,150,3,@ibexgirl thankfully Hurricane Waugh played it cool and waited this one out. Ready to go at any moment tho.
4,1434450568909,0,0,1,0,off-topic,0,137,4,@taos you never got that magnificent case of Burgundy I sent you to thank you for your tweets?
5,1434450568909,0,0,1,0,off-topic,0,112,5,I'm at Mad River Bar &amp; Grille (New York, NY) http://t.co/VSiZrzKP
6,1434450568910,1,0,1,0,on-topic,1,172,6,Neighborly duties. @Cory_Kennedy arrives to the rescue sporting some spelunking equipment #sandy @ 300 Squad http://t.co/QbpGdm3w
7,1434450568910,0,0,1,0,off-topic,0,74,7,And that's it until the spring.
8,1434450568910,1,1,1,1,on-topic,0,133,8,I don't know how I'm getting back to Jersey since the trains and subways aren't running...
9,1434450568910,0,1,1,0,off-topic,0,124,9,@NaeemPeena We were asked to get off the plane, after checkin and boarding passes
10,1434450568910,0,0,1,0,off-topic,0,113,10,@jaytee_96 you must be crazy! &amp; omg you tweeted something yay lol
11,1434450568911,1,1,1,1,on-topic,1,105,11,Already flooded so much #SANDY @ Hoboken http://t.co/MPhft4a8
12,1434450568911,0,0,1,0,off-topic,0,152,12,@eloreeeeeee need me to comeback and finish it since I was supposed to sleep over and then I woulda finished
13,1434450569093,1,1,1,1,on-topic,182,133,13,On that note, i pray that everyone stays safe, and keeps a positive attitude ! #godisgood
14,1434450569093,1,1,1,1,on-topic,0,118,14,@codyfinz my house is creeking... Does that mean she's trying to break in?
15,1434450569093,0,1,1,0,off-topic,0,152,15,My mom just found my little sister screaming out of her window in a random language to animals #onlymyfamily
16,1434450569093,0,0,1,0,off-topic,0,130,16,RT @FrankIero: Droplets of water is literally falling from the sky. #FrankenstormLIVE!
17,1434450569097,0,1,1,0,off-topic,4,89,17,@NevaTRUST_Again I Dnt No If She Gonna Let Me
18,1434450569097,0,0,1,0,off-topic,0,113,18,@jennettemccurdy @noahmunck He's got that kinda spec ops rugged looks
19,1434450569097,1,1,1,1,on-topic,0,82,19,debating going home in prep for #sandy
20,1434450569098,0,0,1,0,off-topic,1,96,20,@viamadison Thanks, babe. We all appreciate it. :) x
21,1434450569098,0,0,1,0,off-topic,0,72,21,I can't taste my damn food .
22,1434450569098,1,1,1,1,on-topic,0,104,22,By 11am it's going to be 100% chance of rain #HurricaneSandy
23,1434450569098,0,0,1,0,off-topic,0,110,23,Big Daddy Deco ready for this Halloween party http://t.co/grKxmXPV
24,1434450569098,0,0,1,0,off-topic,0,137,24,@MSLWILLSEE loll I don't know your twitter name anymore it doesn't popup when I type for name
25,1434450569099,0,0,1,0,off-topic,1,94,25,@lisanewmn I do it all the time. Don't hate me! :)
26,1434450569281,1,1,1,1,on-topic,182,173,26,@newscaster we are 5 blocks from the water. First two blocks were evacuated. Sounds like a train just went by. Stay safe! Thanks.
27,1434450569281,1,1,1,1,on-topic,0,99,27,It's crazy out there, not gonna lie I'm kind of scared.
28,1434450569281,1,0,1,0,on-topic,0,123,28,@israilov1012 god bless them ! Lmao the wind calmed down a little so thats good
29,1434450569282,0,1,1,0,off-topic,1,117,29,No sooner then my last tweet did I receive this text http://t.co/X7sLiyzt
30,1434450569282,0,0,1,0,off-topic,0,152,30,@mike_cucci queen duck face    ((((I can't do dick face so tongue works too right?))))) http://t.co/UjGnXfiP
31,1434450569282,0,1,1,0,off-topic,0,134,31,Off to try to find a kids phone I have no idea why he wanted until now to look for it #huh
32,1434450569282,1,1,1,1,on-topic,0,89,32,One more shower before the power goes out lol
33,1434450569282,1,0,1,0,on-topic,0,188,33,@marcushasfun- u were a guest star in my dream last night, &amp; 2day I noticed Marcus Garvey Park on a NYC #hurricane map! http://t.co/LQ2Kpif0
34,1434450569283,1,0,1,0,on-topic,1,166,34,Word to the wise, make sure you have cash on u in case of a prolonged power outage &amp; charge all ur phones, iPads, etc.
35,1434450569283,0,0,1,0,off-topic,0,174,35,#GottaAceMySATexam : OH LORD: wish my cousin found this previously http://t.co/umUM2hzE ya better get this #Top10FavoriteSongs kvb
36,1434450569283,0,1,1,0,off-topic,0,118,36,@victoriaaa0x haha I was gonna say how can u not wanna stay with Martha ?!
37,1434450569468,0,1,1,0,off-topic,185,129,37,@jackmackenroth: I'm bored so I'm gonna go outside and get a blow job #HurricaneSandy
38,1434450569468,0,0,1,0,off-topic,0,75,38,Yo ref his hand is outta bounds
39,1434450569469,1,0,1,0,on-topic,1,170,39,Stop with this silly snow hoax. We all know this is a global warming hurricane... @slackadjuster @severestudios @reedtimmerTVN
40,1434450569469,0,0,1,0,off-topic,0,122,40,This is what it look like out my window  @ WeedTopia ! =} http://t.co/ca1HBCtc
41,1434450569469,0,0,1,0,off-topic,0,181,41,@Hayleyshammock shopping fun! ;)  it should be like this then start to gradually get worse..but will keep u up2date! @ see what goes on..
42,1434450569469,0,0,1,0,off-topic,0,87,42,I'm debating if I should take you homeeee .
43,1434450569470,1,0,1,0,on-topic,1,124,43,Emily's air mattress is our Noah's Ark. Two of every type (of boxed wine) #sandy
44,1434450569470,0,0,1,0,off-topic,0,100,44,Checking the city here in Brooklyn  http://t.co/ESLzKZm7
45,1434450569470,0,0,1,0,off-topic,0,129,45,Holy shit it must be the end of the world when not even best buy is opening. Day offf
46,1434450569470,0,1,1,0,off-topic,0,88,46,just because you can't, doesn't mean i can't
47,1434450569470,1,1,1,1,on-topic,0,137,47,When the lights in the elevator you're in go out and you're stuck in darkness #hurricanesandy
48,1434450569471,0,0,1,0,off-topic,1,171,48,#SATstudyTime : WOW.. wish my boys found that earlier http://t.co/BmrBPwYv hurry before its unavailable Des Moines Register bwy
49,1434450569507,0,0,1,0,off-topic,36,88,49,@TheFatLadyRaps but you love me... And u ugg
50,1434450569740,0,0,1,0,off-topic,233,122,50,@judyrey Same thing in Queens, I have siding hanging from my house. Where r u?
51,1434450569741,0,0,1,0,off-topic,1,94,51,@OredRocAnn holy shit, your block or the next one?
52,1434450569741,1,0,1,0,on-topic,0,162,52,The Statue of Liberty as seen from near Battery Park. #sandy #hurricanesandy  @ Battery Park City http://t.co/0MZy2IXX
53,1434450569742,0,0,1,0,off-topic,1,179,53,Channel surfing, and relaxing with my green goodies. I wanna go for a walk, but not feeling flying away like #MaryPoppins or some shit.
54,1434450569744,1,1,1,1,on-topic,2,89,54,I wanna go to the beach but I don't wanna die
55,1434450569744,1,1,1,1,on-topic,0,164,55,RT @KatEdorsson: #SANDY &amp; #A-ROD Damn dude... What is this world coming too http://t.co/GZgV9jnM     too funny LOL!!
56,1434450569745,1,1,1,1,on-topic,1,177,56,@nicoledandrea yea, just hoping my windows hold. They're shaking but they're all new so fingers crossed. Hope all is well on your end
57,1434450569745,0,0,1,0,off-topic,0,97,57,Today i had more fun then i have in the longest tim
58,1434450569745,0,1,1,0,off-topic,0,112,58,@CocoCrunchMB Hi P'! Your going to do great today :D Love you! &lt;3
59,1434450569745,1,1,1,1,on-topic,0,124,59,Water levels be rising!!! (@ Long Island City Piers) [pic]: http://t.co/D9VVuCPo
60,1434450569745,1,0,1,0,on-topic,0,133,60,dearest @andre_kamp, i love you. wish you were in the storm with us. http://t.co/f4ehKQQA
61,1434450570114,0,0,1,0,off-topic,369,128,61,Stfup...! Nobody likes your shit anyways....!! ___ likes to talk shit ALOT !   Lmfao
62,1434450570114,1,1,1,1,on-topic,0,180,62,BREAKING: RT @youranonnews: #NYC #Sandy - FDNY on scanner confirmed fuel leak contamination. Drink bottled water. Boiling will not help.
63,1434450570114,0,1,1,0,off-topic,0,113,63,@MikeyDeleasa thank you for posting that! Is it gonna be rescheduled?
64,1434450570115,1,1,1,1,on-topic,1,73,64,My power keep goin in and out
65,1434450570116,0,0,1,0,off-topic,1,68,65,My whole street is BLACK
66,1434450570116,0,1,1,0,off-topic,0,172,66,@shalomshuli Dude...you are CRUSHING on Howard!  I'm listening on demand right now.  Shalom, mother effer!  ~Sal ( from Raw Dog)
67,1434450570116,1,0,1,0,on-topic,0,100,67,@Max_D_tho smokin during a hurricane is hard as hell lol
68,1434450570116,0,1,1,0,off-topic,0,153,68,tonight I'm gonna dance for all that we've been through, but I don't wanna dance if I'm not dancing with you.
69,1434450570117,1,0,1,0,on-topic,1,115,69,Things are bad out there @ West Orange Police Dept http://t.co/elNnbJwG
70,1434450570118,1,0,1,0,on-topic,1,142,70,If only I was stormed in with @Twink_ie &amp; @GiBaby_ My only survival needs. Stay safe, love you
71,1434450570118,0,0,1,0,off-topic,0,101,71,@Wimblaaa what!? Malteses are cute!! http://t.co/bbYpEvBA
72,1434450570118,0,0,1,0,off-topic,0,133,72,Well I was the only sober one at the party at least I won't have a #hangover #suckstosuck
73,1434450570302,0,0,1,0,off-topic,184,88,73,Everyone and their mothers are at home depot
74,1434450570302,0,0,1,0,off-topic,0,78,74,@ant_decicco I wanna check it out!
75,1434450570302,0,0,1,0,off-topic,0,70,75,I'm too nice at FIFA!!!!!!
76,1434450570303,0,0,1,0,off-topic,1,103,76,So much to do..in such short time ; must not be lazy!! AHJA
77,1434450570303,0,0,1,0,off-topic,0,131,77,Sicilia ubd !!! #HaveToAceMySATexam .. ..better get it while u can http://t.co/2OZUsia8
78,1434450570303,1,1,1,1,on-topic,0,114,78,Power's been cut to lower Manhattan and our lights are flickering....!
79,1434450570303,0,0,1,0,off-topic,0,121,79,My mom told me I could have whoever I want sleep over, it's a little late mom
80,1434450570303,1,0,1,0,on-topic,0,120,80,Pre Sandy Calm @ Patsy &amp; Eddie's Boli-Stoli Factory http://t.co/2zE2rPiN
81,1434450570304,1,1,1,1,on-topic,1,173,81,Guys!!!! It's getting really bad out there now!!! Hope everyone  @ Frankenstorm Apocalypse - Hurricane Sandy http://t.co/sRvSO8kj
82,1434450570304,0,0,1,0,off-topic,0,85,82,GIANTS!!! Congratulations. What a season!
83,1434450570304,0,0,1,0,off-topic,0,108,83,I have so much ammo, I'm gunna kill all the babies- @Zaine_O_Mac
84,1434450570304,0,0,1,0,off-topic,0,68,84,@pweetytinu am Gud and u
85,1434450570305,1,0,1,0,on-topic,1,123,85,good bye Astoria #hurricanesandy on the way @ Astoria Park http://t.co/WBqWIqHU
86,1434450570305,0,0,1,0,off-topic,0,102,86,@AbbieBradyD it's not a memo you wanted to be on, trust me
87,1434450570489,0,0,1,0,off-topic,184,154,87,Oh dear Sandy.. #Home #IgnorantShit #LookingLikeIm13 #SuperAsian  @ Somewhere in my world http://t.co/axBvzhzV
88,1434450570489,0,0,1,0,off-topic,0,127,88,@ZMars89 to be honest with you. I don't remember peeing infront of his house ever..
89,1434450570489,0,1,1,0,off-topic,0,84,89,sandy can't stop me from getting my owab
90,1434450570489,0,0,1,0,off-topic,0,97,90,NO WE DO NOT HAVE FUCKING ICE !!!  GO THE FUCK HOME !
91,1434450570489,1,0,1,0,on-topic,0,77,91,Hide yo kids hide yo wives #Sandy
92,1434450570490,0,0,1,0,off-topic,1,119,92,Are you Don Drapers wife?  BOoM #halloween2012 #madmen http://t.co/ioBGXliU
93,1434450570490,1,0,1,0,on-topic,0,131,93,Ok - goodbye New Yorkers. I'm outta here! Good luck with the #frankenstorm and stuff...
94,1434450570490,0,0,1,0,off-topic,0,182,94,#GottaAceMySATexam .. OH LORD: I really wish we found that previously http://t.co/rbnRHSAj ya better get this #TallGirlAppreciationDay pzk
95,1434450570490,1,0,1,0,on-topic,0,65,95,And out goes my power
96,1434450570491,0,0,1,0,off-topic,1,128,96,#RT_ @shakira says: I'm something you'll regret losing, I can promise you that much.
97,1434450570491,0,1,1,0,off-topic,0,129,97,@4SHOCinCity so far good, I'm part of emergency staff, I just happen to have day off!
98,1434450570491,1,1,1,1,on-topic,0,111,98,I dont even care about the power, I just want this storm to be over
99,1434450570677,1,1,1,1,on-topic,186,104,99,Really don't mind this sandy thing unless the power goes out
100,1434450570677,1,0,1,0,on-topic,0,165,100,@stephennyr89 cause I seen people post pictures of flooding &amp; puddles .. Didnt know what was going on out there haha
101,1434450570677,0,0,1,0,off-topic,0,93,101,Tree Trimming in Nee Jersey http://t.co/SnvLYuLp
102,1434450570678,0,0,1,0,off-topic,1,125,102,I honestly hate the Volkswagen commercial with the dude singing in the black car
103,1434450570678,1,1,1,1,on-topic,0,132,103,Oh my god there's an emergency alert in my area I'm fucking scared http://t.co/h5ZoNDkG
104,1434450570678,1,0,1,0,on-topic,0,183,104,@jacquelinetweet we just happen to be surrounding a tray of vodka Kelly right now while sheltering in our building haha #hurricanefestival
105,1434450570679,0,0,1,0,off-topic,1,86,105,I want 1st marking period to end already!
106,1434450570679,0,0,1,0,off-topic,0,87,106,@s_mehalick: Why won't my friends text me?
107,1434450570679,0,1,1,0,off-topic,0,157,107,This guy Skelton had the job in week 1. Got hurt. Kolb leads them to 4-2 n skelton comes is and is just HORRIFIC
108,1434450570679,1,1,1,1,on-topic,0,120,108,@SwagisLethal But around 6-8pm with the high tide we will have bad flooding
109,1434450570680,1,1,1,1,on-topic,1,93,109,@Prarthana_xo I have electricity come over later
110,1434450570680,0,0,1,0,off-topic,0,102,110,I feel like If we Fall apart You Wouldn't Care. &lt;\3 :(
111,1434450570863,0,0,1,0,off-topic,183,78,111,@JAZMINrazzles My Soul To Take (:
112,1434450570864,0,0,1,0,off-topic,1,99,112,Its sad, when you can't trust someone you involve with
113,1434450570864,0,1,1,0,off-topic,0,112,113,I'm tighter than a virgin right now since i can't text &lt;&lt;&lt;
114,1434450570864,0,0,1,0,off-topic,0,66,114,Baby all I need is on
115,1434450570865,1,0,1,0,on-topic,1,184,115,Can't believe one of the twitter accounts for the hurricane is actually tweeting/promoting4Obama. Be funny bout the storm not talk politics
116,1434450570865,0,0,1,0,off-topic,0,98,116,@XO_kimx3: #ToMyFutureDaughter you will play softball
117,1434450570865,0,0,1,0,off-topic,0,85,117,@SBedard23 sounds great love you guys !!
118,1434450570865,0,0,1,0,off-topic,0,114,118,Teaching your little siblings how to actually be a decent human bieng
119,1434450570866,0,0,1,0,off-topic,1,104,119,@ufouria_ I don't even like candy so I don't know man lmfao
120,1434450570866,0,0,1,0,off-topic,0,113,120,Why does my twitter randomly favorite other people tweets #sorryguys
121,1434450570866,0,0,1,0,off-topic,0,123,121,@Vikeologist we're a cbs owned and operated station. NY needed crews, we came!
122,1434450570866,0,0,1,0,off-topic,0,90,122,He ain't nothing like the boy I used to know.
123,1434450570867,0,0,1,0,off-topic,1,134,123,My first step in MY :) (@ New York Penn Station w/ 79 others) [pic]: http://t.co/X3ZqCD9p
124,1434450571052,0,1,1,0,off-topic,185,135,124,@Nikki_217 @_wonderrwoman flounder is just a buzz kill, Arial cannot be tamed. #fucksafety
125,1434450571052,0,0,1,0,off-topic,0,145,125,!!!!!!!@XSTROLOGY: #Aries cannot stand stagnant relationships. If shit gets boring they will wander.
126,1434450571052,1,1,1,1,on-topic,0,120,126,@Jikankun @ManaPuddingFox no power in town. both doing fine. driving sucks.
127,1434450571053,0,1,1,0,off-topic,1,86,127,They can just throw me a couple hundred .
128,1434450571053,1,1,1,1,on-topic,0,140,128,Lots of people out in #BayRidge #Brooklyn checking out the storm damage. #sandy #sandyaftermath
129,1434450571053,0,0,1,0,off-topic,0,85,129,about to beg my mom to let me throw down
130,1434450571053,1,1,1,1,on-topic,0,161,130,No power, out driving the jeep and charging my phone. Trees down, Does not look like are getting power anytime soon.
131,1434450571053,0,0,1,0,off-topic,0,125,131,First day of #nnguw started with Mobile Websites and Apps today. So far so good!
132,1434450571054,1,0,1,0,on-topic,1,108,132,The hurricane updates are most interesting than the Jets games.
133,1434450571054,0,0,1,0,off-topic,0,76,133,@mikesvehla come to bayonne son
134,1434450571054,0,0,1,0,off-topic,0,185,134,Marcus Lattimore man prayers up for u man keep fighting South Carolina #21 shyt was terrifying espi ally if you are a football playerlike me
135,1434450571054,1,0,1,0,on-topic,0,155,135,I should of went to a hurricane sandy party..I'm so bored I'm tweeetin my biscuits off over here #bored #awake
136,1434450571239,0,0,1,0,off-topic,185,111,136,@HenryEdmondson the big bear was on pix11 news and got interviewed
137,1434450571239,1,1,1,1,on-topic,0,163,137,No power, no problem! #blackout #sandy #eastvillagenyc #newyork #hurricanecowboys  @ East Village http://t.co/84LtDMIZ
138,1434450571240,0,0,1,0,off-topic,1,135,138,@bree_cass this is from rob bc he doesn't have a smartphone at my house: coookkkieeeeeee!!
139,1434450571240,1,1,1,1,on-topic,0,88,139,@toodopekay_ yea lets hope it pass us quick
140,1434450571240,0,0,1,0,off-topic,0,116,140,@sirenasmaster well we shall see lol...i aint worried i leave it to God
141,1434450571240,0,0,1,0,off-topic,0,81,141,Watching tv nd Textin my best friend
142,1434450571241,1,1,1,1,on-topic,1,112,142,@Valerie_Mia how is it by you Valerie? It's really windy over here.
143,1434450571241,0,0,1,0,off-topic,0,99,143,The lady on channel 4 news looks like @jekkkkax3 s mom
144,1434450571241,0,0,1,0,off-topic,0,132,144,Hi Cav vmt WOW.. #HaveToAceMySATexam : ..better get it while u can http://t.co/nN4neU1z
145,1434450571242,0,0,1,0,off-topic,1,140,145,In love with my bed except for the fact that every move you make something squeaks #thestruggle
146,1434450571242,0,0,1,0,off-topic,0,88,146,@Fxq_Ya_Feelins u good nobody gon see lmfao
147,1434450571243,0,0,1,0,off-topic,1,90,147,No normal people leave the airport this early
148,1434450571244,1,0,1,0,on-topic,1,72,148,Hurricane sandy can suck it
149,1434450571427,1,0,1,0,on-topic,183,130,149,Frankenstorm? More like zombie apocalypse. (at Manhattan) [pic]  http://t.co/kyzTKAog
150,1434450571427,0,0,1,0,off-topic,0,129,150,Promise that you'll sing about me 4eva, promise that you'll sing about me 4...ooOooo
151,1434450571427,0,0,1,0,off-topic,0,85,151,@nathanandy lol no trauma to little man!
152,1434450571428,0,1,1,0,off-topic,1,124,152,@steffffuhhknee omg I was just talking about that game. I fucking love it! Lmao
153,1434450571428,1,0,1,0,on-topic,0,148,153,West side highway downtown is a swimming pool @FrankBeach_  @ Riverside Park North http://t.co/F7uL15nX
154,1434450571428,0,0,1,0,off-topic,0,92,154,woke up in the worst pain in my knee #IHateRain
155,1434450571428,1,1,1,1,on-topic,0,141,155,Moving Target! (@ Frankenstorm Apocalypse - Hurricane Sandy w/ 1057 others) http://t.co/ap6Pdf6X
156,1434450571428,0,0,1,0,off-topic,0,120,156,I hope I'm able to make good friends when I move to Florida in two years :)
157,1434450571429,1,0,1,0,on-topic,1,107,157,Wind Advisory issued for Union Center, NJ http://t.co/elByuKlj
158,1434450571429,1,0,1,0,on-topic,0,101,158,@Robyouells hey brotha, how u dealing with this weather?
159,1434450571429,0,0,1,0,off-topic,0,108,159,I'm at Mile End (Brooklyn, NY) w/ 4 others http://t.co/6XNIh6j3
160,1434450571429,0,0,1,0,off-topic,0,131,160,@dominiloka YES to football but pending on ur tv u might lose the satelite n all that.
161,1434450571614,0,0,1,0,off-topic,185,176,161,@SandraMcGarrell I love you all deeply but until you can offer me a Jamba Juice, Whole Foods and Bud Light Lime, I'm staying put. X
162,1434450571614,0,1,1,0,off-topic,0,71,162,Got my loud, now I'm ready
163,1434450571614,0,0,1,0,off-topic,0,75,163,@jvssica get the 5 on sprint..
164,1434450571614,1,0,1,0,on-topic,0,177,164,@jessicadelfino: Any chance #Mitt #Romney made this hurricane? #Sandy Our fault bc we depend on govt subways, roads and FEMA. Right?
165,1434450571615,1,0,1,0,on-topic,1,130,165,What if the power goes out and I'm left with raw cupcakes? That would just be fucked.
166,1434450571615,0,1,1,0,off-topic,0,183,166,Hehe @cha_patti: @aruna_dawn Can't wait to see your mummy on ITV tonight! Hope all's well.... Lots of chapatti love coming your way xxxxxx
167,1434450571615,1,0,1,0,on-topic,0,168,167,Hide your children, hide your wives! (@ Frankenstorm Apocalypse- Hurricane Sandy w/ @beer4molly @y_vo) http://t.co/cwZpTNB7
168,1434450571615,1,1,1,1,on-topic,0,126,168,omg a huge tree just fell in my backyard so close to my house. this is too scary!
169,1434450571615,0,0,1,0,off-topic,0,140,169,Love these bitches @jgords nichole_durant brooke_nicholeee92  @ Bamboo Bar http://t.co/so8RUPvA
170,1434450571615,1,0,1,0,on-topic,0,130,170,I'm at Frankenstorm Apocalypse - Hurricane Sandy w/ @sarahjgiann http://t.co/lrH0HeaJ
171,1434450571616,1,1,1,1,on-topic,1,83,171,Water has officially entered my house.
172,1434450571803,0,1,1,0,off-topic,187,129,172,LMFAOO  @BollyWoodsOwn: If you text me right now prepare for a long ass conversation
173,1434450571804,0,0,1,0,off-topic,1,92,173,A fuck nigga that's ; that shit I don't like !!
174,1434450571805,1,1,1,1,on-topic,1,108,174,Why ppl crying and taking sandy serious? She's just a squirrel.
175,1434450571807,0,0,1,0,off-topic,2,92,175,Put me as your screen saver so I know it's real
176,1434450571810,1,1,1,1,on-topic,3,113,176,Storm is supposed to die down around midnight. 3 more hours of hell.
177,1434450571811,0,0,1,0,off-topic,1,141,177,@Exotic_Asian_: Im really bored in bedddddd. Ahhhhhh I keep changing positions every 5 mins lmao
178,1434450571812,0,0,1,0,off-topic,1,123,178,: Video Of ConEd Station On FDR And 14th Street Exploding http://t.co/nhU1igZx
179,1434450571812,0,0,1,0,off-topic,0,137,179,@PrincessReb_: Jaime missed me texting him ugh me too . &amp; if wifi goes I'm done for lmao
180,1434450571812,0,0,1,0,off-topic,0,84,180,@POInT_at_ASH thanks girl I'm home safe
181,1434450571813,0,0,1,0,off-topic,1,78,181,@kritzkolesa coolest fork in town
182,1434450571813,0,0,1,0,off-topic,0,82,182,out to cnr, wish me luck lmao  i wish
183,1434450571813,0,0,1,0,off-topic,0,94,183,I need some classic #Halloween movies in my life.
184,1434450571814,0,0,1,0,off-topic,1,100,184,I'm at NBCUniversal (New York, NY) http://t.co/LLvUhyrJ
185,1434450571816,0,1,1,0,off-topic,2,83,185,Just gunna walk everywhere for now on.
186,1434450571989,0,0,1,0,off-topic,173,174,186,MBFW S2013 FLASHBACK: BEAUTIFUL SILHOUETTES @reemacra!! This i @ Reem Acra Show @ Mercedes-Benz Fashion Week http://t.co/jvCcJMVV
187,1434450571990,0,0,1,0,off-topic,1,82,187,When she says my name she's mad at me
188,1434450571990,1,0,1,0,on-topic,0,171,188,Keep hearing a crazy grinding and lights keep flickering but thankfully we're still lit up here in Bayonne! #Sandy #sandyn12nj
189,1434450571991,0,0,1,0,off-topic,1,176,189,#SATstudyTime .. GOODNESS I really wish my cousin had got that previously http://t.co/vXLm9pTW ya better get this #donttextmeif ckf
190,1434450571991,0,1,1,0,off-topic,0,108,190,@richard1826 I'm so mad!! It was just his fingertips out! Ughhh
191,1434450571992,1,0,1,0,on-topic,1,85,191,Who wants to o looting when sandy hits?!
192,1434450571993,0,0,1,0,off-topic,1,98,192,Omg  @ Consolidated Edison of NY http://t.co/tQ9MSSBa
193,1434450571993,0,0,1,0,off-topic,0,127,193,IPHONES ARE OFFICIAL!! STAY FOCUS!!  @ Mott Haven (Bronx, NY) http://t.co/lK2ISQ28
194,1434450571994,0,0,1,0,off-topic,1,71,194,i wanna go to the park lol
195,1434450571994,0,0,1,0,off-topic,0,99,195,@iArrestNoCuffs mad ya man pays no mind during da game
196,1434450571995,1,0,1,0,on-topic,1,120,196,@capitalV @macnrg The CALM before the storm...is over! http://t.co/L6NVT8BM
197,1434450571996,1,1,1,1,on-topic,1,181,197,@James_Yammouni   good morning! Please pray for your USA east coast fans like me because a horrible hurricane is hitting us very soon 10
198,1434450572030,0,0,1,0,off-topic,34,90,198,Class canceled Monday &amp; Tuesday.. Perfect
199,1434450572030,0,0,1,0,off-topic,0,100,199,&amp; if I don't I'm paying someone to come out with me
200,1434450572031,0,1,1,0,off-topic,1,135,200,I'm so bored since i have no TV right now that I've heard all the songs on my phone #4,539
201,1434450572218,1,1,1,1,on-topic,187,105,201,@Heady_Mo Rd better be safe that shit gonna hit tomorrow lol
202,1434450572218,0,0,1,0,off-topic,0,159,202,@Automotive: Lamborghini Aventador http://t.co/jlnGZPoC because my next boyfriend will drive this! @lorrainepesola
203,1434450572219,0,0,1,0,off-topic,1,130,203,new york from the Statue of Liberty (crown) http://t.co/62VX2L2B http://t.co/eixNarep
204,1434450572219,1,0,1,0,on-topic,0,94,204,these hurricane sandy tweets are so hilarious tho
205,1434450572219,0,0,1,0,off-topic,0,124,205,@_MonyMaknMitch: Think I'm a use this time off to get back n the gym u need too
206,1434450572219,0,0,1,0,off-topic,0,84,206,trees n wine. #hurricanesupplies #sandy
207,1434450572220,0,0,1,0,off-topic,1,99,207,@PatriArt: The Days of Our Lies #ObamaSoapOperas  nice
208,1434450572220,0,1,1,0,off-topic,0,96,208,Maybe now you ignoramus might appreciate school 3-/
209,1434450572220,1,1,1,1,on-topic,0,189,209,There's a lot of good cops,volunteers, and emergency responders out there risking it all.. Thanks &amp; my thoughts are with you #hurricanesandy
210,1434450572220,0,0,1,0,off-topic,0,99,210,My dream of having a fat guinea pig has been fulfilled
211,1434450572221,0,0,1,0,off-topic,1,130,211,-' LmaO !!!! *grabs sneakers*  @BtwImPretty_: @JahTeflon_ lets get his ass out da pic
212,1434450572221,1,0,1,0,on-topic,0,167,212,Thank god not every place was affected by the storm! (@ Uncle Louie G's Italian Ices &amp; Ice Cream) http://t.co/NWqRvNip
213,1434450572412,1,0,1,0,on-topic,191,126,213,I'm at Frankenstorm Apocalypse - Hurricane Sandy w/ @megtowe http://t.co/p56xmALz
214,1434450572413,1,0,1,0,on-topic,1,127,214,Riding out Sandy @ my in-laws in Leonardo, NJ. My town of Keansburg, NJ is a lake!
215,1434450572414,1,1,1,1,on-topic,1,181,215,lol @ my aunt saying she's not evacuating because a certain family by her house will be just waiting to steal everybody's shit #realtalk
