2111,1434448351008,0,0,1,0,off-topic,1,79,3433,@itsJACKIEbitchz me too, oh yeah!
2112,1434448351009,1,0,1,0,on-topic,1,128,3434,Oh geez. Seriously, horrible timing to be on the east coast. Really? #Frankenstorm
2113,1434448351496,1,0,1,0,on-topic,487,166,3435,The Wonder Wheel. Coney Island is still without power. #sandy  @ Coney Island Beach &amp; Boardwalk http://t.co/eFyklDR1
2114,1434448351497,0,0,1,0,off-topic,1,117,3436,@ntmar5161 I have him in yahoo. Wanted him in ESPN to but u snagged him
2115,1434448351497,0,0,1,0,off-topic,0,143,3437,Wish I could meet her, but still cool to be down the street (@ Jwowws House) http://t.co/1Rcfy0fL
2116,1434448351497,0,1,1,0,off-topic,0,81,3438,The car ride there is going to suck
2117,1434448351498,0,0,1,0,off-topic,1,185,3439,@RealJayWilliams Happy Bday Mama Williams :-) from 1 Williams to another. my sister @RebeccaPlfdNJ  is a councilwoman closeby in Plainfield
2118,1434448351498,1,0,1,0,on-topic,0,104,3440,Dey dne found two sharks so far smh yupp its real out here
2119,1434448351499,0,0,1,0,off-topic,1,94,3441,Fake blondes make real blondes seem way smarter!
2120,1434448351500,0,0,1,0,off-topic,1,117,3442,@jeanette_d lucky still waiting for power in Teaneck. Hope you are too!
2121,1434448351501,0,0,1,0,off-topic,1,85,3443,#NW jersey shore* starts fist pumping *
2122,1434448351501,0,0,1,0,off-topic,0,72,3444,God I love my friends lmao
2123,1434448351502,0,0,1,0,off-topic,1,112,3445,chef ally @allyfusco  @ 241 Central Park West http://t.co/x6yWSmnL
2124,1434448351503,0,0,1,0,off-topic,1,79,3446,No one leave their house past 6 !
2125,1434448351504,0,1,1,0,off-topic,1,156,3447,Anyone that is home in the neck and wants to get fucked up and have a sleepover for the storm come over now ;)
2126,1434448351504,0,0,1,0,off-topic,0,107,3448,#old #man #me #halloween  @ The Arnold's http://t.co/o7ESlppK
2127,1434448351505,0,0,1,0,off-topic,1,124,3449,I really don't think a simple phone call is to much to ask for #GuessIWasWrong
2128,1434448351506,0,0,1,0,off-topic,1,143,3450,While I be bangin on yo body , they be bangin on out wall , while they dreamin , you be screamin.
2129,1434448351506,0,1,1,0,off-topic,0,84,3451,@kocface your gonna save people.......
2130,1434448351508,1,0,1,0,on-topic,2,100,3452,Floods and power outages , hurricane sandy is mad real
2131,1434448351509,0,1,1,0,off-topic,1,104,3453,this is just sad @ Mantoloking Bridge http://t.co/8GxifcKf
2132,1434448351510,0,0,1,0,off-topic,1,95,3454,@lukebenward will never notice me and it kills me
2133,1434448351511,1,1,1,1,on-topic,1,155,3455,My building was just featured on the @CBSnews on #Sandy. Thank God I got out of there!!! http://t.co/NqMZJfxC
2134,1434448351511,1,0,1,0,on-topic,0,174,3456,Hoping and praying I can get outta here before the storm hits or else I'm gonna be stuck in jersey till Thursday #hurricanesandy
2135,1434448351512,0,1,1,0,off-topic,1,87,3457,Landry's becoming one of my favorite Jets
2136,1434448351513,0,0,1,0,off-topic,1,66,3458,Why am I up though ?
2137,1434448351514,1,0,1,0,on-topic,1,101,3459,The damage caused in the subway system is mind blowing.
2138,1434448351684,1,0,1,0,on-topic,170,131,3460,Idk how people think that seaside being destroyed is a good thing #horrible #notfunny
2139,1434448351685,0,0,1,0,off-topic,1,175,3461,-0+PLUS MEDIA PROMO NY CRAZY PICTURE! #zeroplusmedia #music #mixtape #murdaave #mel @ Mott Haven (Bronx, NY) http://t.co/qgYmgQ2y
2140,1434448351685,0,1,1,0,off-topic,0,80,3462,Wish I was at my moms right now :/
2141,1434448351686,1,0,1,0,on-topic,1,143,3463,Tree falls into my house and does some damage to the house? but we still have electricity. Holla.
2142,1434448351686,0,0,1,0,off-topic,0,138,3464,Asked her how are the patties from this store and she bust out laughing http://t.co/7XY4X4WZ
2143,1434448351687,1,0,1,0,on-topic,1,130,3465,A #crane dangles in #manhattan #sandy #stormwsj @ Carnegie Deli http://t.co/EAC7mKTf
2144,1434448351687,0,0,1,0,off-topic,0,90,3466,@iluvny3000 DUDE IDK DOWN POWER LINES MAYBE?
2145,1434448351688,1,0,1,0,on-topic,1,142,3467,@daronjonesmusic aww thanx a million I hope and pray your family is safe in this Hurricane Sandy
2146,1434448351688,1,0,1,0,on-topic,0,144,3468,How about after all the power lines are blown down again - we put the new ones underground? #sandy
2147,1434448351689,0,1,1,0,off-topic,1,121,3469,Brianna is so depressed that she just started playing Bleeding Love...u ok?
2148,1434448351689,0,0,1,0,off-topic,0,109,3470,Lmfao At Solo Giving Donald Trump a Seat!! He Tried It Though!!
2149,1434448351690,0,0,1,0,off-topic,1,107,3471,#ToMyFutureSon you WILL be a Giants, Knicks, and Yankees fan.
2150,1434448351691,0,0,1,0,off-topic,1,108,3727,@danaanicolee I got blonde dye come over  we can ombr our hair
2151,1434448351691,1,0,1,0,on-topic,0,98,3728,Tree down on Clinton Ave #Sandy http://t.co/JsRe0BbW
2152,1434448351692,0,0,1,0,off-topic,1,125,3729,Halloween Flashback!  @ Harrah's Resort Hotel &amp; Casino http://t.co/Gdure7w6
2153,1434448351693,0,0,1,0,off-topic,1,80,3730,If i had a choice it would be you!
2154,1434448351694,1,0,1,0,on-topic,1,177,3731,Hungry on this stormy evening in #astoria? Come to #mezzeplace for some Shakshuka.  #sandy won't bring us down http://t.co/VHIsXTZ7
2155,1434448351694,1,0,1,0,on-topic,0,95,3732,Going down the shore to check out maaa girl sandy
2156,1434448351695,1,0,1,0,on-topic,1,157,3733,Wow. Really a river! | RT @BuzzFeed: Crazy video of flooding on Avenue C, via @nowthisnews http://t.co/qUOk8lFa
2157,1434448351696,0,0,1,0,off-topic,1,81,3734,Watchin' a 3D Movie  w. The Family.
2158,1434448351697,0,0,1,0,off-topic,1,79,3735,Best night ever doe shit was live
2159,1434448351697,1,1,1,1,on-topic,0,124,3736,My cousin might just be the smartest person bet... he is storm chasing in city
2160,1434448351698,0,0,1,0,off-topic,1,69,3737,Bouta blow up her phone
2161,1434448351699,0,0,1,0,off-topic,1,78,3738,Bras that clip on the front omfg
2162,1434448351700,1,0,1,0,on-topic,1,160,3739,@mbaratz They were also out at the A&amp;P in Jersey City. Who knew #bananas were such a hot disaster food? #Sandy
2163,1434448351700,0,0,1,0,off-topic,0,104,3740,I'm at Stelton Lanes (Piscataway, NJ) http://t.co/8Yz1XzKh
2164,1434448351701,0,0,1,0,off-topic,1,108,3741,Got to take a walk down FDR.  @ FDR Drive http://t.co/Ngllc9IZ
2165,1434448351702,0,0,1,0,off-topic,1,123,3742,I'm at Newport Centre Mall (Jersey City, NJ) w/ 6 others http://t.co/Z4Hcnq4q
2166,1434448351702,1,0,1,0,on-topic,0,75,3743,@billyboulia are you guys ok?
2167,1434448351703,0,1,1,0,off-topic,1,85,3744,TURN MY POWER BACK ON!!!!!!! NOW!!!!!!!
2168,1434448351704,1,0,1,0,on-topic,1,118,3745,I hope the flooding in your area isn't too  bad. We will back Wednesday.
2169,1434448351705,0,0,1,0,off-topic,1,106,3746,shout out to my #NF @sassypantsbeana make sure to follow her
2170,1434448351706,0,0,1,0,off-topic,1,94,3747,@shaeconnor lol we are not in an evacuation zone
2171,1434448351707,0,0,1,0,off-topic,1,80,3748,Bring it on Sandy we gucc out chea
2172,1434448351708,1,0,1,0,on-topic,1,131,3749,I'm at Frankenstorm Apocalypse - Hurricane Sandy w/ @cherryred23 http://t.co/4fWbA8Qi
2173,1434448351708,1,0,1,0,on-topic,0,145,3750,I'm at Frankenstorm Apocalypse - Hurricane Sandy (New York, NY) w/ 1034 others http://t.co/ue9ym3Ku
2174,1434448351709,1,0,1,0,on-topic,1,105,3751,Flood Watch issued for Perth Amboy, NJ http://t.co/lWmSJv4d
2175,1434448351709,0,1,1,0,off-topic,0,157,3752,Drinks with leopards. Yes it's gone there. #sandy (@ Eventi - A Kimpton Hotel w/ 3 others) http://t.co/qKajmSNF
2176,1434448351878,0,0,1,0,off-topic,169,117,3753,@m_verdesco hahah best believe the naked pallet is number one on mine(;
2177,1434448351879,0,1,1,0,off-topic,1,111,3754,@mackenzieehuber ya just did cause #GooseNation doesn't lose ever
2178,1434448351880,1,0,1,0,on-topic,1,107,3755,Bring it on Sandy @ East River Promenade http://t.co/0x6AqTxg
2179,1434448351882,0,0,1,0,off-topic,2,93,3756,Mite Be Mix Match , But Everything Designer ...
2180,1434448351884,0,0,1,0,off-topic,2,91,3757,I wanna give you what's better than better ..
2181,1434448351885,0,1,1,0,off-topic,1,89,3758,Don't give up just because things are hard.
2182,1434448351887,0,0,1,0,off-topic,2,121,3759,@AmandaDematteo OMG I have to tell you something! Text me when you get up!!
2183,1434448351889,0,0,1,0,off-topic,2,156,3760,@lalalexieeex3: Whenever I watch a scary movie I cover my face half the time lmao #scared i cover my ears lmao
2184,1434448351890,0,0,1,0,off-topic,1,112,3761,Having all my college applications in &gt;&gt;&gt;&gt;&gt;&gt;&gt;
2185,1434448351891,0,0,1,0,off-topic,1,117,3762,Good thing I have an iPod &amp; phone &amp; both are charged  # winning
2186,1434448351892,1,0,1,0,on-topic,1,123,3763,#FDNY removing 9 #ConEd workers by boat from unspecified location #sandy #nyc
2187,1434448351893,0,0,1,0,off-topic,1,123,3764,Jus holdin my son close , there wouldnt b anywhere else i would b wid out him
2188,1434448351895,0,0,1,0,off-topic,2,137,3765,SWEET! LOL! RT @finslippy: We're off to pretend to sleep. Tomorrow's a full day of looting!
2189,1434448351896,0,1,1,0,off-topic,1,138,3766,Why wen ny get mad they gatta start hittin and getting penalties? Jus like a new yorker. smh
2190,1434448351896,0,0,1,0,off-topic,0,154,3767,I think I'm a pretty cool person, if you don't like me. Speak up . Don't talk shit about me when I walk past
2191,1434448351898,0,0,1,0,off-topic,2,74,3768,Its finna get real out there
2192,1434448351902,0,0,1,0,off-topic,4,140,3769,Saw the cat in the hat today Washington n park pl @ Half Court Sports Bar http://t.co/YQpLWl4R
2193,1434448351904,0,1,1,0,off-topic,2,104,3770,i was just sitting there looking with my eyes open. -darin
2194,1434448351907,0,0,1,0,off-topic,3,102,3771,Nigga I'm ballin I'm over charging my phone cuz I can...
2195,1434448351908,0,0,1,0,off-topic,1,143,3772,#Top10FavoriteSongs buj WOW.. #StudyingForTheSAT : thanks Jesus I found that http://t.co/1oOtejIo
2196,1434448351909,0,0,1,0,off-topic,1,87,3773,Wine and Atlantis themed monopoly  #sandy
2197,1434448351912,0,0,1,0,off-topic,3,142,3774,#westside exploring. #hudsonriver #manhattan  @ Pier 57 @ Hudson River Park http://t.co/jmdpgR0a
2198,1434448351913,0,1,1,0,off-topic,1,172,3775,ESPN Friday Night Fights in 2012 has lowest ratings since inception at 409k avg. http://t.co/6ysTW1Qo @KMBReferee #justnumbers
2199,1434448351913,0,0,1,0,off-topic,0,76,3776,What is wrong with Cruz today?
2200,1434448351916,0,0,1,0,off-topic,3,81,3777,People who can dance salsa &gt;&gt;
2201,1434448351918,0,1,1,0,off-topic,2,167,3778,Just got off the fone with my baby , :* aww he called me in the a.m how cute him and his sexy sleepy voice ;* @LuisJz_x12
2202,1434448351918,0,0,1,0,off-topic,0,88,3779,@alexa_barreto thank you, how is it by you
2203,1434448351919,0,0,1,0,off-topic,1,139,3780,Open for business. Try the Napoleon! #sandy  @ The Hungarian Pastry Shop http://t.co/N6muGUNn
2204,1434448351920,1,0,1,0,on-topic,1,108,3781,All you retards know the hurricane starts tomorrow night right
2205,1434448351921,1,0,1,0,on-topic,1,120,3782,I need groceries... not because of the storm... Just legit need groceries.
2206,1434448351922,0,0,1,0,off-topic,1,100,3783,Giants better score more points. Don't sit on the lead
2207,1434448351923,0,0,1,0,off-topic,1,72,3784,I hope aaron okay , #icare
2208,1434448351925,0,1,1,0,off-topic,2,126,3785,Zone A kbm #OMG #StudyingForTheSAT .. you better get it now http://t.co/KiPUmQsZ
2209,1434448351926,0,1,1,0,off-topic,1,165,3786,#GottaAceMySATexam : OMG I really wish our girl had found this previously http://t.co/DV0X2rTJ you better get it now...
2210,1434448351926,0,0,1,0,off-topic,0,87,3787,Bout to go traipse the town this morning!
2211,1434448351927,0,1,1,0,off-topic,1,149,3788,iThought you changed for a second but you just proved that you're the same. Exes are exes for a reason*
2212,1434448351928,0,1,1,0,off-topic,1,168,3789,@scaackler just a little breezy, light rain this afternoon then nothing...it would be fantastic if it went somewhere else!
2213,1434448352066,0,0,1,0,off-topic,138,77,3790,Brian and I are missing @epco18
2214,1434448352068,0,0,1,0,off-topic,2,83,3791,My stomaach's acting little fishy tho
2215,1434448352070,0,1,1,0,off-topic,2,139,3792,OMG... I swear I think I just fell in love.. I just walked passed Wonder Woman... :-P  ~Gio~~
2216,1434448352071,0,0,1,0,off-topic,1,88,3793,@_bubblesxD definitely. I think we all are
2217,1434448352074,0,0,1,0,off-topic,3,102,3794,@bluedisco Haha, that mean you need to dance more often.
2218,1434448352076,0,0,1,0,off-topic,2,96,3795,I actually miss him but I disappear on him to much
2219,1434448352078,1,0,1,0,on-topic,2,83,3796,@sadebedatruth you be safe out there.
2220,1434448352082,0,1,1,0,off-topic,4,180,3797,On my way back home!!! Going to miss N.Y. &amp; @JMcKinleyNYC but I will be back as always!!! #TeamAnthonyRyan #TeamJoshua #PRAllStars
2221,1434448352085,0,0,1,0,off-topic,3,83,3798,A srs deal when i misplace my lighter
2222,1434448352091,1,0,1,0,on-topic,6,124,3799,Day after Sandy in Manhattan. From 57th street @nytmetro  http://t.co/9cPtmTBL
2223,1434448352094,0,0,1,0,off-topic,3,175,3800,@dcoptimist that was the play of the year for PIT D, you better believe you gotta take that shot at a QB when you get the chance.
2224,1434448352095,1,0,1,0,on-topic,1,110,3801,@sillyjillyy_ I made it back alive!  Just with very knotty hair!
2225,1434448352098,0,0,1,0,off-topic,3,122,3802,@rachfitzpatrick Im good Rach..thx for asking! Hope ur good out ur way too!!
2226,1434448352101,1,1,1,1,on-topic,3,113,3803,Bay Street is flooded and mobile ave has no power... I just any win
2227,1434448352104,0,1,1,0,off-topic,3,170,3804,I'm still in NY til Thursday and I am getting cabin fever. Anyone doing anything for halloween? @slagii @MissJtotheK anyone?
2228,1434448352106,0,1,1,0,off-topic,2,84,3805,Soon I'm in a room full of pocahontas'
2229,1434448352115,0,0,1,0,off-topic,9,109,3806,Watching a documentary about witches. What has my life come to?
2230,1434448352117,0,0,1,0,off-topic,2,71,3807,I hear the Sirens outside
2231,1434448352119,1,1,1,1,on-topic,2,109,3808,No power+ 6 o'clock curfew= me and @dee_freshest getting drunky
2232,1434448352121,1,0,1,0,on-topic,2,176,3809,Bad news: I seem to have a headache unless I'm outdoors. Worse news: Looks like I'll be spending the next four days inside. #Sandy
2233,1434448352122,0,0,1,0,off-topic,1,99,3810,@stephanyy__x I know I feel so bad :( such a same ugh
2234,1434448352124,0,0,1,0,off-topic,2,184,3811,@kokupuff: @tynie626 @chansonthegreat @lfresh alright folks--i can sleep peacefully knowing that much same here check in from time to time
2235,1434448352124,0,0,1,0,off-topic,0,68,3812,My mom is freaking out
2236,1434448352127,0,1,1,0,off-topic,3,158,3813,In church streaming #ustream #disciplesofCrist #sunday  @ Second Disciples of Christ Church http://t.co/PArKa7lq
2237,1434448352127,0,1,1,0,off-topic,0,106,3814,@niallgiggins was a bit looterish at first but seems ok now.
2238,1434448352129,0,0,1,0,off-topic,2,99,3815,#ToMyFutureDaugther you will be the next jennny finch
2239,1434448352130,0,0,1,0,off-topic,1,97,3816,@inoahpop @ya_boi_chrispat word, best. Handle that.
2240,1434448352131,0,1,1,0,off-topic,1,98,3817,@StayTrueTo_You I was going to call back . &gt;_&lt;
2241,1434448352132,1,0,1,0,on-topic,1,185,3818,@Debra_Anastasia I'm glad you are all ok!  We lost our power and my son is driving me crazy! That is worse than the power outage. Omg stop!
2242,1434448352133,0,0,1,0,off-topic,1,108,3819,That's my night planned!  @ Epstein's Bar http://t.co/O5yxOBj1
2243,1434448352134,0,0,1,0,off-topic,1,94,3820,The vow is one of my favorite movies its so cute
2244,1434448352135,0,0,1,0,off-topic,1,132,3821,@DonaldAllen23 if ya need somewhere to go yah can come to my crib.. We still got power
2245,1434448352136,0,1,1,0,off-topic,1,144,3822,Marilyn finally getting a drink or two in after the new little Nina.  @ Geido http://t.co/QlysbfKW
2246,1434448352136,1,0,1,0,on-topic,0,107,3823,@josephcampagna I may be making an appearance #hurricanesandy
2247,1434448352137,0,0,1,0,off-topic,1,92,3824,No i dont kno O Boy; but i kno he a broke boy!
2248,1434448352139,0,0,1,0,off-topic,2,90,3825,Ever seen 1 of ya dogs transform to a snake?
2249,1434448352140,0,1,1,0,off-topic,1,154,3826,@n0velli03 Lmfao I know just thought I'd cut the tendon in that tweet lmao. &amp;  My fingers are too soft!!
2250,1434448352141,0,0,1,0,off-topic,1,159,3827,@reggiewatts at The Drink, fueled by secret elixirs and potions. cc @thedrinkbk  @ The Drink http://t.co/MtKD7rBV
2251,1434448352141,0,0,1,0,off-topic,0,139,3828,Monkey knows how to make a bf proud!!!  Such a great job!!! @ Harlem, NY http://t.co/gMlswMfy
2252,1434448352142,0,0,1,0,off-topic,1,73,3829,I'm crying this is so funny
2253,1434448352143,0,0,1,0,off-topic,1,87,3830,RT @Josshuwa: Bad bitch and her cha cha's
2254,1434448352144,0,0,1,0,off-topic,1,125,3831,I know so many people in midland beach that's so scary I hope everybody is okay
2255,1434448352145,1,0,1,0,on-topic,1,145,3832,I'm at Frankenstorm Apocalypse - Hurricane Sandy (New York, NY) w/ 2547 others http://t.co/Ls5BMhjQ
2256,1434448352146,0,0,1,0,off-topic,1,133,3833,I'm at Our Lady Star Of The Sea Church (Atlantic City, New Jersey) http://t.co/jYwFEkcD
2257,1434448352147,0,0,1,0,off-topic,1,112,3834,@kelswoo7   @TheFauxMilaniaG: hide your pugs hide your wife #sandy
2258,1434448352150,0,0,1,0,off-topic,3,160,3835,Trains that washed up onto the NJ Turnpike in Carteret NJ near Exit 12 #ohshit @ carteret, nj http://t.co/dphwIqAv
2259,1434448352152,0,0,1,0,off-topic,2,170,3836,@dj_monkeyboy It's really windy here. No flooding in the basement which is a good thing since we can't use the shop vac. lol
2260,1434448352152,0,0,1,0,off-topic,0,190,3837,met @djvitognj's daughter yesterday at work. she's so stinking precious, smart &amp; definitely a daddy's girl! Gigi is on her way to big things
2261,1434448352259,1,0,1,0,on-topic,107,183,3838,@ElInganni Yep -as far as I know. Have power. Don't live near the water. It's messy will take forever to clean up-far worse elsewhere -xo
2262,1434448352259,1,1,1,1,on-topic,0,179,3839,Water is starting to rise along the pier w/ the rain &amp; wind but so far so good. #Sa @ The Powerhouse rooftop http://t.co/NDHYOXz9
2263,1434448352260,1,0,1,0,on-topic,1,96,3840,sandy isn't even here yet and I'm already boredddd
2264,1434448352261,0,0,1,0,off-topic,1,163,3841,@rebeccaarouse @munroeelizabeth Missing you too! Praying for you and @markarouse as you prepare to plant your church!
2265,1434448352261,1,0,1,0,on-topic,0,128,3842,Going stir crazy. I've been in my apartment since Sunday morning. #HurricaineSandy
2266,1434448352262,0,0,1,0,off-topic,1,175,3843,Dave's idea of emergency supplies. I am definitely marrying an Italian. #sandy #adven @ William Beaver House http://t.co/eORfbd9P
2267,1434448352263,0,1,1,0,off-topic,1,166,3844,@KWBaseball I hear you but give me good health for my wife and kids. The rest is what it is. It is hitting Cape May now.
2268,1434448352263,0,0,1,0,off-topic,0,175,3845,The boardwalk literally less than 24 hrs ago. Our reaction when th @ Beach Front Ceasers Hotel Atlantic City http://t.co/FIFAxW6Z
2269,1434448352265,0,1,1,0,off-topic,2,101,3846,@PaulyWalnuts93 lance is gonna have a heart attack haha
2270,1434448352267,1,0,1,0,on-topic,2,167,3847,Watching the news about #Sandy for the first time... They're really being dramatic huh? Let's see if this is gona be real
2271,1434448352269,0,0,1,0,off-topic,2,96,3848,@gina_buscetta honestly why can't this be my life.
2272,1434448352274,0,0,1,0,off-topic,5,110,3849,@KLizD I know!! So bummed to miss you all, next time for sure Xx
2273,1434448352278,0,0,1,0,off-topic,4,94,3850,@BrMalie I'm loving that track... Real laid back
2274,1434448352279,1,0,1,0,on-topic,1,131,3851,I feel really bad for the people who dont have a home to begin with in this hurricane
2275,1434448352280,0,1,1,0,off-topic,1,101,3852,Idc idc...my bed is just so comfy. Wont get out from it
2276,1434448352281,0,0,1,0,off-topic,1,82,3853,He told me i'm adorable &gt;&gt;&gt;
2277,1434448352283,0,1,1,0,off-topic,2,96,3854,@_BlackTOUCH Lmao , yeaa I was just never on it ..
2278,1434448352284,0,1,1,0,off-topic,1,72,3855,Everybody a Weeknd fan now
2279,1434448352286,0,0,1,0,off-topic,2,171,3856,@jgonzzz708 me and my whole family talked about u yesterday man. Ur the fuckin best i love you fam......we NEED to chill asap
2280,1434448352286,1,0,1,0,on-topic,0,166,3857,Can definitely HEAR the fire dept (or someone) making announcements but cannot tell WHAT they are saying #sandy #nervous
2281,1434448352287,0,0,1,0,off-topic,1,131,3858,@DonnaTruly pity I'm about to stop watching it bc of this bullshit Kalinda storyline.
2282,1434448352447,0,0,1,0,off-topic,160,110,3859,@ITS_CVSH: Why have a girlfriend when you can have a girl friend
2283,1434448352449,0,0,1,0,off-topic,2,121,3860,I told everyone they couldn't keep harden... Fantasy stock up or down ? Idk
2284,1434448352450,0,0,1,0,off-topic,1,96,3861,I'm sure you bitches ain't want no baby mama drama
2285,1434448352454,1,0,1,0,on-topic,4,136,3862,Gonna stock up on AAA batteries. I'm going to need to whip out the flip cam for this storm
2286,1434448352456,0,1,1,0,off-topic,2,159,3863,My Nigga Meech @Lafred_ Bout To Go Down In History Like the Real BMF Nigga Bang Bang No Chief Keep Just Glocks .!
2287,1434448352458,1,1,1,1,on-topic,2,89,3864,Pray for me x . Hurricane Sandy coming.....
2288,1434448352460,1,0,1,0,on-topic,2,176,3865,Looks like getting groceries will be an issue for the foreseeable future. #Fairway #Brooklyn is under water. https://t.co/gWub7dhB
2289,1434448352461,0,0,1,0,off-topic,1,81,3866,BDAY IN 6 MORE DAYS #SCORPIO SEASON
2290,1434448352462,0,0,1,0,off-topic,1,117,3867,OMG!!!  Disney to buy Lucasfilm for $4.05 billion  http://t.co/nqqiCIBO
2291,1434448352463,1,0,1,0,on-topic,1,114,3868,They're closing NYC subways starting at 7 tonight #basicallynoschool
2292,1434448352466,1,0,1,0,on-topic,3,134,3869,I know! RT @lawnlandscape: Wow. Atlantic City. http://t.co/bmolXHHE #Sandy #FrankenStorm
2293,1434448352467,1,0,1,0,on-topic,1,116,3870,Why do ppl park their nice ass cars under trees during a hurricane ???
2294,1434448352468,0,0,1,0,off-topic,1,106,3871,there's a room full of bitches... What chu following for....
2295,1434448352469,0,0,1,0,off-topic,1,92,3872,@AndyBellTAP aw. Good luck with everything! (:
2296,1434448352470,0,0,1,0,off-topic,1,112,3873,@KParrisWorld we got some silly impatient women in heels here *smh
2297,1434448352471,0,1,1,0,off-topic,1,119,3874,@Mocha_Allure mmmhmm you just saying dat to my mouth chey! U wicked o lml
2298,1434448352471,1,0,1,0,on-topic,0,125,3875,@bkabak And when is the last time a weather event caused citywide power outage?
2299,1434448352472,0,0,1,0,off-topic,1,135,3876,Pele ooo, maybe you will manage Portsmouth lmaooo@Thisismykl: @AlexanderSugar never man u
2300,1434448352473,1,0,1,0,on-topic,1,118,3877,Thank God for instant coffee ... #Sandy has officially knocked the power
2301,1434448352473,0,0,1,0,off-topic,0,82,3878,@brimadej yeah yeah whatever you say
2302,1434448352474,0,0,1,0,off-topic,1,141,3879,@nick_ponzo @angepalermo ill take whatever I can get asshole. Go drink like adults and shut up.
2303,1434448352475,0,0,1,0,off-topic,1,119,3880,Dan Balis Sighting: New York, New York/ Webster Hall http://t.co/RZG5cWML
2304,1434448352475,0,1,1,0,off-topic,0,178,3881,@MsNikk729: Romo now plays for the Giants! Thanks Romoromo is a bitch (tony homo) and I can't wait until we bust yal asses next week
2305,1434448352476,0,0,1,0,off-topic,1,119,3882,The speech @Drake gave at his high school graduation was legit. #realtalk
2306,1434448352476,0,0,1,0,off-topic,0,124,3883,@DovBear the fact they are republicans and arents a bunch of spending liberals
2307,1434448352477,0,1,1,0,off-topic,1,137,3884,@havreeluuuke: You're 30, the playboy bunny costume just isn't working for you dumbass nice
2308,1434448352477,0,0,1,0,off-topic,0,80,3885,@bajapantiix77 Imma go to ya house
2309,1434448352478,0,0,1,0,off-topic,1,183,3886,#SATstudyTime .. O.M.G. I wish my brother had found this earlier http://t.co/4WWFS0xe hurry before its unavailable #askdanaandallison kae
2310,1434448352479,1,0,1,0,on-topic,1,147,3887,I would live in Florida if I wanted to deal with this shit. Apocalyptic shit right outside your door.
2311,1434448352479,1,0,1,0,on-topic,0,84,3888,This hurricane is messin with my coin!
2312,1434448352480,0,0,1,0,off-topic,1,78,3889,At target , it's so dark in here
2313,1434448352481,1,0,1,0,on-topic,1,180,3890,Yall thought that was Hurricane Sandy that knocked out the power that was Gov. Christie givin niggas the greenlight to clip the shit .
2314,1434448352482,0,0,1,0,off-topic,1,175,3891,@HerTurnOns: Pay attention to the way your boyfriend treats others, because one day he will treat you that way as well. #truethat
2315,1434448352482,0,0,1,0,off-topic,0,115,3892,I'm a new convert @DeatonOpal: @MsLiryc Scandal is GREAT I love it...
2316,1434448352482,1,1,1,1,on-topic,0,110,3893,@kyleighhraee stop the storm is bad look at what happened in AC.
2317,1434448352483,0,0,1,0,off-topic,1,134,3894,@brandoncaba same lets see how this hoe plays out and Maybe we can make off w some goods
2318,1434448352484,0,0,1,0,off-topic,1,87,3895,@SenorWanon give me a song and I will lol
2319,1434448352485,0,0,1,0,off-topic,1,121,3896,Gotta watch what I say though. Always someone who snitches me out. #WhoIsIt
2320,1434448352486,1,0,1,0,on-topic,1,116,3897,@angelavaccaro3 so they evacuated Belmar but my sisters still there...
2321,1434448352486,1,0,1,0,on-topic,0,113,3898,Preparing for hurricane sandy obvs @ Cafeteria http://t.co/7NKNjjfa
2322,1434448352487,1,0,1,0,on-topic,1,89,3899,fml i have no food &amp; sandy's on her way
