2058,1434448565479,1,0,1,0,on-topic,1,172,4340,People are clearly freaked about #Fraankenstorm. Checkout line runs all the way back to the beer section! http://t.co/j2MIHWQK
2059,1434448566022,1,0,1,0,on-topic,543,111,4350,Thoughts and prayers from Brooklyn... @ Home http://t.co/9VwqlhI7
2060,1434448566025,1,0,1,0,on-topic,3,164,4353,Of course there's a checkin for this (@ Frankenstorm Apocalypse - Hurricane Sandy w/ 3566 others) http://t.co/LaW1AM6u
2061,1434448566026,1,0,1,0,on-topic,1,177,4354,@StormTeam4NY: Levy break in town of Moonachie along Hackensack River causing inundation of water downstream Praying for everyone!!
2062,1434448566027,1,0,1,0,on-topic,1,160,4366,so are you gonna call it cuddling weather when hurricane sandy blows off your roof too-  @zayncocaine  LMFAOOOOOOO
2063,1434448566028,1,0,1,0,on-topic,1,83,4381,They are calling it the Perfect Storm
2064,1434448566030,0,1,1,0,off-topic,2,85,4385,My dad just asked if I was dead ? wtf ?
2065,1434448566032,0,0,1,0,off-topic,2,175,4386,I have a show in CT 11/1.. Not lookin good #Slideout #WHAT_IT_IS!? STREAM/BUY http://www.vibed @ king mobile http://t.co/ERWkWdEq
2066,1434448566033,1,0,1,0,on-topic,1,177,4234,On a more serious note.. Hope all I love and care about is safe. Even you guys on the SS. Your in my prayers too. #HelpStatenIsland
2067,1434448566034,1,0,1,0,on-topic,1,158,4241,Main @msnbc set losing power from #hurricane #sandy. Parts of 30 rock flickering on and off http://t.co/CMz9l0yM
2068,1434448566035,0,0,1,0,off-topic,1,175,4243,I live a couple of blocks away from the shore. I never get flooded. But this  @ Home (Bensonhurst, Brooklyn) http://t.co/4Qxx7H01
2069,1434448566036,1,0,1,0,on-topic,1,113,4253,I Knew This Hurricane Wasn't Gunna Be As Big As They Made It Seem .
2070,1434448566038,0,0,1,0,off-topic,2,143,4256,I want to go see Belmar but at the same time I don't because I can't see it all destroyed #mybaby
2071,1434448566040,1,0,1,0,on-topic,2,122,4272,Tree on house after Sandy. No damage inside. Thank God. http://t.co/yJrXL0Lc
2072,1434448566041,0,0,1,0,off-topic,1,111,4279,About to go on a drive with @preezybear95 to check out the damage
2073,1434448566045,1,1,1,1,on-topic,4,159,4288,This storm is startin to pick up!!! Still loomin good over here since all our trees already fell down last time!!
2074,1434448566047,1,0,1,0,on-topic,2,132,4156,I'm at Frankenstorm Apocalypse - Hurricane Sandy w/ @realmattholt http://t.co/Fer1tLw2
2075,1434448566052,1,1,1,1,on-topic,5,101,4169,@mills_bethany: hurricane sandy is in my hour ecall 911
2076,1434448566055,1,0,1,0,on-topic,3,154,4178,@PatPizzy let's just hope we don't get drunk enough to go out and do some dumb shit during the hurricane lol
2077,1434448566056,0,0,1,0,off-topic,1,97,4193,@B_Strong4life since Friday UNTIL MY IMMINENT DEATH
2078,1434448566059,1,0,1,0,on-topic,3,83,4195,I cant feel you here hurricane sandy!
2079,1434448566060,1,0,1,0,on-topic,1,121,4197,I can't swim so I'm staying home tomorrow #needaboat #HurricaneSandy #Getit
2080,1434448566062,1,1,1,1,on-topic,2,167,4199,People are downstairs buying food supplies like crazy. Everyone be safe...even though I think it'll just be a rain storm.
2081,1434448566062,1,0,1,0,on-topic,0,89,4203,How come I didn't get the emergency alert??
2082,1434448566064,1,1,1,1,on-topic,2,118,4214,Dinner getting through the storm!  @ Spanish Harlem http://t.co/PXLV4Nss
2083,1434448566066,1,1,1,1,on-topic,2,105,4075,Going to Times Square because #YOHO you only hurricane once
2084,1434448566068,1,0,1,0,on-topic,2,188,4085,Wow I watched 3 trees come down across the street then 1 on my moms property &amp; tons of transformers blowing up in wild green explosions...
2085,1434448566068,1,0,1,0,on-topic,0,188,4098,As #Sandy approaches Im Praying for all those LEO &amp; 1st responders working through this storm overnight, especially those i know #StaySafe
2086,1434448566069,1,0,1,0,on-topic,1,137,4107,Preparing for Hurricane Sandy (@ Metropolitan City Market w/ 2 others) http://t.co/61ZBv547
2087,1434448566070,1,1,1,1,on-topic,1,81,4114,Storms is a coming. Be safe people.
2088,1434448566071,1,0,1,0,on-topic,1,145,4115,I'm at Frankenstorm Apocalypse - Hurricane Sandy (New York, NY) w/ 2031 others http://t.co/FR3c6RWr
2089,1434448566072,1,0,1,0,on-topic,1,99,4117,And Sandy is still here.. Good morning hurricane #smh
2090,1434448566073,1,0,1,0,on-topic,1,177,4119,@NPRrussell: Another weather wow with Hurricane #Sandy: Great Lakes wave heights could reach 33 feet in storm. http://t.co/CGar8cAt
2091,1434448566074,1,1,1,1,on-topic,1,139,4132,Wait . I am blasting music and because a hurricane is coming the have to turn.off the radio ?
2092,1434448566074,0,0,1,0,off-topic,0,184,4139,@WSJNY: Mayor Bloomberg said parts of NYC transit system would be out for days at least, as tunnels remained flooded: http://t.co/kTLTkghu
2093,1434448566075,0,0,1,0,off-topic,1,116,4140,Sea Bright and Highlands is looking crazy...Storm chasing with Scotty!
2094,1434448566084,1,0,1,0,on-topic,9,143,4144,Not evacuating because the Gregorio's are a bunch of bad asses. #HurricaneSandy #YourNoMatchForUs
2095,1434448566084,0,1,1,0,off-topic,0,117,4146,promoters still promoting like ppl gonna go in a crisis like this #lmao
2096,1434448566085,0,0,1,0,off-topic,1,91,4294,Hate when people try to ruin ur smoke session
2097,1434448566087,0,0,1,0,off-topic,2,89,4295,@gmanzsoto hope you stocked up a lot on KFC
2098,1434448566088,0,0,1,0,off-topic,1,92,4296,@stefaniefields your hairs ugly as shit anyway
2099,1434448566090,0,0,1,0,off-topic,2,145,4297,@mishpep fine.....but after, im drawing you a bath and leaving you in peace while i cook you dinner
2100,1434448566091,1,0,1,0,on-topic,1,116,4390,Roots #sandy #wind #damage @ Lincoln Terrace Park http://t.co/HhhFYVO1
2101,1434448566092,1,0,1,0,on-topic,1,78,4402,Quite excited for this hurricane
2102,1434448566094,1,0,1,0,on-topic,2,105,4408,Hurricane Sandy is about to kick some ass!! #hurricanesandy
2103,1434448566096,1,1,1,1,on-topic,2,132,4411,Shout out to the college kids that evacuated to where the storm is coming #SouthJersey
2104,1434448566395,0,1,1,0,off-topic,299,152,4413,It's a cover-up for the government to plan another attack on nyc this time its gonna be the train stations
2105,1434448566396,1,0,1,0,on-topic,1,123,4428,All these Sandy Cheeks relations to the hurricane&gt;&gt;&gt;&gt;&gt;&gt;&gt;
2106,1434448566398,1,0,1,0,on-topic,2,126,4438,Working out what I gained in these past 8 hours #nothingelsetodo #hurricanesandy
2107,1434448566399,0,0,1,0,off-topic,1,180,4441,@WesLinda: @peter_hurley @chris_fain_ @JohnDavdPittman thanks to everyone who put last night on! What a blast!! Great hanging out Wes!
2108,1434448566400,0,1,1,0,off-topic,1,133,4389,I think Bloomberg just said in Spanish, everything is ok, these white people are crazy.
2109,1434448566401,0,0,1,0,off-topic,1,113,4391,@ITalkSCUM how u been tho n no problem.. how we never linked up smh
2110,1434448566402,0,0,1,0,off-topic,1,76,4392,Little India aka oak tree road
2111,1434448566404,0,0,1,0,off-topic,2,135,4393,Nice evening for grilled chicken breasts. @ Clinton and State Street http://t.co/X4AY9CfO
2112,1434448566405,0,0,1,0,off-topic,1,81,4394,werewolf beer. STOP. HAMMERED TIME.
2113,1434448566407,1,0,1,0,on-topic,2,78,4395,I need my power back its a must!
2114,1434448566409,0,0,1,0,off-topic,2,105,4396,@Giv_Em_The_Rust stay home then. Take shelter mother fucker
2115,1434448566411,1,0,1,0,on-topic,2,129,4397,Lol lighting up like the 4th of july on my block, dont know how we still have power
2116,1434448566412,0,0,1,0,off-topic,1,103,4398,I'm at Dunkin' Donuts (New York, NY) http://t.co/ZTbaIDZE
2117,1434448566414,1,0,1,0,on-topic,2,159,4399,@jtbennett Were not sure close to Gowanus but worrying about surge resulting in power outage. You guys take care!
2118,1434448566415,0,0,1,0,off-topic,1,66,4400,Big cock in my mouth
2119,1434448566418,0,0,1,0,off-topic,3,89,4401,-' @NICKIMINAJ who does your eyebrows boo ?
2120,1434448566420,0,1,1,0,off-topic,2,126,4403,Is it bad that I want Korean BBQ again although I just had Sunday? #addictedmuch
2121,1434448566421,1,0,1,0,on-topic,1,95,4404,Sandys gonna make me gain like 80 pounds and shit
2122,1434448566426,0,0,1,0,off-topic,5,78,4405,I'm out here suffering by myself
2123,1434448566434,0,0,1,0,off-topic,8,83,4406,I Was Mad My Power Went Out LastNight
2124,1434448566441,0,0,1,0,off-topic,7,87,4407,I want junk food to wash my worries away!
2125,1434448566448,0,0,1,0,off-topic,7,105,4409,You idiot... This leaves are gunna blow back!!!!! I'm done.
2126,1434448566451,0,0,1,0,off-topic,3,100,4410,I'm at jcpenney (Jersey City, NJ) http://t.co/LX09OiFB
2127,1434448566453,0,0,1,0,off-topic,2,111,4412,If we go through this will be the best day of my life, loving NYC
2128,1434448566455,0,0,1,0,off-topic,2,93,4414,My power was out for like 5 days when Irene hit
2129,1434448566458,0,0,1,0,off-topic,3,170,4415,News media keeps saying to be well stocked on water... Do these bottles count!? @ High Roller Penthouse http://t.co/4MdqLCB6
2130,1434448575597,0,1,1,0,off-topic,9139,186,4416,Angelo-  Fat- Boyz (@Jerseyshore00)  I would like to thank. Press #Obama....he is coming to the #jerseyshore tomorrow. To help. #USA  #Sandy
2131,1434448575599,0,0,1,0,off-topic,2,169,4417,@Louis_Tomlinson Louis I've been trying to get  a follow from you for so long! Please follow me it would mean the world! Xx
2132,1434448575599,0,0,1,0,off-topic,0,100,4418,@katelyn_arbadji are you serious that really sucks lol
2133,1434448575601,0,0,1,0,off-topic,2,137,4419,The fact that I went into my pitch dark basement to get my guinea shows how much I love him
2134,1434448575602,1,0,1,0,on-topic,1,121,4420,@rob41278 wow! Be careful with those power lines. But ur a professional lol
2135,1434448575603,0,0,1,0,off-topic,1,89,4421,Smh a lot of gurls jus isn't worth the time
2136,1434448575606,0,0,1,0,off-topic,3,131,4422,The view of dark lower Manhattan is eerie (@ Sunset Park) [pic]: http://t.co/axGU51qd
2137,1434448575607,0,0,1,0,off-topic,1,102,4423,@amayrosay don't wanna hear it lmao http://t.co/8PesvbVx
2138,1434448575608,0,0,1,0,off-topic,1,134,4424,its a good day when the giants win and the cowboys and eagles loose :) I'm a happy girl!
2139,1434448575609,0,0,1,0,off-topic,1,89,4425,I HATE guys that smoke like that's not cool
2140,1434448575611,0,0,1,0,off-topic,2,87,4426,@bob_giosa She's a slut .Get out if here.
2141,1434448575612,0,0,1,0,off-topic,1,92,4427,Let's take Reggie's Bush head off #jetsdefense
2142,1434448575614,0,0,1,0,off-topic,2,98,4429,@alice_gao that can't be right - figure 10' a floor.
2143,1434448575615,1,0,1,0,on-topic,1,183,4430,Let's not forget to thank the police, firemen, FEMA workers, national guard and the public servants who are tirelessly serving the public
2144,1434448575616,0,0,1,0,off-topic,1,182,4431,On #Sandy stockpiling: Did you buy smooth or crunchy peanut butter? Because smooth is a snack, but crunchy is a meal. -- @andrewdelcolle
2145,1434448575616,0,0,1,0,off-topic,0,95,4432,Facetiming with guy friends, freaking my mom out.
2146,1434448575618,0,0,1,0,off-topic,2,84,4433,Lord help me to forkkkkk my tongue!!!!
2147,1434448575620,0,1,1,0,off-topic,2,80,4434,Uhh let me get off my tl, like now
2148,1434448575622,0,0,1,0,off-topic,2,99,4435,I thought I be slaying nugget she beat me at it LMFAO
2149,1434448575623,0,0,1,0,off-topic,1,123,4436,Photo wall at Gramercy Park Hotel. @ Gramercy Park Hotel http://t.co/5TWslQuC
2150,1434448575625,1,1,1,1,on-topic,2,76,4464,Westy woods is already flooded
2151,1434448575626,0,0,1,0,off-topic,1,91,4467,@BricksFromPluto how I'm tweeting if I'm dead
2152,1434448575628,1,1,1,1,on-topic,2,144,4481,No flights no work getting paid to recover from a hangover #Sandy my bed awaits you better be good
2153,1434448575629,1,0,1,0,on-topic,1,168,4489,The remains of an umbrella that could not hold up to Hurricane Sandy @ King Pizza &amp; Fried Chicken http://t.co/sIoJvV8m
2154,1434448575629,1,0,1,0,on-topic,0,147,4493,@_tomja LOL! I don't care, I'm missing a few days of school because of the Hurricane! #notcomplaining
2155,1434448575630,1,0,1,0,on-topic,1,104,4494,We are way past from it's raining cats and dogs #hurricane
2156,1434448575632,1,0,1,0,on-topic,2,127,4500,Minor damage in my neighborhood. #sandy #nyc  @ Europan Cafe http://t.co/JN8Q8GCG
2157,1434448575633,1,0,1,0,on-topic,1,134,4506,I'm at Frankenstorm Apocalypse - Hurricane Sandy (NJ) w/ 127 others http://t.co/mVaj4XJn
2158,1434448575633,0,0,1,0,off-topic,0,130,4510,Chillin in my car charging my phone blasting heat and music watching the trees.  #HL
2159,1434448575634,1,0,1,0,on-topic,1,170,4513,Lone NYPD officer standing guard in case #Sandy sneaks in to town overnight #hurricane #nypd #nyc @ NYC http://t.co/mXP0stLo
2160,1434448575635,1,0,1,0,on-topic,1,137,4526,#sandyn12nj #hurricane #sandy #hurricanesandy #flooded  @ Trader Joe's http://t.co/ZCmW9RMq
2161,1434448575636,1,0,1,0,on-topic,1,99,4528,Hurricane Sandy shows no mercy.. http://t.co/bEbvkQtr
2162,1434448575637,0,1,1,0,off-topic,1,146,4534,Whoever was planning to dress as Storm (the Halle berry one) is going to look so badass on Haloween.
2163,1434448575638,1,0,1,0,on-topic,1,132,4535,I'm at Frankenstorm Apocalypse - Hurricane Sandy w/ @cornfedchris http://t.co/fLdJJ0o4
2164,1434448575639,0,0,1,0,off-topic,1,109,4461,Woah  @supreme_corey: When I get married.. http://t.co/sYd7ffKy
2165,1434448575640,0,0,1,0,off-topic,1,91,4462,My father is not liking American horror story
2166,1434448575641,0,1,1,0,off-topic,1,116,4463,Just posted a photo @ Battery Park City Boardwalk http://t.co/s1FTVL8D
2167,1434448575642,1,0,1,0,on-topic,1,115,4465,Fifty shades of Cuomo: Andrew talking about 'pumping capacity' #sandy
2168,1434448575644,0,0,1,0,off-topic,2,153,4466,For a nigga on the east coast I'm chillin. I got power and shit. I'm technically stuntin since I got power.
2169,1434448575644,0,0,1,0,off-topic,0,101,4468,IF YOU WANT THE RAINBOW YOU GOT TO PUT UP WITH THE RAIN
2170,1434448575646,1,0,1,0,on-topic,2,91,4469,@blakeshelton be thankful you are not in NYC!
2171,1434448575648,0,0,1,0,off-topic,2,89,4470,Hey Neil, we have power on UES (Yorkville).
2172,1434448575650,1,0,1,0,on-topic,2,119,4471,#Midtown morning after #sandy @ United Nations Plaza http://t.co/6ZpMMxFw
2173,1434448575651,0,0,1,0,off-topic,1,129,4472,#newyork #jobs Data Entry Clerk - FCi Federal -  New York, NY  http://t.co/Ai9nbdF6
2174,1434448575652,0,0,1,0,off-topic,1,84,4473,Lmfao thou shall never lie on thy peen
2175,1434448575654,0,0,1,0,off-topic,2,107,4474,WHY DON'T I HAVE BEER I WOULD SO PLAY FLIP CUP AGAINST MYSELF
2176,1434448575655,0,0,1,0,off-topic,1,70,4475,There I dissed you again
2177,1434448575657,0,0,1,0,off-topic,2,66,4476,Am I the only one up
2178,1434448575659,0,0,1,0,off-topic,2,89,4477,FUMBLE ' oh shxtt they messing up already .
2179,1434448575660,0,0,1,0,off-topic,1,161,4478,#GottaAceMySATexam : O.M.G. wish we had found this before http://t.co/z2Uz8Hlz hurry before its unavailable ACT szy
2180,1434448575661,0,0,1,0,off-topic,1,102,4479,@TichinaArnold good morning and thank you ! Likewise :-)
2181,1434448575663,0,0,1,0,off-topic,2,84,4480,Party on the rooftop top of the world.
2182,1434448575664,0,0,1,0,off-topic,1,74,4482,i am not who you think i am.
2183,1434448575666,0,0,1,0,off-topic,2,187,4483,All I see in my feed is even if you aren't a fan of *insert celeb name here* please pray for them.. Uh I live in NYC too! Screw you all&lt;3.
2184,1434448575667,0,0,1,0,off-topic,1,107,4484,HAPPY HALLOWEEN !! (@ On the East River) http://t.co/MkYsbYbl
2185,1434448575668,0,0,1,0,off-topic,1,110,4485,AMAZING Witten one-handed catch. And then #13. 124 yards so far.
2186,1434448575670,0,0,1,0,off-topic,2,140,4486,@JCP_L @news12li jcp&amp;L are a get crew with a very concerned president. Thank you Don Lynch
2187,1434448575671,0,1,1,0,off-topic,1,120,4487,@bri_dendler I'm gonna go sit in the focus for a while and charge my phone
2188,1434448575672,0,0,1,0,off-topic,1,110,4488,@CrownKING_DVOXO How come I can't retweet your shit boy -______-
2189,1434448575673,0,0,1,0,off-topic,1,108,4490,I need to go to a chiropractor and spa after basketball season
2190,1434448575675,0,0,1,0,off-topic,2,155,4491,@eyewitnessnyc @jeffpegues7 it's 100 houses and 3 blocks burnt down accd to local fire fighter. Please cover!
2191,1434448575676,0,0,1,0,off-topic,1,176,4492,#GottaAceMySATexam : FINALLY!! We wish our son had got that earlier http://t.co/T6kVGY7o hurry before its unavailable #tsunami dra
2192,1434448575677,0,0,1,0,off-topic,1,118,4495,@xRedRobin_YUMx can I follow you your making my tummy hurt from laughing
2193,1434448575679,0,1,1,0,off-topic,2,116,4496,when @jennnech tweets about cindarella story cause we just watched it!
2194,1434448575681,0,0,1,0,off-topic,2,76,4497,I heard too much about u..#sad
2195,1434448575683,0,0,1,0,off-topic,2,117,4498,Bucket list check! (@ Apollo Theater w/ 15 others) http://t.co/acFWaNjd
2196,1434448575684,0,0,1,0,off-topic,1,130,4499,@STEPlockHolmes thank you we r ok God definitely is looking out for me and my family
2197,1434448575684,1,1,1,1,on-topic,0,94,4501,Now if the power does go out I don't gotta worry
2198,1434448575686,0,0,1,0,off-topic,2,161,4502,I should prolly unfollow all the fast food accounts I get mad hungry when I look at my timeline #FatBoyShit #Swerve
2199,1434448575687,0,0,1,0,off-topic,1,172,4503,Pee oN tod what did tod do to you?... #newark #lightrail #glass #missing #letters P @ Newark Penn Station http://t.co/6b5PzkCs
2200,1434448575687,1,0,1,0,on-topic,0,179,4542,@timlovejoy Some people here in NY are playing a drinking game where you have to drink every time the TV news says storm surge #Sandy
2201,1434448575688,1,1,1,1,on-topic,1,112,4543,NYC has report 1 death so far from Sandy RIP to that 29yr old man.
2202,1434448575689,1,0,1,0,on-topic,1,120,4553,Massive downed tree near my apartment.  @ Prospect Pl http://t.co/QAU9fJWF
2203,1434448575690,1,0,1,0,on-topic,1,124,4557,I'm at Frankenstorm - Glen Ridge Central (Glen Ridge, NJ) http://t.co/vPaexaAs
2204,1434448575692,1,1,1,1,on-topic,2,175,4562,Double rainbow over manhattan just now...always a calm after a storm...I'm up I'm healthy I'm ali @ The Crib http://t.co/jTDs3u8V
2205,1434448575693,1,0,1,0,on-topic,1,186,4565,Them Team Romney people probably put up a few stacks to make this Hurricane happen...   #HAARP   How this shit occur right before election ?
2206,1434448575695,1,0,1,0,on-topic,2,81,4568,oh god the solarium #hurricanesandy
2207,1434448575700,0,0,1,0,off-topic,5,164,4573,Annnnd another former #PennState linebacker for the Cowboys is injured. Maybe they shouldn't play for this crappy team
2208,1434448575703,1,0,1,0,on-topic,3,85,4590,Fuck this storm. Ruining everything -,-
2209,1434448575709,0,0,1,0,off-topic,6,138,4592,@Funny_Truth: In an emergency, I'd probably tweet about it before calling the police. #lmfao
2210,1434448575717,1,0,1,0,on-topic,8,127,4595,Casey looking out the window waiting for Frankenstorm @ Home http://t.co/z3eEabnS
2211,1434448575719,1,0,1,0,on-topic,2,144,4596,Hurricane shit ain't nothing to joke about , y'all seen Katrina . You never know what can happen .
2212,1434448575720,1,0,1,0,on-topic,1,168,4598,Gotta luv Capitalism .. They ain't missing a beat .. Still open for business. #hurricanesandy  @ IHOP http://t.co/OOZwKqgi
2213,1434448575721,1,0,1,0,on-topic,1,105,4610,Don't have my retainers. Need my retainers. #HurricaneSandy
2214,1434448575724,1,0,1,0,on-topic,3,142,4611,Earthquake &amp; tsunami in Hawaii...hurricane in New York = sheer and absolute madness at work.
2215,1434448575725,1,0,1,0,on-topic,1,176,4612,(No Internet because of the hurricane, making up links) Newly discovered pachyderm species indifferent to using iPhone or Android.
2216,1434448575727,1,0,1,0,on-topic,2,129,4624,broke out the emergency glowstick #plur #sandy  @ East Village http://t.co/BxW3HDjR
2217,1434448575728,0,0,1,0,off-topic,1,152,4627,Bring it on... WOAH BITCH! (@ Frankenstorm Apocalypse - Hurricane Sandy w/ @dynah227) http://t.co/tnQwC6Cq
2218,1434448575729,0,0,1,0,off-topic,1,101,4540,I really don't like when my mom stay in the living room
2219,1434448575732,0,0,1,0,off-topic,3,115,4541,No shame in my game, I used to be THE gullible Guy, I'll admit it lol
2220,1434448575734,0,0,1,0,off-topic,2,68,4544,But I still miss you..
2221,1434448575736,0,0,1,0,off-topic,2,153,4545,@Dave_r_milne @daveyswims yup we lucked out.  another day off work tomorrow for me too. Guess where I'll be
2222,1434448575737,0,0,1,0,off-topic,1,105,4546,@LopezNicooleex3 well yeah lol I figured you can help best.
2223,1434448575739,0,0,1,0,off-topic,2,83,4547,@meganbrittan I am hehehe love you xx
2224,1434448575749,0,0,1,0,off-topic,10,115,4548,All the Nexus products introduced. Shut up and take my money #Android
2225,1434448575755,0,0,1,0,off-topic,6,83,4549,@nparmalee I haven't checked actually
2226,1434448575758,0,0,1,0,off-topic,3,104,4550,Class cancelled monday and tuesday #woohooo #thankyousandy
2227,1434448575760,0,0,1,0,off-topic,2,176,4551,SO glad I never moved to Hoboken. Westwood will keep Sandra and I nice and dry, until we decide between Chelsea or Newbury street.
2228,1434448575761,0,1,1,0,off-topic,1,153,4552,@erlenzi @ashleyrayray our power did the same thing. Now we're going on 2 hrs of candlelight and quiet time
2229,1434448575762,0,1,1,0,off-topic,1,184,4554,@HobokenHero saw a guy drown trying to cross observer hwy and grove. Current knocked him down three times. He didn't get up the third time
2230,1434448575764,0,1,1,0,off-topic,2,106,4555,@annaojmi lol I just wanna have an end of the world party xD
2231,1434448575766,0,1,1,0,off-topic,2,79,4556,WHERE IS EMILY RIGHT NOW?! LMFAO.
2232,1434448575769,0,0,1,0,off-topic,3,182,4558,Wait for #Apple TV to get #Hulu only to have #30Rock disappear! Stupid rights. Have to #Airplay from my #Macbook. #IWantAllContentAlways
2233,1434448575769,0,0,1,0,off-topic,0,86,4559,@MeriamPulles whatever I say is true! ;)
2234,1434448575772,1,0,1,0,on-topic,3,167,4560,Good Morning. To all of my fellow Northeastern neighbors: stay inside and be safe. Save your thirst for adventure. #Sandy
2235,1434448575773,0,0,1,0,off-topic,1,106,4561,@StrokeMeDown_69 in good thanks for   Asking what you up to?
2236,1434448575775,0,0,1,0,off-topic,2,91,4563,It sounds like sandy is having some wild sex.
2237,1434448575777,0,0,1,0,off-topic,2,111,4564,@SatyrnFox in the words of Samuel L Jackson, GO THE FUCK TO SLEEP
2238,1434448575780,0,0,1,0,off-topic,3,84,4566,I wonder how my butt looks in leggings
2239,1434448575783,1,0,1,0,on-topic,3,126,4567,BQE southbound evacuation backups. #sandy  @ Flying Lobster http://t.co/Tmv1mv7U
2240,1434448575785,0,0,1,0,off-topic,2,86,4569,I need to like take a class about weave.
2241,1434448575788,0,0,1,0,off-topic,3,81,4570,We don't diss them, we dismiss them
2242,1434448575791,0,0,1,0,off-topic,3,105,4571,Apples all sandbagged up @ Apple Store http://t.co/Wg9uI9Eu
2243,1434448575793,0,1,1,0,off-topic,2,182,4572,@Danyellium: Sometimes I wish that the few people that know me didn't follow me so I could just vent but #no go private or block em. Lol
2244,1434448575795,0,1,1,0,off-topic,2,154,4574,Stuck. Mom won't let me go back to school, no tv, allergies going nuts cus of the cats. #wah #itcouldbeworse
2245,1434448575796,0,0,1,0,off-topic,1,77,4575,Omw home from work. Stomachache
2246,1434448575802,0,1,1,0,off-topic,6,82,4576,Brb for 2 hours no texts or anything
2247,1434448575806,0,0,1,0,off-topic,4,143,4577,@BballProblemz: When you keep a basketball in your car at all times... #BasketballSuccessI keep 2
2248,1434448575807,0,0,1,0,off-topic,1,100,4578,I should probably remove my car from under Nole's tree
2249,1434448575809,0,0,1,0,off-topic,2,100,4579,@TheOnly_Cjb Do what you gotta do brvh Real Nigga Shit
2250,1434448575811,1,0,1,0,on-topic,2,120,4630,even all this food will not avail me if this hurricane takes down my house
2251,1434448575813,0,0,1,0,off-topic,2,140,4640,@AmmandaJ I think you may be right :( I think alot of things won't be around after this storm.
2252,1434448575814,1,0,1,0,on-topic,1,107,4642,@_ForeverrYOUNG: Idk why people think this hurricane a joke !
2253,1434448575815,0,1,1,0,off-topic,1,186,4643,Livetweeting (in order of appearance); The Walking Dead, Breaking Amish, Long Island Medium, Hurricane Sandy, Romney's Binders full of Women
2254,1434448575816,1,0,1,0,on-topic,1,134,4648,First #Sandy casualties in Park Slope. #sandyproblems  @ Park Slope http://t.co/nEKG40Nk
2255,1434448575817,0,0,1,0,off-topic,1,99,4655,Rookie mistake. Wholefoods on a Sunday before a storm
2256,1434448575819,1,1,1,1,on-topic,2,181,4660,ATTENTION!!!! If you don't need to be outside. Stay home. It's bad out there. First hand experience. #HurricaneSandy #PrepperTalk #shtf
2257,1434448575820,1,0,1,0,on-topic,1,118,4672,Coastal Flood Warning issued for Spuyten Duyvil, NY http://t.co/0zEOq7h8
2258,1434448575821,1,0,1,0,on-topic,1,126,4673,Best part about hurricanes. The $5 dollar hurrican drink special. @JJsPub #mola.
2259,1434448575822,0,0,1,0,off-topic,1,94,4680,Watching a new episode of the @WalkingDead_AMC!!
2260,1434448575824,1,1,1,1,on-topic,2,156,4686,Ready for my very first hurricane experience  #hurricanesandy #newyork  @ Hilton New York http://t.co/DvjIfNaF
2261,1434448575825,0,0,1,0,off-topic,1,103,4688,@Leilooney86 dead serious imma let mommy video tape it...
2262,1434448575826,1,1,1,1,on-topic,1,164,4693,Getting ready for hurricane Sandy :) (@ Frankenstorm Apocalypse - Hurricane Sandy w/ 2656 others) http://t.co/95qhqUDy
2263,1434448575827,1,0,1,0,on-topic,1,115,4697,@teeeenie @julismangs it's an AIN'T NO STOPPIN ME NOW KINDA HURRICANE
2264,1434448575828,1,0,1,0,on-topic,1,93,4704,It sounds like a hurricaneoh wait because it is
2265,1434448575830,1,0,1,0,on-topic,2,117,4705,, my powers out and my phones dead and my sisters phone is on 28% ! FML
