2521,1434450615872,0,0,1,0,off-topic,1,127,3038,@ashleighhyoungg yes I think so either way I would sneak out because I need food!
2522,1434450616058,0,0,1,0,off-topic,186,143,3039,First avenue looking good. We are lucky here. @ 53rd Street and First Avenue http://t.co/9t7aIRL4
2523,1434450616058,0,1,1,0,off-topic,0,143,3040,I was able to get a bed in pacu but these Jamaicans talking mad loud! I'm not gonna get any sleep
2524,1434450616058,0,0,1,0,off-topic,0,162,3041,Retro #brooklyn buildings &amp; record shop.  @ Park / South Slope &amp; Gowanus (Brooklyn, NY) http://t.co/YcuILksg
2525,1434450616059,0,0,1,0,off-topic,1,126,3042,@gabegabesilva of course lol but you woulda seen me in my jammies  #embarrassing
2526,1434450616059,1,1,1,1,on-topic,0,139,3043,Just lost power. Counting on her to be my beacon. #Sandy #Hurricane #NYC http://t.co/ZmlAyeAD
2527,1434450616060,0,0,1,0,off-topic,1,184,3044,#GottaAceMySATexam .. OH LORD: I really wish we found that previously http://t.co/Uu00v9sw ya better get this #TallGirlAppreciationDay pzk
2528,1434450616060,0,0,1,0,off-topic,0,115,3045,@robert_atkins the picture you tweeted at me last night oh ny GOD LOL
2529,1434450616060,0,1,1,0,off-topic,0,80,3046,@z_muns you're just tryna get laid
2530,1434450616061,0,0,1,0,off-topic,1,104,3047,Filipinos pull superstitions out their asses.. too much bs
2531,1434450616062,0,0,1,0,off-topic,1,87,3048,I Keep My Mouth Close &amp; Eyes open ...
2532,1434450616063,0,0,1,0,off-topic,1,127,3049,Love football games at our school, it's fun chilling with everyone minus the COLD
2533,1434450616246,1,1,1,1,on-topic,183,108,3050,So glad to say belmars gone and powers out for 10-14 days #YES
2534,1434450616247,0,0,1,0,off-topic,1,92,3051,Times like this I'm glad I bought a @boostcase
2535,1434450616248,0,0,1,0,off-topic,1,85,3052,We have a table at French roast tonight
2536,1434450616249,0,0,1,0,off-topic,1,111,3053,Did you think I wouldn't find out through my family ? Lol dumbass
2537,1434450616249,1,1,1,1,on-topic,0,99,3054,@gmayweather6309 no stop there's a hurricane coming!!
2538,1434450616250,0,0,1,0,off-topic,1,107,3055,Who is the one artist that you will never say no to? @Hit_Boy
2539,1434450616251,0,0,1,0,off-topic,1,139,3056,@Dave_r_milne sure that's all we've done all day and we didn't have a marathon this mornin ;)
2540,1434450616251,0,0,1,0,off-topic,0,175,3057,Episode VII: The Droning On and On Wars RT@pegobry: WHAT. RT @Reuters: Star Wars episode seven will come out in 2015, Disney says
2541,1434450616251,1,1,1,1,on-topic,0,135,3058,Classes cancelled. Everyone in the NYC area preparing. #HurricaneSandy is coming to town.
2542,1434450616252,0,0,1,0,off-topic,1,110,3059,I will miss you home, cats, town, childhood... Everything I know
2543,1434450616252,0,1,1,0,off-topic,0,89,3060,White boy just left :[ ugh his annoying ass
2544,1434450616253,1,0,1,0,on-topic,1,140,3061,People gathered at Main Street, Dumbo. #sandy  @ Empire-Fulton Ferry Park http://t.co/GNyedAjU
2545,1434450616253,0,1,1,0,off-topic,0,115,3062,A lot of shit has happened already and they say the worst is to come.
2546,1434450616254,0,0,1,0,off-topic,1,129,3063,@ant_917 This trip is my 18th birthday present, but, you have to be 21 here anyway.
2547,1434450616254,0,1,1,0,off-topic,0,100,3064,Kinda not loving having a wall of windows right now...
2548,1434450616255,0,0,1,0,off-topic,1,91,3065,#RT @shakira says: When boys bite their lips.
2549,1434450616255,1,0,1,0,on-topic,0,145,3066,I'm at Frankenstorm Apocalypse - Hurricane Sandy (New York, NY) w/ 2302 others http://t.co/80MhRUHx
2550,1434450616256,0,1,1,0,off-topic,1,84,3165,Sorry guys! Going through iPad photos!
2551,1434450616256,0,0,1,0,off-topic,0,109,3166,@JaimeMaser @howie_berman I love reading your tweets in French.
2552,1434450616257,1,0,1,0,on-topic,1,117,3167,Get home early fokes. Transit stops at 7pm tonight. No school tomorrow.
2553,1434450616258,0,0,1,0,off-topic,1,82,3168,@Gh0sTiE5 I expect a good part is :P
2554,1434450616259,1,0,1,0,on-topic,1,157,3169,@Scotte2hotte07: Shout out to Carlyle Court and my house for still staying strong #ay shout out to main st too!
2555,1434450616260,0,0,1,0,off-topic,1,130,3170,@gabriellefaithp ohhhh man we have to cook again! Remember we took pics of it lmao!!
2556,1434450616260,0,0,1,0,off-topic,0,143,3171,@Taaylorr_x3: I'm bored and there's nothing to do . SOMEONE PLEASE HIT ME UP !y n you hardly talk
2557,1434450616261,1,0,1,0,on-topic,1,130,3172,@derlum it's gotten quiet here again. Everything below 34th st is outta power though
2558,1434450616262,0,0,1,0,off-topic,1,89,3173,@tylerdigiovanni I see her naked every day.
2559,1434450616263,0,0,1,0,off-topic,1,105,3174,@SharmishthaaT ah, I thought you were in NY for some reason
2560,1434450616264,1,0,1,0,on-topic,1,146,3175,Is it wrong to hope we lose power so @ThomasTheBoxer stops playing video games? #geek #addict #Sandy
2561,1434450616265,0,0,1,0,off-topic,1,84,3176,@MrImNotShit_Yet I think it's cute lol
2562,1434450616266,0,0,1,0,off-topic,1,128,3177,@travelingstogie @jyow617 @BarristerCigars on 22 in Union is but I can't get there
2563,1434450616266,1,0,1,0,on-topic,0,153,3178,Has Bloomberg revealed where the ark is leaving from? And who's allowed on? Hopefully no women or children.
2564,1434450616267,0,1,1,0,off-topic,1,107,3179,if I have volleyball on Wednesday I'm gonna be sooooo pissed.
2565,1434450616267,0,0,1,0,off-topic,0,95,3180,Halloween on Saturday ? That's fucking retarted .
2566,1434450616268,1,0,1,0,on-topic,1,140,3181,all quiet on the Chelsea front. #hurricanesandy @ Karen's Den of Iniquity http://t.co/waBE5mi5
2567,1434450616269,0,0,1,0,off-topic,1,174,3182,We will be CLOSED tomorrow and hopefully shipping can resume on Wednesday. Hoping the flood waters miss us. Stay safe neighbors!
2568,1434450616269,1,1,1,1,on-topic,0,139,3183,The world just another swimming pool thanks to Mother Nature  @ My Place http://t.co/RrK88cQE
2569,1434450616269,1,0,1,0,on-topic,0,110,3184,Dear New Yorkers, A hurricane is not the apocalypse. Thanks, Me.
2570,1434450616270,0,0,1,0,off-topic,1,130,3185,@ejayzo if your lap top has betters charge it in there! You need your phone more lol
2571,1434450616271,0,1,1,0,off-topic,1,80,3186,I wish I knew than what I know now
2572,1434450616272,0,0,1,0,off-topic,1,84,3187,The weakness I have for those 3 words.
2573,1434450616272,0,0,1,0,off-topic,0,66,3188,Look Mama we made it
2574,1434450616273,0,0,1,0,off-topic,1,147,3189,@senoritauniqua_ Niggah please my procrastination is so bad, I hand in assignments AFTER the due date
2575,1434450616274,0,0,1,0,off-topic,1,139,3190,@LCrampsie http://t.co/8Aes95On maybe that will help? News is saying a few days unfortunately
2576,1434450616274,0,0,1,0,off-topic,0,91,3191,I am still feeling hated http://t.co/CnZMIdf8
2577,1434450616275,0,0,1,0,off-topic,1,103,3192,@LeoSorcher haha i could imagine u were prob flipping out
2578,1434450616276,0,0,1,0,off-topic,1,95,3193,@nicolezee exactly. I'm living the life right mow
2579,1434450616277,0,0,1,0,off-topic,1,100,3194,@Nic0LeSaNgill0o: You'll all be spewin fuck it #imsick
2580,1434450616278,0,0,1,0,off-topic,1,127,3195,@RobWipfler59 there the jets. The giants are loosing to tony romo and the cowboys
2581,1434450616278,0,0,1,0,off-topic,0,133,3196,Legit, Blair Waldorf was such a cunt character. I remember wanting to be her so bad lol
2582,1434450616279,0,0,1,0,off-topic,1,176,3197,@Prodr1977 we did for each other but you forgot how I did for you along the way and I really don't need anything even if I'm broke
2583,1434450616279,0,0,1,0,off-topic,0,72,3198,#NW Not Another Teen Movie
2584,1434450616281,1,0,1,0,on-topic,2,117,3199,Hihihi this guy instead of evacuating he wants to see mother nature lol
2585,1434450616284,0,0,1,0,off-topic,3,106,3200,My dolphins are Sanduskying the fucking jets bunch of scrubs
2586,1434450616288,1,0,1,0,on-topic,4,113,3201,Pasta Carbonara and a glass of vino for dinner!#HurricaneSandynight
2587,1434450616291,1,0,1,0,on-topic,3,108,3202,Only thing I'm worried about now is getting fat #Sandyproblems
2588,1434450616294,0,0,1,0,off-topic,3,100,3203,Mike betch  what you doing in your neck of the woods ?
2589,1434450616299,0,0,1,0,off-topic,5,67,3204,@BBRENMAR I see u boo
2590,1434450616306,0,1,1,0,off-topic,7,122,3205,@_madumwizel lmao but what am I going to do without my phone?! I'll go crazy
2591,1434450616308,1,0,1,0,on-topic,2,98,3206,High tide schedule for New York http://t.co/3qMCsdmC
2592,1434450616311,0,1,1,0,off-topic,3,133,3207,@OfficialKat I hope they now realise your choice to act wasn't the worst decision ever.
2593,1434450616312,0,0,1,0,off-topic,1,76,3208,Mm , well that's cute to see .
2594,1434450616313,0,0,1,0,off-topic,1,122,3209,Awww he loves me  , sent this yesterday . My first love http://t.co/zffdbnXA
2595,1434450616314,0,0,1,0,off-topic,1,96,3210,I'm at Equinox (New York, NY) http://t.co/ASaqY3ho
2596,1434450616315,0,1,1,0,off-topic,1,97,3211,Just posted a photo @ Verb Caf http://t.co/EY0EkMG8
2597,1434450616316,0,0,1,0,off-topic,1,65,3212,Tony Romo Is A HOMO
2598,1434450616318,1,0,1,0,on-topic,2,164,3213,I wish I had someone to cuddle with during the storm... My bed is freezing and this wind is scary! #SingleGirlProblems
2599,1434450616318,0,1,1,0,off-topic,0,175,3214,Lights were just too good.. #justice #nyc #lights #electro #house #music #techno #dis @ Hammerstein Ballroom http://t.co/yDGElnI8
2600,1434450616318,0,0,1,0,off-topic,0,73,3215,Are there any cabs driving?
2601,1434450616319,0,0,1,0,off-topic,1,113,3216,@__Ranz: High five to Sprint for the service. High five to AT&amp;T
2602,1434450616320,0,0,1,0,off-topic,1,80,3217,They closed every movie theater :!
2603,1434450616322,0,1,1,0,off-topic,2,122,3218,@RussRB thanks! Just called but they're only open Tuesday- Friday 11 to 4...
2604,1434450616322,0,0,1,0,off-topic,0,93,3219,Yo STJ let's get that cancellation for tomorrow
2605,1434450616324,1,0,1,0,on-topic,2,113,3220,I'm praying for those stuck and stranded without power. Love y'all.
2606,1434450616325,0,1,1,0,off-topic,1,136,3221,@melanie_stamey ur Gunna think I suck .... Let's just say I missed my pr by 45 seconds....
2607,1434450616325,1,1,1,1,on-topic,0,81,3222,The wind is picking up now in bklyn
2608,1434450616326,0,1,1,0,off-topic,1,84,3223,my dad is going to give Clint a tattoo
2609,1434450616329,0,0,1,0,off-topic,3,67,3224,I hate my drunk self.
2610,1434450616333,0,0,1,0,off-topic,4,124,3225,Police tellin me to stay indoors... Got out and did the dougie ... Like a boss
2611,1434450616334,0,0,1,0,off-topic,1,88,3226,@JessMarie_85 thanks. I'm doing my best :)
2612,1434450616336,0,0,1,0,off-topic,2,86,3227,I don't read the script, script reads me
2613,1434450616337,0,0,1,0,off-topic,1,93,3228,If PC has school we will definitely have school
2614,1434450616339,0,0,1,0,off-topic,2,104,3229,He said I really want to be wit u  I jus LAUGHED  lmaooo !
2615,1434450616341,1,0,1,0,on-topic,2,98,3230,Hoes ain't gone be hoes no more just call them Sandy
2616,1434450616342,0,0,1,0,off-topic,1,96,3231,I'm at Rico Rico (Hudson, NJ) http://t.co/6yqxeUrt
2617,1434450616343,0,0,1,0,off-topic,1,76,3232,A niggah surfing he extra wavy
2618,1434450616344,0,0,1,0,off-topic,1,87,3233,@NOFcks_Givn WTF why everybody say that ?
2619,1434450616346,0,1,1,0,off-topic,2,109,3234,Saying what but then one second later realizing what they said.
2620,1434450616348,0,0,1,0,off-topic,2,137,3235,@aslanatay miss you too Pato!! I need to approve any baby names before future's are ruined!
2621,1434450616350,0,1,1,0,off-topic,2,172,3236,#GottaAceMySATexam : GOODNESS We wish our girl had stumbled upon that previously http://t.co/TZCaswGH you better get it now...
2622,1434450616350,0,0,1,0,off-topic,0,149,3237,I rather be alone then be with someone who do not care about how i feel but want me to care bout them .
2623,1434450616351,1,0,1,0,on-topic,1,168,3238,Went outside to get my mail. #Cabinfever (@ Frankenstorm Apocalypse - Hurricane Sandy w/ 2969 others) http://t.co/hUCGlOlZ
2624,1434450616351,0,0,1,0,off-topic,0,108,3239,Ma Brother Think This Stump Tha Fxckn Yard He Needa Sit Tf Dwn
2625,1434450616352,0,0,1,0,off-topic,1,183,3240,#GottaAceMySATexam : !!! wish we students managed to get this previously http://t.co/2EU1qfeq hurry before its unavailable Notre Dame bay
2626,1434450616352,1,1,1,1,on-topic,0,166,3241,I'm going to call this one infection Irene and hope it takes after that let down and not like this upcoming sandy bitch.
2627,1434450616353,0,0,1,0,off-topic,1,113,3242,@KylerXAsh was it removed? It says not found when i click the link.
2628,1434450616353,1,0,1,0,on-topic,0,103,3243,Not for nothin' the saying, calm before the storm. #sandy
2629,1434450616354,0,0,1,0,off-topic,1,82,3244,@Danyellium im too good for the team
2630,1434450616355,0,0,1,0,off-topic,1,100,3245,@amandaabloss i refuse to ever watch that movie again.
2631,1434450616356,1,0,1,0,on-topic,1,163,3246,The houses closer to the beach were completely destroyed by the surge. #Sandy @ Belle Harbor, NY http://t.co/WFd3i0x7
2632,1434450616357,0,0,1,0,off-topic,1,103,3247,I'm at Central Market (New York, NY) http://t.co/ZJweAtds
2633,1434450616358,0,0,1,0,off-topic,1,116,3248,@JimmyVanBramer jimmy I'm sooo proud of the good work you do stay safe
2634,1434450616359,0,0,1,0,off-topic,1,173,3249,@KaileyMcCaffery idk if I can anymore ! I'm suppose to sleep at Tori's since she lives down the road and I'm already with her !
2635,1434450616359,0,0,1,0,off-topic,0,86,3250,No classes Monday or Tuesday?? #fuckyeah
2636,1434450616361,1,0,1,0,on-topic,2,134,3251,Warning for people in the pink area...aka: everyone. @ Inside Sandy http://t.co/wMk039Jy
2637,1434450616361,0,0,1,0,off-topic,0,112,3252,@ElBloombito  What, there aren't any deaf Spanish speaking people?
2638,1434450616362,0,0,1,0,off-topic,1,102,3253,The wind's handiwork: @ Grace Court http://t.co/X0GK10rP
2639,1434450616363,0,0,1,0,off-topic,1,101,3254,.@realDonaldTrump do you build vacuums to then live in?
2640,1434450616366,1,0,1,0,on-topic,3,110,3255,@apiowinnie the #hurricane means no one travels till it settles.
2641,1434450616367,0,0,1,0,off-topic,1,82,3256,@Sunnnay_ make it into a tree house!
2642,1434450616368,0,0,1,0,off-topic,1,102,3257,Sweet Juice @ Calico Jack's Cantina http://t.co/qsqkkLak
2643,1434450616369,0,1,1,0,off-topic,1,116,3258,@DavickaTC2 definitely! pretty happy with myself right now! :)) #Sandy
2644,1434450616370,0,0,1,0,off-topic,1,142,3259,@I_AM_HOTROD hey if u got a kik kik me dlrican....ill tell u all bout them...can i plz get a s/o
2645,1434450616370,1,0,1,0,on-topic,0,184,3260,tho #hurricane #sandy en route #easternseaboard life goest on in #gotham  just did gymoclock annnd still #hurtslikehell ab bench crunch! x
2646,1434450616370,0,0,1,0,off-topic,0,181,3261,@Maa_Ngoo: Wen stuff start really gettin out ov hand outside thts wen my brotha and I are makn our move outside lol cnt waityo I'm down
2647,1434450616371,0,1,1,0,off-topic,1,79,3262,This music is saving me right now
2648,1434450616373,0,0,1,0,off-topic,2,175,3263,Search and rescue / Recovery team. Aviation task force in full effect! NJ national g @ National Guard Armory http://t.co/dJmMeM44
2649,1434450616373,0,0,1,0,off-topic,0,75,3264,Anybody got pralems see me'!!
2650,1434450616374,0,0,1,0,off-topic,1,134,3339,I guess I'm a little lame for wearing a skull print blouse on Halloweekend but whatever.
2651,1434450616374,0,1,1,0,off-topic,0,154,3340,My shore house is probably out floating in the Atlantic Ocean right now. Gonna have to go fish that shit out
2652,1434450616375,1,1,1,1,on-topic,1,175,3341,@Karaoswinn Should be coming home tomorrow night! And it's just windy and rainy! It hasn't hit NYC yet, so that'll be interesting
2653,1434450616375,0,0,1,0,off-topic,0,88,3342,OMG those people do not want to sleep shit
2654,1434450616375,0,0,1,0,off-topic,0,116,3343,@YoungREEK732: tell em ima @Squeeze_Blazzin till they free pretty piru
2655,1434450616376,1,0,1,0,on-topic,1,157,3344,The wind was so strong that the sign for the local business broke into half! #sandyonfox   http://t.co/cbD0S0UM
2656,1434450616376,1,0,1,0,on-topic,0,175,3345,Sandy, its time for me to hit the gym. Since you lock me in #sandy #hurricane #hurricanesandy @ The Magellan http://t.co/UUXXnGIp
2657,1434450616376,0,0,1,0,off-topic,0,130,3346,Exploring all the damage with @itismonicaa @taylor_finley12 @RonnieRaymond5 @heyhuds
2658,1434450616377,0,1,1,0,off-topic,1,93,3347,@Netty_Harris I Been aigh u comin down der soon
2659,1434450616378,0,0,1,0,off-topic,1,84,3348,@MyRoseFragrance she's from toronto :D
2660,1434450616378,1,0,1,0,on-topic,0,174,3349,Oh my god! @anildash: HOLY CRAP. Video of the ConEd power plant blowing out: http://t.co/iyGlAXVZ (starts at 0:16) via @JukayHsu
2661,1434450616379,0,0,1,0,off-topic,1,133,3350,Where is Atlantic City on the map? Play the game at http://t.co/VV8CDNJJ #Atlantic City
2662,1434450616379,0,0,1,0,off-topic,0,123,3351,@dol4rob Ohhhh Yeaaa.. and then we can have #Thunderbuddies .. I got my pick!
2663,1434450616380,0,1,1,0,off-topic,1,63,3352,I just wanna slay
2664,1434450616381,0,0,1,0,off-topic,1,86,3353,You can't have the best of both worlds!!
2665,1434450616382,0,0,1,0,off-topic,1,152,3354,@Spencealot @breakthrough513 you are bad and part of the problem, then. (Says no reasonable person, ever.)
2666,1434450616382,1,0,1,0,on-topic,0,175,3355,#hipsters need their craft #frenchpress coffee. #Sandy #Frankenstorm 35-45mph wind gusts at time o @ Variety http://t.co/VWwNjTOv
2667,1434450616383,0,0,1,0,off-topic,1,105,3356,Props to the bike delivery guys for still doing their thang
2668,1434450616384,1,0,1,0,on-topic,1,97,3357,LMFAO this nigga David stern said Hurricane Katrina
2669,1434450616384,0,0,1,0,off-topic,0,95,3358,@Prodr1977  fuck me PEDRO u kno you love my pussy
2670,1434450616385,0,0,1,0,off-topic,1,162,3359,Times Square is dead, and I am totally feeling like Will Smith in I Am Legend only without those vampire zombie guys
2671,1434450616386,0,0,1,0,off-topic,1,72,3360,liquor store cuz I'm bored
2672,1434450616387,0,0,1,0,off-topic,1,113,3361,I've never been so happy for a phone ca in my entire life I promise
2673,1434450616388,0,0,1,0,off-topic,1,93,3362,@_Reggiefor3_ lmao what some nasty ass henny?!!
2674,1434450616389,0,0,1,0,off-topic,1,131,3363,About to get some candy with my aunt in this weather since there is no type of food .
2675,1434450616390,0,0,1,0,off-topic,1,111,3364,I'm at 7-Eleven (Rego Park, New York) [pic]: http://t.co/9gPMRu6G
2676,1434450616390,0,0,1,0,off-topic,0,139,3365,@fateiswhatumake your damn right Erik...totally forgot about that -.- I miss google maps too.
2677,1434450616391,0,0,1,0,off-topic,1,100,3366,@goldenyardy Things are ok n praying it stays that way
2678,1434450616392,0,0,1,0,off-topic,1,171,3367,When will people learn that Lucas will on everything you love for ? Episode 1. Kingdom of the Crystal Skull. You were warned.
2679,1434450616392,1,0,1,0,on-topic,0,136,3368,@missjuj RT @SoozOnSports: Christie: decision to stay on the barrier islands was a bad one
2680,1434450616393,0,0,1,0,off-topic,1,103,3369,So when I'm not on campus i get the phone calls tisk tisk
2681,1434450616393,0,0,1,0,off-topic,0,179,3370,I don't know if this message could have been more brief and to the point. (with Mary at @frankenstorm_ny) [pic]  http://t.co/5l0fNWIm
2682,1434450616394,0,0,1,0,off-topic,1,162,3371,this one goes out to all my #snowflakes @stefalane @kaylaswall @sam_francisco  @ Fairway Market http://t.co/f1fdmq5G
2683,1434450616394,1,0,1,0,on-topic,0,109,3372,Sandy turned out the lights....  @ Chelsea http://t.co/IQ43LgxV
2684,1434450616397,1,0,1,0,on-topic,3,104,3373,Mid Hurricane roof walk @ A&amp;C Apt http://t.co/21ZDE3cs
2685,1434450616398,0,0,1,0,off-topic,1,128,3374,Dinner time (@ The Breslin Bar &amp; Dining Room w/ 5 others) http://t.co/O7tutakO
2686,1434450616399,0,1,1,0,off-topic,1,129,3375,@Cminee609 word man thats all i care about its just sad how fucked up the island is
2687,1434450616400,1,0,1,0,on-topic,1,143,3376,Hopefully this is like hurricane Katrina. I'm looking to loot quick chek, shoprite, and Spencer's
2688,1434450616401,1,0,1,0,on-topic,1,87,3377,Kinda scared for this hurricane &gt;.&lt;
2689,1434450616402,0,1,1,0,off-topic,1,95,3378,They finally turn on the generatror now lessggooo
2690,1434450616404,1,0,1,0,on-topic,2,180,3379,sandy is a hurricane/ blizzard, there's tsunami warnings on west coast, and there was tornados in NYC a month ago #thedayaftertomorrow
2691,1434450616405,0,1,1,0,off-topic,1,124,3380,@justinbieber thank you justin! its insane up here in new york! wish me luck:*
2692,1434450616406,0,0,1,0,off-topic,1,80,3381,Saying goodbye will never get easy
2693,1434450616408,1,0,1,0,on-topic,2,89,3382,So im scared. This weather is wild already.
2694,1434450616410,0,0,1,0,off-topic,2,90,3383,@nascarchick_3 ps: earnhardt fan i assume ;)
2695,1434450616413,0,0,1,0,off-topic,3,90,3384,These fuckers went out to eat without me -.-
2696,1434450616415,0,0,1,0,off-topic,2,90,3385,5th wheelin hard where's that fat bitch at?!
2697,1434450616417,0,0,1,0,off-topic,2,113,3386,I'm at Parkway Elementary School (Paramus, NJ) http://t.co/LaEeqAEq
2698,1434450616418,0,0,1,0,off-topic,1,166,3387,@holyshityouguys Christie and Cuomo have been WAYYYY better. Bloomberg was a clown leading up to this - downplaying, etc
2699,1434450616419,1,0,1,0,on-topic,1,114,3388,off on off on off on STOP FUCKING WITH MY MIND SANDY YOU CRAZY BITCH
2700,1434450616419,0,0,1,0,off-topic,0,151,3389,Gotta knock these 4 shows out but i am slightly under the weather. Only one voice can make my day better.
2701,1434450616420,0,0,1,0,off-topic,1,94,3390,So upset she wasnt albanian..she looked the part
2702,1434450616421,0,0,1,0,off-topic,1,166,3391,10 Super-Hypocritical CEOs Rigging The Election For Romney  And What To Do About It http://t.co/sF8NMVFZ via @AddInfoOrg
2703,1434450616422,1,0,1,0,on-topic,1,106,3392,How the fuckk do u have to gtg in the middle of a hurricane?
2704,1434450616424,0,0,1,0,off-topic,2,132,3393,Burn the flames... Higher and higher... @ The D'Agger Royale Lair http://t.co/5nhL65aw
2705,1434450616425,1,0,1,0,on-topic,1,115,3394,@NinaINLA yay!!! Okay! Hurricane sandy can't stop one of your classes
2706,1434450616427,0,0,1,0,off-topic,2,104,3395,@mattlanger do you exist I debated this with @finn tonight
2707,1434450616428,1,1,1,1,on-topic,1,111,3396,Gonna go check out this aftermath #Sandy n get some more supplies
2708,1434450616430,0,0,1,0,off-topic,2,79,3397,@Heaphy11893 u do it all the time
2709,1434450616434,1,0,1,0,on-topic,4,83,3398,The want us to evacuate Staten Island
2710,1434450616436,1,0,1,0,on-topic,2,171,3399,Well I guess it was a good thing I came in last night bc there would have been no way I could get back to the city if I didnt
2711,1434450616437,0,0,1,0,off-topic,1,107,3400,@Tease_Me21 nah yu said some rascist shit. Not even off that.
2712,1434450616439,0,0,1,0,off-topic,2,71,3401,@MsHKarma I love you too'
2713,1434450616441,1,0,1,0,on-topic,2,88,3402,I hope everyone stays safe in tthe storm .
2714,1434450616442,0,1,1,0,off-topic,1,149,3403,now that it officially has affected me I'm going in my closer and going to bed cause this fucking blows
2715,1434450616443,1,0,1,0,on-topic,1,182,3404,One thing is watching it all from the news, and another thing is living through it and wondering what the hell is happening next. #Sandy
2716,1434450616444,0,0,1,0,off-topic,1,140,3405,Gooooood Morning New York City! (@ Z Hotel New York - Rooftop Bar/Lounge) http://t.co/qFL3URbc
2717,1434450616444,0,0,1,0,off-topic,0,145,3406,Winging it with Liz and Jordan. #TuesdayTradition (@ The Habitat w/ 10 others) http://t.co/qoxeCMvs
2718,1434450616445,0,0,1,0,off-topic,1,163,3407,Apple Stock Fall? Assigned Customer Relations Rep VM FULL - Applecare Fail-2012 MBP: Please Help http://t.co/cLTrehIT
2719,1434450616446,1,0,1,0,on-topic,1,115,3408,NYTimes: Storm Gains Strength as It Churns North http://t.co/RrHORPNK
2720,1434450616448,1,1,1,1,on-topic,2,143,3409,@kat_camps noo the storm is supposed to get realllly bad tonight, this is just like the beginning
2721,1434450616449,0,0,1,0,off-topic,1,82,3410,@MaryACJane dont be gassing me bby;D
2722,1434450616451,0,0,1,0,off-topic,2,99,3411,@RGaits313 if your out be careful officaaaaaa Richard
2723,1434450616454,0,0,1,0,off-topic,3,167,3412,My mom- that shirt isn't a good color on you it doesn't make you shine (wtf does that even mean?) me- Ryan makes me shine
2724,1434450616455,1,1,1,1,on-topic,1,120,3413,@AustinMahone I would live to go with you big there hurricane coming at me
2725,1434450616456,0,0,1,0,off-topic,1,111,3414,@ladygaga mother monster do you not care about ur nyc monsters :(
2726,1434450616464,1,1,1,1,on-topic,8,136,3415,@VZWnews: Apps to Help Prepare for Hurricane Sandy (update) @VZWNews  http://t.co/TG02amse
2727,1434450616465,0,0,1,0,off-topic,1,113,3416,The caption is in the picture.  @ Mirage Diner http://t.co/jcnEN8O0
2728,1434450616466,0,0,1,0,off-topic,1,111,3417,@daniela_corb: I really hope McDonald's is open we think the same
2729,1434450616467,0,1,1,0,off-topic,1,135,3418,Omg when my lights go off its going to be sooooo funny !!!!! Im with my whole family yo .
2730,1434450616468,0,0,1,0,off-topic,1,105,3419,@mayawhite_ Shining....hmm suddenly have craving for rum...
2731,1434450616469,0,0,1,0,off-topic,1,85,3420,My #LRT ! I thought I was the only on
2732,1434450616471,0,0,1,0,off-topic,2,118,3421,Dozens of ConEd trucks at the ready in Union Square http://t.co/RIWZ2xcX
2733,1434450616472,0,0,1,0,off-topic,1,82,3422,ugh. I hope you understand one day..
2734,1434450616474,0,0,1,0,off-topic,2,88,3423,@C_Castillo24 my messages didn't send babe
2735,1434450616476,0,0,1,0,off-topic,2,90,3424,@RonaKoka lmaoooooo  your tweets crack me up
2736,1434450616477,1,0,1,0,on-topic,1,86,3425,I need a cuddle buddy through this storm
