1048,1434448544774,0,0,1,0,off-topic,1,121,1744,I'm at Halloween Adventure (New York, NY) w/ 24 others http://t.co/sp4AC9hY
1049,1434448544775,1,1,1,1,on-topic,1,85,1745,i just pray that the power dnt go out .
1050,1434448544775,1,1,1,1,on-topic,0,163,1771,Just got back from the hospital. Signs to George Washington Bridge warning that the bridge may be closed at any time.
1051,1434448544775,1,0,1,0,on-topic,0,155,1772,RT @aegies: worth repeating that mitt romney is not in favor of federal disaster relief: http://t.co/8UjbqDNq
1052,1434448544775,1,0,1,0,on-topic,0,96,1776,Its kind of freaky  Plz be gentle  #HurricaneSandy
1053,1434448544776,1,0,1,0,on-topic,1,129,1787,Like if you wanna go out in the storm, have fun but my ass is staying in the house.
1054,1434448544776,1,0,1,0,on-topic,0,132,1789,Thanks for the heads up, Apple! #Hurricane #Sandy  @ Williamsburg http://t.co/bjB1f6j6
1055,1434448544776,0,0,1,0,off-topic,0,116,1792,There's something missing .. I can deadass feel it like on some shit .
1056,1434448544777,1,0,1,0,on-topic,1,158,1800,Running away from Frankenstorm #Sandy with @asudano  @ NJ Transit - Northeast Corridor Line http://t.co/9YszMRG6
1057,1434448544777,0,0,1,0,off-topic,0,100,1808,newark will always Stay strong  that's how we're built
1058,1434448544777,0,0,1,0,off-topic,0,185,1817,@MFBrooklyn does the show stream online later tonight? I'm at my buddies here in Brooklyn &amp; he's a best-selling author with no tv haha.
1059,1434448544964,0,0,1,0,off-topic,187,133,1827,Is Einstein his first name or his last name? - @rachelbrit #hurricanetalk #ganghamstyle
1060,1434448544966,1,0,1,0,on-topic,2,151,1829,look at me do social media! (@ Frankenstorm Apocalypse - Hurricane Sandy w/ @saadiq) http://t.co/RLSd2blA
1061,1434448544967,1,0,1,0,on-topic,1,174,1832,Meteorologists need to take a more badass approach on  how they name storms. Hellfire or Bitch with Balls seem more appropriate.
1062,1434448544968,0,0,1,0,off-topic,1,83,1838,Good night all! And please stay safe!
1063,1434448544969,0,0,1,0,off-topic,1,184,1769,@JohannaFrelin @jocke nothing to talk about without content though. Better to not crown one or the other but say they're both feudal lords
1064,1434448544969,0,0,1,0,off-topic,0,97,1770,Well since I have no power I guess it's nap time :)
1065,1434448544969,1,0,1,0,on-topic,0,138,1773,Scene at 5th between 90th and 91st. @ Fifth Ave. between 90th and 91st. http://t.co/vqlYuso1
1066,1434448544970,0,0,1,0,off-topic,1,114,1774,First victim  as I drive around ... @ Todt Hill http://t.co/11aomp5l
1067,1434448544970,0,1,1,0,off-topic,0,122,1775,@justinbieber follow me and i will give you a cookie then it will be fun day
1068,1434448544970,0,0,1,0,off-topic,0,135,1777,@Dirty___Mike @Ted_is_real actually found a place around Fordham that is still delivering
1069,1434448544970,0,0,1,0,off-topic,0,97,1778,Keep it 100 babe we both know I'm not the only one.
1070,1434448545150,0,1,1,0,off-topic,180,102,1779,Just posted a photo @ Millburn Deli http://t.co/eBOhFbnq
1071,1434448545153,0,0,1,0,off-topic,3,107,1780,@Nicpetrone the captain is STILL sailing around in my stomach
1072,1434448545155,1,0,1,0,on-topic,2,185,1781,None of the street lights work, cars are abandoned or driving as they please.... lookin like the apocolypse!!!! #Sandy #2012 #WeGonnnDiiiie
1073,1434448545156,0,0,1,0,off-topic,1,142,1782,This one still has regular filling up headed home (@ Wawa Food Market #937) http://t.co/ybs2Resr
1074,1434448545157,0,0,1,0,off-topic,1,177,1783,@TheBroadwayHat Good in the Rosebank section of Staten Island, I know other parts are under water on the Island. Hope you are well!
1075,1434448545158,0,0,1,0,off-topic,1,168,1784,On the bright side , happy birthday to my sissy @SPtheGhost29 . 21 oh helllllls yaaa ! Love u ma ! :) http://t.co/c9eijW4g
1076,1434448545159,0,1,1,0,off-topic,1,92,1785,This fucker just overpowered that FFFFFUCK #FB
1077,1434448545163,0,0,1,0,off-topic,4,160,1786,#SATstudyTime .. FINALLY!! We wish we had found that before http://t.co/yMJmibVt ya better get this Soul Plane gqb
1078,1434448545167,1,0,1,0,on-topic,4,161,1788,RT @Pervaizistan: Bloomberg: Signing an executive order mandating evacuation of low lying areas, zone A. #sandy #fb
1079,1434448545168,0,0,1,0,off-topic,1,107,1790,I'm at Fifth Avenue Diner (Brooklyn, NY) http://t.co/b5gEDwSp
1080,1434448545336,1,0,1,0,on-topic,168,118,1791,We'll survive..! #nyc #sandy @ New York Loft Hostel http://t.co/9kGhSpUD
1081,1434448545337,0,0,1,0,off-topic,1,136,1793,@TheMachoBrand: @EastHarlemCafe keep up the good work 1 of these days Ill pay a visit . :)
1082,1434448545337,1,0,1,0,on-topic,0,141,1794,River view #nyc #sandy #landscape #lic @ Riverview Restaurant &amp; Lounge http://t.co/4aMaO0tj
1083,1434448545337,1,1,1,1,on-topic,0,103,1795,I'm hearing tree branches being torn off outside. Wicked!
1084,1434448545338,0,1,1,0,off-topic,1,107,1796,@BodyBldrMarcus I know that. It's just old to see that though
1085,1434448545338,1,0,1,0,on-topic,0,118,1797,A couple of #sandy shots from Bedford Ave (Nth 3rd) http://t.co/evIgkn28
1086,1434448545339,0,0,1,0,off-topic,1,119,1798,I'm at Vincent's Trattoria (Washington Township, NJ) http://t.co/fcPdbalj
1087,1434448545339,0,0,1,0,off-topic,0,171,1799,#SATstudyTime : GOODNESS We wish my girls found this previously http://t.co/rhmIgcET ya better get this #RiseOfTheZombies guu
1088,1434448545339,0,0,1,0,off-topic,0,128,1801,@ArumontWolf -hugs- sounds like a wolf needs a hot shower and wolfnoms #wolfthings
1089,1434448545339,1,0,1,0,on-topic,0,91,1802,@Spiniello96 is 32nd street area out of power
1090,1434448545340,0,0,1,0,off-topic,1,88,1803,@sal_bravo_ but I don't have a ps3 :( lmao
1091,1434448545340,0,0,1,0,off-topic,0,171,1804,#SATstudyTime : GOODNESS We wish my girls found this previously http://t.co/vXLm9pTW ya better get this #RiseOfTheZombies guu
1092,1434448545524,0,0,1,0,off-topic,184,93,1805,@ZachSmith7 boardwalk is battened down, so cool
1093,1434448545524,0,0,1,0,off-topic,0,101,1806,@CheckThisKidOut in jersey bruh. Its looking real crazy
1094,1434448545525,0,0,1,0,off-topic,1,76,1807,@lydsthekid where do you live?
1095,1434448545525,0,0,1,0,off-topic,0,81,1809,What is newjersey turning into ? ):
1096,1434448545526,0,0,1,0,off-topic,1,91,1810,Who wants to go swimming in Revel's new pool?
1097,1434448545526,0,0,1,0,off-topic,0,113,1811,@FemaleTurnOns: When they pick you up and throw you down on the bed
1098,1434448545527,0,1,1,0,off-topic,1,107,1812,Bout dis money fukk the beef...no response just a silent hill
1099,1434448545527,0,1,1,0,off-topic,0,103,1813,@FlanneryRollins just finished. What a crazy concept jeez
1100,1434448545527,1,0,1,0,on-topic,0,137,1841,Last night in downtown, MTA flood protection for #sandy  @ 200 West St http://t.co/x7KPC0uV
1101,1434448545528,1,0,1,0,on-topic,1,113,1843,McDonald park (off S) is filled w con Edison emergency trucks.  #fb
1102,1434448545528,1,0,1,0,on-topic,0,90,1854,Can't wait to explore the aftermath tomorrow
1103,1434448545529,1,0,1,0,on-topic,1,169,1859,Hurricane Sandy approacheth. The Colgate Clock is probably not going to make it.  @ Liberty State Park http://t.co/I64vmdWw
1104,1434448545529,1,0,1,0,on-topic,0,185,1866,Bsides the tree on our house, my family and I have stayed safe and lucky w/ power. Keeping every victim of this storm in my thoughts #sandy
1105,1434448545712,1,0,1,0,on-topic,183,103,1886,This is a mockery with this storm ...everyone be safe !!!
1106,1434448545712,1,0,1,0,on-topic,0,95,1893,Why is hurricane sandy so sketch  #scared #hiding
1107,1434448545713,1,0,1,0,on-topic,1,130,1894,@Prodr1977 LOVE IZ STRONG IT OVER COMES EVEN SANDY (THA STORM ) http://t.co/yottRXD7
1108,1434448545714,1,0,1,0,on-topic,1,108,1903,so our beach house in LBI is under water #fuck #HurricaneSandy
1109,1434448545716,1,0,1,0,on-topic,2,100,1905,My tl about the hurricane &lt;&lt;&lt;&lt;&lt;&lt;&lt;
1110,1434448545716,1,0,1,0,on-topic,0,130,1911,@Emmanuel_IsDead: Evacuation by 8:00 ? /well, packing time. Who has to evacuate ?!?!
1111,1434448545717,0,0,1,0,off-topic,1,114,1839,I'm at Chodae Presbyterian Church (Norwood, NJ) http://t.co/RVwiyJyK
1112,1434448545717,0,0,1,0,off-topic,0,68,1840,You gotta work for it.
1113,1434448545718,0,0,1,0,off-topic,1,127,1842,Today's outfit                     Don't mind my pillow pet  http://t.co/t0MMi04W
1114,1434448545718,0,0,1,0,off-topic,0,101,1844,Turning the fuck up tonight :) my weekend is not over !
1115,1434448545719,0,0,1,0,off-topic,1,129,1845,Fuck come on!!!!! I need a new car! Will this damn tree fall over already &gt;.&gt;
1116,1434448545719,0,0,1,0,off-topic,0,101,1846,Got my swimming shorts with me. Who has a boogie board?
1117,1434448545719,0,0,1,0,off-topic,0,83,1847,Halloween Really In 2 More Days ! O.o
1118,1434448545899,0,1,1,0,off-topic,180,140,1848,My sister was playing Skinny Love for my dad and he asks...what happens when you gain weight ?
1119,1434448545899,0,0,1,0,off-topic,0,99,1849,Classes canceled Monday and Tuesday #fordhampleasures
1120,1434448545899,0,0,1,0,off-topic,0,107,1850,I like Taylor Swifts curly hair more then her new hair style.
1121,1434448545900,0,0,1,0,off-topic,1,88,1851,@NourhanHeikal look at a tweet I retweeted
1122,1434448545900,0,0,1,0,off-topic,0,119,1852,I'm at The Allendale Bar &amp; Grill (Allendale, NJ) http://t.co/pdWIpmvq
1123,1434448545901,0,0,1,0,off-topic,1,146,1853,Thomas Schutte Loves Brooklyn http://t.co/lyN6YxKf Most read by neighbors in #LowerEastSide #NewYork
1124,1434448545901,0,0,1,0,off-topic,0,175,1855,Brunch y'all-- I hear the rosemary mint pancakes are the bomb diggity. #instafood  #brunchlove #bu @ Mazelle http://t.co/1xRzGqna
1125,1434448545901,0,0,1,0,off-topic,0,108,1856,@pourLeternite okay I will &amp; yea i know cici is mad scared
1126,1434448545902,0,0,1,0,off-topic,1,180,1857,@Prodr1977 I have my X husband full custody of my sons , Xavier he will be fine and the baby well like I said he's being release to me
1127,1434448545902,0,0,1,0,off-topic,0,85,1858,@naiomiDEEZ ill talk to my manager girl
1128,1434448545903,0,0,1,0,off-topic,1,106,1860,Won't have to evac until 8:30 tomorrow. Mafia until we dieee
1129,1434448545903,0,0,1,0,off-topic,0,101,1861,Only thing left in the house is Halloween candy #ohdarn
1130,1434448546087,0,0,1,0,off-topic,184,95,1862,Hooray for vehicle phone chargers. #suckit #sandy
1131,1434448546088,0,0,1,0,off-topic,1,106,1863,@taylloorx: When guys get straight to the point &gt;&gt;&gt;
1132,1434448546089,0,0,1,0,off-topic,1,121,1864,@BeckyPaulson2 @mittromney Romney is 'wealth extractor' not a 'job creator'
1133,1434448546089,0,0,1,0,off-topic,0,105,1865,@hehecore it doesn't leave your hair smelling like shampoo?
1134,1434448546090,1,0,1,0,on-topic,1,132,1867,all of NYC lost power except the Empire State Building, Times Square, and apartment 5E
1135,1434448546090,1,0,1,0,on-topic,0,104,1868,@Jaddy_Jahh , , loll the wind might blow us away but okaay
1136,1434448546090,0,0,1,0,off-topic,0,89,1869,Happy I saw @rich_wave23 while I was @ work
1137,1434448546091,0,0,1,0,off-topic,1,106,1870,@Ztaz_ LMFAO and all of the wind and shit is from their ship
1138,1434448546091,0,0,1,0,off-topic,0,99,1871,@mmallqui94 I didn't even notice she jumped in! lmfao
1139,1434448546092,0,1,1,0,off-topic,1,86,1872,I wish Cupid could help me out right now
1140,1434448546092,0,0,1,0,off-topic,0,120,1873,@_ThickandSassy. So u styling the kid. Ima die of hunger messing with u eb
1141,1434448546093,0,0,1,0,off-topic,1,80,1874,@tnfff same I wish I never took it
1142,1434448546093,0,0,1,0,off-topic,0,86,1875,@seducedbyluke aw thank you so much&lt;3
1143,1434448546094,0,0,1,0,off-topic,1,95,1876,@mikaylasindel @alexalombardi97 fill this girl in
1144,1434448546273,0,0,1,0,off-topic,179,127,1877,Selling my nba 2k13 $50 looks brand new and works like brand new for the xbox360!
1145,1434448546274,0,1,1,0,off-topic,1,96,1878,Me and @mhogan_21 conversation right now #bffprobz
1146,1434448546274,0,0,1,0,off-topic,0,183,1879,@JaredLeto. Boy,they are ripping u a new asshole! for wearing that marine jacket.You better school them. Let them know it out of respect!
1147,1434448546274,0,0,1,0,off-topic,0,134,1880,Be back twitter, I'm bout to hop in the shower with a flashlight on http://t.co/cW2jLYML
1148,1434448546274,1,1,1,1,on-topic,0,133,1881,Sandy is blowing me so good. She might cancel school for Monday and Tuesday.   oh sandy
1149,1434448546275,0,0,1,0,off-topic,1,83,1882,@davon4L you two are so perfect &lt;3
1150,1434448546275,1,0,1,0,on-topic,0,181,1921,Summit's office of emergency management in high gear with new technology. Message of the day: Stay inside. Downed wires being reported.
1151,1434448546275,1,0,1,0,on-topic,0,75,1923,so about this Hurricane Sandy
1152,1434448546276,1,0,1,0,on-topic,1,173,1925,Thanks for cooking me dinner in the middle of a hurricane, babes. lgeorge12  @ 4 Washington Square Village http://t.co/ZXnTGUKA
1153,1434448546276,1,0,1,0,on-topic,0,119,1939,Does this look like a dog threatened by a hurricane? http://t.co/qMpj7UF0
1154,1434448546276,1,1,1,1,on-topic,0,186,1941,@styles_miracle niether can I!! I'm just stalking the hurricane Sandy to make sure I have no school tomorow so I can listen to little Things
1155,1434448546461,1,0,1,0,on-topic,185,160,1944,Hurricanes are named after women, Because they arrive wet and wild, and then leave with your house and car! #Truuu
1156,1434448546461,1,0,1,0,on-topic,0,181,1946,I was supposed to fly down from NYC for tonight's #MiamiHeat game, but Sandy had other plans. So take this, storm! http://t.co/rz5c9Mur
1157,1434448546461,1,0,1,0,on-topic,0,126,1952,I'm at Frankenstorm Apocalypse - Hurricane Sandy w/ @s_mojo http://t.co/71uhlbpw
1158,1434448546462,1,0,1,0,on-topic,1,98,1956,Governor Christie, we need you to eat the hurricane.
1159,1434448546462,1,1,1,1,on-topic,0,175,1957,Its flooding into the tunnel in lower manhattan.  #batterypark #batteryparktunnel #lowermanha @ Battery Park http://t.co/ELUGGGj0
1160,1434448546462,0,0,1,0,off-topic,0,111,1971,A tower of terror.  @ Rooftop 505 W.37th St. http://t.co/pUgv72oo
1161,1434448546463,1,0,1,0,on-topic,1,127,1974,LMAO RT @RacistJuan: Dominican grandmas think hurricanes are created by El Diablo
1162,1434448546463,1,1,1,1,on-topic,0,80,1975,5 deaths in NY so far due to Sandy
1163,1434448546464,1,0,1,0,on-topic,1,122,1912,Sandy is like a stripper she fucks us over and makes us spend a lot of money
1164,1434448546464,0,0,1,0,off-topic,0,90,1913,@lyndsaykutiak lmfao the picture of your mom
1165,1434448546465,0,0,1,0,off-topic,1,74,1914,by your side is where ill be
1166,1434448546465,0,0,1,0,off-topic,0,183,1915,@Nagler: So you know that building on 14th and 8th that lost its front wall? Someone somehow got video of the fall. https://t.co/nkrjSN37
1167,1434448546648,1,0,1,0,on-topic,183,75,1916,I really hope you're all ok!!
1168,1434448546649,0,0,1,0,off-topic,1,92,1917,Thunder dropped Harden for Martin. Interesting
1169,1434448546649,0,0,1,0,off-topic,0,154,1918,Upstate waterfall hike with @shannennorman. Such a perfect fall day.  @ Kaatskill Falls http://t.co/91vi3fmA
1170,1434448546650,0,0,1,0,off-topic,1,73,1919,Keep this pressure on #Gmen
1171,1434448546650,0,0,1,0,off-topic,0,80,1920,I wanna go to LBI and check it out
1172,1434448546651,0,0,1,0,off-topic,1,139,1922,@amanduhweavuh: Yeah, I like to fuck. I gotta fucking problem.there's nothing wrong with that
1173,1434448546651,0,0,1,0,off-topic,0,131,1924,It's killing me when northerners pronounce Norfolk wrong on air. Smh the L is silent.
1174,1434448546652,0,1,1,0,off-topic,1,176,1926,I just heard the power company shut off the power in Jersey they shut it off just in case what the f .. ?? I  hope that's not true
1175,1434448546652,0,0,1,0,off-topic,0,103,1927,@JusCallme_LOGAN who knows, he had a book bag on his back
1176,1434448546653,0,1,1,0,off-topic,1,121,1928,Internet, please don't go out. You're my only friend right now. :(   #Sandy
1177,1434448546653,0,0,1,0,off-topic,0,155,1929,They are in Full support of Breast Cancer Awareness month.. See the pink lights at night http://t.co/VBnp5sSi
1178,1434448546654,1,1,1,1,on-topic,1,107,1930,Welp - just lost the internets. Thankfully power is still on.
1179,1434448546836,1,1,1,1,on-topic,182,114,1931,My house has been shaking for 2 hours but this shit is getting worse
1180,1434448546837,0,0,1,0,off-topic,1,178,1932,.,. Hey!! Want to #win this handbag RT @mauricioshinepr and @ShineMediaPR #handbags #giveaway featuring @TRUVOW http://t.co/slWiyNvl
1181,1434448546837,0,0,1,0,off-topic,0,96,1933,It's impossible to lose you cause I never had you.
1182,1434448546838,0,0,1,0,off-topic,1,78,1934,If his arms were longer.... damn
1183,1434448546838,0,1,1,0,off-topic,0,94,1935,Knock off your hole right side now u all left!!!
1184,1434448546838,0,0,1,0,off-topic,0,105,1936,Woke up to mad sweet good morning text messages &gt;&gt; :)
1185,1434448546839,0,0,1,0,off-topic,1,168,1937,@whoisthisvin i know, but damn.. merck is off 1&amp;9. do they have boats to get them there?! and are you working today?!?
1186,1434448546845,1,0,1,0,on-topic,6,182,1938,to the people saying sucks to suck to those who have trees in their backyards or no power, you're an asshole and you're not funny #prick
1187,1434448546845,0,0,1,0,off-topic,0,171,1940,I feel bad for Kevin Durant. James Harden to Houston Rockets sounds like a good deal for both team. Surprising news tho. #nba
1188,1434448546845,0,0,1,0,off-topic,0,107,1942,#IWishMyCarHad a machine that will give me HJ's while I drive
1189,1434448546845,0,0,1,0,off-topic,0,111,1943,Bored as hell (@ 110 Lawrence Ave Dumont Nj) http://t.co/ya4tEifm
1190,1434448547024,0,0,1,0,off-topic,179,83,1945,@allisonemilyy it lasts forever on e.
1191,1434448547027,0,0,1,0,off-topic,3,182,1947,@redheadlefthand @mikebloomberg please help me. My latkes recipe was saved on my PDA and I can't access it because my thumbs are swollen
1192,1434448547028,0,0,1,0,off-topic,1,101,1948,Bout to Leave WORK...It's Home to my Lil Loves n My Guy
1193,1434448547031,0,0,1,0,off-topic,3,84,1949,Pauly killed Tony so it was only right
1194,1434448547033,0,1,1,0,off-topic,2,154,1950,Who doesn't love getting a pedi I'm in love with my pedi  @ Lily's Nail Salon &amp; Spa http://t.co/i0HNpWCK
1195,1434448547034,0,0,1,0,off-topic,1,91,1951,DD isn't even open, all I want is my chai tea
1196,1434448547035,0,0,1,0,off-topic,1,175,1953,I play biggie better then the dude from Notorious, #biggie #brooklyn #coogi #jes @ Trump Taj Mahal Taj Tower http://t.co/Qygwlmem
1197,1434448547035,1,0,1,0,on-topic,0,77,1954,Mad windy by the river#damnnnnn
1198,1434448547036,0,0,1,0,off-topic,1,165,1955,I would like to congratulate @namesonthedoor for a big Zona win. Cheat on Trojans! Only way you're beating the wildcats
1199,1434448547036,0,0,1,0,off-topic,0,69,1958,Got a new AVI for y'all
1200,1434448547036,0,0,1,0,off-topic,0,158,1983,@ambition4life_ ...Tomorrow's lecture how English Muffins impacted American breakfasts... Major #snooze #NoBueno
1201,1434448547036,1,0,1,0,on-topic,0,163,1984,@fun2bblonde we got a call saying that record floods may occur and go as high as 8 feet above the top of the bulkhead
1202,1434448547211,1,0,1,0,on-topic,175,115,1988,RT @WNYC: MAP: Monitor flood gauges live. #sandy http://t.co/B3dk94wn
1203,1434448547212,1,0,1,0,on-topic,1,122,1990,FDR is shutdown. #hurricanesandy #nyc @ 52 East End Ave http://t.co/FDMSd2qc
1204,1434448547212,1,0,1,0,on-topic,0,175,1995,The water is unsettled and the clouds are ominous ... storms a  @ Coler Hospital, Roosevelt Island, New York http://t.co/obcDqIcx
1205,1434448547213,1,0,1,0,on-topic,1,129,1996,#westvillage no power cars are floating by and my street is flooded #hurricanesandy
1206,1434448547213,1,0,1,0,on-topic,0,81,1997,Bedtime at the height of the storm.
1207,1434448547215,0,1,1,0,off-topic,2,159,1998,I want my boyfriend and I need him now !!!!!!!  I dead ass would feel so safe with him, parents left me all alone
1208,1434448547216,1,0,1,0,on-topic,1,176,2002,Me &amp; my new #pet turtle read this together... #frankenstorm @HuffingtonPost: Hurricane pet emergency plan http://t.co/r3ZjlJop
1209,1434448547216,0,0,1,0,off-topic,0,167,2007,@Valerie_Mia : nena me too! Hope you are w/friends. Im here organizing bedroom to stay distracted. Praying for all of us.
1210,1434448547216,1,0,1,0,on-topic,0,127,2009,RT! @NoNIEMARESxO: If my basement is destroyed I will be the angriest bitch alive
1211,1434448547216,1,0,1,0,on-topic,0,165,2013,Bloomfield residents- The Emergency Operations Center is open. Call 973-680-4177 for info and non emergency situations.
1212,1434448547401,1,0,1,0,on-topic,185,173,2014,@missdevorahrose looking great, once the storm is over let's put in some work. Looking forward to training you and your friends
1213,1434448547402,1,0,1,0,on-topic,1,171,2016,I just had icing for breakfast. If #Melancholia does happen today at least I know I lived the day I died #sandy #Frankenstorm
1214,1434448547402,1,0,1,0,on-topic,0,157,2017,LOOK y'all we made it! #hurricanesandy #sandy #NYC #ny1sandy #clouds  @ Washington Heights http://t.co/qUUkGmGj
1215,1434448547402,1,0,1,0,on-topic,0,144,2031,@calaispeterkin Hahaha..Sry Is #Hurricanesandy Had Me Tossed Up..lol..But Thanks For The Lookout..
1216,1434448547403,1,1,1,1,on-topic,1,172,2036,WTH is going in outside?! The hurricane is CRAZY. I heard glass break. No school. @SquishyOntokki I'm stuck here..... :D ! ^^~
1217,1434448547403,1,0,1,0,on-topic,0,109,2043,Hurricane sandy please don't wash away my shore house!  #thanks
1218,1434448547403,1,0,1,0,on-topic,0,180,2049,We are okay here in Jersey City. Power still out but am cooking up the contents of the fridge on the gas stove. No flooding at our apt
1219,1434448547403,1,0,1,0,on-topic,0,151,2052,Live from Zone A, baby! (@ Frankenstorm Apocalypse - Hurricane Sandy w/ 2532 others) http://t.co/zuuRY0fs
1220,1434448547404,0,0,1,0,off-topic,1,130,2054,@nytimes: Attacks Continue During Failed Holiday Truce in Syria http://t.co/euA7KWC8
1221,1434448547586,0,1,1,0,off-topic,182,135,1985,@Dyllie_Tha_Kid: I'm good on my food and water supply so whatever happens, happens me too
1222,1434448547587,0,0,1,0,off-topic,1,140,1986,#Top10FavouriteSongs yzl OMG #StudyingForTheSAT .. thank God I found this http://t.co/VlAVjIoO
1223,1434448547587,0,0,1,0,off-topic,0,92,1987,@BrionesIday26 thanks! I haven't had dinner :)
1224,1434448547587,0,0,1,0,off-topic,0,104,1989,I'm at Rosie O'Grady's (New York, NY) http://t.co/thzJMrIh
1225,1434448547588,1,1,1,1,on-topic,1,175,1991,NYC: City service vehicles on deserted W.26th St. Getting ready to deal w #Sandy mess. A few peopl @ Chelsea http://t.co/QVeOW7BQ
1226,1434448547588,0,0,1,0,off-topic,0,84,1992,@alibarbere thanks girl love you more!
1227,1434448547588,0,0,1,0,off-topic,0,95,1993,#ToMyFutureHusband oh baby I will always love you
1228,1434448547589,0,0,1,0,off-topic,1,126,1994,Once you've truly accepted yourself it matters little what others think. ~@Oprah
1229,1434448547589,0,0,1,0,off-topic,0,184,1999,what a day, saw lives saved tears shed, and great group of people who stepped up to take care if those who needed help, NYUMC your great!!
1230,1434448547589,0,1,1,0,off-topic,0,74,2000,Fuck it, shit happens right?
1231,1434448547589,0,0,1,0,off-topic,0,115,2001,@callmetrisha lmao I bet! Lets start somewhere ok And work from there
1232,1434448547590,0,0,1,0,off-topic,1,143,2003,@joshsanchez69 Mary Jane always been with me thru thick &amp; thin. She hasn't left me yet! LMFAO
1233,1434448547773,0,0,1,0,off-topic,183,86,2004,My horoscope is so on point.. Its creepy
1234,1434448547774,0,0,1,0,off-topic,1,162,2005,At the Jets game- not exactly sure why, but I am here. (@ MetLife Stadium w/ 453 others) [pic]: http://t.co/2zl9jBxQ
1235,1434448547774,0,0,1,0,off-topic,0,174,2006,This is 1 of the 6 trees down in the woods near @uccweb that's lez @ Union County College - Cranford Campus http://t.co/EXdtPlPs
1236,1434448547775,0,0,1,0,off-topic,1,81,2008,Checking out hotels with generators
1237,1434448547775,0,0,1,0,off-topic,0,104,2010,@airjulie and probably not walking to the office either :)
1238,1434448547776,0,0,1,0,off-topic,1,179,2011,http://t.co/kqi7gTjZ : #Romney photoshops crowds to make them appear larger.  Also, bussed in paid black people to seem more diverse.
1239,1434448547776,0,0,1,0,off-topic,0,94,2012,Jeremy Affedlt was a starter on the Omaha Royals
1240,1434448547776,0,0,1,0,off-topic,0,71,2015,Hey, this what I wanna do
1241,1434448547777,0,0,1,0,off-topic,1,102,2018,I'm at House Of Jello (Astoria, NY) http://t.co/ZzVftD8r
1242,1434448547777,0,0,1,0,off-topic,0,119,2019,When saying things you think sound cute but you ded #LookDUMBlikeJimCarry
1243,1434448547778,0,1,1,0,off-topic,1,100,2020,@mikeybaha mine went out almost 6 hours ago so shut up
1244,1434448547778,1,0,1,0,on-topic,0,145,2021,I've never waited in a line this long @duanereade but I need milk for my bread pudding! #blameSandy
1245,1434448547963,0,1,1,0,off-topic,185,136,2022,I've listened to Soma at least 20 times now but I'm still on page 4 o k a y #brandnewworld
1246,1434448547963,0,0,1,0,off-topic,0,121,2023,@brianna_flynn lets do it we'll show this bitch we're jersey strong bitches
1247,1434448547963,0,0,1,0,off-topic,0,105,2024,@TravisSBN totally lost it better late than never? I guess?
1248,1434448547964,0,0,1,0,off-topic,1,112,2025,@CallMe_Neisha: when i care about someone, i really fucking care !
1249,1434448547964,0,0,1,0,off-topic,0,83,2026,@allie_cheebs I'm trying to sleep lol
1250,1434448547967,1,0,1,0,on-topic,3,116,2268,Jesus christ you can't believe I go out at such this hurricane night!!
1251,1434448547969,1,0,1,0,on-topic,2,145,2296,I'm at Frankenstorm Apocalypse - Hurricane Sandy (New York, NY) w/ 2947 others http://t.co/nCHxnkRA
1252,1434448547970,1,0,1,0,on-topic,1,121,2307,The only reason I love hurricanes is cause my parents buy alot of snacks :D
