2109,1434447390720,0,0,1,0,off-topic,1,93,3362,@_Reggiefor3_ lmao what some nasty ass henny?!!
2110,1434447390721,0,0,1,0,off-topic,1,131,3363,About to get some candy with my aunt in this weather since there is no type of food .
2111,1434447390721,0,0,1,0,off-topic,0,111,3364,I'm at 7-Eleven (Rego Park, New York) [pic]: http://t.co/9gPMRu6G
2112,1434447390722,0,0,1,0,off-topic,1,139,3365,@fateiswhatumake your damn right Erik...totally forgot about that -.- I miss google maps too.
2113,1434447390722,0,0,1,0,off-topic,0,100,3366,@goldenyardy Things are ok n praying it stays that way
2114,1434447390723,0,0,1,0,off-topic,1,171,3367,When will people learn that Lucas will on everything you love for ? Episode 1. Kingdom of the Crystal Skull. You were warned.
2115,1434447390723,1,0,1,0,on-topic,0,136,3368,@missjuj RT @SoozOnSports: Christie: decision to stay on the barrier islands was a bad one
2116,1434447390723,0,0,1,0,off-topic,0,103,3369,So when I'm not on campus i get the phone calls tisk tisk
2117,1434447390724,0,0,1,0,off-topic,1,179,3370,I don't know if this message could have been more brief and to the point. (with Mary at @frankenstorm_ny) [pic]  http://t.co/5l0fNWIm
2118,1434447390724,0,0,1,0,off-topic,0,162,3371,this one goes out to all my #snowflakes @stefalane @kaylaswall @sam_francisco  @ Fairway Market http://t.co/f1fdmq5G
2119,1434447390725,1,0,1,0,on-topic,1,109,3372,Sandy turned out the lights....  @ Chelsea http://t.co/IQ43LgxV
2120,1434447390725,1,0,1,0,on-topic,0,104,3373,Mid Hurricane roof walk @ A&amp;C Apt http://t.co/21ZDE3cs
2121,1434447390726,0,0,1,0,off-topic,1,128,3374,Dinner time (@ The Breslin Bar &amp; Dining Room w/ 5 others) http://t.co/O7tutakO
2122,1434447390727,0,1,1,0,off-topic,1,129,3375,@Cminee609 word man thats all i care about its just sad how fucked up the island is
2123,1434447390727,1,0,1,0,on-topic,0,143,3376,Hopefully this is like hurricane Katrina. I'm looking to loot quick chek, shoprite, and Spencer's
2124,1434447390727,1,0,1,0,on-topic,0,87,3377,Kinda scared for this hurricane &gt;.&lt;
2125,1434447390728,0,1,1,0,off-topic,1,95,3378,They finally turn on the generatror now lessggooo
2126,1434447390729,1,0,1,0,on-topic,1,180,3379,sandy is a hurricane/ blizzard, there's tsunami warnings on west coast, and there was tornados in NYC a month ago #thedayaftertomorrow
2127,1434447390729,0,1,1,0,off-topic,0,124,3380,@justinbieber thank you justin! its insane up here in new york! wish me luck:*
2128,1434447390730,0,0,1,0,off-topic,1,80,3381,Saying goodbye will never get easy
2129,1434447390730,1,0,1,0,on-topic,0,89,3382,So im scared. This weather is wild already.
2130,1434447390731,0,0,1,0,off-topic,1,90,3383,@nascarchick_3 ps: earnhardt fan i assume ;)
2131,1434447390732,0,0,1,0,off-topic,1,90,3384,These fuckers went out to eat without me -.-
2132,1434447390733,0,0,1,0,off-topic,1,90,3385,5th wheelin hard where's that fat bitch at?!
2133,1434447390734,0,0,1,0,off-topic,1,113,3386,I'm at Parkway Elementary School (Paramus, NJ) http://t.co/LaEeqAEq
2134,1434447390735,0,0,1,0,off-topic,1,166,3387,@holyshityouguys Christie and Cuomo have been WAYYYY better. Bloomberg was a clown leading up to this - downplaying, etc
2135,1434447390735,1,0,1,0,on-topic,0,114,3388,off on off on off on STOP FUCKING WITH MY MIND SANDY YOU CRAZY BITCH
2136,1434447390736,0,0,1,0,off-topic,1,151,3389,Gotta knock these 4 shows out but i am slightly under the weather. Only one voice can make my day better.
2137,1434447390736,0,0,1,0,off-topic,0,94,3390,So upset she wasnt albanian..she looked the part
2138,1434447390737,0,0,1,0,off-topic,1,166,3391,10 Super-Hypocritical CEOs Rigging The Election For Romney  And What To Do About It http://t.co/sF8NMVFZ via @AddInfoOrg
2139,1434447390737,1,0,1,0,on-topic,0,106,3392,How the fuckk do u have to gtg in the middle of a hurricane?
2140,1434447390737,0,0,1,0,off-topic,0,132,3393,Burn the flames... Higher and higher... @ The D'Agger Royale Lair http://t.co/5nhL65aw
2141,1434447390738,1,0,1,0,on-topic,1,115,3394,@NinaINLA yay!!! Okay! Hurricane sandy can't stop one of your classes
2142,1434447390738,0,0,1,0,off-topic,0,104,3395,@mattlanger do you exist I debated this with @finn tonight
2143,1434447390739,1,1,1,1,on-topic,1,111,3396,Gonna go check out this aftermath #Sandy n get some more supplies
2144,1434447390740,0,0,1,0,off-topic,1,79,3397,@Heaphy11893 u do it all the time
2145,1434447390740,1,0,1,0,on-topic,0,83,3398,The want us to evacuate Staten Island
2146,1434447391090,1,0,1,0,on-topic,350,171,3399,Well I guess it was a good thing I came in last night bc there would have been no way I could get back to the city if I didnt
2147,1434447391090,0,0,1,0,off-topic,0,107,3400,@Tease_Me21 nah yu said some rascist shit. Not even off that.
2148,1434447391090,0,0,1,0,off-topic,0,71,3401,@MsHKarma I love you too'
2149,1434447391091,1,0,1,0,on-topic,1,88,3402,I hope everyone stays safe in tthe storm .
2150,1434447391092,0,0,1,0,off-topic,1,133,3674,Death B4 Dishonor Halsey St do or die on http://t.co/vssLtRIz Must Rd &amp; Buy # TeamX
2151,1434447391093,1,0,1,0,on-topic,1,185,3675,@hitRECordJoe finally reading my mags since I'm stuck at home bcuz of #HurricaneSandy &amp; whose smiling face pops up http://t.co/N8Hpn4rL
2152,1434447391093,0,0,1,0,off-topic,0,131,3676,I'm at Big Time Fruit &amp; Vegatable Market (Staten Island, NY) http://t.co/t5htsVHU
2153,1434447391094,1,0,1,0,on-topic,1,186,3677,UWS @shakeshack team &amp; guests rockin out last provisions b4 the storm! Thank u shack teams for your hard work today http://t.co/trEo73Vw
2154,1434447391094,0,0,1,0,off-topic,0,78,3678,we need a 3 and out let's go NYG
2155,1434447391095,0,0,1,0,off-topic,1,100,3679,Woke up realizing I gotta work forever long today 10-5
2156,1434447391096,0,1,1,0,off-topic,1,135,3680,Cooking with my bf and he just spanked me with a wooden spoon. I think I liked it. #kinky
2157,1434447391097,0,0,1,0,off-topic,1,110,3681,@rhwells13 you are so funny... I can't handle it!!! HA HA HA lol
2158,1434447391097,1,0,1,0,on-topic,0,81,3682,Branches already falling on my roof
2159,1434447391098,1,0,1,0,on-topic,1,123,3683,Literally stuck thanks to #Sandy. No trains nor even the Fung Wah is running.
2160,1434447391099,0,0,1,0,off-topic,1,162,3684,Performance @ Stone Rose last week #lavoteam #performance #show #halloween  @ Stone Rose Lounge http://t.co/jyXNIn4K
2161,1434447391099,0,0,1,0,off-topic,0,173,3685,#GottaAceMySATexam .. OMG wish my brother found that before http://t.co/geb33Le3 ..better get it while u can #TheLadieslove nhv
2162,1434447391100,0,0,1,0,off-topic,1,96,3686,@CassadeePope Do you miss Hey Monday? #AskCassadee
2163,1434447391100,0,0,1,0,off-topic,0,141,3687,@simple_beauty14 @h0pelessdreamer hahaha dont be hating on me bitch. I got it good not my fault
2164,1434447391101,0,0,1,0,off-topic,1,113,3688,@Morgsterious aaaahaa... :-) another twist I believe, mr Morgan :-)
2165,1434447391101,0,0,1,0,off-topic,0,150,3689,@emilyissmiling you are so sweet to check in! It's no joke and scary but we are good! Love you!!! Xoxoxo
2166,1434447391102,0,1,1,0,off-topic,1,152,3690,Oh Vegas how I miss you right now..  #lasvegas #sincity #ceasars #summer  @ Las Vegas http://t.co/dGThl0Ud
2167,1434447391102,0,0,1,0,off-topic,0,84,3691,@RenataIndarr you guys have school too
2168,1434447391103,1,0,1,0,on-topic,1,124,3692,my escape method if a tree falls on my house #hopeitworks http://t.co/XXKEvXvj
2169,1434447391275,0,0,1,0,off-topic,172,100,3693,Happy Birthday to the best Big Brother @LuckyLeo171 !!
2170,1434447391276,0,0,1,0,off-topic,1,90,3694,I want a Scott Disick in my family. #lovehim
2171,1434447391278,0,0,1,0,off-topic,2,173,3695,WO2012145388A1 System And Method Providing Resilient Data Transmission Via Spectral Fragments #H04L #H04L1 http://t.co/ivpTfYm1
2172,1434447391278,0,0,1,0,off-topic,0,92,3696,@louuwashere what ??? You gotta watch it !!!!!
2173,1434447391279,1,1,1,1,on-topic,1,177,3697,It's safe and dry here. We have power and clean water. Feeling pretty lucky compared to family on Long Island. http://t.co/C3dszN8c
2174,1434447391279,0,0,1,0,off-topic,0,154,3698,People are all fucking bullies. Leave me the fuck alone unless u want me to do something Ull feel bad about.
2175,1434447391280,1,1,1,1,on-topic,1,157,3699,Storm is supposed to be really bad, just hope everyone is safe and smart, be careful everyone, love u all &lt;3
2176,1434447391280,0,0,1,0,off-topic,0,166,3700,Disappointed that baseball season may end today. Tigers are better than they have shown. Like Obama at that first debate
2177,1434447391281,0,0,1,0,off-topic,1,138,3701,@mr_keepitfresh haha im not really mean. Im actually a very nice person c: ask @Pepe_Bitches
2178,1434447391281,0,0,1,0,off-topic,0,129,3702,@Dylan7794 oo yea without a doubt and he's gunna be the focal point of that offense
2179,1434447391282,1,0,1,0,on-topic,1,139,3703,@NickGregoryFox5: Reports of partial collapse of boardwalk at Seaside Heights, NJ #sandyonfox
2180,1434447391282,0,1,1,0,off-topic,0,109,3704,Just posted a photo @ Boxers NYC Sportsbar http://t.co/Nczl0Fb1
2181,1434447391283,0,1,1,0,off-topic,1,111,3705,@kellbellkriz low blow... And your id Is on the wall of shame now
2182,1434447391284,0,0,1,0,off-topic,1,90,3706,@wompzwompzwompz 15th and the 1st is my shit
2183,1434447391285,0,0,1,0,off-topic,1,133,3707,Hi Cav vmt WOW.. #HaveToAceMySATexam : ..better get it while u can http://t.co/b43b0pGB
2184,1434447391285,1,0,1,0,on-topic,0,181,3708,I can't believe everyone cares about mischief night! do you not fucking realize the people you go to school with have lost their homes?
2185,1434447391286,0,0,1,0,off-topic,1,101,3709,And if I die before your album drop I hope ... ... ....
2186,1434447391287,0,0,1,0,off-topic,1,146,3710,@michaelstrahan @FOXSportsLily Our Giants won Mike- it felt like u were out there-cuz we won lol :-)
2187,1434447391287,0,0,1,0,off-topic,0,129,3711,I wrote this last night..... Couldn't even spell forever right http://t.co/0lTRsKJP
2188,1434447391288,1,0,1,0,on-topic,1,108,3712,Does anyone know if Kingda Ka is still alive?! #hurricanesandy
2189,1434447391288,0,0,1,0,off-topic,0,99,3713,Knock knock I'm in the mother fucking house bitchhhhh
2190,1434447391289,0,0,1,0,off-topic,1,92,3714,@kcorcutt we're like, related via the universe
2191,1434447391290,0,1,1,0,off-topic,1,103,3715,@CarolineManzo right? Ugh. Give me give minutes with him.
2192,1434447391291,0,0,1,0,off-topic,1,150,3716,I'd like to congratulate the San Francisco giants on making the Yankees look worse then they already did
2193,1434447391292,1,0,1,0,on-topic,1,136,3717,@mommaV511 my parents are safe, but some of there friends are the ones amongst the missing
2194,1434447391292,0,0,1,0,off-topic,0,95,3718,I'm at Skyline (Hoboken, NJ) http://t.co/1IteM1nE
2195,1434447391293,0,0,1,0,off-topic,1,85,3719,Well.... My power officially went out..
2196,1434447391295,1,0,1,0,on-topic,2,185,3720,'Mom i still have class tomorrow''you wont. My Job is closed''this is Jersey, I go to school in PA''oh yea I forgot.You're screwed' #thanks
2197,1434447391295,1,0,1,0,on-topic,0,106,3721,Thank god my room the top floor, my shit not gon get flooded
2198,1434447391297,0,1,1,0,off-topic,2,168,3722,Scott forstall is leaving @apple, guess I'm going to start using whatever mobile operating system company he's working for
2199,1434447391297,0,0,1,0,off-topic,0,119,3723,42ND St never looks this quiet (@ 42nd and 12th Ave) http://t.co/nanmHjW9
2200,1434447391298,0,0,1,0,off-topic,1,179,3724,!!!!!Hey!! Want to #win this handbag RT @mauricioshinepr and @ShineMediaPR #handbags #giveaway featuring @TRUVOW http://t.co/slWiyNvl
2201,1434447391298,0,0,1,0,off-topic,0,122,3725,Only place I can find open in Midtown: Sbarro. Who knew they served coffee??
2202,1434447391299,1,0,1,0,on-topic,1,142,3726,Wow this crane is about to topple! They are waiting with stretchers. #sandy http://t.co/FvcVbIjm
2203,1434447391300,0,0,1,0,off-topic,1,108,3727,@danaanicolee I got blonde dye come over  we can ombr our hair
2204,1434447391301,1,0,1,0,on-topic,1,98,3728,Tree down on Clinton Ave #Sandy http://t.co/JsRe0BbW
2205,1434447391303,0,0,1,0,off-topic,2,125,3729,Halloween Flashback!  @ Harrah's Resort Hotel &amp; Casino http://t.co/Gdure7w6
2206,1434447391303,0,0,1,0,off-topic,0,80,3730,If i had a choice it would be you!
2207,1434447391305,1,0,1,0,on-topic,2,177,3731,Hungry on this stormy evening in #astoria? Come to #mezzeplace for some Shakshuka.  #sandy won't bring us down http://t.co/VHIsXTZ7
2208,1434447391305,1,0,1,0,on-topic,0,95,3732,Going down the shore to check out maaa girl sandy
2209,1434447391307,1,0,1,0,on-topic,2,157,3733,Wow. Really a river! | RT @BuzzFeed: Crazy video of flooding on Avenue C, via @nowthisnews http://t.co/qUOk8lFa
2210,1434447391308,0,0,1,0,off-topic,1,81,3734,Watchin' a 3D Movie  w. The Family.
2211,1434447391309,0,0,1,0,off-topic,1,79,3735,Best night ever doe shit was live
2212,1434447391310,1,1,1,1,on-topic,1,124,3736,My cousin might just be the smartest person bet... he is storm chasing in city
2213,1434447391311,0,0,1,0,off-topic,1,69,3737,Bouta blow up her phone
2214,1434447391313,0,0,1,0,off-topic,2,78,3738,Bras that clip on the front omfg
2215,1434447391315,1,0,1,0,on-topic,2,160,3739,@mbaratz They were also out at the A&amp;P in Jersey City. Who knew #bananas were such a hot disaster food? #Sandy
2216,1434447391470,0,0,1,0,off-topic,155,104,3740,I'm at Stelton Lanes (Piscataway, NJ) http://t.co/8Yz1XzKh
2217,1434447391471,0,0,1,0,off-topic,1,108,3741,Got to take a walk down FDR.  @ FDR Drive http://t.co/Ngllc9IZ
2218,1434447391473,0,0,1,0,off-topic,2,123,3742,I'm at Newport Centre Mall (Jersey City, NJ) w/ 6 others http://t.co/Z4Hcnq4q
2219,1434447391474,1,0,1,0,on-topic,1,75,3743,@billyboulia are you guys ok?
2220,1434447391475,0,1,1,0,off-topic,1,85,3744,TURN MY POWER BACK ON!!!!!!! NOW!!!!!!!
2221,1434447391477,1,0,1,0,on-topic,2,118,3745,I hope the flooding in your area isn't too  bad. We will back Wednesday.
2222,1434447391478,0,0,1,0,off-topic,1,106,3746,shout out to my #NF @sassypantsbeana make sure to follow her
2223,1434447391479,0,0,1,0,off-topic,1,94,3747,@shaeconnor lol we are not in an evacuation zone
2224,1434447391484,0,0,1,0,off-topic,5,80,3748,Bring it on Sandy we gucc out chea
2225,1434447391485,1,0,1,0,on-topic,1,131,3749,I'm at Frankenstorm Apocalypse - Hurricane Sandy w/ @cherryred23 http://t.co/4fWbA8Qi
2226,1434447391486,1,0,1,0,on-topic,1,145,3750,I'm at Frankenstorm Apocalypse - Hurricane Sandy (New York, NY) w/ 1034 others http://t.co/ue9ym3Ku
2227,1434447391487,1,0,1,0,on-topic,1,105,3751,Flood Watch issued for Perth Amboy, NJ http://t.co/lWmSJv4d
2228,1434447391488,0,1,1,0,off-topic,1,157,3752,Drinks with leopards. Yes it's gone there. #sandy (@ Eventi - A Kimpton Hotel w/ 3 others) http://t.co/qKajmSNF
2229,1434447391489,0,0,1,0,off-topic,1,117,3753,@m_verdesco hahah best believe the naked pallet is number one on mine(;
2230,1434447391489,0,1,1,0,off-topic,0,111,3754,@mackenzieehuber ya just did cause #GooseNation doesn't lose ever
2231,1434447391490,1,0,1,0,on-topic,1,107,3755,Bring it on Sandy @ East River Promenade http://t.co/0x6AqTxg
2232,1434447391492,0,0,1,0,off-topic,2,93,3756,Mite Be Mix Match , But Everything Designer ...
2233,1434447391500,0,0,1,0,off-topic,8,91,3757,I wanna give you what's better than better ..
2234,1434447391505,0,1,1,0,off-topic,5,89,3758,Don't give up just because things are hard.
2235,1434447391509,0,0,1,0,off-topic,4,121,3759,@AmandaDematteo OMG I have to tell you something! Text me when you get up!!
2236,1434447391510,0,0,1,0,off-topic,1,156,3760,@lalalexieeex3: Whenever I watch a scary movie I cover my face half the time lmao #scared i cover my ears lmao
2237,1434447391510,0,0,1,0,off-topic,0,112,3761,Having all my college applications in &gt;&gt;&gt;&gt;&gt;&gt;&gt;
2238,1434447391511,0,0,1,0,off-topic,1,117,3762,Good thing I have an iPod &amp; phone &amp; both are charged  # winning
2239,1434447391512,1,0,1,0,on-topic,1,123,3763,#FDNY removing 9 #ConEd workers by boat from unspecified location #sandy #nyc
2240,1434447391513,0,0,1,0,off-topic,1,123,3764,Jus holdin my son close , there wouldnt b anywhere else i would b wid out him
2241,1434447391658,0,0,1,0,off-topic,145,137,3765,SWEET! LOL! RT @finslippy: We're off to pretend to sleep. Tomorrow's a full day of looting!
2242,1434447391660,0,1,1,0,off-topic,2,138,3766,Why wen ny get mad they gatta start hittin and getting penalties? Jus like a new yorker. smh
2243,1434447391661,0,0,1,0,off-topic,1,154,3767,I think I'm a pretty cool person, if you don't like me. Speak up . Don't talk shit about me when I walk past
2244,1434447391662,0,0,1,0,off-topic,1,74,3768,Its finna get real out there
2245,1434447391665,0,0,1,0,off-topic,3,140,3769,Saw the cat in the hat today Washington n park pl @ Half Court Sports Bar http://t.co/YQpLWl4R
2246,1434447391666,0,1,1,0,off-topic,1,104,3770,i was just sitting there looking with my eyes open. -darin
2247,1434447391670,0,0,1,0,off-topic,4,102,3771,Nigga I'm ballin I'm over charging my phone cuz I can...
2248,1434447391672,0,0,1,0,off-topic,2,143,3772,#Top10FavoriteSongs buj WOW.. #StudyingForTheSAT : thanks Jesus I found that http://t.co/1oOtejIo
2249,1434447391673,0,0,1,0,off-topic,1,87,3773,Wine and Atlantis themed monopoly  #sandy
2250,1434447391675,0,0,1,0,off-topic,2,142,3774,#westside exploring. #hudsonriver #manhattan  @ Pier 57 @ Hudson River Park http://t.co/jmdpgR0a
2251,1434447391678,0,1,1,0,off-topic,3,172,3775,ESPN Friday Night Fights in 2012 has lowest ratings since inception at 409k avg. http://t.co/6ysTW1Qo @KMBReferee #justnumbers
2252,1434447391680,0,0,1,0,off-topic,2,76,3776,What is wrong with Cruz today?
2253,1434447391683,0,0,1,0,off-topic,3,81,3777,People who can dance salsa &gt;&gt;
2254,1434447391684,0,1,1,0,off-topic,1,167,3778,Just got off the fone with my baby , :* aww he called me in the a.m how cute him and his sexy sleepy voice ;* @LuisJz_x12
2255,1434447391685,0,0,1,0,off-topic,1,88,3779,@alexa_barreto thank you, how is it by you
2256,1434447391686,0,0,1,0,off-topic,1,139,3780,Open for business. Try the Napoleon! #sandy  @ The Hungarian Pastry Shop http://t.co/N6muGUNn
2257,1434447391686,1,0,1,0,on-topic,0,108,3781,All you retards know the hurricane starts tomorrow night right
2258,1434447391687,1,0,1,0,on-topic,1,120,3782,I need groceries... not because of the storm... Just legit need groceries.
2259,1434447391687,0,0,1,0,off-topic,0,100,3783,Giants better score more points. Don't sit on the lead
2260,1434447391688,0,0,1,0,off-topic,1,72,3784,I hope aaron okay , #icare
2261,1434447391689,0,1,1,0,off-topic,1,126,3785,Zone A kbm #OMG #StudyingForTheSAT .. you better get it now http://t.co/KiPUmQsZ
2262,1434447391691,0,1,1,0,off-topic,2,165,3786,#GottaAceMySATexam : OMG I really wish our girl had found this previously http://t.co/DV0X2rTJ you better get it now...
2263,1434447391692,0,0,1,0,off-topic,1,87,3787,Bout to go traipse the town this morning!
2264,1434447391693,0,1,1,0,off-topic,1,149,3788,iThought you changed for a second but you just proved that you're the same. Exes are exes for a reason*
2265,1434447391694,0,1,1,0,off-topic,1,168,3789,@scaackler just a little breezy, light rain this afternoon then nothing...it would be fantastic if it went somewhere else!
2266,1434447391694,0,0,1,0,off-topic,0,77,3790,Brian and I are missing @epco18
2267,1434447391695,0,0,1,0,off-topic,1,83,3791,My stomaach's acting little fishy tho
2268,1434447391696,0,1,1,0,off-topic,1,139,3792,OMG... I swear I think I just fell in love.. I just walked passed Wonder Woman... :-P  ~Gio~~
2269,1434447391697,0,0,1,0,off-topic,1,88,3793,@_bubblesxD definitely. I think we all are
2270,1434447391698,0,0,1,0,off-topic,1,102,3794,@bluedisco Haha, that mean you need to dance more often.
2271,1434447391698,0,0,1,0,off-topic,0,96,3795,I actually miss him but I disappear on him to much
2272,1434447391699,1,0,1,0,on-topic,1,83,3796,@sadebedatruth you be safe out there.
2273,1434447391700,0,1,1,0,off-topic,1,180,3797,On my way back home!!! Going to miss N.Y. &amp; @JMcKinleyNYC but I will be back as always!!! #TeamAnthonyRyan #TeamJoshua #PRAllStars
2274,1434447391700,0,0,1,0,off-topic,0,83,3798,A srs deal when i misplace my lighter
2275,1434447391701,1,0,1,0,on-topic,1,124,3799,Day after Sandy in Manhattan. From 57th street @nytmetro  http://t.co/9cPtmTBL
2276,1434447391702,0,0,1,0,off-topic,1,175,3800,@dcoptimist that was the play of the year for PIT D, you better believe you gotta take that shot at a QB when you get the chance.
2277,1434447391702,1,0,1,0,on-topic,0,110,3801,@sillyjillyy_ I made it back alive!  Just with very knotty hair!
2278,1434447391703,0,0,1,0,off-topic,1,122,3802,@rachfitzpatrick Im good Rach..thx for asking! Hope ur good out ur way too!!
2279,1434447391703,1,1,1,1,on-topic,0,113,3803,Bay Street is flooded and mobile ave has no power... I just any win
2280,1434447391704,0,1,1,0,off-topic,1,170,3804,I'm still in NY til Thursday and I am getting cabin fever. Anyone doing anything for halloween? @slagii @MissJtotheK anyone?
2281,1434447391704,0,1,1,0,off-topic,0,84,3805,Soon I'm in a room full of pocahontas'
2282,1434447391705,0,0,1,0,off-topic,1,109,3806,Watching a documentary about witches. What has my life come to?
2283,1434447391707,0,0,1,0,off-topic,2,71,3807,I hear the Sirens outside
2284,1434447391709,1,1,1,1,on-topic,2,109,3808,No power+ 6 o'clock curfew= me and @dee_freshest getting drunky
2285,1434447391710,1,0,1,0,on-topic,1,176,3809,Bad news: I seem to have a headache unless I'm outdoors. Worse news: Looks like I'll be spending the next four days inside. #Sandy
2286,1434447391710,0,0,1,0,off-topic,0,99,3810,@stephanyy__x I know I feel so bad :( such a same ugh
2287,1434447391711,0,0,1,0,off-topic,1,184,3811,@kokupuff: @tynie626 @chansonthegreat @lfresh alright folks--i can sleep peacefully knowing that much same here check in from time to time
2288,1434447391711,0,0,1,0,off-topic,0,68,3812,My mom is freaking out
2289,1434447391712,0,1,1,0,off-topic,1,158,3813,In church streaming #ustream #disciplesofCrist #sunday  @ Second Disciples of Christ Church http://t.co/PArKa7lq
2290,1434447391845,0,1,1,0,off-topic,133,106,3814,@niallgiggins was a bit looterish at first but seems ok now.
2291,1434447391846,0,0,1,0,off-topic,1,99,3815,#ToMyFutureDaugther you will be the next jennny finch
2292,1434447391847,0,0,1,0,off-topic,1,97,3816,@inoahpop @ya_boi_chrispat word, best. Handle that.
2293,1434447391848,0,1,1,0,off-topic,1,98,3817,@StayTrueTo_You I was going to call back . &gt;_&lt;
2294,1434447391849,1,0,1,0,on-topic,1,185,3818,@Debra_Anastasia I'm glad you are all ok!  We lost our power and my son is driving me crazy! That is worse than the power outage. Omg stop!
2295,1434447391850,0,0,1,0,off-topic,1,108,3819,That's my night planned!  @ Epstein's Bar http://t.co/O5yxOBj1
2296,1434447391850,0,0,1,0,off-topic,0,94,3820,The vow is one of my favorite movies its so cute
2297,1434447391851,0,0,1,0,off-topic,1,132,3821,@DonaldAllen23 if ya need somewhere to go yah can come to my crib.. We still got power
2298,1434447391852,0,1,1,0,off-topic,1,144,3822,Marilyn finally getting a drink or two in after the new little Nina.  @ Geido http://t.co/QlysbfKW
2299,1434447391852,1,0,1,0,on-topic,0,107,3823,@josephcampagna I may be making an appearance #hurricanesandy
2300,1434447391853,1,0,1,0,on-topic,1,151,4034,Last flight in before #frankenstorm (@ Terminal A (Marine Air Terminal) w/ 2 others) http://t.co/HJIimXxL
2301,1434447391853,0,0,1,0,off-topic,0,149,4035,@jon_bardin with some patience and persistence we figured out a solution, though, despite @americanair.
2302,1434447391854,0,1,1,0,off-topic,1,119,4036,And even the young mobster with his rolled tobacco just flew by holy shit
2303,1434447391854,0,0,1,0,off-topic,0,127,4037,@JayTullis whiskey AND bubbly, we snuck out to the liquor store this afternoon :)
2304,1434447391855,0,0,1,0,off-topic,1,109,4038,I let mudah go out &amp; Im stuck in the house &gt;_&lt; Fuck !
2305,1434447391856,0,1,1,0,off-topic,1,78,4039,I just passed out last night lol
2306,1434447391857,0,0,1,0,off-topic,1,108,4040,I'm at Miller Miraglia LLP (New York, NY) http://t.co/NdOIAZ7z
2307,1434447391858,0,0,1,0,off-topic,1,160,4041,I have a HUGE problem with people lying to my face. Especially, when you're dumb enough to think, I wouldn't know.
2308,1434447391858,0,0,1,0,off-topic,0,100,4042,@MzGracieBaby gimme recap of WORD WAR real quick!!!!!!
2309,1434447391859,1,1,1,1,on-topic,1,101,4043,@JiillBiill I'm getting hit by a hurricane on Monday!!!
2310,1434447391860,0,0,1,0,off-topic,1,117,4044,@SaveTheBS: Act like a Lady, Think like a Boss. Reminds me of @cassbenz
2311,1434447391860,0,0,1,0,off-topic,0,64,4045,I am due for a nap
2312,1434447391862,0,1,1,0,off-topic,2,75,4046,My power just went... Fuck me
2313,1434447391863,0,0,1,0,off-topic,1,117,4047,Came back from retreat to an empty room. Roommates home for the weekend
2314,1434447391865,0,0,1,0,off-topic,2,75,4048,Its dark &amp; I'm scared -_-
2315,1434447391866,0,1,1,0,off-topic,1,128,4049,Just called my boss... I'm glad she's understanding of my situation... This blows.
2316,1434447392039,1,0,1,0,on-topic,173,185,4050,So far the most impressive/brave element of our hurricane preparation experience is the mimosa in our traveling coffee mug. #grapefruitobvs
2317,1434447392039,0,0,1,0,off-topic,0,133,4051,Bitches gon be bitches hoes gon be hoes sluts gon be sluts.. What could you do? Nothing
2318,1434447392040,0,0,1,0,off-topic,1,121,4052,@ladygaga Closed, baby. Big Nick's &amp; Duane Reade are open as is Cafe 71
2319,1434447392041,0,1,1,0,off-topic,1,110,4053,Yo.. . I wonder if Backpage still up and running right now...lol
2320,1434447392041,0,0,1,0,off-topic,0,107,4054,I'm at Rocking Horse Cafe (New York, NY) http://t.co/1NkzV3fF
2321,1434447392042,0,1,1,0,off-topic,1,72,4055,Hoboken is crazy right now
