1,1441958972514,1,1,1,1,on-topic,1441958972514,181,119,One Boston Marathon suspect dead, Boston on lockdown; Update:...: One Boston Marathon suspect dead, Boston on ... http://t.co/SBgsE032Df
2,1441958972519,1,1,1,1,on-topic,5,162,64,#Boston PD tweet: @Boston_Police: Despite reports to the contrary there has not been an arrest in the Marathon attack.
3,1441958972519,1,1,1,1,on-topic,0,155,58,Reports that multiple bombs are being detonated by police around Boston, seems the attack did not go as planned
4,1441958972520,0,1,1,0,off-topic,1,154,31,Shots fired in South End, explosions in Texas. Why is the world crashing down now? I want to graduate college.
5,1441958972520,1,1,1,1,on-topic,0,184,30,You always hear abt explosions in Mumbai, Delhi, NYC but when it happens right in front of your house, it's totally numbing and frightening!
6,1441958972526,0,1,1,0,off-topic,6,135,332,This cough is gonna be the death of me I'm scared I'm gonna pop/break something in my body
7,1441958973517,0,1,1,0,off-topic,991,132,279,Tragedy is hard to understand until it happens 2.6 miles from where you sleep at night.
8,1441958973518,0,1,1,0,off-topic,1,164,188,Needed this right now. RT @EmergencyPuppy: Piglet wearing a sweater and little booties, napping. http://t.co/lFdTJyaTkq
9,1441958973519,1,1,1,1,on-topic,1,166,159,#April 19 #fmsphotoaday: button. Watching breaking news in my BUSM tee in honor of #WearBostonDay. http://t.co/vPnPHmBJKE
10,1441958973519,1,1,1,1,on-topic,0,181,160,I have lived in Boston for 17 years, this is 1st time terrorists strikes me so close to home. I think of those who deal with it everyday
11,1441958973520,0,1,1,0,off-topic,1,139,535,Officials identify murdered MIT Police officer as Sean Collier, 26, of Somerville. Just awful.
12,1441958974523,1,1,1,1,on-topic,1003,164,539,Live stream radio Rt@apbeecher: How can I follow #Boston #manhunt w/o TV - don't want my Little Girl to see it; thanks!
13,1441958974524,1,1,1,1,on-topic,1,183,487,Even in the middle of a horrible crisis Suzy Marden is horrible, and just evil. If you can't be kind during a tragedy, you'll never be ok.
14,1441958974525,1,1,1,1,on-topic,1,166,422,Dozens of police rushed to area of Watertown, Mass., about 2 miles from Cambridge. Reports that explosives were involved.
15,1441958974525,0,1,1,0,off-topic,0,116,414,@androidjed1 at hotel. Just found out about bombs   Thoughts to injured
16,1441958974526,1,1,1,1,on-topic,1,153,404,Covering the #Boston bomb blasts for @NBCNewYork. WATCH @glorioso4ny    live at 11 from Children's hospital.
17,1441958974529,1,1,1,1,on-topic,3,110,844,Im just gonna intimidate this terrorist into custody via twitter.
18,1441958975525,0,1,1,0,off-topic,996,149,776,Clearing backyards for someone who just threw grenades at you like an hour ago must be a bit terrifying.
19,1441958975526,1,1,1,1,on-topic,1,176,753,@BostonDotCom: RT @morisy: #MBTA shut down, but current emergency doesnt slow @DunkinDonuts http://t.co/Ayzde3J7uN spirit of Boston
20,1441958975527,1,1,1,1,on-topic,1,142,684,@BostonDotCom: BREAKING NEWS: Police getting multiple reports of unexploded devices around Boston
21,1441958975527,0,1,1,0,off-topic,0,176,673,survival: my next 24 hours, by meg fox. #norestforthewicked. #darkroast. #caffeinesensitivity. #321blastoff. http://t.co/4trZOTNCKZ
22,1441958975528,1,1,1,1,on-topic,1,164,641,@weavahkidbroguy shooting at MIT now explosions and gunshots literally going on rn in Boston complete chaos on the news
23,1441958976000,0,1,1,0,off-topic,472,180,1115,My thoughts and prayers go out 2 the people of West, Tx. May God Bless u all and give u the strength 2 surpass this horrific incident.
24,1441958976530,0,1,1,0,off-topic,530,148,1105,Many prayers right now. Push comes to shove, university POs are signing up to step in front of bullets
25,1441958976531,0,1,1,0,off-topic,1,171,1043,Not interested in u @Ramou so be gone. If you or anyone wants to make light of this tragedy, u can fuck yourself #boston4life
26,1441958976532,0,1,1,0,off-topic,1,168,1035,For anyone who's heard of the explosions, my dad and are both fine--we had left the finish line area maybe minutes before.
27,1441958976533,1,1,1,1,on-topic,1,176,1019,@Kwables lol I'm jealous! Ugh! If I would've known there was gonna be a terrorist on the loose I would've been right with you! Lol
28,1441958976533,1,1,1,1,on-topic,0,82,994,Holy shit explosion in west texas now
29,1441958976534,0,1,1,0,off-topic,1,174,969,@t_tanguay17 all 4 of them. Molly's hospital is currently in lockdown though so their could be more bombs as terrorists our their
30,1441958976535,1,1,1,1,on-topic,1,147,907,I am speechless. So blessed to have so many law enforcement protecting us right now #Boston #Watertown
31,1441958977004,1,1,1,1,on-topic,469,185,1330,One Fund raises $10M for Marathon attack victims as Boston big business chips in: Just three days after dual bomb... http://t.co/qykkoqdXuC
32,1441958977530,1,1,1,1,on-topic,526,112,1319,The fact that I'm suppose to board a plane right now is terrifying
33,1441958977531,1,1,1,1,on-topic,1,169,1277,To the marathon runner who said the Islam attacked the marathon on the T this afternoon, go home already #getyourfactsright
34,1441958977532,0,1,1,0,off-topic,1,136,1263,@DeanWenner no emergency email/ text message? Thought the system was rapid. Just sayin....
35,1441958977533,1,1,1,1,on-topic,1,114,1183,Friends I am safe. Two casualties and 22 injuries as of now. #boston
36,1441958977534,1,1,1,1,on-topic,1,181,1165,Recently Married Couple Seriously Hurt In Boston Marathon Bombings: BOSTON (AP)  A recently married couple is... http://t.co/0XwDQNA7qU
37,1441958977535,1,1,1,1,on-topic,1,173,1135,Boston may not be my hometown but I live here it's so sad what happened earlier 2day in the marathon ur in my prayers bean town
38,1441958978008,1,1,1,1,on-topic,473,167,1604,@BostonGlobe: UPDATE: Another suspicious package was reported near the Harvard #MBTA station @bernielim please stay safe.
39,1441958978531,1,1,1,1,on-topic,523,122,1581,The twitter love for Boston right now is amazing! #staystrongboston #prayers
40,1441958978535,1,1,1,1,on-topic,4,152,1570,@JuttaBoliver they said there was a fire but it wasn't related to the explosion so at least thats a relief
41,1441958978541,0,1,1,0,off-topic,6,161,1531,Deff a cover up first reports that there was a suspect arrested now there has been no arrest made #Something'sFishy
42,1441958978543,0,1,1,0,off-topic,2,180,1410,what of there was some shot where the bomber took over television and was like you have 20 minutes to find this bomb or you'll all doe
43,1441958978544,0,1,1,0,off-topic,1,162,1366,We all just rent-a-cops until this happens, and you are in the 3rd tallest building in Boston, #AppreciateYourSafety
44,1441958979015,0,1,1,0,off-topic,471,177,1848,@Jaxcash26 I have a little brother, that's terrible I can't imagine what that family is going through no reason to put me on blast.
45,1441958979535,1,1,1,1,on-topic,520,167,1793,Praying for the officers and all people who continue to risk their lives to ensure the safety of others. #america #boston
46,1441958979536,1,1,1,1,on-topic,1,183,1782,@TheFollowingFOX what will happen for people in Boston waiting to watch The Following? Breaking news is still on. Will there be a replay?
47,1441958979537,1,1,1,1,on-topic,1,149,1760,http://t.co/A4N3RWgvLW lots of information here on the #bostonmarathon #explosion with constant updates
48,1441958979538,1,1,1,1,on-topic,1,184,1669,BPD: Do Not Compromise Officer Safety/Tactics by Broadcasting Live Video of Officers While Approaching Search Locations every news station
49,1441958979539,1,1,1,1,on-topic,1,184,1657,Holy Smack! We were feet from the explosion 15 minutes before it happened. #insane #bostonmarathon #explosion we're ok. praying for others
50,1441958979540,1,1,1,1,on-topic,1,145,1636,BOSTON BOMBERS: Search for green Honda Civic now called off. BOLO recalled by state police in Conn.
51,1441958979541,1,1,1,1,on-topic,1,169,1624,@nickkeyko and I are okay! Currently safe in our apartment. Completely shocked and devastated by the events here in #Boston
52,1441958980020,0,1,1,0,off-topic,479,183,2128,You're going to give me my orgo grade back on MY BIRTHDAY. YOU HAD TO FORGET THEM AT HOME TODAY?! At least I woulda had a day to recover.
53,1441958980536,0,1,1,0,off-topic,516,162,2037,Being in love with a #Capricorn will be the most complicated thing of your life. #Warning  #TooLate #Gift&amp;ACurse
54,1441958980538,0,1,1,0,off-topic,2,177,2030,Watching live coverage on TV in the hotel. I keep scanning wave 1 for the sight of @RunningAmick in his bright orange shirt. #Glued
55,1441958980541,1,1,1,1,on-topic,3,162,1990,Just one of many respects left for the casualties of the #Bostonmarathonbombings @ Boston, Ma http://t.co/dJXanDx2VJ
56,1441958980543,0,1,1,0,off-topic,2,121,1988,Every heartache will fade away just like every storm runs, runs out of rain
57,1441958980544,1,1,1,1,on-topic,1,172,1971,@12News hey guys nothing new than what you're hearing on news. We are on lockdown at our hotel and just absorbing the tragedy.
58,1441958980546,1,1,1,1,on-topic,2,107,1922,Boston Globe reporting one Marathon Bombing suspect arrested!
59,1441958981022,1,1,1,1,on-topic,476,184,2383,Reports of Marathon Runners that crossed finish line &amp; continued to run to Mass General Hospital to give blood to victims Sooooo Sweet
60,1441958981543,1,1,1,1,on-topic,521,167,2357,Loud explosion! Shots fired! Shots fired! I can hear a grenade going off! Happening now. PD scanner. Watertown. @andynags
61,1441958981545,1,1,1,1,on-topic,2,156,2350,I can't even comprehend what's going on right now. Thoughts and prayers to everyone affected by the explosions
62,1441958981547,1,1,1,1,on-topic,2,162,2341,Gov Deval Patrick restates what Menino already said, that Boston is ONE community and will recover as one community.
63,1441958981550,1,1,1,1,on-topic,3,126,2320,I hope everybody is okay! Omg, two people died... Thats just sad. #prayforboston
64,1441958981552,1,1,1,1,on-topic,2,181,2309,The Marriott is charging $400 to accomodate people who live on boylston st and had to be evacuated... Where is gone guys? #wcvb #boston
65,1441958981553,1,1,1,1,on-topic,1,182,2303,france24: USA: Confusion amid reports of a Boston bombing arrest: The US authorities have denied re... http://t.co/IfEehwetNX #albarjeel
66,1441958981555,0,1,1,0,off-topic,2,111,2205,AJ Styles beats The Cowboy James Storm via submission #ImpactLIVE
67,1441958981556,0,1,1,0,off-topic,1,137,2155,Please god make this madness stop. So many innocent lives affected....this world is fucked.
68,1441958982024,1,1,1,1,on-topic,468,157,2630,BREAKING: Law enforcement official: Arrest imminent in Boston Marathon bombing, suspect to be brought to court.
69,1441958982550,1,1,1,1,on-topic,526,177,2605,. @CNN reporting shooting began at 130am but I tweeted around 1245am about police already radioing shots and explosions #justsaying
70,1441958982552,1,1,1,1,on-topic,2,173,2604,Two explosions in Boston and two deaths that are known so far. My prayers are with everyone and their family's right now. #PRAY
71,1441958982554,1,1,1,1,on-topic,2,124,2570,@Boston_Police You are always in our prayers, not just during horrific times!!
72,1441958982556,1,1,1,1,on-topic,2,176,2543,#Quincy , MA #internship #Job: Are you a leader? Criminal Justice / Law ... at Massachuetts Survivors Unite http://t.co/Bu21cK3ajt
73,1441958982557,1,1,1,1,on-topic,1,164,2510,So grateful that I wasn't at the finish line when it happened. Praying for all of those who are injured #PrayForBoston
74,1441958982558,0,1,1,0,off-topic,1,166,2506,My computer just died mid-upload, but there's some new shots in my photostream shooting this p.m. http://t.co/JEiKpRe1i9
75,1441958982559,0,1,1,0,off-topic,1,144,2446,Opened Damaged Sign report via iPhone at 25 Carruth St http://t.co/qtUDwK1SU4. Broken street sign.
76,1441958982561,0,1,1,0,off-topic,2,106,2437,Harvard ave completely dead right now http://t.co/nkgYC4KJRq
77,1441958983025,0,1,1,0,off-topic,464,113,2901,@Iamlomonz thanks love. Just keep everyone affected in your prayers
78,1441958983546,1,1,1,1,on-topic,521,149,2871,If I get one more email about Marathon Monday safety rules I am going to purposely violate all of them.
79,1441958983552,0,1,1,0,off-topic,6,82,2734,Flight at Logan evacuated. What now?
80,1441958983554,1,1,1,1,on-topic,2,188,2723,What started out to be a fun day ended in shock &amp; tragedy. Such a sad worldwe live in. Prayers for all the victims  http://t.co/DjYOaYifht
81,1441958983558,0,1,1,0,off-topic,4,175,2718,@thedogpoundd lemme tell you how I've been on the journalists twitters, police scanner and live stream news since 5am homeboy SUP
82,1441958983560,0,1,1,0,off-topic,2,145,2715,Hearing on @WBUR 15 police officers in ER @StElizabethHosp should be released later today thank God
83,1441958983562,1,1,1,1,on-topic,2,176,2710,Standing close to the spot where the explosion was in #Boston 1 hour earlier makes me extremely #grateful to be at home right now.
84,1441958983564,1,1,1,1,on-topic,2,184,2707,Recently married couple lose legs in bombings: They were married in Boston in August, an unlikely match who fell... http://t.co/gus24X63zk
85,1441958983566,1,1,1,1,on-topic,2,147,2663,Multiple people who work in the federal courthouse just confirmed to me it has been evacuated #boston
86,1441958984030,1,1,1,1,on-topic,464,179,3001,Incredible the amount of god-hating and anti-religious people who are praying and thanking god when bad things happen #BostonMarathon
87,1441958984554,1,1,1,1,on-topic,524,178,2978,@edwinocon1 U should shut the fuck up&amp; show some care on what's happening. so what if they never cared until the bombing happen?
88,1441958985032,1,1,1,1,on-topic,478,183,3352,@BuzzFeed: The Epic, Crazy, Horrifying, Ongoing Story Of The Boston Marathon Bombers http://t.co/j7ydJRvbge just wow. @sourcefed @PhillyD
89,1441958985550,1,1,1,1,on-topic,518,133,3340,Loving my city right now.... And it won't be long before they catch this asshole bomber
90,1441958985551,1,1,1,1,on-topic,1,113,3239,Remember when Watertown is right next to where I live? Just praying
91,1441958985552,0,1,1,0,off-topic,1,184,3231,This piece of shit has already affected so many people's lives. Prolonging it and affecting an entire city's workday..turn yoself in bitch
92,1441958985553,1,1,1,1,on-topic,1,184,3161,@BrooklynDecker they did it so that the public will stop using social media to relay what is happening on the scanners. For officer safety
93,1441958985554,1,1,1,1,on-topic,1,180,3152,The world's media assembled for first #bostonmarathon #explosions update. #Boston #BostonBombings LIVE on @NECN http://t.co/zEm0uww92s
94,1441958986041,1,1,1,1,on-topic,487,107,3606,There are still ambulances coming in at #BMC #bostonexplosion
95,1441958986558,0,1,1,0,off-topic,517,105,3599,I wish death on nobody cause aint no coming back from that.
96,1441958986562,0,1,1,0,off-topic,4,167,3535,Thanking God for keeping my friends safe and praying for those that were harmed and the 2 lives that were taken too soon!
97,1441958986564,1,1,1,1,on-topic,2,168,3460,@SweetSinger2888 thanks. Praying for those who lost their lives,who were injured and those who witnessed 1st hand. #tragic
98,1441958987043,1,1,1,1,on-topic,479,179,3860,Thanks to everyone who called or texted, I was in between the bombs but I'm okay, I'm just glad my friends are safe #PrayersForBoston
99,1441958987553,0,1,1,0,off-topic,510,152,3858,@TroyCrossley do u not know wtf is going on ur friend is a mother fucking terrorist find him not play ball
100,1441958987554,0,1,1,0,off-topic,1,167,3840,Back Bay, corner Arlington &amp; Boylston: massive media encampment = nowhere for the Frosty Truck to park! #bostonstrong
101,1441958987555,1,1,1,1,on-topic,1,165,3815,RT @WCVB: #BREAKING: According to @WuWCVB, an arrest in #BostonMarathon bombing is imminent or has already taken place.
102,1441958987556,0,1,1,0,off-topic,1,146,3779,@balfonz I found a good stream and 8 have class in 10 minutes (watching it in class, no fucks given)
103,1441958987557,0,1,1,0,off-topic,1,176,3761,@Luke101988 You said it so well! It was just crazy there and my prayers go out to all that risk their lives to be first respondeds
104,1441958987557,1,1,1,1,on-topic,0,185,3710,#Breaking suspects' uncle talks about investigation-uncle states the boys cdnt adjust 2 American life n resented  anyone that could #boston
105,1441958987558,1,1,1,1,on-topic,1,142,3653,suspect on boat is 2nd Boston Marathon bombing suspect. Source said person was moving. #BREAKING
106,1441958988047,1,1,1,1,on-topic,489,148,4068,My heart is so broken for Boston right now. Sending love and prayers to everyone in our city right now
107,1441958988561,1,1,1,1,on-topic,514,194,3978,driving back home to Boston, &amp; when passing by the T Station I see numbers of soldiers arming the station. This is real, &amp; Boston is strong!
108,1441958988562,0,1,1,0,off-topic,1,159,3965,Police officers everywhere wielding guns if I start crying alone in the airport do u think I'll still have to fly
109,1441958988564,0,1,1,0,off-topic,2,127,3957,Just as I was slowly recovering from what happened on Monday..this has to happen.
110,1441958988565,1,1,1,1,on-topic,1,146,3942,@PeterVigneron Yes! I just finished the race. Two explosions and smoke. Cannot confirm it was bombs.
111,1441958988566,1,1,1,1,on-topic,1,152,3898,It feels so wrong that I was just at the bar having fun while all this tragedy was happening #bostonstrong
112,1441958988567,1,1,1,1,on-topic,1,182,3893,The tragedy happened @3:20 by 3:25 . I had about 25 different messages from all over the world. Thanks to all of you who did check on me
113,1441958988567,0,1,1,0,off-topic,0,149,3875,I know as soon as I get to David's I'm going to feel the biggest relief of my life.. Get me out of here
114,1441958988568,1,1,1,1,on-topic,1,149,3861,omggg now i'm scared...there were two explosions on boylston street at the finish line of the marathon.
115,1441958989051,1,1,1,1,on-topic,483,151,4330,@jthibodeau13 yeah, we are all okay. he finished shortly before the explosions, so he was safe, thank god
116,1441958989558,1,1,1,1,on-topic,507,146,4315,@Boston_Police: Despite reports to the contrary there has not been an arrest in the Marathon attack.
117,1441958989558,1,1,1,1,on-topic,0,177,4276,Bombing Suspects Uncle: They Do Not Deserve To Live On This Earth: BOSTON (CBS)  The uncle of the two men... http://t.co/xcfVJcvhSG
118,1441958989559,1,1,1,1,on-topic,1,119,4210,All of Boston on lockdown now. #marathonbombing #terrorism #prayforboston
119,1441958989561,1,1,1,1,on-topic,2,185,4186,@BostonGlobe: BREAKING NEWS: Residents describe pandemonium on Franklin Street in Watertown; source says suspect pinned down.PLEASE BE TRUE
120,1441958989562,1,1,1,1,on-topic,1,96,4170,@johnguilfoil yet news stations are live-streaming
121,1441958989563,0,1,1,0,off-topic,1,138,4138,@basedvirgin it must just be like the ER.  My friend is a patient and hasn't been evacuated.
122,1441958990056,1,1,1,1,on-topic,493,152,4511,@MarathonMom5 Good luck on the race.  My prayers are with you.  May what happened here never happen again.
123,1441958990559,1,1,1,1,on-topic,503,161,4490,Obama is coming to visit the victims of the bombing at MGH &amp; the secret service got this bitch on LOCK DOWN lol
124,1441958990560,1,1,1,1,on-topic,1,85,4440,Just heard an explosion #BostonMarathon
125,1441958990561,0,1,1,0,off-topic,1,96,4410,@Imthatkid19 he might be on a boat. Dead or Alive?
126,1441958990563,0,1,1,0,off-topic,2,168,4356,@mattgentili not at all. Praying and showing support is great, but taking immediate, tangible action to help is different.
127,1441958991059,1,1,1,1,on-topic,496,182,4795,So sad what happened in Boston today.  I was supposed to be downtown shopping. Glad we changed our plans. #BOS. Praying for the victims.
128,1441958991563,0,1,1,0,off-topic,504,116,4693,WCVB reports explosions were also heard on Franklin St. @BUNewsService
129,1441958991565,1,1,1,1,on-topic,2,128,4670,Mass general Hospital is reporting  2 casualties from the bomb at #bostonmarathon.
130,1441958991567,1,1,1,1,on-topic,2,132,4667,Flowers and letters at the finish line: Boston Bombing http://t.co/7XUpC0U2jw #iReport
131,1441958991570,0,1,1,0,off-topic,3,155,4647,News interviewing a poly sci professor who immediately says these guys are al Qaeda home grown terrorists -_-
132,1441958991570,0,1,1,0,off-topic,0,170,4637,@DavidVenner18 they r turning away ppl now blood banks full but nice idea sat @ soccer they r having a bake sale for victims
133,1441958991571,1,1,1,1,on-topic,1,182,4631,Shock gives way to angst in wake of Boston bombings: Within minutes, the gatherings began. In bars across the ... http://t.co/vL6qX2R7Jf
134,1441958991572,1,1,1,1,on-topic,1,177,4619,BPD: Fire At JFK Library Not Related To Downtown Explosions: BOSTON (CBS)  Boston Police are now saying a... http://t.co/DUndFLI8FU
135,1441958992062,1,1,1,1,on-topic,490,185,5046,RT @Startingastory: So awful. How a young, injured Saudi man was treated in the wake of the Boston marathon tragedy: http://t.co/IkgovBHmlk
136,1441958992563,1,1,1,1,on-topic,501,179,5045,RT @WAFB: REPORT: Mayor of Boston says officials have a suspect surrounded http://t.co/iwAWVrY4MG     #bostonbombings #bostonmarathon
137,1441958992564,1,1,1,1,on-topic,1,178,5031,RT @SassyGirlsProbs: What happened in Boston is a tragedy. Don't make it worse by making things up/spreading things that are untrue.
138,1441958992566,1,1,0,0,on-topic,2,184,5030,RT @DannyAmendola: I will DONATE $100 for EVERY pass I catch next season to whatever Boston Marathon Relief Fund there is. And $200 fo ...
139,1441958992567,1,1,0,0,on-topic,1,178,5028,RT @CBSNews: BREAKING NEWS: FBI releases video of possible suspects wanted in Boston Marathon bombing. PHOTO: http://t.co/WLZ3ZwNRFR
140,1441958992568,1,1,1,1,on-topic,1,182,4973,BREAKING NEWS: FBI says bombing suspect may be driving a 4-door, green 1999 Honda Civic with Massachusetts plates 116GC7. Please retweet
141,1441958992569,1,1,1,1,on-topic,1,152,4922,Sending out my prayers to the runners and the fans. Cherish all the special people in your life right now.
142,1441958992572,1,1,1,1,on-topic,3,181,4918,Boston Marathon Runners React To Bombing: BOSTON  Many people who live and work in Boston are still absorbing... http://t.co/tRVaznkUlB
143,1441958992574,0,1,1,0,off-topic,2,139,4879,Both of these chaotic ass events happened next to both of my jobs. The fuck it good right now
144,1441958992578,0,1,1,0,off-topic,4,183,4866,why would anyone say try want him dead, we NEED answers. Take him alive and let him get his little ass handed to him in prison #BitchMade
145,1441958992580,0,1,1,0,off-topic,2,116,4798,Starting the recovery the only way I know: #jackdaniels and hair metal
146,1441958993064,1,1,0,0,on-topic,484,138,5274,RT @AP: BREAKING: Federal officials deny that Boston Marathon bombing suspect is in custody.
147,1441958993541,1,1,1,1,on-topic,477,166,5276,RT @NewsBreaker: BREAKING: AP: Surviving Boston bomb suspect identified as Dzhokhar A. Tsarnaev, 19, of Cambridge, Mass.
148,1441958993543,1,1,1,1,on-topic,2,163,5278,RT @wxward: 6 hours ago, Reddit may have solved the Boston bombing before the Feds. http://t.co/BowkzNWaMO #Watertown
149,1441958993545,1,1,1,1,on-topic,2,172,5268,A bomb. Few innocent lives had been taken. Caused hundreds of injuries. Bloody choas in Boston. People, where's your humanity?
150,1441958993546,1,1,0,0,on-topic,1,161,5270,RT @AP: BREAKING: AP: Surviving Boston bomb suspect identified as Dzhokhar A. Tsarnaev, 19, of Cambridge, Mass. -SS
151,1441958993552,1,1,1,1,on-topic,6,133,5271,Boston Marathon bombings: FBI releases photos, video of suspects http://t.co/Dm99KcArwH
152,1441958993554,1,1,1,1,on-topic,2,182,5255,Country Music Marathon planners react to Boston tragedy: Competitors leave the starting line at the 2010 Count... http://t.co/nd4cPF96oa
153,1441958993555,1,1,1,1,on-topic,1,186,5261,RT @billhobbs: I totally believe Obama will get the terrorists who hit Boston just like he got the ones that hit Benghazi. Totally. Comp ...
154,1441958993557,1,1,1,1,on-topic,2,186,5262,RT @NBCPhiladelphia: RT @AP: BREAKING: Law enforcement official: Arrest imminent in Boston Marathon bombing, suspect to be brought to court.
155,1441958993558,1,1,0,0,on-topic,1,165,5252,RT @AP: BREAKING: Law enforcement official: Arrest imminent in Boston Marathon bombing, suspect to be brought to court.
156,1441958993559,1,1,1,1,on-topic,1,184,5240,#Waco - if you've seen the explosion video, there are going to be severe injuries needing immediate medical attention - waco isn't Boston.
157,1441958993561,1,1,1,1,on-topic,2,133,5241,boston marathon contest from explosion accident process report.  http://t.co/Fa5v9PiSRv
158,1441958993562,1,1,1,1,on-topic,1,131,5242,fbi releases photos of two #boston bomb #suspects - reuters uk http://t.co/5TlFZ9OPme
159,1441958993565,1,1,1,1,on-topic,3,132,5228,RT @timesofindia: #Boston police official confirms bomb suspect dead, hunt for second.
160,1441958993567,1,1,0,0,on-topic,2,186,5229,RT @SportsCenter: BREAKING: Suspect #1 in Boston Marathon bombing shot and killed by police. Suspect #2 on the run, massive manhunt unde ...
161,1441958993568,1,1,1,1,on-topic,1,154,5225,RT @LawsonAndy: Can’t believe what I’m watching. Devastating what has happened in Boston. #PrayForBoston
162,1441958993569,1,1,0,0,on-topic,1,186,5224,RT @SportsCenter: BREAKING: Suspect #1 in Boston Marathon bombing shot and killed by police. Suspect #2 on the run, massive manhunt unde ...
163,1441958993570,1,1,1,1,on-topic,1,165,5219,RT @Follow_MyFace: First Boston , Now Texas?? Smh Prayers Out To Everyone Affected By it #PrayForBoston & #PrayForTexas
164,1441958993573,1,1,0,0,on-topic,3,186,5221,RT @MassStatePolice: BOSTON MARATHON BOMBING SUSPECTS. IF YOU RECOGNIZE EITHER OF THEM, CALL 1-800-CALL-FBI IMMEDIATELY. http://t.co/NEh ...
