2453,1442074526635,0,0,1,0,off-topic,1,81,4562,I'll be in DC this time next month!
2454,1442074526640,0,0,1,0,off-topic,5,113,4563,What do you get when you put 50 lawyers in a room with 50 lesbians?
2455,1442074526644,1,0,1,0,on-topic,4,171,4564,Makes me smile to see firefighters on the processional taking pics and video of the crowd. They're touched too. #westmemorial
2456,1442074526646,0,0,1,0,off-topic,2,116,4565,I'm tryna catch a break . But every time I do some always goes wrong .
2457,1442074526649,0,1,1,0,off-topic,3,186,4566,@CALMATE_Carina as long as it's healthy lol. I'm not going to eat anything I'm going to take some drink it's a meal replacement it's healthy
2458,1442074526650,0,1,1,0,off-topic,1,112,4567,Satan asks the third guy, What was your daddy when you were alive?
2459,1442074526651,0,1,1,0,off-topic,1,80,4568,I really just wanna get fucked up.
2460,1442074526652,0,1,1,0,off-topic,1,92,4569,Ying Yang twins are going to be here on DIA ?!
2461,1442074526654,0,1,1,0,off-topic,2,87,4570,@WhatTheDickens_ why are you going home??
2462,1442074526655,0,0,1,0,off-topic,1,85,4571,@MissJenn121211 WELL work go get one!!!
2463,1442074526657,0,0,1,0,off-topic,2,105,4572,@JMag90 @ngunyi_michelle OMG!!!!  He knew wat he was dong!!
2464,1442074526658,0,1,1,0,off-topic,1,100,4573,Got this yungsta in the crib right now killing shit...
2465,1442074526660,0,1,1,0,off-topic,2,124,4574,Wish I had a girl to kick it with , shii gone be back right soon hopefully ...
2466,1442074526661,0,0,1,0,off-topic,1,153,4575,@AdamAjSalinas ok it didn't work ok i tried and it didn't work....i refuse to slow down my life ok im sorry
2467,1442074526661,0,1,1,0,off-topic,0,108,4576,I never wanted to be your whole life-- just your favorite part
2468,1442074526662,0,0,1,0,off-topic,1,173,4577,Everyone pay there money to go to school in PJ's tomorrow? Smh or go to school for free and not look ratchet #DUMB  #FUNDRAISER
2469,1442074526663,1,1,1,1,on-topic,1,178,4578,I feel like the people that are interested in just seeing Obama just shouldn't go. Don't forget the purpose of the memorial service.
2470,1442074526664,0,0,1,0,off-topic,1,167,4579,#tbt to the best spring break ever with my best friend! #HPL #Hogwarts #normal  @ Hogsmead Village http://t.co/EYGfCNLKdX
2471,1442074526664,0,0,1,0,off-topic,0,101,4580,Well looks like I ain't making my Mama that cheese cake
2472,1442074526969,0,0,1,0,off-topic,305,105,4581,@BegginForMOE nearest liquor bottle JK hope you feel better
2473,1442074526970,0,0,1,0,off-topic,1,105,4582,@johnnyjeff05 you comin down for the summer semesters right
2474,1442074526972,0,0,1,0,off-topic,2,116,4583,@ashleyybrooke6: Feels so good to not work on a Saturday for once AMEN
2475,1442074526972,0,1,1,0,off-topic,0,125,4584,@teeburt9493: I don't see how some people just stay on twitter forever.. Guilty
2476,1442074526973,0,1,1,0,off-topic,1,167,4585,Here at Baylor the girls don't have to study for finals. We just have to pray that our future husbands are. #ringbyspring
2477,1442074526973,0,0,1,0,off-topic,0,111,4586,@YoungBoyBurton: Gotta watch who you love, love will let you down
2478,1442074526974,0,0,1,0,off-topic,1,87,4587,Goodluck to all the juniors testing today
2479,1442074526975,0,0,1,0,off-topic,1,126,4588,#WeCantDateIf &lt;------ girls y'all need to stop using this lol y'all look dumb
2480,1442074526976,0,0,1,0,off-topic,1,88,4589,@TheReal_BAIN wish I was.... Stuck in waco
2481,1442074526977,0,0,1,0,off-topic,1,93,4590,@Pretty_Eyez_94 how I tweeted it before you guy
2482,1442074526979,0,0,1,0,off-topic,2,90,4591,Never been with a playa x big binky &gt;&gt;
2483,1442074526980,0,0,1,0,off-topic,1,97,4592,Fuck my feelings .... That's usually how it goes ..
2484,1442074526982,0,0,1,0,off-topic,2,142,4593,The area code that the Westboro Baptist Church is located in is 66604. Coincidence? I think not.
2485,1442074526983,0,1,1,0,off-topic,1,189,4594,just got into my fluffy pajama pants, walk out in the front yard to my car &amp; the damn sprinklers come on... DARN YOUR AUTOMATIC SPRINKLERS!
2486,1442074526984,0,0,1,0,off-topic,1,171,4595,Watching David Letterman for the 1st time ever &amp; his quick sarcasm reminds me of Prof. Harris! @lisamonthie #gottalovehim
2487,1442074526984,0,0,1,0,off-topic,0,171,4596,I mean, I shared a build-a-bear monkey with my ex and look how that turned out. #IGotStuckWithTheMonkey #NoMonkeySupportMoney
2488,1442074526985,0,0,1,0,off-topic,1,76,4597,I seriously need a haircut foo
2489,1442074526987,0,0,1,0,off-topic,2,159,4598,@RalphLondon_: Finna jump in my tlady bed and mess w/ her till she wake upNuh uh stay your grown ass in YOUR bed.
2490,1442074526987,0,1,1,0,off-topic,0,81,4599,Waco. 3 more hours then San Antonio
2491,1442074526989,0,0,1,0,off-topic,2,135,4600,@BarryHartweg why would you tweet about that and announce it to the world... #embarrassed
2492,1442074526989,0,0,1,0,off-topic,0,120,4601,Bump to the beat in the streets! !!! Turn it up on the 4 o clock four play
2493,1442074526990,1,0,1,0,on-topic,1,178,4602,So glad I went to the memorial today. The best thing wasn't seeing the president speak, but the videos of the legacy those men left.
2494,1442074526990,0,1,1,0,off-topic,0,112,4603,They Will Fuck over You ina minute and swear nothing wrong with It
2495,1442074526991,0,0,1,0,off-topic,1,129,4604,Learn To Appreciate What You Have , Before Time Makes You Appreciate What You Had .
2496,1442074527530,0,1,1,0,off-topic,539,115,4605,@OhItsJehtay @krissybrown73 but what comment started the whole thing?
2497,1442074527531,0,0,1,0,off-topic,1,70,4606,Ready to talk to my baby
2498,1442074527533,0,0,1,0,off-topic,2,108,4607,And so we meet again: the question of pancakes versus physics.
2499,1442074527535,0,0,1,0,off-topic,2,101,4608,Light skins and dark skins then it became a competition
2500,1442074527537,0,0,1,0,off-topic,2,133,4830,@itsalwaysMIA: Umm.. RT@Ant_GetBuckets: @itsalwaysMIA hey can I be your friend? (:No!!!
2501,1442074527538,0,0,1,0,off-topic,1,164,4831,@itsanastacia_: who's down for roasting marshmallows on the West middle school? ha tackiest shit I've seen in so long.
2502,1442074527539,0,0,1,0,off-topic,1,116,4832,I'm bored AF, I guess it's good that I always find sleep entertaining.
2503,1442074527540,0,1,1,0,off-topic,1,106,4833,Its too live that president Obama gone be at baylor tomorrow
2504,1442074527541,0,0,1,0,off-topic,1,75,4834,Had too help you out one time
2505,1442074527543,0,0,1,0,off-topic,2,81,4835,@BegginForMOE did the aspirin help?
2506,1442074527545,0,0,1,0,off-topic,2,150,4836,Staaaaaarving like a mo'fo but Wing Stop should hit the spot. I can't wait for 12:15 anymore. Hurrrryyy.
2507,1442074527546,0,1,1,0,off-topic,1,129,4837,just sayin it doesn't look good saying all your 4th graders are messaging you.. LOL
2508,1442074527547,0,0,1,0,off-topic,1,90,4838,Wish I couldn't feel, wish I couldn't love..
2509,1442074527548,0,0,1,0,off-topic,1,96,4839,Niggas bout to cough up where this nigga stay lmao
2510,1442074527550,0,0,1,0,off-topic,2,94,4840,@CurvACEouZ yay!!!!!! I'm so happy you are here!
2511,1442074527552,0,0,1,0,off-topic,2,109,4841,@akenjari plus why give up the chance to learn more about India
2512,1442074527553,0,0,1,0,off-topic,1,160,4842,When your in the middle of a concert in the shower &amp; the water turns cold from too many ppl usin the hot water
2513,1442074527554,0,1,1,0,off-topic,1,83,4843,@Greg_2LiveAnd no new friends so two.
2514,1442074527555,0,0,1,0,off-topic,1,130,4844,Anytime I'm reminded of things in my past, I remember it's in the past for a reason.
2515,1442074527556,0,0,1,0,off-topic,1,70,4845,My computer makin me mad
2516,1442074527558,0,0,1,0,off-topic,2,83,4846,Oomf is suppose to be here with me rn
2517,1442074527560,0,0,1,0,off-topic,2,121,4847,XL Miami Heat red long sleeve thanks @KaseyMontgomery....have a good day :)
2518,1442074527561,0,0,1,0,off-topic,1,83,4848,Dealing with two different situations
2519,1442074527562,0,0,1,0,off-topic,1,186,4849,Breaks my heart when girls from west come in to get dresses &amp; they tell me they are having to move from west, change jobs, homes bc they
2520,1442074527563,0,0,1,0,off-topic,1,93,4850,@ComeTakeAPuff duh you can't leave a real nigga
2521,1442074527565,0,0,1,0,off-topic,2,75,4851,We been new you was a pervert
2522,1442074527566,0,0,1,0,off-topic,1,134,4852,You know summer is drawing near when you get an email about returning your micro fridge.
2523,1442074527567,0,1,1,0,off-topic,1,174,4853,And so it begins, our drive for our first NBA Championship. Let's go win this, @zachtaylor_19. #NBAPlayoffs #Thunder #OKC #1Down
2524,1442074527568,0,0,1,0,off-topic,1,89,4854,@2ravebitchez so your not guys then? Hahaha
2525,1442074527569,0,1,1,0,off-topic,1,107,4855,Member when I found out last year I passed mine was too live!
2526,1442074527571,0,1,1,0,off-topic,2,177,4856,Keeping close eye on #Watertown @FBIPressOffice: New Image Released of Suspect in Bombing Case:  Boston http://t.co/GluGLsJMxo #FBI
2527,1442074527571,0,1,1,0,off-topic,0,122,4857,@5hark_Lee I'm at home and we can leave now lol we ain't on lock down nomore
2528,1442074527572,0,1,1,0,off-topic,1,96,4858,8 more days of class! Then finals! #summeriscoming
2529,1442074527574,0,0,1,0,off-topic,2,175,4859,@Googlearthpics: Most animals get funnier when you shave them. Not bears. Bears get more terrifying. http://t.co/5H8WZad05C Wtf?!
2530,1442074527575,1,0,1,0,on-topic,1,134,4860,Using what I learned at #mfm13 to help with the family assistance center. #westexplosion
2531,1442074527575,1,1,1,1,on-topic,0,160,4861,Just donated some items at Extraco Events Center @BasedBrownKid @DannyPanda212 #PrayforWest http://t.co/b3xqHqslCc
2532,1442074527576,1,0,1,0,on-topic,1,89,4862,My prayers goez out to wezt texas... #faith
2533,1442074527578,1,0,1,0,on-topic,2,153,4863,@WacoPolice @wacotrib Prayers go out to all emergency responders. God bless you for the work you are doing.
2534,1442074527578,0,0,1,0,off-topic,0,173,4864,@megcottrell I should put mine on private to never know which Indian girl maybe creeping on me... Lol @DaneAGross @MissLizzzzzz
2535,1442074527579,0,0,1,0,off-topic,1,72,4865,Lol u must not kno me then
2536,1442074527581,0,0,1,0,off-topic,2,109,4866,@IHeart_Hoopers: Garantee you off top I'm better than your last
2537,1442074527582,0,0,1,0,off-topic,1,155,4867,After shopping with @SoAshley13, I've realized mine and her definition of a red shirt is completely different
2538,1442074527583,0,0,1,0,off-topic,1,112,4868,The dance I do when roomie's bf isn't in the room &gt;&gt;&gt;&gt;
2539,1442074527584,0,0,1,0,off-topic,1,88,4869,@_AndrewLashod you better follow me back..
2540,1442074527586,0,0,1,0,off-topic,2,157,4870,@Chase_goes_rawr I probably won't. I don't feel financially stable enough to blow 200 dollars this weekend lols
2541,1442074527586,0,0,1,0,off-topic,0,64,4871,The DM I sent oomf
2542,1442074527588,0,0,1,0,off-topic,2,106,4872,When you don't give a fuck what anyone says &gt;&gt;&gt;&gt;
2543,1442074527589,0,1,1,0,off-topic,1,141,4873,@baron_jodi @nurya oh just twitter :) we were actually just talking about how we both love you!
2544,1442074527590,0,0,1,0,off-topic,1,76,4874,Lame ass niggas talk about mee
2545,1442074527592,0,0,1,0,off-topic,2,116,4875,I need a boyfriend so I can stop spoiling my sister.  @KristennnBrooke
2546,1442074528094,0,0,1,0,off-topic,502,90,4876,Hahaha doggie parents  damn I was semi right
2547,1442074528096,0,0,1,0,off-topic,2,169,4877,Sitting in the 1pm breifing with all the officials from all the departments. Waiting for them to let http://t.co/AnApMHfLLe
2548,1442074528096,0,0,1,0,off-topic,0,144,4878,Beckas the only one I know who can hold it down at ihop like me but she's being a Weiner.. soooooo
2549,1442074528098,0,1,1,0,off-topic,2,174,4879,Ahhhhhhhhhh!!! Cabinet doors are going up! Now for the other side! Kitchen is almost completely finished. http://t.co/ToRF1rGdAH
2550,1442074528098,0,0,1,0,off-topic,0,79,4880,@Scottyday hey, my mom has those!
2551,1442074528100,0,0,1,0,off-topic,2,138,4881,Super excited about Jurassic Park 3-D tomorrow with @michael_sch @BAYLOR_PAYTON @CarleeJoy_P
2552,1442074528101,0,0,1,0,off-topic,1,116,4882,@rihanna is 9272617445938x more attractive because she reps Lebron too
2553,1442074528102,0,0,1,0,off-topic,1,97,4883,@alyssacuevas1 hey little girl you need to text me!
2554,1442074528107,0,0,1,0,off-topic,5,109,4884,I'm at Czech Stop (West, TX) w/ 3 others http://t.co/iZNhC45cpF
2555,1442074528110,0,1,1,0,off-topic,3,98,4885,You can find Gringo in the library. It's going down.
2556,1442074528115,0,0,1,0,off-topic,5,70,4886,Love Will Get You Killed
2557,1442074528118,1,0,1,0,on-topic,3,140,4887,Cefco gas station is giving out free kolaches today. #westtx @ West, TX http://t.co/n41USxt7QX
2558,1442074528120,0,0,1,0,off-topic,2,110,4888,Jesus sought me when a stranger, wandering from the fold of God.
2559,1442074528121,0,0,1,0,off-topic,1,73,4889,Bout to smoke &amp; get otp
2560,1442074528122,0,1,1,0,off-topic,1,86,4890,I get happy now when I take my shirt off
2561,1442074528124,0,0,1,0,off-topic,2,183,4891,@brooke_xo_Not after all that oil and what not its after shaving creme cause after shaving creme you don't use nothing else besides soap!
2562,1442074528125,0,0,1,0,off-topic,1,89,4892,@DeAsiaaRobinson Happy Birthday To My Nigga
2563,1442074528127,0,1,1,0,off-topic,2,79,4893,I was 2ft from going to regionals
2564,1442074528130,0,0,1,0,off-topic,3,81,4894,Don't try to explain shit to me .!!
2565,1442074528132,0,0,1,0,off-topic,2,80,4895,Watching the hunger games in class
2566,1442074528138,0,0,1,0,off-topic,6,180,4896,I will say that a lot of administration has effected some of the activities Baylor has had in the past but they're the same as last yr
2567,1442074528139,0,0,1,0,off-topic,1,125,4897,I'm not looking forward to seeing everyone crying especially my brother and mom
2568,1442074528140,0,0,1,0,off-topic,1,190,4898,Which is fuxking bullshit bc I was supposed to get a app in feb but I put it off bc of Js deployment/grad &amp; then she told me not to in march
2569,1442074528141,0,0,1,0,off-topic,1,92,4899,Try to break me down but I'm like a brick wall
2570,1442074528143,0,0,1,0,off-topic,2,101,4900,@TheRealRaveen I know Raveen. you don't have to say it.
2571,1442074528470,0,0,1,0,off-topic,327,113,4901,@ThatDamnDash Forreal?? I'll see what I can do!! Money talks cuddie
2572,1442074528471,0,1,1,0,off-topic,1,172,4902,Iv been so blessed to have a great family and I just wanted to say I love you guys so much! @Coach_Cruz12 @ThisIsTheZemix #FOE
2573,1442074528472,0,0,1,0,off-topic,1,169,4903,You can't control what other people think of you but you can control what you think about yourself. Fuck what a hater says.
2574,1442074528473,0,0,1,0,off-topic,1,83,4904,@princesscathh I have no fucking clue
2575,1442074528474,0,0,1,0,off-topic,1,122,4905,When people question God&lt;&lt;&lt;&lt;&lt;&lt;&lt;&lt;&lt;&lt;&lt;&lt;&lt;
2576,1442074528475,0,0,1,0,off-topic,1,109,4906,I'm at Waco, TX - @cityofwaco (Waco, TX) http://t.co/VQSIQIZJKv
2577,1442074528477,0,0,1,0,off-topic,2,106,4907,@Emilyjenogan if you want to stalk me.. You CAN! Hahaha lmao
2578,1442074528478,0,0,1,0,off-topic,1,118,4908,Feeding the ducks (: (@ Downtown Farmer's Market) http://t.co/Kb4VhQt4zm
2579,1442074528479,0,0,1,0,off-topic,1,83,4909,This Is Exactly Why I Stay To Myself!
2580,1442074528481,0,1,1,0,off-topic,2,95,4910,Losing  weight :\ imma have to start eating more.
2581,1442074528483,0,0,1,0,off-topic,2,108,4911,Texas Is A Prejudice State No Damn Well They Dont Like Obama.!
2582,1442074528484,0,0,1,0,off-topic,1,175,4912,I saw that on tv once, a guy spontaneously combusted and caught on fire on the toilet...I was scared and drank water ever since..
2583,1442074528485,0,1,1,0,off-topic,1,118,4913,Won our first game lost our second, we did good for our first tournament
2584,1442074528486,0,0,1,0,off-topic,1,97,4914,Keep Calm  , I'm still Sleeping Gooooooddd At Night
2585,1442074528487,0,0,1,0,off-topic,1,99,4915,I'm tryna find a reason not to go out every evening !
2586,1442074528489,0,0,1,0,off-topic,2,139,4916,@itsmanlymann: Love is a two way street but you have to be careful because women can't drive.
2587,1442074528490,0,0,1,0,off-topic,1,77,4917,I got a million ways to get it!
2588,1442074528492,0,0,1,0,off-topic,2,152,4918,@mayyyron smh it wouldn't, they're somewhat lucky that they have Russian backgrounds. *sigh* this is crazy
2589,1442074528493,0,1,1,0,off-topic,1,131,4919,I really should go to sleep. Now. But I'm just in a blah mood. I don't want to sleep.
2590,1442074528494,0,0,1,0,off-topic,1,83,4920,How I accidentally fuck up my own day
2591,1442074528495,0,0,1,0,off-topic,1,76,4921,TURN UP ! Turn Down For What !
2592,1442074528497,1,1,1,1,on-topic,2,132,4922,Anyone know of any MAJOR explosions near Dallas....I-35 just got covered in gray smoke
2593,1442074528498,0,0,1,0,off-topic,1,119,4923,@Xman813: 2 Chainz! That's yo best answer! 2 Rangzzz that's the best EVER
2594,1442074528499,0,0,1,0,off-topic,1,99,4924,@NextBestSecret dang y'all have to wake early as heck
2595,1442074528500,0,0,1,0,off-topic,1,92,4925,@MairaArellano28 I look bad in all my pictures
2596,1442074528502,0,1,1,0,off-topic,2,140,4926,@Timbo_Cole24 @realskipbayless I know what you mean bro. I've just never heard you be so vocal
2597,1442074528503,0,1,1,0,off-topic,1,90,4927,@JaredDiedrich me and @dani_crayy are going.
2598,1442074528504,0,0,1,0,off-topic,1,157,4928,for once im at peace with myself. ive been burdened with blame, trapped in the past for too long. im movin on..
2599,1442074528505,0,0,1,0,off-topic,1,169,4929,These are adventurous times. If you try to keep your life, you always end up losing it. But when you http://t.co/I64LUkSWvk
2600,1442074528506,0,1,1,0,off-topic,1,71,4930,Life startin to get scary
2601,1442074528507,0,0,1,0,off-topic,1,103,4931,@Mvke_: Check my fashion bitch , this shit aint average!!
2602,1442074528509,0,0,1,0,off-topic,2,85,4932,All the way from the bottom to the best
2603,1442074528510,0,0,1,0,off-topic,1,78,4933,#oomf is ALWAYS the third wheel.
2604,1442074528512,0,1,1,0,off-topic,2,86,4934,@kristynx87 i took a 6 hour nap today :)
2605,1442074528515,1,1,1,1,on-topic,3,191,4935,#Obama &amp; #Westboro are coming to the #West Memorial service. So Sad that a time to remember &amp; grieve will be a media circus. #prayforwest
2606,1442074528516,0,0,1,0,off-topic,1,98,4936,@pallo_24 your team??? When did you become the owner
2607,1442074528517,0,1,1,0,off-topic,1,154,4937,I heard Baylor had a weather machine made JUST for today... NICE TRY. DIIIAAAAAAA!!!! #comininhot #dartytime
2608,1442074528655,0,0,1,0,off-topic,138,158,4938,@teeburt9493: I WOKE UP IN A NEW BUGATTI !!!!! I WOKE UP IN A NEW BUGATTI !!!!! I WOKE UP IN A NEW BUGATTI !!!!!
2609,1442074528656,0,0,1,0,off-topic,1,104,4939,I might have to take your number when I'm through with ya.
2610,1442074528657,0,0,1,0,off-topic,1,183,4940,He will wipe every tear from their eyes. There will be no more death or mourning or crying or pain #Revelation21:4 http://t.co/ur6DkQGedQ
2611,1442074528658,0,0,1,0,off-topic,1,74,4941,Do me a favor save that shit
2612,1442074528660,0,1,1,0,off-topic,2,85,4942,Your Bodys My party lets get it started
2613,1442074528662,0,0,1,0,off-topic,2,71,4943,Today has been a good day
2614,1442074528664,0,0,1,0,off-topic,2,85,4944,@GrabMyGat you know where I love right?
2615,1442074528666,1,0,1,0,on-topic,2,141,4945,Expecting a very large event from across the state and nation to honor fallen first responders.
2616,1442074528666,0,0,1,0,off-topic,0,153,4946,Oh snap! Heard it hear first... #genosmith to @dallascowboys Word! Haha. Say sumthin!!! I can hope can't I!
2617,1442074528667,0,0,1,0,off-topic,1,70,4947,I DON'T CARE. I LOVE IT.
2618,1442074528669,0,1,1,0,off-topic,2,73,4948,Lmao Second place ass bitch
2619,1442074528671,0,0,1,0,off-topic,2,178,4949,3) I don't give a flippity fuck if you like it or not there's a unfollow button for a reason. Get over it. It's my twitter not yours
2620,1442074528672,0,1,1,0,off-topic,1,135,4950,My Mama getting on my nerves and she's only said two sentences to jr in the last.24.hours
2621,1442074528673,0,0,1,0,off-topic,1,98,4951,@Natalia__Malik like a lot of shooting stars at once
2622,1442074528674,0,0,1,0,off-topic,1,168,4952,@bekahforest you are on the road to recovery 1st step saying you have a problem and admitting it. 2nd committing to change
2623,1442074528674,0,0,1,0,off-topic,0,99,4953,I'm no longer In the picture baby, dont waist ya time
2624,1442074528676,0,0,1,0,off-topic,2,116,4954,@TheTyMontague lol cause my house is a few blocks away from your house
2625,1442074528677,0,0,1,0,off-topic,1,69,4955,Time to get some sleep.
2626,1442074528678,0,0,1,0,off-topic,1,82,4956,Being Mature will Get You A Long Way
2627,1442074528680,0,0,1,0,off-topic,2,118,4957,I'm at Family Dollar - @myfamilydollar (Waco, TX) http://t.co/dDzgQoCI8D
2628,1442074528681,0,0,1,0,off-topic,1,80,4958,I peep everything get over on me !
2629,1442074528682,0,0,1,0,off-topic,1,166,4959,I got the warriors beating the nuggets in the playoffs!! All the other western conference games I could careless about..
2630,1442074528683,0,0,1,0,off-topic,1,183,4960,@LatalyaDenese: I think the reason my relationships dont work is because I never give anybody 100% of the real me in fear of getting hurt
2631,1442074528683,0,0,1,0,off-topic,0,81,4961,Shoulda put some money on that shit
2632,1442074528684,0,1,1,0,off-topic,1,183,4962,Body: But can I pleaseee just lay around and watch Netflix all day?!Life: Sure!.. LOLCATZ JKNow get to class before I make things worse..
2633,1442074528685,0,0,1,0,off-topic,1,171,4963,Flinging our green and gold... and blue and pink and purple!!!  #Baylor Paint Run! #diadeloso13 #sicem http://t.co/AYwCRiKyZW
2634,1442074528685,0,0,1,0,off-topic,0,101,4964,If Memphis was winning the refs wouldn't be cheatin tho
2635,1442074528687,0,1,1,0,off-topic,2,74,4965,I'm going Saturday for real!
2636,1442074528688,0,1,1,0,off-topic,1,183,4966,@DragonLordEmrys Hey, so I started watching Merlin recently and am also done with season 2. My point: I know what your names means now xD
2637,1442074528689,0,1,1,0,off-topic,1,163,4967,Every time I get a group email from my political science group I just want to jump through my computer and smack them
2638,1442074528689,0,0,1,0,off-topic,0,107,4968,@JD_HaveDreams I'm not even sure I think some where in marlin
2639,1442074528690,0,0,1,0,off-topic,1,78,4969,@ItssTeee_ lol it aint that hard
2640,1442074528692,0,0,1,0,off-topic,2,190,4970,@davidsibley @drtysxyministry that page clearly didn't go to CPE where it would've learned that we need to be open&amp;direct about our concerns
2641,1442074528692,0,1,1,0,off-topic,0,134,4971,I love waking up sore from a workout just lets me know that I did what I was suppose to.
2642,1442074528693,1,1,1,1,on-topic,1,126,4972,@jmathews7 I'm ok. (: They're just worried about the fumes reaching us tomorrow.
2643,1442074528693,0,0,1,0,off-topic,0,74,4973,Let the Lord be with us #254
2644,1442074528847,0,0,1,0,off-topic,154,104,4974,@imQUESHA lol who is ? Y'all taking all our customers hell
2645,1442074528850,1,0,1,0,on-topic,3,117,4975,@alex_sowell12 my aunt &amp; uncle are both out there helping! #PRAYING
2646,1442074528852,0,0,1,0,off-topic,2,156,4976,i hate when girls are like we don't like each other. no hun, you don't like me. i don't give a f.ck about you.
2647,1442074528854,0,0,1,0,off-topic,2,74,4977,I have a HUGE crush on oomf.
2648,1442074528862,0,0,1,0,off-topic,8,94,4978,At Flying J Travel Plaza  http://t.co/C7AkWIDstJ
2649,1442074528867,1,0,1,0,on-topic,5,107,4979,Gov. Perry issued a disaster proclamation for McLennan County
2650,1442074528870,1,1,0,0,on-topic,3,169,5169,RT @BreakingNews: Texas authorities advise West, Texas, residences to leave town immediately following explosion - @WestISD
2651,1442074528871,1,0,1,0,on-topic,1,135,5170,Rudy Monteagudo Tip: Calls capture terror of Texas plant explosion http://t.co/1dj0EO8Wg4
2652,1442074528872,1,0,1,0,on-topic,1,174,5171,Congress cut backs on safety inspectors kills innocent people in Texas explosion. Great job congress!!#notenoughsafetyinspectors
2653,1442074528872,1,0,1,0,on-topic,0,80,5172,The explosion in Texas looks crazy
2654,1442074528874,1,0,1,0,on-topic,2,108,5173,15 feared dead in Texas plant explosion http://t.co/StoKFOrP8r
2655,1442074528876,1,0,1,0,on-topic,2,143,5174,A fourth-generation farmer's perspective on the Texas fertilizer explosion http://t.co/MRy92GXNIR
2656,1442074528877,1,1,0,0,on-topic,1,176,5175,RT @BonnieBernstein: Boston. Now this horrible fertilizer plant explosion in Texas. Please. Someone make this week stop already...
2657,1442074528878,1,1,0,0,on-topic,1,178,5176,RT @YourAnonNews: #BREAKING - Dispatcher on the West Texas radio reports of another explosion at fire scene, Fire fighters are down.
2658,1442074528880,1,1,0,0,on-topic,2,138,5177,RT @KeeganAllen: Terrible - Just awful... In my thoughts and Prayers. http://t.co/bh2CTv2MsF
2659,1442074528882,1,0,1,0,on-topic,2,164,5178,RT @HealthyLiving: What are the potential health risks of the Texas fertilizer plant explosion? http://t.co/umHFb2JEae
2660,1442074528883,1,0,1,0,on-topic,1,186,5179,RT @garytx: Lots of mutual aid headed to West, TX aft fertilizer plant explosion, many structures burning, people trapped, numerous inju ...
2661,1442074528884,1,0,1,0,on-topic,1,185,5180,RT @TattooedBarbie: OMG @AshleyMarietta: WOW.. the video of today's explosion in Texas is unbelievable  #PrayForTexas http://t.co/Gtx1O ...
2662,1442074528885,1,0,0,0,on-topic,1,186,5181,RT @Rangers: Our thoughts are with our fellow Texans in the city of West tonight as they recover from tonight's explosion. #TexasLove #W ...
