1347,1442074504827,0,0,1,0,off-topic,0,175,2082,Dear little freshman boy, SHOUTING your conversation in Collins does not make you any cooler #interruptingmahsportscenter #shutup
1348,1442074504828,0,0,1,0,off-topic,1,95,2083,@LowkeyBri there aint nothing wrong with that lol
1349,1442074505011,0,1,1,0,off-topic,183,181,2084,For the people that don't like me hate me dont talk to me well i don't give a fuck just know im going to be somewhere on top you aint!!
1350,1442074505011,0,0,1,0,off-topic,0,79,2085,You forgot about it?  Yeah Me too
1351,1442074505011,0,0,1,0,off-topic,0,83,2086,West, Texas is a great town I love it
1352,1442074505012,0,0,1,0,off-topic,1,88,2087,Water, water... #ThirstyThe thirst is real
1353,1442074505012,0,0,1,0,off-topic,0,178,2088,my patients are looking at me tonight like... do you need a Kleenex? should you be making me better when you clearly have malaria?..
1354,1442074505013,0,0,1,0,off-topic,1,76,2089,Helena beat - Foster of People
1355,1442074505013,0,1,1,0,off-topic,0,177,2090,It's a certain type of person who has iPhone read receipts on, like you have them on and it just makes sense @chelseatshort #uhwhat
1356,1442074505013,0,0,1,0,off-topic,0,118,2091,If it's not windy through the tunnel, then it won't be windy. #NoRoLogic
1357,1442074505014,0,0,1,0,off-topic,1,94,2092,@YoSoyFAME you need to cook for me one day then.
1358,1442074505014,0,0,1,0,off-topic,0,166,2093,@bmiana love with it!! So he's getting the setting here but getting the center diamond over there bc it's a better cost.
1359,1442074505014,0,1,1,0,off-topic,0,184,2094,@everydayakita @vapriestess Coming Soon: rector Barbie!  Because being in charge of a church &amp; day school isn't just for boys anymore!
1360,1442074505015,0,0,1,0,off-topic,1,113,2095,@fabi_hdz_franco: Oh snap!!! Is that 11 players? #nfldraft ?!? Yes!
1361,1442074505199,1,0,1,0,on-topic,184,145,2096,RT @NomaanMerchant: Today's @wacotrib front after the explosion last night - http://t.co/8qK4WTdNaW
1362,1442074505201,0,0,1,0,off-topic,2,73,2097,Get out your feelings bitch
1363,1442074505204,0,0,1,0,off-topic,3,97,2098,If I go crazy then will you still call me Superman?
1364,1442074505208,0,0,1,0,off-topic,4,82,2099,@big_mikec23 I know, ill do it later
1365,1442074505209,0,0,1,0,off-topic,1,93,2100,Fuck everybody lmao watermelons where's it's at
1366,1442074505210,0,0,1,0,off-topic,1,123,2101,In my dad's spare time he enjoys thinking of more things to yell at me about.
1367,1442074505210,0,0,1,0,off-topic,0,137,2102,Purposely waiting for the next elevator to avoid riding in one full of people #awkwardprobz
1368,1442074505211,0,1,1,0,off-topic,1,137,2103,@tannahchristine ok! Yeah i have no where to even start. Even the blood banks are full now.
1369,1442074505211,0,0,1,0,off-topic,0,137,2104,@X0X0__Villa hey thanx forvthoes kind words of you the other day, my DM dont let me reppl
1370,1442074505211,0,1,1,0,off-topic,0,78,2105,All my niggas live rich as fuck.
1371,1442074505211,0,0,1,0,off-topic,0,148,2106,So much salsa!!! Our waiter is awesome. W/kevinzevely @ Chili's Grill &amp; Bar http://t.co/H365ybkdEF
1372,1442074505212,0,1,1,0,off-topic,1,145,2107,5'4 , 130 pounds. -____- i started the school year at 120 ... WHAT THE FUCK. I need to lose weight.
1373,1442074505384,0,0,1,0,off-topic,172,118,2108,@Forever_like21 you not funny... &amp; im at a Junior College called MCH
1374,1442074505385,0,1,1,0,off-topic,1,73,2109,I just can't get out of bed
1375,1442074505385,0,1,1,0,off-topic,0,124,2110,@kobebryant isn't going to tweet during the game but he can after. #SmartMamba
1376,1442074505386,0,0,1,0,off-topic,1,114,2111,Why is Barton Hollow stuck in my head? #Thecivilwars #hipsterbutgood
1377,1442074505386,0,0,1,0,off-topic,0,86,2112,@OddDrug: Fuck society's idea of beauty.
1378,1442074505387,0,0,1,0,off-topic,1,109,2113,I DON'T WANT TO STUDY! #finaltomorrow #longhairdontcare #sleepy
1379,1442074505388,0,1,1,0,off-topic,1,110,2114,@sigaferdy Thanks for the follow! What's going on in your world?
1380,1442074505388,0,1,1,0,off-topic,0,145,2115,These parties need too hurry up and happen I'm tired of seeing wat type of party people gone attend
1381,1442074505388,0,1,1,0,off-topic,0,133,2116,Everyone please pray for Catherine's best friend, she's in ICU right now #thinkingofyou
1382,1442074505389,0,0,1,0,off-topic,1,78,2117,Tired. Don't wanna' go to class.
1383,1442074505389,0,1,1,0,off-topic,0,130,2118,@SammiePizarro: I ain't never been a pretty nigga, just chill smoking hippy nigga ..
1384,1442074505389,0,0,1,0,off-topic,0,101,2119,@chinkkkyyy whatever you say my homie G skillet biscuit
1385,1442074505390,0,0,1,0,off-topic,1,77,2120,Everyone I fuck with is fake af
1386,1442074505390,1,0,1,0,on-topic,0,176,2121,Lines out the door at WestTX library as res of est 50 homes register to return to homes in blast zone @khou http://t.co/rYXNVCe7MY
1387,1442074505571,0,0,1,0,off-topic,181,111,2122,I can't wait till the boys actually sign, Kenrich be bullshitting
1388,1442074505572,0,0,1,0,off-topic,1,185,2123,#CatheterSongLyrics he truly don't mind her prosthetic for it's only cosmetic but the catheter's a bummer, hopefully it'll be out by summer
1389,1442074505573,0,0,1,0,off-topic,1,170,2124,@raveandrollhard @krewella has amazing shows.. I saw them during spring break in #UME South Padre Island.. Unbelievable show
1390,1442074505574,0,0,1,0,off-topic,1,128,2125,@brooke_xo_And baby oil is for sex!!!! Lol let me find out Cj really over there!!!
1391,1442074505574,0,0,1,0,off-topic,0,165,2126,@ThelIluminati: Everything is either an opportunity to grow or an obstacle to keep you from growing. You get to choose.
1392,1442074505575,0,1,1,0,off-topic,1,147,2127,@J_Lee30 damn. Lol. Thought you were coming up this weekend? Or am I confusing that wit next weekend?
1393,1442074505575,0,0,1,0,off-topic,0,108,2128,Please tell me it's not true..I didn't mean that much to you..
1394,1442074505575,0,0,1,0,off-topic,0,146,2129,@iAmNotA_Dyke: Alcohol wears off on me SOOOOOOOOOOOOOO fast lol.ain't enough of it in your systems !
1395,1442074505575,0,1,1,0,off-topic,0,131,2130,Tomorrow is clean up day \/ I can honestly say my second semester of college was good
1396,1442074505760,0,0,1,0,off-topic,185,93,2131,@Blessed_Moee: I feel the ANIMOSITY on my TL ..
1397,1442074505761,0,1,1,0,off-topic,1,132,2132,The one putting pressure and expectation on you is probably yourself. #juststop #gross
1398,1442074505761,0,0,1,0,off-topic,0,91,2133,@_TasteeMyPink: Thuggin it up in ISS bad asss
1399,1442074505762,0,0,1,0,off-topic,1,108,2134,@Leeraley21 mmmm depends is his age between 12-22 or 23 and up
1400,1442074505762,0,1,1,0,off-topic,0,91,2135,Just want to take this test &amp; then nap !!
1401,1442074505763,0,0,1,0,off-topic,1,86,2136,I've been listening to Macklemore lately
1402,1442074505763,0,1,1,0,off-topic,0,183,2137,@kenny_817: Great scorer = versatility of scoring. Examples...Melo/Kobe/JR Smiff/D Rose etc. Just to name a few The German in that group?
1403,1442074505763,0,0,1,0,off-topic,0,85,2138,@yObreezy11 so I don't still text you ?
1404,1442074505764,0,1,1,0,off-topic,1,113,2139,Oomf just too fine, I feel like they worth every bit of thirst.....
1405,1442074505765,0,0,1,0,off-topic,1,113,2140,@priscillaalvar7 Bahahaha, I had LaFonda cracking up with that one!
1406,1442074505765,0,0,1,0,off-topic,0,128,2141,Last Of Class For Me Is Tomorrow &amp; Thursday Is My Birthday&gt;&gt;&gt;&gt;&gt;
1407,1442074505765,0,0,1,0,off-topic,0,108,2142,@iJussWannaHoop I don't get paid till Thursday! Play @T_Raww__
1408,1442074505766,0,0,1,0,off-topic,1,93,2143,I'm like one of the youngest people in my grade
1409,1442074505766,0,0,1,0,off-topic,0,76,2144,Real Nigga Fuck These Haters !
1410,1442074505947,0,0,1,0,off-topic,181,118,2145,Now My Side Bitch My Main Bitch Cuz My Main Hoe Ain't Feelin Me No Moe..
1411,1442074505948,0,1,1,0,off-topic,1,70,2146,In a good mood right now
1412,1442074505949,0,1,1,0,off-topic,1,149,2147,@skytavious Well You Know Its Gone Be BEAUTIFUL &amp; BAD Just Like The Rest Of The Kids In The Fam Lol
1413,1442074505949,0,0,1,0,off-topic,0,120,2148,Peanut butter and pears, string cheese, and HEB tortillas. Great lunch. :)
1414,1442074505949,0,0,1,0,off-topic,0,159,2149,Double fisting my two FREE Starbucks drinks. #thegoodlife #getatme @ The Centre Apartments http://t.co/jbwmj3KNrb
1415,1442074505949,0,0,1,0,off-topic,0,77,2150,Me and Tink know every song foo
1416,1442074505950,0,0,1,0,off-topic,1,134,2151,Friday Night Family Dinner! (@ BJ's Brewhouse w/ 2 others) [pic]: http://t.co/SWgsdoodke
1417,1442074505950,0,0,1,0,off-topic,0,134,2152,Pepperoni sausage and mushrooms Mmmmm west pizza house @ west, tx http://t.co/juTl31CuAK
1418,1442074505950,0,0,1,0,off-topic,0,78,2153,I got people to seeeee in dallas
1419,1442074505951,0,0,1,0,off-topic,1,69,2154,Win or lose God is good
1420,1442074505952,0,0,1,0,off-topic,1,72,2155,My baby sleep so goodnight
1421,1442074505952,0,0,1,0,off-topic,0,111,2156,I made up my mind, ima dye my hair back.. I can't take it no more
1422,1442074505953,0,0,1,0,off-topic,1,91,2157,I'm all about that taco cabana breakfast life
1423,1442074505953,0,0,1,0,off-topic,0,105,2158,Phone charging on the laptop... THANK GO FOR LAPTOPS !!!!!!
1424,1442074506135,0,0,1,0,off-topic,182,153,2159,My favorite position is when a nigga is hittin it from the back. .....*suck thru teeth * be makin my night!
1425,1442074506136,0,0,1,0,off-topic,1,81,2160,He fuck With Me Cause im very Loyal
1426,1442074506136,0,0,1,0,off-topic,0,137,2161,@t__johnston: Remember when the Harlem Shake was a thing? Yeah, I'm glad that's over.  haha
1427,1442074506137,0,0,1,0,off-topic,1,86,2162,The weather changed again. #notsurprised
1428,1442074506137,0,1,1,0,off-topic,0,131,2163,only bad thing about drinking water all day is that you have to pee every 30 seconds.
1429,1442074506137,0,1,1,0,off-topic,0,164,2164,Why yo bitch love the stalking ? Every night &amp; every morning. Starting to make me go harder, plus I got a daughter
1430,1442074506138,0,0,1,0,off-topic,1,97,2165,these late night cravings need to stop. right meow.
1431,1442074506138,0,1,1,0,off-topic,0,114,2166,I just want this girl to wear real clothes. Is that too much to ask?
1432,1442074506139,0,0,1,0,off-topic,1,117,2167,@TDOfficial Saturday ill be in pfulggerville but not necessarily Austin
1433,1442074506139,0,1,1,0,off-topic,0,105,2168,In her watching passion of the Christ with my bro @A_Ritz11
1434,1442074506140,0,0,1,0,off-topic,1,88,2169,@Tweet_MeeBoo lol girl too ready to know .
1435,1442074506140,0,0,1,0,off-topic,0,97,2170,Can't Turn Hoe Into A Housewife #PeriodPointBlank !
1436,1442074506323,0,0,1,0,off-topic,183,94,2171,You can't talk but you can text?  Sweeeeerrrvree
1437,1442074506323,0,0,1,0,off-topic,0,118,2172,My buddy is visiting me :) he's my bed partner xD http://t.co/mUzuypqj4D
1438,1442074506323,1,0,1,0,on-topic,0,166,2173,@Huntermoore have you heard of the explosion here near Waco? There may be 60-70 casualties and 100+ injured #prayforWaco
1439,1442074506324,0,0,1,0,off-topic,1,86,2174,I been talking about my Love all morning
1440,1442074506329,0,0,1,0,off-topic,5,158,2175,I would say If you can't handle the heat get out of the kitchen, but you're a woman and that's where you belong.
1441,1442074506329,0,0,1,0,off-topic,0,86,2176,I always look ratchet for work. *shrugs*
1442,1442074506330,0,1,1,0,off-topic,1,95,2177,I think the Lakers just won the Championship.....
1443,1442074506331,0,0,1,0,off-topic,1,90,2178,LOLOL, Jk! I said home is where you make it.
1444,1442074506332,0,0,1,0,off-topic,1,66,2179,With Eli at the park
1445,1442074506332,0,1,1,0,off-topic,0,194,2180,@JessicaRoseKern I used to work till 2-4am &amp; it was a creepy area kinda at least at night, &amp; Im going back to working nights so he's worried
1446,1442074506332,0,0,1,0,off-topic,0,111,2181,If you love life, it will most definitely love you back #thankful
1447,1442074506333,0,0,1,0,off-topic,1,88,2182,@Jthomas224 @ryannanderson I got you both!
1448,1442074506333,0,1,1,0,off-topic,0,125,2183,@NewbergReport here is that gif with each pitch labeled. http://t.co/dISw2LmwU8
1449,1442074506510,0,0,1,0,off-topic,177,90,2184,Idc cause He always accusing Me of some shit
1450,1442074506511,0,0,1,0,off-topic,1,137,2296,There's a reason I failed English every semester. It's called grammar. And it is from hell.
1451,1442074506512,0,0,1,0,off-topic,1,125,2297,@DatDamn_Fini: hoes will try anything to get to my nigga... Bitch you pathetic!
1452,1442074506512,0,0,1,0,off-topic,0,104,2298,@rev_david that is not what I'm hearing. I could be wrong.
1453,1442074506513,0,0,1,0,off-topic,1,84,2299,@SmilingKIJ it's a bowl from target :)
1454,1442074506513,0,1,1,0,off-topic,0,120,2300,Definitive rule for myself: no social interaction for 1 hour after I wake.
1455,1442074506514,0,0,1,0,off-topic,1,75,2301,I dont smoke with new smokers
1456,1442074506514,0,0,1,0,off-topic,0,92,2302,#ReplaceBandNamesWithPizza Pizza! At the Disco
1457,1442074506515,0,0,1,0,off-topic,1,97,2303,@jazzzmyn55 oh ok ! I'll enjoy it withou you then !
1458,1442074506515,0,1,1,0,off-topic,0,156,2304,Spending the weekend with this lady. Thanks for coming to visit me! @ Baylor University http://t.co/pzeXZMzArZ
1459,1442074506515,0,0,1,0,off-topic,0,79,2305,for the first time  #kennychesney
1460,1442074506516,0,0,1,0,off-topic,1,73,2306,I wish I had perfect vision
1461,1442074506517,0,0,1,0,off-topic,1,93,2307,Ugh i wanna do a YouTube channel!!!! #so badily
1462,1442074506517,0,0,1,0,off-topic,0,111,2308,@ForrestBoyd wanting to barf is not doing anything for my energy.
1463,1442074506697,0,1,1,0,off-topic,180,81,2309,@brittneykmoore let's hang out soon
1464,1442074506697,0,0,1,0,off-topic,0,150,2310,ugh these girls yelling and laughing in other languages and I'm like CG IS NOT A PLACE OF FUN OR SMILES.
1465,1442074506698,0,1,1,0,off-topic,1,147,2311,When I was in high school, I couldn't wait to leave SETX. Now I'm in college, I wish I could go back.
1466,1442074506698,0,0,1,0,off-topic,0,167,2312,Here's to this amazing human being. I love you so much, Zatch. #minichamberconcert @zacharybarba @ http://t.co/N4I7Gao2Sx
1467,1442074506698,0,1,1,0,off-topic,0,181,2313,@pluckypresby you also enable them to give it to others. Same goes for justice, and justice &amp; love don't exist without one another.
1468,1442074506698,1,0,1,0,on-topic,0,183,2314,Did our standups in #west. on our way to parkland hospital to learn more about evacuated victims of the explosion. http://t.co/UA28ORQJCA
1469,1442074506698,0,0,1,0,off-topic,0,152,2315,@LisaKhalifaa I want to have a BBQ/party at my dads ranch Saturday night. You're invited if yah want! Wbu?
1470,1442074506699,0,1,1,0,off-topic,1,128,2316,I just wanna hold you, take you by the hand, and tell you that you're good enough.
1471,1442074506699,0,0,1,0,off-topic,0,116,2317,@YoSoyFAME whaaaaa. that's crazy. how come I've never seen you there?!
1472,1442074506699,0,0,1,0,off-topic,0,119,2318,@twEAT_ItRight: @BraziliaanGOTTI: We High and Tipsy Okayy Straight Lean'n
1473,1442074506887,0,0,1,0,off-topic,188,149,2319,The things I would do if @blakeshelton tweeted me!!  #die #jumpup #yell #doahapydance So. Many. Things.
1474,1442074506888,0,0,1,0,off-topic,1,109,2320,@FullOfMySelf009: Why everybody in they feelings what are those
1475,1442074506890,0,0,1,0,off-topic,2,140,2321,@B2Will1 Happy birthday bro! Make It a good one. Last illegal time to drink for your birthday!
1476,1442074506891,0,0,1,0,off-topic,1,89,2322,#TurnOff constantly calling yourself ugly..
1477,1442074506891,0,0,1,0,off-topic,0,72,2323,Check x Big Chief &gt;&gt;
1478,1442074506893,0,0,1,0,off-topic,2,89,2324,Iginla was such a good pick up! #letsgoPens
1479,1442074506895,0,1,1,0,off-topic,2,176,2325,Showing respectful interest in someone has become subject of embarrassment. Come at her like u just tryna have sex and you get her
1480,1442074506896,0,1,1,0,off-topic,1,82,2326,Taks next week &lt; I just wanna cry
1481,1442074506898,0,0,1,0,off-topic,2,100,2327,don't work till 5 tomorrow! sleeping in and being lazy
1482,1442074506900,0,1,1,0,off-topic,2,116,2328,Ryan just said my battery said, fuck you I'm going to sleep. I'm dying
1483,1442074506900,0,0,1,0,off-topic,0,124,2329,@MissLizzzzzz http://t.co/KEMycfQ4xv this will spark your interest a bit more!
1484,1442074506901,0,0,1,0,off-topic,1,85,2330,To my good friend @Iamwalkerlove cheers
1485,1442074506902,0,0,1,0,off-topic,1,86,2331,@DreWill_Kcg I notice lol , by waco high
1486,1442074506902,0,1,1,0,off-topic,0,123,2332,Lolol a guy just said me and @e__nastyyy look alike... Never got that before!
1487,1442074507072,0,0,1,0,off-topic,170,93,2333,When We together his phone go right in my purse
1488,1442074507072,0,0,1,0,off-topic,0,130,2334,@ShoUp_N_ShoOut Im Up Bored To Cuzzo Hope Yal Come Saturday If Not Ima Come That Way
1489,1442074507073,0,0,1,0,off-topic,1,103,2335,I never have the same motivation as I do in the mornings.
1490,1442074507073,0,0,1,0,off-topic,0,104,2336,Half Of The People Tweeting About 4/20 , Don't Even Smoke!
1491,1442074507074,0,1,1,0,off-topic,1,185,2337,@OhItsJehtay I know I have at least 2, &amp; all of my wisdom teeth are poking through. My mouth hurts.. I'm just like wahhhh I don't wanna
1492,1442074507074,0,0,1,0,off-topic,0,147,2338,@diana_schmitz: Shrimp steak liquor and pastaaaaa @tayloraewing real shit boi, these n*ggas imposters
1493,1442074507074,0,0,1,0,off-topic,0,100,2339,Might fuck around &amp; fuck yo bitch, dont say i cant
1494,1442074507075,0,0,1,0,off-topic,1,94,2340,The life of an only child is one I'm suited for.
1495,1442074507075,1,0,1,0,on-topic,0,128,2341,Driving through West on the way to Dallas today. @ West, TX http://t.co/rcjfT77GtD
1496,1442074507076,0,0,1,0,off-topic,1,80,2342,At All that Lil Hoe Underage nshit
1497,1442074507076,0,0,1,0,off-topic,0,101,2343,getting followers on tumblr is the hardest thing to do.
1498,1442074507077,0,0,1,0,off-topic,1,94,2344,AK on my nightstand.. Right next to that bible!!
1499,1442074507260,0,0,1,0,off-topic,183,121,2345,and my next day isn't until Thursday. so it'll be 14. shoot me in the face.
1500,1442074507261,0,1,1,0,off-topic,1,76,2346,Watch how i start doing em tho
1501,1442074507262,0,0,1,0,off-topic,1,69,2347,Finna eat again I guess
1502,1442074507263,0,1,1,0,off-topic,1,145,2348,@chas1214: I literally died  http://t.co/IDGI43fMZY so you ain't gone s/o who sent you this -_- lol
1503,1442074507263,0,0,1,0,off-topic,0,108,2349,Yo fat ass needs to stop tweeting about over exerting yourself
1504,1442074507264,0,0,1,0,off-topic,1,97,2350,@DSwan7 bro!! We got our asses Rock bottomed on cod
1505,1442074507264,0,1,1,0,off-topic,0,80,2351,@LoyolaGil  just got an AC unit =)
1506,1442074507265,0,0,1,0,off-topic,1,99,2352,Poor Belle Kitty! She has been by herself all day! :(
1507,1442074507265,0,0,1,0,off-topic,0,146,2353,Dnt know what to do..... :( I hate the idea of not being able to be in 2 places at the same time....
1508,1442074507266,0,0,1,0,off-topic,1,92,2354,He'll be clean with dreads tho. Once they grow
1509,1442074507266,0,0,1,0,off-topic,0,159,2355,@FigNewton29 I definitely will!!! I also have to wait for his birthstone they were out if January my mom said lol
1510,1442074507267,0,1,1,0,off-topic,1,95,2356,Lol!! My boss is afraid I'm going to take his job
1511,1442074507267,0,0,1,0,off-topic,0,78,2357,Even tho that's all I talk about
1512,1442074507268,0,0,1,0,off-topic,1,123,2358,@Andreaa_Kaye: I hate the word Boyfriend.. Baby be my MAN!Look no farther lol
1513,1442074507447,0,1,1,0,off-topic,179,166,2359,Gotta work hard on that Death Investigation project.  #CriminalJustice got to love these classes. http://t.co/kYvDtev1Yg
1514,1442074507448,0,0,1,0,off-topic,1,92,2360,Why did I not charge my phone last night? #15%
1515,1442074507448,0,1,1,0,off-topic,0,107,2361,It's going to be wonderful to not have an 8 am next semester.
1516,1442074507449,0,0,1,0,off-topic,1,93,2362,@JayJayed_007 and real madrid all the way nigga
1517,1442074507449,0,0,1,0,off-topic,0,81,2363,If only you could realize how much?
1518,1442074507450,0,0,1,0,off-topic,1,164,2364,There's nothing I love more than Sunday morning coffee dates with my beautiful bride. #marriage http://t.co/zzuSFS8fMo
1519,1442074507450,0,1,1,0,off-topic,0,133,2365,President Obama maybe coming to Baylor this week... Damn Thursday should be interesting
1520,1442074507450,0,0,1,0,off-topic,0,86,2366,Actin a ass till they free all my niggas
1521,1442074507451,0,1,1,0,off-topic,1,183,2367,Went to the bookstore and now hanging outside on the porch with @michael_sch eating a yummy, summery, fruit salad. http://t.co/r8oh0YDTy7
1522,1442074507451,0,1,1,0,off-topic,0,123,2368,Listening to Les Miz &amp; doing homework at the same time just depresses me.
1523,1442074507451,0,0,1,0,off-topic,0,118,2369,6. Avoid men who have a bunch of children by a bunch of different women.
1524,1442074507452,0,0,1,0,off-topic,1,117,2370,Jamey Ice, you rascal. @ church under the bridge http://t.co/fI5bYZAMEY
1525,1442074507636,0,0,1,0,off-topic,184,71,2371,Put em right In his place
1526,1442074507640,1,1,1,1,on-topic,4,186,2372,@RaveLiveLove I'm fine.. Ambulances are coming and going like you won't believe. Sad part is 60-70 casualties are expected and 100+ injuries
1527,1442074507641,0,0,1,0,off-topic,1,177,2373,see I know I'mma make it but even if I don't, don't feel bad cuz honestly all these times that I had those will be my best memories
1528,1442074507642,0,0,1,0,off-topic,1,88,2374,That Hoe W/The Braces Dead &amp; Ugly AF !
1529,1442074507644,1,0,1,0,on-topic,2,161,2375,West City emergency worker breaks down during memorial svc 2 fallen colleagues at St Mary's. http://t.co/zWxihdUw0B
1530,1442074507648,0,0,1,0,off-topic,4,80,2376,guys who smoke everyday.  &lt;&lt;
1531,1442074507649,0,0,1,0,off-topic,1,82,2377,Laughing at my ex lol she too normal
1532,1442074507650,0,0,1,0,off-topic,1,100,2378,I hope I'm not the only one that attends this class...
1533,1442074507651,0,0,1,0,off-topic,1,83,2379,Ima nightmare in all black night gear
1534,1442074507651,0,0,1,0,off-topic,0,118,2380,Can we reverse time and go back to the good ole days? That's all I ask..
1535,1442074507652,0,0,1,0,off-topic,1,140,2381,hi @EvanHebert do u want to go to semi with me? i can jerk, cabbage patch, and cha cha slide~~
1536,1442074507652,0,0,1,0,off-topic,0,164,2382,why my dad feels the need to turn the tv all the way up when he's sitting right in front of it, I'll never understand.
1537,1442074507823,0,1,1,0,off-topic,171,135,2383,I'm in a college classroom... Not gonna complain about that.. Too grateful for that shit!
1538,1442074507824,0,0,1,0,off-topic,1,94,2384,I love Saturday nights. They always end up good.
1539,1442074507828,0,0,1,0,off-topic,4,109,2385,I'm at Czech Stop (West, TX) w/ 4 others http://t.co/AUPntGLdaT
1540,1442074507830,0,1,1,0,off-topic,2,145,2386,&amp; these 8's... Ehhhhh might just get em to flip em!! They look on though http://t.co/FFIQrYqw7b
1541,1442074507831,0,1,1,0,off-topic,1,100,2387,Hey boo..@oohcharueexo: I just need someone to talk to
1542,1442074507836,0,0,1,0,off-topic,5,90,2388,I Hate When People Wake Me Up Out My Sleep.!
1543,1442074507837,0,1,1,0,off-topic,1,76,2389,What is this world coming to?!
1544,1442074507840,0,0,1,0,off-topic,3,102,2390,Scrappy be Laying That Good Dick ,  Got Everybody Sprung
1545,1442074507841,0,1,1,0,off-topic,1,129,2391,As of right now, I have a 111 in mastering chemistry homework. Bonesquad haunts me.
1546,1442074507841,0,0,1,0,off-topic,0,87,2392,@Tweet_SummGirl temple or west girl ? Lol
1547,1442074507842,0,0,1,0,off-topic,1,169,2393,@ToyaAmanda: Omg!!!! Like I wanna delete my IG!! I wanna see pics not S/O all down my shit lol geesh!!ShoutOuts LetsGoo !!!
1548,1442074507842,0,0,1,0,off-topic,0,100,2394,@ChrisTsavageAzz Me Plus You and One more is three boo
1549,1442074507843,0,1,1,0,off-topic,1,115,2395,@TyylerCuffee umm not now . .  Maybe tomorrow  I need some schleep  !
1550,1442074508010,0,1,1,0,off-topic,167,93,2396,4 weekends from now, I'll be back at the beach.
1551,1442074508011,0,0,1,0,off-topic,1,137,2397,@WAZZAAM__round: LAWS HOT INA SOUTH!!!!always thats how it is in my side of town #southwaco
1552,1442074508012,0,0,1,0,off-topic,1,94,2398,@kobebryant there's nothing you could have done.
1553,1442074508012,0,0,1,0,off-topic,0,108,2399,Class at 8 but I can't seem to sleep. Lots of thoughts!! Poop!
1554,1442074508013,0,1,1,0,off-topic,1,102,2400,lol tracer just walked in here and handed me his beats..
1555,1442074508015,1,1,1,1,on-topic,2,112,2401,Waitin for 4 pm news conference in West City Hall.  It's now 4:25.
1556,1442074508016,0,0,1,0,off-topic,1,85,2402,@akenjari wonder what your thoughts are
1557,1442074508017,0,0,1,0,off-topic,1,83,2403,Good lil run with a few real niggas..
1558,1442074508018,0,1,1,0,off-topic,1,183,2404,@KyleAnthony1254 I love how we complain about 40 bucks at the cleaners but we will happily drop 100 bucks at a bar in a matter of minutes
1559,1442074508018,0,0,1,0,off-topic,0,143,2405,@bobeezy_214: Im so in love with Girls Love Beyonce. Feels good to have some new Drake. Me too.!!
1560,1442074508018,0,0,1,0,off-topic,0,150,2406,There's a cat in the kennel with her paw out meowing. She looks like she's in jail begging to be let out
1561,1442074508019,0,0,1,0,off-topic,1,112,2407,@Ay_ItsSierra: Im only here for one night then ima be ya memory ;)
1562,1442074508197,0,0,1,0,off-topic,178,143,2408,My lil nigga @BeauTEEisLife laced me up today . Basically letting me know I'm missed by somebody!
1563,1442074508198,0,0,1,0,off-topic,1,105,2409,@Xman813 @cgooood06 picked some trash up I'm sweating! Woo!
1564,1442074508198,0,0,1,0,off-topic,0,143,2410,Right Above It by Lil Wayne will always make me think of driving to school Junior Year. Why? Idk.
1565,1442074508199,0,0,1,0,off-topic,1,81,2411,Holy shit, Adrian is here on stage.
