2198,1442073805431,1,1,1,1,on-topic,1,194,3962,MT @Baylor: Pres @BarackObama at #Westmemorial: We give thanks for the courage &amp; compassion &amp; the incredible grace of the people of #WestTX.
2199,1442073805432,0,0,1,0,off-topic,1,183,3963,White folks be stopping to talk at the most inconvenient time...like forming groups in the middle of the sidewalk like no one behind you.
2200,1442073805432,0,1,1,0,off-topic,0,109,3964,S/o to the corner that just got drafted from south eastern LA !
2201,1442073805433,0,0,1,0,off-topic,1,85,3965,I hope that hoe logged me out his phone
2202,1442073805435,0,0,1,0,off-topic,2,95,3966,Lol but the Young Hoes Dumb and Don't Give a Fuck
2203,1442073805436,0,0,1,0,off-topic,1,166,3967,This is one of the staging areas the authoritorder are as well a a food distribution area for hot http://t.co/TwF3DwdBvA
2204,1442073805437,0,0,1,0,off-topic,1,88,3968,Money Over Bitches 2 Time For The FAKERS !
2205,1442073805438,0,0,1,0,off-topic,1,170,3969,Chris called me asking me why I am in my feelings about technology... Because bitch. I am. That's why. #Teamunderappreciated
2206,1442073805438,0,0,1,0,off-topic,0,125,3970,...........@_FunkyFresh: Settling down with a white woman would me a sell out?!
2207,1442073805439,0,0,1,0,off-topic,1,91,3971,Imma getting as Much Time on My Bed as I Can!
2208,1442073805441,0,0,1,0,off-topic,2,144,3972,@Ana_heart00 according to how big she is. It's 10X better than the stuff you get at the pet stores
2209,1442073805441,0,1,1,0,off-topic,0,76,3973,That Taco Bell I just had &gt;
2210,1442073805443,0,0,1,0,off-topic,2,94,3974,I drink orange juice all day, my momma be so mad
2211,1442073805445,0,0,1,0,off-topic,2,85,3975,@MiikeSttar how's life for the big man?
2212,1442073805446,0,0,1,0,off-topic,1,170,3976,Ion givaa fuck how many times me and my bae get into it , he my mfn nigga  and imaa forever hold his grounds . I love My Boo
2213,1442073805447,0,0,1,0,off-topic,1,97,3977,@shelby_nb mines an autopilot feature for my truck!
2214,1442073805448,0,0,1,0,off-topic,1,117,3978,But Maan Quistar visiting High Schools and still ain't Came to the High
2215,1442073805449,0,0,1,0,off-topic,1,132,3979,Trying some Chaga Tea! (@ Downtown Farmer's Market w/ 2 others) http://t.co/eh0P5sgYZn
2216,1442073805450,0,0,1,0,off-topic,1,152,3980,@MabeISimmons: Long hair don't care .... I don't think anyone care bitch so annoying when people say this.
2217,1442073805450,0,1,1,0,off-topic,0,107,3981,@RavensLast No Im In Austin . Im Not Coming Back till Sunday.
2218,1442073805451,0,1,1,0,off-topic,1,120,3982,Why would anyone ever live in Waco Texas?  Has to have a high suicide rate
2219,1442073805452,0,0,1,0,off-topic,1,101,3983,I'm So High High High That A Bitch Can't Blow My High !
2220,1442073805454,0,0,1,0,off-topic,2,96,3984,4-1 #dortmund looks like Real Madrid is in trouble
2221,1442073805455,0,1,1,0,off-topic,1,81,3985,Ahem.. Pria is already happening...
2222,1442073805457,0,1,1,0,off-topic,2,91,3986,John Henson is just flat out adorable. #Bucks
2223,1442073805459,0,0,1,0,off-topic,2,171,3988,@MarinaMeador @anderson25_bp hahaha 5head I bet when you have dreams, you don't have dreams, you have movies @TheRealMikeEpps
2224,1442073805459,0,0,1,0,off-topic,0,80,3989,Nothing ratchet about a Real Nigga
2225,1442073805462,0,0,1,0,off-topic,3,123,3990,I haven't been on twitter in a couple days it feels like, where have I been?!
2226,1442073805463,1,1,1,1,on-topic,1,136,3991,@Adore_Felicia thank you girl, I love 15 min away. I am safe, Im going to help them tomoro
2227,1442073805464,0,0,1,0,off-topic,1,114,3992,Bitch says im anoying aha shut yo fat ass up haha soccer is life -_-
2228,1442073805465,0,0,1,0,off-topic,1,80,3993,Say I'm handsome cause my bands up
2229,1442073805468,0,0,1,0,off-topic,3,137,3994,Bacon, burger, egg, grilled cheese. @ Salty Dog Sports Bar and Grill http://t.co/p4GReqZD0I
2230,1442073805469,0,1,1,0,off-topic,1,147,3995,rather than dwell on the desolation of man, focus your attention on the overwhelming goodness of God.
2231,1442073805472,0,0,1,0,off-topic,3,175,3996,I may not have the newest or coolest this but hey atleast I can say I got that shit on my own!, Unlike most of yall titty babies!
2232,1442073805474,0,0,1,0,off-topic,2,109,3997,@lely254 Lol. This is the only time where I want an iPhone. -_-
2233,1442073805478,0,0,1,0,off-topic,4,103,3998,@sexIaws: The I missed you sex is always worth the wait..
2234,1442073805482,1,0,1,0,on-topic,4,111,4093,For the west victims they still need donations of school supplies
2235,1442073805483,1,0,1,0,on-topic,1,102,4099,Memorial service was incredible, including Obamas speech
2236,1442073805484,0,0,1,0,off-topic,1,141,4155,Get Steve nd Jodie on the wing. Pau on that 15 footer and Dwight on the block that'll be deadly
2237,1442073805485,1,0,1,0,on-topic,1,182,4158,@J_Lee30 fertilizer plant caught fire and exploded. Dozens and dozens injured and being taken to area hospitals. NO confirmed deaths yet
2238,1442073805485,1,0,1,0,on-topic,0,126,4161,Dang what is up with all these explosions dude? Praying for those people in West
2239,1442073805486,1,0,1,0,on-topic,1,130,4202,I don't even like Obama &amp; I think it's nice of him to come speak on this tragedy
2240,1442073805486,0,0,1,0,off-topic,0,109,4071,@BrookeHarring10 haha I knew this would get tweeted pretty fast
2241,1442073805487,0,1,1,0,off-topic,1,189,4072,@TanMilSO no matter what happens it'll just make y'all stronger &amp; if he wants to do eod then you'll at least know he's doing something that
2242,1442073805488,0,0,1,0,off-topic,1,91,4073,@JordaanSanford love you more man come on man
2243,1442073805490,0,0,1,0,off-topic,2,75,4074,I want it to get hot outside.
2244,1442073805491,0,1,1,0,off-topic,1,91,4075,@X0X0__Villa i just wanted to say thankyou:)!
2245,1442073805494,0,0,1,0,off-topic,3,107,4076,I been avoiding commitment that's why I'm in this position !!
2246,1442073805495,0,0,1,0,off-topic,1,93,4077,You Only Get 1 Life Remember When You Wake Up .
2247,1442073805496,0,0,1,0,off-topic,1,83,4078,I hate broke niggas with rich mouths.
2248,1442073805498,0,1,1,0,off-topic,2,151,4079,I was gone get out, but the way my gas tank set up.... I can't be asking moms for gas money everyday bruh
2249,1442073805498,0,0,1,0,off-topic,0,77,4080,He Be On Some Other Type Shit ?
2250,1442073805502,0,1,1,0,off-topic,4,149,4081,What's sad is that I'll never be cool enough for the CG cool facial hair club. I'm just not man enough.
2251,1442073805503,0,1,1,0,off-topic,1,121,4082,@ItsCESAR_13 lmao hell naw then people going to try and capture me and shit
2252,1442073805503,1,1,1,1,on-topic,0,159,4083,Obama is having a speech around 2 and there's already a line that's a mile long to get in. http://t.co/idJOM3X8Ic
2253,1442073805503,0,0,1,0,off-topic,0,184,4084,@FuckDatBitch_CB: Well we need to get Lacy with my aunt's male Bichon Juju and make us some babies! I want one so bad. ); They're so cute!
2254,1442073805504,1,1,1,1,on-topic,1,155,4085,We're the only local news crew in #West today. So many things to see when you aren't just covering the story.
2255,1442073805504,0,0,1,0,off-topic,0,94,4086,She dont like it when i be checkin her boyfriend
2256,1442073805506,0,0,1,0,off-topic,2,171,4087,While I was giving blood yesterday all I could think about were those movies where people get all the blood drained from them
2257,1442073805506,0,0,1,0,off-topic,0,68,4088,My legs all scarred up
2258,1442073805508,0,0,1,0,off-topic,2,67,4089,I came a longgggg way
2259,1442073805511,0,0,1,0,off-topic,3,88,4090,Doesn't mean imma act the sane towards you
2260,1442073805513,0,1,1,0,off-topic,2,104,4091,Just took the hardest final I've ever had in my life. Smh.
2261,1442073805515,0,0,1,0,off-topic,2,113,4092,I REALLY want a truck as my next vehicle. Or a motorcycle. Or both.
2262,1442073805517,0,0,1,0,off-topic,2,106,4094,If You Got Any Kids Or A CRAZY BABYMAMA Stay Away From Me .!
2263,1442073805518,0,0,1,0,off-topic,1,149,4095,Maybe if I listen to summer songs I can pretend it's the summer and not freezing and raining outside...
2264,1442073805521,0,1,1,0,off-topic,3,83,4096,I'm just happy my nigga ponce scored!
2265,1442073805523,0,0,1,0,off-topic,2,167,4097,@BaylorBoundShee @akassh25 I mean if you are talking about watching the #nbaplayoffs over the #NFLDraft you have a point.
2266,1442073805523,0,1,1,0,off-topic,0,184,4098,Even if I wanted to go to class today it would be nearly impossible. Already had to miss my advising appointment because roads are blocked
2267,1442073805524,0,0,1,0,off-topic,1,149,4100,@LostWords_: Value yourself enough to choose to be with someone who wants you as much as you want them.
2268,1442073805524,0,1,1,0,off-topic,0,98,4101,IM GOING IN FINNA PASS THIS TEST YO!!!! Wish me luck
2269,1442073805526,0,1,1,0,off-topic,2,112,4102,@IamRichardG yeah ima get you here on that 360 it's gone be a wrap
2270,1442073805527,0,0,1,0,off-topic,1,90,4103,There can't possibly be any better that that
2271,1442073805528,0,0,1,0,off-topic,1,87,4104,Fuck y'all bitches' except my bitchessss.
2272,1442073805530,0,0,1,0,off-topic,2,107,4105,ARMADILLOS ARE SO CUTE!!! Especially when they race! #Dia2013
2273,1442073805546,0,0,1,0,off-topic,16,151,4106,Cause girl Im not the kind to two time or play games behind your back. Im a little more country than that
2274,1442073805547,0,0,1,0,off-topic,1,85,4107,Only two weeks of class left. Bring it.
2275,1442073805548,0,0,1,0,off-topic,1,90,4108,I want a green apple with some peanut butter
2276,1442073805552,0,0,1,0,off-topic,4,115,4109,washing your makeup off and rubbing your eyes endlessly. #thebestever
2277,1442073805553,0,1,1,0,off-topic,1,127,4110,Thinking bout going back tomorrow too get sum running on trend mill in and bench!
2278,1442073805554,0,0,1,0,off-topic,1,77,4111,@Guerro_08 at the car wash? Lol
2279,1442073805556,0,1,1,0,off-topic,2,144,4112,@Ssog_Omar: School is so boring. Im just glad its friay!! Lets skip. Jk I'm not about it &gt;.&lt;
2280,1442073805557,0,0,1,0,off-topic,1,79,4113,@WBCSays then why don't you leave
2281,1442073805559,0,1,1,0,off-topic,2,172,4114,Just bought this lifeproof case!! Just in time for summer!! So excited for it to come in hope it works  http://t.co/t8bOMC8ZXy
2282,1442073805559,0,0,1,0,off-topic,0,81,4115,I'm young 21 livin in a crazy world
2283,1442073805561,0,0,1,0,off-topic,2,98,4116,@_Brichelle: I wish I was in high school again !!!!!
2284,1442073805562,0,0,1,0,off-topic,1,129,4240,Okay y'all, keep praying and taking action and don't forget to give blood tomorrow!
2285,1442073805563,1,0,1,0,on-topic,1,181,4261,West press briefing postponed indefinitely. DPS hopes to give new info by end of the day. Residents w/ damaged homes frustrated @nbcdfw
2286,1442073805563,0,0,1,0,off-topic,0,171,4297,@lindseynholt praying for you girl! Hope everything is okay and they figure out whatever is wrong. Call if you need anything!
2287,1442073805564,0,0,1,0,off-topic,1,126,4305,Got em! Much respect for federal/state/local authorities and responders. #merrka
2288,1442073805565,0,1,1,0,off-topic,1,90,4211,Love is just a word until its proven to you!
2289,1442073805566,0,0,1,0,off-topic,1,93,4212,@CaramelBOMBBB some cheetah prints on my sleeve
2290,1442073805570,0,0,1,0,off-topic,4,101,4213,#DrBradleySays push it like a cushion  @BaylorMensChoir
2291,1442073811884,0,0,1,0,off-topic,6314,77,4214,Don't Know What I'm Doing Yet !
2292,1442073811885,0,1,1,0,off-topic,1,120,4215,Got into a fender bender before work... Great way to start off my Friday..
2293,1442073811886,0,1,1,0,off-topic,1,105,4216,I just don't take people serious no more lol #sorrynotsorry
2294,1442073811888,0,0,1,0,off-topic,2,147,4217,@kushhh2013 girl you way the heck over there in midway  ill take you out to eat some other day foreal
2295,1442073811890,0,1,1,0,off-topic,2,133,4218,Disappointments are just God's way of saying: I've got something better in mind for you
2296,1442073811893,0,0,1,0,off-topic,3,99,4219,@ZaRiah_Pecina: I DON'T like BITCHES in my BUSINESSSS
2297,1442073811897,0,0,1,0,off-topic,4,85,4220,I'm not even e optional WHEB I'm deny k
2298,1442073811901,0,0,1,0,off-topic,4,99,4221,@Jordynberryy then how do we find B? I feel so stupid
2299,1442073811907,0,0,1,0,off-topic,6,160,4222,@bmiana I said budget for ring like $7-900 that fool said $4000 I was like no no no no no no no NO absolutely not!
2300,1442073811910,0,0,1,0,off-topic,3,90,4223,@fat_daddy33 that's honestly my worst fear..
2301,1442073811912,0,0,1,0,off-topic,2,116,4224,@CocoaWessst: Free @LIL_marko_KREAM 57x goddamn!!! !!!! On da set 1137
2302,1442073811913,0,0,1,0,off-topic,1,159,4225,Excuse me, why is the stairwell closed? Like FINE I'LL TAKE THE ELEVATOR. Stairs can't even break, right? #whaaat
2303,1442073811914,0,0,1,0,off-topic,1,121,4226,Named my baby cactus after @oddfuckingtaco #meetTaco http://t.co/463trNGlPE
2304,1442073811915,1,1,1,1,on-topic,1,185,4227,@davebautista thx were ok I had a friend that lived in west tx he 40 stitches but he's ok thx for ur kind words an I hope the best movie c.
2305,1442073811915,0,0,1,0,off-topic,0,107,4228,@fosteerChild she better be, or I'll kill someone. Seriously.
2306,1442073811916,0,0,1,0,off-topic,1,153,4229,I hate that I can't say that I'm thirsty anymore without people making it thirsty smh.. Lol @morganntaaylor
2307,1442073811917,0,0,1,0,off-topic,1,139,4230,Having A Car &gt;&gt;&gt;&gt;&gt;&gt; But NO Where To Go &lt;&lt;&lt;&lt;&lt;&lt;&lt;&lt;&lt;
2308,1442073811918,0,1,1,0,off-topic,1,168,4231,Him - no there's this man at the window and I'm scared Me- swear? I'm On my way!!!! *so serious* Him- naw I'm just kidding
2309,1442073811918,0,0,1,0,off-topic,0,161,4232,I'm So childish because I actually get happy when we watch movies in class LLAB fuck you I don't care whatcha think
2310,1442073811919,0,0,1,0,off-topic,1,73,4233,Keep Calm I still don't gaf
2311,1442073811922,0,1,1,0,off-topic,3,180,4234,Scrolling through my Instagram TL, and I'm like, Where has this semester gone? Not sure if I'm actually ready to say bye to this year.
2312,1442073811923,0,0,1,0,off-topic,1,124,4235,And for all I care you can take my famous pineapple &amp; shove it up your ass
2313,1442073811924,0,0,1,0,off-topic,1,80,4236,I got pooped on by a bird earlier.
2314,1442073811927,0,0,1,0,off-topic,3,98,4237,@TekkDeffAustin: @jadifihart yes!It's good so far!!!
2315,1442073811928,0,0,1,0,off-topic,1,105,4238,Boy, I SWEAR Behind that Pussy A Niggaa will Sell His Soul!
2316,1442073811930,0,0,1,0,off-topic,2,63,4239,Why am I still up
2317,1442073811932,0,0,1,0,off-topic,2,89,4241,Trust Issues &lt;&lt; Remix ft. The Weeknd.
2318,1442073811934,0,1,1,0,off-topic,2,105,4242,@skytavious yess fam i already know when is your girl due??
2319,1442073811935,0,1,1,0,off-topic,1,111,4243,The light heavyweight championship is tonight. Gonna be toooo raw
2320,1442073811936,0,0,1,0,off-topic,1,104,4244,Oomf favorite my tweet cause she know I GOTTA come see her
2321,1442073811937,0,0,1,0,off-topic,1,74,4245,I'm not fat my stomach is 3D
2322,1442073811939,0,0,1,0,off-topic,2,135,4246,Yesterday I literally told a girl you need to keep your twerk to yourself. Who am i? #dia
2323,1442073811939,0,0,1,0,off-topic,0,73,4247,My niggas will fuck yo lady
2324,1442073811941,0,0,1,0,off-topic,2,114,4248,@Kris_Mac12: Work with @cayyyrae is never good for HEB  THEY LOVE US
2325,1442073811942,0,1,1,0,off-topic,1,147,4249,Lol get someone for me .!! I dare you to cause I will have that bitch on the ground in a quick second
2326,1442073811943,0,0,1,0,off-topic,1,74,4250,The temptation to go home...
2327,1442073811945,0,0,1,0,off-topic,2,185,4251,A girl doesn't have to wear a ton of make-up to be beautiful. True beauty is not on the outside, it's inside. A lot of make-up covers evil.
2328,1442073811945,0,0,1,0,off-topic,0,68,4252,I forgot to wear red..
2329,1442073811946,0,0,1,0,off-topic,1,90,4253,Imma make a singing video i swear i can blow
2330,1442073811948,0,0,1,0,off-topic,2,124,4254,@LorenATaylor considering that song comes on every other time, not so much lol
2331,1442073811949,0,0,1,0,off-topic,1,122,4255,Me and @MrBigShot34 are jammin and we're not even together #GirlsLoveBeyonce
2332,1442073811950,0,0,1,0,off-topic,1,153,4256,Seriously y'all the little hooker keeps trynna jump on me, I can't even get dressed  http://t.co/CvSfbaL9BX
2333,1442073811950,0,0,1,0,off-topic,0,132,4257,If I Don't Fw , My Name Should Never Be In Your Mouth Or Come Up In Your Conversation.
2334,1442073811951,1,1,1,1,on-topic,1,162,4340,Im in waco right now &amp; I didnt know shit about the explosion. My great grandma called &amp; told me about it -_-
2335,1442073811951,1,0,1,0,on-topic,0,148,4348,TX EXPLOSION:  Fresh video of school building hammered by blast. #westexplosion http://t.co/rOiMV9P7SR
2336,1442073811952,1,0,1,0,on-topic,1,164,4350,Volunteers from Fort Worth preparing to cook as many as 1,000 meals twice a day. #westexplosion http://t.co/b1MW3ulPsJ
2337,1442073811953,1,1,1,1,on-topic,1,107,4366,@megateer I'll check now &amp; see the death toll. Thank you.
2338,1442073811954,0,0,1,0,off-topic,1,143,4368,@GodWelcomesAll oh certainly. So excited for you that you have a tentative date. Praying for you.
2339,1442073811954,1,1,1,1,on-topic,0,159,4401,But anyways hoping all of West will pull through this tragic moment, sometimes things happen for unknown reasons.
2340,1442073812830,0,0,1,0,off-topic,876,176,4420,Watch LOOK!  Proof That Craft aka Blackwater did the Boston Marathon Bombing! on YouTube - https://t.co/3w7a8lZYZe @wilkowmajority
2341,1442073812833,1,0,1,0,on-topic,3,113,4426,DDC Waco active in supporting #westexplosion http://t.co/zPKtZvQ8hV
2342,1442073812836,0,0,1,0,off-topic,3,94,4431,But if you run up on me then its gon be a tragic
2343,1442073812837,0,1,1,0,off-topic,1,95,4438,have no fear of sudden disasters. | proverbs 3:25
2344,1442073812838,0,1,1,0,off-topic,1,136,4442,@slmathis11 happens every disaster. Hurricanes Tornados Floods.. People always doing wrong
2345,1442073812839,0,0,1,0,off-topic,1,91,4336,@JaredDiedrich go look at my previous tweets.
2346,1442073812840,0,0,1,0,off-topic,1,92,4337,@prettyterumi I know big crazy messed up world
2347,1442073812842,0,1,1,0,off-topic,2,154,4338,@Eemma___ I was bout to but shit my parents aint leaving so im not shit I dont want to leave and some happen
2348,1442073812842,0,0,1,0,off-topic,0,171,4339,I keep seeing people on the Bulls. Have y'all not seen their offense? Plus Brooklyn is a lot more dangerous than people think
2349,1442073812843,0,0,1,0,off-topic,1,77,4341,Im His Gutta Bitch for a Reason
2350,1442073812845,0,0,1,0,off-topic,2,83,4342,Shoulda waited To put in applications
2351,1442073812846,0,0,1,0,off-topic,1,78,4343,She Down For Shaye All The Way !
2352,1442073813016,0,0,1,0,off-topic,170,71,4344,I know where the stash is
2353,1442073813018,0,1,1,0,off-topic,2,130,4345,@ItssTeee_: Im Trynna Go Back To Sleep But Im Just UP-_-! Just close ya eyes lil one
2354,1442073813019,1,1,1,1,on-topic,1,154,4346,guys it feels like shattered dreams but it's so real. just taking a moment to let that sink in. #prayforwest
2355,1442073813019,0,0,1,0,off-topic,0,113,4347,When I get home, lets go on a 20 mile jog to catch up ok @MoeArthur
2356,1442073813020,0,0,1,0,off-topic,1,94,4349,@priscillaalvar7 Awk, I meant on the highway....
2357,1442073813022,0,0,1,0,off-topic,2,165,4351,@pluckypresby I think in part the question is the answer. The desire is part of the fulfillment.  The how is your life.
2358,1442073813022,0,0,1,0,off-topic,0,86,4352,I can't go get food until 6 I'm starving
2359,1442073813023,0,0,1,0,off-topic,1,83,4353,Bestfriend Stunting On My Young nigga
2360,1442073813025,0,0,1,0,off-topic,2,120,4354,Thanking The Man Above Waking Me Up &amp; This Unpromised Day #DailyTweet.
2361,1442073813026,0,1,1,0,off-topic,1,77,4355,I've seemed too have passed ^_^
2362,1442073813027,0,0,1,0,off-topic,1,60,4356,Lol i wanna go
2363,1442073813029,0,0,1,0,off-topic,2,132,4357,Idk how I'm cool with ish, he called me ugly then he don't even laugh at my damn jokes
2364,1442073813030,0,1,1,0,off-topic,1,138,4358,@itsmatty_bruh I agree with you, but that's not the only reason why he's coming here. Sadly.
2365,1442073813391,0,0,1,0,off-topic,361,104,4359,@YBLU_TR  I have a child on the way I can't go home lol JK
2366,1442073813392,0,1,1,0,off-topic,1,169,4360,@iAmSandra23Okay well if I get it by then ill give it to you if not then ill just tweet you and let you know when I get it.
2367,1442073813393,0,0,1,0,off-topic,1,101,4361,@yourRidicious o yeah me too, but where at in Waco? Lol
2368,1442073813395,0,0,1,0,off-topic,2,180,4362,@SallieKateHouse I ache every time someone from Baylor has told me they they've been to Missouri once...... Branson, Missouri that is.
2369,1442073813396,0,0,1,0,off-topic,1,110,4363,@TheRealFatGirl: Whenever I hear exercise i think of extra fries
2370,1442073813397,0,0,1,0,off-topic,1,120,4364,@SmilingKIJ Mine too. Sending you my love-- we got this!!! #pastorpeptalks
2371,1442073813398,0,1,1,0,off-topic,1,169,4365,So basically it was meant to be...Jay Gatsby and Nick Carraway from the beginning #thegreatgatsby  @ http://t.co/Ul4d6bCkw3
2372,1442073813399,0,0,1,0,off-topic,1,76,4367,Throw that ahhhh hold up bitch
2373,1442073813401,0,1,1,0,off-topic,2,89,4369,@Elizabethh_XoXo I ain't going to the store
2374,1442073813403,0,1,1,0,off-topic,2,101,4370,I have a feeling this is going to be a really long week
2375,1442073813405,0,1,1,0,off-topic,2,161,4371,Getting good parking spots at the BSB &gt;&gt;&gt;. Especially when driving is a last second thing for me. Love it.
2376,1442073813406,0,0,1,0,off-topic,1,103,4372,Stephen's whizz pig deluxe stacker http://t.co/jA9pjo3gND
2377,1442073813408,0,1,1,0,off-topic,2,150,4373,about to give my uncle a curfew bc this whole me staying home alone every night just is NOT cutting it..
2378,1442073813409,0,1,1,0,off-topic,1,87,4374,Someone just told me I act like I'm rich.
2379,1442073813410,0,0,1,0,off-topic,1,87,4375,@DannyPanda212 I still have your charger!
2380,1442073813412,0,0,1,0,off-topic,2,87,4376,Finna go get something to eat. Hungry -_-
2381,1442073813415,0,0,1,0,off-topic,3,89,4377,Wtf I know I'm in texas but what part shit!
2382,1442073813417,0,0,1,0,off-topic,2,86,4378,We were having such a great conversation
2383,1442073813419,0,0,1,0,off-topic,2,146,4379,Be jealous!!! This is what my interpreting team does before work today. Mmmm! http://t.co/w4eZ5jffGC
2384,1442073813419,1,1,1,1,on-topic,0,162,4455,Some folks wearing Obama t-shirts just want to see Obama.  I'm here to honor the fallen victims of the West tragedy!
2385,1442073813420,1,1,1,1,on-topic,1,175,4486,While one death or injury is too many, glad to see death toll revised downward. Also saw one missing firefighter was found alive.
2386,1442073813421,0,0,1,0,off-topic,1,183,4515,@OurDailyBears:President Obama will join Truman, Eisenhower, Johnson, Ford, and Bush as sitting Presidents to visit @Baylor.@Grant_Senter
2387,1442073813422,1,1,1,1,on-topic,1,120,4522,About to pass West Texas praying for everyone effective with the explosion
2388,1442073813423,1,0,1,0,on-topic,1,136,4527,donating clothes &amp; money tomorrow! im determined to make a difference in this tragedy!
2389,1442073813424,0,0,1,0,off-topic,1,134,4538,Boston shooting again near MIT, explosions have been heard. One officer has been killed.
2390,1442073813424,0,1,1,0,off-topic,0,154,4547,Diet Dr. Pepper: checkSubway: checkBrownies to eat while studying:check Heart attack: check back for updates
2391,1442073813425,1,0,1,0,on-topic,1,171,4564,Makes me smile to see firefighters on the processional taking pics and video of the crowd. They're touched too. #westmemorial
2392,1442073813425,1,1,1,1,on-topic,0,178,4578,I feel like the people that are interested in just seeing Obama just shouldn't go. Don't forget the purpose of the memorial service.
2393,1442073813426,0,1,1,0,off-topic,1,121,4445,@kmays just read your bio again- love Owned by cats. Me too, only just one!
2394,1442073813427,0,1,1,0,off-topic,1,136,4446,No matter what I do or what I say, there's always gonna be that one #NegativeNancy #FuckEm
2395,1442073813427,0,0,1,0,off-topic,0,139,4447,@ClareColeman92 I don't agree with you but I'm favoriting this tweet because of your Ebonics.
2396,1442073813428,0,0,1,0,off-topic,1,154,4448,Boys don't cry!??? Tell that to #Allen106 last night. Seven Pounds was raw. #WillSmithpower @NicholasLopez11
2397,1442073813430,0,0,1,0,off-topic,2,139,4449,I know I should respect your opinion but I find that difficult because you're a fucking idiot
2398,1442073813774,0,0,1,0,off-topic,344,115,4450,All them hoes tryna date me all them niggas hate me but its all gravy
2399,1442073813775,0,0,1,0,off-topic,1,109,4451,My clicc better than alot of these niggas in the industry #1137
2400,1442073813777,0,0,1,0,off-topic,2,124,4452,I wouuuuld go to pink Friday but oomf never gave me an I  shsu gammas t shirt.
2401,1442073813778,0,0,1,0,off-topic,1,137,4453,@CJCliburn I really did try to suppress my giggles! But then David totally called me out...
2402,1442073813778,0,0,1,0,off-topic,0,133,4454,I hope everyone is on there tweet grind tonight. Since ill be up working on my paper...
2403,1442073813779,0,0,1,0,off-topic,1,185,4456,I like when Charlie comes to visit. She brought cookies and last time cake. Food makes me happy and so does Charlie. http://t.co/YGUEcBZytj
2404,1442073813780,0,0,1,0,off-topic,1,80,4457,@Neeeners_  you find out what time
2405,1442073813781,0,0,1,0,off-topic,1,82,4458,Really not tryna' go to class today.
2406,1442073813783,0,0,1,0,off-topic,2,113,4459,@DatDamn_Fini: But I had to think ' that hoe ain't got nun on me'!!
2407,1442073813785,0,0,1,0,off-topic,2,84,4460,If I buy a phone on eastbay  @mickyyXO
