1570,1442071677879,0,0,1,0,off-topic,1,163,1570,@SmilingKIJ good!  Yeah, long fun story about that! Remind me to tell you MONDAY WHEN I'M IN DALLAS WITH YOU!! #squee
1571,1442071677879,0,0,1,0,off-topic,0,81,1571,Nobody fuckin with them tho, but ok
1572,1442071677880,0,0,1,0,off-topic,1,171,1572,To the girl who is tanning right outside my window, please get out of my view of Pat Neff! #disturbing http://t.co/fDWZ3F3aCQ
1573,1442071677880,0,0,1,0,off-topic,0,92,1573,@Natalia__Malik yeah(: no prob, and goodnight.
1574,1442071678058,0,1,1,0,off-topic,178,164,1574,Been chillin with these homies for 18 of the past 24 hours. #beefjerkey #heisprettychill #water http://t.co/zRYg8x5413
1575,1442071678059,0,0,1,0,off-topic,1,168,1575,I only know a few that listened to quistar before he got this noticed Richard, Diego, Eric, Omar, and myself foreal though
1576,1442071678059,0,0,1,0,off-topic,0,83,1576,Hooping this weekend with my loves (:
1577,1442071678059,0,0,1,0,off-topic,0,100,1577,This no one word replying back thong is hard &gt;.&lt;
1578,1442071678060,1,0,1,0,on-topic,1,136,1578,So In Love..                                                                  With Myself!
1579,1442071678060,0,1,1,0,off-topic,0,107,1579,People don't realize they had something good until its gone.!
1580,1442071678060,0,0,1,0,off-topic,0,114,1580,@ChrisTsavageAzz: I beat that pussy like no otha bitch dont even lie
1581,1442071678060,0,1,1,0,off-topic,0,102,1581,Church was just what I needed this morning. @CarolineR94
1582,1442071678061,0,0,1,0,off-topic,1,186,1582,@melissawible Working on Elevate verses. You shared this one w/ me at Awaken 3 yrs ago and I still come back to it =] http://t.co/3h7rn6WPXP
1583,1442071678061,0,0,1,0,off-topic,0,171,1583,I love those outfits where everyone thinks I've spent a lot of money on it, but really I most likely bought it at Goodwill...
1584,1442071678061,0,0,1,0,off-topic,0,83,1584,@That_SwaggyNiqq my car fucked up bro
1585,1442071678245,0,0,1,0,off-topic,184,113,1585,Special Olympics taking place at Connally HS http://t.co/LBptCEzF8r
1586,1442071678246,0,1,1,0,off-topic,1,124,1586,@bayydayy literally hypothetical... But in the past I have just ended the shit
1587,1442071678246,0,1,1,0,off-topic,0,83,1587,He tries to be clever and just fails.
1588,1442071678246,0,0,1,0,off-topic,0,77,1588,I'm all about that hibachi life
1589,1442071678247,1,0,1,0,on-topic,1,108,1589,God Bless everyone affected by the events in #West and #Boston
1590,1442071678247,0,0,1,0,off-topic,0,87,1590,I cant trust nobody at the end of the day
1591,1442071678247,0,0,1,0,off-topic,0,122,1591,Stay in bed, or shower and go to geology while crying?Looks like number 2...
1592,1442071678248,0,1,1,0,off-topic,1,167,1592,@RightSideVP yea it happens.My totals have been great this month though.  Bad days happen. Lets get both get it tomorrow!
1593,1442071678248,1,0,1,0,on-topic,0,179,1593,Dropping by a Red Cross donation. A somber mood at West's Czech Stop. Our thoughts are w/ West. (@ Czech Stop) http://t.co/OjOqPdG0Bl
1594,1442071678248,0,0,1,0,off-topic,0,82,1594,every song somehow reminds me of you
1595,1442071678248,0,0,1,0,off-topic,0,156,1595,@JayRetro718 no doubt! I was diggin through I definitely was feelin the vibe. Some real dope stuff you doing!!
1596,1442071678249,0,0,1,0,off-topic,1,74,1596,Dolled up &amp; ready to go!
1597,1442071678249,1,0,1,0,on-topic,0,186,1597,Ervin Cinek, 84, was asleep in his nursing home during explosion. Left his false teeth behind, helped others get out. http://t.co/4BmUYCMtR8
1598,1442071678432,0,1,1,0,off-topic,183,87,1598,I only think of you as breaking my heart.
1599,1442071678432,0,0,1,0,off-topic,0,90,1599,I got a game in 30 mins and I'm still in bed
1600,1442071678433,0,0,1,0,off-topic,1,180,1600,Wait. Aren't Christians supposed to love everyone and not be judgmental? I don't remember Jesus being harsh toward sinners.  #subtweet
1601,1442071678433,0,0,1,0,off-topic,0,111,1601,Fighting is ugly , but I KNOW don't no bitch put fear in my heart
1602,1442071678433,0,0,1,0,off-topic,0,176,1602,@jennaakay: yeah no definitely do not feel safe with this huge lizard living right outside my bedroom Except its a 3 inch gecko...
1603,1442071678434,0,0,1,0,off-topic,1,79,1603,Damn he knocked that nigga out yo
1604,1442071678434,0,1,1,0,off-topic,0,87,1604,Chasity be having the niggas going crazy!
1605,1442071678434,0,1,1,0,off-topic,0,85,1605,Miss the old days, just not my old ways
1606,1442071678435,1,0,1,0,on-topic,1,141,1606,Dropping by a Red Cross donation. A somber mood at West's Czech Stop. Our thoughts are w/ West.
1607,1442071678435,0,0,1,0,off-topic,0,100,1607,God continues to amaze me with His beautiful creation!
1608,1442071678435,1,0,1,0,on-topic,0,185,1608,@colettemc21 Thank you sweet girl! All safe in Waco. Such a tragedy but so touching to see the entire central TX community uniting #missyou
1609,1442071678436,0,1,1,0,off-topic,1,145,1609,Hopefully the Browns have a good draft! Good way to start by drafting @keke_mingo #Browns #Football
1610,1442071688182,0,1,1,0,off-topic,9746,106,1610,I'll ride with you through bullshit, just don't bullshit me.
1611,1442071688183,0,0,1,0,off-topic,1,94,1611,@holly1120 that's not a trail, it's a side walk!
1612,1442071688183,0,1,1,0,off-topic,0,169,1612,Let's take a trip down memory lane... The halls of my old High School, ain't much changed just a few http://t.co/2LujOK5iBa
1613,1442071688183,0,1,1,0,off-topic,0,150,1613,@StephGhost: Grown men dating kids has started to become normal in this society and that shit is sick !!
1614,1442071688184,0,0,1,0,off-topic,1,121,1614,When ppl act like they dont care about shit&lt;&lt;&lt;&lt;&lt;&lt;&lt;&lt;
1615,1442071688184,0,0,1,0,off-topic,0,73,1615,Puff Hating On a real nigga
1616,1442071688184,0,1,1,0,off-topic,0,162,1616,@yourRidicious: I'm The Current Bitch , Fuck A Next Bitch . I'm Worried About ME &amp; How I Can Benefit My Nigga :)
1617,1442071688184,0,1,1,0,off-topic,0,169,1617,There's a lot of good stuff going on in West besides just kolaches #GodBlessWest @ West Fair Grounds http://t.co/ByZRahu6F6
1618,1442071688184,0,1,1,0,off-topic,0,78,1618,I just wanna tell you good game.
1619,1442071688185,0,0,1,0,off-topic,1,109,1619,This last week has made me appreciate everything so much more b
1620,1442071688185,0,0,1,0,off-topic,0,142,1620,@dani_crayy @jperk2012 I hate you hahahahah  and jd should feel honored that I took creeper pics
1621,1442071688185,0,1,1,0,off-topic,0,84,1621,I aint going anywhere without my bread
1622,1442071688185,0,0,1,0,off-topic,0,186,1622,@JeremyC_Bradley oh!That'd be an amazing mission trip location.Remind me to scope that out for a college mission trip sometime #worktripyall
1623,1442071688185,0,1,1,0,off-topic,0,178,1623,my tweets earlier were really mean, i apologize everybody. had to step out of character for a quick moment.. i just REALLY hate her.
1624,1442071688186,1,0,1,0,on-topic,1,169,1624,Thursday Night Bonus Karaoke Fundraiser for West at Scruffs. #westtx #prayforwest @ Scruffy Murphy's http://t.co/N0pcWPvoZQ
1625,1442071688186,0,0,1,0,off-topic,0,78,1625,@CareUhLion yea! A gift from ME.
1626,1442071688186,0,0,1,0,off-topic,0,134,1626,@sammich___: @JakeV_BU13 We must be from the same tribe... the chinglangdinglingdangs no
1627,1442071688186,0,0,1,0,off-topic,0,81,1627,@dani_crayy heheh this is why I  u.
1628,1442071688186,0,0,1,0,off-topic,0,119,1628,I wish @MelanieIglesias or @ArianaGrande would at least RT me..  #Thirsty
1629,1442071688187,0,0,1,0,off-topic,1,71,1629,Why did God create women?
1630,1442071688187,0,0,1,0,off-topic,0,74,1630,because fuck you that's why.
1631,1442071688187,0,1,1,0,off-topic,0,112,1631,@SayyLilBri  lmao not even the case..same thing happens every week
1632,1442071688188,0,1,1,0,off-topic,1,161,1632,@Be_Determined_: Fear is fake. It's just a feeling. But danger... Danger is very real. Don't be afraid of anything.
1633,1442071688558,0,0,1,0,off-topic,370,111,1633,When we're out of balance, it creates an open door for the devil.
1634,1442071688559,0,0,1,0,off-topic,1,183,1634,Watching a documentary on BULLYING. I will not be that teacher who looks the other way! It's the opposite of why I chose to be a teacher!
1635,1442071688559,0,0,1,0,off-topic,0,162,1635,TV and tulips...okay - not really tulips, but flowers(weeds) and an old tube TV...#mikefights http://t.co/qod1cyJopj
1636,1442071688559,0,0,1,0,off-topic,0,93,1636,Where Is my momma anyways I'm at home by myself
1637,1442071688559,0,1,1,0,off-topic,0,89,1637,@goin_HAM5 oh ard lol I was just makin sure
1638,1442071688560,0,1,1,0,off-topic,1,82,1638,i guess i should start packing now..
1639,1442071688560,0,0,1,0,off-topic,0,128,1639,Having to redo my impressions because the other ones didn't work. I'm about to gag
1640,1442071688560,0,1,1,0,off-topic,0,101,1640,Oooo yes!! Vitek's BBQ is gonna hit the spot for sure!!
1641,1442071688561,0,1,1,0,off-topic,1,189,1641,It's always: 1)fake milso 2)being in his uniform 3)wifey vs gf 4)opsec 5)more fake MilSOs, we get it!every now &amp; then ok, but every day now
1642,1442071688561,0,0,1,0,off-topic,0,121,1642,@BraylonBartlett Yo dawg we got a party tonight at my house if u wanna come
1643,1442071688561,0,0,1,0,off-topic,0,115,1643,Cause those other men are practice. And this ain't no time for actin.
1644,1442071688561,0,0,1,0,off-topic,0,127,1644,Referred Listing in Waco, TX - earnings estimate: $3,000 - http://t.co/xpkgUD4vz4
1645,1442071688562,0,0,1,0,off-topic,1,91,1645,Would you believe me if I said I was in love?
1646,1442071688562,0,0,1,0,off-topic,0,68,1646,Aight I need to go eat
1647,1442071688562,0,0,1,0,off-topic,0,96,1647,I want all of you, forever, you and me, every day.
1648,1442071688563,0,0,1,0,off-topic,1,143,1648,Fuck These Skeezy Ass Hoes I'm His ole laaddyy and that's the business ^_^ http://t.co/BbmOExLY8X
1649,1442071688563,0,1,1,0,off-topic,0,97,1649,That text i just sent Chris &gt;&gt;&gt; its so 100
1650,1442071688563,1,0,1,0,on-topic,0,179,1650,Pointwest Bank VP tells me they have opened a fund for #West victims. Accepting all kinds of donations. (200 W. Oak or waco branches)
1651,1442071688563,0,0,1,0,off-topic,0,116,1651,@TweetEm_B: Baby These Young Hoes Got Alot Too Learn Bout This Niggas.
1652,1442071688563,1,0,1,0,on-topic,0,151,1652,I can't stop crying for these people that need hell, &amp; that have had everything torn away from them..
1653,1442071688563,0,0,1,0,off-topic,0,81,1653,I dont like hoe niggas in my circle
1654,1442071688564,0,0,1,0,off-topic,1,99,1654,@creolemigo you really think you can beat me up huh ?
1655,1442071688564,0,0,1,0,off-topic,0,83,1655,Why am I such a beast a call of duty?
1656,1442071688564,0,1,1,0,off-topic,0,102,1656,Ima lakers fan but that Knicks and Boston series gone be
1657,1442071688565,0,0,1,0,off-topic,1,178,1657,First time to sit down since 7:45, &amp; I can't even enjoy it bc I keep thinking about how much more I have to get done today #uggg
1658,1442071688565,0,0,1,0,off-topic,0,83,1658,@irvman116 thanks Irv! Miss you too!!
1659,1442071688565,0,0,1,0,off-topic,0,98,1659,#DrBradleySays he's been around a lot. #HappyTuesday
1660,1442071688566,0,0,1,0,off-topic,1,87,1660,Soaking my feet because they hurt so bad!
1661,1442071688566,0,1,1,0,off-topic,0,179,1661,@xxcantbesavedxx no my mom did just now lol I'm in love with it  she got me a navy charm too but they have to wait for it to come in!
1662,1442071688566,0,0,1,0,off-topic,0,118,1662,Target of the next 5 min: Laurel #LeadLLCtraining http://t.co/U1a5LO7BCW
1663,1442071688566,0,1,1,0,off-topic,0,128,1663,Charlie and I just walking @oliviaoffringa to class #baylor http://t.co/2SlFIPyhWV
1664,1442071688567,0,0,1,0,off-topic,1,139,1664,Had to relocate to find more ducks (@ Bledsoe-Miller Community Center) http://t.co/ayjNz11QeW
1665,1442071688567,0,0,1,0,off-topic,0,140,1665,Have you ever seen a flying squirrel? No. You're about to. *Flops ontop of roomie* #roomielove
1666,1442071688567,0,0,1,0,off-topic,0,114,1666,When @NickRodriquezz and I have our reading time&gt;&gt;&gt;&gt;&gt;
1667,1442071688567,0,0,1,0,off-topic,0,94,1667,@ReeeeeUpppppp: Who is Snupe?same question I got
1668,1442071688568,0,0,1,0,off-topic,1,139,1668,Finally my mom decides to turn the AC on! It was like 80 degrees in this house!! #ThaStruggle
1669,1442071688572,0,0,1,0,off-topic,4,81,1669,My mistakes hurt the ppl around me.
1670,1442071688572,0,1,1,0,off-topic,0,174,1670,@kjon @zatch90 It's been unusually chilly here...and then today hit and we're suddenly in the 90s. #Texasweatherprobs #butreally
1671,1442071688573,0,0,1,0,off-topic,1,118,1671,Dried my polo that hoe shrunk on My bitch ass,  straight Marshall's polo
1672,1442071688573,0,1,1,0,off-topic,0,79,1672,@ the news i just found out. #FML
1673,1442071688573,0,0,1,0,off-topic,0,159,1673,@GrantStout divv :( might cheer you up that when I wrote that it autocorrected to dove. Div, such a delicate dove
1674,1442071688574,0,0,1,0,off-topic,1,179,1674,@Valenzuela_123 Lol. She erased her MySpace before everyone abandoned it &amp; joined the FB wagon. Errrbody either forgot or erased.
1675,1442071688574,0,0,1,0,off-topic,0,129,1675,@TirayeKream_: I got bloods n crips wit 30 clips fresh ass nigga wit a dirty pistol
1676,1442071688574,0,0,1,0,off-topic,0,128,1676,love the way I feel after drinking a #bode in the morning  #energized #happymonday
1677,1442071688574,0,0,1,0,off-topic,0,105,1677,za West. (For West) @ Ferrell Center http://t.co/xP63BZOltY
1678,1442071688575,1,0,1,0,on-topic,1,164,1678,MT @BU_GradSchool: Ordinary individuals blessed with extraordinary courage - @GovernorPerry #westmemorial #prayforwest
1679,1442071688575,0,0,1,0,off-topic,0,106,1679,The last time I tripped over pussy was probably at my birth.
1680,1442071688575,0,0,1,0,off-topic,0,148,1680,@Xman813: @JakeV_BU13 I be omw when my pop corn is done! Ill be at the bank like get this cash off me!
1681,1442071688746,0,0,1,0,off-topic,171,144,1681,@BEATKINGKONG: why is whataburger fries always so stingy wit da salt ? @Whataburger #weneedanswers
1682,1442071688746,0,0,1,0,off-topic,0,78,1682,Guys he inhaled that burger lmao
1683,1442071688747,0,0,1,0,off-topic,1,98,1683,@iAmNotA_Dyke ...nice blurring effect ya did there .
1684,1442071688747,0,0,1,0,off-topic,0,113,1684,Khelsea on twitter lastnight talking about  bitch you see this shit
1685,1442071688747,1,0,1,0,on-topic,0,95,1685,Explosion outside of Waco https://t.co/W31HbAA3jG
1686,1442071688748,0,0,1,0,off-topic,1,108,1686,I'm too good at forgiving but forgetting isn't my strong point
1687,1442071688748,0,0,1,0,off-topic,0,115,1687,As happy as I am that T. Will got drafted, I'm still hellllllla salty
1688,1442071688748,0,0,1,0,off-topic,0,92,1688,@aee_mickey ??? Noo, it means we gon fight lol
1689,1442071688749,0,1,1,0,off-topic,1,166,1689,All 4 horses in the National Championship ride off are Kstate horses. Flat, fences, reining and horsemanship. #justsayin
1690,1442071688749,0,1,1,0,off-topic,0,177,1690,I was real live finna drop a year, &amp; idek the girl... Just the fact that she was just on IG on her way to prom looking so happy
1691,1442071688749,0,1,1,0,off-topic,0,144,1691,@_liltats aw was w/ Deaudric earlier was seeing if you gone go too Dewey but we ain't end up going
1692,1442071688749,0,0,1,0,off-topic,0,86,1692,Ima have juicy &amp; disi washing my car
1693,1442071688750,0,0,1,0,off-topic,1,149,1693,@Great_One_: I don't know yet. Care to tone it down some while I'm still worrying about my grade? (-_-)
1694,1442071688750,0,0,1,0,off-topic,0,125,1694,My charger is in the bathroom... WELP ! This one ain't getting charged tonight.
1695,1442071688750,0,0,1,0,off-topic,0,174,1695,@bmiana: @marckiewalter smart man! Haha. That's awesome though. I love it, it really is unique and from what I know, TOTALLY you
1696,1442071688750,0,1,1,0,off-topic,0,93,1696,my room was clean Ike a week ago. what happened
1697,1442071688750,0,0,1,0,off-topic,0,87,1697,Asher need to take her African ass to bed
1698,1442071688751,0,0,1,0,off-topic,1,179,1698,I'm still hype from that game @CintoXantano and those University Trojans played last night! Y'all balled kid!!!!! #proudofyou #salute
1699,1442071688751,0,0,1,0,off-topic,0,68,1699,A top notch bitch &gt;
1700,1442071688751,1,1,1,1,on-topic,0,136,1700,At the busiest time of the day there was a 5 hour wait to give blood here in Waco #OneWaco
1701,1442071688752,0,1,1,0,off-topic,1,137,1701,@itsanastacia_ I'm not angry. I thought I'd just let you know how stupid of a cunt you are.
1702,1442071688752,0,0,1,0,off-topic,0,107,1702,@Onlyy_MeeXoXo girl it was alright I don't think I got it tho
1703,1442071688752,0,1,1,0,off-topic,0,142,1703,@_Lovee15 yes girl lol I got it right after class, I was gonna sue them if they would've lost it
1704,1442071689120,0,0,1,0,off-topic,368,157,1704,76701: Special Weather Statement issued April 18 at 5:53AM CDT  by NWS Dallas-Fort Worth http://t.co/xe7HrtXAxi
1705,1442071689121,0,1,1,0,off-topic,1,99,1705,@Kodi_thickAss you &amp; tay going to the freak nik ?
1706,1442071689121,0,0,1,0,off-topic,0,144,1706,@Camille_Butler @onlyonetscan lol. If it makes you feel any better no one got me drunk food at 6am
1707,1442071689121,0,0,1,0,off-topic,0,65,1707,One hell of a night
1708,1442071689122,0,0,1,0,off-topic,1,170,1708,Amazon Original: Onion News Empire. One amazing pilot. Hilarious. Sticks to classic onion. Can't wait to see more! @TheOnion
1709,1442071689122,0,0,1,0,off-topic,0,122,1709,Everything you want to know about #Waco, #Texas here! http://t.co/mpIFXhwJ3U
1710,1442071689122,0,0,1,0,off-topic,0,71,1710,Chillin with the old crew
1711,1442071689123,0,0,1,0,off-topic,1,124,1711,@boogiechick21: Watching Kings of Comedy on Netflix. Too funny!! #ripberniemac
1712,1442071689123,0,0,1,0,off-topic,0,95,1712,Yall dont know how bad I wish I was back in the h
1713,1442071689123,1,0,1,0,on-topic,0,143,1713,Need dry socks for the rescue workers in west Texas...call me if you want to donate  254 730 3447
1714,1442071689124,0,1,1,0,off-topic,1,73,1714,I be thinking we gone die!!
1715,1442071689124,0,0,1,0,off-topic,0,175,1715,Jurassic Park....I'm 8 years old again!!! (at @StarplexCinemas Galaxy 16 for Jurassic Park 3D w/ 2 others) http://t.co/ByJFpauqLp
1716,1442071689124,0,0,1,0,off-topic,0,98,1716,@tykam94 i didn't.. i parked in a muddy ditch.. LOL.
1717,1442071689125,0,0,1,0,off-topic,1,83,1717,@TlalocRivas I am safe. Send prayers.
1718,1442071689125,0,1,1,0,off-topic,0,91,1718,Someone draft Lacy and @TerranceWill2 already
1719,1442071689125,0,0,1,0,off-topic,0,98,1719,@John__Reyes: Keep them squares up out your circle..
1720,1442071689126,0,1,1,0,off-topic,1,119,1720,Desperate Ass Ppl That Beg For Attention &lt;&lt;&lt;&lt;&lt;&lt;&lt;&lt;
1721,1442071689126,0,1,1,0,off-topic,0,123,1721,This early &amp; people tryna talk shit to me already! Lmao. Bye, Dissmissed.
1722,1442071689126,0,1,1,0,off-topic,0,86,1722,@TareanS okay ill just donate money then
1723,1442071689127,0,0,1,0,off-topic,1,127,1723,All this homework I had done but never turned in is what's causing me to fail.-.-
1724,1442071689127,0,0,1,0,off-topic,0,157,1724,76639: Special Weather Statement issued April 10 at 2:02PM CDT  by NWS Dallas-Fort Worth http://t.co/rjIcUPWVBz
1725,1442071689127,0,0,1,0,off-topic,0,69,1725,Test anxiety to the max
1726,1442071689128,0,0,1,0,off-topic,1,156,1726,@WBCSays @Dallas_Observer You guys really really don't want to come to Texas. You will get quite the greeting!
1727,1442071689128,0,0,1,0,off-topic,0,92,1727,Told me cut ties basically but that also means
1728,1442071689128,0,0,1,0,off-topic,0,116,1728,You can't leave Ginobili open from the 3 in transition!! #makingitrain
1729,1442071689128,0,1,1,0,off-topic,0,154,1729,My brother got a bit a bothered when I told him .. Cause I stopped going to the  youth group at our church .
1730,1442071689129,0,1,1,0,off-topic,1,119,1730,Going to need the weather to warm up, I am freezing with these shorts on.
1731,1442071689129,0,0,1,0,off-topic,0,168,1731,I can't workout for another week until cleared from doctor...but looking forward to having that back in my morning routine
1732,1442071689129,0,0,1,0,off-topic,0,82,1732,@TheeLastOreo thank you!! I love it!
1733,1442071689129,0,0,1,0,off-topic,0,76,1733,You get served around this hoe
1734,1442071689130,0,0,1,0,off-topic,1,78,1734,Mama Dee Really Don't Fw Erica !
1735,1442071689130,0,0,1,0,off-topic,0,172,1735,Gets me twerking.... @ThatIsTRAGIC: Works, every time @TomCatOnTop: Drink tequila if you wanna fight with your bf... #GirlCode
1736,1442071689131,0,0,1,0,off-topic,1,174,1736,The world of health care needs Daniels. God has given you the tools and the opportunity. Be a Daniel. -ethics prof  #inspiration
1737,1442071689131,0,0,1,0,off-topic,0,137,1737,Finna take a hoe bath before these lights try to cut off again, won't catch me slipping lol
1738,1442071689131,1,0,1,0,on-topic,0,174,1738,About 0.8 km away from the plant explosion site. Roadblocks everywhere.#texas #explosion (at West Texas)  http://t.co/d5dDCBFDer
1739,1442071689131,1,0,1,0,on-topic,0,116,1739,Catch up on local news from #Waco, #Texas here! http://t.co/gertcbZ4dp
1740,1442071689131,1,0,1,0,on-topic,0,104,1740,At the benefit concert! #DiadelWest http://t.co/JwjG10tGKz
1741,1442071689132,0,0,1,0,off-topic,1,86,1741,I'm in the mood for a breakfast burritos
1742,1442071689132,0,1,1,0,off-topic,0,87,1742,Everybody going to sleep on me &amp; shit
1743,1442071689133,0,0,1,0,off-topic,1,125,1743,@DannyPanda212 hahaha nice, so y'all ended up getting to go to each place today
1744,1442071689133,0,0,1,0,off-topic,0,111,1744,Almost through with this Chem then a Spanish review #Perseverance
1745,1442071689133,0,0,1,0,off-topic,0,89,1745,@_ExoticYella: let me taste between yo legs
1746,1442071689133,0,1,1,0,off-topic,0,167,1746,Me and Ryan goin to work on this system in the Boat! Y'all gonna hear us jam for days while we're on the Water!!!!!!!!!!!
1747,1442071689134,0,1,1,0,off-topic,1,174,1747,Don't give me those condescending looks dude in the car next to me. Yes I'm jamming to bieber #favoritegirl live. #EXITTOTHELEFT
1748,1442071689134,0,1,1,0,off-topic,0,87,1748,I love all my shoes , we gone get married
1749,1442071689134,0,1,1,0,off-topic,0,105,1749,My boy @CT4197 puttin' in hours at Crave #crucial #thesquad
1750,1442071689135,0,0,1,0,off-topic,1,92,1750,My bitch got every nigga in here that want her
1751,1442071689135,0,0,1,0,off-topic,0,70,1751,Dont play me like a fool
1752,1442071689135,0,0,1,0,off-topic,0,87,1752,I like bad bitches , I hate boring hoes !
1753,1442071689136,0,0,1,0,off-topic,1,102,1753,But Play It Smart ,Don't Jeopardize What You got At Home
1754,1442071689309,0,0,1,0,off-topic,173,91,1754,Done With Spring Semester&gt;&gt;&gt;&gt;&gt;
1755,1442071689309,0,1,1,0,off-topic,0,104,1755,@Forever_like21: Twiiter so boring now then get off of it.
1756,1442071689309,0,0,1,0,off-topic,0,111,1756,Looks like i cant go to the game tomorrow  No one can work for me
1757,1442071689310,0,0,1,0,off-topic,1,102,1757,@Milsostruggles where's his aschool? Is it far from you?
1758,1442071689310,0,0,1,0,off-topic,0,90,1758,This dumbass nigga done lost the lighter -_-
1759,1442071689310,0,0,1,0,off-topic,0,184,1759,Oh Snap! #baylor Cory Jefferson to stay?!?!? Hell yea!!!! If Austin stay the WHOLE DAMN @NCAA @marchmadness  better look out next season!!
1760,1442071689311,0,0,1,0,off-topic,1,71,1760,I'm so over this semester
1761,1442071689311,0,0,1,0,off-topic,0,169,1761,If you ever need to be knocked down a notch, watch the YouTube vids you thought were funny in middle school. #embarrassment
1762,1442071689311,0,0,1,0,off-topic,0,107,1762,Get on my face. #roadtrip @ Czech Stop http://t.co/i4oikXvGpM
1763,1442071689312,0,1,1,0,off-topic,1,70,1763,Okay I'm gonna sleep now
1764,1442071689312,0,0,1,0,off-topic,0,117,1764,@_arielrechellee I wasn't talking about you, buttt you are very pretty!
1765,1442071689312,0,0,1,0,off-topic,0,68,1765,I don't give a boo boo
1766,1442071689313,0,0,1,0,off-topic,1,91,1766,The bases are loaded and Pujols is up... WHY.
1767,1442071689313,0,0,1,0,off-topic,0,98,1767,@creolemigo that train aint that hard to handle mama
1768,1442071689314,0,1,1,0,off-topic,1,133,1768,This next week.... Is going to to be hell with papers ! Ain't no time for distractions.
1769,1442071689314,0,0,1,0,off-topic,0,98,1769,@lizeast :) it is always better to do with a friend.
1770,1442071689314,0,0,1,0,off-topic,0,99,1770,That Long talk I had with dj about Our Loves &gt;&gt;
1771,1442071689315,0,0,1,0,off-topic,1,96,1771,@everydayakita then let's be there for each other!
1772,1442071689315,0,0,1,0,off-topic,0,71,1772,This aint the Dream world
1773,1442071689316,0,1,1,0,off-topic,1,106,1773,Yea ima be black today! Tan gonna be all kinds of wrong lmao
1774,1442071689316,0,0,1,0,off-topic,0,104,1774,@Keee_Marie bro you need a ride before I leave east waco ?
1775,1442071689316,0,0,1,0,off-topic,0,163,1775,@_PrincessGF known him 10 yrs, dated almost 5, each others 1st, getting married, best friends  http://t.co/mssSEDr1T5
1776,1442071689316,0,0,1,0,off-topic,0,99,1776,Weekends &gt; Shit get better and better every time !
1777,1442071689317,0,0,1,0,off-topic,1,80,1777,Kissy face is like my default face
1778,1442071689317,0,0,1,0,off-topic,0,108,1778,Let's see how many ways I can avoid wearing pants this week...
1779,1442071689318,0,0,1,0,off-topic,1,92,1779,@brooke_xo_Okay! It's a Sunday so be home! Lol
1780,1442071689318,0,0,1,0,off-topic,0,129,1780,Ugh! Mann I hate being sick somebody HELP @ The HEADquarters http://t.co/wh5kLmx41C
1781,1442071689503,0,0,1,0,off-topic,185,108,1781,Lazy days like this I wish my dog was still here to chill with
1782,1442071689505,0,1,1,0,off-topic,2,107,1782,Is it true about what's happening in Boston right now? .____.
1783,1442071689506,0,0,1,0,off-topic,1,71,1783,It Feels So Good Outside!
