3108,1442071708349,0,0,1,0,off-topic,0,175,3108,Walking procession of uniformed personnel at noon at the ceremony. Doors open to public after uniformed personnel make it inside.
3109,1442071708350,0,1,1,0,off-topic,1,85,3109,I seriously dont need traffic right now
3110,1442071708351,0,0,1,0,off-topic,1,80,3110,He cut the bitch head off god damn
3111,1442071708353,0,1,1,0,off-topic,2,176,3111,When you feel like criticizing anyone, just remember that all the people in this world haven't had the advantages that you've had.
3112,1442071708353,0,0,1,0,off-topic,0,121,3112,How much do you want it are you willing to out everything on hold to fix it
3113,1442071708354,0,0,1,0,off-topic,1,106,3113,Seriously wanting to invest money into a good stylish watch.
3114,1442071708355,0,0,1,0,off-topic,1,119,3114,cotton palace with my wifey @annacurlyy @ Waco, TX http://t.co/jn3FUMBb8h
3115,1442071708356,0,0,1,0,off-topic,1,177,3115,Met the Ying Yang Twins at lunch! You may know them from their classy songs such as Whistle While You Twerk or Big Butts. #happydia
3116,1442071708356,1,1,1,1,on-topic,0,137,3116,Just dropped donations off in West, there's so much stuff already!! #GodIsGood #prayforwest
3117,1442071708357,0,0,1,0,off-topic,1,148,3117,@BuzzFeedNews: Boston bombing suspect after he was captured (pic: @AP) http://t.co/BUXvV8xUHu #legit ?
3118,1442071708357,0,0,1,0,off-topic,0,149,3118,@theonetruemyles Yes but participation in Theo-Logos, the eternal Son. Makes it fundamentally dufferent
3119,1442071708358,0,1,1,0,off-topic,1,139,3119,Just sent my bestest best friend her happy birthday message now I can officially go to sleep.
3120,1442071708358,0,1,1,0,off-topic,0,158,3120,Really hoping this MTV show doesn't ruin my love for Ke$ha... but somehow I'm already planning on it... #hateMTV
3121,1442071708359,0,0,1,0,off-topic,1,111,3121,@lorilee714 @laurenphillips3 moving to the sand volleyball courts
3122,1442071708359,1,1,1,1,on-topic,0,163,3122,Just arrived at the Ferrell Center. @KLTV7 will have live coverage on today's memorial service http://t.co/PJuOZoihEY
3123,1442071708360,0,0,1,0,off-topic,1,89,3123,@YBLU_TR that's not a joke I would tell Bob
3124,1442071708361,0,0,1,0,off-topic,1,139,3124,RT @RoyceMrSleeve: I don't want no scrubhaha A scrub is a guy that can't getnolove from me...
3125,1442071708361,0,0,1,0,off-topic,0,186,3125,@TerranceWill2 for my @dallascowboys?! YES!!! WELCOME TERRANCE!! Im so excited youre continuing w/my favorite team!! HOW BOUT THEM COWBOYS!!
3126,1442071708362,0,0,1,0,off-topic,1,97,3126,Good weekend so far. Ready for Saturday. Impatient.
3127,1442071708363,0,0,1,0,off-topic,1,110,3127,@EroticSexFacts: Don't be shy about your freaky side I'm not lol
3128,1442071708363,0,0,1,0,off-topic,0,81,3128,After tht I'm takin me a badass nap
3129,1442071708364,0,0,1,0,off-topic,1,132,3129,@MissC_Bobby lasagna, chicken, Mac &amp; cheese, and some other shit I didn't see haha
3130,1442071708365,0,0,1,0,off-topic,1,86,3130,@Shawnee_Keyshae love you too, hmu later
3131,1442071708366,0,0,1,0,off-topic,1,121,3131,LOL I'm the boringest texter ever... especially if I don't know you well ;p
3132,1442071708366,1,1,1,1,on-topic,0,171,3132,So thankful Obama is coming to Waco tomorrow because my test got cancelled... #soblessed @LauraHaigler http://t.co/RAWAx6tVNv
3133,1442071708367,0,0,1,0,off-topic,1,68,3133,My team blasting on em
3134,1442071708368,0,0,1,0,off-topic,1,81,3134,Love me some crawfish!' #mixer #yum
3135,1442071708369,0,0,1,0,off-topic,1,88,3135,@Lil_BigJoe lmao thats cute cause i can (:
3136,1442071708370,0,0,1,0,off-topic,1,95,3136,Tired.. I need a drink. And a superhero costume..
3137,1442071708372,0,0,1,0,off-topic,2,111,3137,Am i the only person on this earth who has to have center caps???
3138,1442071708373,0,0,1,0,off-topic,1,88,3138,I swear you're giving me a heart attackkkk
3139,1442071708375,0,0,1,0,off-topic,2,157,3139,76676: Special Weather Statement issued April 18 at 4:49AM CDT  by NWS Dallas-Fort Worth http://t.co/X82mvLS2b5
3140,1442071708376,0,0,1,0,off-topic,1,115,3140,#ThingsISayInSchoolTheMost daaaaaayyyuuuuummm she gotta big forehead.
3141,1442071708378,0,0,1,0,off-topic,2,179,3141,@kimbrrrly94: Maybe I don't have my life all planned out like I thought I use too. I don't even know who I am anymore.. #WhatAmIDoing
3142,1442071708379,0,0,1,0,off-topic,1,108,3142,@Forever_like21 woah woah woah, who you think you talking too?
3143,1442071708380,0,1,1,0,off-topic,1,182,3143,If my professor cancels class on Thursday because the president is coming to Baylor. I promise you I won't be going to see the president
3144,1442071708381,0,1,1,0,off-topic,1,123,3144,Today is NOT my day. Next person to say/do something wrong aint gone like me.
3145,1442071708381,0,0,1,0,off-topic,0,126,3145,@xxxKakey: Sometimes all a bitch really need is some GOOD DICK to calm her down.
3146,1442071708382,1,1,1,1,on-topic,1,151,3146,Where?? RT@AyoooooTee: Another explosion YOU KNOW WHAT IM PACKING MY SHYT ND GOING TO CANADA OR SOME SHYT
3147,1442071708383,0,0,1,0,off-topic,1,94,3147,Also locked in Cards ML, Rangers RL, and reds RL
3148,1442071708385,0,1,1,0,off-topic,2,177,3148,@NICKIMINAJ: I used to dilly dally now I dilly to cali/used to push da pink denali now its da __________________da red fahar__. :-)
3149,1442071708386,0,0,1,0,off-topic,1,71,3149,This morning was not good
3150,1442071708388,0,0,1,0,off-topic,2,104,3150,Ive been avoiding commadment, that why im in this position
3151,1442071708389,0,0,1,0,off-topic,1,75,3151,@tiesto come to Texas again!!
3152,1442071708390,0,0,1,0,off-topic,1,70,3152,Iknow that wasn't to me?
3153,1442071708391,0,1,1,0,off-topic,1,91,3153,@GretGru are you visiting Waco anytime soon?!
3154,1442071708392,0,1,1,0,off-topic,1,149,3154,That awkward moment when my laptop decides to play I just had sex on full volume in my dads office.....
3155,1442071708393,0,0,1,0,off-topic,1,109,3155,I juss liked Everything to be Funny like Yea BITCCHH I See It !
3156,1442071708394,0,0,1,0,off-topic,1,72,3156,Cheating can't be that bad
3157,1442071708395,1,0,1,0,on-topic,1,162,3157,Volunteering side by side in west with victims, students, and people from all over the state. http://t.co/AWTo85AiOR
3158,1442071708395,0,0,1,0,off-topic,0,115,3158,Every Saturday I regret signing up for overtime -_- #sleepy #overtime
3159,1442071708396,1,1,1,1,on-topic,1,134,3159,Going to the West memorial service today! #prayforwest @ west, tx http://t.co/6QZZ4CEjcO
3160,1442071708396,0,0,1,0,off-topic,0,163,3160,@blondie_vivian didnt wanna cause a riot, you know, being in front of soro and all. Thought it best to cover up. Lol.
3161,1442071708397,0,0,1,0,off-topic,1,111,3161,Norte Dame spring game on TV, gets your mind right #fightingirish
3162,1442071708397,0,0,1,0,off-topic,0,176,3162,This is for y'all who don't understand my tweet. Also, watch the stinking movie. #april25 #misscongeniality http://t.co/JRermtohBS
3163,1442071708398,0,1,1,0,off-topic,1,128,3163,@dawnavrildotcom after West exploding its certainly chilling here where I live. :/
3164,1442071708398,0,0,1,0,off-topic,0,94,3164,Can't wait to go to a rangers game this year !!!
3165,1442071708399,0,0,1,0,off-topic,1,113,3165,@ThelIluminati: It could always be worse, stop complaining so much.
3166,1442071708399,0,0,1,0,off-topic,0,79,3166,I peep oomf, its all good tho lol
3167,1442071708400,0,0,1,0,off-topic,1,171,3167,@TaylorDrenzek REMEMBER THAT TIME WE TRIED TO KILL THAT SCARY BUG WITH HAIRSPRAY AND A SCRATCHING POST AND EVERYTHING ELSE???
3168,1442071708401,0,0,1,0,off-topic,1,75,3168,#ToMyEx you don't deserve me.
3169,1442071708402,0,0,1,0,off-topic,1,171,3169,@LizVaughan09 I wish he would've had the ring when he proposed, but he proposed at his bootcamp grad so he didn't have it lol
3170,1442071708402,0,0,1,0,off-topic,0,111,3170,@Joe_Kissick REMEMBER WHEN I INTRODUCED YOU TO CHIPOTLE #whataday
3171,1442071708403,0,0,1,0,off-topic,1,75,3171,My day 1 niggas come in handy
3172,1442071708403,0,0,1,0,off-topic,0,93,3172,@blackwood55 10 points to ravenclaw for honesty
3173,1442071708404,0,0,1,0,off-topic,1,84,3173,I know you like the back of my hand...
3174,1442071708406,0,1,1,0,off-topic,2,104,3174,Hang in there Bucks. Just cover. That's all us bettors ask
3175,1442071708407,0,0,1,0,off-topic,1,95,3175,@sydneyf15 hey. Give photo cred where it's due...
3176,1442071708408,0,0,1,0,off-topic,1,122,3176,I would be the one to paint my nails then come out here and play soccer. Lol
3177,1442071708409,0,0,1,0,off-topic,1,119,3177,There is a reason I avoid Sportscenter during draft weekend. It angers me
3178,1442071708410,0,0,1,0,off-topic,1,73,3178,All I think about is sleep.
3179,1442071708411,0,1,1,0,off-topic,1,74,3179,Why can't you just let me be
3180,1442071708412,0,0,1,0,off-topic,1,142,3180,@fehurt: S/O to all the parents out there handling their business. Especially the single ones!!!
3181,1442071708413,0,0,1,0,off-topic,1,142,3181,My grandpa always watching tv  like you here all the way from Mexico and you watching tv ... -.-
3182,1442071708413,0,0,1,0,off-topic,0,82,3182,@jessgrov08 I hear they are amaizing
3183,1442071708414,0,0,1,0,off-topic,1,74,3183,Can't trust noone these days
3184,1442071708415,0,0,1,0,off-topic,1,168,3184,My first time at the Czech Stop with some great people!  #yum @klside @jessicaacunaa @USS_Lexington http://t.co/iiGdgFE6kG
3185,1442071708416,0,0,1,0,off-topic,1,120,3185,I'm at Cricket's Grill &amp; Draft House (Waco, TX) http://t.co/XweBYURHnG
3186,1442071708417,0,0,1,0,off-topic,1,111,3186,@twEAT_ItRight bitch you know I'm talking about Chris capping ass
3187,1442071708418,0,0,1,0,off-topic,1,175,3187,Now Hiring: Merrill Lynch Financial Advisor Program - Waco, TX | Bank of America: US - Waco/TX/USA | http://t.co/F8Vq0SYWhR #jobs
3188,1442071708418,0,0,1,0,off-topic,0,158,3188,Owee man I look ratchet -.- But today is my last day testing for that dam accuplacer and I'm so leaving after ..
3189,1442071708419,0,0,1,0,off-topic,1,132,3189,So glad @DisneyChannelPR is playing older shows like even stevens &amp; Lizzie Mcguire
3190,1442071708420,0,1,1,0,off-topic,1,127,3190,@Sharlynegger I just have never been around it. Honestly it sounds disgusting lol
3191,1442071708420,0,0,1,0,off-topic,0,71,3191,DC in two weeks tho ... !
3192,1442071708422,1,0,1,0,on-topic,2,117,3192,@TheEllenShow could you please help the out the people from West, Texas
3193,1442071708423,0,0,1,0,off-topic,1,82,3193,@LaceyJWilliams yes!!!! I love it!!!
3194,1442071708424,0,0,1,0,off-topic,1,74,3194,Smokin weed &amp; on this 2k
3195,1442071708426,0,0,1,0,off-topic,2,90,3195,I Swear These Hoes Ain't Got Nothing On Me !
3196,1442071708427,0,1,1,0,off-topic,1,124,3196,All of them mother fuckers are not coming to my house that's for fucking sure.
3197,1442071708428,0,1,1,0,off-topic,1,163,3197,@Taylortoofresh: Meeting someone you like that lives so far away &lt;&lt;&lt;&lt;&lt;&lt;&lt;&lt;&lt;&lt;&lt;&lt;!!!!
3198,1442071708429,0,0,1,0,off-topic,1,82,3198,bout time Alex gives me some credit.
3199,1442071708430,1,0,1,0,on-topic,1,99,3199,This is crazy and upsetting. Praying for West, Texas.
3200,1442071708431,0,0,1,0,off-topic,1,94,3200,@Wh0a_Kimosabeee can get it. Sorry I'm not sorry
3201,1442071708433,0,0,1,0,off-topic,2,93,3201,I only ride with them niggas who recognize real
3202,1442071708434,0,0,1,0,off-topic,1,74,3202,Adrian is peer pressuring me
3203,1442071708435,0,0,1,0,off-topic,1,97,3203,My phone be dry. That's why I be on twitter all day
3204,1442071708436,0,0,1,0,off-topic,1,104,3204,Might as Well Say  Free ShoutOuts  Doing who i want  nshit
3205,1442071708437,0,0,1,0,off-topic,1,105,3205,@xxcantbesavedxx I liked them too. Mainly to watch Brett ;)
3206,1442071708438,0,0,1,0,off-topic,1,128,3206,@LafriqueBelle so what u got planned for memorial weekend siz?? Cause we comin lol
3207,1442071708438,0,1,1,0,off-topic,0,128,3207,Can't believe I'm gonna be the adult in this situation tonight... #chaperonestatus
3208,1442071708439,0,1,1,0,off-topic,1,186,3208,Headed to bed, folks. Thanks again for being just a fabulous group of human beings. How did I ever get out of the habit of checking Twitter?
3209,1442071708439,0,0,1,0,off-topic,0,70,3209,Chuck Bass is so dreamy.
3210,1442071708440,0,0,1,0,off-topic,1,105,3210,But I'm making dinner. lasagna and garlic bread on the menu
3211,1442071708441,0,0,1,0,off-topic,1,115,3211,@YouInYoFeelings: @BraziliaanGOTTI: Put that ass in Her place Who?Nay
3212,1442071708442,0,0,1,0,off-topic,1,70,3212,This bitch wants To play
3213,1442071708443,0,0,1,0,off-topic,1,179,3213,Still can't believe I was jamming @QuistarGo  ever since middle school though! Him &amp; my big brother Emmanuel was cool back then!!
3214,1442071708443,0,0,1,0,off-topic,0,81,3214,He won't lemme go through his phone
3215,1442071708444,0,0,1,0,off-topic,1,67,3215,Need a new phone asap
3216,1442071708446,0,1,1,0,off-topic,2,98,3216,Going HAM on these grapes and chocolate.chip cookies
3217,1442071708447,0,0,1,0,off-topic,1,120,3217,My iPod is playing amazingness tonight.. Avenged sevenfold&gt;&gt;&gt;&gt;
3218,1442071708448,1,0,1,0,on-topic,1,189,3218,So, so grateful for this rain for healing the air in West. Sucks it ruins Dia but so much more important that fires &amp; chemicals be put out.
3219,1442071708448,0,0,1,0,off-topic,0,120,3219,Window shopping!(: (with James at Tex-star Rustic)  http://t.co/iDASuCA05O
3220,1442071708448,0,1,1,0,off-topic,0,103,3220,Well now you made me have to pull out my damn bitch face.
3221,1442071708449,0,1,1,0,off-topic,1,139,3221,@DaneAGross 10' TAKS week now that's a week ill never forget the things I remembered at least
3222,1442071708449,0,0,1,0,off-topic,0,111,3222,@JaimiesHusband glad I can help! Haha let me know if he likes it!
3223,1442071708450,0,0,1,0,off-topic,1,173,3223,Oh hey @katelynfiedler good luck on your taks test (enthusiastic voice)  and, thanks for stocking up my ice ! (sarcastic voice)
3224,1442071708450,0,1,1,0,off-topic,0,63,3224,I need a nap now.
3225,1442071708451,0,1,1,0,off-topic,1,99,3225,Sooo, @laurenoliver11 forgot how to spell tomorrow...
3226,1442071708453,0,0,1,0,off-topic,2,93,3226,@SamanthaOConna i can play it on guitar too! :D
3227,1442071708454,0,0,1,0,off-topic,1,105,3227,I hate days like today. Either rain or don't. Stop teasing.
3228,1442071708456,0,0,1,0,off-topic,2,99,3228,Give blood. Save a life. Save a family.#SpreadTheWord
3229,1442071708460,0,1,1,0,off-topic,4,95,3229,It's 9 am and I've already had two cups of coffee
3230,1442071708463,0,1,1,0,off-topic,3,114,3230,I just realized that I haven't had coffee in a week. #starbucksbound
3231,1442071708466,0,0,1,0,off-topic,3,92,3231,I Love The Kardashians Family Especially KIM.!
3232,1442071708468,0,1,1,0,off-topic,2,138,3232,@TCoz16 Billy's, bc I was there lol &amp; then I'm going applying again the next couple days
3233,1442071708468,0,0,1,0,off-topic,0,184,3233,@Umi_SUN37 they haven't I talk to them &amp; see them every day.. He'd contact me first but at this point I wouldn't care who he contacted
3234,1442071708468,0,0,1,0,off-topic,0,75,3234,Sleeping with my baby brudder
3235,1442071708469,0,1,1,0,off-topic,1,145,3235,@thenameisdanii: I just wanna get your attention. I really wanna be all up in your head.  #heydaddy
3236,1442071708469,0,1,1,0,off-topic,0,101,3236,@_SimplyRuthless ofcourse, you should already know that
3237,1442071708470,0,0,1,0,off-topic,1,109,3237,God is teaching me patience by making me wait for deer season..
3238,1442071708470,0,0,1,0,off-topic,0,99,3238,Steve Nash look like a bad guy from Boardwalk Empire.
3239,1442071708471,0,0,1,0,off-topic,1,84,3239,Girls love to fuck with your contioens
3240,1442071708472,0,0,1,0,off-topic,1,131,3240,She's the Man puts me in a good mood. #wordGman #bro? #brother?#brethren?  #debutante
3241,1442071708473,0,0,1,0,off-topic,1,65,3241,LOOK AT MY FACE OMG
3242,1442071708474,0,0,1,0,off-topic,1,100,3242,I threw my hands in the air, said show me something...
3243,1442071708474,0,1,1,0,off-topic,0,105,3243,@princesscathh oh I'm dumb.. Lol I thought you just did it!
3244,1442071708476,0,0,1,0,off-topic,2,97,3244,Be careful with these bitches, alot of them diggers
3245,1442071708477,0,0,1,0,off-topic,1,86,3245,His phone So ratchet,  steady hanging up
3246,1442071708478,0,0,1,0,off-topic,1,90,3246,Smh at these kids teaching us how to dougie!
3247,1442071708479,0,1,1,0,off-topic,1,153,3247,@MrBigShot34: @MayEMiers jammin out hard right now. Why are you not taking me to ATX with you  C'mon bro!!!
3248,1442071708480,0,0,1,0,off-topic,1,133,3248,Um....made it to the final four? #whattheheck #diadeldodgeball #accidentaltimetravelers
3249,1442071708480,0,0,1,0,off-topic,0,137,3249,I should be hired by the CIA or FBI or something. Ya girl knows how to use her resources!!!
3250,1442071708481,0,0,1,0,off-topic,1,161,3250,You call it a lumber yard, I call it a Tuesday night. (Not sure what that means... But lmao) http://t.co/wnA4O6Z1iv
3251,1442071708481,0,0,1,0,off-topic,0,81,3251,I mean I ain't missing shit really.
3252,1442071708482,0,0,1,0,off-topic,1,96,3252,@beyondreal254: Daysha stopped tweeting  hell yeah
3253,1442071708483,0,1,1,0,off-topic,1,186,3253,@queenmehndi @krups930 @arjun_2015 Come on Krupa I know my sports I want the Pacers to lose to the Hawks but I lived in GA so I like them to
3254,1442071708484,0,1,1,0,off-topic,1,89,3254,Straight eatn these grapes for like an hour
3255,1442071708492,0,1,1,0,off-topic,8,106,3255,New single dropping monday morning. This one gone be a beast
3256,1442071708493,0,0,1,0,off-topic,1,119,3256,DAMMIT CASSANDRA CLARE QUIT XOMING OUT WITH BOOKS ALL AT ONE TIME IM POOR
3257,1442071708494,0,1,1,0,off-topic,1,104,3257,And , If You Trust Em Gone and Trust Em Shawty Let it be !
3258,1442071708495,0,1,1,0,off-topic,1,171,3258,what Connally ISD is doing for West ISD &amp; their students is just truly amazing! there is so much love in this community..
3259,1442071708496,0,0,1,0,off-topic,1,80,3259,He Hit the spot like Foreal Foreal
3260,1442071708497,0,1,1,0,off-topic,1,136,3260,@pallo_24 you can't be mad cuz I just don't like him he kills the team everyone knows that
3261,1442071708498,0,0,1,0,off-topic,1,118,3261,You're crazy...@jazzzmyn55: Lets go work out. Get outta bed @TomCatOnTop
3262,1442071708498,0,0,1,0,off-topic,0,156,3262,@reedfarmer @da_c_word @nathanochoa This isn't exactly news to anyone. Exhibit A: the Penland roof experience.
3263,1442071708499,0,0,1,0,off-topic,1,101,3263,Glad class got cancelled this turned into a good convo!
3264,1442071708500,0,1,1,0,off-topic,1,82,3264,Sometimes a person just has to vent.
3265,1442071708501,0,0,1,0,off-topic,1,88,3265,Lol that tweet was To much lemme delete it
3266,1442071708502,0,0,1,0,off-topic,1,94,3266,It's raining so I don't care how I dress today!!
3267,1442071708503,0,1,1,0,off-topic,1,119,3267,Just got told I look like a sista in my last pic, on fb. Lmao made my day
3268,1442071708504,0,1,1,0,off-topic,1,106,3268,@LongLiveGweb: These niggas turn killas from jamming rappers
3269,1442071708505,0,0,1,0,off-topic,1,68,3269,I want to go watch #42
3270,1442071708506,0,0,1,0,off-topic,1,156,3270,I think if @ShyyyRonnie didn't have to buy a sport coat today, my ps3 would've never been off. #assassinscreed
3271,1442071708507,0,0,1,0,off-topic,1,157,3271,I wish I knew what I wanted.  i admit im wrong of Bringing you down with me cause I'm unsure of my feelings ...
3272,1442071708507,0,0,1,0,off-topic,0,124,3272,@Amber14Lin: Can I get a shout out back?  @JakeV_BU13 everyone go follow her!!
3273,1442071708508,0,0,1,0,off-topic,1,95,3273,N why I had to see his mother and his family cry?
3274,1442071708508,0,0,1,0,off-topic,0,81,3274,Matter of Fact, I needa tell Patt!!
3275,1442071708509,0,0,1,0,off-topic,1,185,3275,MT wacotrib: Cyrus Reed's favorite scripture was John 15:13 - Greater love hath no man than this, that a man lay down his life for a friend
3276,1442071708510,0,0,1,0,off-topic,1,94,3276,Please Spell Check Your Tweets Before You Tweet!
3277,1442071708511,0,0,1,0,off-topic,1,113,3277,Yo something wrong with momma dee I think she was possessed or some
3278,1442071708511,0,0,1,0,off-topic,0,127,3278,@iAmNotA_Dyke: So are black women RT @TomCatOnTop: I HATE ESPN Shits repetitive .
3279,1442071708512,0,1,1,0,off-topic,1,96,3279,@would_woody just cause I didn't smile? K BYE. Lol
3280,1442071708513,0,0,1,0,off-topic,1,117,3280,Lol @ Paul doing a lot of Howard ass kissin in his post game interview.
3281,1442071708513,0,0,1,0,off-topic,0,102,3281,@_SayMyNameLOUD @OhShe_Pretty whow dare lies on twitter.
3282,1442071708514,0,0,1,0,off-topic,1,139,3282,@OhItsJehtay a fuxking rat tried to do that shit to me.. Neverrrrrr again!!! I was scared lol
3283,1442071708515,0,0,1,0,off-topic,1,95,3283,@Mike_Millz187 always smoking without a nigga -.-
3284,1442071708516,0,0,1,0,off-topic,1,81,3284,@brittneykmoore thank you! Miss ya!
3285,1442071708516,0,0,1,0,off-topic,0,110,3285,Oh wait. It's full of sweaty, college, tennis, student athletes.
3286,1442071708517,0,1,1,0,off-topic,1,162,3286,....a hobby could take you places you never imagined just because some one in the business happened to see your work
3287,1442071708517,0,0,1,0,off-topic,0,77,3287,tell me who did I leave behind?
3288,1442071708518,0,1,1,0,off-topic,1,166,3288,Stephen Curry will make a name for himself in the playoffs. This series with Denver is going to be fantastic. Great game
3289,1442071708519,0,0,1,0,off-topic,1,127,3289,@rebeccarheaa: Btw, wearing expensive clothes doesn't mean you have class PREACH.
3290,1442071708519,0,0,1,0,off-topic,0,90,3290,Life Love Loyalty Ill be there for my niggas
3291,1442071708520,0,0,1,0,off-topic,1,92,3291,@shelbylynn1493 weird. I'm an Oxner. Dumb ass.
3292,1442071708521,0,0,1,0,off-topic,1,75,3292,Oh my gawsh y'all I'm hungry.
3293,1442071708522,0,0,1,0,off-topic,1,136,3293,@everydayakita ugh, rough HS is no good. Is she headed to college or doing something else?
3294,1442071708523,0,0,1,0,off-topic,1,186,3294,4 black people and 4 white people sitting here eating lunch together! Martin Luther King did it y'all!!@Iamwalkerlove @bfreeman13 @CobbsLane
3295,1442071708524,0,0,1,0,off-topic,1,92,3295,@QueenE__: About to be knocked out! I feel you
3296,1442071708525,0,0,1,0,off-topic,1,90,3296,@Der_ck  What the hell is #UTexasPinkParty ?
3297,1442071708526,0,1,1,0,off-topic,1,103,3297,I really just wanna bust out and start singing but... nvm
3298,1442071708527,0,1,1,0,off-topic,1,80,3298,Starting that 4/20 tho w my booboo
3299,1442071708528,0,1,1,0,off-topic,1,168,3299,I keep rebooting my phone, thinking there's something wrong with it cause I haven't gotten a text in 5 hours... #thisisodd
3300,1442071708529,0,0,1,0,off-topic,1,94,3300,@Sheree_Neal dayumm what has this world come too
3301,1442071708530,0,0,1,0,off-topic,1,75,3301,Too much chaos for one night.
3302,1442071708531,0,0,1,0,off-topic,1,109,3302,I've been jammin hurricane by Ms Mr all damn daaaaaaAy. love it
3303,1442071708532,0,0,1,0,off-topic,1,85,3303,Missing someone does not require action
3304,1442071708533,0,1,1,0,off-topic,1,82,3304,Some people are just mind readers...
3305,1442071708534,0,1,1,0,off-topic,1,69,3305,I just broke my glasses
3306,1442071708536,0,0,1,0,off-topic,2,109,3306,I'm at Czech Stop (West, TX) w/ 8 others http://t.co/mrxnXkF9wG
3307,1442071708539,0,0,1,0,off-topic,3,74,3307,I don't like this cold front
3308,1442071708543,0,0,1,0,off-topic,4,73,3308,How the soccer boys doing ?
3309,1442071708547,0,1,1,0,off-topic,4,76,3309,I'm just sooo tired of people.
3310,1442071708548,0,0,1,0,off-topic,1,147,3310,@TheDaniel50: I hope you hate my tweets and it annoys you every time someone retweets them to your TL
3311,1442071708549,0,0,1,0,off-topic,1,100,3311,@rihanna_NOrobin Lol . See the way my feet are set up!
3312,1442071708550,0,1,1,0,off-topic,1,166,3312,@Yung_Tonee Lol hell naw bro you addicted after we got the all white foams you were done now you changed your mind ? Lol
3313,1442071708550,0,1,1,0,off-topic,0,186,3313,@revlucymeg that's very encouraging. I guess I just want to know what to expect, while simultaneously welcoming the Holy Spirit which defies
3314,1442071708550,0,0,1,0,off-topic,0,88,3314,Boy Alternative clothes was Blue and khaki
3315,1442071708552,0,0,1,0,off-topic,2,77,3315,Not to much on these tweets tho
3316,1442071708553,0,0,1,0,off-topic,1,106,3316,@jmacofearth Izzard has helped me through many a rough spot.
3317,1442071708554,0,0,1,0,off-topic,1,77,3317,Said that as nicely as possible
3318,1442071708554,0,0,1,0,off-topic,0,113,3318,Well If I have to choose sides..... it will always be potato salad.
3319,1442071708555,0,0,1,0,off-topic,1,123,3319,Cant make me say your name, you gotta have some GOOD pussy for me to say that
3320,1442071708555,0,0,1,0,off-topic,0,84,3320,Idk why I be saying  B  that shit lame
3321,1442071708556,0,0,1,0,off-topic,1,157,3321,76701: Child Abduction Emergency issued April 12 at 1:21PM CDT  by NWS Dallas-Fort Worth http://t.co/CnwIMPbpvg
3322,1442071708557,0,0,1,0,off-topic,1,132,3322,@amandablack14 and I wasted a free redbox on a bad movie. #disappointed #bored #sleepy
3323,1442071708557,0,0,1,0,off-topic,0,101,3323,@tannahchristine would love to see you! You're amazing.
3324,1442071708558,0,1,1,0,off-topic,1,132,3324,Watching Tangled for the first time... omg. The lantern scene. The boat. I just can't.
3325,1442071708558,0,0,1,0,off-topic,0,79,3325,Get you some money fuckin with me
3326,1442071708559,0,0,1,0,off-topic,1,179,3326,@AT_TR3Y: When dating me you gotta b my #1 fan n I'll be yours &lt;&lt;&lt;&lt; I likes that! Wish more youth recognized their worth!
3327,1442071708559,1,0,1,0,on-topic,0,143,3327,CAUGHT ON CAMERA: Fertilizer Plant Explosion Near Waco, Texas http://t.co/FGnRORZW11 @Huntermoore
3328,1442071708560,0,1,1,0,off-topic,1,102,3328,@J_Lee30 and I'm high on hydrocodone pills tweeting now.
