1131,1442073786335,0,0,1,0,off-topic,1,112,1222,NO ONE CARES YOU WANT A BATHING SUIT WITH SEQUINS SHIT THE FUCK UP
1132,1442073786336,0,0,1,0,off-topic,1,168,1223,Shage have these shirts bc of their brother. I wish McK could have had one when we were little. Too http://t.co/QBaWPmV3sr
1133,1442073786336,0,0,1,0,off-topic,0,126,1224,Don't act like you was raised in a house wit Nuns in it haha word to @eightyocho
1134,1442073786336,1,0,1,0,on-topic,0,101,1403,@CharoKnightJr he's comin for the West memorial service
1135,1442073786513,1,0,1,0,on-topic,177,133,1408,Can't sleep. So shaken and sad for our neighbors. Praying so hard tonight. #prayforwest
1136,1442073786513,0,0,1,0,off-topic,0,89,1414,@ThatIsTRAGIC ion wanna catch on fire cuh !
1137,1442073786513,1,1,1,1,on-topic,0,174,1439,The greatest need right now is blood ~news anchor urging people to help for the explosion victims. If you wanna help, donate #fb
1138,1442073786514,1,0,1,0,on-topic,1,124,1447,@celia_pd thank you.  It's pretty awful.  Appreciate prayers for all affected.
1139,1442073786514,1,0,1,0,on-topic,0,142,1453,My thoughts and prayers are with our brother and sisters of #West. #PrayForWest #FirstResponders
1140,1442073786514,1,0,1,0,on-topic,0,107,1477,RT @JohnCornyn: Blast site West, Texas http://t.co/7d2pymjg1h
1141,1442073786514,1,0,1,0,on-topic,0,121,1485,some serious military choppers out here in the Waco area... #BlessWestTexas
1142,1442073786515,1,1,1,1,on-topic,1,171,1332,@chancehorner truth, even working 24 straight hours covering the West explosion is so much better than just watching it on TV
1143,1442073786515,0,0,1,0,off-topic,0,152,1358,Sorting text panels for the #stormwatch exhibit! @drpeppermuseum @ Dr Pepper Museum http://t.co/6VUCmY1o8b
1144,1442073786515,0,0,1,0,off-topic,0,95,1384,Nigga was determined too hoop on Hurricane Season
1145,1442073786515,1,0,1,0,on-topic,0,184,1390,One more pic of procession outside West memorial. Hundreds of fire trucks, ambulances and first responders. @nbcdfw http://t.co/7eqaUHBm32
1146,1442073786701,1,0,1,0,on-topic,186,180,1391,MT @bynickdean: How does one find such selflessness to put the safety of everyone else before your own? - @JohnCornyn at #westmemorial
1147,1442073786701,1,1,1,1,on-topic,0,166,1399,Awaiting possible briefing at 10 a.m. Follow @startelegram and @fwhanna for updates as the day progresses #westexplosion
1148,1442073786701,0,0,1,0,off-topic,0,79,1319,A bad accident on cs hwy #praying
1149,1442073786702,1,0,1,0,on-topic,1,178,1320,Had a kolach, God bless the people of West, TX, lots of disaster relief staff here (@ Czech Stop w/ 7 others) http://t.co/64o3WO1dCT
1150,1442073786702,1,1,1,1,on-topic,0,144,1260,@TigLionCTH yeah man it's just really West that was affected as of right now. We're close but yeah
1151,1442073786702,1,0,1,0,on-topic,0,147,1281,@ImKindaABigDill CAUGHT ON CAMERA: Fertilizer Plant Explosion Near Waco, Texas http://t.co/FGnRORZW11
1152,1442073786702,0,0,1,0,off-topic,0,124,1402,For All the marbles. Sic em bears! @ Hurd Tennis Courts http://t.co/wLxqoa74k6
1153,1442073786702,0,0,1,0,off-topic,0,79,1404,I Wanna Go To Sleep But I Don't !
1154,1442073786703,0,0,1,0,off-topic,1,179,1405,I don't understand why people hang dream catchers from their car's rearview mirror. You plan on sleeping in there? #DefeatsThePurpose
1155,1442073786703,0,0,1,0,off-topic,0,99,1406,These niggas out here frontin. They aint drillin shit
1156,1442073786888,0,0,1,0,off-topic,185,80,1407,Dude love jay-z !! Ash K went hard
1157,1442073786890,0,0,1,0,off-topic,2,76,1409,Dude.. How selfish can you be?
1158,1442073786890,0,0,1,0,off-topic,0,107,1410,Salman gets peach raspberry cherry cream slushes at Sonic ...
1159,1442073786891,0,0,1,0,off-topic,1,67,1411,I was knocked out boy
1160,1442073786891,0,1,1,0,off-topic,0,97,1412,I'm going to be 6'7 by basketball season  next year
1161,1442073786891,0,1,1,0,off-topic,0,135,1413,@ayy_mcGangstaa what happened?? o: and really I need a cig so I don't explode mentally :I
1162,1442073786892,0,0,1,0,off-topic,1,120,1415,Dia del Saturday. Thank goodness for our amazing @BaylorPiKapps #happiness
1163,1442073786892,0,1,1,0,off-topic,0,130,1416,@NiyMonroee sound good, don't talk all that shit now and cop a deuce when I get back
1164,1442073786892,0,0,1,0,off-topic,0,125,1417,@yellafella_TP: @Eric_F_Baby23: But if anybody ask, we are taking it day by day
1165,1442073786892,1,1,1,1,on-topic,0,111,1418,i seriously can't stop crying right now.. my family is out there!
1166,1442073786892,0,0,1,0,off-topic,0,82,1419,I got subtweeted in real life today.
1167,1442073786893,0,0,1,0,off-topic,1,82,1420,Well this has been a great day. #NOT
1168,1442073786893,1,0,1,0,on-topic,0,166,1421,Being in West, Texas for the funeral of a fallen Dallas Fireman is a really sobering experience. #hero #prayforwest #dfd
1169,1442073786893,1,0,1,0,on-topic,0,97,1422,@eric_schumann it's crazy sad man. It's 15 min away
1170,1442073787083,0,1,1,0,off-topic,190,161,1423,I just screamed in the library because I thought @gracehelbig liked my post. #IMPOSTER #rude http://t.co/CI7m02iWOI
1171,1442073787084,0,0,1,0,off-topic,1,68,1424,Guess ill stay up late
1172,1442073787084,0,0,1,0,off-topic,0,105,1425,@Meliamei22 HATER. she makes wine and tweets me. I love her
1173,1442073787084,0,1,1,0,off-topic,0,120,1426,@KidKid_YBLU @ChrisMacTheRula y'all are acting like brothers right now lol
1174,1442073787085,0,0,1,0,off-topic,1,164,1427,I need a dude that keep trill and he remain the same and he don't get behind my back and try and and flip and change .
1175,1442073787085,0,1,1,0,off-topic,0,74,1428,Justice wanna be like me lol
1176,1442073787085,0,0,1,0,off-topic,0,145,1429,@BroHumour: If Taylor Swift ever dated Chris Brown and broke up. Her next song would be a hit. Lmao
1177,1442073787085,0,0,1,0,off-topic,0,83,1430,Omg DO NOT MESS WITH MY SHOE BOXES!!!
1178,1442073787086,0,0,1,0,off-topic,1,75,1431,Stevie J Had Meme Fucked Up ?
1179,1442073787086,0,1,1,0,off-topic,0,137,1432,It's Sad When Girls Lie About Their Age &amp; Shit Just To Be With A Grown Nigga. #DoBetter
1180,1442073787086,0,0,1,0,off-topic,0,106,1433,I can't tell if I'm awake or not. #roughmorning #wheresmybed
1181,1442073787086,0,0,1,0,off-topic,0,147,1434,@Thee_Leaderr @payton_odom13 @shelby_nb a machine that makes any type of food I want instantly appear
1182,1442073787271,0,1,1,0,off-topic,185,169,1435,Papa Johns 50% off tomorrow cuz the rangers scored more than 7 runs again  haha they going to make them run out of business
1183,1442073787271,0,0,1,0,off-topic,0,121,1436,Fool me once? Shame on me. Fool me twice? I'm done with you. #indirecttweet
1184,1442073787271,0,1,1,0,off-topic,0,175,1508,@ToyaAmanda: @__MacAttack: The world's been fucked up. Pay attention in history class. Ain't nothing changed but the date. AMEN !
1185,1442073787271,1,1,1,1,on-topic,0,120,1513,Live streaming of West First Responders Memorial at http://t.co/Ub8gJimfKk
1186,1442073787272,1,0,1,0,on-topic,1,115,1524,Massive donation sorting center #westexplosion http://t.co/8WZQh0JkoN
1187,1442073787272,0,0,1,0,off-topic,0,87,1535,I bet they arrested that dude on the roof
1188,1442073787272,0,1,1,0,off-topic,0,168,1558,@mayra_maldonado: I always question why I put my mother as my emergency contact. She's not going to answer. #DyingProblems
1189,1442073787273,1,0,1,0,on-topic,1,108,1589,God Bless everyone affected by the events in #West and #Boston
1190,1442073787273,1,0,1,0,on-topic,0,186,1597,Ervin Cinek, 84, was asleep in his nursing home during explosion. Left his false teeth behind, helped others get out. http://t.co/4BmUYCMtR8
1191,1442073787273,0,0,1,0,off-topic,0,81,1498,Now mami show me how that neck feel
1192,1442073787273,0,0,1,0,off-topic,0,152,1499,Not that it isn't a good song. But how is a song about a crack whore so popular? Class a team.. Strange...
1193,1442073787459,0,0,1,0,off-topic,186,103,1500,Thinking Real Hard If I Should Fade Dallas Next Weekend .
1194,1442073787460,0,0,1,0,off-topic,1,77,1501,I fuck with females 19 &amp; up
1195,1442073787460,1,0,1,0,on-topic,0,133,1502,I'm only 15 min away.. &amp; I am so helpless... I haven't felt like this since 9/11...
1196,1442073787460,0,0,1,0,off-topic,0,78,1503,I should be writing my 5 essays.
1197,1442073787461,0,0,1,0,off-topic,1,114,1504,I'm at Waco, TX - @cityofwaco w/ @b_vasquez28 http://t.co/n4BjobvGH8
1198,1442073787461,0,0,1,0,off-topic,0,77,1505,I could f*ck you all the time..
1199,1442073787461,0,0,1,0,off-topic,0,174,1506,@Mike_Millz187 That nigga Alex lying hard !!! -.- he ain't ever call me ... But it's all good ! -.- fuck all y'all niggas . Lmao
1200,1442073787461,0,0,1,0,off-topic,0,90,1507,@Jamzbro Wow, and I totally went to class...
1201,1442073787462,0,0,1,0,off-topic,1,116,1509,im congested but my nose is running. what kind of devil magic is that.
1202,1442073787462,0,0,1,0,off-topic,0,71,1510,#HonestDM ? R e t w e e t
1203,1442073787462,0,0,1,0,off-topic,0,91,1511,If yo avi look ugly, you not getting a follow
1204,1442073787462,0,0,1,0,off-topic,0,116,1512,So many people left after Obama's speech..... That's so disrespectful.
1205,1442073787463,0,0,1,0,off-topic,1,169,1514,Relaxing and watching a sunset after finishing a LONG, emotional day. Nice to unwind and decompress. http://t.co/5aBSXmBesS
1206,1442073787646,0,0,1,0,off-topic,183,142,1515,S/O to my bros @_John_Doee and @OGClarkKent for holdin it down! KO football is the best football
1207,1442073787646,0,0,1,0,off-topic,0,95,1516,Fuck him, he looks like the scream - Ester hahaha
1208,1442073787647,0,0,1,0,off-topic,1,84,1517,@kby80 @jordynnlea where is her car...
1209,1442073787647,0,0,1,0,off-topic,0,121,1518,@ThelIluminati: Don't make a permanent decision for your temporary emotion.
1210,1442073787647,1,0,1,0,on-topic,0,122,1519,Half of proceeds at Scruffs go to West #everyreasontodrinkmore #baylor #waco
1211,1442073787648,0,0,1,0,off-topic,1,88,1520,Damn I forgot I wanted to change My number
1212,1442073787648,0,0,1,0,off-topic,0,97,1521,@JoeneishaC it's almost there, food comes first lol
1213,1442073787648,0,0,1,0,off-topic,0,106,1522,Yesterday I told Chris He Look like he work at walmart nshit
1214,1442073787649,0,0,1,0,off-topic,1,129,1523,He cheats, he dives, he'll bite your hands and thighs. Luis Suarez, Suareeeeezzzzz!
1215,1442073787649,0,0,1,0,off-topic,0,180,1525,@akenjari I'm writing a paper on if India was more authoritarian would it have more economic growth than China and at a faster rate...
1216,1442073787649,0,0,1,0,off-topic,0,73,1526,I'm about to fire myself up
1217,1442073787649,0,0,1,0,off-topic,0,96,1527,Them blunts and that Cup had a bitch feeling right
1218,1442073787650,0,1,1,0,off-topic,1,117,1528,I See Wat Niggas Be Talking Bouyt I Be Thinking They Just Be Talking...
1219,1442073787844,0,0,1,0,off-topic,194,126,1529,Somebody Tell Me What Happiness Is Cuz I'm Sick Of Living So Low... In My Life..
1220,1442073787844,0,0,1,0,off-topic,0,85,1530,@Dinero_Quaa: All freaks go both ways!!
1221,1442073787845,0,0,1,0,off-topic,1,77,1531,I need to get my life together.
1222,1442073787846,0,0,1,0,off-topic,1,100,1532,@Lickk_Downn_LOW: The FACT That He Aint Shit But A Hoe
1223,1442073787847,0,1,1,0,off-topic,1,173,1533,I might sound very hypocritical in my tweets cause I smoke and now I'm tryna go back to church ... But people could change ....
1224,1442073787847,0,0,1,0,off-topic,0,173,1534,@iiGBreezy: PICTURE Of Chris Brown's New DOPE Painting! #Teambreezy #BreezyART @chrisbrown RT http://t.co/gldSbbKgxK that ant a
1225,1442073787847,0,0,1,0,off-topic,0,118,1536,@TirayeKream_: damn this nigga really mad the price done went up 3 raccs
1226,1442073787848,0,0,1,0,off-topic,1,108,1537,Nothing brings two people together faster than a common enemy.
1227,1442073787849,0,0,1,0,off-topic,1,70,1538,Damn I Hate Being Sober!
1228,1442073787850,0,0,1,0,off-topic,1,75,1539,I'm in my zone!!I'm feelin it
1229,1442073787850,0,0,1,0,off-topic,0,142,1540,I remember those dark days of high school when we couldn't wear Nike shorts. How did we survive?
1230,1442073787851,0,0,1,0,off-topic,1,85,1541,@Jordynberryy did you figure it out? :(
1231,1442073787851,0,1,1,0,off-topic,0,167,1542,Being reminded of the smell of an old love that you just can't get over when someone who wears the same cologne walks by.
1232,1442073788029,1,1,1,1,on-topic,178,142,1543,Just bringing water to the people of West with @livriordann! #prayforWest http://t.co/1ARqD74W1V
1233,1442073788029,0,0,1,0,off-topic,0,69,1544,if I get these shoes...
1234,1442073788030,1,0,1,0,on-topic,1,185,1608,@colettemc21 Thank you sweet girl! All safe in Waco. Such a tragedy but so touching to see the entire central TX community uniting #missyou
1235,1442073788030,1,0,1,0,on-topic,0,179,1650,Pointwest Bank VP tells me they have opened a fund for #West victims. Accepting all kinds of donations. (200 W. Oak or waco branches)
1236,1442073788030,1,0,1,0,on-topic,0,95,1685,Explosion outside of Waco https://t.co/W31HbAA3jG
1237,1442073788030,1,0,1,0,on-topic,0,143,1713,Need dry socks for the rescue workers in west Texas...call me if you want to donate  254 730 3447
1238,1442073788031,0,0,1,0,off-topic,1,111,1601,Fighting is ugly , but I KNOW don't no bitch put fear in my heart
1239,1442073788031,0,0,1,0,off-topic,0,176,1602,@jennaakay: yeah no definitely do not feel safe with this huge lizard living right outside my bedroom Except its a 3 inch gecko...
1240,1442073788031,0,0,1,0,off-topic,0,79,1603,Damn he knocked that nigga out yo
1241,1442073788031,0,1,1,0,off-topic,0,87,1604,Chasity be having the niggas going crazy!
1242,1442073788032,0,1,1,0,off-topic,1,85,1605,Miss the old days, just not my old ways
1243,1442073788032,1,0,1,0,on-topic,0,141,1606,Dropping by a Red Cross donation. A somber mood at West's Czech Stop. Our thoughts are w/ West.
1244,1442073788217,0,0,1,0,off-topic,185,100,1607,God continues to amaze me with His beautiful creation!
1245,1442073788218,0,1,1,0,off-topic,1,145,1609,Hopefully the Browns have a good draft! Good way to start by drafting @keke_mingo #Browns #Football
1246,1442073788218,0,1,1,0,off-topic,0,106,1610,I'll ride with you through bullshit, just don't bullshit me.
1247,1442073788218,0,0,1,0,off-topic,0,94,1611,@holly1120 that's not a trail, it's a side walk!
1248,1442073788218,0,1,1,0,off-topic,0,169,1612,Let's take a trip down memory lane... The halls of my old High School, ain't much changed just a few http://t.co/2LujOK5iBa
1249,1442073788219,0,1,1,0,off-topic,1,150,1613,@StephGhost: Grown men dating kids has started to become normal in this society and that shit is sick !!
1250,1442073788219,0,0,1,0,off-topic,0,121,1614,When ppl act like they dont care about shit&lt;&lt;&lt;&lt;&lt;&lt;&lt;&lt;
1251,1442073788219,0,0,1,0,off-topic,0,73,1615,Puff Hating On a real nigga
1252,1442073788219,0,1,1,0,off-topic,0,162,1616,@yourRidicious: I'm The Current Bitch , Fuck A Next Bitch . I'm Worried About ME &amp; How I Can Benefit My Nigga :)
1253,1442073788220,0,1,1,0,off-topic,1,169,1617,There's a lot of good stuff going on in West besides just kolaches #GodBlessWest @ West Fair Grounds http://t.co/ByZRahu6F6
1254,1442073788220,0,1,1,0,off-topic,0,78,1618,I just wanna tell you good game.
1255,1442073788405,0,0,1,0,off-topic,185,109,1619,This last week has made me appreciate everything so much more b
1256,1442073788405,0,0,1,0,off-topic,0,142,1620,@dani_crayy @jperk2012 I hate you hahahahah  and jd should feel honored that I took creeper pics
1257,1442073788405,0,1,1,0,off-topic,0,84,1621,I aint going anywhere without my bread
1258,1442073788405,0,0,1,0,off-topic,0,186,1622,@JeremyC_Bradley oh!That'd be an amazing mission trip location.Remind me to scope that out for a college mission trip sometime #worktripyall
1259,1442073788406,0,1,1,0,off-topic,1,178,1623,my tweets earlier were really mean, i apologize everybody. had to step out of character for a quick moment.. i just REALLY hate her.
1260,1442073788406,1,0,1,0,on-topic,0,169,1624,Thursday Night Bonus Karaoke Fundraiser for West at Scruffs. #westtx #prayforwest @ Scruffy Murphy's http://t.co/N0pcWPvoZQ
1261,1442073788406,0,0,1,0,off-topic,0,78,1625,@CareUhLion yea! A gift from ME.
1262,1442073788406,0,0,1,0,off-topic,0,134,1626,@sammich___: @JakeV_BU13 We must be from the same tribe... the chinglangdinglingdangs no
1263,1442073788407,0,0,1,0,off-topic,1,81,1627,@dani_crayy heheh this is why I  u.
1264,1442073788408,0,0,1,0,off-topic,1,119,1628,I wish @MelanieIglesias or @ArianaGrande would at least RT me..  #Thirsty
1265,1442073788408,0,0,1,0,off-topic,0,71,1629,Why did God create women?
1266,1442073788409,0,0,1,0,off-topic,1,74,1630,because fuck you that's why.
1267,1442073788599,0,1,1,0,off-topic,190,112,1631,@SayyLilBri  lmao not even the case..same thing happens every week
1268,1442073788599,0,1,1,0,off-topic,0,161,1632,@Be_Determined_: Fear is fake. It's just a feeling. But danger... Danger is very real. Don't be afraid of anything.
1269,1442073788599,0,0,1,0,off-topic,0,111,1633,When we're out of balance, it creates an open door for the devil.
1270,1442073788599,0,0,1,0,off-topic,0,183,1634,Watching a documentary on BULLYING. I will not be that teacher who looks the other way! It's the opposite of why I chose to be a teacher!
1271,1442073788600,0,0,1,0,off-topic,1,162,1635,TV and tulips...okay - not really tulips, but flowers(weeds) and an old tube TV...#mikefights http://t.co/qod1cyJopj
1272,1442073788600,0,0,1,0,off-topic,0,93,1636,Where Is my momma anyways I'm at home by myself
1273,1442073788600,0,1,1,0,off-topic,0,89,1637,@goin_HAM5 oh ard lol I was just makin sure
1274,1442073788600,0,1,1,0,off-topic,0,82,1638,i guess i should start packing now..
1275,1442073788601,0,0,1,0,off-topic,1,128,1639,Having to redo my impressions because the other ones didn't work. I'm about to gag
1276,1442073788601,0,1,1,0,off-topic,0,101,1640,Oooo yes!! Vitek's BBQ is gonna hit the spot for sure!!
1277,1442073788602,0,1,1,0,off-topic,1,189,1641,It's always: 1)fake milso 2)being in his uniform 3)wifey vs gf 4)opsec 5)more fake MilSOs, we get it!every now &amp; then ok, but every day now
1278,1442073788602,0,0,1,0,off-topic,0,121,1642,@BraylonBartlett Yo dawg we got a party tonight at my house if u wanna come
1279,1442073788786,0,0,1,0,off-topic,184,115,1643,Cause those other men are practice. And this ain't no time for actin.
1280,1442073788787,0,0,1,0,off-topic,1,127,1644,Referred Listing in Waco, TX - earnings estimate: $3,000 - http://t.co/xpkgUD4vz4
1281,1442073788787,0,0,1,0,off-topic,0,91,1645,Would you believe me if I said I was in love?
1282,1442073788788,0,0,1,0,off-topic,1,68,1646,Aight I need to go eat
1283,1442073788788,0,0,1,0,off-topic,0,96,1647,I want all of you, forever, you and me, every day.
1284,1442073788789,0,0,1,0,off-topic,1,83,1717,@TlalocRivas I am safe. Send prayers.
1285,1442073788790,0,1,1,0,off-topic,1,86,1722,@TareanS okay ill just donate money then
1286,1442073788790,0,0,1,0,off-topic,0,172,1735,Gets me twerking.... @ThatIsTRAGIC: Works, every time @TomCatOnTop: Drink tequila if you wanna fight with your bf... #GirlCode
1287,1442073788790,1,0,1,0,on-topic,0,174,1738,About 0.8 km away from the plant explosion site. Roadblocks everywhere.#texas #explosion (at West Texas)  http://t.co/d5dDCBFDer
1288,1442073788790,1,0,1,0,on-topic,0,156,1829,Please pray for everyone to have strength to make it through this disaster.  The wind and rain are moving in!!
1289,1442073788791,1,0,1,0,on-topic,1,144,1831,Speaker at prayer vigil for #Westexplosion victims: Death and destruction will not have last word.
1290,1442073788791,0,0,1,0,off-topic,0,133,1835,@ThelIluminati: Stay strong when times get tough. Don't get discouraged, Keep fighting.
1291,1442073788974,0,1,1,0,off-topic,183,73,1714,I be thinking we gone die!!
1292,1442073788975,0,0,1,0,off-topic,1,175,1715,Jurassic Park....I'm 8 years old again!!! (at @StarplexCinemas Galaxy 16 for Jurassic Park 3D w/ 2 others) http://t.co/ByJFpauqLp
1293,1442073788975,0,0,1,0,off-topic,0,98,1716,@tykam94 i didn't.. i parked in a muddy ditch.. LOL.
1294,1442073788975,0,1,1,0,off-topic,0,91,1718,Someone draft Lacy and @TerranceWill2 already
1295,1442073788976,0,0,1,0,off-topic,1,98,1719,@John__Reyes: Keep them squares up out your circle..
1296,1442073788976,0,1,1,0,off-topic,0,119,1720,Desperate Ass Ppl That Beg For Attention &lt;&lt;&lt;&lt;&lt;&lt;&lt;&lt;
1297,1442073788976,0,1,1,0,off-topic,0,123,1721,This early &amp; people tryna talk shit to me already! Lmao. Bye, Dissmissed.
1298,1442073788977,0,0,1,0,off-topic,1,127,1723,All this homework I had done but never turned in is what's causing me to fail.-.-
1299,1442073788977,0,0,1,0,off-topic,0,157,1724,76639: Special Weather Statement issued April 10 at 2:02PM CDT  by NWS Dallas-Fort Worth http://t.co/rjIcUPWVBz
1300,1442073788977,0,0,1,0,off-topic,0,69,1725,Test anxiety to the max
1301,1442073788978,0,0,1,0,off-topic,1,156,1726,@WBCSays @Dallas_Observer You guys really really don't want to come to Texas. You will get quite the greeting!
1302,1442073788978,0,0,1,0,off-topic,0,92,1727,Told me cut ties basically but that also means
1303,1442073789161,0,0,1,0,off-topic,183,116,1728,You can't leave Ginobili open from the 3 in transition!! #makingitrain
1304,1442073789161,0,1,1,0,off-topic,0,154,1729,My brother got a bit a bothered when I told him .. Cause I stopped going to the  youth group at our church .
1305,1442073789161,0,1,1,0,off-topic,0,119,1730,Going to need the weather to warm up, I am freezing with these shorts on.
1306,1442073789162,0,0,1,0,off-topic,1,168,1731,I can't workout for another week until cleared from doctor...but looking forward to having that back in my morning routine
1307,1442073789162,0,0,1,0,off-topic,0,82,1732,@TheeLastOreo thank you!! I love it!
1308,1442073789162,0,0,1,0,off-topic,0,76,1733,You get served around this hoe
1309,1442073789163,0,0,1,0,off-topic,1,78,1734,Mama Dee Really Don't Fw Erica !
1310,1442073789163,0,0,1,0,off-topic,0,174,1736,The world of health care needs Daniels. God has given you the tools and the opportunity. Be a Daniel. -ethics prof  #inspiration
1311,1442073789163,0,0,1,0,off-topic,0,137,1737,Finna take a hoe bath before these lights try to cut off again, won't catch me slipping lol
1312,1442073789164,1,0,1,0,on-topic,1,116,1739,Catch up on local news from #Waco, #Texas here! http://t.co/gertcbZ4dp
1313,1442073789164,1,0,1,0,on-topic,0,104,1740,At the benefit concert! #DiadelWest http://t.co/JwjG10tGKz
1314,1442073789164,0,0,1,0,off-topic,0,86,1741,I'm in the mood for a breakfast burritos
1315,1442073789165,0,1,1,0,off-topic,1,87,1742,Everybody going to sleep on me &amp; shit
1316,1442073789349,0,0,1,0,off-topic,184,125,1743,@DannyPanda212 hahaha nice, so y'all ended up getting to go to each place today
1317,1442073789351,0,0,1,0,off-topic,2,111,1744,Almost through with this Chem then a Spanish review #Perseverance
1318,1442073789353,0,0,1,0,off-topic,2,89,1745,@_ExoticYella: let me taste between yo legs
1319,1442073789355,0,1,1,0,off-topic,2,167,1746,Me and Ryan goin to work on this system in the Boat! Y'all gonna hear us jam for days while we're on the Water!!!!!!!!!!!
1320,1442073789355,0,1,1,0,off-topic,0,174,1747,Don't give me those condescending looks dude in the car next to me. Yes I'm jamming to bieber #favoritegirl live. #EXITTOTHELEFT
1321,1442073789356,0,1,1,0,off-topic,1,87,1748,I love all my shoes , we gone get married
1322,1442073789358,0,1,1,0,off-topic,2,105,1749,My boy @CT4197 puttin' in hours at Crave #crucial #thesquad
1323,1442073789359,0,0,1,0,off-topic,1,92,1750,My bitch got every nigga in here that want her
1324,1442073789361,0,0,1,0,off-topic,2,70,1751,Dont play me like a fool
1325,1442073789363,0,0,1,0,off-topic,2,87,1752,I like bad bitches , I hate boring hoes !
1326,1442073789365,0,0,1,0,off-topic,2,102,1753,But Play It Smart ,Don't Jeopardize What You got At Home
1327,1442073789366,0,0,1,0,off-topic,1,91,1754,Done With Spring Semester&gt;&gt;&gt;&gt;&gt;
1328,1442073789366,0,1,1,0,off-topic,0,104,1755,@Forever_like21: Twiiter so boring now then get off of it.
1329,1442073789536,0,0,1,0,off-topic,170,111,1756,Looks like i cant go to the game tomorrow  No one can work for me
1330,1442073789536,0,0,1,0,off-topic,0,102,1757,@Milsostruggles where's his aschool? Is it far from you?
1331,1442073789537,0,0,1,0,off-topic,1,90,1758,This dumbass nigga done lost the lighter -_-
1332,1442073789537,0,0,1,0,off-topic,0,184,1759,Oh Snap! #baylor Cory Jefferson to stay?!?!? Hell yea!!!! If Austin stay the WHOLE DAMN @NCAA @marchmadness  better look out next season!!
1333,1442073789537,0,0,1,0,off-topic,0,71,1760,I'm so over this semester
1334,1442073789538,1,1,1,1,on-topic,1,181,1854,Just talked to Michael Maler, 49, whose house was destroyed. He says he knew several of the dead: (West) is never going to be the same.
1335,1442073789538,0,0,1,0,off-topic,0,151,1873,@emmajo94 congrats on Baylor cheer!! That will be a blast and I'm excited for you to be here next year!(:
1336,1442073789538,0,0,1,0,off-topic,0,90,1884,Which branch of the military do babies join?
1337,1442073789539,1,0,1,0,on-topic,1,128,1895,guess I'll find out if he died in the morning. goodnight errybody. #PrayersForWest
1338,1442073789539,1,1,1,1,on-topic,0,188,1909,Jerry Chapman and Kevin Sanders are also firefighters who were killed in #West: They died in the line of duty &amp; others lived because of it
1339,1442073789539,1,0,1,0,on-topic,0,184,1942,Your prayers for the area are appreciated, but please put them into action. Drive here to give blood and donate goods responsibly. #westtx
1340,1442073789731,0,1,1,0,off-topic,192,185,1843,Please tell me again how u know what Im going through.. How u get LDR bc he lives 30 min away.. How about I punch u? http://t.co/fWBQvtKFut
1341,1442073789731,0,1,1,0,off-topic,0,134,1844,@EvieJoeXO_ lol thank you! But compared to the majority of y'all I'm chopped liver! Lmao
