1351,1442074034598,0,1,1,0,off-topic,0,152,1351,@nurya phew! Also, just as an FYI, Jodi &amp; Christian Baron are two of my favesies. Don't you know them?
1352,1442074034598,0,1,1,0,off-topic,0,91,1352,I don't wanna lose you, I just got to have ya
1353,1442074034599,0,0,1,0,off-topic,1,169,1353,My Nikes are soaked and my socks...thank goodness I left my crocs in C1!  It's defiantly a new look. http://t.co/WyO4aYQYEh
1354,1442074034599,0,0,1,0,off-topic,0,90,1354,I'm Finna fall asleep. I been up all day smh
1355,1442074034599,0,1,1,0,off-topic,0,81,1355,That strawberry I just ate &gt;&gt;
1356,1442074034599,0,0,1,0,off-topic,0,103,1356,I'm at @SamsOnTheSquare (Waco, TX) http://t.co/iRN47sn6lr
1357,1442074034600,0,0,1,0,off-topic,1,89,1357,@SebstianIngross why did you in follow me:(
1358,1442074034600,0,0,1,0,off-topic,0,152,1358,Sorting text panels for the #stormwatch exhibit! @drpeppermuseum @ Dr Pepper Museum http://t.co/6VUCmY1o8b
1359,1442074034600,0,0,1,0,off-topic,0,164,1359,Charlie and Raider had such a fun sleepover last night! @kelsieshea91 #sweetdogs @ Kappa Korner http://t.co/8MAWItsX4C
1360,1442074034600,0,1,1,0,off-topic,0,104,1360,@JakeLaneTX not fun. I'm dying, I just want my sleep! Haha
1361,1442074034600,0,1,1,0,off-topic,0,90,1361,I hate being alone, im just not used to it..
1362,1442074034601,0,0,1,0,off-topic,1,98,1362,@Letmeslideindat lol quit changing people tweets hoe
1363,1442074034601,0,0,1,0,off-topic,0,103,1363,WHY am I in my jeans still? *takes them off aggressively*
1364,1442074034601,0,1,1,0,off-topic,0,81,1364,Im never gonna knock a nigga hustle
1365,1442074034602,0,0,1,0,off-topic,1,90,1365,@Describe_name: You know Starr . Naaa I dont
1366,1442074034602,0,0,1,0,off-topic,0,83,1366,@ahhleesonn ok, I'll do that then pal
1367,1442074034602,0,0,1,0,off-topic,0,165,1367,Beautiful but cold here on day one of the #TAQHA State Championship Show! #weather #instaweather http://t.co/VSphwSpaXY
1368,1442074034602,0,0,1,0,off-topic,0,79,1368,A real bitch over here lost nshit
1369,1442074034968,0,0,1,0,off-topic,366,95,1369,@alex_sowell12 straight took the A tho! COPY CAT!
1370,1442074034969,0,0,1,0,off-topic,1,178,1370,Cannot wait to be done with these stinking cabinet doors, they have been a HUGE pain! @michael_sch #housereno http://t.co/vlfNQ5Rudz
1371,1442074034969,0,0,1,0,off-topic,0,92,1371,That will never be enough but You are! #beglad
1372,1442074034969,0,0,1,0,off-topic,0,94,1372,What do you call a lesbian with ten girlfriends?
1373,1442074034969,0,1,1,0,off-topic,0,94,1373,@raveandrollhard Yes. I live a block from Baylor
1374,1442074034970,0,1,1,0,off-topic,1,134,1374,What a crazy day at work today... It's about that time to start looking for a new job...
1375,1442074034970,0,0,1,0,off-topic,0,114,1375,@rigby_eleanor :( Tigger moment? (referring to move this summer?) :D
1376,1442074034970,0,0,1,0,off-topic,0,154,1376,@princesscathh true true  lol I forget not everyone has a mom that used to be a hairdresser for 30 years lol
1377,1442074034971,0,0,1,0,off-topic,1,172,1377,#texas #jobs Park Tech I / West District Parks (Part-time, Temp, Seasonal) - Travis County -  West, TX  http://t.co/3LodjMfqfZ
1378,1442074034971,0,0,1,0,off-topic,0,119,1378,Wife and kids at park to relax, I'm at #goldsgym to relax #workout #golds
1379,1442074034971,0,0,1,0,off-topic,0,80,1379,Yo I'm bout to turn twitter up!!!!
1380,1442074034971,0,0,1,0,off-topic,0,101,1380,@brittgilmartin: @marckiewalter what a cutie! Thank you
1381,1442074034972,0,0,1,0,off-topic,1,88,1381,This wedding today better have open bar...
1382,1442074034972,0,1,1,0,off-topic,0,120,1382,@XXKINGCANOXX I'm saying how you coming over here if the freeway I closed?
1383,1442074034972,0,0,1,0,off-topic,0,155,1383,@trey2flythoo @bryan_highflyin delt feathers tho &gt; #ShreddedGirlsOverEverything with big booties of course
1384,1442074034972,0,0,1,0,off-topic,0,95,1384,Nigga was determined too hoop on Hurricane Season
1385,1442074034973,0,0,1,0,off-topic,1,96,1385,Damn Darius uglass Needed my charger and im on 15%
1386,1442074034973,0,0,1,0,off-topic,0,143,1386,@JennaJohnson015 you don't have to say that twice... Over here about to have a nervous breakdown.
1387,1442074034973,1,1,1,1,on-topic,0,165,1387,Anhydrous tank is safe now, says state fire Marshall. No tanks are problems. No fires burning on the scene. No dangers.
1388,1442074034973,0,0,1,0,off-topic,0,181,1388,@LizVaughan09 I talked to a girl and she said she uses it toCount her miles in the pool so I was like.. That's good enough for me!! Lol
1389,1442074034974,0,1,1,0,off-topic,1,95,1389,@GorgeoussTHUGG I'm bout to follow you now, dm it
1390,1442074034974,1,0,1,0,on-topic,0,184,1390,One more pic of procession outside West memorial. Hundreds of fire trucks, ambulances and first responders. @nbcdfw http://t.co/7eqaUHBm32
1391,1442074034974,1,0,1,0,on-topic,0,180,1391,MT @bynickdean: How does one find such selflessness to put the safety of everyone else before your own? - @JohnCornyn at #westmemorial
1392,1442074034984,1,1,1,1,on-topic,10,172,1392,@J_Lee30 plus we took all the WestTx donations yesterday. And I loaded and unloaded our truck. Just a lot of strain on my back
1393,1442074034984,0,0,1,0,off-topic,0,110,1393,walking like a penguin today because of my leg workout yesterday
1394,1442074034984,0,1,1,0,off-topic,0,174,1394,I absolutely hate it when it's the last minute of class and the professor is talking and people stand up and get ready to leave.
1395,1442074034985,0,0,1,0,off-topic,1,98,1395,How she dont suck dick but she begging me to eat her
1396,1442074034985,0,0,1,0,off-topic,0,79,1396,Uggh this English class is BORING
1397,1442074034985,0,0,1,0,off-topic,0,142,1397,watching behind the scenes on how they made Spider-Man 2.. NONE of the stunts are real.. #SadDay
1398,1442074034985,0,0,1,0,off-topic,0,71,1398,Guess who hops on my back
1399,1442074034986,1,1,1,1,on-topic,1,166,1399,Awaiting possible briefing at 10 a.m. Follow @startelegram and @fwhanna for updates as the day progresses #westexplosion
1400,1442074034986,1,0,1,0,on-topic,0,143,1400,GRO boys playing a benefit for #WestTexas in Waco tonight @ Ferrell Center http://t.co/KojaRZqUlC
1401,1442074034986,0,0,1,0,off-topic,0,188,1401,@JeremyC_Bradley it's the closest Volvo dealership &amp; I need some repairs :( so basically my trip is the exact opposite of your trip bc I'm
1402,1442074034986,0,0,1,0,off-topic,0,124,1402,For All the marbles. Sic em bears! @ Hurd Tennis Courts http://t.co/wLxqoa74k6
1403,1442074034986,1,0,1,0,on-topic,0,101,1403,@CharoKnightJr he's comin for the West memorial service
1404,1442074034986,0,0,1,0,off-topic,0,79,1404,I Wanna Go To Sleep But I Don't !
1405,1442074034986,0,0,1,0,off-topic,0,179,1405,I don't understand why people hang dream catchers from their car's rearview mirror. You plan on sleeping in there? #DefeatsThePurpose
1406,1442074034987,0,0,1,0,off-topic,1,99,1406,These niggas out here frontin. They aint drillin shit
1407,1442074034987,0,0,1,0,off-topic,0,80,1407,Dude love jay-z !! Ash K went hard
1408,1442074034987,1,0,1,0,on-topic,0,133,1408,Can't sleep. So shaken and sad for our neighbors. Praying so hard tonight. #prayforwest
1409,1442074034987,0,0,1,0,off-topic,0,76,1409,Dude.. How selfish can you be?
1410,1442074034988,0,0,1,0,off-topic,1,107,1410,Salman gets peach raspberry cherry cream slushes at Sonic ...
1411,1442074034988,0,0,1,0,off-topic,0,67,1411,I was knocked out boy
1412,1442074034988,0,1,1,0,off-topic,0,97,1412,I'm going to be 6'7 by basketball season  next year
1413,1442074034988,0,1,1,0,off-topic,0,135,1413,@ayy_mcGangstaa what happened?? o: and really I need a cig so I don't explode mentally :I
1414,1442074034990,0,0,1,0,off-topic,2,89,1414,@ThatIsTRAGIC ion wanna catch on fire cuh !
1415,1442074034990,0,0,1,0,off-topic,0,120,1415,Dia del Saturday. Thank goodness for our amazing @BaylorPiKapps #happiness
1416,1442074034990,0,1,1,0,off-topic,0,130,1416,@NiyMonroee sound good, don't talk all that shit now and cop a deuce when I get back
1417,1442074034991,0,0,1,0,off-topic,1,125,1417,@yellafella_TP: @Eric_F_Baby23: But if anybody ask, we are taking it day by day
1418,1442074034991,1,1,1,1,on-topic,0,111,1418,i seriously can't stop crying right now.. my family is out there!
1419,1442074034991,0,0,1,0,off-topic,0,82,1419,I got subtweeted in real life today.
1420,1442074034991,0,0,1,0,off-topic,0,82,1420,Well this has been a great day. #NOT
1421,1442074034992,1,0,1,0,on-topic,1,166,1421,Being in West, Texas for the funeral of a fallen Dallas Fireman is a really sobering experience. #hero #prayforwest #dfd
1422,1442074034992,1,0,1,0,on-topic,0,97,1422,@eric_schumann it's crazy sad man. It's 15 min away
1423,1442074034992,0,1,1,0,off-topic,0,161,1423,I just screamed in the library because I thought @gracehelbig liked my post. #IMPOSTER #rude http://t.co/CI7m02iWOI
1424,1442074034992,0,0,1,0,off-topic,0,68,1424,Guess ill stay up late
1425,1442074034993,0,0,1,0,off-topic,1,105,1425,@Meliamei22 HATER. she makes wine and tweets me. I love her
1426,1442074034993,0,1,1,0,off-topic,0,120,1426,@KidKid_YBLU @ChrisMacTheRula y'all are acting like brothers right now lol
1427,1442074034993,0,0,1,0,off-topic,0,164,1427,I need a dude that keep trill and he remain the same and he don't get behind my back and try and and flip and change .
1428,1442074034993,0,1,1,0,off-topic,0,74,1428,Justice wanna be like me lol
1429,1442074034994,0,0,1,0,off-topic,1,145,1429,@BroHumour: If Taylor Swift ever dated Chris Brown and broke up. Her next song would be a hit. Lmao
1430,1442074034994,0,0,1,0,off-topic,0,83,1430,Omg DO NOT MESS WITH MY SHOE BOXES!!!
1431,1442074034994,0,0,1,0,off-topic,0,75,1431,Stevie J Had Meme Fucked Up ?
1432,1442074034995,0,1,1,0,off-topic,1,137,1432,It's Sad When Girls Lie About Their Age &amp; Shit Just To Be With A Grown Nigga. #DoBetter
1433,1442074034995,0,0,1,0,off-topic,0,106,1433,I can't tell if I'm awake or not. #roughmorning #wheresmybed
1434,1442074034995,0,0,1,0,off-topic,0,147,1434,@Thee_Leaderr @payton_odom13 @shelby_nb a machine that makes any type of food I want instantly appear
1435,1442074034995,0,1,1,0,off-topic,0,169,1435,Papa Johns 50% off tomorrow cuz the rangers scored more than 7 runs again  haha they going to make them run out of business
1436,1442074034995,0,0,1,0,off-topic,0,121,1436,Fool me once? Shame on me. Fool me twice? I'm done with you. #indirecttweet
1437,1442074034996,0,0,1,0,off-topic,1,86,1437,@TweetEm_B We Do!!  This Weekend wassup?
1438,1442074034996,0,0,1,0,off-topic,0,66,1438,I know I had it too!
1439,1442074034996,1,1,1,1,on-topic,0,174,1439,The greatest need right now is blood ~news anchor urging people to help for the explosion victims. If you wanna help, donate #fb
1440,1442074034996,0,0,1,0,off-topic,0,172,1440,#texas #jobs Park Tech I / West District Parks (Part-time, Temp, Seasonal) - Travis County -  West, TX  http://t.co/rUJhiX5Dtr
1441,1442074034997,0,0,1,0,off-topic,1,67,1441,We Up In This Bitch !
1442,1442074034997,0,0,1,0,off-topic,0,161,1442,@JaimiesHusband hahaha I'm glad you know the limit, I don't think we could handle a Colin conceitedness filled life
1443,1442074034997,0,0,1,0,off-topic,0,99,1443,He into them ugly ass females with them bad attitudes
1444,1442074034998,0,0,1,0,off-topic,1,86,1444,We still here playing fifa and pool haha
1445,1442074034998,0,0,1,0,off-topic,0,127,1445,Show me a sign LordIt's all that I've been waiting forI can't go on without you..
1446,1442074034998,0,0,1,0,off-topic,0,116,1446,Drinking some Ultras with these jams. Faaaaaak. http://t.co/mLXmkBYICD
1447,1442074034999,1,0,1,0,on-topic,1,124,1447,@celia_pd thank you.  It's pretty awful.  Appreciate prayers for all affected.
1448,1442074034999,0,1,1,0,off-topic,0,175,1448,That awkward moment when I'm hanging out with @kelbelle13 at shortys but I'm really just alone at the bar while she works........
1449,1442074034999,0,0,1,0,off-topic,0,73,1449,Middle finger to the police
1450,1442074034999,0,0,1,0,off-topic,0,127,1450,Ok FINE. I'm sorry about the munch munch #struggle #youreamazing @NicholasLopez11
1451,1442074034999,0,1,1,0,off-topic,0,99,1451,@SimplyErica__ showing her this tomorrow just because
1452,1442074035000,0,0,1,0,off-topic,1,135,1452,At Baylor, even the graffiti is scripture @ Moody Memorial Library http://t.co/tKYXcVfpoJ
1453,1442074035554,1,0,1,0,on-topic,554,142,1453,My thoughts and prayers are with our brother and sisters of #West. #PrayForWest #FirstResponders
1454,1442074035555,0,1,1,0,off-topic,1,147,1454,To my last RT, if a body has been In the river for months, why would it just now be noticed floating?
1455,1442074035555,0,0,1,0,off-topic,0,112,1455,Ill rub tf out of Dwight Howard big as shoulders with his fine ass
1456,1442074035555,0,0,1,0,off-topic,0,155,1456,@airmanlover13 this is my foot tat. I love tattoos too girl! I'm fixin to get another  http://t.co/rpb2zI6zdO
1457,1442074035555,0,0,1,0,off-topic,0,95,1457,Always Count Your Blessings , Not Your Problems !
1458,1442074035555,0,0,1,0,off-topic,0,75,1458,Y'all ain't real. None of you
1459,1442074035556,0,0,1,0,off-topic,1,134,1459,When you use the handicap button so you don't have to physically open a door. #lazyprobs
1460,1442074035556,0,1,1,0,off-topic,0,129,1460,@jennyc104 I'll just go study accounting at a&amp;m! It'll be a party all the time!
1461,1442074035556,0,0,1,0,off-topic,0,104,1461,@Mark_Cummings_ I got 2nd and got a Rudy's gift card. Haha
1462,1442074035556,0,0,1,0,off-topic,0,112,1462,@bugirl14 shouldn't you be working on something...? Procrastinator
1463,1442074035557,0,1,1,0,off-topic,1,144,1463,where are the real people at just in general. thats why im the way I am bc nobody is real anymore.
1464,1442074035557,0,1,1,0,off-topic,0,104,1464,I kinda wanna do that lucid dream!! Just not be by myself!
1465,1442074035742,0,0,1,0,off-topic,185,129,1465,@jazzzmyn55 you cooked.... And graced me with the opportunity to eat from the pot !
1466,1442074035742,0,0,1,0,off-topic,0,162,1466,@GorgeoussTHUGG: @DreWill_Kcg What Middle School DID You Go To ? I went to baines in fortbend &amp; johnston in HISD
1467,1442074035743,0,0,1,0,off-topic,1,104,1467,Tryna Lose At Least 10 Pounds So I Can Be Summer Time Fine
1468,1442074035743,0,0,1,0,off-topic,0,125,1468,@OsamaBinAndre @BEATKINGKONG either way u say it ...that IS some #homo ass shit
1469,1442074035743,0,0,1,0,off-topic,0,94,1469,Lol I aint know my lil nigga jared from compton.
1470,1442074035743,0,0,1,0,off-topic,0,201,1470,@TheeLastOreo no we didn't, we looked &amp; looked &amp; I found this one &amp; fell in love, he actually showed me it  i love unique stuff &amp; it's perf
1471,1442074035744,0,0,1,0,off-topic,1,135,1471,@bmiana you like them &amp;&amp;&amp;&amp;  I like them! So that all that matters anyways
1472,1442074035744,0,0,1,0,off-topic,0,80,1472,Detention&lt;&lt;&lt; but last day
1473,1442074035744,1,0,1,0,on-topic,0,184,1473,Sen. Cornyn n Cruz taking questions from media Tells @keyetv at least another day before folks allowed home #WestTX http://t.co/Y65NpMLUem
1474,1442074035744,0,0,1,0,off-topic,0,85,1474,And I'm laughing at them puuhh nihhhhas
1475,1442074035745,0,0,1,0,off-topic,1,78,1475,Lol i stays doing oomf like that
1476,1442074035745,0,0,1,0,off-topic,0,156,1476,idgaf who you are or where I am I will ALWAYS jam every word to every song on Britney's blackout album. #endof
1477,1442074035745,1,0,1,0,on-topic,0,107,1477,RT @JohnCornyn: Blast site West, Texas http://t.co/7d2pymjg1h
1478,1442074035745,0,0,1,0,off-topic,0,80,1478,Im putting all the young niggas on
1479,1442074035746,0,1,1,0,off-topic,1,150,1479,just two rags waving in the wind @therealjwills #JonnyFlag #vivaItalia @ flagpole http://t.co/uCXoGb0zQc
1480,1442074035746,0,1,1,0,off-topic,0,182,1480,Who woulda thought little ole Watertown, Mass., where I spent a good chunk of my early childhood, would be the hub for media right now?!
1481,1442074035746,0,0,1,0,off-topic,0,135,1481,There's a bird stuck in our living room ceiling vent. HE. NEEDS. TO. LEAVE. #byebyebirdie
1482,1442074035746,0,1,1,0,off-topic,0,108,1482,Tonight it's just me, myself and basketball #playoffs #memphis
1483,1442074035747,0,0,1,0,off-topic,1,103,1483,I can't help you if you ain't willing to help yourself !!
1484,1442074035747,0,0,1,0,off-topic,0,111,1484,Oh snaps Patrick Peterson and TM7 on the same team again ... Nice
1485,1442074035748,1,0,1,0,on-topic,1,121,1485,some serious military choppers out here in the Waco area... #BlessWestTexas
1486,1442074035748,0,0,1,0,off-topic,0,106,1486,@CocoaWessst: Damn it's cold outside. Ill be there next time
1487,1442074035749,0,0,1,0,off-topic,1,123,1487,@x_CussImJazz: @BraziliaanGOTTI: Real Bitches Listen When im Speaking No.why?
1488,1442074035749,0,0,1,0,off-topic,0,83,1488,Time has changed so fuck it get a new
1489,1442074035930,0,0,1,0,off-topic,181,74,1489,Still at this hospital tho .
1490,1442074035930,0,0,1,0,off-topic,0,124,1490,@foreverkaelaa: My ass looks enormous with grey leggings .  #liestoldontwitter
1491,1442074035931,0,1,1,0,off-topic,1,163,1491,@krissybrown73 @tx_navyfiance just like you didn't think everyone would take it this seriously, so might she, ya know
1492,1442074035931,0,0,1,0,off-topic,0,78,1492,I refuse to be sick! #notdoingit
1493,1442074035931,0,0,1,0,off-topic,0,74,1493,Beer farts are the stinkiest
1494,1442074035932,0,0,1,0,off-topic,1,91,1494,Ex txted me &lt;&lt;&lt; its been how long .?
1495,1442074035932,0,0,1,0,off-topic,0,73,1495,I can't roast for shit !!!!
1496,1442074035932,0,0,1,0,off-topic,0,84,1496,Take ugly selfies so I know it's real.
1497,1442074035933,0,0,1,0,off-topic,1,84,1497,Sorry but true you can catch me on T.V
1498,1442074035933,0,0,1,0,off-topic,0,81,1498,Now mami show me how that neck feel
1499,1442074035934,0,0,1,0,off-topic,1,152,1499,Not that it isn't a good song. But how is a song about a crack whore so popular? Class a team.. Strange...
1500,1442074035934,0,0,1,0,off-topic,0,103,1500,Thinking Real Hard If I Should Fade Dallas Next Weekend .
1501,1442074035934,0,0,1,0,off-topic,0,77,1501,I fuck with females 19 &amp; up
1502,1442074035934,1,0,1,0,on-topic,0,133,1502,I'm only 15 min away.. &amp; I am so helpless... I haven't felt like this since 9/11...
1503,1442074035935,0,0,1,0,off-topic,1,78,1503,I should be writing my 5 essays.
1504,1442074035935,0,0,1,0,off-topic,0,114,1504,I'm at Waco, TX - @cityofwaco w/ @b_vasquez28 http://t.co/n4BjobvGH8
1505,1442074035935,0,0,1,0,off-topic,0,77,1505,I could f*ck you all the time..
1506,1442074035936,0,0,1,0,off-topic,1,174,1506,@Mike_Millz187 That nigga Alex lying hard !!! -.- he ain't ever call me ... But it's all good ! -.- fuck all y'all niggas . Lmao
1507,1442074035936,0,0,1,0,off-topic,0,90,1507,@Jamzbro Wow, and I totally went to class...
1508,1442074035936,0,1,1,0,off-topic,0,175,1508,@ToyaAmanda: @__MacAttack: The world's been fucked up. Pay attention in history class. Ain't nothing changed but the date. AMEN !
1509,1442074035936,0,0,1,0,off-topic,0,116,1509,im congested but my nose is running. what kind of devil magic is that.
1510,1442074035936,0,0,1,0,off-topic,0,71,1510,#HonestDM ? R e t w e e t
1511,1442074035937,0,0,1,0,off-topic,1,91,1511,If yo avi look ugly, you not getting a follow
1512,1442074035937,0,0,1,0,off-topic,0,116,1512,So many people left after Obama's speech..... That's so disrespectful.
1513,1442074035937,1,1,1,1,on-topic,0,120,1513,Live streaming of West First Responders Memorial at http://t.co/Ub8gJimfKk
1514,1442074035938,0,0,1,0,off-topic,1,169,1514,Relaxing and watching a sunset after finishing a LONG, emotional day. Nice to unwind and decompress. http://t.co/5aBSXmBesS
1515,1442074035938,0,0,1,0,off-topic,0,142,1515,S/O to my bros @_John_Doee and @OGClarkKent for holdin it down! KO football is the best football
1516,1442074035938,0,0,1,0,off-topic,0,95,1516,Fuck him, he looks like the scream - Ester hahaha
1517,1442074035938,0,0,1,0,off-topic,0,84,1517,@kby80 @jordynnlea where is her car...
1518,1442074035939,0,0,1,0,off-topic,1,121,1518,@ThelIluminati: Don't make a permanent decision for your temporary emotion.
1519,1442074035939,1,0,1,0,on-topic,0,122,1519,Half of proceeds at Scruffs go to West #everyreasontodrinkmore #baylor #waco
1520,1442074035939,0,0,1,0,off-topic,0,88,1520,Damn I forgot I wanted to change My number
1521,1442074035940,0,0,1,0,off-topic,1,97,1521,@JoeneishaC it's almost there, food comes first lol
1522,1442074035940,0,0,1,0,off-topic,0,106,1522,Yesterday I told Chris He Look like he work at walmart nshit
1523,1442074035940,0,0,1,0,off-topic,0,129,1523,He cheats, he dives, he'll bite your hands and thighs. Luis Suarez, Suareeeeezzzzz!
1524,1442074035940,1,0,1,0,on-topic,0,115,1524,Massive donation sorting center #westexplosion http://t.co/8WZQh0JkoN
1525,1442074035941,0,0,1,0,off-topic,1,180,1525,@akenjari I'm writing a paper on if India was more authoritarian would it have more economic growth than China and at a faster rate...
1526,1442074035941,0,0,1,0,off-topic,0,73,1526,I'm about to fire myself up
1527,1442074035941,0,0,1,0,off-topic,0,96,1527,Them blunts and that Cup had a bitch feeling right
1528,1442074035942,0,1,1,0,off-topic,1,117,1528,I See Wat Niggas Be Talking Bouyt I Be Thinking They Just Be Talking...
1529,1442074036116,0,0,1,0,off-topic,174,126,1529,Somebody Tell Me What Happiness Is Cuz I'm Sick Of Living So Low... In My Life..
1530,1442074036116,0,0,1,0,off-topic,0,85,1530,@Dinero_Quaa: All freaks go both ways!!
1531,1442074036116,0,0,1,0,off-topic,0,77,1531,I need to get my life together.
1532,1442074036117,0,0,1,0,off-topic,1,100,1532,@Lickk_Downn_LOW: The FACT That He Aint Shit But A Hoe
1533,1442074036117,0,1,1,0,off-topic,0,173,1533,I might sound very hypocritical in my tweets cause I smoke and now I'm tryna go back to church ... But people could change ....
1534,1442074036117,0,0,1,0,off-topic,0,173,1534,@iiGBreezy: PICTURE Of Chris Brown's New DOPE Painting! #Teambreezy #BreezyART @chrisbrown RT http://t.co/gldSbbKgxK that ant a
1535,1442074036117,0,0,1,0,off-topic,0,87,1535,I bet they arrested that dude on the roof
1536,1442074036118,0,0,1,0,off-topic,1,118,1536,@TirayeKream_: damn this nigga really mad the price done went up 3 raccs
1537,1442074036118,0,0,1,0,off-topic,0,108,1537,Nothing brings two people together faster than a common enemy.
1538,1442074036118,0,0,1,0,off-topic,0,70,1538,Damn I Hate Being Sober!
1539,1442074036119,0,0,1,0,off-topic,1,75,1539,I'm in my zone!!I'm feelin it
1540,1442074036119,0,0,1,0,off-topic,0,142,1540,I remember those dark days of high school when we couldn't wear Nike shorts. How did we survive?
1541,1442074036120,0,0,1,0,off-topic,1,85,1541,@Jordynberryy did you figure it out? :(
1542,1442074036303,0,1,1,0,off-topic,183,167,1542,Being reminded of the smell of an old love that you just can't get over when someone who wears the same cologne walks by.
1543,1442074036304,1,1,1,1,on-topic,1,142,1543,Just bringing water to the people of West with @livriordann! #prayforWest http://t.co/1ARqD74W1V
1544,1442074036304,0,0,1,0,off-topic,0,69,1544,if I get these shoes...
1545,1442074036304,0,0,1,0,off-topic,0,78,1545,At Home Staying Out Of The Air .
1546,1442074036305,0,0,1,0,off-topic,1,181,1546,@krissybrown73 @tx_navyfiance girl people don't joke about that kinda stuff, it's hurtful. How would you feel if that girl actually did
1547,1442074036305,0,1,1,0,off-topic,0,153,1547,I think it's funny when people are scared to sit by someone on the bus they don't know so they just stand..
1548,1442074036305,0,0,1,0,off-topic,0,98,1548,@roach_april @bwadwilliams dont act like you havent!
1549,1442074036305,0,1,1,0,off-topic,0,91,1549,All the good ones gone , Drake wasn't lying !
1550,1442074036306,0,0,1,0,off-topic,1,129,1550,@hellodesh apparently it was intentional? Idk my parents didnt hear about it either
1551,1442074036306,0,0,1,0,off-topic,0,70,1551,Stop playing hard to get
1552,1442074036306,0,0,1,0,off-topic,0,183,1552,@Truminati  New Music## Promotional track from theMixTape ((THE BLACKOUT)) ... http://t.co/ZYfFFKte81weI&amp;feature=youtube_gdata_player
1553,1442074036306,0,0,1,0,off-topic,0,78,1553,Love &amp; Hip Hop , Tuning In '
1554,1442074036307,0,1,1,0,off-topic,1,99,1554,I hate sleeping alone cause then i start hearing shit
1555,1442074036307,0,0,1,0,off-topic,0,77,1555,how many special people change?
1556,1442074036308,0,0,1,0,off-topic,1,106,1556,I am very much done with Calculus. I can't even concentrate.
1557,1442074036308,0,1,1,0,off-topic,0,96,1557,...let me take a nap, right now.... On this table.
1558,1442074036308,0,1,1,0,off-topic,0,168,1558,@mayra_maldonado: I always question why I put my mother as my emergency contact. She's not going to answer. #DyingProblems
1559,1442074036308,0,0,1,0,off-topic,0,124,1559,Once you stop grinding don't expect to keep shinning unless you Gates or trump
1560,1442074036309,0,0,1,0,off-topic,1,81,1560,@gorgeouschassy you too don't front
1561,1442074036309,0,0,1,0,off-topic,0,128,1561,@akenjari do you think the corruption in India has slowed economic growth as well?
1562,1442074036309,0,0,1,0,off-topic,0,75,1562,I pay the cost to be the boss
1563,1442074036310,0,0,1,0,off-topic,1,72,1563,Damn this is making me sad
1564,1442074036310,1,0,1,0,on-topic,0,168,1564,@jblakely5 for the people closer to that side of Waco. I was playing in a dodgeball tournament so I didn't see or hear it.
1565,1442074036310,0,0,1,0,off-topic,0,150,1565,there's like 6 girls pregnant at work.  i dont know what they're drinking but I don't want none of that.
1566,1442074036310,0,0,1,0,off-topic,0,77,1566,Ion even know Why I Be tripping
1567,1442074036311,0,0,1,0,off-topic,1,94,1567,This is how it was to be a dinosaur @el_pive_sol
1568,1442074036311,0,0,1,0,off-topic,0,73,1568,These hoes thirsty in my dm
1569,1442074036312,0,0,1,0,off-topic,1,78,1569,I haven't fed my fish in so long
