2448,1442074050513,0,1,1,0,off-topic,1,138,2802,@Joe_Kissick we will always remember that day which was the day you started living my friend
2449,1442074050514,0,0,1,0,off-topic,1,80,2803,Let's stop this make believe stuff
2450,1442074050515,0,0,1,0,off-topic,1,144,2804,@hiran_patel @RJScherwin y'all thought it was funny when I said Bayern Munich could beat Barcelona
2451,1442074050515,0,0,1,0,off-topic,0,81,2805,I love pussy but it aint all i know
2452,1442074050516,0,0,1,0,off-topic,1,85,2806,@Ashley_N12 I know! I want real food...
2453,1442074050517,0,0,1,0,off-topic,1,68,2807,Dont wanna die young!!
2454,1442074050518,0,0,1,0,off-topic,1,167,2946,@andrewphelps But people here callit West, Texas or West comma Texas. They like the comma because West is in North Texas.
2455,1442074050518,0,0,1,0,off-topic,0,101,2947,I love quiet nights on campus. Perfect time for a walk.
2456,1442074050519,0,0,1,0,off-topic,1,130,2948,lol when people try to write offensive stuff in desks but can't even spell it right.
2457,1442074050519,0,0,1,0,off-topic,0,137,2949,A nice end to a hectic day. #texassunsets @ Speight Parking Facility http://t.co/lPxnb6xcCp
2458,1442074050519,0,0,1,0,off-topic,0,132,2950,Does a truck carrying another truck have to be bigger then the truck its carrying....?
2459,1442074050520,1,0,1,0,on-topic,1,167,2951,Photo cred: @kentthebardMy president grieves.For you, O God, have tested us...we went through fire http://t.co/zpOgnImflb
2460,1442074050520,0,0,1,0,off-topic,0,93,2952,@GabrielleDiona ok I might have to check it out
2461,1442074050521,0,0,1,0,off-topic,1,135,2953,@FigNewton29: @marckiewalter me I love your tweets girl  YAY!! Haha some of you like meh!
2462,1442074050521,0,0,1,0,off-topic,0,124,2954,Living by myself means I never wear pants and I never close the bathroom door.
2463,1442074050522,0,0,1,0,off-topic,1,81,2955,I don't even really like you, quit.
2464,1442074050523,1,1,1,1,on-topic,1,110,2956,@Garcia91Macey about 15 minutes south of the explosions location
2465,1442074050523,0,1,1,0,off-topic,0,122,2957,Lol people say that I'm mean &lt;&lt;&lt; no honey your just to sensitive ..
2466,1442074050524,0,0,1,0,off-topic,1,171,2958,#Baylor engineering students celebrate at their Cardboard Boat Regatta. #sicem #cardboardandducttape @ http://t.co/Cda4Tteohh
2467,1442074050524,0,0,1,0,off-topic,0,172,2959,Y'all really think Milwaukee got a chance against Miami??? Even y'all Miami haters should know the answer to that!!#TeamLebron
2468,1442074050524,0,0,1,0,off-topic,0,86,2960,Running is like walking, only faster lol
2469,1442074050525,1,1,1,1,on-topic,1,152,2961,they don't know yet if it's related at all to everything else going on the news.. #prayersforthoseworkers.
2470,1442074050525,0,0,1,0,off-topic,0,88,2962,I'm not happy with the life I'm living ...
2471,1442074050526,0,1,1,0,off-topic,1,170,2963,@kjon @zatch90 @huizingadanny @bwaltens thanks! It's about 15 minutes north of us but they're bringing all the injured here.
2472,1442074050526,0,0,1,0,off-topic,0,90,2964,I want My nigga to tell these hoes fall back
2473,1442074050527,0,0,1,0,off-topic,1,80,2965,@SmoothOcean no prob man good luck
2474,1442074050528,0,0,1,0,off-topic,1,101,2966,@ZekeFreeman happy birthday! Lets turnup in the hall???
2475,1442074050528,0,0,1,0,off-topic,0,96,2967,Nothing I hate more then funny acting ass people !
2476,1442074050529,1,1,1,1,on-topic,1,184,2968,BREAKING: Search will continue at demolished West apt complex w/ heavy machinery. Mayor rushing to help sort thru rubble. 15 dead  @NBCDFW
2477,1442074050530,0,0,1,0,off-topic,1,75,2969,She cut 4 a nigga tho.. #True
2478,1442074050530,0,0,1,0,off-topic,0,129,2970,@iJussWannaHoop nah. But I heard it go hard so I do needa go pick that up!! You do?
2479,1442074050531,0,0,1,0,off-topic,1,146,2971,Now if only I got weekends off.. Lmao this is my Friday ps guys I realize today is actually Saturday
2480,1442074050531,0,0,1,0,off-topic,0,130,2972,@PeteRock Cus if it wasnt for the BRONX this rap shit probly would never be goin on!
2481,1442074050531,0,1,1,0,off-topic,0,88,2973,they got him! #justicewillbeserved #boston
2482,1442074050532,1,0,1,0,on-topic,1,183,2974,We met this man in a #WestTX neighborhood...he's on a mission to help his hometown tonight. Meet him at 6 on @krgv http://t.co/sHl5svjCSb
2483,1442074050533,0,0,1,0,off-topic,1,112,2975,I'm hungry and can't go back home and  forgot my credit card there
2484,1442074050533,0,0,1,0,off-topic,0,74,2976,@Sukkieee I would if I could
2485,1442074050534,0,0,1,0,off-topic,1,93,2977,Why does EVERY boy I know, try to get with her?
2486,1442074050535,0,0,1,0,off-topic,1,98,2978,I'm at Health Camp (Waco, TX) http://t.co/i9sSJ7DI04
2487,1442074050535,0,0,1,0,off-topic,0,84,2979,Everyone on my TL take a twitter drink
2488,1442074050536,0,0,1,0,off-topic,1,98,2980,@rihanna_NOrobin I work the morning shift not w/ him
2489,1442074050537,0,0,1,0,off-topic,1,122,2981,Lol don't see how oomf came from Philly to Waco ohhhhhh my cry baby self lol
2490,1442074050537,0,0,1,0,off-topic,0,82,2982,Talk about a bad sun burn that I got
2491,1442074050538,0,0,1,0,off-topic,1,78,2983,Lol he does that shit on purpose
2492,1442074050539,0,1,1,0,off-topic,1,101,2984,@XO_ImDaee: I miss him it hasn't even been 24 hours....
2493,1442074050539,0,0,1,0,off-topic,0,80,2985,What the fuck is wrong with me. /:
2494,1442074050540,0,1,1,0,off-topic,1,115,2986,You already know (@ C&amp;R Sports Bar) [pic]: http://t.co/98QAhak4DU
2495,1442074050541,0,0,1,0,off-topic,1,74,2987,Fuck you Caesar hahaha bitch
2496,1442074050542,0,0,1,0,off-topic,1,153,2988,Where they um make em like that at???? @U_NeedSomeManny: @PostBadBitchez: White Girl http://t.co/gafXxa5vtn
2497,1442074050542,0,0,1,0,off-topic,0,106,2989,When a guy holds your face while kissing you.. Major #TurnOn
2498,1442074050543,0,0,1,0,off-topic,1,107,2990,I never liked ludicris.. Like why must you rap the way you do
2499,1442074050543,0,0,1,0,off-topic,0,127,2991,Took a test yesterday then takes it again today thinking mr.ferrell wouldn't know
2500,1442074050544,0,0,1,0,off-topic,1,93,2992,I am still so obsessed with the dress in my avi
2501,1442074050544,0,0,1,0,off-topic,0,103,2993,@MrLottery my dad got one... I blocked his ass real quick
2502,1442074050545,0,0,1,0,off-topic,1,164,2994,Hahaha, God doesn't hate them because they are fags....They're fags because he hates them.#ShitWestboroBaptistCultSays
2503,1442074050545,0,1,1,0,off-topic,0,72,2995,Just do you let me do me!!
2504,1442074050546,1,0,1,0,on-topic,1,138,2996,@Trouty20: #PrayForTexas Even though I don't like the Angels... thank you. Have a good year.
2505,1442074050547,0,0,1,0,off-topic,1,77,2997,@JuddieeDGAF its only right foo
2506,1442074050547,0,1,1,0,off-topic,0,141,2998,@80thedoulos_Rnm watch out!!! You wild fam!!!! I'm going to be in town the 25th so we will see!
2507,1442074050548,0,0,1,0,off-topic,1,144,2999,Best part part of my day is laying down with Karter to watch our nightly movie #daddy&amp;daughter
2508,1442074050548,1,0,1,0,on-topic,0,182,3000,Jenene Picha, owner of Czech-American Restaurant, whose in-laws' homes were destroyed: It was like a war zone last night. #westexploison
2509,1442074050548,0,0,1,0,off-topic,0,164,3001,@krissybrown73 @tx_navyfiance hurt herself? Even if it's a joke to you it might not be to the person your talking too.
2510,1442074050549,0,0,1,0,off-topic,1,103,3002,Lol I'm not stupid &lt;&lt; #foolish yes but never stupid
2511,1442074050549,0,0,1,0,off-topic,0,127,3003,I FINALLY HAVE MY BABY GIRL BACK. So happy, such a trooper http://t.co/TqSnmcKJIa
2512,1442074050551,1,0,1,0,on-topic,2,182,3004,George Brinegar, running West community resource center, thinks full weight of tragedy is sinking in: This will really be the tough day.
2513,1442074050551,1,1,1,1,on-topic,0,139,3005,All these laws nd ambulances passing by me going to west I hope they their alright down there
2514,1442074050552,1,1,1,1,on-topic,1,174,3006,@MFOBK: Barack Obama, this is no time so start playing your trombone. We have shit to do. #TG http://t.co/n38zmdvFl9 OH MY WORD.
2515,1442074050552,0,1,1,0,off-topic,0,153,3007,The Honey Badgers interview is great. A man that had everything taken away and has now gotten a 2nd chance.
2516,1442074050552,0,0,1,0,off-topic,0,84,3008,@GrabMyGat it's okay I can forgive you
2517,1442074050554,0,1,1,0,off-topic,2,131,3009,@mrkrowdpleaser that's ur perception. I'm starting to understand what he's getting at
2518,1442074050555,0,0,1,0,off-topic,1,143,3010,Maybe it was bc I had a drink or 2 but I was pissed it didn't taste anywhere near the looks of it
2519,1442074050556,0,0,1,0,off-topic,1,82,3011,Larry joe Taylor music fest tomorrow
2520,1442074050557,0,1,1,0,off-topic,1,109,3012,I always put comfy clothes on as soon I was I walk in the door.
2521,1442074050558,0,0,1,0,off-topic,1,109,3013,I'm at Waco, TX - @cityofwaco (Waco, TX) http://t.co/Le7gak8z9C
2522,1442074050560,0,0,1,0,off-topic,2,139,3014,My normal I-35 stop seems so much more important today. (@ Czech Stop) http://t.co/8ZQ0Vkc1kv
2523,1442074050561,0,1,1,0,off-topic,1,90,3015,@TuyenBear23 I CAN'T STOP LAUGHING RIGHT NOW
2524,1442074050563,0,0,1,0,off-topic,2,154,3016,Ummmmm S/O to @cantstopBen for not letting me know his essays got him into UT #hoe #soproud #bigleaguestatus
2525,1442074050564,0,0,1,0,off-topic,1,90,3017,What My Love Got me for my birthday &gt;&gt;
2526,1442074050566,0,0,1,0,off-topic,2,93,3018,Imma stop cursing&lt;&lt; its not good for me .
2527,1442074050569,0,1,1,0,off-topic,3,87,3019,I was gonna workout tonight but...... eh.
2528,1442074050571,0,0,1,0,off-topic,2,92,3020,Trinidad James - Females Welcomed &gt;&gt;&gt;
2529,1442074050573,0,0,1,0,off-topic,2,86,3021,I have like 9482683 different tan lines.
2530,1442074050575,0,0,1,0,off-topic,2,127,3022,Relationship with freedom... The fuck? I didn't know them shits could go together
2531,1442074050576,0,1,1,0,off-topic,1,156,3023,Great time tonight! Seriously needs to happen more often! @AReedKyle #waco=awesome#dancing#learninghowtotweet!
2532,1442074050578,0,0,1,0,off-topic,2,166,3024,@TravisPastrana the base jump age is 18, if you could come to Texas and change it, my bro's &amp; I would appreciate it!
2533,1442074050580,0,0,1,0,off-topic,2,77,3025,That nigga mal the worst yo lol
2534,1442074050582,0,0,1,0,off-topic,2,81,3026,@Iggy_95 you got yours new or used?
2535,1442074050583,0,0,1,0,off-topic,1,115,3027,@bmiana pretty!!! I like them! They aren't the same as everyone else!
2536,1442074050584,0,1,1,0,off-topic,1,82,3028,That's when it starts going downhill
2537,1442074050584,1,0,1,0,on-topic,0,184,3029,All-around a phenomenal memorial service. Both pain and triumph for people of West. And what an honor to see Pres. Obama pay his respects.
2538,1442074050585,0,0,1,0,off-topic,1,91,3030,Soo much bread I mighg have to count it twice
2539,1442074050585,1,0,1,0,on-topic,0,123,3031,@beckyfogel Be safe lady. Journalists are working hard with this tragedy too.
2540,1442074050586,0,0,1,0,off-topic,1,81,3032,Who wanna drink a lil beer tonight?
2541,1442074050587,0,0,1,0,off-topic,1,69,3033,Too young to be in love
2542,1442074050587,0,0,1,0,off-topic,0,74,3034,#TeamCanelo all the way ! ;D
2543,1442074050588,0,0,1,0,off-topic,1,92,3035,When a guy curses you out &gt;&gt;&gt;&gt;&gt;
2544,1442074050589,0,0,1,0,off-topic,1,144,3036,Walking to media ctr to get more news. Sending in school buses from hillsboro. What for? Confused.
2545,1442074050591,0,0,1,0,off-topic,2,117,3037,@apple3swagg: Phone been dead all day !!nigga that text was way earlier
2546,1442074050592,0,0,1,0,off-topic,1,72,3038,Played a good game tonight
2547,1442074050593,0,0,1,0,off-topic,1,97,3039,@JoeneishaC told him about leaving My lil nigga our
2548,1442074050593,1,1,1,1,on-topic,0,165,3040,There are two types of people in HEB right now: those buying supplies for West and those buying supplies for Diadeloso.
2549,1442074050594,0,1,1,0,off-topic,1,118,3041,Phone finna die &amp; I really don't feel like going to get that charger
2550,1442074050594,0,0,1,0,off-topic,0,94,3042,@Randyy400 nope Dave hurt his hamstring in the 2
2551,1442074050595,0,0,1,0,off-topic,1,84,3043,Ugh this bitch is giving me a headache
2552,1442074050595,0,1,1,0,off-topic,0,86,3044,@JamesStanford6 I just want to go tubing
2553,1442074050596,0,0,1,0,off-topic,1,117,3045,@BlessedTeen: Smile. Not cause you're happy, but because you're strong.
2554,1442074050596,0,0,1,0,off-topic,0,88,3046,Done taking care of the kids! #imexhausted
2555,1442074050597,0,0,1,0,off-topic,1,125,3047,Heck Yea Me To RT @carter_lashonda: @OhTweetsMyAss I knew I wasn't tripping lol
2556,1442074050597,0,0,1,0,off-topic,0,134,3048,I like to call this work Procrastination @ Jesse H. Jones Library http://t.co/MZJWATbqv7
2557,1442074050598,0,0,1,0,off-topic,1,104,3049,I have no idea how to make a toga for the party tonight...
2558,1442074050598,0,0,1,0,off-topic,0,106,3050,You know I went long cause i turned my sound off my keyboard
2559,1442074050599,0,0,1,0,off-topic,1,132,3051,At least she's comfortable right? #blowinuptwitter #withmypussy http://t.co/R6Xncj3PvS
2560,1442074050599,0,0,1,0,off-topic,0,105,3052,I miss my man.. This fucking sucks I haven't heard from him
2561,1442074050600,0,0,1,0,off-topic,1,133,3053,@Amber14Lin: @JakeV_BU13 Ain't you playing for BU next year? Football. Not baseball lol
2562,1442074050600,0,0,1,0,off-topic,0,99,3054,I'm unfollowing anyone that talks about smoking weed.
2563,1442074050601,0,1,1,0,off-topic,1,103,3055,These news anchors are gonna' be knocked out come the am.
2564,1442074050602,1,0,1,0,on-topic,1,171,3056,everyone be safe out there tonight...100+ suspected injuries and people are still inside the plant from the explosion.. #waco
2565,1442074050602,0,0,1,0,off-topic,0,110,3057,Do not put contacts in after you eat takis. My eye is on fireeee
2566,1442074050603,0,0,1,0,off-topic,1,160,3058,I can't even contain my excitement about leaving Waco at 430 am to play golf... Ready to embarrass myself #woooooo
2567,1442074050603,0,0,1,0,off-topic,0,110,3059,I'm at @Lowes Home Improvement (Waco, TX) http://t.co/Jo5FNNzDf1
2568,1442074050604,0,0,1,0,off-topic,1,157,3060,76639: Child Abduction Emergency issued April 24 at 1:49PM CDT  by NWS Dallas-Fort Worth http://t.co/kQTJWOuwG0
2569,1442074050604,1,1,1,1,on-topic,0,160,3061,President @BarackObama now speaking at #WestMemorial after being introduced by Sen. @JohnCornyn #PrayforWest #West
2570,1442074050604,0,0,1,0,off-topic,0,157,3062,@bmiana see that's awesome!!! If my mom wasn't a sz 2-4 bodybuilder/sexy model I prob would have done that too!
2571,1442074050604,0,1,1,0,off-topic,0,104,3063,Just sleepless and coughing up a lung or both over here...
2572,1442074050605,0,0,1,0,off-topic,1,69,3064,I wanna believe him but
2573,1442074050606,0,0,1,0,off-topic,1,114,3065,When I Be Listening To Kelly Rowland Songs, I Feel Like I Can Dance!
2574,1442074050606,0,0,1,0,off-topic,0,92,3066,I believe actions speak louder than words . !!
2575,1442074050607,1,0,1,0,on-topic,1,159,3067,Your #RedCross is hard at noble work at the West, TX Joint Assistance Center. @RedCrossDFW http://t.co/Czwc506sU8
2576,1442074050608,0,0,1,0,off-topic,1,99,3068,I like that Obama makes times for things such as this
2577,1442074050608,0,0,1,0,off-topic,0,92,3069,I will never apologize for saying what i feel.
2578,1442074050609,0,1,1,0,off-topic,1,141,3070,@KristenSvec didnt see the a at first and this tweet seriously concerned me for a second hahaha
2579,1442074050609,0,0,1,0,off-topic,0,112,3071,@QuinteroAbby sounds good ill hit you up if I get into anything !!
2580,1442074050610,0,0,1,0,off-topic,1,96,3072,Lol foreal I did that Hoe right in Tink yard nshit
2581,1442074050611,0,0,1,0,off-topic,1,110,3073,@Valerie_0225 @davisjessd2014 I won't go into my Jesus reference
2582,1442074050611,0,0,1,0,off-topic,0,95,3074,Dk if ima be able to hang with girls this weekend
2583,1442074050612,0,0,1,0,off-topic,1,103,3075,#ThingsISayInSchoolTheMost what kind of question is that?
2584,1442074050612,0,0,1,0,off-topic,0,99,3076,@victortexass then she isn't to young for you bro lol
2585,1442074050613,0,0,1,0,off-topic,1,169,3077,@SportsCenter: Pacers take Game 1 vs Hawks, 107-90. Paul George's triple-double (23 Pts, 12 Ast, 11 Reb): I'M TELLIN YA!!!!
2586,1442074050613,0,0,1,0,off-topic,0,169,3078,Have every intention of continuing what I want to do in the pre-health industry that's why I went to school, but who knew..
2587,1442074050613,0,0,1,0,off-topic,0,71,3079,Hector is so dumb lol :')
2588,1442074050614,0,0,1,0,off-topic,1,120,3080,I regret making that promise too oomf cause all I have too say is oh!!!!!!
2589,1442074050615,0,1,1,0,off-topic,1,130,3081,nigga Omar is like my second family and shows us a picture of him with kaitlyn's fam
2590,1442074050615,0,0,1,0,off-topic,0,85,3082,@Meliamei22 THIS GIRL IS STILL TALKING.
2591,1442074050616,0,0,1,0,off-topic,1,133,3083,Who's ready for a Dia #brotrip? I know @jacob_rao is! @ Not Waco http://t.co/66hxrGP7hc
2592,1442074050616,0,0,1,0,off-topic,0,164,3084,Clinical Psychologist - #Waco , TX (http://t.co/3zYgjGMRt9) Get Psychologist Jobs #Psychologist #jobs #job #GetAllJobs
2593,1442074050616,0,0,1,0,off-topic,0,128,3085,@xTerrri: @Ur_Majestyyy that was my favoritest song ever. yep, it's pretty awesome
2594,1442074050617,0,0,1,0,off-topic,1,121,3086,I Lost damn near $500 Last night.. I couLd sLap tha shit outta nigga.. #FML
2595,1442074050617,0,0,1,0,off-topic,0,162,3087,@hannahspears. Hide n go seeks my favorite. . Tell big sister she had better hide good..  nice day to be outside. .!
2596,1442074050618,0,0,1,0,off-topic,1,85,3088,My Mama gave me some money this morning
2597,1442074050618,0,0,1,0,off-topic,0,183,3089,I know I'll regret not living Ivan but my emotions are fickle and he deserves someone absolutely amazing. Better than me to say the least
2598,1442074050619,0,0,1,0,off-topic,1,95,3090,@SommLike_Dat laughing to the bank like ahhahAhah
2599,1442074050620,0,0,1,0,off-topic,1,98,3091,These squirrels have it so easy. Not a worry in life
2600,1442074050621,1,0,1,0,on-topic,1,183,3092,You see stuff on the news all the time.. I never thought a little town 15 min away would be on the news all over, with such devastation..
2601,1442074050621,0,0,1,0,off-topic,0,121,3093,Day ends in shit. Getting it back tomorrow. Goodnight. Fucking nuggets man.
2602,1442074050621,0,0,1,0,off-topic,0,75,3094,Move too strike . Kiss my ass
2603,1442074050622,0,0,1,0,off-topic,1,126,3095,@XANAX_abuser: @AMBITIONBELL11: What to do tonight #navarro absolutely nothing:(
2604,1442074050623,0,0,1,0,off-topic,1,132,3129,@MissC_Bobby lasagna, chicken, Mac &amp; cheese, and some other shit I didn't see haha
2605,1442074050624,0,0,1,0,off-topic,1,86,3130,@Shawnee_Keyshae love you too, hmu later
2606,1442074050624,0,0,1,0,off-topic,0,121,3131,LOL I'm the boringest texter ever... especially if I don't know you well ;p
2607,1442074050625,1,1,1,1,on-topic,1,171,3132,So thankful Obama is coming to Waco tomorrow because my test got cancelled... #soblessed @LauraHaigler http://t.co/RAWAx6tVNv
2608,1442074050626,0,0,1,0,off-topic,1,68,3133,My team blasting on em
2609,1442074050628,0,0,1,0,off-topic,2,81,3134,Love me some crawfish!' #mixer #yum
2610,1442074050629,0,0,1,0,off-topic,1,88,3135,@Lil_BigJoe lmao thats cute cause i can (:
2611,1442074050631,0,0,1,0,off-topic,2,95,3136,Tired.. I need a drink. And a superhero costume..
2612,1442074050632,0,0,1,0,off-topic,1,111,3137,Am i the only person on this earth who has to have center caps???
2613,1442074050632,0,0,1,0,off-topic,0,88,3138,I swear you're giving me a heart attackkkk
2614,1442074050633,0,0,1,0,off-topic,1,157,3139,76676: Special Weather Statement issued April 18 at 4:49AM CDT  by NWS Dallas-Fort Worth http://t.co/X82mvLS2b5
2615,1442074050634,0,0,1,0,off-topic,1,115,3140,#ThingsISayInSchoolTheMost daaaaaayyyuuuuummm she gotta big forehead.
2616,1442074050634,0,0,1,0,off-topic,0,179,3141,@kimbrrrly94: Maybe I don't have my life all planned out like I thought I use too. I don't even know who I am anymore.. #WhatAmIDoing
2617,1442074050634,0,0,1,0,off-topic,0,108,3142,@Forever_like21 woah woah woah, who you think you talking too?
2618,1442074050635,0,1,1,0,off-topic,1,182,3143,If my professor cancels class on Thursday because the president is coming to Baylor. I promise you I won't be going to see the president
2619,1442074050635,0,1,1,0,off-topic,0,123,3144,Today is NOT my day. Next person to say/do something wrong aint gone like me.
2620,1442074050636,0,0,1,0,off-topic,1,126,3145,@xxxKakey: Sometimes all a bitch really need is some GOOD DICK to calm her down.
2621,1442074050636,1,1,1,1,on-topic,0,151,3146,Where?? RT@AyoooooTee: Another explosion YOU KNOW WHAT IM PACKING MY SHYT ND GOING TO CANADA OR SOME SHYT
2622,1442074050637,0,0,1,0,off-topic,1,94,3147,Also locked in Cards ML, Rangers RL, and reds RL
2623,1442074050638,0,1,1,0,off-topic,1,177,3148,@NICKIMINAJ: I used to dilly dally now I dilly to cali/used to push da pink denali now its da __________________da red fahar__. :-)
2624,1442074050638,0,0,1,0,off-topic,0,71,3149,This morning was not good
2625,1442074050639,0,0,1,0,off-topic,1,104,3150,Ive been avoiding commadment, that why im in this position
2626,1442074050640,0,0,1,0,off-topic,1,75,3151,@tiesto come to Texas again!!
2627,1442074050641,0,0,1,0,off-topic,1,70,3152,Iknow that wasn't to me?
2628,1442074050642,0,1,1,0,off-topic,1,91,3153,@GretGru are you visiting Waco anytime soon?!
2629,1442074050643,0,1,1,0,off-topic,1,149,3154,That awkward moment when my laptop decides to play I just had sex on full volume in my dads office.....
2630,1442074050643,0,0,1,0,off-topic,0,109,3155,I juss liked Everything to be Funny like Yea BITCCHH I See It !
2631,1442074050644,0,0,1,0,off-topic,1,72,3156,Cheating can't be that bad
2632,1442074050644,1,0,1,0,on-topic,0,162,3157,Volunteering side by side in west with victims, students, and people from all over the state. http://t.co/AWTo85AiOR
2633,1442074050645,0,0,1,0,off-topic,1,115,3158,Every Saturday I regret signing up for overtime -_- #sleepy #overtime
2634,1442074050645,1,1,1,1,on-topic,0,134,3159,Going to the West memorial service today! #prayforwest @ west, tx http://t.co/6QZZ4CEjcO
2635,1442074050646,0,0,1,0,off-topic,1,163,3160,@blondie_vivian didnt wanna cause a riot, you know, being in front of soro and all. Thought it best to cover up. Lol.
2636,1442074050646,0,0,1,0,off-topic,0,111,3161,Norte Dame spring game on TV, gets your mind right #fightingirish
2637,1442074050647,0,0,1,0,off-topic,1,176,3162,This is for y'all who don't understand my tweet. Also, watch the stinking movie. #april25 #misscongeniality http://t.co/JRermtohBS
2638,1442074050647,0,1,1,0,off-topic,0,128,3163,@dawnavrildotcom after West exploding its certainly chilling here where I live. :/
2639,1442074050647,0,0,1,0,off-topic,0,94,3164,Can't wait to go to a rangers game this year !!!
2640,1442074050649,0,0,1,0,off-topic,2,113,3165,@ThelIluminati: It could always be worse, stop complaining so much.
2641,1442074050649,0,0,1,0,off-topic,0,79,3166,I peep oomf, its all good tho lol
2642,1442074050650,0,0,1,0,off-topic,1,171,3167,@TaylorDrenzek REMEMBER THAT TIME WE TRIED TO KILL THAT SCARY BUG WITH HAIRSPRAY AND A SCRATCHING POST AND EVERYTHING ELSE???
2643,1442074050651,0,0,1,0,off-topic,1,75,3168,#ToMyEx you don't deserve me.
2644,1442074050651,0,0,1,0,off-topic,0,171,3169,@LizVaughan09 I wish he would've had the ring when he proposed, but he proposed at his bootcamp grad so he didn't have it lol
2645,1442074050652,0,0,1,0,off-topic,1,111,3170,@Joe_Kissick REMEMBER WHEN I INTRODUCED YOU TO CHIPOTLE #whataday
2646,1442074050652,0,0,1,0,off-topic,0,75,3171,My day 1 niggas come in handy
2647,1442074050653,0,0,1,0,off-topic,1,93,3172,@blackwood55 10 points to ravenclaw for honesty
2648,1442074050654,0,0,1,0,off-topic,1,84,3173,I know you like the back of my hand...
2649,1442074050655,0,1,1,0,off-topic,1,104,3174,Hang in there Bucks. Just cover. That's all us bettors ask
2650,1442074050656,0,0,1,0,off-topic,1,95,3175,@sydneyf15 hey. Give photo cred where it's due...
2651,1442074050656,0,0,1,0,off-topic,0,122,3176,I would be the one to paint my nails then come out here and play soccer. Lol
2652,1442074050657,0,0,1,0,off-topic,1,119,3177,There is a reason I avoid Sportscenter during draft weekend. It angers me
2653,1442074050657,0,0,1,0,off-topic,0,73,3178,All I think about is sleep.
2654,1442074050658,0,1,1,0,off-topic,1,74,3179,Why can't you just let me be
2655,1442074050659,0,0,1,0,off-topic,1,142,3180,@fehurt: S/O to all the parents out there handling their business. Especially the single ones!!!
2656,1442074050660,0,0,1,0,off-topic,1,142,3181,My grandpa always watching tv  like you here all the way from Mexico and you watching tv ... -.-
2657,1442074050660,0,0,1,0,off-topic,0,82,3182,@jessgrov08 I hear they are amaizing
2658,1442074050661,0,0,1,0,off-topic,1,74,3183,Can't trust noone these days
2659,1442074050662,0,0,1,0,off-topic,1,168,3184,My first time at the Czech Stop with some great people!  #yum @klside @jessicaacunaa @USS_Lexington http://t.co/iiGdgFE6kG
2660,1442074050662,0,0,1,0,off-topic,0,120,3185,I'm at Cricket's Grill &amp; Draft House (Waco, TX) http://t.co/XweBYURHnG
2661,1442074050663,0,0,1,0,off-topic,1,111,3186,@twEAT_ItRight bitch you know I'm talking about Chris capping ass
2662,1442074050663,0,0,1,0,off-topic,0,175,3187,Now Hiring: Merrill Lynch Financial Advisor Program - Waco, TX | Bank of America: US - Waco/TX/USA | http://t.co/F8Vq0SYWhR #jobs
2663,1442074050664,0,0,1,0,off-topic,1,158,3188,Owee man I look ratchet -.- But today is my last day testing for that dam accuplacer and I'm so leaving after ..
2664,1442074050664,0,0,1,0,off-topic,0,132,3189,So glad @DisneyChannelPR is playing older shows like even stevens &amp; Lizzie Mcguire
