1286,1442076115319,0,0,1,0,off-topic,3,138,4385,Shout out to all those couples that keep it 100 with each other Can't find many like those..
1287,1442076115471,0,0,1,0,off-topic,152,113,4386,I'm so happy you always tweet your redneck shit. Don't nobody care.
1288,1442076115473,0,0,1,0,off-topic,2,94,4387,@Dede_ontheBeach: I want you! What a coincidence
1289,1442076115480,0,0,1,0,off-topic,7,117,4388,@RealSkipBayless where do you see the hype of the Honey Badger landing?
1290,1442076115481,0,0,1,0,off-topic,1,121,4389,The Beat Crew is at the Extraco event center! We are lending a helping hand
1291,1442076115482,0,0,1,0,off-topic,1,99,4390,Trying to do the healthy thing http://t.co/afPEw9wapu
1292,1442076115484,0,0,1,0,off-topic,2,110,4391,I meant it as a compliment, she was super cute and made me smile
1293,1442076115485,0,0,1,0,off-topic,1,178,4392,@Valenzuela_123 Lol ! I know same here !! I swear it was this but I probably changed some little part of it &amp; forgot completely.
1294,1442076115486,0,0,1,0,off-topic,1,183,4393,@scottyyyy11: Really Makin their drinks right infront of the liquor store @kekav23 @jessicamariee90 @steph_sariles http://t.co/kZodxQ7wq5
1295,1442076115486,0,1,1,0,off-topic,0,182,4394,Just witnessed a girl walking down the hallway giggling like an idiot. She proceeded to walk straight into a wall and fall on the floor.
1296,1442076115487,0,0,1,0,off-topic,1,119,4395,When my absence doesn't alter your life, my presence has no meaning in it
1297,1442076115669,0,0,1,0,off-topic,182,81,4396,No good girls are up this late haha
1298,1442076115671,0,1,1,0,off-topic,2,115,4397,Headed to a men's retreat. Gonna be a fun weekend with @Rick_Reynolds
1299,1442076115672,0,1,1,0,off-topic,1,98,4398,I feel like I could literally go to sleep right now.
1300,1442076115674,1,0,1,0,on-topic,2,171,4564,Makes me smile to see firefighters on the processional taking pics and video of the crowd. They're touched too. #westmemorial
1301,1442076115675,1,1,1,1,on-topic,1,178,4578,I feel like the people that are interested in just seeing Obama just shouldn't go. Don't forget the purpose of the memorial service.
1302,1442076115676,0,0,1,0,off-topic,1,156,4618,@Kdoll1234: @Ur_Majestyyy Alexis, stay strong girl. They will be okay, I love you!! thank you! i love you too!
1303,1442076115676,1,1,1,1,on-topic,0,198,4621,I live right off the highway in Lacy-Lakeview/Waco &amp; all I hear are police &amp; EMS Sirens. My thoughts &amp; prayers are w/you responders as well.
1304,1442076115677,0,1,1,0,off-topic,1,115,4636,&amp; all i can do now is pray.  prayers go up, blessings come down..
1305,1442076115678,0,0,1,0,off-topic,1,164,4660,@KayleighLovvorn Yes, it's incredibly important to me too. I wish we had more time for it. So tragic and so important.
1306,1442076115679,1,1,1,1,on-topic,1,185,4715,RT @WacoPolice: Animal control officers from Waco West Woodway and Hewitt going house to house in West conducting animal search and rescue.
1307,1442076115857,0,0,1,0,off-topic,178,190,4728,When &amp; if God decides to come he will take who he all wants why make them suffer a painful death when he's taking them cause they are worthy
1308,1442076115857,0,0,1,0,off-topic,0,92,4741,Death by boredom is not how I wanted to gooooo
1309,1442076115859,1,1,1,1,on-topic,2,155,4758,im gonna be donating money &amp; clothes tomorrow.. due to the fact that im anemic &amp; can't donate blood..
1310,1442076115860,0,0,1,0,off-topic,1,131,4768,Having to fix the damage I caused in my dorm. #aggressionprobz http://t.co/6lEV9Anu7s
1311,1442076115860,0,0,1,0,off-topic,0,170,4772,Chillin' on this bench, then I see a dead bird next to me and someone plz come clean up my projectile vomit.  #happyearthday
1312,1442076115861,1,0,1,0,on-topic,1,166,4790,Had the honor of hearing the President speak at the West Memorial Service. #emotionalday @ Baylor http://t.co/1hgJzaL7cC
1313,1442076115862,1,1,1,1,on-topic,1,137,4803,Fixin to give blood to help these wonderful people, then later going to donate clothes, etc
1314,1442076115863,0,1,1,0,off-topic,1,110,4553,My lil dude just made me move my bed around for no reason -____-
1315,1442076115864,0,1,1,0,off-topic,1,129,4554,@ImKindaABigDill I did about a year ago! Now I live about 3 hours away from there..
1316,1442076115865,0,0,1,0,off-topic,1,184,4555,I love when roomie @jennaakay texts me sweet things, especially when she's laying next to me, in my bed.  #truelove http://t.co/E8XjLd8bA9
1317,1442076121276,0,0,1,0,off-topic,5411,133,4556,Wow! The semester is winding down! I have 1 class b4 finals. I'm so ready to celebrate!
1318,1442076121277,0,0,1,0,off-topic,1,95,4557,@reagannewman15 oh my gawwdd haha! I was so naive
1319,1442076121279,0,0,1,0,off-topic,2,96,4558,I really need to get my shit together!!! #Stressed
1320,1442076121280,0,0,1,0,off-topic,1,97,4559,WCW and MCM Make a Bitch Not wanna get on instagram
1321,1442076121281,0,0,1,0,off-topic,1,85,4560,Oomf never texted me back -.- it's cool
1322,1442076121283,0,0,1,0,off-topic,2,116,4561,Not to mention the way some of y'all talk to y'all daddy...? Chill out
1323,1442076121284,0,0,1,0,off-topic,1,81,4562,I'll be in DC this time next month!
1324,1442076121285,0,0,1,0,off-topic,1,113,4563,What do you get when you put 50 lawyers in a room with 50 lesbians?
1325,1442076121286,0,0,1,0,off-topic,1,116,4565,I'm tryna catch a break . But every time I do some always goes wrong .
1326,1442076121287,0,1,1,0,off-topic,1,186,4566,@CALMATE_Carina as long as it's healthy lol. I'm not going to eat anything I'm going to take some drink it's a meal replacement it's healthy
1327,1442076121288,0,1,1,0,off-topic,1,112,4567,Satan asks the third guy, What was your daddy when you were alive?
1328,1442076121289,0,1,1,0,off-topic,1,80,4568,I really just wanna get fucked up.
1329,1442076121292,0,1,1,0,off-topic,3,92,4569,Ying Yang twins are going to be here on DIA ?!
1330,1442076121294,0,1,1,0,off-topic,2,87,4570,@WhatTheDickens_ why are you going home??
1331,1442076121467,0,0,1,0,off-topic,173,85,4571,@MissJenn121211 WELL work go get one!!!
1332,1442076121469,0,0,1,0,off-topic,2,105,4572,@JMag90 @ngunyi_michelle OMG!!!!  He knew wat he was dong!!
1333,1442076121470,0,1,1,0,off-topic,1,100,4573,Got this yungsta in the crib right now killing shit...
1334,1442076121472,0,1,1,0,off-topic,2,124,4574,Wish I had a girl to kick it with , shii gone be back right soon hopefully ...
1335,1442076121473,0,0,1,0,off-topic,1,153,4575,@AdamAjSalinas ok it didn't work ok i tried and it didn't work....i refuse to slow down my life ok im sorry
1336,1442076121473,0,1,1,0,off-topic,0,108,4576,I never wanted to be your whole life-- just your favorite part
1337,1442076121476,0,0,1,0,off-topic,3,173,4577,Everyone pay there money to go to school in PJ's tomorrow? Smh or go to school for free and not look ratchet #DUMB  #FUNDRAISER
1338,1442076121477,0,0,1,0,off-topic,1,167,4579,#tbt to the best spring break ever with my best friend! #HPL #Hogwarts #normal  @ Hogsmead Village http://t.co/EYGfCNLKdX
1339,1442076121478,0,0,1,0,off-topic,1,101,4580,Well looks like I ain't making my Mama that cheese cake
1340,1442076121480,0,0,1,0,off-topic,2,105,4581,@BegginForMOE nearest liquor bottle JK hope you feel better
1341,1442076121481,0,0,1,0,off-topic,1,105,4582,@johnnyjeff05 you comin down for the summer semesters right
1342,1442076121483,0,0,1,0,off-topic,2,116,4583,@ashleyybrooke6: Feels so good to not work on a Saturday for once AMEN
1343,1442076121484,0,1,1,0,off-topic,1,125,4584,@teeburt9493: I don't see how some people just stay on twitter forever.. Guilty
1344,1442076121485,0,1,1,0,off-topic,1,167,4585,Here at Baylor the girls don't have to study for finals. We just have to pray that our future husbands are. #ringbyspring
1345,1442076121485,0,0,1,0,off-topic,0,111,4586,@YoungBoyBurton: Gotta watch who you love, love will let you down
1346,1442076121486,0,0,1,0,off-topic,1,87,4587,Goodluck to all the juniors testing today
1347,1442076121489,0,0,1,0,off-topic,3,126,4588,#WeCantDateIf &lt;------ girls y'all need to stop using this lol y'all look dumb
1348,1442076121491,0,0,1,0,off-topic,2,88,4589,@TheReal_BAIN wish I was.... Stuck in waco
1349,1442076121493,0,0,1,0,off-topic,2,93,4590,@Pretty_Eyez_94 how I tweeted it before you guy
1350,1442076121495,0,1,1,0,off-topic,2,177,4856,Keeping close eye on #Watertown @FBIPressOffice: New Image Released of Suspect in Bombing Case:  Boston http://t.co/GluGLsJMxo #FBI
1351,1442076121496,0,0,1,0,off-topic,1,175,4859,@Googlearthpics: Most animals get funnier when you shave them. Not bears. Bears get more terrifying. http://t.co/5H8WZad05C Wtf?!
1352,1442076121497,1,0,1,0,on-topic,1,134,4860,Using what I learned at #mfm13 to help with the family assistance center. #westexplosion
1353,1442076121498,1,1,1,1,on-topic,1,160,4861,Just donated some items at Extraco Events Center @BasedBrownKid @DannyPanda212 #PrayforWest http://t.co/b3xqHqslCc
1354,1442076121499,1,0,1,0,on-topic,1,89,4862,My prayers goez out to wezt texas... #faith
1355,1442076121501,1,0,1,0,on-topic,2,153,4863,@WacoPolice @wacotrib Prayers go out to all emergency responders. God bless you for the work you are doing.
1356,1442076121502,1,1,1,1,on-topic,1,132,4922,Anyone know of any MAJOR explosions near Dallas....I-35 just got covered in gray smoke
1357,1442076121503,1,1,1,1,on-topic,1,191,4935,#Obama &amp; #Westboro are coming to the #West Memorial service. So Sad that a time to remember &amp; grieve will be a media circus. #prayforwest
1358,1442076121503,0,0,1,0,off-topic,0,183,4940,He will wipe every tear from their eyes. There will be no more death or mourning or crying or pain #Revelation21:4 http://t.co/ur6DkQGedQ
1359,1442076121504,1,0,1,0,on-topic,1,141,4945,Expecting a very large event from across the state and nation to honor fallen first responders.
1360,1442076121505,0,0,1,0,off-topic,1,168,4952,@bekahforest you are on the road to recovery 1st step saying you have a problem and admitting it. 2nd committing to change
1361,1442076121506,1,0,1,0,on-topic,1,117,4975,@alex_sowell12 my aunt &amp; uncle are both out there helping! #PRAYING
1362,1442076121507,1,0,1,0,on-topic,1,107,4979,Gov. Perry issued a disaster proclamation for McLennan County
1363,1442076121509,1,0,1,0,on-topic,2,189,5008,First photos of one of the West victims, Buck Uptmor. Seen with his 2 boys, ages 10 &amp;12. Was trying to free horses before explosion @NBCDFW
1364,1442076121511,1,0,1,0,on-topic,2,186,5018,RT @HuffPostBiz: Texas fertilizer plant where an explosion injured more than 100 people was cited for a 2006 permit violation  http://t. ...
1365,1442076121513,1,0,1,0,on-topic,2,118,5019,Wow another explosion in Texas?! What the fuck is wrong with this world?
1366,1442076121517,1,1,1,1,on-topic,4,140,5020,Boston bombings, Texas explosion, Water Town shooting... wtf is going on in America this week.
1367,1442076121522,1,1,0,0,on-topic,5,185,5021,RT @KIDCHOCOLATE: Prayers also for the ppl who lost their lives in the Texas explosion at the fertilizer plant. Strength for the families w
1368,1442076121523,1,0,1,0,on-topic,1,185,5022,@GregAbbott_TX Let's see some of that $11 Billion Rainy Day Fund used! If NOT for #WestTx then for what?? 14 First Responders DIed. #txlege
1369,1442076121523,1,1,1,1,on-topic,0,186,5023,RT @RT_com: Residents in #Texas town advised to evacuate immediately for fear of secondary explosion at fertilizer plant http://t.co/3TT ...
1370,1442076121524,1,0,0,0,on-topic,1,186,5024,RT @ABC: 75 to 100 houses, businesses completely destroyed around Texas fertilizer plant explosion http://t.co/ZlnCEsAAp2 http://t.co/5Z ...
1371,1442076121525,1,1,1,1,on-topic,1,168,5026,Prayers going out to everyone that was involved in West, TX fertilizer plant explosion and their friends and family #Texas
1372,1442076121526,1,1,1,1,on-topic,1,157,5027,RT @NewsBreaker: BREAKING: People trapped on second floor of apartment complex after explosion near Waco, Texas
1373,1442076121526,1,1,0,0,on-topic,0,175,5028,RT @YourAnonNews: Breaking: EMS Director Dr. George Smith says possibly 60 To 70 Dead, hundreds injured In #WestExplosion #WestTX
1374,1442076121527,1,0,0,0,on-topic,1,183,5029,RT @BuzzFeedNews: Gripping Images Of The Explosion At A Fertilizer Factory Near Waco, Texas http://t.co/3wEufdRuKY http://t.co/3QvFbopKWJ
1375,1442076121527,1,0,1,0,on-topic,0,121,5030,RT @ABC: Texas Explosion Registered on Richter Scale http://t.co/CpqOhW6lgf
1376,1442076121528,1,0,0,0,on-topic,1,181,5031,RT @chrissadeghi: Happy to say the Czech Stop is open and serving breakfast to emergency workers. #westexplosion http://t.co/gFS4MHdaHJ
1377,1442076121530,1,1,1,1,on-topic,2,186,5032,RT @acsayre: Evacuation order now given to citizens near explosion at fertilizer plant in Waco Texas. Serious situation, very fluid. Tak ...
1378,1442076121530,1,1,1,1,on-topic,0,186,5033,RT @cjaehnig: Huge explosion at a fertilizer plant in Waco, Texas tonight. Already at least 66 injured. #PrayForTexas http://t.co/jqnAeG9iZv
1379,1442076121531,1,0,1,0,on-topic,1,139,5034,@TheFPShow: Actual video of the TX fertilizer plant explosion-https://t.co/72IVCD99oa Unreal!
1380,1442076121532,1,0,1,0,on-topic,1,177,5035,RT @theblaze: Explosion rocks fertilizer plant in Texas; several people injured (See the stunning photos) http://t.co/r33x0ltAMg jh
1381,1442076121533,1,0,0,0,on-topic,1,185,5036,RT @BBCNewsUS: Police say three or four firefighters at site of #Texas fertiliser plant explosion are still missing  http://t.co/MxFUogN6Y6
1382,1442076121534,1,1,0,0,on-topic,1,185,5037,RT @911BUFF: TEXAS EXPLOSION: DRAMATIC PHOTO - MULTIPLE STRUCTURES ON FIRE WITH REPORTS OF PEOPLE TRAPPED AND FFS DOWN! #911BUFF  http: ...
1383,1442076121534,1,0,1,0,on-topic,0,174,5038,RT @alroker: Up to 70 people may be dead following a massive explosion at a fertilizer plant in West, TX. http://t.co/ilsuq08Roe
1384,1442076121535,1,0,1,0,on-topic,1,131,5040,CAUGHT ON CAMERA: Fertilizer Plant Explosion Near Waco, Texas: http://t.co/TF6A0hlcTA
1385,1442076121536,1,1,1,1,on-topic,1,140,5041,RT @MSN: Report: Texas fertilizer plant explosion injures more than 100 http://t.co/Zkk3s4SxRx
1386,1442076121537,1,0,1,0,on-topic,1,182,5042,Explosion rips Texas fertilizer plant: An explosion ripped through a fertilizer plant Wednesday night in West,... http://t.co/AMK62fX5LP
1387,1442076121538,1,1,1,1,on-topic,1,126,5044,RT @LynnSanchez5: Oh no, now a fertilizer plant explosion!  #PrayForWest #WestTx
1388,1442076121539,1,0,1,0,on-topic,1,185,5045,RT @MaxPowahh: CAUGHT ON CAMERA: Fertilizer Plant Explosion Near Waco, Texas: http://t.co/s7mccgqJLH via @youtube CRAZY SHIT OMG MUST WATCH
1389,1442076121540,1,0,0,0,on-topic,1,185,5046,RT @IngrahamAngle: I jumped watching this! @michellemalkin: Unreal: Video captures fertilizer plant explosion in West, Texas http://t.c ...
1390,1442076122595,1,1,0,0,on-topic,1055,176,5047,RT @BonnieBernstein: Boston. Now this horrible fertilizer plant explosion in Texas. Please. Someone make this week stop already...
1391,1442076122596,1,1,0,0,on-topic,1,138,5048,RT @FactBoook: BREAKING NEWS: 70 people dead from Fertilizer plant explosion in Waco, Texas.
1392,1442076122598,1,0,1,0,on-topic,2,186,5049,RT @bradenframe: Go ahead. Come to Texas. Protest at our #TXFire #WestExplosion funerals...enjoy our 2nd Amendment Texas Welcome! http:/ ...
1393,1442076122599,1,0,0,0,on-topic,1,185,5050,RT @whitehouse: POTUS: We've also seen a tight-knit community in Texas devastated by a terrible explosion, &amp; I want them to know that t
1394,1442076122600,1,1,1,1,on-topic,1,178,5051,Such a horrific week. First the Boston Marathon explosion and now a plant explosion in Waco, TX. 60-70 reported dead. Prayers needed
1395,1442076122601,1,0,1,0,on-topic,1,182,5052,Anhydrous ammonia danger fears: Firefighters at the scene of a massive fertilizer plant explosion in Texas wer... http://t.co/ffQhBBjEok
1396,1442076122602,1,0,1,0,on-topic,1,182,5053,@_Happy_Gilmore: Here is video of the explosion in West, Texas. Please pray for everyone in the area... -&gt; http://t.co/ydvUAM69bm wow
1397,1442076122603,1,0,0,0,on-topic,1,186,5054,RT @wxbrad: Full amateur footage. CAUGHT ON CAMERA: Fertilizer Plant Explosion Near Waco, Texas: http://t.co/6cGCbPba9j  #westfire #west ...
1398,1442076122603,1,0,0,0,on-topic,0,162,5056,RT @knowledgeisdeep: @joerogan CAUGHT ON CAMERA: Fertilizer Plant Explosion Near Waco, Texas https://t.co/kIapEHEpbh
1399,1442076122604,1,0,0,0,on-topic,1,186,5057,RT @PrayForTexas: RETWEET to send out a prayer for all involved in the Texas Fertilizer Plant Explosion! #PrayForTexas http://t.co/mAq9i ...
1400,1442076122605,1,1,1,1,on-topic,1,186,5132,RT @BleacherReport: A Texas man was present at both the Boston Marathon bombing and West, Texas fertilizer plant explosion http://t.co/g ...
1401,1442076122606,1,0,1,0,on-topic,1,125,5133,Was the explosion in Texas an accident or another planned attack? #PrayForTexas
1402,1442076122607,1,0,1,0,on-topic,1,124,5134,Prayers are with all the victims of the boston explosions and texas explosion.
1403,1442076122608,1,1,1,1,on-topic,1,175,5135,Bombing in Boston. Explosion in Texas. And now gunfire at MIT in Boston. This has been a horrible week, filled with tragedy. #why
1404,1442076122609,1,1,0,0,on-topic,1,186,5136,RT @BreakingNews: Authorities: 12 confirmed dead after West, Texas, fertilizer plant explosion; about 200 injuries - @wacotrib http://t. ...
1405,1442076122610,1,0,0,0,on-topic,1,186,5137,RT @andersoncooper: My thoughts are also with all those in West, Texas. So many first responders killed there in fertilizer plant explosion.
1406,1442076122610,1,0,1,0,on-topic,0,130,5138,RT @KevLambie: Jeez 35 dead in a Texas plant explosion. Lawsuits on top of lawsuits.
1407,1442076122612,1,0,0,0,on-topic,2,186,5139,RT @SkyNewsBreak: Local TV says 60 to 70 people are dead with many injured following a major explosion at a fertiliser plant near Waco i ...
1408,1442076122613,1,0,1,0,on-topic,1,186,5140,RT @caribnews: 70 people confirmed dead, including 5 firefighters &amp; 1 police officer. Hundreds of others injured in explosion - KHOU ...
1409,1442076122614,1,0,1,0,on-topic,1,154,5141,HOLY FUCK @YourAnonNews: WACO TEXAS. FERTILIZER PLANT EXPLOSION. ALL UNITS REQUESTED. http://t.co/oVeHj1XwR3
1410,1442076122616,1,0,1,0,on-topic,2,184,5142,Obama: I want them to know they are not forgotten. Abt ppl of West, TX where some 15 dead, 60 said missing, 200 injured in plant explosion
1411,1442076122617,1,0,1,0,on-topic,1,138,5143,Deadly explosion at Texas fertilizer plant kills 15, over 150 injured http://t.co/nlBagUpr3Y
1412,1442076122619,1,0,0,0,on-topic,2,182,5144,RT @BexarCounty: As we all rightfully applaud the law enforcement efforts in #Boston, please remember those first responders in #WestTx.
1413,1442076122620,1,1,1,1,on-topic,1,163,5145,I'm broadcasting #westexplosion press update live on @Ustream. Come watch and chat! - http://t.co/6wZuMbKPSs (4:34am)
1414,1442076122622,1,0,1,0,on-topic,2,129,5146,The video of the explosion in Texas is one of the scariest things I've ever seen :/
1415,1442076122623,1,0,1,0,on-topic,1,88,5147,Prayers go to those in West Texas. #WestTX
1416,1442076122626,1,0,1,0,on-topic,3,133,5148,Austerity, Deregulation and the Texas Fertilizer Plant Explosion http://t.co/QuesvvkRaw
1417,1442076122628,1,0,1,0,on-topic,2,182,5149,911 tapes recount horrific scene: As the Texas town rocked by a plant explosion recovers, 911 tap... http://t.co/HEfONlSint #globaltrade
1418,1442076122629,1,0,1,0,on-topic,1,130,5150,RT @BCHsports: West, Texas explosion. This video is chilling. http://t.co/Jh58KvHFF6
1419,1442076122630,1,1,0,0,on-topic,1,180,5151,RT @NBCNews: 'The whole street is gone': Bloodied eyewitnesses describe Texas fertilizer plant explosion horror http://t.co/x4fhmewvPN
1420,1442076122631,1,1,1,1,on-topic,1,159,5152,JUST IN: West, Texas fertilizer plant explosion leaves many dead and more than 100 injured http://t.co/yaHnEypboU
1421,1442076122632,1,0,1,0,on-topic,1,179,5153,RT @Mysstyblue: 'Free Market' Ayn Rand Ideology Was a Root Cause of the Horrific Explosion in Texas | Alternet http://t.co/1Wf225I5bL
1422,1442076122633,1,0,1,0,on-topic,1,158,5154,Bloody hell - CAUGHT ON CAMERA: Fertilizer Plant Explosion Near Waco, Texas: http://t.co/CsKJTGk7ck via @youtube
1423,1442076122635,1,1,1,1,on-topic,2,157,5155,RT @TheMattFowler: And now 70 are dead at a factory explosion in West Texas. This week is horrible. START OVER!
1424,1442076122636,1,0,1,0,on-topic,1,167,5156,RT @cm_rocks: Our thoughts and prayers go out to all those affected by the plant explosion in Texas tonight. #PrayForWest
1425,1442076122638,1,0,1,0,on-topic,2,183,5157,RT @BBCNewsUS: BBC's @aleithead in #WestTX: Some of the damage to buildings next to the factory site. http://t.co/D5XpA5Ql3u http://t.co/
1426,1442076122639,1,0,0,0,on-topic,1,186,5158,RT @Rangers: Our thoughts are with our fellow Texans in the city of West tonight as they recover from tonight's explosion. #TexasLove #W ...
1427,1442076122640,1,1,0,0,on-topic,1,166,5159,RT @shan2p: #westexplosion Cell phones towers damaged by explosion. Reporters having a hard time reporting out on phone.
1428,1442076122641,1,0,1,0,on-topic,1,186,5160,RT @bcantrill: Full version of the West, TX fertilizer plant explosion is much more terrifying than the clip being shown: http://t.co/RA ...
1429,1442076122642,1,0,1,0,on-topic,1,156,5161,RT @TexGov: #WestTX could still use your help | View our Disaster Center for more info: http://t.co/u5tDzC7ith
1430,1442076122644,1,0,1,0,on-topic,2,134,5162,RT @nytimes: Texas Plant Explosion Injures Several, Official Says http://t.co/E7V9lPO44v
1431,1442076122647,1,0,1,0,on-topic,3,120,5163,Deadly explosion hits #Texasfertilizer plant http://http://t.co/TA3talD3Pz
1432,1442076122652,1,0,1,0,on-topic,5,186,5164,This week gets worse and worse. @BlogsofWar: CBS Dallas says 60 dead, 100+ injured in West, TX Fertilizer Explosion - http://t.co/HZTZHizgX4
1433,1442076122653,1,0,1,0,on-topic,1,180,5165,Officials hold a press conference on the explosion last week at a fertilizer plant in West, Texas - @NBCNews... http://t.co/Ssw7ScbChC
1434,1442076122654,1,1,1,1,on-topic,1,112,5166,[URGENT] 60-70 dead, hundreds hurt in Texas plant explosion: media
1435,1442076122657,1,1,0,0,on-topic,3,169,5169,RT @BreakingNews: Texas authorities advise West, Texas, residences to leave town immediately following explosion - @WestISD
1436,1442076122658,1,0,1,0,on-topic,1,135,5170,Rudy Monteagudo Tip: Calls capture terror of Texas plant explosion http://t.co/1dj0EO8Wg4
1437,1442076122661,1,0,1,0,on-topic,3,174,5171,Congress cut backs on safety inspectors kills innocent people in Texas explosion. Great job congress!!#notenoughsafetyinspectors
1438,1442076122662,1,0,1,0,on-topic,1,80,5172,The explosion in Texas looks crazy
1439,1442076122665,1,0,1,0,on-topic,3,108,5173,15 feared dead in Texas plant explosion http://t.co/StoKFOrP8r
1440,1442076122668,1,0,1,0,on-topic,3,143,5174,A fourth-generation farmer's perspective on the Texas fertilizer explosion http://t.co/MRy92GXNIR
1441,1442076122670,1,1,0,0,on-topic,2,176,5175,RT @BonnieBernstein: Boston. Now this horrible fertilizer plant explosion in Texas. Please. Someone make this week stop already...
1442,1442076122671,1,1,0,0,on-topic,1,178,5176,RT @YourAnonNews: #BREAKING - Dispatcher on the West Texas radio reports of another explosion at fire scene, Fire fighters are down.
1443,1442076122672,1,1,0,0,on-topic,1,138,5177,RT @KeeganAllen: Terrible - Just awful... In my thoughts and Prayers. http://t.co/bh2CTv2MsF
1444,1442076122673,1,0,1,0,on-topic,1,164,5178,RT @HealthyLiving: What are the potential health risks of the Texas fertilizer plant explosion? http://t.co/umHFb2JEae
1445,1442076122674,1,0,1,0,on-topic,1,186,5179,RT @garytx: Lots of mutual aid headed to West, TX aft fertilizer plant explosion, many structures burning, people trapped, numerous inju ...
1446,1442076122675,1,0,1,0,on-topic,1,185,5180,RT @TattooedBarbie: OMG @AshleyMarietta: WOW.. the video of today's explosion in Texas is unbelievable  #PrayForTexas http://t.co/Gtx1O ...
1447,1442076122675,1,0,0,0,on-topic,0,186,5181,RT @Rangers: Our thoughts are with our fellow Texans in the city of West tonight as they recover from tonight's explosion. #TexasLove #W ...
1448,1442076122676,1,0,1,0,on-topic,1,185,5182,RT @OpieRadio: sure did! RT @GaryCantrell: Hey @opieradio did you see this? Fertilizer Plant Explosion Near Waco, Texas http://t.co/0y9Zkic
1449,1442076122677,1,0,1,0,on-topic,1,144,5183,UTA organization raises money for victims of city of West, Texas explosion. http://t.co/dthx9CVN42
1450,1442076122679,1,0,1,0,on-topic,2,180,5548,RT @Politics_PR: Ted Cruz asks for federal aid after Texas explosion, but voted against federal aid post-#Sandy http://t.co/BrEdpH57wY
1451,1442076122680,1,0,1,0,on-topic,1,186,5549,RT @conservativesue: First Baptist Church of Lott has room for those displaced by #westexplosion needing a place to stay. Call (254) 829 ...
1452,1442076122682,1,0,1,0,on-topic,2,135,5550,@AHA_1988 @Red1Tweets The explosion hapened in texas it was a fertiliser factory or summa
1453,1442076122683,1,0,1,0,on-topic,1,167,5551,RT @BaylorFutbol: #PrayforWest @BaylorAthletics: Saddened by news of explosion in West, Texas. Praying for our neighbors.
1454,1442076122684,1,0,1,0,on-topic,1,168,5552,RT @OpTicMiDNiTE: This is a video of the explosion of the fertilizer plant near Waco, Texas. Unreal http://t.co/1XV7bZe6A1
1455,1442076122685,1,1,1,1,on-topic,1,184,5553,RT @democracynow: Today's Show: Report on Texas fertilizer plant explosion; Boston bombing media analysis; Film War on Whistleblowers  ...
1456,1442076122686,1,0,1,0,on-topic,1,141,5554,My heart goes out to the people who were hurt or killed in the explosion at the plant in #texas
1457,1442076122687,1,0,1,0,on-topic,1,122,5555,Explosion in Texas.. Please pray for those people in danger and who are hurt
